Comment,Author,Date,Score"That’s totally plausible, except that Trump would never admit that he lost, claiming that radical leftists moved the cup at the last second or secretly lengthened the fairways or some other idiocy.",sharp11flat13,2025-04-23T05:21:37,2
"No thank you, I’d rather not be hurt.   Doing anything to the US will not help China anyway. If we are in a recession, we’ll buy less.  And if they made it hurt, it won’t get Trump out of office or hurt Trumps feelings.",Rikers-Mailbox,2025-04-23T05:09:23,2
"That's not his tail!  (""Goodbye Horses"" plays in the background)",biscuitarse,2025-04-22T20:32:03,5
Fart of the eel,ampolution,2025-04-22T23:56:44,1
"True, but at least the glass is half full. We could be in a depression. :)  I think the only thing keeping Trump from destroying everything is his legacy and how he’ll be viewed when he is dead. It’s always about him. Lol",Rikers-Mailbox,2025-04-23T06:21:01,1
"Worse, didn't even beat Liz Truss.",honor_and_turtles,2025-04-23T17:20:10,2
"""Nobody knows golf better than I do""",Ok-Potential-1832,2025-04-23T03:54:11,2
"I'm not American so it's not a ""we"". Good luck babes. ",MixRepresentative819,2025-04-23T06:00:02,4
Those Extra Extra Large Diapers do tend to sag after a few gallons slosh around for a while ,zillion_grill,2025-04-22T21:15:40,3
