Comment,Author,Date,Score
" As a reminder, this subreddit [is for civil discussion.](/r/politics/wiki/index#wiki_be_civil)  In general, be courteous to others. Debate/discuss/argue the merits of ideas, don't attack people. Personal insults, shill or troll accusations, hate speech, any suggestion or support of harm, violence, or death, and other rule violations can result in a permanent ban.   If you see comments in violation of our rules, please report them.   For those who have questions regarding any media outlets being posted on this subreddit, please click [here](https://www.reddit.com/r/politics/wiki/approveddomainslist) to review our details as to our approved domains list and outlet criteria.    We are actively looking for new moderators.  If you have any interest in helping to make this subreddit a place for quality discussion, please fill out [this form](https://docs.google.com/forms/d/1y2swHD0KXFhStGFjW6k54r9iuMjzcFqDIVwuvdLBjSA).    ***   *I am a bot, and this action was performed automatically. Please [contact the moderators of this subreddit](/message/compose/?to=/r/politics) if you have any questions or concerns.*",AutoModerator,2025-04-22T19:47:08,1
Did he win anything? Or just realized that his plan was f-ing stupid  Edit: Ahh negotiations haven’t even started yet I see. And he’s already folding. So I’m guessing the latter,A1sauc3d,2025-04-22T19:50:55,185
I thought he won't back down until Xi calls him. Well Art of the Kneel strikes again!,nasorrty346tfrgser,2025-04-22T20:06:25,65
"All this to basically fuck up short term and long term gdp potential for a generation. Fucking nice job dingbat.  Even if he brokered a deal I don’t see how it would be a net positive compared to what we lost.  Dudes the worst president we have ever had and up there with the worst leaders in history. What an absolute shit stained, incompetent, demented, racist, incontinent, waste of space and breath this dumb mfer is.",AcidRohnin,2025-04-22T20:15:28,56
I swear he does more backflips than an Olympic gymnast,Expensive-Horse5538,2025-04-22T19:47:34,105
"Tariffs are on. Okay, they're off. But they're on again. Except for electronics. Electronics are ESPECIALLY being tariffed. Then again, no. Yes. The world is being tariffed. But they're not, except when they are. 100%. 10%. 50%. Penguins have to pay for their exports. No they don't. Fuck it, I'm going golfing.",DoomOne,2025-04-22T20:12:31,42
Yes but unfortunately that doesn't mean China is now going to do the same. This man is so stupid it's amazing he remembers to breathe everyday.,Ande64,2025-04-22T19:56:02,28
"Oh. Did we build all the US factories last week?   Idiotic, deranged coward.",orcinyadders,2025-04-22T20:04:57,29
“Now would be a good time to buy”,OG-BoomMaster,2025-04-22T19:50:21,21
Create a problem and pretend solving by backtracking. That's his playbook,OneNaive56,2025-04-22T20:04:57,25
Oh and they still haven't actually reached a deal yet.,ZZartin,2025-04-22T19:53:29,17
"Alt headline : Xi still has not called Trump   >Trump hasn’t spoken with Xi since returning to the White House, the longest a US president has gone without talking to his Chinese counterpart post-inauguration in 20 years.    China Just Turned Off U.S. Supplies Of Minerals Critical For Defense & Cleantech   [https://cleantechnica.com/2025/04/05/china-just-turned-off-u-s-supplies-of-minerals-critical-for-defense-cleantech/](https://cleantechnica.com/2025/04/05/china-just-turned-off-u-s-supplies-of-minerals-critical-for-defense-cleantech/)   > What China did wasn’t a ban, at least not in name. They called it export licensing. Sounds like something a trade lawyer might actually be excited about. But make no mistake: this was a surgical strike. They didn’t need to say no. They just needed to say “maybe later” to the right set of paperwork. These licenses give Beijing control over not just where these materials go, but how fast they go, in what quantity, and to which politically convenient customers.  >  > The U.S.? Let’s just say Washington should get comfortable waiting behind the rope line. The licenses have to be applied for and the end use including country of final destination must be clearly spelled out. Licenses for end uses in the U.S. are unlikely to be approved. What’s astonishing is how predictable this all was. China has spent decades building its dominance over these supply chains, while the U.S. was busy outsourcing, divesting, and cheerfully ignoring every report that said, “Hey, maybe 90% dependence on a single country we keep starting trade wars with and rattling sabers at is a bad idea.”  >  > Try ramping up your semiconductor fab or solar plant when your indium source just dried up. It’s a fun exercise in learning which of your suppliers used to be dependent on Beijing but never mentioned it in the quarterly call.  >  > The materials China just restricted aren’t random. They’re chosen with the precision of someone who’s read U.S. product spec sheets and defense procurement orders. Start with dysprosium. If your electric motor needs to function at high temperatures—and they all do—then mostly it is using neodymium magnets doped with dysprosium. No dysprosium, no thermal stability. No thermal stability, no functioning motor in your F-35 or your Mustang Mach-E. China controls essentially the entire supply of dysprosium, and no, there is no magical mine in Wyoming or Quebec waiting in the wings. If dysprosium doesn’t come out of China, it doesn’t come out at all. It’s the spinal cord of electrification, and right now China’s holding the vertebrae.  >  > So here we are. China has responded to Trump’s tariffs by cutting off U.S. supply of some of the most essential ingredients of the modern world.",tech57,2025-04-22T20:30:35,17
what   a    DISASTER,Personal_Remote920,2025-04-22T19:51:24,16
Gaming the market for the next four years. Fucking brain dead voters man…,fowlraul,2025-04-22T19:48:57,30
Imagine thinking that any other foreign country takes him seriously,susibirb,2025-04-22T20:15:48,13
The bully took a swing and missed.  Now he thinks the target is going to be his friend again.,TintedApostle,2025-04-22T20:00:03,12
In exchange for...nothing.,Weird-Ad7562,2025-04-22T20:12:29,9
"Then what was their point in the 1st place... oh yea, to manipulate stocks so he & his cronies could get rich. ",StrangerFew2424,2025-04-22T19:54:54,10
dude caving again?,Illuminated12,2025-04-22T20:20:08,8
"He flinched... Again. God, this is the dumbest timeline...",SolemnestSimulacrum,2025-04-22T20:25:40,7
"Strong man, smart man, the best at deals. ",Mamatne,2025-04-22T19:55:39,6
"what happened to big str0nk, maga?  sad trombone.",hurdurBoop,2025-04-22T19:56:26,6
All those retailer CEOs bribed him yesterday. ,postmfb,2025-04-22T20:27:46,4
Why? He doesn’t want America to be rich anymore? lol…. What a loser,Sarcasmgasmizm,2025-04-22T19:57:08,3
I feel like he only did this to make his billionaire friends more money,Numerous_Lobster7330,2025-04-22T20:08:31,3
Pump and dump...ride the wave baby. ,therapistofcats,2025-04-22T20:23:30,5
Make Acrobatics Great Again,potchippy,2025-04-22T20:28:25,4
He gambled with our money and lost!!!,fairoaks2,2025-04-22T20:42:44,5
"Yet even in the thinly traded overnight markets, stocks still couldn't regain the level they jumped to when he first announced the pause. They're trying to jawbone it back up, and it isn't working.  I think he popped the bubble.",[deleted],2025-04-22T20:52:49,4
They should hold shipments till they get an apology.,fastcatdog,2025-04-22T20:53:22,4
He and his cronies made enough money from all the flip flopping that he can back them off now.  Anyone who doesn't see this whole damn thing as a huge grift is either embarrassingly naive or brainwashed.   Every republican who genuinely voted for him thinking he would make their lives better were played for chumps.,lathamb_98,2025-04-22T20:34:57,7
all that america being tough business just for him to be a coward in the end,saiyanscaris,2025-04-22T20:08:15,3
"What a weak, ineffective meatbag.",bullintheheather,2025-04-22T20:21:58,3
We're still gonna be paying more though.,thegoodnamesrgone123,2025-04-22T20:36:18,3
"Such a dealmaker!  He negotiated for China to charge us more for the same products, without getting anything for Americans.  When does the winning start?  We’ve been waiting nearly 10 years with nothing to show for it.",tjk45268,2025-04-22T20:57:31,3
"I swear this guy is a 4d chess master!!   No wonder he is famous for making deals, leaders of many many countries are lining up to kiss his asre.   Oh for any maga.   /s",Rude_Egg_6204,2025-04-22T21:02:54,3
Did he tell his rich stock owning buddies this a few hours before making the announcement so they could buy up stock. I'd imagine the market went up on this news.,mces97,2025-04-22T21:41:31,3
Still grifting I see. I wonder how many shares of shit rich people bought before the announcement,Mike_Pences_Mother,2025-04-22T19:57:47,2
caving trump,Cyndakill88,2025-04-22T20:04:35,2
All part of his plan to manipulate the markets and make money going down and up,Express_Ticket1699,2025-04-22T20:42:17,2
"Lol. He's trying to manipulate the stock market.  There is no ""deal"" coming anytime soon.  What happened to those 75 countries who have been begging to negotiate?  Not one single deal.  Trump is panicking.  My guess is Trump is getting economic data (that he should have access to) and it's bad.",Dry-University797,2025-04-22T20:58:07,2
There was never a fucking plan.,Elmer_Whip,2025-04-22T21:13:58,2
"Damn, the oligarchs must have made a phone call to maralago.  The dumbest man to have ever been in the oval office must really be shitting his pants from whatever they said to him.",Minute-Individual-74,2025-04-22T21:35:54,2
He has no cards.,stein63,2025-04-22T21:39:19,2
"United States President Donald Trump says American tariffs on Chinese imports will come down ""substantially"" from the current rate of 145 per cent.  ""It won't be that high, not going to be that high,"" he told an Oval Office press conference on Tuesday, local time.  Mr Trump said he believes a tariff deal with China could happen ""pretty quickly,"" adding he isn't going to ""play hardball"" during negotiations.  ""They're gonna do very well, and I think they're going to be happy, and we're gonna live together very happily and ideally work together,"" he said.  ""So I think it's gonna work out very well.""",The_Starving_Autist,2025-04-22T22:06:26,2
"China hasn't even called him to negotiate and Trump is already capitulating. Imagine telegraphing your next loser move to the ""enemy"" before you've even started actual negotiations.  ""Liberation Day"" was only three weeks ago and Trump has already lost. In just three weeks Trump has managed to:  * Start a trade war with friendly countries; * Crash the stock market; * Made bond yields up (gonna cost the US a LOT of money!); and * Increased the price of almost everything for everyday Americans.  A lot of countries that are traditionally friends are now pretty pissed off with America. So even if Trump removes all tariffs the damage is still done. There are a lot of people who don't want anything to do with buying from America anymore (or at least for the next four years).  Honestly, China is going to come out of this debacle much better than America.",Southern-Pen9792,2025-04-23T01:03:38,2
Donny Blinko,peatoire,2025-04-23T01:10:03,2
Caving so hard that echoes could be heard.,KeviRun,2025-04-23T02:30:20,2
Why is he being a Panican?,Language-Alternative,2025-04-22T21:11:16,2
Going to be something watching all of his cult followers call this a win.,ev6464,2025-04-22T20:13:55,1
Flip Flopper,thomas_brock13190,2025-04-22T20:56:50,1
How incredibly fucking stupid and immature these people are.   I guess? it's nice the tariffs are going down but these fucking idiots have no idea what they are doing. This political party is the equivalent of a hormonal high school boy rebelling against the world complaining about everything being unfair and not seeing how they are acting like an asshole.,citizen_x_,2025-04-22T21:03:39,1
Something tells me Trump could make the tariffs go negative and China will still twist the knife. What a stupid man.,hmr0987,2025-04-22T21:03:57,1
also every country in the world should pay attention to china here and do things the way china did. and eventually trump will fold and back out,saiyanscaris,2025-04-22T21:07:42,1
"Capitulated to China within weeks. I'm running laps around friends who voted for Trump in my group chat. The great negotiator, art of the deal? Haha, yeah right.",IpeeEhh_Phanatic,2025-04-22T21:11:18,1
China will demand that the tariffs be removed completely. Dummy Trump walked the US economy into a trap and now must try to wriggle his way out of it.   I suspect that China will be only satisfied with his complete and utter humiliation.,iyamwhatiyam8000,2025-04-22T21:11:19,1
Neato. And what did you get for engaging in this death spiral charade? How are things more fair for America now?,once_again_asking,2025-04-22T21:13:03,1
Hey Y'all: Just a reminder: It's only Tuesday.  There's a few more days left in the week and plenty more darts to throw at the tariff dartboard.,Catspaw129,2025-04-22T21:14:33,1
Guessing some Wall St VIP made a phone call after all the threats to fire Powell and told him “here’s what you’re gonna do…” hence all the commentary on Powell and the tariffs after the bell.,mkt853,2025-04-22T21:15:59,1
"Man, he, along with his supporters, turned the US into a joke. What kind of basic negotiation ""tactic"" is starting at 145% tarrifs just to settle at like 10%? That's not a negotiation. That's *thinking* you know how to negotiate.",Necessary_Grass_2313,2025-04-22T21:19:48,1
Art of the Deal,schu4KSU,2025-04-22T21:31:40,1
The day can't come soon enough when the world won't hear about this POS again.  He has hastened the fall of America and the opportunity now for a better world order.,throwaway1070now,2025-04-22T21:39:23,1
So only 100% now,Corryinthehouz,2025-04-22T21:39:24,1
Any concessions?  Or is this just Trump caving again.,YesterShill,2025-04-22T21:42:17,1
Are we winning yet? Cause it looks like we're heading towards a nation shattering economic depression and tyranny.,Grace_of_Talamh,2025-04-22T22:13:16,1
"Eh, he says a lot of things and back-pedals on those things he said faster than a circus clown on a unicycle, so until the tariff's are actually reversed it's all talk.",dispelhope,2025-04-22T22:16:55,1
"He’s just squirming to unpack his mess, shooting blanks again.",Fit-Significance-436,2025-04-22T22:25:39,1
Funny smile for a man whose asshole is bleeding.  Maybe he likes it.,NoOneStranger_227,2025-04-22T22:31:58,1
Bend the knee Donnie you are no match,Ok-Spot-9917,2025-04-22T22:36:23,1
Coward lol,AliveTank5987,2025-04-22T22:41:12,1
Another pump cycle in the market graft pump/dump component of his second term.  I'm wondering if the crypto scams aren't panning out for him and he's having to revert to good old fashioned market manipulation?,SoupSpelunker,2025-04-22T22:47:29,1
"Mr wishie washie   One day it is this, the next day it is that  You can’t run AMERICA AMUCK",doublelist87,2025-04-22T22:51:15,1
Already laid off hell ya,AnalExplodes,2025-04-22T22:53:57,1
They will be 10% and he will celebrate this as a “massive tax cut for the middle and lower class”,Darkstar197,2025-04-22T22:57:12,1
Everyone is laughing at the US.,this_name_not_that,2025-04-22T23:02:41,1
This chaos makes it impossible for businesses to plan and order things that potentially arrive subject to taxes in the hundreds or thousands of percentages. Cannot imagine the USA business community tolerating this shit show much longer.,cookycoo,2025-04-22T23:20:29,1
"Oh MAGA, you're supreme macho leader is a fucking horrible negotiator.",Responsible-Pain-620,2025-04-22T23:56:09,1
"Proper Headline: trump caved to China, demonstrating what a pathetic weak clown he is.",CraftBeerParis,2025-04-23T00:06:48,1
"Oh no, baby bitch boy is folding. How sad.",allthe_namesaretaken,2025-04-23T00:32:07,1
Why would you negotiate with Donald while all you need to do is waiting he changes his mind ?,Em1ngh,2025-04-23T00:33:38,1
"Did Walmart, Target and Home Depot convince him how devastating these tariffs would be on their businesses and their customers?",User4C4C4C,2025-04-23T00:35:22,1
"Could someone living in the US tell me if you are experiencing a actual increase in the living cost? Or rather, people don't really feel it?      In general, as a foreign trade practitioner (B2B) here in China, Trump's policies are bringing a lot of uncertainty, making business tough. Most business owners and employees I am familiar with, hold a pessimistic attitude towards the future market, except for some top monopolistic enterprises.",Newelegy,2025-04-23T00:41:28,1
Stock market manipulation again,DefiantCommand4357,2025-04-23T00:44:47,1
"Got it, we are in the pump phase again of his scheme.",Stummi,2025-04-23T00:45:48,1
And if Xi just says fine and leaves his tariffs where they are?,woodstockzanetti,2025-04-23T01:40:26,1
So why did we do this in the first place? Everyone told you it was a stupid idea. ,jgilla2012,2025-04-23T03:12:33,1
"Buy calls, anounce lowering of tariffs, collect.  That's what this is.",bosgeest,2025-04-23T03:25:44,1
"This is stock manipulation at the most blatant.  This criminal is assisting his friends by manipulating the stock market at a whim, all his buddies are making billions of it.",Content_Ad9506,2025-04-23T03:27:06,1
"This feels like a triple barrel then proceeding to fold out of turn, all while the opponent sits there calmly watching.",Ok-Potential-1832,2025-04-23T04:29:16,1
Imagine considering investing tens of millions of dollars in a new factory in the USA while this clown changes direction completely every few days. Industries need stable long-term conditions. Not this crap.,De_chook,2025-04-23T04:32:36,1
"God, I so want to play poker with this orange turd.   Raise, raise, raise, all-in, fold.   Every time!",albiondave,2025-04-23T05:17:48,1
"Canadian here. I hope China does what we’re doing. I don’t know how many times Trump has changed the tariffs on our products, but our tariffs on US products have remained in place since their inception. We’re not playing these stupid games.",sharp11flat13,2025-04-23T05:18:33,1
Announcing the upcoming stock market rebound,30mil,2025-04-23T05:44:45,1
He shit the bed and he knows it. Now he is looking for someone to take the blame and he can say it was never his idea.,CurrentlyLucid,2025-04-23T07:20:33,1
Here's the next pump for the next dump. Why does anyone believe anything he says? Actions speak much much louder than words.,FuzzyCub20,2025-04-23T08:24:14,1
"At the end of the day, everyone bows to China.",AlstottUpDaGutt,2025-04-23T18:16:12,1
"""The worst thing you can possibly do in a deal is seem desperate to make it.""    \- The Art of the DealBook by Donald Trump",Saltie-orange,2025-04-23T21:19:58,1
"Now the fun begins, who could have seen this coming other than anyone who understands how much respect means to the Chinese, just because they were kind to him by letting him get away with quite a lot of bullshit, I think Queen Vance calling them peasants was the tipping point, They have had enough and they are not going to let up now, Trump has not even realised yet that his attempt at appeasement now is far too late. Wait till it dawns on him how mean China is being to him, he'll be whining about that till the end of time.",you_are_soul,2025-04-24T06:28:57,1
">Treasury Secretary Scott Bessent said in a private speech that trade negotiations between the US and China were yet to formally start.      If he had brokered some amazing secret deal he'd already be ""truthing"" about it non-stop.",SquidFarts,2025-04-22T19:56:11,71
Art of the deal! Negotiating with himself and losing!,PatchyWhiskers,2025-04-22T21:04:19,45
China was never going to negotiate on this. They made that clear. They are negotiating with all of our trade partners to fill the void we leave behind.  Trump just surrendered. I bet the Chinese don’t change policies though. Why should they? They can fuck his over and also say they never know what to trust out of DC.,KilroyLeges,2025-04-22T21:35:57,27
"He caved, projecting weakness and fragility",gradientz,2025-04-22T23:12:40,7
"The man’s life is lying, cheating, raping, committing crimes, and hemorrhaging money. Big fat fucking loser",TurquoiseSnail720,2025-04-23T00:33:25,7
"I’m glad that he’s folding, I don’t care what he has to lie about to save his face from leopards.  Just stop this madness.",Rikers-Mailbox,2025-04-23T04:56:23,1
Unfortunately Trumps biggest weakness is taking hold   His laziness   Sad because we are going to lose another 4 years of not fixing any of our problems,yoppee,2025-04-23T10:53:50,1
hence it won’t go down. xi isn’t calling. markets seemed to miss that,whatproblems,2025-04-23T00:43:36,5
Take this up vote NOW!!!!,Ok_Feeling9354,2025-04-22T20:41:12,9
Xi is calling everyone but Drumpf!,295Phoenix,2025-04-23T05:55:26,1
Don’t forget rapist,Alaskaguy,2025-04-23T10:31:13,6
Did the Chinese tariffs even last a Mooch?,TubeframeMR2,2025-04-22T20:21:57,23
"That's his signature Trump Backflip: triple backflip in layout position, four full twists, and lands squarely on both sides of reality.",DuplicatedMind,2025-04-22T20:28:23,18
How did he seriously expect this to go? China produces so many goods that the US relies on along with a huge number of raw materials. What was a 245% tariff on everything out of China going to achieve other than putting a bullet into the economy? Mission accomplished I guess?,legocastle77,2025-04-22T20:20:13,16
Not more than his followers making excuses for his batshit insane behavior.,MidnightWorried6992,2025-04-22T20:34:33,6
He's trying to prop up the stock market.  Some bad economic data is coming I bet.,Dry-University797,2025-04-22T20:59:08,5
He has more skills named after him in the gymnastics code of points than Simone Biles.,jjgm21,2025-04-22T20:00:10,2
Red waffler,mole_that_got_whackd,2025-04-22T20:34:48,2
And now I have a terrible mental image in my head. Thanks :P,kookiemaster,2025-04-22T21:28:18,2
"If we wanted to go snowboarder rotations of a 360, has he already surpassed the snowborder 2340??",TheRabidGoose,2025-04-22T22:02:15,2
Hmmm… Reminds me of a politician from our country,jmw1163,2025-04-22T23:53:57,2
"I lost at golf, 3500%!",Postom,2025-04-22T21:06:08,10
I hope China makes it hurt.,MixRepresentative819,2025-04-22T20:34:25,12
It also doesn't make the last months of orders be produced or shipped. ,ratedsar,2025-04-22T22:05:25,2
"He may be stupid, but not as stupid as those millions who voted him in. He incited a riot on the Capital, impeached twice, and was convicted of 34 felonies. Not to mention his failed businesses and bankruptcies. Yeah let's have him for president!!",Ok-Evening9269,2025-04-23T00:27:25,2
"Yeah, latest news is that a company based in Guangzou  that manufactures rubber dogshit and whoopsie cushions is thinking about setting up manufacturing in Nebraska. Massive employment opportunities for about a dozen people at .75 cents an hour. Make Murica Grate Agin!",hr2pilot,2025-04-22T22:36:22,2
China hasn’t even reached out.  This is just Trump putting putting his tail between his legs.,YgramulTheMany,2025-04-22T19:58:09,31
and trump falls in defeat by pulling back,saiyanscaris,2025-04-22T20:56:21,3
"All the other foreign leaders are coming up to him, big guys, smart guys, with tears in their eyes, saying ""Sir, will you please make a deal with us?""",BurnedWitch88,2025-04-22T20:56:35,8
I think more countries are then I  initially thought after seeing this.  [https://www.reuters.com/sustainability/climate-energy/eu-explores-tweaking-methane-rules-us-gas-help-trade-talks-sources-say-2025-04-21/](https://www.reuters.com/sustainability/climate-energy/eu-explores-tweaking-methane-rules-us-gas-help-trade-talks-sources-say-2025-04-21/),Specialist_Cicada200,2025-04-22T22:55:15,1
I heard that in my head!!!,Weird-Ad7562,2025-04-22T20:13:06,2
"Oh, he did it because he really thought it was a good idea. The waffling allowing his buddies to wring more capital out of the market was just a side benefit.",BurnedWitch88,2025-04-22T20:58:15,1
Make Assholes Goebbels Again.,sharp11flat13,2025-04-23T05:23:30,1
Did you expect something different?,BurnedWitch88,2025-04-22T20:57:33,1
He is brilliant ( in his own mind ) That’s why he wrote the art of the Fart .,-Freddybear480,2025-04-22T21:19:20,2
It was always about capitulating to China. /s,schu4KSU,2025-04-22T21:35:52,2
Then we're fucked.,295Phoenix,2025-04-23T06:00:25,1
Fart of the steal,zubuneri,2025-04-22T21:19:04,10
And that void was only 15% of their total global sales. China has arrived.,CV90_120,2025-04-23T03:47:56,5
"Hell, now china have a reason to demand something now that US just cave in.",kerorobot,2025-04-23T09:50:52,2
Damage has still been done. China's going to be buying their oil from Canada and beef from Australia now rather than us. It's great that he's giving up but we've still been fucked.,295Phoenix,2025-04-23T05:54:37,3
Didn’t even outlast a head of lettuce.,UltravioletAfterglow,2025-04-22T21:05:05,10
Probably related to unemployment because of all the federal employees he illegally fired. ,Dear_Boot9770,2025-04-23T11:56:44,1
Dear leader Trump is best golfer. #1 in country.,zedodee,2025-04-22T23:54:18,2
