Comment,Author,Date,Score
" As a reminder, this subreddit [is for civil discussion.](/r/politics/wiki/index#wiki_be_civil)  In general, be courteous to others. Debate/discuss/argue the merits of ideas, don't attack people. Personal insults, shill or troll accusations, hate speech, any suggestion or support of harm, violence, or death, and other rule violations can result in a permanent ban.   If you see comments in violation of our rules, please report them.   For those who have questions regarding any media outlets being posted on this subreddit, please click [here](https://www.reddit.com/r/politics/wiki/approveddomainslist) to review our details as to our approved domains list and outlet criteria.    We are actively looking for new moderators.  If you have any interest in helping to make this subreddit a place for quality discussion, please fill out [this form](https://docs.google.com/forms/d/1y2swHD0KXFhStGFjW6k54r9iuMjzcFqDIVwuvdLBjSA).    ***   *I am a bot, and this action was performed automatically. Please [contact the moderators of this subreddit](/message/compose/?to=/r/politics) if you have any questions or concerns.*",AutoModerator,2025-04-23T01:19:08,1
So he’s definitely firing Powell. Got it.,ApplicationAfraid334,2025-04-23T01:19:47,30
"President Trump said he had “no intention of firing” Jerome Powell after his criticism of the US Federal Reserve chairman led to a sharp sell-off in American shares and the dollar.  He said in a news conference on Tuesday that he wanted Powell to be “a little more active in terms of his idea to lower interest rates”.  Last Thursday, Trump said the “termination” of Powell as Federal Reserve chairman “cannot come fast enough” after Powell raised concerns about the impact of tariffs on the US economy.  The president renewed his attack on his social media platform Truth Social on Monday, calling Powell “TOO LATE AND WRONG” and demanding immediate interest rate cuts. This triggered a market sell-off on Monday that left all three main equity indices down more than 2%",TimesandSundayTimes,2025-04-23T01:19:46,10
"Playground bully tactics, pretty much as expected from this fucking guy",Drolb,2025-04-23T01:49:22,7
What a fucking maniac. The world has zero trust in America now.,Beforemath,2025-04-23T01:56:56,7
"classic trump thing, i believe that is what he said about the art of making a deal",R2-D2Skywalker,2025-04-23T01:21:27,7
I heard Circ du Soleil were hoping to get Trump as an acrobat. Despite his age he's an expert at backflips.,Ohforgawdamnfucksake,2025-04-23T01:50:30,7
Yeah so when everything crashes there will be someone besides his own fat ass that he can point the finger at,EZbreezyFREEZY,2025-04-23T01:53:43,3
Today. Tomorrow is another question. As is the day after and the one after that,PerformerOk4332,2025-04-23T02:31:54,3
He is also backing off the Tariffs i am guessing the other billionaires got together and threatened Trump.,sedatedlife,2025-04-23T02:44:13,4
Like with everything Trump says - I will believe it when I see it.,Truthisnotallowed,2025-04-23T02:51:51,3
"""Trump's reversal on Powell has stocks roaring higher""  More stock market manipulation. First the tariffs on/off switch, now Fed threats.",mhsuffhrdd,2025-04-23T07:37:36,3
"This submission source is likely to have a soft paywall. If this article is not behind a paywall please report **this comment** for “breaks r/politics rules -> custom -> ""incorrect flair"""". [More information can be found here](https://www.reddit.com/r/politics/wiki/index/#wiki_paywalls)  *I am a bot, and this action was performed automatically. Please [contact the moderators of this subreddit](/message/compose/?to=/r/politics) if you have any questions or concerns.*",AutoModerator,2025-04-23T01:19:09,1
🤣Just overlooks the fact the he hasn’t the power to do so.,yorapissa,2025-04-23T06:08:18,1
I suspect there was a sudden uptick in volume of calls on index funds yesterday afternoon from a suspicious cohort of Trump associates.,jaywastaken,2025-04-23T06:25:33,1
"“Trump, with a straight face, says he has no intention of firing fed chief Jerome Powell”  FTFY",Big-Plankton-4484,2025-04-23T07:00:40,1
He legally can't. Powell should move to hire more guards for the building. Trump firing him would be no different than me firing him.,Plzbanmebrony,2025-04-23T02:00:04,7
Or Else…. Deportation is my guess,Big-D-TX,2025-04-23T08:16:15,1
"Trump is like U turning every day, or should i say, every few hours",R2-D2Skywalker,2025-04-23T01:31:31,5
The art of nobody wanting to deal with you again.,PhDinDildos_Fedoras,2025-04-23T03:20:48,4
There's a beach stand somewhere looking to sell an excellent flipflop.,PhDinDildos_Fedoras,2025-04-23T03:19:21,1
In theory he can’t but I can see him putting pressure on the trump sycophants in congress. He has die hard loyalists in every branch.,ApplicationAfraid334,2025-04-23T02:07:50,5
There are a lot of things he legally can’t do that he’s already done. Including firing people at what were supposed to be independent agencies.,Melodic-Task,2025-04-23T04:39:30,5
Trump: The flipflop  you wear when you like the feel of dogshit between your toes.,Ohforgawdamnfucksake,2025-04-23T04:53:19,3
