Comment,Author,Date,Score
" As a reminder, this subreddit [is for civil discussion.](/r/politics/wiki/index#wiki_be_civil)  In general, be courteous to others. Debate/discuss/argue the merits of ideas, don't attack people. Personal insults, shill or troll accusations, hate speech, any suggestion or support of harm, violence, or death, and other rule violations can result in a permanent ban.   If you see comments in violation of our rules, please report them.   For those who have questions regarding any media outlets being posted on this subreddit, please click [here](https://www.reddit.com/r/politics/wiki/approveddomainslist) to review our details as to our approved domains list and outlet criteria.    We are actively looking for new moderators.  If you have any interest in helping to make this subreddit a place for quality discussion, please fill out [this form](https://docs.google.com/forms/d/1y2swHD0KXFhStGFjW6k54r9iuMjzcFqDIVwuvdLBjSA).    ***   *I am a bot, and this action was performed automatically. Please [contact the moderators of this subreddit](/message/compose/?to=/r/politics) if you have any questions or concerns.*",AutoModerator,2025-04-23T09:41:00,1
As any sane person would.,gasahold,2025-04-23T09:44:16,28
"Pope was pro DEI and immigrants while Trump is a known racist, bigot and sexist.  Pope was an honorable man while Trump isn't.  Pope will go to heaven.",reddittorbrigade,2025-04-23T09:44:40,26
"""That's why he had to die.""",NihilisticPollyanna,2025-04-23T09:47:26,17
So I smothered him with a pillow,PerfectHandz,2025-04-23T09:45:47,12
"I think he was a great Christian pastor and that's how I choose to remember the holy father.""""  A ""great Christian pastor""?  The *Pope*?  The *Bishop of Rome*?  The Supreme Pontiff?  And that's the phrase you choose to remember him with?  Do you also see a hurricane rip through the US Bible Belt and think to yourself ""Hm, that's a little breezy""?",memcginn,2025-04-23T09:51:53,10
"""Compassion and love are what Jesus preached""  ""I disagree, your holiness""",steve_ample,2025-04-23T10:00:01,11
"He's allowed to disagree Vance, that's not enough reason to kill him! Pope slayer!",Salurain,2025-04-23T09:50:28,6
MTG said worse things. She's even more vile than Vance.,Automatic-Advice-613,2025-04-23T10:04:14,4
... and so he had him liquidated.,pjwalen,2025-04-23T10:11:03,4
"He was a decent man, indeed.",postsshortcomments,2025-04-23T09:44:43,3
"By Dan Cody - Digital Media Reporter:   Vice President JD Vance has reflected on the legacy of Pope Francis and their recent meeting, acknowledging policy disagreements but emphasizing the pontiff's lasting impact as a pastoral leader.  Speaking to reporters in Agra, India, on Wednesday, Vance addressed questions about whether he would attend the pope's upcoming funeral and shared personal insights into their encounter, which occurred less than a day before the pope's death.  Read more: [https://www.newsweek.com/pope-francis-jd-vance-trump-administration-funeral-2062978](https://www.newsweek.com/pope-francis-jd-vance-trump-administration-funeral-2062978)",newsweek,2025-04-23T09:42:03,2
Was it the fascism?    I bet it was the fascism.,Searchlights,2025-04-23T10:35:02,2
You misspelled Jesus. Jesus was pro DEI and immigration.,YouShouldLoveMore69,2025-04-23T10:42:48,6
A sofa pillow.,Temporary_Client7585,2025-04-23T10:17:58,3
