Comment,Author,Date,Score"> negotiate fair pricing.  > In 2021 An arbitrator ruled that the DOD VA had engaged in bad faith bargaining during contract negotiations with  American Federation of Government Employees for employees of the VA since 2017.  The most recent example of this  **State of California Single Payor Healthcare** vs **Doula Providers**  * The Department of Health Care Services (DHCS) added doula services as a covered benefit on January 1, 2023.  >Doulas had initially criticized the state for offering one of the lowest rates in the nation, $450 per birth — so low that many said it wouldn't be worthwhile to accept Medi-Cal patients.   * The sticking point, Doulas do not deliver babies. Meaning the state has to also pay an OBGYN   * the rate Medicaid programs pay is a maximum, which doulas receive if the patient attends every prenatal and postnatal visit.  * Doulas provide resources to navigate the health care system, information on sleep or nutrition, and postpartum coaching and lactation support. They also support mothers during birth to make sure their wishes are being respected by the hospital.   Doulas are also unregulated  In response to the backlash on low rates, Gov. Gavin Newsom  increased his proposal to $1,154, far higher than in most other states  **State of California Single Payor Healthcare** vs **Doula Providers**  Final Score  * State of California Single Payor Healthcare **0**  * Doula Providers **1**  They reject State of California Single Payor  ------- And when given the option, people dont like it  NYC operates its own Single Payer Healthcare and Public Option  ------ The Single Payer System is used by 15% of the Population   * 1.2 Million, of the more than 8 Million New Yorkers visit  NYC Health + Hospitals.  * NYC Health + Hospitals operates 11 Acute Care Hospitals, 50+Community Health Centers, 5 Skilled Nursing Facilities and 1 Long-Term Acute Care Hospital",semideclared,2025-04-24T11:43:20,1
">Medicine price should be just about the price it costs to make it.  Good one  How much should doctors and Hospitals have costs for rent  * Like most Businesses, Rent is about 10 percent of costs....  Spend $150,000 on rent a year for a doctors office means $1.5 Million in Total Operating Costs  Is that high?  Doctor sees about 2,500 people a year  * 2500 people pay $600 a year to see the doctor  * $60 of that is rent",semideclared,2025-04-24T11:49:15,1
"You’d be absolutely insane if you think we should have more monitoring of private data, rather than less",barchueetadonai,2025-04-23T15:28:00,2
"> Insurance companies are the only reason healthcare is expensive to begin with.   Sourse please  Because   Let me help you with the Facts  >insurance industry last year “sucked $23 billion in profits out of the health care system.”    - Elizabeth Warren * as reported by  2019 National Association of Insurance Commissioners U.S. Health Insurance Industry | 2018 Annual Results   As of 2017, there's $3.5 Trillion in spending on healthcare.   Profits were then 0.65% of expenses   ------ Private insurance reported in 2017 total revenues for health coverage of $1.24 Trillion for about 110 Million  Americans Healthcare  * $1.076 Trillion the insurance spends on healthcare.  That leaves $164 Billion was spent on Admin, Marketing, and Profits at Private Insurance.     * **$75 Billion** savings for onboarding the Insured to Medicare taking Profit and excess Admin costs out  **Of course, there is $1.7 Trillion Medicare and Medicaid spends** doesn’t get cheaper   * But because of Medicare Advantage, Medicare has outsourced most of the Admin to Private Insurance. So we  would increase Medicare Costs to rise about $50 Billion on top of no savings   **Net Savings of about $25 Billion** 0.75% of Healthcare Costs  0.75% means there is 99.25% of Costs still there   ------- The Doctor's Office,  and all the other Medical Offices where we spend $950 Billion a year for mostly office visits and Lab work. Almost 1/3rd of Healthcare  **How do you want to cut that spending**  >After that is taken care of, make healthcare free at the cost of slightly higher taxes.  Source please  In 2011, the Vermont legislature passed Act 48, allowing Vermont to replace its current fragmented system--which is driving unsustainable health care costs-- with Green Mountain Care, the nation’s first universal, publicly financed health care system  Healthcare Reform would realistically be financed from  * An 11.5% payroll tax on all businesses * A sliding scale income-based public premium on individuals of 0% to 9.5%.   * The public premium would top out at 9.5% for those making 400% of the federal poverty level ($102,000 for a family of four in 2017) and would be capped so no Vermonter would pay more than $27,500 per year.   > After the non-stop weekend, Lunge met on Monday, December 15 2014, with Governor Shumlin. He reviewed the weekend's work and delivered his final verdict: he would no longer pursue single-payer.  So 9.5% is already more than most people pay but its going to have to be more than that to account for the small businesses that cant afford the cost of Insurance   * Smaller businesses, many of which do not currently offer insurance would need transition costs  requiring an additional 4 points on the payroll tax or 50% increase in the income tax.  Shumlin's office kept the decision secret until a Wednesday press conference.   >The audience was shocked — **many had turned up thinking that Shumlin would announce his plan to pay for universal coverage**, not that he was calling the effort off.  > * ""It was dramatic being in that room,"" Richter said. ""You just saw reporters standing there with their mouths open.""  Vermont had spent 2 and a half years to create a Single Payor plan all the way to the Governor's desk to become a Law and Single Payor in Vermont  The Governor veto'd it at the last step, The only thing that stopped it was the governor objecting to the taxes to fund it  The same taxes wold be required for a national single payer   >Health Care Reform would cover all Vermonters at a 94 actuarial value (AV), meaning it would cover 94% of total health care costs   * And leave the individual to pay on average the other 6% out of pocket.   **Yes....all healthcare reform proposals currently in review in the US still include additional Out of Pocket Costs**  And even with OOP the taxes are still to high",semideclared,2025-04-24T11:24:38,1
"There's nothing inherently wrong or inherently bad about using an insurance model to finance necessary health care. Plenty of developed world spots around the globe do exactly that.  Even if you comparatively chuck out the globally exceptional outlier, as anyone should unless you're just making yet another glaring point about the *exceptional* outlier, the insurance model spots have done that rather well and continue to do so.  America's continues to choose the worst of the worst aspects of using an insurance model to finance necessary health care, has done so for 8 uninterrupted decades, and enshrines them into law.",AllTheyEatIsLettuce,2025-04-24T13:39:45,1
"Health insurance is a scam and should not exist, period. Universal healthcare is the only humane answer.",stinkywrinkly,2025-04-23T14:32:04,-3
"I think preventive care and lifestyle changes should be incentivised through fed/state/local grants and tax breaks.  That would make the biggest change and fast.  People love saving money but once they see the benefits of less body (and mind) problems, all the rest of the industry wouldn't be as necessary.",mycall,2025-04-24T08:33:16,1
"If only it was that simple    >  “The bone marrow transplant issue gets at part of the crux of the health-care crisis,” said Dr. James Gajewski, a member of the UCLA Medical Center bone marrow transplant team. “What do you do with patients with a terminal disease who may have a chance of cure” with therapy that’s inconclusive? he asked. “How do you pay for it?”  In 1991, Nelene Fox, a 38-year-old mother of three, was diagnosed with breast cancer. She underwent bilateral mastectomies and chemotherapy but nonetheless developed bony metastases. Her physicians said her only chance for survival was high-dose chemotherapy and autologous bone marrow transplantation. A costly new kind of therapy that involves the harvest and retransplant of her own bone marrow–high-wire medicine occupying what one of her physicians calls “the twilight zone between promising and unproven treatments.""  * Doctors say 5% or more die from the treatment itself  Her Health Maintenance Organization (HMO) refused to cover the procedure (around $140,000 - $220,000) on the basis that it was experimental.  “How do you pay for it?”  Who pays for it?”  Its the Top, **Cutting the Spending of the Top 10% in half saves $1 Trillion** 30 Percent Savings. Indeed, this skewness in health care spending has been documented in nearly every health care system, its just the US Spends the most and the most on its most expensive.   Spenders	|	Average per Person	|	Civilian Noninstitutionalized Population	|	Total Personal Healthcare Spending in 2017	|	Percent paid by Medicare and Medicaid ------	|	-----	|	------	|	------	|	---- Top 1%	|	$259,331.20	|	2,603,270	|	$675,109,140,000.00	|	42.60% Next 4%	|	$78,766.17	|	10,413,080	|	$820,198,385,000.00	|	 Next 5%	|	$35,714.91	|	13,016,350	|	$464,877,785,000.00	|	47.10%  So-called “super spenders;” are people that accumulate more than $250,000 in drug costs per year.  In 2016, just under 3,000 people were Super Spenders. By the end of 2018, that figure had grown to nearly 5,000.   Then there is Elite super-spenders those spending at least $750,000 in drug costs per year. In 2016, 256 people were Elite super-spenders. By the end of 2018, that figure had grown to 354.  Almost all of these 5,000 people were using **Cancer Drugs**   ------- Then there are the Super Users   >In Camden NJ, A large nursing home called Abigail House and a low-income housing tower called Northgate II between January of 2002 and June of 2008 nine hundred people in the two buildings accounted for more than 4,000 hospital visits and about $200 Million in health-care bills.  .  >Eugene Harris, age forty-five. Harris was diagnosed with type 1 diabetes when he was thirteen and dropped out of school. He never went back. Because he never graduated from high school and because of his illness, Harris hasn’t had a steady job. Different family members cared for him for decades, and then a number of them became sick or died. Harris became homeless. He used the Regional One ED thirteen times in the period March–August 2018. Then he enrolled in ONE Health. The hospital secured housing for him, but Harris increased his use of the ED. He said he liked going to the hospital’s ED because “I could always get care.” From September 2018 until June 2019 Harris went to the ED fifty-three times, mostly in the evenings and on weekends, because he was still struggling with his diabetes and was looking for a social connection, Williams says.  * Then in June 2019, after many attempts, a social worker on the ONE Health team was able to convince Harris to connect with a behavioral health provider. He began attending a therapy group several times a week. He has stopped using the ED and is on a path to becoming a peer support counselor.  ONE Health clients are 50 years old on average and have three to five chronic conditions.  Social needs are prevalent in the population, with 25 percent experiencing homelessness on admission, 94 percent experiencing food insecurity, 47 percent with complex behavioral health issues, and 42 percent with substance use disorder.  LongTerm Care Providers in 2016, was 12.9% of all Medical Spending Across the U.S. and Medicaid and Medicare Pay 66 Percent of Costs.   * 4.5 million adults' receive longterm care, including 1.4 million people living in nursing homes.   A total of 24,092 recipients received nursing home care from Alabama Medicaid at a cost of $965 million.  **Its really that easy. Tell people No**",semideclared,2025-04-24T16:00:31,1
"> if we actually want to fix healthcare in this country, it starts by tearing out the rot at the foundation.   Ok  > In Camden NJ, A large nursing home called Abigail House and a low-income housing tower called Northgate II between January of 2002 and June of 2008 nine hundred people in the two buildings accounted for more than 4,000 hospital visits and about $200 Million in health-care bills.  That?  >A total of 24,092 recipients received nursing home care from Alabama Medicaid at a cost of $965 million.  That?  >  “The bone marrow transplant issue gets at part of the crux of the health-care crisis,” said Dr. James Gajewski, a member of the UCLA Medical Center bone marrow transplant team. “What do you do with patients with a terminal disease who may have a chance of cure” with therapy that’s inconclusive? he asked. “How do you pay for it?”  In 1991, Nelene Fox, a 38-year-old mother of three, was diagnosed with breast cancer. She underwent bilateral mastectomies and chemotherapy but nonetheless developed bony metastases. Her physicians said her only chance for survival was high-dose chemotherapy and autologous bone marrow transplantation. A costly new kind of therapy that involves the harvest and retransplant of her own bone marrow–high-wire medicine occupying what one of her physicians calls “the twilight zone between promising and unproven treatments.""  * Doctors say 5% or more die from the treatment itself  Her Health Maintenance Organization (HMO) refused to cover the procedure (around $140,000 - $220,000) on the basis that it was experimental.  That?  >Or **Cutting the Spending of the Top 10% in half saves $1 Trillion** 30 Percent Savings. Indeed, this skewness in health care spending has been documented in nearly every health care system, its just the US Spends the most and the most on its most expensive.   Spenders	|	Average per Person	|	Civilian Noninstitutionalized Population	|	Total Personal Healthcare Spending in 2017	|	Percent paid by Medicare and Medicaid ------	|	-----	|	------	|	------	|	---- Top 1%	|	$259,331.20	|	2,603,270	|	$675,109,140,000.00	|	42.60% Next 4%	|	$78,766.17	|	10,413,080	|	$820,198,385,000.00	|	 Next 5%	|	$35,714.91	|	13,016,350	|	$464,877,785,000.00	|	47.10%  So-called “super spenders;” are people that accumulate more than $250,000 in drug costs per year.  In 2016, just under 3,000 people were Super Spenders. By the end of 2018, that figure had grown to nearly 5,000.   Then there is Elite super-spenders those spending at least $750,000 in drug costs per year. In 2016, 256 people were Elite super-spenders. By the end of 2018, that figure had grown to 354.  Almost all of these 5,000 people were using **Cancer Drugs**   That?  All of that is the US cutting spending close to the rest of the world",semideclared,2025-04-24T16:05:33,1
I love the idea of this,indigoC99,2025-04-23T19:35:27,0
"~140 Million people have  nearly free to them healthcare through Medicare and Medicaid as low income and elderly pay nearly $0 in Taxes in the US  Add in In 2018, 27.5 million, did not have health insurance at any point during the year   *   There are 5.1 million people that make over $100,000 that are uninsured.  *   There are 9.1 million people that make $50,000 - $100,000 that are uninsured   155 million people would owe some kind of tax in a new system and   Thats the problem  Because  >You literally pay the same in tax as us in the UK   Yes and No, 2019's [Government Social Spending & Tax Revenue as a Percent of GDP in the OECD](https://i.redd.it/inidngntu6fa1.png)  ------- There is no VAT in the US and almost all federal taxes is taxes from the top 40% who recieve very little in social services    UK Taxes vs US Taxes  Compare In the US  * Top 1% Paid 40.4% of Income Taxes * Top 90%-99% paid 31.6% * 50% - 90% paid 25% * Bottom 50% paid 3%  This is not true in the UK  * Top 1% Paid 29.1% of Income Taxes * Top 90%-99% paid 31.2% * 50% - 90% paid 30.2% * Bottom 50% paid 9.5%  Plus a VAT everyone pays",semideclared,2025-04-24T16:09:02,1
"The VA system does not all a vet to be seen “for anything.”     There are a huge number of eligibility limits and restrictions, and the entire system spends close to twice the national per-patient average anyway.",DanforthWhitcomb_,2025-04-23T15:14:58,0
It’s been tried in Vermont and California and has never made it out of committee because the costs would force effectively doubling the size of the state budgets.     The feds also don’t have the constitutional authority to force the states to spend money.,DanforthWhitcomb_,2025-04-23T14:51:28,3
"Explain to them that they can either lower their prices to reasonable levels, or they will be nationalized through eminent domain.  It's not hard or complicated.  It just requires a government with the resolve to actually do it.",candre23,2025-04-23T16:10:30,1
Between employer and employee taxes Medicare already gets 2.9% of your income.,DanforthWhitcomb_,2025-04-23T15:17:02,0
"It’s not that simple, and saying that it is just sets the discussion up for tangential argument.    For all its warts, the US has the best healthcare in the world IF you look at the absolute top care and research takes place. That’s not at all saying it’s available to the general population, but the care and innovation at that top level is (at least somewhat) a function of the profit-driven system we have.   Now, a more “everyday” level of care that is available to all is certainly a goal. The question is how to achieve that without sacrificing the above. Baby and bath water and all that.   Also, these other countries are not nearly as seamless as “I have an owie and all I need to do is go get it taken care of.” Care is necessarily rationed and waitlisted, and private insurance or cash is used to cover gaps.    I’m not at all against a national plan, and have lived in countries where that everyday access is there. I’m just not naive about the practicalities.",JuniorFarcity,2025-04-24T07:37:20,1
That just sounds like paying for your healthcare with extra steps,escapevelocity-25k,2025-04-24T10:19:54,1
But the exchange is not what the result would be if there was no employer-sponsored insurance at all. It would be incomparable.,ObviousExit9,2025-04-23T15:49:30,16
Then you have a very bad employer or a small employer. Large employees usually provide health insurance plans that are far cheaper than the exchange.,barchueetadonai,2025-04-23T15:25:55,9
"> We did that. I’ve shopped prices on the exchanges  Oh, you ""shopped prices"", did you? Call me when you actually switch to it baby!  > that’s arguably money that would be paid to you anyway if it wasn’t going to an insurer  First of all that money would be immediately taxed so you would lose thousands even if you could arrange it. Secondly, in what world can you get your employer to redirect the insurance premiums to your paycheck?",pgriss,2025-04-24T09:25:43,1
Are you saying Germany does not have a functioning system?,gman2093,2025-04-23T19:12:50,2
"I think it's an open question whether or not it is subsidized, but the US is the lions share of the global revenue for pharma companies. That is true. I am not qualified to answer whether the US getting costs under control would increase the prices of other countries (Pharma marketing costs do not seem that useful to me so maybe they could reduce those expenditures). I tend to believe there's cost savings to be made in pharma and that it makes no sense for pharma to roll over for smaller poorer countries while playing hardball with the US. Even if the US is subsidizing others, I think it would be reasonable for the true cost of medication to be covered by all countries and not just the US. When you spread the cost of something over the whole planet, the increased cost is shared among more people, so instead of Americans paying $500 for insulin and Europeans paying $10, maybe everyone pays $15 (assuming that is happening, which I am unqualified to answer)",StrategistEU,2025-04-23T14:17:22,10
This is cope.  Every market operates at a profit - the US market is just *obscenely* profitable by comparison.  Any market which is legitimately unprofitable unto itself is simply unserved.,candre23,2025-04-23T14:31:09,7
"Not the person you’re responding to but:  > While it would be an improvement to cut out the 10-15% of their total revenue out of the system, the bigger problem seems to be the cost of healthcare in our country. Maybe you are right that a single payer would be able to negotiate those costs down more than a for profit company that is also making a percentage off the top, but it would seem to me that the focus should be more on limiting the profits made by healthcare providers (especially the pharmaceutical and medical device companies who are making much higher profit margins than any insurers)  Limiting the percent of profit was a driver in increasing costs. A company may see a 20% cap on the percentage as hindering profits, but companies quickly saw that they could increase costs from $100/service ($20 profit=20%) to $400/service ($80 profit still equals 20%).   A universal system that negotiates lower prices like all developed nations do is currently the most successful path to limiting costs.",none74238,2025-04-24T05:17:19,1
The fact that insurance company profits are ostensibly capped shouldn't be construed to mean they are only a small part of the problem. Insurance companies will gate access to needed care by making patients go through a sequence of treatments which they may not want or need in order to get the care they do need. This raises the overall cost of care while simultaneously resulting in worse outcomes for patients.,VitaAurelia,2025-04-23T17:00:54,3
"I'm not necessarily advocating for single payer healthcare (although that would bring some considerable benefits). the US government can use its existing market power and ability to approve or ban medication to negotiate lower drug prices and then have private insurances pay for those prices. At the moment we have a pretty substantial difference between the cost to produce and the cost to buy and with stronger leverage, the prices would likely get negotiated down. If you control access to 300 million customers, drug companies are gonna want to play ball to get access to your market, compared to each private insurance with a much smaller customer base negotiating separately. The government doesn't have to necessarily pay for the care to still act as a brake on prices. Private insurance and government negotiation of drug and medical device costs can coexist and have already been used (Insulin prices were capped at $35 due to medicare demanding lower prices from companies).",StrategistEU,2025-04-23T17:40:08,0
"I admittedly simplified away insurers such as TK (gesetzliche Krankenkasse) who, to my admittedly limited knowledge, are largely self financed. I think for an American context it would be misleading to call what Germany has public health insurance, but rather a hybrid model, which is what I'm proposing the US should at least try to move towards. My understanding is that public health insurance is conducted through intermediaries who act as quasi private entities who finance themselves (with some financial support from the state).   I felt it was more accurate to call those private non-profits than to call that a public insurance as i felt it would be misleading in an American context otherwise. But you are correct, they are technically public insurances.",StrategistEU,2025-04-23T19:51:09,2
Something like 60% of employees of hospitals don’t have anything to do with medicine or impact patient care. It’s an astronomical amount of waste,ItsAGoodDay,2025-04-24T07:31:44,1
"There's a broader argument about keeping full employment that captures political discussions in America. Making a bunch of people unemployed is seen as worse than saving money, for some reason. For the record, I don't like this framing or agree with it.   When I argue, I try to address the points directly (even if I think the other person is acting in bad faith)/ It just makes things easier and if your argument is good, the audience will be more convinced, I feel.",Dmagnum,2025-04-23T14:20:06,3
"> It's literally insane that switching to a single payer system could save us 2 million jobs' worth of money and this is considered a counter-argument.  If a loss of 2 million jobs is a counter argument against M4A, then consider that the American Recovery and Reinvestment Act of 2009 created 2.3 jobs in 2010. Leadership knows how to stimulate significant job growth.",none74238,2025-04-24T05:30:22,1
Medicare wouldn’t just replace those jobs because it’s replacing several competing bureaucracies with just one. Numerous positions would be redundant.,Kronzypantz,2025-04-23T14:19:44,2
"I think they estimated it would save about $400 billion in admin spending, specifically. [https://www.healthaffairs.org/content/forefront/congressional-budget-office-scores-medicare-for-all-universal-coverage-less-spending](https://www.healthaffairs.org/content/forefront/congressional-budget-office-scores-medicare-for-all-universal-coverage-less-spending)",Dmagnum,2025-04-23T14:23:19,2
"Every single care provider - from hospitals down to single-doctor practices - has to keep at least one person on staff whose only job is to deal with the kafkaesque nightmare of insurance bureaucracy.  At a big hospital, there could be dozens of such people.  Knock it down to a single standardized system, and all those jobs could be instantly eliminated.",candre23,2025-04-23T14:39:05,0
It can be a blend.,AncienTleeOnez,2025-04-23T16:22:07,2
