Comment,Author,Date,Score"Nationalized, ideally. I want any person in the country to be able to walk into a clinic and receive healthcare at no cost.",GrandMasterPuba,2025-04-23T15:31:22,1
"Nationalized, or effectively so.  Whether it's a government agency or technically an independent organization, there needs to be a single entity that is in charge of setting fees, collecting payroll pay-ins, and doing the paperwork.  Whether health care providers and drug makers are federal or private, the rules determining what care they must provide and what they are allowed to charge for it is so tightly controlled at the national level that it's an irrelevant distinction.",candre23,2025-04-23T15:50:40,0
"What, you want me to pull numbers out of my ass?  Hard numbers to be determined by experts based on real data.",candre23,2025-04-24T11:41:48,1
"Pretty complicated for my Canadian brain eh.  Here it's really simple.....  Everyone in the entire country has free Healthcare.   You get a card the same size as your drivers license and that's it.  No copay, No deposits, no deductibles.  No lifetime limits, no pre-existing anything.  But you need to pay for parking at the hospital.",RL203,2025-04-24T13:13:31,1
"I didn't say that.  Could make it opt in. Everyone pays X rate but if you want you can opt in for a discount or some type of program that pays you back. Don't want your health data monitored, don't opt in.  Could make it separate and funded by the government as some bonus program. Don't want to do it, you don't have to.  There's many ways this could be implemented that don't even have to tie back to your personal data, and they only have what you give them.  Not sure where you got that I said we should have more monitoring by the government. Heck if you were serious, you'd argue that's a general issue with government healthcare. Someone has your health data, be it insurance, private practices, or government healthcare.",OhWhatsHisName,2025-04-23T15:50:38,1
My source is that healthcare was cheap before insurance got involved. Look up the chargemaster and why it exists.,Confusedgmr,2025-04-24T13:02:27,1
"Does plenty of the world have an insurance plan because it's a good idea, or does a lot of the world have insurance because a bunch of parasites convinced everyone that giving them their money was a good idea?   Perhaps, being an American myself, I've just become jaded with the idea.",Confusedgmr,2025-04-24T13:49:45,1
"> I think preventive care and lifestyle changes should be incentivised through fed/state/local grants and tax breaks.   .  >Two-thirds of hospital ER visits are avoidable visits from privately insured individuals  * research of 27 million ER Patients – 18 million were avoidable.  * An avoidable hospital ED visit is a trip to the emergency room that is primary care treatable – and not an actual emergency. The most common are bronchitis, cough, dizziness, f­lu, headache, low back pain, nausea, sore throat, strep throat and upper respiratory infection.  139 Million Visits were made to the ER in the US	|	weighted % (95% CI)	|	Number of Visits ---	|	------	|	----- Level 1 (resuscitation) requires immediate, life-saving intervention and includes patients with cardiopulmonary arrest, major trauma, severe respiratory distress, and seizures.	|	0.8 (0.6–1.1)	|	1,112,000 Level 2 (emergent) requires an immediate nursing assessment and rapid treatment and includes patients who are in a high-risk situation, are confused, lethargic, or disoriented, or have severe pain or distress, including patients with stroke, head injuries, asthma, and sexual-assault injuries.	|	9.9 (8.7–11.3)	|	13,761,000 Level 3 (urgent) includes patients who need quick attention but can wait as long as 30 minutes for assessment and treatment and includes **patients with signs of infection, mild respiratory distress, or moderate pain**.	|	35.9 (32.6–39.2)	|	49,901,000 Level 4 (Less urgent)  require evaluation and treatment, but time is not a critical factor.	|	20.3 (18.3–22.4)	|	28,217,000 Level 5 (non urgent) have minor symptoms or need a prescription renewal.	|	3.0 (2.5–3.6)	|	4,170,000 Not Listed	|	30.2 (24.4–36.6)	|	41,978,000  So how do you change that?  privately insured individuals use the ER instead of a doctors office or even an urgent care",semideclared,2025-04-24T15:48:11,1
"yep... all of that. because none of it exists in a vacuum.  you got hospitals milking the system, pharma pricing like it’s a hostage negotiation, and insurance companies playing gatekeeper with your life. meanwhile the super spenders are torching billions while half the country can’t even afford a blood test. the whole machine’s bloated and bleeding... but somehow, everyone’s pointing fingers instead of killing the actual parasite.  and yeah ...cutting spending at the top *should* help. but it won’t matter unless the entire incentive structure flips. right now? staying sick is profitable. staying healthy is not. and all those “cutting-edge” treatments that bankrupt people? they’re not the problem ....they’re the symptom of a cartel system where innovation = jackpot for shareholders and death sentence for the uninsured.  you want to fix healthcare? make wellness the business model, not sickness. reward health, not procedures. smash price secrecy. ban backroom deals. and for once, let medicine serve people instead of dragging them through a gauntlet of corporate extortion with a stethoscope on.  you can’t tweak this into working. you gut it. you burn the rot. or it keeps dragging us down while the elites sip $30,000 chemo cocktails.",Famous-Garlic3838,2025-04-24T16:25:00,1
Wasn’t aware of that. Everything I’ve gone in for has been treated. Haven’t charged me. Probably should have.  I could pay.  But they didn’t.,mcgunner1966,2025-04-23T19:00:19,0
"It's not enough to just figure you'll take the existing system and remove all the current insurance companies and insert the states into the place of the insurance companies.  You need to completely rethink how the entire system works (and this is where it gets tricky.)  No more doctors making 5 million bucks a year.  No more 200 dollars for a couple of Tylenols.  All prices need to be regulated.  Doctors who were making 5 million a year will now find themselves making 600 grand a year.   It's the same across the board.  Only then would you find that health care costs were manageable.  Oh, and then your taxes will need to go up too.    There's no such thing as free lunch.",RL203,2025-04-23T15:03:37,1
"So all the people who hold some of these stocks in their 401K’s are just out of luck? And I beg to disagree, it’s both hard and complicated and will likely never happen.",flat6NA,2025-04-23T17:33:16,0
"We have the best lots of things if you decide to cherry pick it that way.   If you're judging the general state of a healthcare system, though, I don't believe the tradeoff for innovations and care that applies to hundreds or thousands offsets a complete lack of access to preventative care, bankruptcy inducing cost of treatment, and death from lack of access for millions.   I understand you proactively qualified that counter argument but the sheer existence of the phrase ""best healthcare in the world"" makes it a nonstarter.  I also think you're forgetting that the sheer size of us, and the scope of our trajectory as a hegemon, naturally means we're going to get more innovation and accolades. It's the same reason the major countries have absurdly high Olympic medal counts.  You also have no real tangible evidence that innovation was directly, primarily, and/or exclusively driven by a for profit financial model. Further, you'd have to assume that there's no suitable replacement for that driving force if it was the case, such as investing in more research and increasing access to education, which the US is also horrendous at doing (the EU gets shade too, btw, they've let their health systems suffer from underinvestment as well).  Throwing the baby out with the bathwater is ACTUALLY not getting citizens treatment out of fear of interrupting the broad concept of innovation, which in this case is not defined, quantified, or in any way actually proven to be causational in the first place. Sort of like how every fiscally conservative rhetoric frontruns something with direct, immediate, measurable impact and proof of concept with ""what about what it does to the market as per outdated economic philosophy"".  Side points for your less core arguments: Rationing over triage is a fun little word game to play, you solve it with proper investment in your workforce though.  Waitlists are a hilarious argument, as if that's worse than no access at all, and as if specialists for those with means aren't equally inaccessible for many Americans anyway. Again, this is an intertwined, but also independent issue of workforce availability (but it's actually exacerbated by forcing in network treatment).",SantaClausDid911,2025-04-24T16:19:29,1
"> It’s not that simple  It can and should be that simple.  The government provides health care to all citizens for free.  It tallies up what this costs and divvies up that cost between everybody, using a progressive payroll tax.  It's not hard.  It's not complicated.  It's perfectly fair and extremely doable.  Any claim to the contrary is objectively false.",candre23,2025-04-24T11:12:24,1
"> the US has the best healthcare in the world IF you look at the absolute top care... not at all saying it’s available to the general population  I don't care for stuff I couldn't possibly afford. All I want is reasonably competent care that won't bankrupt me or drive me into poverty.   As for research, US does well, other countries do some of it too. Fleming, Pasteur, Semmelweis... were not American. Huge piles of money going to insurance company profits and overhead does not help research.",I-Here-555,2025-04-24T11:53:55,1
> but the care and innovation that takes place at that op level is a function of the system we have.   You're saying there are no single payer healthcare countries that make innovations in healthcare?,IniNew,2025-04-24T07:41:51,1
"In case you don't pay taxes (and have no insurance either), then yes, paying taxes would be an extra step. Otherwise, no, it's fewer steps, fewer things that could go wrong.   Moreover, it's not some odd fantasy, many countries have it this way.",I-Here-555,2025-04-24T11:44:40,1
Cheaper *to you*. How much do you think your employer is paying?,Eric848448,2025-04-23T15:46:40,7
No. They do.  Many do and are similar to each other.  Only the UK and Canada have fully government run systems.,bjdevar25,2025-04-23T19:16:17,4
"> Americans paying $500 for insulin and Europeans paying $10  The actual cost to make that insulin is $3.  The EU is turning a profit unto itself, so the US is not ""subsidizing"" the EU.  The company is simply overcharging the US because the US allows it, and what are Americans going to do, not take their insulin and die?",candre23,2025-04-23T14:34:37,11
"No, we absolutely subsidize other countries’ pharmaceutical prices, not least because most of the funding for the underlying basic research came from the US. You can tell we subsidize drug prices [because name brand meds are way cheaper abroad, but generics (which can be produced locally) are actually slightly more expensive.](https://aspe.hhs.gov/sites/default/files/documents/8e057b0a094e6f9b9d01171fce6698f4/international-price-comparisons.pdf)",Polyodontus,2025-04-23T15:24:59,10
"> the US market is just obscenely profitable by comparison.  What are you referring to here, specifically?  Profit margins in most of these areas are very narrow.",ClockOfTheLongNow,2025-04-23T16:18:55,-1
">universal system that negotiates lower prices like all developed nations do is currently the most successful path to limiting costs.  Why? How much?  The US is expensive  New Amsterdam (Hospital) the American medical drama television series, based on the Hospital in real Life known as Bellevue Hospital, owned by NEW YORK CITY HEALTH AND HOSPITALS CORPORATION   A Component Unit of The City of New York  >As the largest municipal health care system in the United States, NYC Health + Hospitals delivers high-quality health care services to all New Yorkers with compassion, dignity, and respect. Our mission is to serve everyone without exception and regardless of ability to pay, gender identity, or immigration status. The system is an anchor institution for the ever-changing communities we serve, providing hospital and trauma care, neighborhood health centers, and skilled nursing facilities and community care  NYC Health + Hospitals operates 11 Acute Care Hospitals, 50+Community Health Centers, 5 Skilled Nursing Facilities and 1 Long-Term Acute Care Hospital  **NYC Health + Hospitals received more Revenue from the Dept of Corrections than Commercial Insurance**  ----- Bellevue Hospital is the oldest hospital in the country, 287 years old.   * It is also arguably the most famous public hospital in the United States.   * The first maternity ward,  * first pediatric ward,  * first C-section — Bellevue is full of firsts.   Its public sanitation programs date back to the Civil War.   Yellow fever, tuberculosis, typhoid, and polio epidemics were brought under control here.   Famous for psychiatry, Bellevue also pioneered child psychiatry with the first inpatient unit complete with a public school for children.   Two Bellevue physicians won the Nobel Prize for heart catheterization.    * The first cardiac pacemaker was developed at Bellevue.   So was the early treatment of drug addiction.   >We are known for many things, in particular our emergency room.   * If a cop gets shot in Manhattan, his first choice is often Bellevue.  * If a diplomat gets attacked at the UN, he gets taken to Bellevue.  * If an investment banker goes into cardiac arrest, his limo driver knows to take him to Bellevue.   **But, just 1.2 Million,** of the more than 8 Million New Yorkers use H+H   And go ask a NYC Sub for their opinion on H+H for a even worse opinion of it  H+H has a per person cost of $9,500 and is underfunded",semideclared,2025-04-24T15:24:46,1
Yeah I don't know that that's accurate. Insurance company's have no incentive to push for higher cost procedures because their revenue is the same regardless of the claims that they pay out. They can't just increase premiums to make up for it because those are subject to regulations as well (and they need to be as low as possible to remain competitive),Dark_Twisted_Fantasy,2025-04-24T15:35:32,1
This might be a good read  [https://www.sweeneylawfirm.com/content/unnecessary-surgeries](https://www.sweeneylawfirm.com/content/unnecessary-surgeries)  [https://healthjournalism.org/blog/2024/11/worthless-back-surgeries-are-a-nagging-pain-for-u-s-health-care/](https://healthjournalism.org/blog/2024/11/worthless-back-surgeries-are-a-nagging-pain-for-u-s-health-care/)  There's a reason insurance companies make you do therapy before back surgery.   And this is just unnecessary surgeries.  [https://www.hcinnovationgroup.com/home/blog/13018116/whats-the-most-expensive-technology-the-doctors-pen](https://www.hcinnovationgroup.com/home/blog/13018116/whats-the-most-expensive-technology-the-doctors-pen)  Many doctors will immediately go for the most expensive treatment. That hundred thousand dollar drug or million dollar miracle treatment with a 0.1% chance of working in a 100 yr old person.  Premiums would be through the roof if insurance companies didnt find some way to control these things.,RevolutionaryGur4419,2025-04-23T22:16:01,4
"There’s no question that insurance companies contribute to major issues with our healthcare system. All I’m saying is that eliminating their profits doesn’t solve all of our problems. As long as healthcare providers are still incentivized to maximize profits, insurers will have to implement whatever cost saving measures that they can to pay out their obligations. Making them non-profit doesn’t mean they won’t still deny claims and route policyholders to lower cost procedures.",Dark_Twisted_Fantasy,2025-04-23T17:39:03,2
"No, the issue is to close hospitals  * Is that something mericans will accept  [Canada, Australia, and the US](https://i.redd.it/o9uqxbofw08e1.png)  [as Numbers](https://i.redd.it/szxursd2y08e1.png)  **We spend a lot of money at Hopitals and Doctors Offices** and that has to be cut out  $1.36 Trillion was Spent Hospital at 6,100 hospitals currently operating in 2022. $4,030 per person   * Reducing costs 40% - $2,418 per person   * Hospitals Adjusted to the US its $650 Billion Cheaper  ------ Lets look at Russell County Virginia had 25,550 People in 2021  * $4,030 per Person  * $102,966,500 Operating Revenue  It cost about $1 - $1.5 per Hospital Bed to operate a Hospital (1.25, right down the middle)  Or   83 Beds, looks like Russell County Hospital is a little expensive  * Russell County Hospital is a not-for-profit, 78-bed hospital operating today  ------ Under Government Funding to lowering Costs Russell County, VA gets   * $2,418 Per Person Hospital Expenses in the US  * $61,779,000 Operating Revenue  Admin Savings under any Single Payer Plan would save 5 Percent of Costs, So, now It cost about $1.135 Million per Hospital Bed to operate a Hospital  Russell County VA can have a 54 Bed Hospital  Russell County Hospital is a not-for-profit, 78-bed hospital operating today  So thats not good  But of course most of that savings ~15% is Staff Cuts, layoffs in Nursing  ----- Now do that same thing to your Doctors office  Jut saved $1 Trillion and got the US closer to the rest of the World  Want to close hospitals and doctors offices?",semideclared,2025-04-24T10:24:22,1
"> the US government can use its existing market power and ability to approve or ban medication to negotiate lower drug prices   Yes they could and they don't.  The US doesn't and needs to say no to some medication  >When NICE assesses new drugs for NHS approval, they focus on the Incremental Cost-Effectiveness Ratio (ICER), or cost per Quality-Adjusted Life Year (QALY) gained, typically considering treatments costing between £20,000 and £30,000 per QALY to be good value  --------  IRL  In 1991, Nelene Fox, a 38-year-old mother of three, was diagnosed with breast cancer. She underwent bilateral mastectomies and chemotherapy but nonetheless developed bony metastases. Her physicians said her only chance for survival was high-dose chemotherapy and autologous bone marrow transplantation. A costly new kind of therapy that involves the harvest and retransplant of her own bone marrow–high-wire medicine occupying what one of her physicians calls “the twilight zone between promising and unproven treatments.""  Doctors say 5% or more die from the treatment itself  * Her Health Maintenance Organization (HMO) refused to cover the procedure (around $140,000 - $220,000) on the basis that it was experimental.  Her husband launched a successful fundraising effort raising the $220,000, and Mrs Fox received the procedure, but died eight months later.  >“The bone marrow transplant issue gets at part of the crux of the health-care crisis,” said Dr. James Gajewski, a member of the UCLA Medical Center bone marrow transplant team. “What do you do with patients with a terminal disease who may have a chance of cure” with therapy that’s inconclusive? he asked. “How do you pay for it?”  However, as clinical trial results rolled in, the story began to unravel.  * An early positive report from researchers in South Africa proved to be fraudulent. * National Institutes of Health (NIH)-sponsored trials, long delayed, finally showed the new treatment to be **no more effective than standard chemotherapy, but more toxic**.  By The time the negative results became available, 42,000 women in the US had been treated at a cost of $3.4 billion.    >At the moment we have a pretty substantial difference between the cost to produce and the cost to buy   TL;Dr  * For $50 Million, The California CalRx Biosimilar Insulin Initiative bought the Naming Rights to Civica's US made Affordable Generic Insulin to be sold at about the same price as Insulin at Walmart Nationwide  In the FY2022 State Budget The Department of Health Care Access and Information (HCAI) requests one-time $100 million General Fund, available until 2025-26, for the CalRx Biosimilar Insulin initiative.   **January 2020**, Governor Newsom announced a first-in-the-nation plan to lower the cost of prescription drugs by creating Cal Rx – a state-sponsored generic drug label  **September 2020**, Gavin Newsom signed SB 852, a law enabling California to become the first state to produce its own generic prescription drugs  **In March 2021**, the state announced $100 Million in Funding   **In March 2022**, Civica Inc. has announced construction of its new state-of-the-art 140,000 square-foot manufacturing plant in Petersburg. The facility will manufacture and distribute insulins to its hospital partners across the United States.   * Scheduled for completion in early 2024.   * Thanks to “Bold philanthropic partners have made it possible, with committed funds to date of over two-thirds of our $125M goal, for us to undertake this affordable insulin initiative,”    **In Mar 2023** California signed a contract with Civica Rx providing $50 Million in Funding.   **At the Same time** Civica has entered into co-development and commercial agreement with GeneSys Biologics for these three insulin biosimilars.   **In April 2023**, Civica announced that the suggested retail price for a 10mL vial of insulin will be no more than $30  * Pending approval from the US Food and Drug Administration, the contract announced  CalRx (or Golden Bear) insulin products are expected to be available in pharmacies to all California residents, without eligibility or insurance requirements by 2024.   In 2024 CalRx (or Golden Bear) annouced  insulin products  are still at least another year before California citizens begin seeing the low-cost alternatives hit shelves.  And, again in January 2025, Allan Coukell, chief government affairs officer at Civica, said manufacturing has begun at the company’s new pharmaceutical plant in Virginia but there is no timeline for when the first insulin — a generic for glargine — will be available on the market.  ----- Orginally there was a plan in 2026 or later that California has $50 Million for construction of a California-based manufacturing facility in partnership to Civica’s Petersburg, Virginia plant, but Civica said that’s “not something that’s been started at this point.”  Newsom spokesperson Elana Ross refused to answer CalMatters’ questions about the state’s plans to develop a manufacturing plant in California.  -------  And the most important part, its not that much of the problem  * 30% of all Medicare expenditures ($300 Billion) are attributed to the 5% of beneficiaries that die each year (3.4 Million Enrollees), with 1/3 of that cost occurring in the last month of life ($100 Billion)  * ~$88,235 per person     * $29,333 in Spending for the Last month of their life   The US does not put a limit on spending and for most medical issues costs is not questioned.  As Above this is not healthcare in the rest of the world  * Should the US Federal Government Medicare tell Grandma no more care?  ----- [Canada, Australia, and the US](https://i.redd.it/o9uqxbofw08e1.png)  [as Numbers](https://i.redd.it/szxursd2y08e1.png)  **We spend a lot of money at Hopitals and Doctors Offices** and that has to be cut out  $1.36 Trillion was Spent Hospital at 6,100 hospitals currently operating in 2022. $4,030 per person   * Reducing costs 40% - $2,418 per person * Hospitals Adjusted to the US its $650 Billion Cheaper  Means closing hospitals",semideclared,2025-04-24T10:42:24,1
"Although the Krankenkassen that administer the actual insurance plans operate as independent non-profits, they are funded by the statutory payroll tax and have most of their rules and coverages mandated by the government, and I think would be generally understood to be a form of public insurance in the American context too based on that",nope_nic_tesla,2025-04-23T21:06:55,3
