Comment,Author,Date,Score
"[A reminder for everyone](https://www.reddit.com/r/PoliticalDiscussion/comments/4479er/rules_explanations_and_reminders/). This is a subreddit for genuine discussion:  * Please keep it civil. Report rulebreaking comments for moderator review. * Don't post low effort comments like joke threads, memes, slogans, or links without context. * Help prevent this subreddit from becoming an echo chamber. Please don't downvote comments with which you disagree.  Violators will be fed to the bear.  ---  *I am a bot, and this action was performed automatically. Please [contact the moderators of this subreddit](/message/compose/?to=/r/PoliticalDiscussion) if you have any questions or concerns.*",AutoModerator,2025-04-23T13:54:20,1
"One no-brainer goal should be to completely disconnect jobs from health insurance. This wouldn't solve everything, but would address at least one aspect of the complete insanity and should be relatively easy to achieve.",pgriss,2025-04-23T14:15:53,140
"I think the most workable solution, at least in the short term here in the US. Is to copy parts of the German system. In Germany, private insurance companies do exist, but they are by law non-profit. The Federal government in Germany also sets medication prices by negotiating with drugmakers directly on behalf of the whole nation. This gives them far more leverage with regards to drug prices. I would also create a national healthcare database system (in Germany we have an insurance hard that the doctor scans to get our medical history and insurance info) and make it so every provider takes every insurance, rather than negotiating with each hospital individually.  I think another knock-on effect is you'd need to lower the costs of medical school and lower the barrier to entry (such as strict quotas for doctors) so we can get more qualified doctors out and not restrict supply. US doctors are paid a lot more than their foreign counterparts, in part because they have to be to cover the massive debt they're put in. I think if we do away with the debt problem, wages wouldn't have to be so high (controversial). Doctors do super important work, but they are pricey and that can limit access in poorer communities (I'm open to the idea of other incentives to keep doctors operating rurally).  While a nationally run healthcare system may be desirable, it would be incredibly difficult to sustain the current revenues of each sector of the system. The healthcare system isn't just greedy insurance, it's profit seeking behavior at every step of the way, from insurance to drugmakers to hospitals. I don't  blame them, but to have the state take over that would be ... an immense and expensive undertaking. Transitioning slowly into a non-profit system with government playing an active role in price negotiations would be a good start towards removing barriers.  I think national healthcare is probably not a good idea for the US in particular, opinions are too diverse at the moment. I think if the state wants to play an active role in healthcare insurance (which I think there's a reasonable argument for) it would be best managed at the state level.     Edit: Thanks to Nope\_nic\_tesla for some additional context:   The non-profit private entities I refer to are more strongly connected to the state than the term suggests, please see their comment for additional context:   ""Although the Krankenkassen that administer the actual insurance plans operate as independent non-profits, they are funded by the statutory payroll tax and have most of their rules and coverages mandated by the government, and I think would be generally understood to be a form of public insurance in the American context too based on that""",StrategistEU,2025-04-23T14:04:39,64
"I thought the Medicare For All plan from 2020 was a good idea in terms of eliminating waste, lowering costs, and expanding access. The main arguments against it seemed to be that it's either a bad idea to eliminate so many jobs (which implies the waste is necessary) or that it's politically unfeasible (but we've seen some fairly unfeasible things happen recently).  Edit: Second point should be ""arguments against it (M4A)"". I was trying to explain the counterpoints - which I disagree with.",Dmagnum,2025-04-23T14:01:06,18
"A system where if you’ve paid into it your whole life they can’t deny you healthcare no matter what. That’s the biggest flaw in American healthcare, the insurance companies are incredibly corrupt and evil.",Jen0BIous,2025-04-23T14:08:26,6
"Nationalized healthcare for all.  Trivial out-of-pocket costs, waived for those who can't afford it.   The cost to provide comprehensive healthcare to all Americans is paid for via a progressive payroll tax, with employers contributing a portion, and no income cap.  Procedure and drug prices are dictated at the federal level so as to keep costs manageable and prevent profiteering. Easy-peasy.",candre23,2025-04-23T14:19:29,11
"As a caveat, I'm Canadian but I did live and work in the US around the turn of the millennium. Since then I've been elsewhere but primarily in Canada, where the HC isn't ideal but is better by most metrics.  The best systems I've seen are in East Asia. Results based and technocratically run, most of the good ones coming from relatively (relative to us) autocratic states (Singapore, China, Japan, Korea). The common theme is central control, science-based and universality.",NorthernerWuwu,2025-04-23T23:42:20,1
The Medicare for America bill seemed like the most logical but didn’t get much attention because it wasn’t Medicare for All.,159_throwaway,2025-04-23T13:59:56,5
"I'm Canadian.  We have universal health care.  It's not easy and it's not perfect, but I can assure you that you'll find that 85 percent of Canadians would never want to adopt private primary care health care coverage.  I'm a small C conservative, which is pretty much akin to a Democrat in the USA.   I'd never want a US style health care system.  Take that for what it's worth.",RL203,2025-04-23T15:09:33,6
"I actually get discouraged by this because the costs of healthcare are so high and so really are the standards of what we expect.  We think a lot about the solutions for patients.  What is the solution for cheaper production?  For salaries, malpractice insurance?  Operation costs?  I’d like to see healthcare universally available by whatever ethical means.  But just the government or whoever saying “Make it available” doesn’t address the factors that are making it hard to access.  How do we bring costs down?  The government would have to do it somehow if we implemented universal healthcare.  More of a question in response to a question than an answer.",No-Average-5314,2025-04-23T15:20:28,2
"People who need it, get it. People who abuse it go to the back of the line. I can’t tell you how many times I’ve seen ER resources wasted on PCP or even virtual care appropriate patients. It delays treatment for serious issues.",ResidentLazyCat,2025-04-23T15:52:30,2
I would say the perfect healthcare plan would be what our politicians have that we taxpayers pay for.,Adorable-Anxiety6912,2025-04-23T19:25:45,2
"I want to go into a clinic at CVS, or WalMart, Tell them where it hurts, Get it fixed, Pay $20, and go on my way. No long waits, no insurance to deal with. If its something serious, they send you to a specialist or the hospital.  They should deal with all regular stuff. Dialysis isn't covered, or organ transplants, or sex changes, or cosmetic stuff.If you want that covered, get insurance, or pay it yourself, or do a go fund me.",Iconiclastical,2025-04-24T15:05:53,1
"National single payer opt-in for all that offers reasonable normal coverage with a massive pool of people so it has much power to negotiate fair pricing. Remove the massive inefficiencies of denying and fighting every claim, profit, admin expense, etc. If you want to pay for ultra-premium insurance, go for it.",cbarrister,2025-04-23T14:35:33,3
"Due to the current state of the US system, universal healthcare is unrealistic. However, it would be more optimal. The US spends around $13,432 per person a year on healthcare, compared to Britain spending $6,023. Despite this, the UK has a greater life expectancy of 2 years. Yes this is also partly due to food standards and average exercise habits, but healthcare is also a part of it. I believe the ideal system is universal healthcare, with the option of private. I also don’t buy the idea of people abusing healthcare particularly. People are deliberately injuring themselves/getting sick just to abuse free healthcare?! And for every hypochondriac, there is someone who never gets ill or refuses to admit when they are. Also, not feeling stress when you get ill/injured because you don’t fear the bill is almost invaluable.",MiddleAndLeg_,2025-04-23T15:59:00,5
"To me, an ideal healthcare system is:  1. Not tied to employment. Everyone should just have it.  2. Healthcare covered?? Like I shouldn’t have to decide if I need to die or go into debt forever  3. No profit healthcare, ever. Everything should be non-profit.  4. Medicine price should be just about the price it costs to make it.  This is just a basic, but ultimately, our system is so broken.",ShapeDifficult6094,2025-04-23T14:31:27,3
"Our system is so stupidly broken, and while I'm not going to praise our system (as I hate it), there are some things that I think can be done on top of some form of nationalized system to promote health even more.  My company offers a premium discount plus money towards gift cards for getting points in an app that are based around health. You get points for steps or activity, tracking sleep and getting good sleep, improving cholesterol over time, etc etc.   I don't know if that could be implemented if the government was involved, but having something that also promoted healthy activity does of course have benefits to it.   Essentially my company offers lower insurance rates and cash bonus for people who do healthy things.... Most likely because they pay out less to those people.   I don't know if it would be constitutional for the government to offer some type of bonus or discount for people who didn't smoke, were more active, worked towards making themselves healthier, etc., but the benefit is those people most likely have fewer health problems.",OhWhatsHisName,2025-04-23T14:52:58,2
"There is a very easy solution to the healthcare problem that many might consider a hot take. First, make health insurance illegal. Insurance companies are the only reason healthcare is expensive to begin with. After that is taken care of, make healthcare free at the cost of slightly higher taxes.  Greedy bastards get the boot, and everyone can afford healthcare. It's a win-win.",Confusedgmr,2025-04-24T03:30:27,1
"Health insurance should be like car insurance. If you never/rarely use it and are in good physical health via a screening then you have a much lower rate than a person who doesn't live a healthy lifestyle, that regularly goes to the doctor for anything or wastes ED resources. It drives me absolutely insane that I have been to an urgent care TWICE in my entire adult life, over 40 years yet I still pay a substantial rate, almost $500 per month with laughable coverage.",l1qq,2025-04-23T14:23:09,3
Getting rid of payment codes. They overcharge everything single thing in relation to healthcare. One thing Mexico does right and why a lot of Americans have gotten healthcare from them.,demihope,2025-04-23T19:42:54,1
"There is a saying that you have cheap, fast and high quality but you can only get two out of the three. Countries with universal healthcare get cheap and high quality but in a lot of cases it's excrutingly slow to get care.   The US as rich as it is chose fast and high quality but it's expensive and doesn't cover everyone. We have been inching towards more universal coverage  and trying to make things cheaper but it's slow. The Affordable Care Act was a big step forward and we will need to add to things incrementally like it as wholesale changes won't happen politically and logistically. The way people get care is deeply engrained and changing any aspect of it negatively will have big consequences that will undermine the effort.   The next big step doesn't have to be huge structural changes. It could just be a cultural change from the medical community to emphasize preventive care and lifestyle changes. The medical community is too reactive in how they diagnose things and mostly handwave prescriptive advice to just working out and eating right. Well when you're not specific nobody is actually going to do that. This may go into the whole longevity community spiel but western medicine has too long been stuck in treating things when it's too late. If we focus on giving pathways for higher quality of life it will also lead to better outcomes and overall cheaper care altogether.",Temporary__Existence,2025-04-23T23:51:04,1
"I compared and contrasted a bunch of countries, I think Germany's system is best suited for the US. The public healthcare system requires so that insurers are non-profit, and highly regulated. That to me seems like the best way to approach it in the US. Instead of relying on the government to build a broad bureaucracy infrastructure that likely wouldn't address all the geographical realities, just start tightly regulating insurers and remove profit-incentives until costs go down. Also devolving these policies and leaving it to the states so that they can better regulate realities closer to the ground.",illegalmorality,2025-04-24T01:52:08,1
Any workable solution also massively improves pay for first responders and other EMS. In some cases their compensation has *declined* since the 2000s despite ever growing need.,Paradox621,2025-04-24T08:52:44,1
"An ideal healthcare system is one where everyone is covered and receives high-quality health care, quickly, and without co-payments. There would be a system of collective bargaining in place to ensure that prices are kept to near cost.   The system I am most familiar with is Germany's and I would say they are quite close to what I outlined. For some specialists the wait times for appointment are too long (especially Psychologists), but otherwise they are doing very well. Worlds better than the US in any case.",westoast,2025-04-24T09:11:58,1
"Capitiation reinsurance. You pay an annual fee to your doctor who gets capitation reinsurance to cover overruns. My gramps paid his cousin the town doctor a goat every year to take care of his family of ten.   Social savings accounts should replace entitlements (retirement, health, education, housing).  As Enron, Bear Stearns, GM and Chrysler pensions vanished, these should be jointly monitored by individual, employer and government.  As major transactions are delayable and deliberate and tax assessors never mark to market, it is better to use indifference prices than marking to market. When an individual has fulifilled obligations to social savings, may be considered ""accredited"" investor",vasjpan002,2025-04-24T10:17:18,1
"My ideal form of healthcare would be one where getting sick doesn't bankrupt people and everyone can get the healthcare they need regardless of their ability to pay.  It is worth noting that ""leaving healthcare to the private sector"" is mostly what we do today in the U.S., and it clearly isn't working for a lot of people. People might be inclined to blame Obamacare or something, but the healthcare system was spiraling the drain long before Obamacare was implemented but that really only slowed the swirl a little bit and the problems with our system continued to get worse.",almightywhacko,2025-04-24T11:08:03,1
"alright ....if we actually want to fix healthcare in this country, it starts by tearing out the rot at the foundation. the current system isn’t broken because of a lack of innovation or good doctors. it’s broken because it's designed to prioritize profits over people, with insurance companies and pharmaceutical giants rigging the entire structure. the fix isn't more regulation or more bureaucracy. it's a total reframing of how we incentivize care, manage costs, and punish exploitation.  we need a system where patients are directly rewarded for taking care of their health. not just vague wellness programs, but real, tangible benefits ,,,,lower insurance premiums, tax breaks, and direct cash incentives for things like maintaining healthy bloodwork, showing up for checkups, and staying within optimal health ranges. doctors too should be compensated not just for how many procedures they perform, but for how many of their patients actually stay healthy. if your patient population is thriving, your pay should reflect that. it flips the whole dynamic ....from treating sickness to actually preventing it.  sugar and ultra-processed garbage need to be called what they are: addictive, destructive substances driving the metabolic disease crisis. we treat heroin like a dangerous drug, but sugar? it's in everything, pushed onto kids, subsidized by the government. that needs to stop. schedule it. tax it. restrict its advertising just like we did with tobacco. use that money to subsidize real food ,,,,actual nutrition ....especially for working families stuck eating what they can afford.  pharma and insurance companies? they’re the twin leeches in this mess. pharma sets absurd list prices, then plays a shell game with “discounts” through insurance middlemen who skim profit off the chaos. the price you pay has nothing to do with what it costs to make your meds. it’s all smoke and mirrors. we need full transparency ...real numbers on what it costs to develop, produce, and sell every drug. no more rebates that don’t go to patients. no more charging $700 for insulin that costs $5 to make. and insurance companies should be stripped of the power to decide which drugs are “covered” based on what makes them the most money.  every hospital and clinic should have to publish the actual cost of procedures ...no more $10,000 surprise bills for basic scans. the pricing needs to be public, standardized, and easy to compare. if one place charges five times more for the same service, we need to know. and we need a universal safety net for serious, uncontrollable medical events ...cancer, catastrophic injuries, rare diseases ..fully covered through public funding, negotiated pricing, and strict limits on what hospitals and specialists can charge. you shouldn’t lose your house because you got unlucky.  this isn’t about socialism or free markets. it’s about flipping the incentive structure. right now, sickness is profitable and wellness is ignored. we can flip that. reward prevention, enforce transparency, eliminate profiteering, and treat healthcare as a human necessity ...,.not a corporate asset. because the current system isn’t medicine. it’s extortion in a lab coat.",Famous-Garlic3838,2025-04-24T11:20:13,1
I just got out of an NHS uk operation and the quality of care is absolutely  superb.   And what is more when I'm given advise I know its objective and correct - not just some argument from a doctor  or quack seeking to maximise his profit off my misery.  The NHS is free.  Long live the NHS.,robertbowerman,2025-04-24T11:45:08,1
"I have a personal belief that the US should have the mindset of ""If we want to be the best, we should either imitate the rest or improve upon it"" when it comes to the healthcare system. This means looking at what other countries have done, namely either Japan or South Korea. Both of which have their own problems in the healthcare system; however, their life expectancy rates are much higher than the US for much cheaper than the US.  This means a multilevel system that can't be adapted all at once. Japan uses a system like some American insurance companies do, with either 10/90, 20/80, and 30/70 cost split between the patient and the government respectively with heavy negotiations with pharmaceutical companies to keep cost down. In the US, patients are at the whim of private insurance companies and their employers.   South Korea is universally funded with an income threshold for contributing to the single payer system, and welfare medicare for those who can't contribute. If I understand this correctly at least.  Separate jobs from health insurance, eliminate private health insurance, and eliminate private tax companies like TurboTax, H&R block, etc. and simplify the tax codes! (They are why the government doesn't just send a tax bill. It was lobbied to be as difficult as possible so it could be privatized).   Socialize medicine like South Korea or Japan. This would allow specialists in their own fields to actually treat issues regarding their specialties instead of a jack-of-all-referrals like we have now.",Ill_Examination_5760,2025-04-24T14:04:14,1
"One that the Federal Government stays the hell out of. I’ve brought onsite medical and mental health services into my business for my employees so they can access free basic healthcare vs having to pay $200 for a doctor’s visit for a sick kid. ACA ruined the access to healthcare for my employees.   Current high deductible plans are nothing more than catastrophic illness coverage. Basic preventative and maintenance medicine are unaffordable now, with high deductible plans that cost 5X what the old no deductible plans cost, and cover NOTHING towards the basic day to day health needs of an average family.",VA_Cunnilinguist,2025-04-24T19:31:43,1
"Ideal healthcare system is the same all over the world, and the principles are simple:   \- If you need healthcare (be it mental, physical, dental or whatever), you go to a healthcare professional   \- Said healthcare professional will then help you to the best they can   \- You hopefully get better, you say thank you and go home and live your life",MastusAR,2025-04-24T22:50:30,1
"Ideal System:  Get badly hurt --> Ambulance ride into hospital --> Get treated --> Total bill is 3 digits or less.  Maybe if we made med school more accessible we could have more doctors that are less overworked, maybe if we changed copyright laws we could have more generic medicine that doesn't cost a fortune here when it is inexpensive everywhere else, maybe if we looked at what literally any other country with better healthcare outcomes was doing we could fix some stuff.  I'm thinking we just copy what Sweden or Norway does, since it works.",TheKingNarwhal,2025-04-23T14:06:06,1
"The Profit Motive is principally at odds with the Hippocratic Oath. Presently, the value of a person's life is determined by their wealth and income, which is inhumane and immoral at its foundation.   It should be strictly prohibited for *any* company to profit from healthcare in any way. Thus, Universal Healthcare is the only equitable solution. Research should be publicly funded and owned. And so on",miklayn,2025-04-23T14:40:25,2
Been using the VA system for about 20 years. No complaints here. Personally I think health-care for profit sucks. I'll take the VA system over that.,Ill_Illustrator_6097,2025-04-23T15:18:04,1
"A single-payer system would be ideal, but given the issues, there would be with implementing it (like banning insurance companies leading to unemployment, the lawsuits associated with banning it, the tax increases, and people being angry over their insurance being banned because some people want to keep private insurance for some reason) there's a plan that could get everyone covered and sorta gradually introduce the idea of a single-payer system.  The plan is called ""Medicare For America"". Everyone on Medicare, Medicaid, CHIP, or is uninsured would immediately be put on the new government program called ""Medicare For America"" Everyone else can join it if they want to or keep private insurance as long as it is up to certain standards (so if you have good insurance you can keep it). The program would be funded by an increase in payroll taxes, tobacco taxes, alcohol taxes, a new tax on sugar-sweetened drinks, ending the tax deduction for health insurance, rolling back the Trump tax cuts, and premiums. The premiums are set by the Department of Health and Human Services or an 8% tax depending on which is lower (if the tax is lower you pay the tax, if the premium is lower you pay that). Employers would be able to buy it for employees. People who make less than 200% of the poverty line pay nothing, people between 200-600% pay on a sliding scale. There might be some co-pays (but there would be a cap on out-of-pocket spending). The idea is that people who want to keep private insurance can, people who want the government plan can get that one, and everyone is covered. That and since the government plan would be better and cheaper the hope is to have everyone (or almost everyone) switch to it over time and then be able to just pass a Single Payer plan. There wouldn't be any legal issues if they go bankrupt, people would lose jobs more gradually (which could be less bad to the general public), and they would be able to find new ones, and people would choose the new one and just get used to the government covering them, which would make single-payer easier to pass.  I think it would be more likely to succeed and lead to a single-payer system over time.",NicoRath,2025-04-23T15:39:39,1
