Comment,Author,Date,Score"$1 Trillion of $3.5 Trillion in Health Costs goes to [15 million Healthcare] (https://www.bls.gov/ooh/healthcare/home.htm) employees.    * 30 Percent of that goes to Doctors  * 20 percent goes to RNs,  * 11 million other Employees split up the remaining $500 Billion  BLS [Pie Chart](https://i.redd.it/bus66612xdx31.png)  * 55% of Expenses are Labor  * ~15% is all Managment & Admin is  You can cut 10% of that ....maybe  0.75% of Labor costs  * 0.3% of Hospital Costs  Publically Owned [University of Alabama Hospital/UAB Health Systems](https://i.redd.it/hpqvdgdym9t51.png) reported in 2019 $2.2 Billion in Revenue. And half of Costs are Salaries, like most hosptials   * The Top 6 highest paid people at the University of Alabama Hospital account for $7.4 million in Expenses   * 2 of the are the CEO and COO ($2.5 Million)  * 4 are pediatric specialist ($4.9 Million)  As to BLS **Estimations** of Top 11 Jobs at UAB Health  Job Title | Total Jobs | Total Expenses | Average Pay per Employee 						 ---|---|----|----						 Registered Nurses	|	3,694	|	$287,143,939.24	|	$77,726.37 Nursing Assistants	|	809	|	$25,532,304.14	|	$31,553.44 Physician Assistants/Physician, etc | 404	 | $68,911,080.04 |$170,505.52	 Medical Secretaries	|	332	|	$12,501,133.35	|	$37,680.00 Radiologic Technologists	|	265	|	$16,552,781.80	|	$62,568.37 Medical and Health Services Managers	|	263	|	$32,207,465.38	|	$122,540.30 Maids and Housekeeping Cleaners	|	217	|	$6,278,073.51	|	$28,910.00 Respiratory Therapists	|	215	|	$13,436,679.47	|	$62,620.26 Medical Assistants	|	212	|	$7,658,868.45	|	$36,128.65 Licensed Practical and Licensed Vocational Nurses	|	196	|	$8,832,083.29	|	$45,150.19 Surgical Technologists	|	169	|	$8,196,796.01	|	$48,530.00 Pharmacists	|	164	|	$20,617,773.47	|	$125,924.55  * 30% of Hospital employees are Nurses",semideclared,2025-04-24T10:55:49,1
"Abruptly terminating a large quantity of jobs is bad for the economy as it prevents the circulation of money, but it’s also not a good reason to keep something going that is a waste. Basically you have 2,000,000 people spending their entire working time on something that isn’t even needed.",Zzqnm,2025-04-23T15:04:37,7
"Replacing multiple companies with on payer changes nothing about the number of people needed to actually do the job, especially when you’re adding an extra ~26 million people to the pool.     It genuinely baffles me that people think the insurance companies are paying people to just sit around all day, because they aren’t. The more likely outcome is that a move to M4A would force an *increase* in the number of administrative positions due to the private companies cutting things so far over the years.",DanforthWhitcomb_,2025-04-23T14:37:54,0
"It assumes that because you’d be switching from multiple payers to a single payer you’d save money based on that alone, which is not supported by the evidence provided in the actual reports.",DanforthWhitcomb_,2025-04-23T14:39:53,0
"I don’t think you understand how Medicare/Medicad work: they’re insurance companies in their own right. That billing/coding person (or people) would still be doing the exact same thing, it would just all be done for Medicare/caid. You’d save 0 jobs because the coding itself is the same for Medicare/caid as it is the private insurers and the billing based on the coding is already done via computer.",DanforthWhitcomb_,2025-04-23T14:41:35,1
"> Every single care provider   Has on average just under 1 employee  So with roughly 900,000 Doctors there is 850,000 Billing reps   850,000 x $50,000 Salary  $42.5 billion  $4.1 Trillion is Total Spending  42.5 billion/4.1 Trillion  1.03% of Spending  And not all cost would be cut  So 0.75% savings",semideclared,2025-04-24T11:03:16,1
"Shocking, thats the way policy is discussed  But, They already exist and are not supported by the majority  Easy policy  Medicaid enrollment today and Obamacare....are they the cutoff.....more or less of Obamacare?",semideclared,2025-04-24T11:55:33,1
"Canada has a GST   The US refuses to have a GST to have those services  And our healthcare   $1.1 Trillion was Spent Hospital  at 6,146 hospitals currently operating in 2017.     Hospital Bed-occupancy rate   * Canada [91.8%](https://www.oecd-ilibrary.org/sites/0d67e02a-en/index.html?itemId=/content/component/0d67e02a-en) * for UK hospitals of 88% as of Q3 3019 up from 85% in Q1 2011 * In Germany 77.8% in 2018 up from 76.3% in 2006 * IN the US in 2019 it was 64% down from 66.6% in 2010  * Definition. % Hospital bed occupancy rate measures the percentage of beds that are occupied by inpatients in relation to the total number of beds within the facility. Calculation Formula: (A/B)*100  **That means that we need to close down the 1,800 (vs Canada) to many operating hospitals**   Which saves more money because   The OECD also tracks the supply and utilization of several types of diagnostic imaging devices—important to and often costly technologies. Relative to the other study countries where data were available,  there were an above-average number per million of;    * (MRI) machines  *  25.9 US vs OECD Median 8.9 * (CT) scanners  *  34.3 US vs OECD Median 15.1 * Mammograms  * 40.2 US vs OECD Median 17.3  Plus all the other operating costs extras each hospital has",semideclared,2025-04-24T13:43:10,1
I didn’t say “government” though. I’d much rather the government have my data than private companies.,barchueetadonai,2025-04-23T15:55:58,0
"Total health care spending in Canada is expected to reach $372 billion in 2024, or $9,054 per Canadian (6,440.11 United States Dollar)  Medicaid, the cheapest healthcare in the US operating as a State run Single Payer, is $8,900 per person enrolled, O but,   * For that, costs aren't even paid in full for those that accept Medicaid Patients  * DSH payments help offset hospital costs for uncompensated care to Medicaid patients and patients who are uninsured. In FY 2017, federal DSH funds must be matched by state funds; in total, $21 billion in state and federal DSH funds were allotted in FY 2017. Medicaid Paid Hospitals $197 Billion in 2017. Out of pocket Spending was $35 Billion.  * 10% under-paid.   **So closer to $9,800**   50% more expensive than Canada and no insurance",semideclared,2025-04-24T13:47:36,1
I would imagine they have an insurance model because it was an acceptable model and they set about making some guardrails to ensure they weren't overrun by the model to the degree that the parasites become the host.,AllTheyEatIsLettuce,2025-04-24T14:02:03,1
"Those companies can absolutely remain profitable without price-gouging.  Considering the orange dickhead erased $10 trillion from the stock market in the last couple months with literally nothing to show for it, I think a handful of cash-rich companies can take a minor short-term hit in exchange for permanently unfucking the healthcare system in this country.  Even if they all go out of business (they won't), it's still worth it by several orders of magnitude.  It will likely never happen because politicians are greedy cowards, but it is certainly not hard or complicated.  It is simple, obvious, and necessary.",candre23,2025-04-23T17:42:35,0
"I’m planning a move to a wealthy European country with a solid public healthcare system. I sat on the phone and online for a little more than half a day yesterday and have barely scratched the surface of solving my problems. Simple, it is not my friend. It hasn’t always been this way, but many countries in the EU are experiencing doctor and nursing shortages, coupled with funding shortages, and long waits for care. This has been very much a post covid issue IMO.   My husband and I are both on medications and on top of that, I have a history of breast cancer in my family. In NYC, I was fast tracked into their breast cancer preventative program and get all sorts of preventative care every 6 months even though I’m only 35. This is completely free of charge. Because I’m only 35, in the EU country, I won’t get a mammogram until I’m 40 or older I believe (I could be wrong, there was A LOT of info). I have to wait my turn. That scares me to no end because I have immediate family who was diagnosed with breast cancer at 41 and 40, so it’s potentially life threatening for me to wait and catch this too late (something that unfortunately does happen more often than you’d think in the EU with cancer under public healthcare these days). Then I found out some of our medications aren’t covered because some are illegal and some are deemed unnecessary under public care, like what?! Since when is preventative care medication unnecessary?! So then I get on the phone with a private healthcare option. And booooooy you should’ve seen my face when I found out about the LACK of coverage for pre existing conditions! That’s when I found we’d pay the same price for private healthcare in the US, but that NONE of our preexisting conditions or medications even the preventative ones that were unnecessary for dumb stuff like hypertension were not covered. I’m telling you. And the cherry on top? I asked about mental healthcare, because that’s a big one for us. A move is hard and I’d like continue therapy. Yeah, public option is to wait 2-4 years for a therapist and I can kiss my anxiety meds goodbye. And private DOESN’T COVER MENTAL HEALTH.   I asked the rep, how are these things not covered?! And he’s like, yeah, I get that question a lot from Americans, truth is, Obamacare is really great. It’s very different talking to someone who’s 35 from America and someone who’s 50. It’s really different over here. Both preexisting conditions and mental health coverage? Yeah, both Obamacare.  I had 2 very important life lessons confirmed for me yesterday.   1. Anyone who ever says to me voting republican and democrat is the same thing, after that discussion, is getting a slap in the face and a serious telling off. It’s a matter of life and death. Obama literally saved hundreds of millions of people’s lives and got called horrible, racist, names in return.  2. Adulting sucks and is hard everywhere. Take those rose colored glasses off and set them aside. There is no greener pasture. You have to fight and advocate for yourself no matter what. Always remember to fight for you and those around you who can’t stand up for themselves. Otherwise people like Trump will stomp on us all and have us believe it’s “the same”. But rule one has shown us it’s not.",queenofthepoopyparty,2025-04-24T13:57:18,1
">All I want is reasonably competent care that won't bankrupt me or drive me into poverty.   If only it was that simple    >  “The bone marrow transplant issue gets at part of the crux of the health-care crisis,” said Dr. James Gajewski, a member of the UCLA Medical Center bone marrow transplant team. “What do you do with patients with a terminal disease who may have a chance of cure” with therapy that’s inconclusive? he asked. “How do you pay for it?”  In 1991, Nelene Fox, a 38-year-old mother of three, was diagnosed with breast cancer. She underwent bilateral mastectomies and chemotherapy but nonetheless developed bony metastases. Her physicians said her only chance for survival was high-dose chemotherapy and autologous bone marrow transplantation. A costly new kind of therapy that involves the harvest and retransplant of her own bone marrow–high-wire medicine occupying what one of her physicians calls “the twilight zone between promising and unproven treatments.""  * Doctors say 5% or more die from the treatment itself  Her Health Maintenance Organization (HMO) refused to cover the procedure (around $140,000 - $220,000) on the basis that it was experimental.  “How do you pay for it?”  Who pays for it?”  Its the Top, **Cutting the Spending of the Top 10% in half saves $1 Trillion** 30 Percent Savings. Indeed, this skewness in health care spending has been documented in nearly every health care system, its just the US Spends the most and the most on its most expensive.   Spenders	|	Average per Person	|	Civilian Noninstitutionalized Population	|	Total Personal Healthcare Spending in 2017	|	Percent paid by Medicare and Medicaid ------	|	-----	|	------	|	------	|	---- Top 1%	|	$259,331.20	|	2,603,270	|	$675,109,140,000.00	|	42.60% Next 4%	|	$78,766.17	|	10,413,080	|	$820,198,385,000.00	|	 Next 5%	|	$35,714.91	|	13,016,350	|	$464,877,785,000.00	|	47.10%  So-called “super spenders;” are people that accumulate more than $250,000 in drug costs per year.  In 2016, just under 3,000 people were Super Spenders. By the end of 2018, that figure had grown to nearly 5,000.   Then there is Elite super-spenders those spending at least $750,000 in drug costs per year. In 2016, 256 people were Elite super-spenders. By the end of 2018, that figure had grown to 354.  Almost all of these 5,000 people were using Cancer Drugs   The 3% - 10% is where we can probably cut costs. [The 20 Most Expensive Conditions Treated in U.S. hospitals, all payers, 2017](https://i.redd.it/ke9iwjc3cey61.png)  Drawing upon strategies that have worked for several other health systems, Regional One has built a model of care that, among a set of high utilizers, reduced uninsured ED visits by 68.8 percent, inpatient admissions by 75.4 percent, and lengths-of-stay by 78.6 percent—averting $7.49 million in medical costs over a fifteen month period (personal communication, Regional One Health, July 8, 2019).  ONE Health staff find people that might qualify for the program through a daily report driven by an algorithm for eligibility for services. Any uninsured or Medicaid patient with more than 10 ED visits in the Last 12 months is added to the list. The team uses this report daily to engage people in the ED or inpatient and also reach out by phone to offer the program. There is no charge for the services and the team collaborates with the patient’s current care team if they have one.   About **80 percent of eligible patients agree to the service**, and about 20 percent dis-enroll without completing the program. ONE Health served 101 people from April - December of 2018. Seventy-six participants remain active as of December 2018 and 25 people had graduated from the program.  Since 2018, the population of the program has grown to more than 700 patients and the team continues to monitor clients even after graduation to re-engage if a new pattern of instability or crisis emerges.   But its voluntary   The process of moving people toward independence is time-consuming. Sometimes patients keep using the ED.  One of these was Eugene Harris, age forty-five. Harris was diagnosed with type 1 diabetes when he was thirteen and dropped out of school. He never went back. Because he never graduated from high school and because of his illness, Harris hasn’t had a steady job. Different family members cared for him for decades, and then a number of them became sick or died. Harris became homeless. He used the Regional One ED thirteen times in the period March–August 2018. Then he enrolled in ONE Health. The hospital secured housing for him, but Harris increased his use of the ED. He said he liked going to the hospital’s ED because “I could always get care.” From September 2018 until June 2019 Harris went to the ED fifty-three times, mostly in the evenings and on weekends, because he was still struggling with his diabetes and was looking for a social connection, Williams says.  Then in June 2019, after many attempts, a social worker on the ONE Health team was able to convince Harris to connect with a behavioral health provider. He began attending a therapy group several times a week. He has stopped using the ED and is on a path to becoming a peer support counselor.  ONE Health clients are 50 years old on average and have three to five chronic conditions.  Social needs are prevalent in the population, with 25 percent experiencing homelessness on admission, 94 percent experiencing food insecurity, 47 percent with complex behavioral health issues, and 42 percent with substance use disorder.  And then $366.0 billion was spent on LongTerm Care Providers in 2016, representing 12.9% of all Medical Spending Across the U.S. and Medicaid and Medicare Pay 66 Percent of Costs. 4.5 million adults' receive longterm care, including 1.4 million people living in nursing homes. A total of 24,092 recipients received nursing home care from Alabama Medicaid at a cost of $965 million.  **Its really that easy. Tell people No**",semideclared,2025-04-24T15:03:43,1
"Well, that’s not what I said, and I have no interest in a Cathy Newman exchange where my words are extrapolated into an extreme position that is not my point.",JuniorFarcity,2025-04-24T07:44:26,1
"True, but in most of those countries the working class pays significantly more income taxes than in the United States. I believe in the UK people making over roughly $20k equivalent per year pay something like 20% taxes, and $60k pay 40%.   So for most Americans, implementing an NHS style system would mean paying 20% to 40% more in taxes every year.",escapevelocity-25k,2025-04-24T12:43:42,1
"My employer is paying like $7,000 a year for me and my single person coverage. My insurance is far better than anything on the exchange. We just tried to find my girlfriend’s dad health insurance through the exchange and even the most expensive options were abysmal in comparison to what she or I have, it was insanely disappointing. I have *strong* doubts that most employers would pass the insurance savings cost onto the employees and not just pocket it for themselves.",Tw1tcHy,2025-04-23T18:54:19,6
"I know how much. It’s cheaper overall. That’s clearly not how it should be, but my company pays a few thousand per year for me.",barchueetadonai,2025-04-23T15:55:05,1
Ah thanks for clarifying,gman2093,2025-04-23T22:00:13,1
That's not proof that the US is not subsidizing prices elsewhere.,JKlerk,2025-04-23T14:38:15,0
"Yes, we absolutely do. Drug makers have expected costs and profit margins when developing a new drug, and factoring in the US market plays an extremely large role in that calculation. It’s been well known we subsidize the world for years, I’m honestly shocked more political capital hasn’t been expended hammering this fact home, because it seems like a universal win-win across the political spectrum in multiple facets. We 100% absolutely subsidize the cost of prescription drugs for *everyone* and it’s not even really debatable.  From 2012: https://www.pbs.org/newshour/economy/do-other-countries-piggyback-o  https://reason.org/commentary/how-america-subsidizes-medicine-across-the-world/  Vox article from 2016: https://archive.is/MEnLG  And more: https://synapse.patsnap.com/article/does-the-us-subsidize-health-care-in-the-rest-of-the-world-by-doing-most-of-the-drug-research?",Tw1tcHy,2025-04-23T18:33:20,0
"Nah.  All that extra money that we pay goes toward [marketing](https://www.washingtonpost.com/news/wonk/wp/2015/02/11/big-pharmaceutical-companies-are-spending-far-more-on-marketing-than-research/) and [bribing politicians](https://www.promarket.org/2022/06/29/healthcare-companies-spent-more-on-lobbying-than-any-other-industry-last-year/) and [wealth hoarding,](https://www.statnews.com/pharmalot/2021/07/08/pharma-stock-rnd-dividends/) not research.  Drug corpos are greedy evil fuckers.  They charge $800 for a $3 pill because we let them, and they know that we don't have a choice.  All we have to do is stop letting them and the problem goes away.",candre23,2025-04-23T16:01:07,-4
"Drug manufacturing in particular, which is the only part of the healthcare system where ""the US market subsidizes the prices other countries pay"" can even make sense.  [Profit margins on drugs are beyond astronomical.](https://accountable.us/report-profits-investor-handouts-soar-among-top-5-pharma-companies-amid-industry-price-hikes/)",candre23,2025-04-23T16:23:35,1
"> H+H has a per person cost of $9,500 and is underfunded  We can both agree that no system is perfect, and we can both agree that we can find someone who thinks there system is underfunded, but if we take each system as a whole, what does a survey of their customer base rate their services (H+H and private health insurance companies) to compare them to each other?  > universal system that negotiates lower prices like all developed nations do is currently the most successful path to limiting costs >> Why? How much? The US is expensive  Why? Because they are cheaper with better outcomes and wait times that are worse in some situations for the US and worse for other in single payer systems. And even with lower costs and some aspects with longer wait times, they have overall the same or better outcomes than the US. That’s why.   How much? I guess you mean how much cheaper? Google costs per capita of developed nations health care. Other developed nations have from 25% to 100% cheaper cost per capita.   The US is expensive. Yes and expensive amount is how much we currently pay for healthcare and we know a single payer healthcare system is likely to be cheaper in cost per capita.",none74238,2025-04-24T20:27:47,1
>They can't just increase premiums to make up for it because those are subject to regulations as well (and they need to be as low as possible to remain competitive)  What SPECIFIC regulation are insurance companies subject to that limits their ability to increase prices?,none74238,2025-04-24T19:58:30,1
"That's an interesting read, and yes I recognize the gate keeping strategy makes sense in some contexts. But just because gate keeping makes sense in the case of avoiding unnecessary surgeries does not mean it is universally the right approach for regulating access to care. I had the direct experience of knowing, in consultation with my regular physician, that I needed a particular imaging study (an MRI). But my insurance company would not approve this study directly. Instead, I had to see a series of specialists, spaced out over months, who all agreed with my regular physician's recommendation, and receive a less effective imaging study (a CT), all to ultimately arrive at the point I started. It was a waste of my time, multiple specialists time, and an unnecessary procedure, all because my insurance company believes it has a better understanding of what medical treatment I should receive than my primary care provide. And I am sure countless people have needed to jump unnecessarily through similar hoops.",VitaAurelia,2025-04-24T10:44:58,1
"I don't think this is the most constructive way to look at the issue. Yes, hospitals are expensive to run and need to serve a population of patients of a certain size before they become cost-effective, but providing access to health care should not be optional. If you're advocating for a model that gives the government greater power to negotiate the cost of medical care, then yes I agree with that.",VitaAurelia,2025-04-24T10:31:23,1
"I think that's a reasonable interpretation, I'll add more context to the original comment",StrategistEU,2025-04-23T23:35:17,1
"Absolutely, it's a short term shock for a longer term net benefit (and even saying the benefits are only long term is misleading as the cost savings would be more immediate).  What you see in justifying government spending, especially infrastructure projects, is that the jobs are held up as the point of the program rather than the actual aim of the project. Building HSR, for example, will provide most of its jobs in the construction and some more in the operations but that is secondary to the primary good that is rapid public transport. American legislators get a little lost in the sauce when pitching these projects and that can lead to poor execution once the project is started.",Dmagnum,2025-04-23T15:43:27,5
"It isn’t a one for one replacement. A single payer system wouldn’t need a single lobbyist (let alone thousands), no teams of accountants and consultants strategizing on marketing and denial of coverage, no executive boards squabbling for top position, no shareholders to please with returns.   And with the rank and file not spending their days trying to deny coverage, their work is heavily streamlined.   For comparison, the UK’s NHS has 1.7 million employees, with most of those being actual facilities staff.   The number of those doing the equivalent job of most health insurance workers in the US? Only tens of thousands of that overall number.   Even with five times the population, a similar program in the US wouldn’t have a quarter of the workers involved in health insurance that it does today.",Kronzypantz,2025-04-23T16:30:13,2
"""The actual reports"", like which reports? The article I posted is summarizing the CBO report.",Dmagnum,2025-04-23T14:56:14,2
"I don't think you understand what actual insurance negotiators at medical providers do.  It's not merely ""coding"" - although that is an overly-complicated part of it.  The near-totality of the work comes down to figuring out what the insurer will and won't pay for, and haggling over how much they'll pay.  For each line item, for each patient.  And it's different for each insurer.  Oh, you had surgery?  Well the hospital and the primary surgeon is in your network, but the anesthesiologist isn't somehow.  Some of the medicines are covered, and some aren't.  It's a fucking minefield of pointless paperwork.  With a nationalized system, there is one code book, and it only exists to get the hospital paid.  There is no billing, because everything is covered by one simple co-pay.  Zero nonsense.  Millions of busywork jobs eliminated.",candre23,2025-04-23T14:54:38,1
