Title,URL,Date,Score,Author,num_comments,identifier"‘No friend anymore’: Days from a national election, Canadian voters focus on the US relationship",https://www.cnn.com/2025/04/24/politics/canada-trump-election-prime-minister-tariffs/index.html,2025-04-27T14:56:21,94,nosotros_road_sodium,15,‘No_friend_anymore’_---20250427_145621
Americans Still Trust Donald Trump Over Democrats,https://www.newsweek.com/donald-trump-polling-democrats-republicans-2064747?utm_term=Autofeed&utm_medium=Social&utm_source=Twitter#Echobox=1745762615,2025-04-27T14:49:12,0,AccurateInflation167,51,Americans_Still_Trus---20250427_144912
California’s shift to the Right is the true sign that woke is whacked,https://www.telegraph.co.uk/news/2025/04/27/californias-shift-right-true-sign-that-woke-is-whacked/,2025-04-27T14:44:32,0,AccurateInflation167,30,California’s_shift_t---20250427_144432
Homan says having US-born children does not make people ‘immune’ from deportation,https://thehill.com/homenews/administration/5270048-homan-us-born-children-deportation/?fbclid=IwZXh0bgNhZW0CMTEAAR4ol4ntWyjV0Wb9CbbSQqGKV3-huuaLRR_y6wqfFcBvI19VcTOgaraks12r8A_aem_LQXGkyMtJi1XpDb6YoWEMQ,2025-04-27T14:42:41,158,kootles10,72,Homan_says_having_US---20250427_144241
The American democratic republic has died. It was 236 years old,https://www.sfchronicle.com/opinion/openforum/article/us-democracy-dies-trump-236-years-20292708.php,2025-04-27T14:41:50,25885,nosotros_road_sodium,1461,The_American_democra---20250427_144150
Joe Rogan warns Trump policy ‘is dangerous’,https://www.pennlive.com/news/2025/04/joe-rogan-warns-trump-policy-is-dangerous.html,2025-04-27T14:29:11,3421,aslan_is_on_the_move,506,Joe_Rogan_warns_Trum---20250427_142911
Trump Administration to Judges: ‘We Will Find You’,https://www.theatlantic.com/politics/archive/2025/04/trump-administration-initimidates-judges/682620/,2025-04-27T14:27:43,98,SterlingVII,24,Trump_Administration---20250427_142743
2 American Children Were Sent to Honduras With Their Undocumented Mother,https://www.nytimes.com/2025/04/27/us/politics/us-citizen-children-deported-honduras-trump.html?smid=url-share,2025-04-27T14:26:42,94,Competitive_Ad291,6,2_American_Children_---20250427_142642
"JB Pritzker, a potential 2028 Democratic presidential candidate, headlines New Hampshire fundraiser",https://abcnews.go.com/amp/US/wireStory/jb-pritzker-potential-2028-democratic-presidential-candidate-headlines-121210800,2025-04-27T14:23:17,115,DevinGraysonShirk,24,"JB_Pritzker,_a_poten---20250427_142317"
Trump White House pleased with first 100 days despite low approval rating,https://www.washingtonpost.com/politics/2025/04/27/trump-presidency-100-days/?utm_campaign=wp_main&utm_medium=social&utm_source=reddit.com,2025-04-27T14:09:52,33,washingtonpost,42,Trump_White_House_pl---20250427_140952
"Bernie Sanders: Americans Know What 'Oligarchy' Means, They Aren't 'Dumb'",https://www.rollingstone.com/politics/politics-news/bernie-sanders-americans-arent-dumb-oligarchy-1235326101/,2025-04-27T14:09:22,3373,rollingstone,281,Bernie_Sanders__Amer---20250427_140922
"Is Trump trolling Canada with 51st state attacks? ‘No I’m not,’ he says",https://globalnews.ca/news/11148924/donald-trump-time-interview-51st-state/amp/,2025-04-27T13:57:19,69,Partimenerd,49,Is_Trump_trolling_Ca---20250427_135719
Trump is softening his tariff talk. But the damage may already be done.,https://www.washingtonpost.com/business/2025/04/27/trump-tariffs-us-economy/,2025-04-27T13:32:42,213,Rock-n-roll-Kevin,72,Trump_is_softening_h---20250427_133242
Bessent Demurs on Trump’s Claim of Trade Talks With China’s Xi,https://www.nytimes.com/2025/04/27/us/politics/bessent-trump-xi-tariffs.html,2025-04-27T13:26:19,34,muchnycrunchny,16,Bessent_Demurs_on_Tr---20250427_132619
"White House “faith” leader says it’s “not hard” for women to “submit” to their husbands. Paula White is the head of the White House Faith Office, and she's happy men are returning to the church so that women can ""submit"" to them.",https://www.lgbtqnation.com/2025/04/white-house-faith-leader-says-its-not-hard-for-women-to-submit-to-their-husbands/,2025-04-27T13:25:18,200,southpawFA,77,White_House_“faith”_---20250427_132518
"Sen. Bernie Sanders defends 'Fighting Oligarchy' tour from Democratic criticism, says Americans aren't 'dumb'",https://www.nbcnews.com/politics/politics-news/bernie-sanders-fighting-oligarchy-tour-criticism-elissa-slotkin-rcna203206,2025-04-27T13:05:44,7152,jackytheblade,728,Sen._Bernie_Sanders_---20250427_130544
US treasury secretary says ‘there is a path’ with China over tariff negotiations,https://www.theguardian.com/us-news/2025/apr/27/trump-tariffs-china-negotiations,2025-04-27T12:59:54,0,OverallPhotograph350,37,US_treasury_secretar---20250427_125954
Ron and Casey DeSantis were plotting a political dynasty in Florida. Then came a scandal,https://www.cnn.com/2025/04/27/politics/ron-casey-desantis-florida-scandal,2025-04-27T12:53:37,155,sunnysidejacqueline,17,Ron_and_Casey_DeSant---20250427_125337
Trump golf club to host speaker who claims bleach can cure cancer and Covid,https://www.theguardian.com/us-news/2025/apr/27/trump-golf-club-speaker-bleach,2025-04-27T12:51:41,347,pharrt,85,Trump_golf_club_to_h---20250427_125141
Major car manufacturer says it will stop production of this vehicle due to tariffs,https://www.pennlive.com/business/2025/04/major-car-manufacturer-says-it-will-stop-production-of-this-vehicle-due-to-tariffs.html,2025-04-27T12:45:38,28,SAJ-13,15,Major_car_manufactur---20250427_124538
Rubio says the coming week is 'very critical' in Russia-Ukraine war negotiations,https://www.cnbc.com/2025/04/27/trump-negotiations-russia-ukraine-rubio-critical-week.html,2025-04-27T12:43:21,14,avid-learner-bot,18,Rubio_says_the_comin---20250427_124321
Trump Claims He’s Made 200 Deals on Tariffs. His Cabinet Members Can’t Name One,https://www.rollingstone.com/politics/politics-news/trump-trade-deals-cabinet-cant-name-any-1235326080/,2025-04-27T12:42:45,10138,rollingstone,413,Trump_Claims_He’s_Ma---20250427_124245
Canadians see U.S. relationship as just as bad as with Russia: survey,https://globalnews.ca/news/11148997/canada-us-relations-russia-china/,2025-04-27T12:28:34,270,OtherwiseCanary8971,32,Canadians_see_U.S._r---20250427_122834
Stephen Miller Unveils Bizarre New Attack on Birthright Citizenship,https://newrepublic.com/post/194261/stephen-miller-new-attack-birthright-citizenship,2025-04-27T12:25:40,1510,SnoozeDoggyDog,224,Stephen_Miller_Unvei---20250427_122540
"Ahead of Canada’s Election, Secretary of State Marco Rubio Speaks Out on Trump’s Plans to Annex the Country",https://time.com/7280793/does-trump-plan-to-annex-canada-marco-rubio-51st-state-comments/,2025-04-27T12:25:39,65,rookie-mistake,36,Ahead_of_Canada’s_El---20250427_122539
"Chicago mayor donned keffiyeh for Arab Heritage Month event, sparking outcry from Jewish groups",https://forward.com/fast-forward/715489/chicago-mayor-donned-keffiyeh-for-arab-heritage-month-event-sparking-outcry-from-jewish-groups/,2025-04-27T12:22:00,0,Somervilledrew,15,Chicago_mayor_donned---20250427_122200
Why the Republicans’ Budget Bill Won’t Add Up,https://www.bloomberg.com/opinion/articles/2025-04-27/republican-budget-bill-why-it-won-t-add-up?embedded-checkout=true,2025-04-27T12:18:05,118,rapidcreek409,19,Why_the_Republicans’---20250427_121805
Navy secretary cancels Biden-era climate change policy,https://www.stripes.com/branches/navy/2025-04-25/navy-phelan-climate-change-17578872.html,2025-04-27T12:17:50,51,1900grs,9,Navy_secretary_cance---20250427_121750
The Coming Economic Nightmare,https://www.theatlantic.com/magazine/archive/2025/06/trump-economy-tariffs-stagflation/682572/?gift=I4LGsilsOekK9WrXBxktmubP4-0E0Ir8MAii71a1C0U&utm_source=copy-link&utm_medium=social&utm_campaign=share,2025-04-27T12:15:37,182,amartin141,67,The_Coming_Economic_---20250427_121537
Trump cabinet members clash on tariff talks with China,https://www.reuters.com/world/us/trump-cabinet-members-clash-tariff-talks-with-china-2025-04-27/,2025-04-27T12:07:43,54,RoughWestern9152,12,Trump_cabinet_member---20250427_120743
"Greenland not a piece of property, says PM after Trump threats",https://www.bbc.com/news/articles/cly1pjnpyjpo,2025-04-27T12:00:47,182,aslan_is_on_the_move,6,Greenland_not_a_piec---20250427_120047
Sen. Bernie Sanders says Democrats lack ‘vision for the future',https://www.nbcnews.com/meet-the-press/video/sen-bernie-sanders-says-democrats-lack-vision-for-the-future-full-interview-238425157563,2025-04-27T11:57:53,1349,Murky-Site7468,244,Sen._Bernie_Sanders_---20250427_115753
Donald Trump Approval Rating Hits 80-Year Low,https://www.vanityfair.com/news/story/trump-approval-rating-hits-80-year-low,2025-04-27T11:52:48,3316,Rock-n-roll-Kevin,235,Donald_Trump_Approva---20250427_115248
"In rural Minnesota, the pain is worth it",https://www.startribune.com/in-minnesotas-most-conservative-county-trump-voters-resolute-100-days-into-term/601328790,2025-04-27T11:51:42,12,Ella0508,47,"In_rural_Minnesota,_---20250427_115142"
The FBI mistakenly raided their Atlanta home. Now the Supreme Court will hear their lawsuit,https://apnews.com/article/georgia-fbi-raid-supreme-court-lawsuit-9cb55aa6f45bbf02c29d84363c7c9e6f,2025-04-27T11:48:19,499,thieh,16,The_FBI_mistakenly_r---20250427_114819
Wisconsin judge threatens courtroom boycott over Hannah Dugan arrest,https://www.foxnews.com/politics/wisconsin-judge-threatens-courtroom-boycott-over-hannah-dugan-arrest,2025-04-27T11:40:02,75,findingmike,28,Wisconsin_judge_thre---20250427_114002
"Government Notices to Migrants Fall Short of Due Process, Legal Experts Say",https://www.nytimes.com/2025/04/25/us/politics/trump-migrants-due-process.html,2025-04-27T11:31:47,172,aslan_is_on_the_move,10,Government_Notices_t---20250427_113147
Cory Booker and Hakeem Jeffries Are Sitting in to Stand Up for Medicaid,https://www.rollingstone.com/politics/politics-news/booker-jeffries-capitol-sit-in-medicaid-1235326047/,2025-04-27T11:29:21,495,rollingstone,49,Cory_Booker_and_Hake---20250427_112921
Video of Pete Buttigieg's explanation on Social Security takes off online,https://www.newsweek.com/video-pete-buttigieg-explanation-social-security-flagrant-viral-2064657,2025-04-27T11:18:17,24039,modooff,767,Video_of_Pete_Buttig---20250427_111817
Trump’s proposals for peace amount to a total betrayal of Ukraine,https://www.telegraph.co.uk/opinion/2025/04/23/letters-trumps-proposals-for-peace-betray-ukraine/,2025-04-27T11:11:24,667,Silent-Resort-3076,50,Trump’s_proposals_fo---20250427_111124
Trump Claims No Time for Immigrant Due Process in Anti-Judge Screed,https://www.thedailybeast.com/trump-claims-no-time-for-immigrant-due-process-in-anti-judge-screed/,2025-04-27T11:06:43,795,sweatycat,92,Trump_Claims_No_Time---20250427_110643
Trump Floats New Income Tax Cut in Bid to Ease Bite of Tariffs,https://www.bloomberg.com/news/articles/2025-04-27/trump-floats-new-income-tax-cut-in-bid-to-ease-bite-of-tariffs,2025-04-27T10:56:57,43,bloomberg,69,Trump_Floats_New_Inc---20250427_105657
‘ I am staying put’: Schumer on passing the torch,https://www.cnn.com/2025/04/27/politics/video/senator-chuck-schumer-democrats-leader-trump-100-days-in-office-digvid?cid=ios_app,2025-04-27T10:55:54,44,Odd-Pomegranate35,135,‘_I_am_staying_put’_---20250427_105554
Secretary of State Marco Rubio: 'Of course' all people in the U.S. are entitled to due process,https://www.nbcnews.com/politics/trump-administration/secretary-state-marco-rubio-all-people-us-entitled-due-process-rcna203193,2025-04-27T10:52:39,3023,fulltrendypro,258,Secretary_of_State_M---20250427_105239
American Panopticon,https://www.theatlantic.com/technology/archive/2025/04/american-panopticon/682616/?gift=JpkgTFCkRrRYYduGsrms84TtokSo_CDx0IJvrGVNMCA&utm_source=copy-link&utm_medium=social&utm_campaign=share,2025-04-27T10:47:56,26,dheber,6,American_Panopticon---20250427_104756
"Americans, including Republicans, losing faith in Trump, new polls reveal.",https://www.theguardian.com/us-news/2025/apr/26/americans-republicans-trump-ratings-poll?utm_source=dlvr.it&utm_medium=bluesky&CMP=bsky_gu,2025-04-27T10:47:24,939,RegnStrom,58,"Americans,_including---20250427_104724"
Ron and Casey DeSantis were plotting a political dynasty in Florida. Then came a scandal,https://www.cnn.com/2025/04/27/politics/ron-casey-desantis-florida-scandal/index.html,2025-04-27T10:46:36,648,rapidcreek409,53,Ron_and_Casey_DeSant---20250427_104636
ICE Arrests Nearly 800 in Florida in Operation With Local Officers,https://www.nytimes.com/2025/04/26/us/politics/ice-arrests-florida-immigrants.html?unlocked_article_code=1.C08.XUsd.9r9IDKHirKtl&smid=nytcore-android-share,2025-04-27T10:12:25,1191,Quiet_Down_Please,189,ICE_Arrests_Nearly_8---20250427_101225
Greenland leader says Trump's threats disrespectful,https://www.wfxg.com/news/greenland-leader-says-trumps-threats-disrespectful/article_6315435b-cc5c-52df-b39f-b049c8efb639.html,2025-04-27T10:07:19,385,SAJ-13,24,Greenland_leader_say---20250427_100719
100 Days. That’s All It Took to Sever America From the World.,https://www.nytimes.com/2025/04/27/opinion/100-days-trump-world.html,2025-04-27T09:57:46,2245,PapyrusKami74,127,100_Days._That’s_All---20250427_095746
Harvard students and faculty face the fallout from a showdown with Trump,https://www.nbcnews.com/news/amp/rcna202468,2025-04-27T09:45:23,59,JamesepicYT,13,Harvard_students_and---20250427_094523
Congress Loved Tariffs Long Before President ‘Tariff Man’ Trump,https://www.bloomberg.com/news/articles/2025-04-25/will-congress-temper-trump-s-tariffs-history-isn-t-encouraging,2025-04-27T09:35:35,0,bloomberg,32,Congress_Loved_Tarif---20250427_093535
Young men and women are taking the 'gender gap' to staggering new levels,https://www.nbcnews.com/politics/elections/young-men-women-are-taking-poll-gender-gap-staggering-new-levels-rcna202672,2025-04-27T09:34:13,47,the-daily-banana,132,Young_men_and_women_---20250427_093413
Trump tariffs could throw off Ford's path to balanced Ontario budget,https://www.cbc.ca/news/canada/toronto/ford-ontario-path-to-balance-1.7517912,2025-04-27T09:32:25,21,nosotros_road_sodium,4,Trump_tariffs_could_---20250427_093225
‘A trickle to a tidal wave’: behind the Trump protest movement that launched on Reddit,https://www.theguardian.com/us-news/2025/apr/27/trump-protest-movement-50501,2025-04-27T09:29:29,1542,qwerty_1965,140,‘A_trickle_to_a_tida---20250427_092929
The New Partisan Divide Is Old Gen Z vs. Young Gen Z,https://www.politico.com/news/magazine/2025/04/26/two-gen-zs-young-conservative-polling-00307375,2025-04-27T09:26:29,0,bummed_athlete,17,The_New_Partisan_Div---20250427_092629
Donald Trump Rages at Judges After Deportation Setback: 'No Retribution,https://www.newsweek.com/donald-trump-judge-deportation-setback-2064731,2025-04-27T09:21:53,144,RoughWestern9152,31,Donald_Trump_Rages_a---20250427_092153
"However Scared You Are, You Are Not Scared Enough - Back during the campaign, Trump pretended his “Dictator on Day 1” talk was just a joke. One hundred days in, it’s clear he was not joking.",https://www.huffpost.com/entry/trump-autocrat-supreme-court_n_680ab464e4b031fa917d7610,2025-04-27T09:13:36,6067,Quirkie,323,However_Scared_You_A---20250427_091336
Immigrants in the US unlawfully can drive legally in 19 states. Now some states want to stop them,https://apnews.com/article/illegal-immigration-drivers-licenses-93b73a2ac83cbbfe687e23e975b991fa,2025-04-27T09:12:13,0,SpaceElevatorMusic,33,Immigrants_in_the_US---20250427_091213
I used to laugh at my Chilean father’s paranoia about life in the US – not any more,https://www.theguardian.com/us-news/ng-interactive/2025/apr/27/chile-trump-pinochet-authoritarianism,2025-04-27T09:11:57,189,ChaskaChanhassen,8,I_used_to_laugh_at_m---20250427_091157
"U.S. Rep. Don Bacon considers retirement, a Nebraska lawmaker interested in running for his seat | State Sen. John Cavanaugh of Omaha confirms possible bid for Nebraska’s 2nd District, regardless of Bacon’s decision",https://nebraskaexaminer.com/2025/04/25/u-s-rep-don-bacon-considers-retirement-a-nebraska-lawmaker-interested-in-running-for-his-seat/,2025-04-27T09:01:23,25,SpaceElevatorMusic,3,U.S._Rep._Don_Bacon_---20250427_090123
American Panopticon: The Trump administration is pooling data on Americans. Experts fear what comes next.,https://www.theatlantic.com/technology/archive/2025/04/american-panopticon/682616/?gift=8NB2Y8R8pwPdrbgeKyENZc0ftey6knolXOAilge96e8&utm_source=copy-link&utm_medium=social&utm_campaign=share,2025-04-27T08:57:45,422,Competitive_Ad291,53,American_Panopticon_---20250427_085745
"Only about half of Republicans say Trump has focused on the right priorities, AP-NORC poll finds",https://apnews.com/article/trump-economy-immigration-trade-100-days-poll-625efe6128d5f2e90e04bcc7f30479eb,2025-04-27T08:45:56,105,SpaceElevatorMusic,29,Only_about_half_of_R---20250427_084556
"Most say Trump, Democrats are ‘out of touch’: Poll",https://thehill.com/homenews/administration/5269876-trump-dems-out-of-touch-poll/?tbref=hp,2025-04-27T08:42:11,113,someopinionthatsr,62,"Most_say_Trump,_Demo---20250427_084211"
"House Minority Leader Jeffries, NJ Sen. Booker begin sit-in protest on Capitol steps",https://abc7ny.com/post/us-politics-house-minority-leader-hakeem-jeffries-ny-nj-sen-cory-booker-begin-livestreamed-sit-protest-capitol-steps/16260342/,2025-04-27T08:41:54,5947,Keyezeecool,610,House_Minority_Leade---20250427_084154
Republicans in the toughest swing districts become hard to find for people angry about Trump,https://apnews.com/article/republicans-recess-congress-no-town-halls-de45284c77fbc54a13c7090f75994674,2025-04-27T08:35:14,644,Just-Sale-7015,35,Republicans_in_the_t---20250427_083514
He once worshipped Elon Musk. Now the owner of Musk Construction is making a big change.,https://www.usatoday.com/story/news/2025/04/27/musk-construction-renaming-company-elon-musk-politics/83137374007/,2025-04-27T08:28:24,47,usatoday,15,He_once_worshipped_E---20250427_082824
Trump’s approval at 100 days lower than any president in at least seven decades,https://www.cnn.com/2025/04/27/politics/approval-rating-trump-100-days/index.html,2025-04-27T08:25:41,1166,NotAKentishMan,73,Trump’s_approval_at_---20250427_082541
"As Musk gained power in Washington, his popularity has fallen, an AP-NORC poll finds",https://apnews.com/article/musk-trump-doge-tesla-d1206a96983b30b9cef7b18eaa8c48a7,2025-04-27T08:25:36,106,SpaceElevatorMusic,15,As_Musk_gained_power---20250427_082536
"Judge says US citizen, 2, may have been deported without 'meaningful process'",https://www.bbc.com/news/articles/c4g278yn4d3o,2025-04-27T08:15:40,2370,RoughWestern9152,196,Judge_says_US_citize---20250427_081540
"'Food is not political,’ WFP head says as U.S. cuts aid and Israel blocks help to Gaza",https://www.pbs.org/newshour/show/food-is-not-political-wfp-head-says-as-u-s-cuts-aid-and-israel-blocks-help-to-gaza,2025-04-27T08:14:27,201,SPY444,69,'Food_is_not_politic---20250427_081427
"Poll: Americans vent disappointment with Trump ahead of his 100-day mark, especially on tariffs",https://www.nbcnews.com/politics/trump-administration/poll-americans-vent-disappointment-trump-ahead-100-day-mark-especially-rcna202656,2025-04-27T08:14:20,154,nbcnews,26,Poll__Americans_vent---20250427_081420
Wife of US Coast Guard member arrested over expired visa after security check for military housing,https://apnews.com/article/coast-guard-immigration-arrest-navy-ice-8c59f778f3245b470871e1da96bf90e7,2025-04-27T08:03:26,119,Mother_Task_2708,34,Wife_of_US_Coast_Gua---20250427_080326
Federal work shaped a Black middle class. Now it's destabilized by Trump's job cuts,https://www.npr.org/2025/04/27/nx-s1-5349442/black-federal-employees-trump-cuts,2025-04-27T08:03:17,221,SpaceElevatorMusic,27,Federal_work_shaped_---20250427_080317
Trump’s Biggest Beneficiary: Himself,https://www.nytimes.com/2025/04/27/opinion/trump-crypto-musk-spacex.html?unlocked_article_code=1.C08.GcBU.5GWT6B-Acvan&smid=url-share,2025-04-27T07:41:27,307,AgentBlue62,17,Trump’s_Biggest_Bene---20250427_074127
"How Trump Plays Into Putin’s Hands, From Ukraine to Slashing U.S. Institutions",https://www.nytimes.com/2025/04/26/us/politics/trump-putin-russia-ukraine.html?unlocked_article_code=1.Ck8.7iju.zec367oMcDPQ&smid=url-share,2025-04-27T07:40:19,174,OtherwiseCanary8971,13,How_Trump_Plays_Into---20250427_074019
"Taking on Musk, New York Considers Move to Close Tesla Dealerships",https://www.nytimes.com/2025/04/27/nyregion/new-york-tesla-dealerships-doge.html,2025-04-27T07:28:45,2346,BreakfastTop6899,139,"Taking_on_Musk,_New_---20250427_072845"
"Trump order to loosen fishing regulations poses major risks, experts warn",https://www.theguardian.com/environment/2025/apr/27/trump-fishing-regulation-order-pacific-islands,2025-04-27T07:06:27,149,pharrt,11,Trump_order_to_loose---20250427_070627
"Trump’s approval rating is lower than the ‘worst president in history,’ new poll says",https://www.masslive.com/news/2025/04/trumps-approval-rating-is-lower-than-the-worst-president-in-history-new-poll-says.html,2025-04-27T06:58:47,32839,Silent-Resort-3076,1351,Trump’s_approval_rat---20250427_065847
The ‘Never Surrender’ President Retreats: The Art of Walking Back,https://www.wsj.com/politics/elections/the-never-surrender-president-retreats-9b82807e,2025-04-27T06:49:47,367,eteplirsen,18,The_‘Never_Surrender---20250427_064947
Trump has lowest 100-day approval rating in 80 years: Poll,https://6abc.com/post/donald-trump-approval-rating-100-days-is-lowest-any-president-past-80-years-abc-newswashington-postipsos-poll-shows/16260005/,2025-04-27T06:43:04,7446,BiggieTwiggy1two3,294,Trump_has_lowest_100---20250427_064304
"Americans Are Claiming Social Security Early, Fearful of Its Future",https://www.wsj.com/personal-finance/retirement/social-security-benefits-early-trump-changes-27ecd4ee,2025-04-27T06:42:53,529,nieuwsjunkie,101,Americans_Are_Claimi---20250427_064253
"Local Social Security offices face staffing shortages, delays due to federal budget cuts",https://cbs6albany.com/news/local/local-social-security-offices-face-staffing-shortages-delays-due-to-federal-budget-cuts,2025-04-27T06:41:01,121,nieuwsjunkie,2,Local_Social_Securit---20250427_064101
What Trump’s order on ‘disparate impact’ means for civil rights,https://www.washingtonpost.com/nation/2025/04/24/disparate-impact-liability-executive-order/,2025-04-27T06:04:13,44,Infidel8,15,What_Trump’s_order_o---20250427_060413
A Long Island community’s ‘Chief’ concern draws President Trump’s attention,https://www.cnn.com/2025/04/26/us/long-island-ny-massapequa-chief-trump?cid=ios_app,2025-04-27T06:01:44,9,Plaintalks,8,A_Long_Island_commun---20250427_060144
RFK Jr.’s Wish Is Coming True: Everybody’s Getting Measles,https://www.thedailybeast.com/rfk-jrs-wish-is-coming-true-everybodys-getting-measles/,2025-04-27T06:00:52,7425,Quirkie,446,RFK_Jr.’s_Wish_Is_Co---20250427_060052
Pentagon prepared briefing for Musk on top secret U.S. weapons for China War,https://www.wsj.com/politics/national-security/pete-hegseth-elon-musk-pentagon-classified-e81dade5,2025-04-27T06:00:16,191,SubjectInevitable650,22,Pentagon_prepared_br---20250427_060016
Campgrounds and visitor centers at federal lakes are closing amid Trump's budget cuts,https://apnews.com/article/army-corps-engineers-campground-reacreation-budget-cuts-8bbdf098e39569ccca951a319bec0735,2025-04-27T05:46:03,217,HeHateMe337,22,Campgrounds_and_visi---20250427_054603
Trump promised to improve the economy on Day 1. Americans are still waiting.,https://www.usatoday.com/story/news/politics/2025/04/27/trump-promised-economic-boom-americans-still-waiting/83140347007/,2025-04-27T05:34:04,405,MobileWisdom,28,Trump_promised_to_im---20250427_053404
"DOGE says it has saved $160 billion. Those cuts have cost taxpayers $135 billion, one analysis says.",https://www.cbsnews.com/news/doge-cuts-cost-135-billion-analysis-elon-musk-department-of-government-efficiency/,2025-04-27T05:22:48,6132,Ace-Cuddler,223,DOGE_says_it_has_sav---20250427_052248
"Trump approval sinks as Americans criticize his major policies, poll finds",https://www.washingtonpost.com/politics/2025/04/27/trump-poll-approval-rating-100-days/,2025-04-27T05:20:54,630,merchlinkinbio,14,Trump_approval_sinks---20250427_052054
Ex-Hegseth Aides’ Mud-Slinging Ramps Up With Cocaine Claim,https://www.thedailybeast.com/ex-hegseth-aides-mud-slinging-ramps-up-with-cocaine-allegation/,2025-04-27T05:20:18,14163,Aggravating_Money992,601,Ex-Hegseth_Aides’_Mu---20250427_052018
"ICE Deports Immigrant Mother Of An Infant And 3 Children Who Are U.S. Citizens, Lawyers Say",https://www.huffpost.com/entry/us-immigration-mothers-citizens-deported_n_680d5141e4b03a96c002e34d,2025-04-27T05:12:45,203,Tuxcali1,18,ICE_Deports_Immigran---20250427_051245
"The world has a verdict on 100 days of Trump 2.0: Wow, what a loser",https://www.salon.com/2025/04/27/the-world-has-a-verdict-on-100-days-of-20-wow-what-a-loser/,2025-04-27T05:11:09,6415,zsreport,239,The_world_has_a_verd---20250427_051109
"Trump Promised Lower Food Prices On Day 1, 99 Days Later Has Delivered The Opposite",https://www.huffpost.com/entry/trump-grocery-prices-100-days_n_680a7fc4e4b0b1be3356225a,2025-04-27T05:01:30,2609,Quirkie,94,Trump_Promised_Lower---20250427_050130
Trump's first 100 days: America First president is overturning the world order,https://www.reuters.com/world/us/trumps-first-100-days-america-first-president-is-overturning-world-order-2025-04-27/,2025-04-27T04:55:19,61,DrThomasBuro,20,Trump's_first_100_da---20250427_045519
