Title,URL,Date,Score,Author,num_comments,identifierUS FTC offers employees financial incentives to quit,https://www.reuters.com/business/world-at-work/us-ftc-offers-employees-financial-incentives-quit-2025-04-25/,2025-04-25T17:56:28,24,coasterghost,3,US_FTC_offers_employ---20250425_175628
Trump Caught Red-Handed Lying in Crazy ’200 Deals’ Interview,https://www.thedailybeast.com/trump-caught-red-handed-lying-in-crazy-200-deals-interview/,2025-04-25T17:54:12,5169,Rock-n-roll-Kevin,298,Trump_Caught_Red-Han---20250425_175412
"NASA administrator was once arrested, accused of passing bad checks to casinos",https://www.reuters.com/world/us/trumps-nominee-nasa-administrator-was-accused-passing-bad-checks-casinos-2025-04-25/,2025-04-25T17:48:45,190,FunConfection2872,24,NASA_administrator_w---20250425_174845
Mike Lindell’s lawyers used AI to write brief—judge finds nearly 30 mistakes,https://arstechnica.com/tech-policy/2025/04/mypillow-ceos-lawyers-used-ai-in-brief-citing-fictional-cases-judge-says/,2025-04-25T17:46:42,339,Rocky_Mountain_Way,22,Mike_Lindell’s_lawye---20250425_174642
USDA withdraws a plan to limit salmonella levels in raw poultry,https://www.seattletimes.com/business/usda-withdraws-a-plan-to-limit-salmonella-levels-in-raw-poultry/,2025-04-25T17:43:56,176,Conscious-Quarter423,36,USDA_withdraws_a_pla---20250425_174356
Harvard Was First. Hollywood Could Be Next,https://www.hollywoodreporter.com/business/business-news/harvard-hollywood-tax-exempt-trump-1236199898/?utm_medium=email&utm_source=exacttarget&utm_campaign=Today%20In%20Entertainment%20April%2025%202025&utm_content=602549_4-25-2025&utm_id=602549,2025-04-25T17:42:22,81,normankrasnerkc,15,Harvard_Was_First._H---20250425_174222
Trump’s planned pharmaceutical tariffs would raise costs by $51bn annually - report,https://www.independent.co.uk/news/world/americas/us-politics/trump-pharmaceutical-tariffs-costs-b2739812.html,2025-04-25T17:42:20,188,theindependentonline,20,Trump’s_planned_phar---20250425_174220
Pete Hegseth’s Signal Phone Number Can Be Found Everywhere,https://newrepublic.com/post/194447/pete-hegseth-signal-phone-number,2025-04-25T17:41:52,339,ralphbernardo,18,Pete_Hegseth’s_Signa---20250425_174152
"Trump upends DOJ's Civil Rights Division, sparking 'bloodbath' in senior ranks",https://www.nbcnews.com/news/amp/rcna202622,2025-04-25T17:41:23,77,latin220,3,Trump_upends_DOJ's_C---20250425_174123
Product shortages and empty store shelves loom with falling shipments from China,https://www.nbcnews.com/politics/economics/product-shortages-empty-store-shelves-loom-falling-shipments-china-rcna202812,2025-04-25T17:39:56,121,Silent-Resort-3076,26,Product_shortages_an---20250425_173956
"Trump Says He Wouldn’t ‘100 Percent’ Agree America Should Be Ruled by Laws, Not Men",https://www.rollingstone.com/politics/politics-news/trump-time-interview-us-nation-laws-1235325085/,2025-04-25T17:32:59,2818,Rock-n-roll-Kevin,258,Trump_Says_He_Wouldn---20250425_173259
Wisconsin judge arrested and charged in federal court for allegedly obstructing immigration agents,https://amp.cnn.com/cnn/2025/04/25/politics/fbi-director-wisconsin-judge-arrested,2025-04-25T17:30:35,96,latin220,57,Wisconsin_judge_arre---20250425_173035
Wisconsin Democrats denounce arrest of Milwaukee judge in ICE case as some Republicans cheer,https://www.jsonline.com/story/news/politics/2025/04/25/wisconsin-top-politicians-react-to-milwaukee-judge-arrest-in-ice-case/83273658007/,2025-04-25T17:29:47,272,netsheriff,16,Wisconsin_Democrats_---20250425_172947
Texas airline risks losing tax breaks over deportation flights,https://www.chron.com/culture/article/avelo-airlines-deportation-houston-20294746.php,2025-04-25T17:29:32,75,chrondotcom,1,Texas_airline_risks_---20250425_172932
Trump offers private dinner to the top investors in his meme coin,https://www.cnn.com/2025/04/24/politics/meme-coin-trump-dinner?cid=ios_app0,2025-04-25T17:27:45,33,Plaintalks,12,Trump_offers_private---20250425_172745
Trump admin will boost Gulf of America oil production by 100K barrels a day under new drilling policy,https://nypost.com/2025/04/24/us-news/trump-admin-will-increase-oil-production-in-gulf-of-america-by-100k-barrels-a-day-under-new-drilling-policy/,2025-04-25T17:22:12,0,brushfirefred,40,Trump_admin_will_boo---20250425_172212
Pam Bondi Warns ‘Deranged’ Judges: ‘We Are Coming For You’. | The Attorney General has put the judiciary on notice after two judges were arrested for helping migrants.,https://www.thedailybeast.com/pam-bondi-warns-deranged-judges-we-are-coming-for-you/,2025-04-25T17:19:42,769,GonzoVeritas,164,Pam_Bondi_Warns_‘Der---20250425_171942
"Inspector General Probes Whether Trump, DOGE Sought Private Taxpayer Information or Sensitive IRS Material",https://www.propublica.org/article/trump-doge-irs-treasury-tigta-inspector-general-probe,2025-04-25T17:09:36,148,wenchette,7,Inspector_General_Pr---20250425_170936
"Pam Bondi Pledging to 'Come After' Those Who Go Against Trump Policies, Including Judges, Sparks Fears of 'End Times': 'This is a Test'",https://www.latintimes.com/pam-bondi-pledging-come-after-those-who-go-against-trump-policies-including-judges-sparks-581757,2025-04-25T17:04:57,9191,PostHeraldTimes,592,Pam_Bondi_Pledging_t---20250425_170457
"Kennedy Center events scheduled for LGBTQ+ pride celebration have been canceled, organizers say",https://apnews.com/article/world-pride-kennedy-center-trump-lgbtq-69fbf0ca20c2f9c36f49f8311f8bf1b6,2025-04-25T16:59:37,172,coasterghost,17,Kennedy_Center_event---20250425_165937
Fact check: It wasn’t ‘in jest.’ Here are 53 times Trump said he’d end Ukraine war within 24 hours or before taking office,https://www.cnn.com/2025/04/25/politics/fact-check-trump-ukraine-war/index.html,2025-04-25T16:56:04,2139,ImDoubleB,61,Fact_check__It_wasn’---20250425_165604
"‘Awful, awful, awful’: Trump breaks his own polling record (again)",https://www.nj.com/politics/2025/04/awful-awful-awful-trump-breaks-his-own-polling-record-again.html,2025-04-25T16:53:22,186,plz-let-me-in,16,"‘Awful,_awful,_awful---20250425_165322"
"Justice Department to resume issuing subpoenas to journalists as part of leaks crackdown, Bondi says",https://apnews.com/article/justice-department-subpoenas-journalists-leaks-investigations-0d5745648eb935a89af1529e08536b9d,2025-04-25T16:51:04,155,Ok-Lets-Talk-It-Out,34,Justice_Department_t---20250425_165104
Trump blows up the notion his Canada talk was just a fleeting fancy,https://www.cbc.ca/news/world/trump-time-interview-analysis-1.7519086,2025-04-25T16:48:22,183,ClassOptimal7655,64,Trump_blows_up_the_n---20250425_164822
AG Bondi's Brother wants to control DC Bar,https://slate.com/news-and-politics/2025/04/pam-bondi-legal-news-maga-dc-bar.html,2025-04-25T16:44:44,140,telerabbit9000,17,AG_Bondi's_Brother_w---20250425_164444
"Hegseth's Pentagon office set up system so he could access Signal messages, sources say",https://www.cbsnews.com/news/pentagon-internet-hegseth-signal-security/,2025-04-25T16:42:40,93,CBSnews,8,Hegseth's_Pentagon_o---20250425_164240
Signs of China ‘caving’ to Trump emerge amid tariff exemptions,https://www.foxbusiness.com/media/china-caving-trumps-trade-war-strategy-expert-signals,2025-04-25T16:38:22,0,jpcapone,46,Signs_of_China_‘cavi---20250425_163822
How Democrats and Republicans cite science: study reveals stark differences. Democratic-led congressional committees and left-wing think tanks reference research papers more often than their right-wing counterparts.,https://www.nature.com/articles/d41586-025-01311-9,2025-04-25T16:28:31,147,mixplate,34,How_Democrats_and_Re---20250425_162831
Covid-like shortages for US consumers ‘within weeks’,https://www.thetimes.com/business-money/companies/article/covid-like-shortages-for-us-consumers-within-weeks-2x7fgjpzq,2025-04-25T16:28:28,671,TimesandSundayTimes,84,Covid-like_shortages---20250425_162828
"Nancy Mace slams Clemson's gender options: 'Follow science, not woke ideology'",https://www.foxnews.com/video/6371943080112,2025-04-25T16:20:46,0,AccurateInflation167,34,Nancy_Mace_slams_Cle---20250425_162046
‘Vaguely Threatening’: Federal Prosecutor Queries Leading Medical Journal,https://www.nytimes.com/2025/04/25/health/nejm-prosecutor-letter.html?smid=nytcore-android-share,2025-04-25T16:19:07,42,navalnys_revenge,4,‘Vaguely_Threatening---20250425_161907
"Inspector General Probes Whether Trump, DOGE Sought Private Taxpayer Information or Sensitive IRS Material",https://www.propublica.org/article/trump-doge-irs-treasury-tigta-inspector-general-probe?utm_source=sailthru&utm_medium=email&utm_campaign=majorinvestigations&utm_content=feature,2025-04-25T16:14:03,128,lotta_love,3,Inspector_General_Pr---20250425_161403
Anti-LGBTQ+ GOP legislator says gay marriage must be overturned because “God”. Oklahoma state Sen. Dusty Deevers made his comment while speaking to a man who believes the Bible commands Christians to kill gay people.,https://www.lgbtqnation.com/2025/04/anti-lgbtq-gop-legislator-says-gay-marriage-must-be-overturned-because-god/,2025-04-25T16:07:08,118,southpawFA,44,Anti-LGBTQ+_GOP_legi---20250425_160708
Is the Trump admin 'getting played' by Putin? Michael Crowley weighs in,https://www.msnbc.com/katy-tur/watch/is-the-trump-admin-getting-played-by-putin-michael-crowley-weighs-in-238359109835,2025-04-25T16:05:11,91,msnbc,25,Is_the_Trump_admin_'---20250425_160511
"Democrat Rep. Wilson urges people to call, threaten lawmakers over uptick in illegal immigration detentions",https://www.foxnews.com/politics/democrat-rep-urges-call-threaten-lawmakers-uptick-illegal-immigration-detentions,2025-04-25T16:03:06,0,AccurateInflation167,36,Democrat_Rep._Wilson---20250425_160306
House Democrats' headaches are about to get much worse,https://www.axios.com/2025/04/24/house-democrats-primary-challenges,2025-04-25T15:57:09,11,skullfers,13,House_Democrats'_hea---20250425_155709
Trump DOJ Ordered ICE to Invade Homes Without Search Warrant,https://newrepublic.com/post/194442/trump-doj-memo-ice-arrest-search-warrant,2025-04-25T15:55:29,11206,coinsCA,797,Trump_DOJ_Ordered_IC---20250425_155529
A Red State Begged Trump For Help. He Said No — And Now They’re Screwed.,https://www.huffpost.com/entry/arkansas-tornados-trump-fema-help_n_680bd3c2e4b0f42cc7ebde87?utm_medium=Social&utm_source=reddit&utm_campaign=us_main,2025-04-25T15:55:02,2158,huffpost,269,A_Red_State_Begged_T---20250425_155502
LA County ports expect roughly 40% drop in traffic as Trump's tariffs continue,https://www.cbsnews.com/losangeles/news/la-county-ports-expect-roughly-40-drop-in-traffic-as-trumps-tariffs-continue/,2025-04-25T15:53:59,129,IWantPizza555,17,LA_County_ports_expe---20250425_155359
US judge blocks Trump from ending union bargaining for many federal workers,https://www.reuters.com/legal/us-judge-blocks-trump-ending-union-bargaining-many-federal-workers-2025-04-25/,2025-04-25T15:52:58,191,IWantPizza555,8,US_judge_blocks_Trum---20250425_155258
Officials Prepared to Return Abrego Garcia—Until Trump Intervened,https://newrepublic.com/post/194454/trump-intervened-return-kilmar-abrego-garcia,2025-04-25T15:51:57,5793,FloridaGirlNikki,153,Officials_Prepared_t---20250425_155157
North Dakota Governor Vetoes Bill Restricting Library Books,https://www.nytimes.com/2025/04/24/us/north-dakota-library-governor-veto.html,2025-04-25T15:51:52,172,aslan_is_on_the_move,9,North_Dakota_Governo---20250425_155152
Matt Gaetz visited El Salvador mega-prison in 2024. He pitched it to Stephen Miller,https://www.the-independent.com/news/world/americas/us-politics/matt-gaetz-el-salvador-prison-trump-deportation-b2739596.html,2025-04-25T15:49:51,559,mrgeekguy,27,Matt_Gaetz_visited_E---20250425_154951
DOJ rescinds policy against subpoenaing journalists,https://www.axios.com/2025/04/25/bondi-doj-garland-subpoena-journalists,2025-04-25T15:45:26,114,wenchette,11,DOJ_rescinds_policy_---20250425_154526
"DOGE is building a master database for immigration enforcement, sources say",https://www.cnn.com/2025/04/25/politics/doge-building-master-database-immigration/index.html,2025-04-25T15:43:17,61,1877KlownsForKids,14,DOGE_is_building_a_m---20250425_154317
"Voters See Trump’s Use of Power as Overreaching, Times/Siena Poll Finds",https://www.nytimes.com/2025/04/25/us/politics/trump-poll-approval.html?campaign_id=190&emc=edit_ufn_20250425&instance_id=153337&nl=from-the-times&regi_id=93576114&segment_id=196756&user_id=3baeb9af6d5a167095d28bc09c6d2eab,2025-04-25T15:39:11,127,Truthisnotallowed,12,Voters_See_Trump’s_U---20250425_153911
FBI arrests Wisconsin Judge Hannah Dugan for obstruction in immigration case,https://www.cbsnews.com/news/fbi-arrests-wisconsin-judge-obstruction-immigration-case/,2025-04-25T15:36:20,68,SterlingVII,19,FBI_arrests_Wisconsi---20250425_153620
Pardoned J6 Rioter Claims He 'Received No Due Process' During Texas Town Hall Showdown: 'That's Why I'm Running for Congress',https://www.latintimes.com/pardoned-j6-rioter-claims-he-received-no-due-process-during-texas-town-hall-showdown-thats-why-581753,2025-04-25T15:29:52,92,PostHeraldTimes,59,Pardoned_J6_Rioter_C---20250425_152952
How Trump’s attack on universities is putting research in peril: Scientists have little information as the US government freezes and cancels their funding.,https://www.nature.com/articles/d41586-025-01289-4,2025-04-25T15:29:21,71,xjian77,5,How_Trump’s_attack_o---20250425_152921
Trump asks Supreme Court to let him enforce ban on transgender troops,https://www.politico.com/news/2025/04/24/trump-supreme-court-transgender-troop-ban-00307892,2025-04-25T15:24:24,38,SterlingVII,10,Trump_asks_Supreme_C---20250425_152424
Hegseth trying to show Trump he's a fighter amid chaos in Pentagon,https://www.nbcnews.com/politics/national-security/hegseth-trying-show-trump-s-fighter-chaos-pentagon-rcna202915,2025-04-25T15:21:20,0,nbcnews,20,Hegseth_trying_to_sh---20250425_152120
"Hegseth’s Phone Number Widely Available Online, Presenting Massive National Security Threat: NYT",https://www.huffpost.com/entry/trump-presidency-latest-updates_n_68029ae0e4b01dc12d4bde68/liveblog_680b9a47e4b031fa917dcb71?d_id=9094975&ref=bffbhuffpost&ncid_tag=fcbklnkushpmg00000063&utm_medium=Social&utm_source=Facebook&utm_campaign=us_main&fbclid=IwZXh0bgNhZW0CMTEAAR49z8lB4oO3dSB6o8_SAJX-mfGhUQC_uFIswiuY-w2P8iaJoNb8iX12_jTCQQ_aem_s-IJZFgxD1yANoALXOAmAA,2025-04-25T15:21:17,909,kootles10,59,Hegseth’s_Phone_Numb---20250425_152117
Trump admin considers exempting Christians from its push to deport some Afghan refugees,https://www.politico.com/news/2025/04/25/trump-administration-exemptions-christians-afghan-refugees-deportation-00309672,2025-04-25T15:19:40,71,SterlingVII,16,Trump_admin_consider---20250425_151940
The Kafkaesque Case of Juan Carlos Lopez-Gomez Is a Warning to Us All,https://truthout.org/articles/the-kafkaesque-case-of-juan-carlos-lopez-gomez-is-a-warning-to-us-all/?utm_source=Truthout&utm_campaign=bd3ee86453-EMAIL_CAMPAIGN_2025_04_25_06_45&utm_medium=email&utm_term=0_bbb541a1db-bd3ee86453-650963661,2025-04-25T15:18:21,62,Truthisnotallowed,2,The_Kafkaesque_Case_---20250425_151821
"For the Trump administration, it’s amateur hour",https://www.washingtonpost.com/opinions/2025/04/25/trump-mistakes-hegseth-yiddish/,2025-04-25T15:16:24,82,mintaphil,14,For_the_Trump_admini---20250425_151624
Trump goes after Fox News for highlighting his cratering economic approval ratings,https://edition.cnn.com/2025/04/24/media/trump-goes-after-fox-news-for-highlighting-his-cratering-economic-approval-ratings/index.html?iid=cnn_buildContentRecirc_end_recirc,2025-04-25T15:16:11,406,alexfuchs2020,56,Trump_goes_after_Fox---20250425_151611
Bennet questions Schumer’s Senate leadership,https://www.semafor.com/article/04/25/2025/colorado-sen-michael-bennet-questions-senate-minority-leader-chuck-schumers-leadership?utm_campaign=semaforreddit,2025-04-25T15:14:07,50,semafornews,8,Bennet_questions_Sch---20250425_151407
Trump’s Attack on ActBlue Just Blew up in His Face -  Donald Trump’s attempt to target the major Democratic fundraising platform has instead galvanized donors.,https://newrepublic.com/post/194450/donald-trump-attack-actblue-donations,2025-04-25T15:09:56,3044,Murky-Site7468,297,Trump’s_Attack_on_Ac---20250425_150956
Trump Makes Bonkers Claim About All His Trade Deals | Donald Trump claims he’s made hundreds of deals—but won’t say with whom.,https://newrepublic.com/post/194421/donald-trump-claim-200-trade-deals,2025-04-25T14:56:35,764,newfrontier58,162,Trump_Makes_Bonkers_---20250425_145635
Academics cancel US travel over fears of harassment and visa issues at border control,https://www.irishexaminer.com/news/arid-41619709.html,2025-04-25T14:56:25,262,throwaway16830261,12,Academics_cancel_US_---20250425_145625
"FBI, state police raid homes of pro-Palestine activists in Michigan",https://www.peoplesworld.org/article/fbi-state-police-raid-homes-of-pro-palestine-activists-in-michigan/,2025-04-25T14:54:09,239,PM_ME_DPRK_CANDIDS,68,"FBI,_state_police_ra---20250425_145409"
America’s Market Exceptionalism Isn’t Coming Back,https://www.bloomberg.com/news/articles/2025-04-25/investors-are-fleeing-us-assets-as-global-financial-crisis-recession-loom,2025-04-25T14:45:58,192,bloomberg,25,America’s_Market_Exc---20250425_144558
"Voters See Trump’s Use of Power as Overreaching, Times/Siena Poll Finds",https://www.nytimes.com/2025/04/25/us/politics/trump-poll-approval.html,2025-04-25T14:43:50,269,fundohun11,16,Voters_See_Trump’s_U---20250425_144350
Ossoff ‘strongly’ backs Trump impeachment but says Democrats need to flip House first. Says Trump has ‘exceeded any prior standard’ for impeachment but warns the political math still matters.,https://www.ajc.com/politics/ossoff-strongly-backs-trump-impeachment-but-says-democrats-need-to-flip-house-first/QUWQFRQOFVEJLHMYAKJ22ABL5U/,2025-04-25T14:42:16,13177,OkayButFoRealz,599,Ossoff_‘strongly’_ba---20250425_144216
"Most Mainers don’t think Susan Collins deserves another term, survey says",https://www.pressherald.com/2025/04/24/most-mainers-dont-think-susan-collins-deserves-another-term-survey-says/,2025-04-25T14:38:12,1584,plz-let-me-in,141,Most_Mainers_don’t_t---20250425_143812
Colorado senator vows to go to ballot after Republicans kill measure to help survivors of child sexual abuse,https://www.cbsnews.com/colorado/news/colorado-ballot-measure-child-sexual-abuse-survivors/,2025-04-25T14:19:54,463,ParadeSit,24,Colorado_senator_vow---20250425_141954
‘Denied’: Judges issue rapid-fire rejection of Trump admin request to lift block on funding cuts to migrant children aid organizations,https://lawandcrime.com/high-profile/denied-judges-issue-rapid-fire-rejection-of-trump-admin-request-to-lift-block-on-funding-cuts-to-migrant-children-aid-organizations/,2025-04-25T14:18:03,278,Sachyriel,4,‘Denied’__Judges_iss---20250425_141803
Justice Department Cuts Grants For Crime Victims At DOGE’s Behest,https://www.huffpost.com/entry/justice-department-grants-doge_n_680a6002e4b0b3e1a66f0f72/amp,2025-04-25T14:12:21,171,Background-Point-769,4,Justice_Department_C---20250425_141221
A lot of hope was pinned on after-school programs — now they’re shutting their doors,https://hechingerreport.org/a-lot-of-hope-was-pinned-on-after-school-programs-now-theyre-shutting-their-doors/?utm_source=The+Hechinger+Report&utm_campaign=ee108923dc-EMAIL_CAMPAIGN_2025_04_24_06_14&utm_medium=email&utm_term=0_-ee108923dc-323417488,2025-04-25T14:05:58,47,CarrollCounty,7,A_lot_of_hope_was_pi---20250425_140558
"Another town hall, another irate crowd. But Iowa Sen. Chuck Grassley says he's not stopping",https://www.desmoinesregister.com/story/news/politics/2025/04/23/iowa-sen-chuck-grassley-town-hall-other-republicans-scale-back/83210129007/,2025-04-25T14:04:31,73,MasterAlchemi,15,"Another_town_hall,_a---20250425_140431"
"Trump is not invincible: Democrats, immigrants and the politics of due process",https://www.salon.com/2025/04/25/is-not-invincible-democrats-and-the-of-due-process/,2025-04-25T14:00:54,455,salon,25,Trump_is_not_invinci---20250425_140054
‘Vaguely Threatening’: Federal Prosecutor Queries Leading Medical Journal,https://www.nytimes.com/2025/04/25/health/nejm-prosecutor-letter.html,2025-04-25T14:00:11,51,Past_My_Subprime,8,‘Vaguely_Threatening---20250425_140011
Consumer expectations crater to three-decade low amid Trump tariff chaos,https://www.politico.com/news/2025/04/25/consumers-confidence-tariffs-economy-inflation-00309521,2025-04-25T13:56:21,151,Quirkie,12,Consumer_expectation---20250425_135621
Social Security may lose thousands more staff under new Trump rule,https://www.reuters.com/world/us/social-security-may-lose-thousands-more-staff-under-new-trump-rule-2025-04-25/,2025-04-25T13:47:50,80,Ubiquitous_Hilarity,8,Social_Security_may_---20250425_134750
"Animated elderly woman behind police incident at Hageman town hall in Wheatland, report shows",https://wyofile.com/animated-elderly-woman-behind-police-incident-at-hageman-town-hall-in-wheatland-report-shows/,2025-04-25T13:39:06,22,WyoFileNews,9,Animated_elderly_wom---20250425_133906
"Trump Doubtful on Another Tariff Pause, Wants China Concessions",https://www.bloomberg.com/news/articles/2025-04-25/trump-sees-trade-deals-coming-in-three-to-four-weeks,2025-04-25T13:38:25,30,bloomberg,40,Trump_Doubtful_on_An---20250425_133825
Advocates for immigrant victims of domestic violence condemn White House ‘political theater’,https://19thnews.org/2025/04/white-house-immigration-domestic-violence-exploitation/,2025-04-25T13:28:36,70,19thnews,2,Advocates_for_immigr---20250425_132836
"Health agencies ""not creating an autism registry,"" official says, contradicting NIH director",https://www.cbsnews.com/news/health-agencies-not-creating-autism-registry-hhs-nih/,2025-04-25T13:25:23,74,alittlelessconvo,16,Health_agencies__not---20250425_132523
The Healthcare Crisis is the Key to a New Populist Left,https://www.currentaffairs.org/news/the-healthcare-crisis-is-the-key-to-a-new-populist-left,2025-04-25T13:21:51,131,curraffairs,28,The_Healthcare_Crisi---20250425_132151
Democratic lawmakers call for release of Tufts student from Ice detention,https://www.theguardian.com/us-news/2025/apr/25/trump-tufts-rumeysa-ozturk-ice,2025-04-25T13:21:11,137,OverallPhotograph350,2,Democratic_lawmakers---20250425_132111
Fox News and Trump MAGA nemesis triggers them again,https://www.nj.com/politics/2025/04/fox-news-and-trump-maga-nemesis-triggers-them-again.html,2025-04-25T13:20:40,48,lightlantern,14,Fox_News_and_Trump_M---20250425_132040
"DOGE is building a master database for immigration enforcement, sources say",https://www.cnn.com/2025/04/25/politics/doge-building-master-database-immigration?cid=ios_app,2025-04-25T13:19:39,69,Oleg101,14,DOGE_is_building_a_m---20250425_131939
Pritzker vs. Newsom: 2028 showdown brews over Democratic game plan,https://www.washingtonexaminer.com/news/campaigns/presidential/3391162/pritzker-newsom-2028-showdown-democratic-game-plan/,2025-04-25T13:16:59,0,Hero-Firefighter-24,39,Pritzker_vs._Newsom_---20250425_131659
‘I don’t know what the party is’: 2028 frontrunner Gavin Newsom admits Democrats are missing a message,https://www.independent.co.uk/news/world/americas/us-politics/newsom-california-democratic-party-presidential-race-b2737650.html,2025-04-25T13:15:25,0,Hero-Firefighter-24,28,‘I_don’t_know_what_t---20250425_131525
"ICE is reversing termination of legal status for international students around US, lawyer says",https://apnews.com/article/international-student-status-restored-9e8a7cb90f4193ec52bf06edc5094cd9,2025-04-25T13:13:31,65,YesterShill,16,ICE_is_reversing_ter---20250425_131331
Trump Budget Draft Ends Narcan Program and Other Addiction Measures,https://www.nytimes.com/2025/04/25/health/narcan-grants-cuts-kennedy.html,2025-04-25T13:10:24,373,Hghwytohell,89,Trump_Budget_Draft_E---20250425_131024
"Hegseth Likely Targeted by 'Spyware' After Same Phone Number Used to Send Plans on Signal Connected to Facebook, Whatsapp, Experts Say",https://www.latintimes.com/hegseth-likely-targeted-spyware-after-same-phone-number-used-send-plans-signal-connected-581738,2025-04-25T13:07:28,718,PostHeraldTimes,43,Hegseth_Likely_Targe---20250425_130728
Donald Trump claims to have received call from Xi Jinping and to have cut ‘200 deals’ on trade,https://www.ft.com/content/0192ea53-e97b-4dfd-9483-110678c4c863,2025-04-25T13:02:21,56,Necessary_Pie2464,60,Donald_Trump_claims_---20250425_130221
Trump’s War on Immigrants Has Become an Attack on Us All,https://newrepublic.com/article/194389/trump-war-immigrants-hitting-americans,2025-04-25T12:59:22,277,thenewrepublic,11,Trump’s_War_on_Immig---20250425_125922
US officials arrest Milwaukee judge for obstructing immigration operation,https://www.reuters.com/world/us/fbi-director-says-arrested-judge-obstructing-immigration-operation-2025-04-25/,2025-04-25T12:56:35,135,FunConfection2872,35,US_officials_arrest_---20250425_125635
Florida halts migrant arrests after judge rebukes state over immigration law enforcement,https://www.foxnews.com/us/florida-halts-migrant-arrests-after-judge-rebukes-state-over-immigration-law-enforcement.amp,2025-04-25T12:55:20,78,Lantis28,7,Florida_halts_migran---20250425_125520
"Trump Pardons ‘Lady Trump’ For Spending Slain Officer Charity Funds On ‘Rent, Cosmetic Procedures, and Her Daughter’s Wedding’: “Trump is spitting in the face of law enforcement”",https://lawandcrime.com/high-profile/trump-is-spitting-in-the-face-of-law-enforcement-president-pardons-lady-trump-for-spending-slain-officer-charity-funds-on-rent-cosmetic-procedures-and-her-daughters-weddin/,2025-04-25T12:55:04,5206,T_Shurt,203,Trump_Pardons_‘Lady_---20250425_125504
