Title,URL,Date,Score,Author,num_comments,identifierNot In Our Backyard: Some Pro-Trump Towns Push Against Detention Centers,https://www.themarshallproject.org/2025/04/26/trump-kansas-prison-detention-immigrant?utm_source=reddit&utm_medium=social&utm_campaign=tmp-reddit,2025-04-28T16:14:31,93,marshall_project,12,Not_In_Our_Backyard_---20250428_161431
Civil rights lawyers leave en masse as Justice Dept. mission shifts,https://www.washingtonpost.com/national-security/2025/04/28/justice-civil-rights-harmeet-dhillon-trump/?utm_campaign=wp_main&utm_medium=social&utm_source=reddit.com,2025-04-28T16:06:49,223,washingtonpost,24,Civil_rights_lawyers---20250428_160649
"Donald Trump Jr. co-founds new private members club, Executive Branch, with a $500,000 fee",https://www.cnbc.com/2025/04/28/donald-trump-jr-private-members-club-executive-branch.html,2025-04-28T15:57:40,362,amir_twist_of_fate,97,Donald_Trump_Jr._co----20250428_155740
"'I run the country and the world,' Donald Trump says in Atlantic interview",https://www.usatoday.com/story/news/politics/2025/04/28/trump-the-atlantic-i-run-the-country-world/83326268007/,2025-04-28T15:56:27,934,HellYeahDamnWrite,233,'I_run_the_country_a---20250428_155627
Mike Lindell apparently too broke to proofread his legal arguments,https://newrepublic.com/post/194427/mypillow-ceo-mike-lindell-ai-generated-legal-filing,2025-04-28T15:55:43,190,tigerseye44,22,Mike_Lindell_apparen---20250428_155543
Trump admits it’s possible US citizens could be deported by mistake: ‘Nothing will ever be perfect in this world’,https://www.independent.co.uk/news/world/americas/us-politics/trump-us-citizens-deported-mistake-b2741009.html,2025-04-28T15:53:32,704,BreakfastTop6899,131,Trump_admits_it’s_po---20250428_155332
Government Actually Threatens Wikipedia's Editorial Freedom; Self-Proclaimed Free Speech Warriors Suddenly Have Other Plans,https://www.techdirt.com/2025/04/28/government-actually-threatens-wikipedias-editorial-freedom-self-proclaimed-free-speech-warriors-suddenly-have-other-plans/,2025-04-28T15:50:57,247,457655676,10,Government_Actually_---20250428_155057
Read The Atlantic’s Interview With Donald Trump,https://www.theatlantic.com/politics/archive/2025/04/donald-trump-oval-office-interview-excerpts/682623/?gift=MchbhUqT1RAaWLMuFYEc_HP7GETycmCRSVwt8_pQhGo&utm_source=copy-link&utm_medium=social&utm_campaign=share,2025-04-28T15:45:02,24,Aryeh98,27,Read_The_Atlantic’s_---20250428_154502
Clean Deliveries Act could lessen warehouse boom-fueled pollution in New York,https://www.news10.com/health/clean-deliveries-act-could-lessen-warehouse-boom-fueled-pollution-in-new-york/,2025-04-28T15:44:56,19,news-10,1,Clean_Deliveries_Act---20250428_154456
"Dem Says ICE Took Florida Mom From Baby, Unlawfully Deported Her To Cuba",https://www.huffpost.com/entry/kathy-castor-florida-mom-deported-cuba-trump_n_680fbd18e4b049bc73d5d604?utm_medium=Social&utm_source=reddit&utm_campaign=us_main,2025-04-28T15:39:55,512,huffpost,24,Dem_Says_ICE_Took_Fl---20250428_153955
Judge snaps at DOJ lawyer arguing Trump executive order targeting Big Law firm can't be illegal,https://www.businessinsider.com/judge-doj-lawyer-defending-trump-executive-order-targeting-jenner-block-2025-4,2025-04-28T15:25:58,262,kirby__000,20,Judge_snaps_at_DOJ_l---20250428_152558
QB Jalen Hurts skipping White House celebration,https://www.ctvnews.ca/sports/article/trump-is-celebrating-the-super-bowl-champ-eagles-but-star-qb-jalen-hurts-is-skipping-the-ceremony/,2025-04-28T15:24:27,364,CTVNEWS,25,QB_Jalen_Hurts_skipp---20250428_152427
Trump says Canada should become U.S. state on election day,https://www.ctvnews.ca/world/article/trump-says-canada-should-become-us-state-as-president-weighs-in-on-canadian-vote/,2025-04-28T15:15:58,15,CTVNEWS,32,Trump_says_Canada_sh---20250428_151558
Trump Assures Nation That Pete Hegseth Will Eventually ‘Get It Together’,https://www.rollingstone.com/politics/politics-news/trump-pete-hegseth-get-it-together-1235326840/,2025-04-28T15:15:48,287,rollingstone,97,Trump_Assures_Nation---20250428_151548
"‘If you’re a fascist, get a Tesla’: Neil Young targets Elon Musk in new song",https://www.sfchronicle.com/entertainment/article/neil-young-new-song-musk-trump-20298731.php,2025-04-28T15:14:26,5540,BreakfastTop6899,146,‘If_you’re_a_fascist---20250428_151426
White evangelicals continue to stand out in their support for Trump,https://www.pewresearch.org/short-reads/2025/04/28/white-evangelicals-continue-to-stand-out-in-their-support-for-trump/,2025-04-28T15:13:29,131,OptimalAd3007,81,White_evangelicals_c---20250428_151329
Karoline Leavitt Lets Unhinged Sycophant Into White House Briefing,https://newrepublic.com/post/194503/karoline-leavitt-white-house-press-briefing-new-media-dc-draino,2025-04-28T15:07:11,258,ChiGuy6124,39,Karoline_Leavitt_Let---20250428_150711
How Popular Is Donald Trump in Canada? What Polls Show,https://www.newsweek.com/donald-trump-popularity-canada-polls-election-2065088,2025-04-28T15:03:14,0,Ironman650,24,How_Popular_Is_Donal---20250428_150314
Trump to sign Executive Order mandating truckers speak English,https://abc3340.com/news/nation-world/trump-to-sign-executive-order-mandating-truckers-speak-english,2025-04-28T15:02:29,130,Rock-n-roll-Kevin,178,Trump_to_sign_Execut---20250428_150229
"Musk, companies could avoid $2 billion in potential liability over DOGE role: Report",https://thehill.com/policy/technology/5271301-elon-musk-government-liability/,2025-04-28T14:55:55,72,kinamieu,11,"Musk,_companies_coul---20250428_145555"
Michelle Obama: Biggest ‘fear’ is Trump’s deportation policy,https://thehill.com/blogs/in-the-know/5271514-michelle-obama-trump-deportation-policy-immigrants-southern-border/,2025-04-28T14:53:46,125,someopinionthatsr,17,Michelle_Obama__Bigg---20250428_145346
"Polls Show Most Voters Dissatisfied With Trump’s First 100 Days, Describing Them as “Chaotic” and “Scary”",https://truthout.org/articles/polls-show-most-view-trumps-first-100-days-as-chaotic-and-scary/,2025-04-28T14:46:42,549,Lotus532,24,Polls_Show_Most_Vote---20250428_144642
Trump to Sign Order Requiring Nationwide List of Sanctuary Cities and States,https://www.wsj.com/politics/policy/trump-to-sign-order-requiring-nationwide-list-of-sanctuary-cities-and-states-dbcc5ada?st=RqruAA&reflink=desktopwebshare_permalink,2025-04-28T14:46:22,86,Plaintalks,28,Trump_to_Sign_Order_---20250428_144622
Trump promised peace but brings rapid increase in civilian casualties to Yemen,https://www.theguardian.com/world/2025/apr/28/us-escalation-yemen-civilian-casualties,2025-04-28T14:46:19,68,pharrt,6,Trump_promised_peace---20250428_144619
The FBI mistakenly raided her Atlanta home. Now the Supreme Court will hear her lawsuit,https://www.latimes.com/world-nation/story/2025-04-27/na-fbi-raid-atlanta-supreme-court,2025-04-28T14:45:46,79,aslan_is_on_the_move,9,The_FBI_mistakenly_r---20250428_144546
Slotkin Panned Online After Claiming That Voters Don't Know What 'Oligarchy' Means,https://www.commondreams.org/news/us-is-an-oligarchy,2025-04-28T14:44:33,82,soalone34,73,Slotkin_Panned_Onlin---20250428_144433
"Musk’s DOGE cuts helped his companies avoid over $2 billion in legal liabilities, new Senate report alleges",https://www.cnbc.com/2025/04/28/elon-musk-doge-trump-legal-liabilities-senate-democrats.html,2025-04-28T14:40:55,4398,Aakash7aak,81,Musk’s_DOGE_cuts_hel---20250428_144055
Trump says Columbus Day will now just be Columbus Day,https://apnews.com/article/trump-columbus-indigenous-peoples-day-biden-ee34f1873a9af8ea85ac732b9edf82fc,2025-04-28T14:35:37,0,Hanginon,47,Trump_says_Columbus_---20250428_143537
"Trump's Navy Secretary Keeps Flubbing The Date Of Pearl Harbor John Phelan, an investor and Trump donor, has never served in the military.",https://www.huffpost.com/entry/navy-secretary-john-phelan-pearl-harbor_n_680fb59be4b0694adc18c581,2025-04-28T14:33:40,686,brithus,81,Trump's_Navy_Secreta---20250428_143340
White House Says Suspending Writ of Habeas Corpus To Speed Up Mass Deportations Is Open to Discussion,https://www.nysun.com/article/white-house-says-suspending-writ-of-habeas-corpus-to-speed-up-mass-deportations-is-open-to-discussion?member_gift=CUZ5qwd3crq4pmz-xrd,2025-04-28T14:33:15,6025,TheNewYorkSun,429,White_House_Says_Sus---20250428_143315
Trump Threatens News Orgs That Published Unflattering Polls,https://www.businessinsider.com/trump-threats-polls-news-60-minutes-paramount-nyt-2025-4,2025-04-28T14:29:54,118,tayefh,25,Trump_Threatens_News---20250428_142954
Trump thinks beleaguered Pete Hegseth is ‘gonna get his act together’,https://www.independent.co.uk/news/world/americas/us-politics/trump-hegseth-atlantic-signal-b2740951.html,2025-04-28T14:27:26,43,BreakfastTop6899,37,Trump_thinks_beleagu---20250428_142726
Maga’s sinister obsession with IQ is leading us towards an inhuman future,https://www.theguardian.com/commentisfree/2025/apr/28/maga-iq-inhuman-future-intelligence-ai,2025-04-28T14:18:41,65,harsh2k5,51,Maga’s_sinister_obse---20250428_141841
"Temu adds 'import charges' of about 145% after Trump tariffs, more than doubling price of many items",https://www.cnbc.com/2025/04/28/temu-adds-import-charges-after-trump-tariffs.html,2025-04-28T14:11:30,329,IWantPizza555,47,Temu_adds_'import_ch---20250428_141130
Majority of US Voters Support Third Trump Impeachment: Poll,https://www.commondreams.org/news/trump-impeachment-2025,2025-04-28T14:10:02,35892,Murky-Site7468,974,Majority_of_US_Voter---20250428_141002
"Chinese freight ship traffic to busiest U.S. ports, Los Angeles, Long Beach, sees steep drop",https://www.cnbc.com/2025/04/22/busiest-us-ports-see-big-drop-in-chinese-freight-vessel-traffic.html,2025-04-28T14:06:20,140,HeHateMe337,17,Chinese_freight_ship---20250428_140620
"International students are rethinking U.S. study plans amid visa policy shifts, experts say",https://www.cnbc.com/2025/04/28/international-students-rethinking-us-college-plans-amid-visa-policy-shift.html,2025-04-28T14:02:34,170,Puginator,9,International_studen---20250428_140234
"China insists no tariff talks underway with Trump and Xi or top aides, despite U.S. claims",https://www.cnbc.com/2025/04/28/trump-xi-tariffs-china-bessent.html,2025-04-28T14:01:15,98,Puginator,20,China_insists_no_tar---20250428_140115
"Poll shows young vets unhappy with Signal leak, federal program cuts",https://www.armytimes.com/veterans/2025/04/28/poll-shows-young-vets-unhappy-with-signal-leak-federal-program-cuts/,2025-04-28T13:54:04,460,Ok-Lets-Talk-It-Out,33,Poll_shows_young_vet---20250428_135404
"CDPAP caregivers sue PPL, claiming weeks of underpayment",https://www.news10.com/news/ny-news/cdpap-caregivers-sue-ppl-claiming-weeks-of-underpayment/,2025-04-28T13:50:52,12,news-10,1,CDPAP_caregivers_sue---20250428_135052
"Trump vowed to end the Ukraine war in 24 hours, but the conflict still rages",https://www.nbcnews.com/politics/politics-news/trump-vowed-end-ukraine-war-24-hours-conflict-still-rages-rcna203085,2025-04-28T13:48:01,126,Somervilledrew,18,Trump_vowed_to_end_t---20250428_134801
Treasury Secretary Admits Trump Is Nowhere Close to China Trade Deal,https://newrepublic.com/post/194494/trump-treasury-secretary-china-tariffs-deal,2025-04-28T13:46:28,923,mmccxi,72,Treasury_Secretary_A---20250428_134628
Congressman Shri Thanedar Introduces Articles of Impeachment Against President Donald J. Trump for High Crimes and Misdemeanors,https://thanedar.house.gov/media/press-releases/congressman-shri-thanedar-introduces-articles-of-impeachment-against-president-donald-j-trump-for-high-crimes-and-misdemeanors,2025-04-28T13:35:19,62954,OkayButFoRealz,1624,Congressman_Shri_Tha---20250428_133519
"Empty shelves, trucking layoffs lead to a summer recession in Apollo's shocking trade fight timeline",https://www.cnbc.com/2025/04/28/empty-shelves-trucking-layoffs-lead-to-recession-in-apollos-trade-war-timeline.html,2025-04-28T13:32:31,125,mymomknowsyourmom,38,"Empty_shelves,_truck---20250428_133231"
DOGE employees gain accounts on classified networks holding nuclear secrets,https://www.npr.org/2025/04/28/nx-s1-5378684/doge-energy-department-nuclear-secrets-access?renderplatform=nprone_ios&unified=true,2025-04-28T13:31:12,114,Healthy_Block3036,11,DOGE_employees_gain_---20250428_133112
"Pierre Poilievre: Trump, stay out of our elections",https://www.telegraph.co.uk/us/politics/2025/04/28/pierre-poilievre-trump-stay-out-our-elections-canada/,2025-04-28T13:28:18,49,ObligationAware3755,18,Pierre_Poilievre__Tr---20250428_132818
DOGE employees gain accounts on classified networks holding nuclear secrets,http://npr.org/2025/04/28/nx-s1-5378684/doge-energy-department-nuclear-secrets-access,2025-04-28T13:23:48,159,zrv8psgOS9AiWK6ugbt2,19,DOGE_employees_gain_---20250428_132348
DOGE employees gain accounts on classified networks holding nuclear secrets,https://www.npr.org/2025/04/28/nx-s1-5378684/doge-energy-department-nuclear-secrets-access,2025-04-28T13:19:55,928,IWantPizza555,70,DOGE_employees_gain_---20250428_131955
Trump to sign executive order to target sanctuary cities,https://thehill.com/homenews/administration/5270765-trump-executive-order-sanctuary-cities/,2025-04-28T13:18:04,69,Dapper-Condition6041,21,Trump_to_sign_execut---20250428_131804
Today’s Canadian elections are most important in decades — thanks to Trump,https://www.vox.com/today-explained-newsletter/410644/canada-elections-carney-poilievre-liberals-conservatives-win-results-trump,2025-04-28T13:17:57,54,ObligationAware3755,9,Today’s_Canadian_ele---20250428_131757
White House press secretary suggests Trump played role in quarterback Shedeur Sanders getting drafted,https://www.politico.com/news/2025/04/28/trump-shadeur-sanders-nfl-draft-00313134,2025-04-28T13:14:13,7,ShreckAndDonkey123,40,White_House_press_se---20250428_131413
Marco Rubio claims Canada should be 51st state as PM told Trump they ‘couldn’t survive’ without U.S.,https://www.independent.co.uk/news/world/americas/us-politics/marco-rubio-trump-canada-51st-state-b2740453.html,2025-04-28T13:08:43,81,ObligationAware3755,60,Marco_Rubio_claims_C---20250428_130843
Rubio reiterates Trump's view that Canada 'would be better off' as a US state,https://www.usatoday.com/story/news/politics/2025/04/27/trump-canada-election-prime-minister-marco-rubio/83319079007/,2025-04-28T13:05:51,24,timetogetoutside100,37,Rubio_reiterates_Tru---20250428_130551
"MyPillow CEO Mike Lindell’s legal team accused of submitting inaccurate, AI-generated brief to Colorado court",https://www.wavy.com/news/national/mypillow-ceo-mike-lindells-legal-team-accused-of-submitting-inaccurate-ai-generated-brief-to-colorado-court/amp/,2025-04-28T13:03:34,107,InclineBeach,10,MyPillow_CEO_Mike_Li---20250428_130334
Justice Department Guts Voting Rights Unit: Report,https://www.rollingstone.com/politics/politics-news/justice-department-guts-voting-rights-unit-1235326589/,2025-04-28T13:03:25,115,rollingstone,9,Justice_Department_G---20250428_130325
Philadelphia Eagles QB Jalen Hurts skips team’s visit to Trump White House,https://www.msnbc.com/top-stories/latest/philadelphia-eagles-jalen-hurts-skips-trump-white-house-rcna203359,2025-04-28T13:03:10,9762,ansyhrrian,367,Philadelphia_Eagles_---20250428_130310
"Donald Trump Says He Runs the Country and the World, But He Still Answers Calls From Unknown Numbers",https://www.vanityfair.com/news/story/donald-trump-the-atlantic,2025-04-28T13:01:31,151,vanityfairmagazine,22,Donald_Trump_Says_He---20250428_130131
Younger Generations Are Ditching Both The Democratic And Republican Party As Polarization Keeps Rising: Poll,https://www.latintimes.com/younger-generations-are-ditching-both-democratic-republican-party-polarization-keeps-rising-poll-581821,2025-04-28T13:01:29,73,IndependentRegion104,134,Younger_Generations_---20250428_130129
RFK Jr. to End 'Godsend' Narcan Program That Helped Reduce Overdose Deaths Despite His Past Heroin Addiction,https://www.latintimes.com/rfk-jr-end-godsend-narcan-program-that-helped-reduce-overdose-deaths-despite-his-past-heroin-581846,2025-04-28T12:49:43,25254,PostHeraldTimes,1284,RFK_Jr._to_End_'Gods---20250428_124943
I’m a Conservative Economist. Here Are 6 Reasons Trump’s Plans Won’t Work.,https://www.politico.com/news/magazine/2025/04/28/trump-economic-plans-reality-check-00309673?fbclid=PAZXh0bgNhZW0CMTEAAac4rzK3f54OvdenamfyvkDahAmqp_IcE9tVatUJWvwJ08Grz4EpXcxNEBOQqQ_aem_FPqYFt-w61Ie9hImTqL0LA,2025-04-28T12:47:30,83,j_michel,20,I’m_a_Conservative_E---20250428_124730
Connolly stepping down as top Democrat on Oversight Committee,https://www.axios.com/2025/04/28/gerry-connolly-house-oversight-committee-cancer,2025-04-28T12:45:08,67,MicCheckTapTapTap,29,Connolly_stepping_do---20250428_124508
Trump offers a private dinner to his biggest memecoin buyers,https://www.theverge.com/cryptocurrency/656700/trump-contest-meme-coin,2025-04-28T12:39:44,44,MaximusDM22,22,Trump_offers_a_priva---20250428_123944
A YIMBY Theory of Power | Pro-housing advocates offer an analysis of class relations that is more sophisticated and has more explanatory power than the one held by many critics of the “abundance agenda.”,https://www.thenation.com/article/society/yimby-abundance-power-housing/,2025-04-28T12:35:55,11,SpaceElevatorMusic,4,A_YIMBY_Theory_of_Po---20250428_123555
David Hogg challenges Democrats' 'ineffective' old guard,https://theweek.com/politics/david-hogg-challenges-democrat-incumbents,2025-04-28T12:31:32,1193,DevinGraysonShirk,242,David_Hogg_challenge---20250428_123132
Joe Biden: Pope Francis stood for compassion as others embraced cruelty. May mercy be his legacy (opinion piece for USA Today),https://www.usatoday.com/story/opinion/2025/04/28/pope-francis-joe-biden-mercy/83316390007/,2025-04-28T12:30:07,548,Julian81295,18,Joe_Biden__Pope_Fran---20250428_123007
Bernie Sanders torches Senate Democrat Elissa Slotkin: Americans aren’t ‘dumb’ and know what ‘oligarchy’ means,https://www.independent.co.uk/news/world/americas/us-politics/bernie-sanders-oligarchy-elissa-slotkin-b2740428.html,2025-04-28T12:28:47,623,Rick_McCrawfordler,75,Bernie_Sanders_torch---20250428_122847
Pete Hegseth’s Orwellian purge leaves US military academies less free,https://www.salon.com/2025/04/28/pete-hegseths-orwellian-purge-leaves-us-military-academies-less-free/,2025-04-28T12:24:26,260,j_michel,10,Pete_Hegseth’s_Orwel---20250428_122426
"Trump's poll numbers are so abysmal he's crying ""fraud""",https://www.salon.com/2025/04/28/poll-numbers-are-so-abysmal-hes-crying-fraud/,2025-04-28T12:23:55,6736,j_michel,216,Trump's_poll_numbers---20250428_122355
Antisemitism reaches 45-year high in US. It’s ‘the canary in the coal mine.’,https://www.csmonitor.com/The-Culture/Faith-Religion/2025/0425/antisemitism-adl-report-gaza-trump-administration,2025-04-28T12:23:47,0,aslan_is_on_the_move,69,Antisemitism_reaches---20250428_122347
"Most Americans don't think DOGE has actually cut government waste, poll says",https://www.businessinsider.com/trump-musk-doge-government-waste-fraud-poll-2025-4?utm_source=reddit&utm_medium=social&utm_campaign=insider-politics-sub-post,2025-04-28T12:22:11,1340,thisisinsider,45,Most_Americans_don't---20250428_122211
Trump needs unity among Republicans to pass his budget bill. Can he get it?,https://www.npr.org/2025/04/28/g-s1-62678/trump-needs-unity-among-republicans-to-pass-his-budget-bill-can-he-get-it,2025-04-28T12:19:16,10,SpaceElevatorMusic,8,Trump_needs_unity_am---20250428_121916
Taking Stock of the Biden Presidency,https://www.currentaffairs.org/news/taking-stock-of-the-biden-presidency,2025-04-28T12:18:42,0,curraffairs,9,Taking_Stock_of_the_---20250428_121842
Don Jr. and Eric Trump Stand to Make a $9.6 Million Windfall for 10 Weeks of Work on an Advisory Board,https://www.esquire.com/news-politics/politics/a64609771/don-jr-eric-trump-sec-filing-stocks-dominari-holdings/,2025-04-28T12:14:41,801,Esquire,92,Don_Jr._and_Eric_Tru---20250428_121441
"Fetterman, Duckworth, Colleagues Condemn Trump Administration Ban on Trans Military Service",https://www.fetterman.senate.gov/fetterman-duckworth-colleagues-condemn-trump-administration-ban-on-trans-military-service/,2025-04-28T12:10:44,71,aslan_is_on_the_move,19,"Fetterman,_Duckworth---20250428_121044"
Trump: ‘I run the country and the world’,https://thehill.com/homenews/administration/5270899-trump-i-run-the-country-and-the-world/,2025-04-28T12:06:41,98,someopinionthatsr,124,Trump__‘I_run_the_co---20250428_120641
Trump: Town hall ‘disruptors’ should be ‘immediately ejected’,https://thehill.com/homenews/administration/5270384-trump-town-hall-disruptors-should-be-immediately-ejected/,2025-04-28T12:03:24,63,Silent-Resort-3076,71,Trump__Town_hall_‘di---20250428_120324
More than 100 migrants were detained during a raid on a Colorado nightclub. Here’s what we know,https://www.cnn.com/2025/04/28/us/colorado-springs-raid-monday/index.html,2025-04-28T11:53:52,50,BigFishPub,14,More_than_100_migran---20250428_115352
"Trump on Iran: ‘If we don’t make a deal, I’ll be leading the pack’ into war",https://forward.com/fast-forward/715711/trump-on-iran-if-we-dont-make-a-deal-ill-be-leading-the-pack-into-war/,2025-04-28T11:51:52,43,SAJ-13,78,Trump_on_Iran__‘If_w---20250428_115152
"Three U.S. Citizen Children, Including 4-Year-Old Battling 4th Stage Cancer, Deported to Honduras",https://www.democracynow.org/2025/4/28/us_citizen_children_expelled_from_country,2025-04-28T11:49:01,218,ZuP,21,Three_U.S._Citizen_C---20250428_114901
Agriculture isn't nearing trade war tariffs crisis — 'it is a full-blown crisis already' farmers say,https://www.nbcnews.com/business/economy/agriculture-isnt-nearing-trade-war-tariffs-crisis-full-blown-crisis-al-rcna203309,2025-04-28T11:47:54,115,nbcnews,22,Agriculture_isn't_ne---20250428_114754
"Trump suggests Canadians should elect him, making the country the 51st state",https://abcnews.go.com/Politics/trump-suggests-canadians-elect-making-country-51st-state/story?id=121241461,2025-04-28T11:44:19,85,Creative-Category-60,59,Trump_suggests_Canad---20250428_114419
"'Yes, I will': O’Rourke says he’ll run for Senate if Texans want him to",https://www.chron.com/politics/article/beto-o-rourke-senate-race-20298042.php,2025-04-28T11:44:07,130,chrondotcom,66,"'Yes,_I_will'__O’Rou---20250428_114407"
What has DOGE done in Trump's first 100 days?,https://www.npr.org/2025/04/28/nx-s1-5377445/doge-musk-trump-100-days,2025-04-28T11:35:18,36,SpaceElevatorMusic,15,What_has_DOGE_done_i---20250428_113518
Trump says he’ll eliminate income taxes. There’s a problem with that,https://www.cnn.com/2025/04/28/business/taxes-trump-tariffs/index.html,2025-04-28T11:29:31,140,Da_Fish,76,Trump_says_he’ll_eli---20250428_112931
AG Pam Bondi reverses Biden-era media protections in leak investigations,https://www.msnbc.com/rachel-maddow-show/maddowblog/ag-pam-bondi-reverses-biden-era-media-protections-leak-investigations-rcna203271?icid=nextpost_bot,2025-04-28T11:29:14,117,jackytheblade,8,AG_Pam_Bondi_reverse---20250428_112914
Trump-China tariff war: Who’s winning so far?,https://www.aljazeera.com/news/2025/4/28/trump-china-tariff-war-whos-winning-so-far,2025-04-28T11:27:04,3,gradientz,16,Trump-China_tariff_w---20250428_112704
Former Social Security Chief Martin O’Malley Warns of “Collapse of the Entire System” Under Trump,https://www.democracynow.org/2025/4/28/martin_omalley_social_security,2025-04-28T11:25:37,1998,ZuP,81,Former_Social_Securi---20250428_112537
"On air, ‘60 Minutes’ reporter says ‘none of us is happy’ about changes that led top producer to quit",https://apnews.com/article/cbs-trump-60-minutes-pelley-ce93eec7f2dc9c9c72f2d598f6bdf816,2025-04-28T11:17:51,436,SpaceElevatorMusic,19,"On_air,_‘60_Minutes’---20250428_111751"
"DOGE orders major cut to AmeriCorps funding, imperiling agency’s work",https://www.washingtonpost.com/nation/2025/04/25/americorps-grant-cuts-doge/,2025-04-28T11:16:56,59,Elegant_Plate6640,8,DOGE_orders_major_cu---20250428_111656
"In Trump-voting Iowa, farmers have started to shout at each other",https://www.thetimes.com/us/american-politics/article/iowa-republican-trump-vote-election-polls-v6w8n30v8,2025-04-28T11:06:30,5473,TimesandSundayTimes,449,In_Trump-voting_Iowa---20250428_110630
Trump’s first 100 days are the worst for the stock market since Nixon,https://www.cnbc.com/2025/04/28/trumps-first-100-days-are-the-worst-for-the-stock-market-since-nixon.html,2025-04-28T11:06:23,225,gradientz,11,Trump’s_first_100_da---20250428_110623
Ice seeking out unaccompanied immigrant children to deport or prosecute them,https://www.theguardian.com/us-news/2025/apr/28/ice-unaccompanied-immigrant-children,2025-04-28T11:03:52,87,pharrt,17,Ice_seeking_out_unac---20250428_110352
Far-right fight groups endorse ‘youth clubs’ targeting US young men and boys,https://www.theguardian.com/us-news/2025/apr/28/active-youth-clubs-neo-nazi-groups,2025-04-28T11:03:17,133,Somervilledrew,37,Far-right_fight_grou---20250428_110317
Trump Makes Chilling “Joke” About Third Term Rumors,https://newrepublic.com/post/194474/trump-comment-third-term,2025-04-28T11:03:04,68,harsh2k5,33,Trump_Makes_Chilling---20250428_110304
I’m a conservative economist.  Here are 6 reasons Trump’s plans won’t work.,https://www.politico.com/news/magazine/2025/04/28/trump-economic-plans-reality-check-00309673,2025-04-28T10:59:40,160,APGovAPEcon,36,I’m_a_conservative_e---20250428_105940
Kamala Harris plans scathing critique of Trump in first major speech since leaving office,https://www.latimes.com/politics/story/2025-04-28/former-vice-president-kamala-trump-wednesday-san-francisco,2025-04-28T10:58:30,223,DevinGraysonShirk,98,Kamala_Harris_plans_---20250428_105830
