Title,URL,Date,Score,Author,num_comments,identifier
"Mothers deported by Trump ‘denied’ chance to transfer custody of children, lawyer says",https://www.theguardian.com/us-news/2025/apr/28/women-children-citizens-deported-honduras,2025-04-29T10:08:10,1,MystikSpiralx,1,Mothers_deported_by_---20250429_100810
Union Workers turn on Trump tariffs: 'Direct attack on the working class',https://www.newsweek.com/union-workers-turn-trump-tariffs-2065456,2025-04-29T10:04:00,16,Silly-avocatoe,7,Union_Workers_turn_o---20250429_100400
It’s President Trump’s 100th day in office. We are journalists from six newsrooms reporting extensively on the new administration. Ask us anything.,https://www.reddit.com/r/politics/comments/1kaq1eq/its_president_trumps_100th_day_in_office_we_are/,2025-04-29T10:00:19,12,yahoonews,8,It’s_President_Trump---20250429_100019
"White House Says Trump Has Added 345,000 Jobs in First 100 Days: Live Updates",https://www.newsweek.com/donald-trump-administration-100-days-office-live-updates-2065529,2025-04-29T10:00:04,0,madcowga,11,White_House_Says_Tru---20250429_100004
Amazon denies report that it plans to show tariff impacts on its prices,https://www.engadget.com/big-tech/amazon-denies-report-that-it-plans-to-show-tariff-impacts-on-its-prices-144320278.html,2025-04-29T09:59:04,1,pcthrowaway35,4,Amazon_denies_report---20250429_095904
"The most consequential, damaging, head-scratching things Trump did in his first 100 days.",https://www.politico.com/news/magazine/2025/04/29/trump-first-100-days-reporter-roundtable-00309408,2025-04-29T09:56:37,7,Sitting_in_a_tree_,2,The_most_consequenti---20250429_095637
These 4 tech billionaires who attended or donated to Trump's inauguration lost $194 billion in his first 100 days,https://www.businessinsider.com/tech-billionaires-wealth-dropped-trump-100-days-inauguration-2025-4?utm_source=reddit&utm_medium=social&utm_campaign=insider-politics-sub-post,2025-04-29T09:55:22,24,thisisinsider,12,These_4_tech_billion---20250429_095522
Elon Musk’s DOGE Promised Budget Cuts but Spending Is Up $171 Billion Over Prior Years,https://www.nysun.com/article/elon-musks-doge-promised-budget-cuts-but-spending-is-up-171-billion-over-prior-years?member_gift=CUZ5qwd3crq4pmz-xrd,2025-04-29T09:46:22,43,TheNewYorkSun,10,Elon_Musk’s_DOGE_Pro---20250429_094622
"RFK Jr., your family fought for disability rights. Why won’t you? | Opinion",https://www.pennlive.com/opinion/2025/04/rfk-jr-your-family-fought-for-disability-rights-why-wont-you-opinion.html?utm_medium=social&utm_source=redditsocial&utm_campaign=redditor,2025-04-29T09:40:02,37,pennlive,13,"RFK_Jr.,_your_family---20250429_094002"
DOGE cuts to Americorps ‘a devastating blow to the state of Wyoming’,https://wyofile.com/doge-cuts-to-americorps-a-devastating-blow-to-the-state-of-wyoming/,2025-04-29T09:38:41,32,WyoFileNews,11,DOGE_cuts_to_Americo---20250429_093841
White House rips ‘hostile and political’ move by Bezos’ Amazon to display how much costs are for tariffs.,https://www.the-independent.com/news/world/americas/us-politics/amazon-tariff-prices-trump-response-b2741552.html,2025-04-29T09:35:40,47,CrackHeadRodeo,53,White_House_rips_‘ho---20250429_093540
Trump brags that he hurt MAGA ally Pierre Poilievre in Canada election — as Liberals grab win,https://www.independent.co.uk/news/world/americas/donald-trump-pierre-poilievre-canada-eletions-b2741230.html,2025-04-29T09:34:40,56,ObligationAware3755,19,Trump_brags_that_he_---20250429_093440
"Secret Deals, Foreign Investments, Presidential Policy Changes: The Rise of Trump’s Crypto Firm",https://www.nytimes.com/2025/04/29/us/politics/trump-crypto-world-liberty-financial.html?unlocked_article_code=1.DU8.kFj6.g1Zw6cQyfVRl&smid=re-share,2025-04-29T09:32:41,17,dheber,10,"Secret_Deals,_Foreig---20250429_093241"
"Over 200 lawsuits, 142 executive orders, and 24 days golfing: Trump’s first 100 days by the numbers",https://www.independent.co.uk/news/world/americas/us-politics/trump-100-days-executive-order-numbers-b2739113.html,2025-04-29T09:31:56,34,theindependentonline,15,"Over_200_lawsuits,_1---20250429_093156"
The US Is Letting Putin String It Along in Ukraine,https://www.bloomberg.com/opinion/articles/2025-04-29/ukraine-trump-is-choosing-to-get-tapped-along-by-putin?accessToken=eyJhbGciOiJIUzI1NiIsInR5cCI6IkpXVCJ9.eyJzb3VyY2UiOiJTdWJzY3JpYmVyR2lmdGVkQXJ0aWNsZSIsImlhdCI6MTc0NTkzNzA0MiwiZXhwIjoxNzQ2NTQxODQyLCJhcnRpY2xlSWQiOiJTVkhISkVUMEcxS1cwMCIsImJjb25uZWN0SWQiOiI0QjlGNDMwQjNENTk0MkRDQTZCOUQ5MzcxRkE0OTU1NiJ9.4O1db_pPT7-R2DeVhfAsaF2vAqOowZaClPTlfgPqBM0,2025-04-29T09:31:04,21,bloombergopinion,7,The_US_Is_Letting_Pu---20250429_093104
"UPS to cut 20,000 jobs on likely lower Amazon shipments, profit beats estimates",https://www.cnbc.com/2025/04/29/united-parcel-service-ups-q1-earnings.html,2025-04-29T09:29:15,41,IWantPizza555,9,"UPS_to_cut_20,000_jo---20250429_092915"
There's a New Fool-Proof Republican Strategy For Getting Out of Any Policy That Helps Non-White Citizens,https://www.esquire.com/news-politics/politics/a64613891/dei-policies-canceled-alabama-sewage-system/,2025-04-29T09:28:03,11,Esquire,7,There's_a_New_Fool-P---20250429_092803
"Trump administration's support for Massapequa mascot could trigger legal fight, experts say",https://gothamist.com/news/trump-administrations-support-for-massapequa-mascot-could-trigger-legal-fight-experts-say,2025-04-29T09:27:58,4,GothamistWNYC,3,Trump_administration---20250429_092758
MAGA Conspiracy Theorist Turns On Trump's 'Unconstitutional' Deportation Methods: 'It's Way More Dangerous',https://www.latintimes.com/maga-conspiracy-theorist-turns-trumps-unconstitutional-deportation-methods-its-way-more-581900,2025-04-29T09:27:51,31,PostHeraldTimes,12,MAGA_Conspiracy_Theo---20250429_092751
"Amazon listing tariff prices is a 'hostile and political act,' White House says",https://www.usatoday.com/story/news/politics/2025/04/29/amazon-tariff-costs-trump-white-house/83340801007/,2025-04-29T09:27:36,27,DevinGraysonShirk,28,Amazon_listing_tarif---20250429_092736
Trump’s Poll Numbers Have Plummeted and He’s Not Taking It Well at All,https://www.esquire.com/news-politics/politics/a64612771/trump-approval-rating-lowest-decades/,2025-04-29T09:26:56,30,Esquire,12,Trump’s_Poll_Numbers---20250429_092656
'Nowhere to turn': Small businesses dependent on imports from China are feeling more desperate,https://apnews.com/article/china-tariffs-small-business-economy-imports-7bc7a0d07ddac551b3b24a5e477ccb0c,2025-04-29T09:23:29,13,YesterShill,6,'Nowhere_to_turn'__S---20250429_092329
Homan defends deporting US citizen children,https://www.cnn.com/2025/04/28/politics/video/homan-us-citizen-children-deported-digvid,2025-04-29T09:20:38,17,Ok_Birthday6468,9,Homan_defends_deport---20250429_092038
America gives Trump an F: More voters pick failing grade than any other for his first 100 days,https://www.independent.co.uk/news/world/americas/us-politics/donald-trump-poll-approval-rating-b2741550.html,2025-04-29T09:20:22,33,WontThinkStraight,8,America_gives_Trump_---20250429_092022
‘This is a hostile and political act’: White House slams Amazon amid tariff standoff,https://www.politico.com/news/2025/04/29/tariff-amazon-donald-trump-00315053,2025-04-29T09:15:23,50,TampontheBludThirsty,48,‘This_is_a_hostile_a---20250429_091523
"Most take Trump’s Canada, Greenland and third-term ideas seriously — and oppose them, poll finds",https://www.washingtonpost.com/politics/2025/04/29/trump-poll-canada-greenland-third-term/,2025-04-29T09:13:14,37,Tremenda-Carucha,5,Most_take_Trump’s_Ca---20250429_091314
'It's unlike anything we have seen before': European Union left reeling after Trump's first 100 days,https://www.cnbc.com/2025/04/29/european-union-left-reeling-after-donald-trumps-first-100-days.html,2025-04-29T09:11:30,34,avid-learner-bot,5,'It's_unlike_anythin---20250429_091130
‘America today is starting to feel like Europe in the 1930s’: Mass. lawmakers condemn Trump’s first 100 days in office,https://www.bostonglobe.com/2025/04/28/metro/massachusetts-senate-trump-100-days-immigration-congress/?s_campaign=audience:reddit,2025-04-29T09:09:48,60,bostonglobe,8,‘America_today_is_st---20250429_090948
"UPS says it's cutting 20,000 jobs amid reduction in Amazon shipments",https://www.cbsnews.com/news/ups-job-cuts-layoffs-amazon-shipments-stock-price/?linkId=808221052,2025-04-29T09:06:28,74,TSHRED56,26,UPS_says_it's_cuttin---20250429_090628
Trump 100 days: delusions of monarchy coupled with fundamental ineptitude | Donald Trump,https://www.theguardian.com/us-news/2025/apr/29/trump-100-days-doge-trade-wars-economy,2025-04-29T09:03:55,38,dheber,3,Trump_100_days__delu---20250429_090355
White House calls Amazon ‘hostile’ after report says it will label tariff price hikes,https://www.theverge.com/news/657807/trump-amazon-tariff-hostile-pricing,2025-04-29T09:00:42,130,theverge,47,White_House_calls_Am---20250429_090042
"Despite Trump's promised cuts, U.S. spent about $220 billion more in first 100 days than last year",https://www.cbsnews.com/news/trump-promised-cuts-spent-200-billion-more/,2025-04-29T08:57:49,112,CBSnews,15,Despite_Trump's_prom---20250429_085749
‘Things better change’: Arizona voters express reservations about Trump’s first 100 days,https://www.cnn.com/2025/04/28/politics/arizona-voters-trump-presidency/index.html,2025-04-29T08:53:07,26,nosotros_road_sodium,11,‘Things_better_chang---20250429_085307
"After 100 days, Trump’s presidency feels like a vengeful monarchy",https://www.thetimes.com/us/american-politics/article/after-100-days-trumps-presidency-feels-like-a-vengeful-monarchy-69r5hqj89?utm_medium=Social&utm_source=Reddit#Echobox=1745934626,2025-04-29T08:50:39,52,TimesandSundayTimes,7,"After_100_days,_Trum---20250429_085039"
"We’re all from D.C. in MAGA world, no matter where we live",https://www.thebaltimorebanner.com/opinion/column/district-of-columbia-jamie-raskin-retrocession-WP6NWHGVNFBVVN3G7CGPMJEIDE/,2025-04-29T08:49:28,9,baltimorebanner,3,We’re_all_from_D.C._---20250429_084928
White House Calls Amazon ‘Hostile’ for Reported Tariff Displays,https://www.bloomberg.com/news/articles/2025-04-29/white-house-calls-amazon-hostile-for-reported-tariff-displays?sref=xuVirdpv,2025-04-29T08:49:19,74,bloomberg,28,White_House_Calls_Am---20250429_084919
White House blasts Amazon over tariff cost report: 'Hostile and political act',https://www.cnbc.com/2025/04/29/white-house-blasts-amazon-over-tariff-cost-report-hostile-and-political-act.htm,2025-04-29T08:48:46,28,JamaalJalon,19,White_House_blasts_A---20250429_084846
"Trump will sign an executive order on auto industry tariffs today, White House says",https://www.cbc.ca/news/business/trump-reduce-auto-tariffs-1.7521474,2025-04-29T08:47:22,10,MagicBingo,12,Trump_will_sign_an_e---20250429_084722
Trump's first 'new media' briefing hosts influencer who spent 7 days convinced the moon had disappeared,https://www.dailydot.com/debug/kambree-nelson-moon-white-house-press-briefing/,2025-04-29T08:45:36,37,dailydot,24,Trump's_first_'new_m---20250429_084536
"Congress passes Take It Down Act to fight deepfake nudes, revenge porn",https://www.washingtonpost.com/technology/2025/04/28/congress-deepfake-revenge-porn-law/?utm_campaign=wp_main&utm_medium=social&utm_source=reddit.com,2025-04-29T08:43:36,5,washingtonpost,8,Congress_passes_Take---20250429_084336
FCC commissioner: Trump on a mission to ‘censor and control’ media,https://thehill.com/homenews/media/5272508-fcc-commissioner-trump-media-paramount-cbs-news/,2025-04-29T08:41:12,53,Creasy007,5,FCC_commissioner__Tr---20250429_084112
White House: Amazon tariff price announcement is hostile,https://www.reuters.com/business/retail-consumer/white-house-amazon-tariff-price-announcement-is-hostile-2025-04-29/,2025-04-29T08:38:31,193,ElfegoBaca,128,White_House__Amazon_---20250429_083831
How One Family Aims to Break Liberals' Corporate Voting Power,https://www.bloomberg.com/news/articles/2025-04-29/how-conservative-activists-empower-investors-for-shareholder-meeting-votes,2025-04-29T08:36:46,0,bloomberg,6,How_One_Family_Aims_---20250429_083646
"Trump's first 100 days: 60% of Latino voters think U.S. is headed in wrong direction, new poll finds",https://www.cbsnews.com/news/trumps-first-100-days-latino-voters-disapprove-economy/,2025-04-29T08:34:46,29,CBSnews,38,Trump's_first_100_da---20250429_083446
This Is Why So Many Immigrants Are Ending Up Detained in Louisiana,https://www.nytimes.com/2025/04/29/opinion/immigrants-louisiana-ice-detention.html,2025-04-29T08:34:27,25,Naurgul,7,This_Is_Why_So_Many_---20250429_083427
Trump Marks 100 Days In Office With A Tanking Economy And Approval Rating,https://www.huffpost.com/entry/trump-100-days-in-office_n_6810a6cde4b075cd646d2bc7?utm_medium=Social&utm_source=reddit&utm_campaign=us_main,2025-04-29T08:31:40,59,huffpost,8,Trump_Marks_100_Days---20250429_083140
Trump Marks 100 Days In Office With A Tanking Economy And Approval Rating,https://www.huffpost.com/entry/trump-100-days-in-office_n_6810a6cde4b075cd646d2bc7,2025-04-29T08:31:14,31,Boonzies,4,Trump_Marks_100_Days---20250429_083114
'Absolutely outraged': Former cyber official targeted by Trump speaks out after cuts to U.S. digital defense,https://www.nbcnews.com/politics/national-security/chris-krebs-speaks-cuts-trump-cuts-digital-defense-rcna203427,2025-04-29T08:30:48,49,Tuna_Sushi,5,'Absolutely_outraged---20250429_083048
How have Trump’s first 100 days impacted the country? Look to New Mexico.,https://19thnews.org/2025/04/new-mexico-trump-100-days/,2025-04-29T08:29:40,16,19thnews,6,How_have_Trump’s_fir---20250429_082940
Fact Sheet: President Donald J. Trump Investigates Unlawful “Straw Donor” and Foreign Contributions in American Elections,https://www.whitehouse.gov/fact-sheets/2025/04/fact-sheet-president-donald-j-trump-investigates-unlawful-straw-donor-and-foreign-contributions-in-american-elections/,2025-04-29T08:28:39,0,LittleBuddyOK,15,Fact_Sheet__Presiden---20250429_082839
"Amazon displaying tariff prices ""hostile and political,"" White House says",https://www.axios.com/2025/04/29/tariffs-amazon-prime-day-sellers-report,2025-04-29T08:27:35,108,Flash_Fiction,56,Amazon_displaying_ta---20250429_082735
An American disgrace: This president has shown neither honor nor decency; neither integrity nor morality.,https://ctmirror.org/2025/04/23/an-american-disgrace/,2025-04-29T08:24:09,239,Silent-Resort-3076,26,An_American_disgrace---20250429_082409
Treasury Sec. Isn't Worried About Empty Shelves as 'Empty Cargo Ships' Push Americans to Panic Buy,https://www.latintimes.com/treasury-sec-isnt-worried-about-empty-shelves-empty-cargo-ships-push-americans-panic-buy-581875,2025-04-29T08:19:38,45,IndependentRegion104,32,Treasury_Sec._Isn't_---20250429_081938
‘They disappear them’: families of the detained liken Trump’s US to Latin American dictatorships,https://www.theguardian.com/us-news/2025/apr/29/venezuelan-detained-families-el-salvador-trump-dictatorship,2025-04-29T08:15:48,86,zsreport,7,‘They_disappear_them---20250429_081548
Why Trump Is Giving Putin Everything He Wants,https://www.theatlantic.com/international/archive/2025/04/trump-putin-ukraine-deal/682626/,2025-04-29T08:13:52,22,OtherwiseCanary8971,24,Why_Trump_Is_Giving_---20250429_081352
Pritzker hits a nerve in Trump world,https://www.politico.com/newsletters/illinois-playbook/2025/04/29/stephen-miller-attacks-jb-pritzker-over-new-hampshire-speech-00314775,2025-04-29T08:13:51,27,DevinGraysonShirk,13,Pritzker_hits_a_nerv---20250429_081351
"Trump to reduce impact of auto tariffs, commerce secretary says",https://www.cnbc.com/2025/04/28/trump-to-reduce-impact-of-auto-tariffs-officials-say-.html,2025-04-29T08:11:47,9,Puginator,9,Trump_to_reduce_impa---20250429_081147
White House blasts Amazon over tariff cost report: ‘Hostile and political act’,https://www.cnbc.com/2025/04/29/white-house-blasts-amazon-over-tariff-cost-report-hostile-and-political-act.html,2025-04-29T08:08:23,446,Rare_Advantage5859,193,White_House_blasts_A---20250429_080823
Grants tie Trump’s anti-DEI order to election security money,https://www.washingtonpost.com/politics/2025/04/29/trump-dei-election-security-states/,2025-04-29T08:04:51,14,avid-learner-bot,4,Grants_tie_Trump’s_a---20250429_080451
Map Shows Donald Trump's Approval Rating in Each State After 100 Days,https://www.newsweek.com/donald-trump-approval-rating-map-100-days-2064207,2025-04-29T08:00:05,24,newsweek,28,Map_Shows_Donald_Tru---20250429_080005
"Trump ready to bail out farmers amid trade war squeeze, Rollins says",https://www.axios.com/2025/04/27/farm-tariffs-bailout-trump-china,2025-04-29T07:57:59,13,1900grs,42,Trump_ready_to_bail_---20250429_075759
FBI using polygraph tests to identify sources of internal leaks,https://www.theguardian.com/us-news/2025/apr/29/fbi-polygraph-test-leaks,2025-04-29T07:48:32,18,pharrt,21,FBI_using_polygraph_---20250429_074832
Republicans tee up federal worker benefit cuts to pay for tax cuts,https://www.govexec.com/pay-benefits/2025/04/republicans-tee-federal-worker-benefit-cuts-pay-tax-cuts/404901/,2025-04-29T07:36:27,78,mailbox_full,13,Republicans_tee_up_f---20250429_073627
Trump Says He's Not 'Looking' To Run For a Third Term In Office: 'It Would Be a Very Hard Thing',https://www.latintimes.com/trump-says-hes-not-looking-run-third-term-office-it-would-very-hard-thing-581869,2025-04-29T07:35:52,0,Adventurous_Row3305,34,Trump_Says_He's_Not_---20250429_073552
The Indelible Imagery of Trump’s First 100 Days,https://www.bloomberg.com/opinion/articles/2025-04-29/trump-100-days-five-photos-that-stand-out-from-musk-to-zelenskiy,2025-04-29T07:32:57,3,bloombergopinion,6,The_Indelible_Imager---20250429_073257
FBI starts using polygraph tests in internal leak investigations,https://www.reuters.com/world/us/fbi-starts-using-polygraph-tests-internal-leak-investigations-2025-04-29/?utm_source=reddit.com,2025-04-29T07:28:07,32,Huge-Platypus9075,21,FBI_starts_using_pol---20250429_072807
Chuck Schumer dodges on whether Democrats will look to impeach Trump if they win back Congress | Senate Minority Leader said 'two years is too far away to predict',https://www.foxnews.com/media/chuck-schumer-dodges-whether-democrats-look-impeach-trump-win-back-congress,2025-04-29T07:25:28,0,newsspotter,20,Chuck_Schumer_dodges---20250429_072528
"Trump signs orders targeting sanctuary cities, seeking military involvement in law enforcement | Trump's orders look to protect police from legal repercussions and involve the military in enforcement",https://www.salon.com/2025/04/28/signs-orders-targeting-sanctuary-cities-seeking-military-involvement-in-law-enforcement/,2025-04-29T07:24:32,1019,1900grs,186,Trump_signs_orders_t---20250429_072432
Mike Johnson Admits Trump’s Presidency Is a ‘Roller Coaster’,https://www.thedailybeast.com/mike-johnson-admits-trumps-presidency-is-a-roller-coaster/,2025-04-29T07:21:46,33,Exciting_Teacher6258,23,Mike_Johnson_Admits_---20250429_072146
Hatchet Job on CFPB Even Worse in the Details,https://prospect.org/justice/2025-04-29-hatchet-job-cfpb-musk-doge/,2025-04-29T07:19:12,41,Smithy2232,4,Hatchet_Job_on_CFPB_---20250429_071912
Donald Trump Given 'F' Rating by Americans After 100 Days,https://www.newsweek.com/donald-trump-given-f-rating-americans-after-100-days-2065546,2025-04-29T07:18:03,5409,sweatycat,124,Donald_Trump_Given_'---20250429_071803
It’s time for the US to guarantee healthcare to all,https://www.theguardian.com/commentisfree/2025/apr/29/america-universal-healthcare-bernie-sanders,2025-04-29T07:08:24,990,_May26_,223,It’s_time_for_the_US---20250429_070824
Angry Florida voters hold ‘empty chair’ town halls for absent Republicans,https://www.theguardian.com/us-news/2025/apr/29/empty-chair-town-hall-republicans-florida,2025-04-29T06:36:18,1982,pharrt,87,Angry_Florida_voters---20250429_063618
"More give Trump an F than any other grade for first 100 days, poll finds",https://www.npr.org/2025/04/29/nx-s1-5379596/trump-100-days-polling-grade-approval-rating,2025-04-29T06:35:48,657,zrv8psgOS9AiWK6ugbt2,34,More_give_Trump_an_F---20250429_063548
Republicans Move to Block Inquiries Into Trump Admin Amid Signal Scandal,https://www.rollingstone.com/politics/politics-features/trump-johnson-republicans-block-inquiries-hegseth-signal-1235327260/,2025-04-29T06:34:04,828,rollingstone,34,Republicans_Move_to_---20250429_063404
Trump has used government powers to target more than 100 perceived enemies,https://www.npr.org/2025/04/29/nx-s1-5327518/donald-trump-100-days-retribution-threats,2025-04-29T06:33:13,152,progress18,6,Trump_has_used_gover---20250429_063313
Trump Insists His Dismal Polling Numbers Are ‘FAKE’ and the Economy Is Doing Great,https://www.thedailybeast.com/trump-insists-his-dismal-polling-numbers-are-fake-and-the-economy-is-doing-great/,2025-04-29T06:31:50,199,Exciting_Teacher6258,72,Trump_Insists_His_Di---20250429_063150
Chaos is Trump’s calling card. But reality is biting back,https://www.theguardian.com/commentisfree/2025/apr/29/trump-chaos-lloyd-green,2025-04-29T06:31:03,86,zsreport,4,Chaos_is_Trump’s_cal---20250429_063103
Top White House aide says Pritzker's call for mass protests 'could be construed as inciting violence',https://chicago.suntimes.com/politics/2025/04/28/white-house-chief-of-staff-says-pritzkers-call-for-mass-protests-could-be-construed-as-inciting-violence,2025-04-29T06:27:59,305,Mother_Task_2708,57,Top_White_House_aide---20250429_062759
Trump’s 5 biggest mistakes of his first 100 days,https://thehill.com/homenews/administration/5271938-trump-michigan-mistakes/,2025-04-29T06:27:32,12,thehill,7,Trump’s_5_biggest_mi---20250429_062732
Trump’s popularity hits historic lows as he marks 100 days in office,https://www.semafor.com/article/04/29/2025/at-100-days-trumps-popularity-hits-historic-lows?utm_campaign=semaforreddit,2025-04-29T06:23:18,92,semafornews,9,Trump’s_popularity_h---20250429_062318
RFK Jr.’s Sister: ‘He Is Not an Appropriate HHS Secretary’,https://www.thedailybeast.com/robert-f-kennedy-jrs-sister-kerry-kennedy-says-he-is-not-an-appropriate-hhs-secretary/,2025-04-29T06:21:06,1525,Aggravating_Money992,63,RFK_Jr.’s_Sister__‘H---20250429_062106
Our writers’ 100-word verdicts on Trump’s first 100 days,https://www.thetimes.com/us/american-politics/article/trump-second-term-policies-orders-mvvl6phfg?utm_medium=Social&utm_source=Reddit#Echobox=1745925050,2025-04-29T06:11:38,5,TimesandSundayTimes,5,Our_writers’_100-wor---20250429_061138
"Most Americans now see Trump as ""a dangerous dictator,"" poll says",https://www.axios.com/2025/04/29/prri-poll-most-americans-trump-dangerous-dictator,2025-04-29T06:07:40,18379,Unusual-State1827,836,Most_Americans_now_s---20250429_060740
"Only 39% approve of Trump's handling of economy, according to poll of first 100 days",https://www.npr.org/2025/04/29/nx-s1-5379613/only-39-approve-of-trumps-handling-of-economy-according-to-poll-of-first-100-days,2025-04-29T05:58:11,133,zsreport,16,Only_39%_approve_of_---20250429_055811
Kansas woman arrested by ICE at KC green card interview | Kansas City Star,https://www.kansascity.com/news/local/article304988381.html,2025-04-29T05:49:45,163,kerpowie,27,Kansas_woman_arreste---20250429_054945
University of Minnesota launches Vaccine Integrity Project amid federal mixed messages,https://www.kare11.com/article/news/health/university-minnesota-launches-vaccine-integrity-project-amid-federal-mixed-messages/89-b8374874-06dc-4f51-81c4-91001ff406d1,2025-04-29T05:44:33,62,HeHateMe337,5,University_of_Minnes---20250429_054433
Trump Issues Executive Order Ramping Up American Police State,https://www.rollingstone.com/politics/politics-news/trump-executive-order-law-enforcement-1235327251/,2025-04-29T05:35:06,7312,rollingstone,648,Trump_Issues_Executi---20250429_053506
Trump 100 days: Trump’s whirlwind start to his second presidency,https://www.theguardian.com/us-news/ng-interactive/2025/apr/29/trump-100-days-president,2025-04-29T05:32:27,20,1-Ohm,2,Trump_100_days__Trum---20250429_053227
How Trump has tried to remake America in his first 100 days,https://www.nbcnews.com/politics/donald-trump/trump-tried-remake-america-first-100-days-rcna201224,2025-04-29T05:24:59,16,nbcnews,4,How_Trump_has_tried_---20250429_052459
"""We will bring this home"": North Carolina Democrats confident they'll defeat GOP election denial",https://www.salon.com/2025/04/29/we-will-bring-this-home-north-carolina-democrats-confident-theyll-defeat-denial/,2025-04-29T05:07:51,267,zsreport,8,_We_will_bring_this_---20250429_050751
Activist pastor who has criticized Trump arrested while praying inside Capitol,https://www.independent.co.uk/news/world/americas/us-politics/william-barber-trump-christian-task-force-b2741146.html?fbclid=IwY2xjawJ9goVleHRuA2FlbQIxMQBicmlkETFOTW44dFpXdnNQWE42cUtzAR5NK3WBd4J1RqXj2NmEmndODWLgbvYWuBONdDduLFMNW5JWVQBbliV2cq3U3A_aem_heFjZj1kuG7ojYeYy6506Q,2025-04-29T05:03:07,1322,irish_fellow_nyc,80,Activist_pastor_who_---20250429_050307
"CNN Poll: Frustrated Americans want more checks on Trump, have dim views of Democratic opposition",https://edition.cnn.com/2025/04/29/politics/poll-frustration-anger-politics/index.html,2025-04-29T04:55:36,2049,StuartGT,362,CNN_Poll__Frustrated---20250429_045536
"As Measles Cases Surge, Mexico Issues a US Travel Alert",https://www.wired.com/story/as-measles-cases-surge-mexico-issues-a-us-travel-alert/,2025-04-29T04:43:47,338,wiredmagazine,16,As_Measles_Cases_Sur---20250429_044347
Trump knows exactly what he just triggered in Canada,https://www.cbc.ca/news/world/trump-canadian-election-analysis-1.7521255,2025-04-29T04:11:13,76,HotHuckleberry8904,56,Trump_knows_exactly_---20250429_041113
