Comment,Author,Date,Score"I call that out when I hear it because it gives the impression to many on Reddit that Latinos or Middle Easterners deserve what they’re getting now. because most of them voted for him, when that’s not the case. I’ve heard it too often as a reason for good people to wash their hands of concerns for others.",mrwhalejr,2025-04-02T11:32:57,2
This is well said and funny.  Thankyou.,Windthrusiberia,2025-04-26T13:15:46,1
Maybe it should not just be about who can be most productive or inventive? We should also value people who bring values like compassion and generosity. Japan is a country that has a very hard work ethic but it is actually quite detrimental to their well-being.,JigglyPuffGuy,2025-04-01T17:21:19,2
" >taking top scientists (O-1 visas) from Germany after WW2 helped, sure.  Our country has been importing legions of broke foreigners, half of which didn't speak English, for it's whole history. And it's history before it's founding, too.    Heck, we practically had an *actual* open-border policy (not using the modern definition ""when a dem is in the white house) until the 1920's (not that I'm advocating for a return to an open-border)  [It's simply a fact that even broke immigrants are good for the nation](https://public3.pagefreezer.com/browse/HHS.gov/02-01-2025T05:49/https://www.hhs.gov/about/news/2024/02/15/new-hhs-study-finds-nearly-124-billion-positive-fiscal-impact-refugees-and-asylees-on-american-economy-15-year-period.html)    >give 30 million people a great education, encourage them to innovate, to excel, and you will get a few people who come up with amazing ideas.  I generally agree with this, except for a few points. But more importantly, this is *loosely* already part of the US's culture, and in that way immigrants benefit from it, regardless of the culture of their former land.    > South korea's culture is hyper focused on education and a very hard work ethic. >  >   The other side of South Korea is the *insane* pressure that kids and young adults are put under, to achieve those results, creating a massive amount of *burnout* and nobody having kids, which further causes a *huge* demographic crisis.   Oh, and also a per-capita GDP that's behind New Zealand's",Interrophish,2025-04-02T04:02:22,1
Heck I might even call it cruel and unusual.,JigglyPuffGuy,2025-04-01T17:37:51,5
"We fundamentally disagree politically, and you are not going to change my mind about the wrongness of racially profiling people and making presumptions on their immigration status.   However, you have raised something that might be a misunderstanding on my part.   ""Green card"" is an American term. I have always assumed it was synonymous with permanent resident, the term used by other countries. Everything I have seen conflates the two terms as being equivalent. Is this not the case?",xtaberry,2025-04-01T11:41:18,6
Correct your mistake.,Cyphinate,2025-04-22T14:42:30,1
"When there is no due process everyone is vulnerable even citizens.   Hispanic citizens have been arrested and held for hours, at least 4 cases that I have heard of and that's inside the US. In one case the person had ID on him and kept telling the officers he is born in the US. They still drove him around for hours and found his ID on him when processing him 10 hours later.   I think you are safe if you are white, that is the sad reality.",[deleted],2025-04-01T17:09:05,9
"Yeah. I lived abroad for about five years and came back early in this shit storm. I have mixed feelings but definitely some regrets that I didn’t stay where I was. I had some optimism when I returned but that has been slowly dissipating. I can’t help but believe that someone, be it a group or an individual, has been sowing the seeds of discord. I have my suspicions about who.",Netherpirate,2025-04-01T19:58:50,4
"> The obvious next step is ""deporting"" a citizen, which I do not doubt will happen. They are testing the waters. But it doesn't seem like they've crossed the line... Yet.  There's lots of speculation about this. The thing to watch for is if people who are full-blooded Americans to the bone are dealing with overseas incarceration (I know it's semantics, but ""deportation"" is not the correct term in the context here when talking about any random person who has no ties to anywhere outside the US).  But I think people will be in for a rude awakening should the people getting deported aren't named something like Jorge, Maria, or Pablo, but instead, something like Nathan, Brandon, Zach, Jackie, etc. A lot of people see a foreign-sounding name and tune it out. It won't capture attention until it's a very American sounding name, and the people being led face down by Salvadorean guards in are actually Americans that wouldn't be mistaken for anyone else....  It will be a different ball game when people are being sent to El Salvador that have no ties outside the US, people's whos ancestors immigrated from Poland, present-day Germany, Ireland, etc., way back in the day and arrived at Coney Island, people who don't speak a lick of Spanish, etc.",Vlad_Yemerashev,2025-04-01T11:18:27,7
"There are very few assholes who actually deserve trump as president.  The macho guys who voted for his pseudo macho-ness, they deserve trump. People who watch FOX all day instead of finding out what is really going on, they deserve trump.",AdhesivenessCivil581,2025-04-03T05:19:26,1
"Its the question that was asked of me.   so I answered that question.  If we just looked at who in the world has it worse off than US citizens we would then try to migrate  a few billion people in, which would make life shitty here.  trying to create a migration policy off of compassion is a bad idea, because there will always be more people you weren't compassionate too.       instead we should look at the impact on US citizens.   Canada recently admitted (duh) that their rapid rate of migration has spiked rental and home prices.  [https://www.bbc.com/news/articles/cp9z5rpgkyeo](https://www.bbc.com/news/articles/cp9z5rpgkyeo)       A lot of Americans rent,  and I'm not seeing people talk about how amazingly low their rent is. instead they complain (rightfully) about how high their rents are.  where's the compassion for them?",discourse_friendly,2025-04-01T17:25:38,-2
"Yes back when immigrants were settlers we took everyone.  people getting off a boat and having to physical build a house from scratch and start farming.    And back when people landed with nothing  and walked around to find a job, when manual labor jobs were a plenty that style of migration served us well.      But the conditions are different now, and how quickly, or slowly we build houses is way different.  LA fires were 3 months ago and the very first building permits are just now being issued.      Mass migration in the settler era meant mass rising of houses and new farms popping up with in 3 months.      mass migration now means cities rent out hotels and apartments and use tax payer dollars to fund it.   migrants then start competing (through no fault of their own) with Americans to rent apartments, rising the prices.      Its not nearly as beneficial now as it was in the 1700s.  and much more externalities are thrust upon Americans now than ever before.      Though in the 1700s the native Americans suffered all the externalities",discourse_friendly,2025-04-02T10:14:21,1
">  it was synonymous with permanent resident  They are conditional for two years, and then after that, it's permanent. The official US govt name for these cards is literally Permanent Resident Card, ffs  https://en.wikipedia.org/wiki/Green_card  Dude is giving incorrect information.",New2NewJ,2025-04-01T15:50:56,3
">We fundamentally disagree politically, and you are not going to change my mind  I 100% agree with you on something.  :)       >However, you have raised something that might be a misunderstanding on my part.  >""Green card"" is an American term. I have always assumed it was synonymous with permanent resident, the term used by other countries. Is this not the case?  [https://www.uscis.gov/green-card/after-we-grant-your-green-card/conditional-permanent-residence](https://www.uscis.gov/green-card/after-we-grant-your-green-card/conditional-permanent-residence)  >A conditional permanent resident receives a Green Card valid for two years. To remove the conditions on your permanent resident status, you must file a petition within the 90-day period before your conditional Green Card expires. Use our [Filing Calculator](https://www.uscis.gov/forms/when-to-file-your-petition-to-remove-conditions) to determine your 90-day filing date. You cannot renew your conditional Green Card. If your conditions are not removed, you will lose your permanent resident status and you will become removable from the United States.  Yeah I didn't know it was a thing until the Mahmoud Khalil detention happened.   the reporting was very confusing because right wing sources said he was on a temporary vias (not technically correct) and left wing sources said he was a permanent resident (not correct either)",discourse_friendly,2025-04-01T11:48:25,0
"I don't know that I believe an open borders activist group to be honest.   I really don't think an actual US Citizen has been deported. detained yes. but I've been detained by police before, I'm not going to suggest we no longer enforce laws, simply because I've been detained a time or two or a dozen.   (mostly for trespassing as a skateboarder)",discourse_friendly,2025-04-22T14:53:39,1
What about the name Melania,Snoo_83517,2025-04-02T08:30:37,1
"Why should we only be compassionate to people who are US citizens? I ask this especially of people who think they're religious and believe in God and what not. If man was made in God's image, why should we treat some men as lesser simply for where they live?   Idk if you're religious but it's something I think about all the time. Yes it's a complex issue but I don't think that our gates should be closed to all except those who can be productive. There are other ways to contribute and make a society better than by just producing shit.",JigglyPuffGuy,2025-04-01T17:36:57,3
the study I linked analyzed 2005-2019,Interrophish,2025-04-02T15:32:09,1
"So he recieved a conditional green card November 2024 and was still within his two year window. That is a detail I was not aware of. I think the argument that this is a temporary status is questionable. It is, as you said, a ""conditional permanent"" residency. ""Permanent"". But the ""conditional"" part might be relevant.   If the green card was granted based on certain conditions (e.g., marriage to a US citizen, investment), and the conditions are not met, they can revoke the green card. However, this doesn't apply in Khalil's case as far as I can see. He also wasn't at the end of the 2 year window, so this isn't about that process of removing the conditions and obtaining unconditional permanent resident status.   Green card holders can definitely be deported if they are convicted of a crime. Khalil is not, at this time, facing criminal charges though, and has certainly not been convicted.   Originally they claimed his presence and activities threaten the foreign policy interests of the U.S. This is such a niche piece of immigration law that I cannot tell what due process would mean in this context. However, the courts said there was not sufficient due process in the government's present actions and he was not eligible for deportation.   After that court case, the administration pivoted, and now the primary argument being made that he lied on his application, concealing details about his affiliation to certain groups that would have barred him for receiving the green card. If this is true, it would be grounds to revoke his green card. But his green card hasn't been revoked and the burden is on the government to prove in an immigration court that he lied and his affiliation with Palestinian groups would have been disqualifying. They can't just deport him prior to doing those steps.   This information is helpful in clarifying why news sources of different leanings can't seem to agree on Khalil's status. But there isn't actually a difference as far as I can see. There is still a burden of proof and a requirement for due process that is being sidestepped.",xtaberry,2025-04-01T13:54:06,4
https://www.aclu.org/news/immigrants-rights/us-citizen-wrongfully-deported-mexico-settles-his-case-against-federal-government,Cyphinate,2025-04-22T15:13:11,1
God bless you man it’s time to stop shit talking the new world order and to make our own. What’s so bad about taking care of everyone on this planet? Or at least trying to.,Netherpirate,2025-04-01T18:14:11,3
"So before the Biden era style of funding their travel, housing, food, clothing, and cell phones.       I've seen studies that claim they add, and studies that claim they take away.      Web AI sums it up pretty well :   >Studies on the fiscal impact of immigration in the United States have yielded mixed results. Some studies indicate that immigrants, particularly those with low levels of education and income, can impose a heavier tax burden on natives at the state and local levels due to their larger families and higher use of public K-12 education services.  >However, other research suggests that immigrants, especially those with higher education levels, are net positive contributors to the federal budget. Over the long term, the upward economic mobility and taxpaying lifetime of second-generation immigrants more than offset the initial fiscal burden.     I guess pick the study to suit your narrative.",discourse_friendly,2025-04-02T15:53:32,1
"There's a ton of conditions, not just stay married.      Secretary of State Marco Rubio cited a provision in the Immigration and Nationality Act that authorizes the nation's top diplomat to revoke the visas of foreign national students on the grounds that their presence or activities have ""**potentially serious adverse foreign policy consequences"" for the U.S.**     Green card applicants must **demonstrate their allegiance to the United States by supporting and defending the principles of the Constitution.**     * Follow all federal, state, and local laws * File U.S. income tax returns * **Support democracy** * Alert the USCIS of any change in addres    It could have been argued that by expressing support for Hamas, who hasn't held elections since winning power in 2006, he's not supporting democracy.      Quite honestly, Mahmoud Khalil  was not a good fit for the USA and never should have been offered a visa / green card process.   However he should have been given more process before removal.         I'm sad we're not giving him more legal process, but I'm not sad he's being removed.   Hamas has 'death to America' in their charter.   Its one thing to hate Israel and love the Palestinians.  its an other to support a group that chants death to America.",discourse_friendly,2025-04-01T14:17:26,1
"Wow, and under Obama!   We still need to deport millions of unauthorized migrants though.      mistakes will be made, to prevent it from happening in the future we can secure our borders so we are never in a situation where we need mass deportations again.",discourse_friendly,2025-04-22T15:17:49,1
"Fair. I believe that the US government could have possibly made a case against Khalil and deported him with due process. I agree with you on that. But they didn't take those steps, and I think that is incredibly bad.   I can respect someone who agrees that is bad but ultimately believes deportation is warranted. Every country in the world has some sort of system for controlling immigration and removing those who do not meet their terms and laws, but due process is critical if those systems are to be just.   Thanks for the additional information and all the best!",xtaberry,2025-04-01T14:38:08,4
You should not have made absolute (and incorrect) statements that it has not happened and will not happen again. It has happened and it will happen again. You were wrong. Your statements were wrong. Making excuses after the fact doesn't change that.,Cyphinate,2025-04-22T15:21:34,1
"yeah they could have, and should have done it much better.  This administration will turn a slight majority favoring mass deportation into a sizeable majority against it,  just in how they are carrying it out.      You're welcome bro! (or sis)   You seem very cool, even if we don't agree on some political stuff.  :)",discourse_friendly,2025-04-01T14:40:03,1
"I should be completely honest, and i posted what I thought was true.      You are correct, I was wrong.      I will now sleep with the hosts of the view as the ultimate act of contrition",discourse_friendly,2025-04-22T15:46:17,1
