Comment,Author,Date,Score
"[A reminder for everyone](https://www.reddit.com/r/PoliticalDiscussion/comments/4479er/rules_explanations_and_reminders/). This is a subreddit for genuine discussion:  * Please keep it civil. Report rulebreaking comments for moderator review. * Don't post low effort comments like joke threads, memes, slogans, or links without context. * Help prevent this subreddit from becoming an echo chamber. Please don't downvote comments with which you disagree.  Violators will be fed to the bear.  ---  *I am a bot, and this action was performed automatically. Please [contact the moderators of this subreddit](/message/compose/?to=/r/PoliticalDiscussion) if you have any questions or concerns.*",AutoModerator,2025-03-31T12:35:01,1
"It's absolutely going to happen, and it's not going to be an accident. He explicitly stated that he's considering shipping Tesla vandals to El Salvador, too.   Don't think for a moment that the gay barber or the guy with the autism awareness tattoo were sent there by mistake. The makeup artist was cleared by one ICE officer then sent anyway. He could have all those men on a plane back to the United States in the next five minutes if he had a mind to. This was no mistake, it was a very clear message to all who oppose Trump that he will send whoever the Hell he wants to a concentration camp without due process if he feels like it.   Cruelty is the point. Do NOT stop fighting.",RyloKloon,2025-04-01T00:46:01,189
"Without due process, I'm not sure anyone could claim confidently and honestly that they haven't been.  It's easy to say someone you want to get rid of is a Salvadorian criminal and there's no way for them to prove otherwise.",Hartastic,2025-04-01T12:36:14,16
"[What’s worse is that even when it’s proven that a deportation was an error, the government is now claiming they can’t do anything to bring them back since they’re in El Salvadorian jurisdiction.](http://archive.today/2025.04.01-045025/https://www.theatlantic.com/politics/archive/2025/03/an-administrative-error-sends-a-man-to-a-salvadoran-prison/682254/)  So they deport people without due process, and pretend they can't do anything about it once the people are out of the country. Not even this Supreme Court will think this is okay. The Trump administration is trying to see how much and far they can get away with.  [(Btw, this is the same tactic and justification the Nazis used in occupying countries when they captured and sent activists to other occupying countries. It was “outside their jurisdiction”.)](https://en.wikipedia.org/wiki/Nacht_und_Nebel)",Barbaricliberal,2025-04-01T04:24:41,45
It’s already happened- what do you mean.  That poor man with autism awareness tattoo is in El Salvador prison and is legal.,Ok-Mechanic-5128,2025-04-01T01:42:51,68
The hallmark of every dictatorship is disappearing people . We are now a dictatorship.,Huckleberry199,2025-04-01T05:29:39,33
"I think some people are (incorrectly) reading your emphasis on citizens to imply that only bad acts against citizens matter.  There have been (not from you) people arguing that so long as the people weren't citizens, none of it should concern citizens and it could never happen to citizens.  I assume you're asking about citizens specifically because it pierces through the ""citizens have nothing to worry about"" arguments, and because it happening to a citizen would be a far bigger news story and raise more alarms.",bl1y,2025-04-01T09:33:11,15
"The biggest issue in all of this is the total lack of due process.  Literally anyone can be picked up and sent to a prison in El Salvador, because at no point is there any process whatsoever to determine if the person should be deported.  It's absolutely bonkers what this administration is trying to do.",kinkgirlwriter,2025-04-01T19:01:37,5
"How else could it happen? People don't have tattoo on thier forehead that say ""I'm here illegally"" so ICE will have to check everyone's papers over and over again if you look Latino or middle eastern .  I'll never understand how trump got the Latino and middle east vote.",AdhesivenessCivil581,2025-04-01T06:59:14,12
"My father was naturalized as a child ~60 years ago. He has expired US passports, but no current photo ID because Texas (where he currently lives) has already refused on multiple tries to recognize his naturalization certificate when he has tried to get state ID. (So for several years, he has had no valid picture ID at all. This hasn't been an issue *yet*.)  It's only a matter of time before people like my father have their citizenship ""lost"".",curien,2025-04-01T11:58:57,9
"not a bug. not a mistake. this is intentional.  they are actively sowing fear and  panic in the population as a control mechanism.  they want every citizen to fear being ""Disappeared"" as a way of curtailing dissent and opposition.  it is very On Brand for a Fascist Government and directly from the Nazi playbook.  considering the administrations embrace of all things Fascist...this should have easily been expected.",wwwhistler,2025-04-01T11:00:42,8
"They’ve already started deporting legal permanent residents with no criminal records to El Salavador. And when told to bring those people back, the government says that it’s too hard and the judges can’t make them do it.   This is going to happen to citizens, if it hasn’t already. As much as I hate to do the old “mark my words” - Trump’s next move is to start rounding up naturalized American citizens born in South America and the Middle East and deporting them as “foreign combatants.”",jadedflames,2025-04-01T09:48:06,9
This is the plan send anyone we don’t like/want here ie dems immigrants disabled people to the concentration camps (gulag) in El Salvador or gitmo.  This is the Republican plan to maintain power permanently.,No-Assignment-5798,2025-04-01T03:35:09,13
There's no transparency on who is being chosen for deportation and who is doing the choosing. Many innocent people will be caught up in such disorganized action.,anonskeptic5,2025-04-01T14:53:37,3
This has happened before unfortunately. Please read up on [Operation Wetback](https://en.m.wikipedia.org/wiki/Operation_Wetback). Many American citizens or authorized Mexican nationals were deported ruthlessly by the American government.   This is vile and will probably be pushed to its limits with the current administration.,alexis_1031,2025-04-02T12:56:00,3
US mistakenly deports man to mega-prison – and can’t get him back  https://www.independent.co.uk/bulletin/news/trump-deportation-el-salvador-cecot-b2725052.html,sonictoddler,2025-04-01T07:41:51,8
"""First they came for the socialists, and I did not speak out—because I was not a socialist.  Then they came for the trade unionists, and I did not speak out—because I was not a trade unionist.  Then they came for the Jews, and I did not speak out—because I was not a Jew.  Then they came for me—and there was no one left to speak for me.""    Posted without comment.",billpalto,2025-04-01T08:26:06,8
"I have a few theories on why this is the ultimate outcome. It just seems too random to not use the powers that were already in place. Keep in mind they're just theories and probably mean nothing.  The Laken Riley Act which was signed into law allows deportation based on accusations of committing a crime, bypassing due process and ethical codes. The president already has deportation authority, and his use of the Alien Enemies Act makes zero sense considering that they're stating most of the people were already here illegally which leads me to believe this is part of a larger scheme. I mean not one lawyer tried to even use the Laken Riley Act as an argument I mean they could be complete idiots but.....  no actually that one checks too   I'm sure Laken Riley is thrilled that her life which included the ANA ethical code of avoiding harm, is being used this way. What a lovely legacy.",FirmLifeguard5906,2025-04-03T04:18:41,1
We should be sure it’s happening but not in the news.  Trump is suppressing the press and platforms of free speech.  These victims of trumps gestapo should do what is happening everywhere. File a Lawsuit!!!!,Windthrusiberia,2025-04-26T12:28:23,1
About 1-5% of people currently in prison are wrongfully convicted. There will always be innocent people who fall victim to circumstances and mistakes. That's what happens when you try to enforce any law. People have been wrongfully convicted of murder before. I assume that doesn't mean we should stop prosecuting murderers.,FreedomPocket,2025-04-01T11:30:33,-7
"things that are ""temporary"" are ephemeral, and are going to end at some point.   No US Citizen has been deported.    No US Citizen will be deported.   Migrants and visitors with temporary or conditional permission to be in the US, may have that revoked, yes.   Why should the USA Host people that are wards of the state, commit crimes, or espouse hatred for the US ,and those that suppose enemies of the USA who say they want death to America?     **Why must the USA have the dumbest immigration policies on the planet?**",discourse_friendly,2025-04-01T10:31:47,-17
"> He explicitly stated that he's considering shipping Tesla vandals to El Salvador, too.  The prison would eventually become another version of Camp Bucca in that case.  For anyone that doesn't know...Camp Bucca is where AQ in Iraq guys were held the occupation of Iraq. All of those guys sharing the same living space allowed them to organize and learn from each other. When they eventually escaped they started ISIS and Nusra Front. The current president of Syria was one of that group at the camp.",1QAte4,2025-04-01T16:24:10,18
"These two cases you are mentioning were not familiar to me, but I read a few articles on them as they have come up multiple times in this thread.   It seems as though they were Lawful permanent residents, but not naturalized citizens? Its still a horrific lack of justice and are helpful examples of how far things have gone. ",xtaberry,2025-04-01T08:27:54,12
Soon enough ICE will be targeting political dissidents and then we really are 1933!   People should start organizing underground resistant cells.   History is repeating itself.,Windthrusiberia,2025-04-26T12:32:19,2
"They came a couple days and took away a friend’s dad who was German and adopted as an infant.  White man in his 70’s, this time when they came to take him they didn’t care about his adoption papers. They took him down to Louisiana.",Defiant_Ferret4542,2025-04-03T21:09:16,1
"This is horrible. It seems as though the citizenship line has not yet been crossed, which is specifically what I was curious about, but I have been provided with plenty of examples of individuals with legal status have deported for essentially no reason and without due process.   The fact that someone with a protected status issued in a court of law to specifically prevent deportation to El Salvador is glaring.",xtaberry,2025-04-01T08:35:43,6
"Neri Alvarado Borges is the man with the autism tattoo you are speaking of? I am not familiar with that story but just googled it.    As far as I can see he was a legal permanent resident, but nothing indicates he was a naturalized citizen. This is obviously atrocious, and goes a step beyond just revoking temporary visas. I was specifically curious about citizens, and whether that line has been crossed yet, but this example is still a good one for how far things are going in the US.   If I am mistaken or misunderstanding the situation, please correct me.",xtaberry,2025-04-01T08:21:04,10
And if we protest they will target us.,Defiant_Ferret4542,2025-04-03T21:10:46,1
"Absolutely, this is true and if people don’t wake up and get out of their comfort zone, it will be too late.  So many bad thing transpire because people are in denial.  It is hard to face change.   We can see the writing on the wall, not just just the disappearing people but the manner in which trump is doing everything… the Blitz tactic.  Everything coming at you all at once and ignoring the courts and breaking the law without any regard to answering for it.  We are on a slippery slope and heading downhill faster and faster.  This is fascism.",Windthrusiberia,2025-04-26T12:43:04,1
"Totally fair - I am arguing exactly the opposite. I know protected asylum claimants and permanent residents have been deported. It's obviously happening. It's obviously abhorrent. I have no further questions in that regard   I don't know to what extent citizens have been caught up, hence the emphasis on citizens. Not because it's more important, just because I am more ignorant. They're obviously being questioned. They are, in at least one case, being detained for short periods. So, I am curious about how often this sort of thing is actually happening.",xtaberry,2025-04-01T10:07:30,7
"Absolutely right again.  No search warrants, no due process,  tricking person into abduction, detaining them indefinitely.  I feel shocked at what is happening.  We are approaching that state of mind of “ flight or fight”.  This is a survival strategy and we should all be very alarmed that this is happening and happening fast.",Windthrusiberia,2025-04-26T12:50:15,1
"He didn’t. He got a slight bump in it, but not the majority of it.",mrwhalejr,2025-04-01T18:38:07,2
"These people fled their homes to get away from people like them, not to live with the same people somewhere else.",Clone95,2025-04-03T10:34:41,1
There's a lot of sexistism within the  latino and Hispanic community. They didn't want a woman for president.,Low_Success_2359,2025-04-05T04:25:22,1
">  I'll never understand how trump got the Latino and middle east vote.  Because these people are not one big blob. People of Cuban background have a very different outlook on things compared to people of Peru origin and so on. Some are going to favor more conservative actions after the horrors of Socialism, religion, or because sky is blue. People are people.",Sageblue32,2025-04-02T05:33:53,1
It will be an issue very soon. Get him into another state that will give him an ID. Please.,Farside_Farland,2025-04-01T14:55:13,7
"This is exactly the sort of person I am thinking about. I hope there is widespread outrage when people like this are targetted... But I previously would have thought that coming after those with student visas and permanent residents would have sparked widespread outrage, and yet that is already happening and people are rationalizing those actions.   Best of luck to you and your family. I cannot imagine what it must feel like to be in the US right now, and hope you stay safe.",xtaberry,2025-04-01T13:21:34,3
"This is how Hitler started.  It was called the AKtion T4.  It started with people with disabilities and political dissident, communists, before going after Jews.  There is a very good article Left Voice,  ICE vs. Gestapo.  We all have to worry Unless your supreme, white, pro capitalist and know how to “lick up”.",Windthrusiberia,2025-04-26T13:32:53,1
I’ve heard this quote before!  And it is beautiful.,Windthrusiberia,2025-04-26T13:34:56,1
"But that's why your government has due process. The administration is bypassing due process and deporting people without taking the steps that previously would have been mandatory. They deported a man with protected status without going to a judge to revoke that status. They've deported permanent residents for crimes they have not been convicted of in a court of law.   If you remove the requirement for a guilty verdict in court and start detaining suspected murderers in prison regardless, there is going to be a lot more wrongfully detained murderers. Isn't that exactly what the American government is doing now with migrants and deportation? ",xtaberry,2025-04-01T13:25:09,8
"Due fucking process. And why are they being sent THERE specifically? If they are here illegally, get them back to their country of origin. Not a random fucking prison in a random fucking country.  I am talking of course about the Venezuelans who were sent there without due process.   https://abcnews.go.com/amp/Politics/venezuelan-migrant-recently-deported-el-salvador-final-order/story?id=120353709",Netherpirate,2025-04-01T18:06:18,5
">**Why must the USA have the dumbest immigration policies on the planet?**  You really think the USA's immigration policies are unrelated to the USA's status as the richest, most powerful country on the planet?  Future generations see something that past generations built, and instead of trying to understand ""why"", they just destroy it.",Interrophish,2025-04-01T16:12:11,6
"Deportation is one thing but sending migrants to a Cecot, a prison for some of the worst gangs in El Salvador, is fucked up.",JigglyPuffGuy,2025-04-01T17:13:31,4
"I mean. Lawful permanent residents are being deported too. That's not a citizen, but also not temporary or ephemeral by definition.  This question was about citizens because citizens ARE being caught in the wide net they are casting. I was just curious how far it had gone and to what extent - certainly questioning and detaining wrongfully, but it appears no further.",xtaberry,2025-04-01T11:17:58,5
"> No US Citizen will be deported.   Why do you believe this mass deportation will avoid the pitfalls of Operation Wetback, when Operation Wetback still had to provide due process and the current operation does not?  Why do you believe it will avoid the pitfalls of Trump's previous term, where deportations were less numerous and due process was still legally required?",BiblioEngineer,2025-04-01T20:49:37,1
https://immigrationimpact.com/2021/07/30/ice-deport-us-citizens/,Cyphinate,2025-04-22T14:24:57,1
"The US has a worldwide reputation of being ""the richest country"", however, when you notice the intricate relations of public accounts and nature resources, it becomes clear that it is in fact a really poor country. That's the reason that, in proportion, compare to Europe and , Canada and South America, US will and is bankrupting completely, causing this desperate attempt to purge deficits by deportation, public institutions unassembled and the forcing of importations/exportation rebalance by tariffs.   The US needs help, but the prideful, boastful and arrogant manner that it's propaganda and policy is being managed is hindering this help to come instead of allowing and attracting it.",secret_chord_,2025-04-01T10:59:06,1
"The law doesn't apply strictly only to american citizens, it applies to everyone present in America regardless of their status.   It's a slippery slope when there is no due process.   And the line the trump cronies are taking is dangerous any questions of due process are deflected with accusations of supporting terrorists or praising how good of job trump is doing.",[deleted],2025-04-01T15:03:48,28
"Just wait until they start doing it to us. Anyone who openly disagrees with the government, welcome to El Salvador!",Netherpirate,2025-04-01T18:03:41,4
"Dude is not a citizen, but he is a legal immigrant, and the Trump administrations has admitted it was an error. So they sent an innocent man to one of the most brutal prisons in the world. And because is outside of their jurisdiction said they cant get him back, and have washed their hands of the situation.   How are people okay with this even if he is not a citizen. This is a trial to see what they can do.",ruminaui,2025-04-01T08:29:25,59
Protest with your wallet. Only buy what you really need. The best way to make Republicans and their corporate sponsors feel pain is by not buying their products. And there is nothing they can do about that.,Huckleberry199,2025-04-03T21:34:02,2
"OK a slight bump that was enough to put him where he is. Now we've got 4 years of this trash government to suffer through,",AdhesivenessCivil581,2025-04-02T07:02:33,2
"I draw the line at “horrors of socialism”,   Because the U.S. doesn’t have enough.  Our Social Security is socialism.  Funding for disasters, funding for education is all socialism.   But what about the health industry in the US.  socialism??  NONE.  Trump would like to be rid of all and anything resembling socialism if he could!",Windthrusiberia,2025-04-26T13:14:25,1
"There will be no outrage until a white, middle class+ blue eyed boy with a promising ball throwing future and christian. Gets sent off and his well to do family and white girlfriend to be wife cry to media.    In mean time Trump is free to conduct as many ""mistakes"" as possible.",Sageblue32,2025-04-02T05:39:12,1
And they are deporting them to a place where they don’t BELONG!,Netherpirate,2025-04-01T18:06:42,6
"If Venezuela refuses to take them, it's very difficult to send them back there.",FreedomPocket,2025-04-03T05:49:34,1
">You really think the USA's immigration policies are unrelated to the USA's status as the richest, most powerful country on the planet?  Our policies in the past 10-20 years? yeah completely unrelated.   USA has lots of resource rich land, and due to our location we avoided both major world wars, leaving our industrial centers fully intact to take advantage of both post war booms.   taking top scientists (O-1 visas) from Germany after WW2 helped, sure.   > Future generations see something that past generations built, and instead of trying to understand ""why"", they just destroy it.  I don't think there's anything magical about Americans, or foreigners . I think humans are humans and we're all  (in large groups) the same regardless of skin color.  Culture matters though.  if your culture values education and innovation that culture will invent more.   if your culture values obedience and everyone being the same, you will invent less.      give 30 million people a great education, encourage them to innovate, to excel, and you will get a few people who come up with amazing ideas.      South korea's culture is hyper focused on education and a very hard work ethic.     5G smart phone technology was invented in south korea.    Its not because of skin color or ethnicity, just their culture.",discourse_friendly,2025-04-01T16:39:51,-2
"It is very fucked up.  It might stop waves of migrants after dems taken office in 2028 and we revert to ""walk in and we will look the other way""   but yeah its very fucked up.    I just want people deported back to their country of origin.  or if they select an other country that's the same distance or shorter, who will accept them, I'm fine with that too.",discourse_friendly,2025-04-01T17:16:21,0
"No they are not.   Green cards can be issued as temporary (I always thought green card = permanent resident, but I was wrong.)  That Columbia protester dude was on a temporary residency and had a green card, but did not have permanent residency.  No US Citizen has been deported.  People get questioned and detained by the police all the time.   It would be impossible for law enforcement to only ever interact with guilty people.  I've been detained and cited incorrectly before and went to court and was found innocent.",discourse_friendly,2025-04-01T11:31:44,-6
"in large enough numbers, law enforcement will always make mistakes.   we could secure our borer so we don't get into this situation again.      accepting 10 million unauthorized migrants isn't the answer.",discourse_friendly,2025-04-22T14:40:29,1
yeah paying billions to house and feed migrants looking for jobs we don't have or are automating away will clearly provide the help we need.,discourse_friendly,2025-04-01T11:09:06,-2
"Oh absolutely. I am not emphasizing citizenship because I think citizens are more important or deserving of basic rights. It's egregious what is happening to lawful immigrants.   But I KNOW they've slipped down the slope from illegal migrants to legal students and green card holders. That is horrifying, but not the focus of the question because I can see it is certainly true.   I am asking if it's slipped further, because it seems like it will but I am ignorant as to whether it has and was finding limited information when looking into it.",xtaberry,2025-04-01T17:01:56,8
"I'm not American and not living in America, so if they're sending me to El Salvador shit has really hit the fan. Best of luck to you though haha.   In all seriousness - I've lived and worked in the US. There is a lot of opportunity in my industry there. But I would never even consider returning because of the political situation - Trump obviously, but also just the growing polarization. It's a time bomb.",xtaberry,2025-04-01T19:51:58,3
"For sure, one very small step away from doing this to a citizen.  The silence from the Right who were always bemoaning governmental overreach and tyranny is deafening.",InterPunct,2025-04-01T11:28:09,13
">And because is outside of their jurisdiction said they cant get him back,  Which is absolute bullshit. They absolutely can get him back. They don't want to. They want to show that they'll take you and throw you away no matter who you are",RegressToTheMean,2025-04-02T06:58:11,2
"Oh I am absolutely not okay with it, although I suppose I have little say over the actions of another country's government as a non-American. I was aware that things have progressed all the way to permanent residents and protected asylum seekers (specific examples provided here are highly appreciated to demonstrate this point). The obvious next step is ""deporting"" a citizen, which I do not doubt will happen. They are testing the waters. But it doesn't seem like they've crossed the line... Yet.",xtaberry,2025-04-01T08:39:54,2
"I'm not ok with this happening. If it can happen to him eventually it can happen to others, including myself",shrekerecker97,2025-04-01T17:55:32,1
