Comment,Author,Date,Score
"[A reminder for everyone](https://www.reddit.com/r/PoliticalDiscussion/comments/4479er/rules_explanations_and_reminders/). This is a subreddit for genuine discussion:  * Please keep it civil. Report rulebreaking comments for moderator review. * Don't post low effort comments like joke threads, memes, slogans, or links without context. * Help prevent this subreddit from becoming an echo chamber. Please don't downvote comments with which you disagree.  Violators will be fed to the bear.  ---  *I am a bot, and this action was performed automatically. Please [contact the moderators of this subreddit](/message/compose/?to=/r/PoliticalDiscussion) if you have any questions or concerns.*",AutoModerator,2025-05-04T10:49:50,1
"It's not exactly polarization (absolutely a huge problem) as much as it is that one side's ideas and goals are not based in or aligned with reality. The economy is now global and the right has a fundamental misunderstanding of what our trade ""deficit"" and national debt actually mean in that context, which sets them up to fight/vote against policies that would strengthen our position in the world financially and diplomatically.  We are seeing this accelerate America's one-country race to the bottom in real time. Russia has a big head start in that direction, but apparently American oligarchs saw that situation and decided that's the future they want for America.   Sure, the left has its issues with radicalization, but if it were to be allowed to drive foreign and domestic policy in the same way as the right is doing at light speed through trump right now, the worst that would happen is that some jobs would be lost and the economy might contract a bit in the name of protecting the environment and providing health care to people. The benefits would massively outweigh the costs over the long term.",frisbeejesus,2025-05-04T18:09:24,102
"Ideologically I’m not sure it’s fair to say MAGA is conservative, at least in the traditional definition.",RChrisCoble,2025-05-04T18:17:46,54
"I'd say our prospects are collapsing.  This foolish America-versus-the-world trade war has put us in a weak position and laid bare our flaws as a functional democracy.  The US dollar has been the world's reserve currency because the world could trust that the US economy and institutions would remain stable and strong.  No longer.  We the people have proven ourselves to be unreliable (twice electing an unstable amateur with delusions of grandeur), and Trump has sealed the deal by eroding the institutions and throwing the economy into chaos.",the_malabar_front,2025-05-04T18:13:43,25
Most likely stagnation. The birth rate is low. The debt is high. It's unclear as to whether or not technology gains will drive inequality higher.   It's possible that a moonshot technology like self-driving cars or asteroid mining will expand the economy but I'm not holding my breath.,bunsNT,2025-05-04T19:34:21,9
"Usa has news media that promote all of that, seems like Republicans and the rest of the US live in different realities. There are no consequences for misinformation, no consequences for lying, I don't see how it will get better",Spirited_Hamster2606,2025-05-04T18:06:36,15
"I think it’s a big problem and will continue to hamper effective governance, but not sure it’s a root level problem or just the byproduct of other issues (like the dying print media industry, dark money and weak campaign finance laws, gerrymandering and partisan primaries, fpp voting and the electoral college).  The fact that congress is stuck in permanent partisan gridlock and thus most consequential lawmaking is happening via EO in recent years definitely reflects and possibly exacerbates the divisions. I think structural reforms are overdue at the federal level. Trump is at least cosplaying to do that (in wrong direction imho), but again via EO so doesn’t offer the resilience/stability that actual congressional laws or constitutional amendments offer.",peetnice,2025-05-04T18:08:04,10
"Ideological standoff? Political division? Is this post from like 2012? We are just trying to survive 145% tariff charges imposed by a drug induced fever dream. We are just trying to figure out how many vets are going to line the streets, homeless after his disastrous elimination of their mortgage help.  Political division? No, man. This is a five alarm fire set by a right wing extremist whose point is to ruin this country. His success equals our collapse. This isn't an ideological standoff.",All_is_a_conspiracy,2025-05-05T02:08:46,7
"Biden’s economy was booming by all objective measures and the infrastructure bill and IRA were creating a massive factory construction boom that was projected to grow the economy and add hundreds of thousands of good paying middle class jobs. Even the oil & gas industry was making  record profits. It was called the envy of the world. Trump is trashing those gains out of spite and ideology. His unprovoked trade war is also destroying US influence in the world and driving up consumer prices. I think there is only one clear roadblock to the US economy continuing to grow and prosper, and it's not political division.",mafco,2025-05-04T18:27:10,15
"To answer your question, ask an observer from outside the States. Unquestionably, they generally know more about US Geopolitics and Economics than Americans due to the differences in the consumption and sourcing of News.   I'm European, so have a very different perspective. We regularly meet Americans who have moved here to live and work and, when asked,  all the members of this diaspora (without exception) have no intention of ever returning to the States. From our perspective, the US is in rapid decline, and it seems that many many Americans are completely oblivious to the reasons why. This is due to the lack of attention given to current affairs and, more importantly, international news. As painful as it can sometimes be, it is often a very good idea to read or watch international news bulletins covering your country as they most often present a very impartial analysis.  So, as a European living within a collection of 27 individual countries with different cultures and languages, why has our society thrived and what are the things we would suggest should be done in the US in order to reverse the trend? Well, let's look at five very stark differences first.  1. Health. Generally, the health services in the EU are free to all citizens. It is free to call an ambulance. Prescriptions cost nothing, or very, very little. Children's healthcare is completely free. You can get private health insurance if you want, but the public systems can be just as good. The thinking here is that if your population is less stressed about health and it's cost, them productivity and morale increase. In the US, people's access to healthcare is tied to their employment, through benefits. In other words, your employer has you by the balls. This is why the majority of rational Americans are petrified of protesting as they are afraid of losing their job and, by extension, their health benefits.  2. Education: Again, more or less free for ALL citizens, and there are also grants and financial supports for those lower down on the economic scale. Over 95% of European citizens have college or university education, with English being the Lingua Franca. Take Ireland as an example. In the 80's, it was in the midst of the Troubles and an economic basket case. The government offered free education to all and, within a few decades, the country was transformed into one of the richest in the World. ( although, living here, we have made a few mistakes when it comes to not enough housing, but that will be addressed very soon. It's not like we don't have the money to do it).   3. Social Supports and Taxes. Unlike the US, We can see where our taxes go, which is why we more or less accept the annoyance of paying them. They pay for health, education, infrastructure, social supports, welfare, and all the important things which a society needs to be successful. I'm return, employee rights are very favourable. We are entitled to 21 days holidays each year ( more in some countries), we get sick pay, parental leave and public holidays. We work to live, not live to work. This actually increases productivity. A happy workforce, and all that. We simply cannot understand how, in the US, the idea of using taxes to look after your citizens in your society, particularly the vulnerable, can be deemed as communism in America. It's a deeply flawed viewpoint. Our system in the EU has worked successfully for a long time.   4. Secularism and the separation of Church and State. Example: In Europe, If a candidate running for election even mentioned God, Jesus, Muhammad, the Virgin Mary or religion in any way, they would be immediately dismissed, ridiculed or ignored by the populace. Bringing religion into politics is a big ""no-no"" and there is a definite line between church and state. Not so in the US. Religious fanaticism and Christian evangelicalism is threaded through almost every facet of US politics and has created an extremely dangerous situation, feeding into the ideology of Right-Wing American. It's interesting to note that, apart from possibly Bernie Saunders, there is not one single politician in the US at the moment who would be taken seriously if they ran for election in Europe. Our press would eat them alive, for starters! Europe is a very secular entity, and it works.   5. Freedom and safety. Despite what many in America would have you believe, compared to Europe, the US is certainly not ""free"" and hasn't been for a long time. You must remember something. In Europe, we live in a Rules-based society, BY CHOICE!. Our politicians and laws work because they are mandated by we, the citizens. We need rules to manage a society populated by half a Billion people, otherwise you get chaos. That's not suppression of freedom, its just common sense! Our press have far more latitude to hold politicians to account. We have freedom of speech, but we also temper it with hate-speech legislation. But that's OK! In fact, it's necessary!. We are free to walk our roads without being picked up by police for....well, WALKING! ( This happened to me in Staunton, Virginia, when I went on a stroll out of town one sunny summer's evening. Walking, it seems, is frowned upon!). We have state or public broadcasting organisations who's job is to have the freedom to question the activities and choices of our politicians on our behalf. This key component is missing in the States.  On Safety, we simply banned 99.999% of guns. We did, the people. It wasn't forced on us. We did it to protect our society and our children.  In Ireland, our police are unarmed. Yep. No guns. Considering our history, that's quite remarkable. Now most of you already know some of our history, an everyone on the planet knows how completely flawed the US is in its approach to gun ownership, so there's no need to repeat it, yet again. I'll just leave it by saying this. We have had zero school-shootings, and zero mass shootings in our country since the foundation of the state. In fact, I'm 53 and have never even seen a real gun in Ireland. I'm not a farmer!  There's five points to start with. In my view, if the US could tackle these five issues, together with changing your voting system to something similar to ours, which is Proportional Representation, the positive effects on your society and Economy would be profound.",Lopsided_Drawer_7384,2025-05-05T03:53:52,8
I read a letter Jimmy Carter wrote. He said China is pulling ahead on the world stage. His reason is they are not spending national wealth on war. They are spending on infrastructure and foreign “soft power” projects. The U. S. has spent trillions of dollars on wars. What did it buy us?,East_Committee_8527,2025-05-04T20:57:16,4
There is a historical precedent for the economic and political situation that we are in. The Gilded Age.  It's worth looking into how that was resolved.,lioneaglegriffin,2025-05-04T21:05:21,3
China is going to collapse like the Soviet Union did before it if America truly manages to reverse the mistake they made with letting China join the WTO in 2000,fairenbalanced,2025-05-04T19:42:48,5
Have you followed the news lately?  We are fast-tracking our own collapse. It is quite a spectacle. After this year is over I don't think there will be any turning back.,NomadicScribe,2025-05-04T19:47:20,4
We're screwed. The wealthiest 1% are going to end up owning everything. The rest of us are going to be begging for scraps.,ZenGeezer,2025-05-04T20:51:19,2
"""the next generation""??? The rich white old men behind all of this don't care about the next generation. If they did, we would have tackled climate change decades ago. They care about themselves, like all evil, power hungry men, they care about themselves and what happens after they die doesn't matter to them. Grandkids, bahhh, let them figure it out for themselves. Vile - a tale as old as time. History has taught us nothing.",Pie-Guy,2025-05-05T05:50:10,2
"Collapsing at the moment. Mass tariffs are a great way to destroy a nation's economy. That's why nobody does them. Nationalist economic policies are horrible for a nation and especially in 2025 because the world is just globalized - there is no changing that. If you don't participate in the global economy as freely as possible you just lose big time to whoever else does. It's like if an NFL team decided to not use the forward pass and only go with a run game. Because globalization is efficient. There are tons of things the US can't do and tons of resources we don't have in the quantities needed to be self sufficient. And some jobs are best done by poor people in poor countries - jobs that would simply not exist in the US because the high wages would make them not profitable. If we moved textile manufacturing back to the US like trump wants to, then the price of clothing would skyrocket. It's also a terrible job that no one wants to do. We're lucky here because we're industrialized and rich, so we should be focusing on high paying jobs and working to improve our educational system to ensure we keep those jobs here. Not bring back unskilled menial labor jobs.   We're also slowly declining for a number of reasons. We've taken our foot off the gas with education. We focus on a service economy that doesn't create durable goods. Our corporations are focused on quarterly reports that they put short term profits above long term stability. And we're allowing all wealth to be accumulated in just a few hands, which leads to mass poverty and a sicker work force.   It's telling that immigrants are the people who do the best here, because they bring a much stronger work ethic. Most American companies have switched to models that constantly require selling less product for more money. Nothing is made to last. Subscription based products are just focused on ripping people off without delivering anything extra.   Socialism is a failed experiment IMO, but the kind of capitalism we have developed here is failing spectacularly at delivering a better life for people. So much so that millions of people are trying to go back to simpler ways of living like mini farms. Our capitalism doesn't reward the strongest competitors - instead it rewards those who capture political positions and fleece the taxpayers, and pump up stocks with stupid tricks. Musk is a prime example. He's gotten tens of billions of dollars in free government help to build businesses where he and other shareholders keep all the profits, and he pumps up the stock price with gimmicks instead of delivering a good profit.   We're in bad shape long term but trump's tariffs are throwing gas on the fire. China is winning the trade war and will be the new economic superpower soon.",Constant-Kick6183,2025-05-05T16:27:25,2
"Collapsing. People are delusional if they think manufacturing is going to come back to America with a tariff in place. People can’t even afford building materials now. Come the fuck on.  I’m a tiny business, I order 380 items of inventory every two weeks for $815. I make $4900 off that. I’ve been able to buy a house, I had $28,000 in savings when he was elected, and I had my electric shut off last week for two days. Single mother with two kids, I had no running water for two whole days. That $815? Yeah, it’s now $1907.10. I mean, how the fuck is that sustainable?  But it’s more than that, he went after federal grants and fed funding. So the daycare subsidy that I had is gone, they have no money, my daycare for my two children, one toddler full-time, one six-year-old after school, *was* $200 a week. $800 a month, which is *still* a lot tbh. **Now its $590 a fucking week.**  Let’s talk about energy costs, that shit’s not going down. He forgets that a lot of the country gets our power from Canada!! Wants to get on national TV and lie, saying that we don’t need them or depend on them for energy lol. I had a $222 delivery fee last month!!! JUST THE DELIVERY FEE.  So between the tariffs, the grants that are gone, the energy prices skyrocketing, **our gas is still exactly the same, $3.25-3.50 a gallon.** the grocery prices are through the roof, we’re gonna lose everything. The middle class is going to be demolished. Which is his goal, and then him and his buddies can come through and buy up all of our properties. Kind of like how they’re doing a pump and dump on the economy right now. We have racist calling little kids slurs and getting almost $1 million in gofundme or whatever in like a few days! Wow, hard-working honest, single parents like myself are worried about how we’re gonna feed our kids, so we go hungry to make sure our kids can eat. But sure Trump, I just won’t buy them “30 dolls”. You guys need to buckle the fuck up. Because People seem to forget that society is society for a reason. We depend on each other, so when everybody starts to go down, you’re gonna feel it too.",NotDysmorphia,2025-05-06T17:40:28,2
"I would suggest remembering that the united states at one point in its history that a entire coalition of states attempted to break away and form their own nation.    It may be unprecedented times for us individually, but that's about it.",benfromgr,2025-05-04T18:27:26,4
I think it's more due to a combination of pervasive disinformation and some type of cult-like influence causing traditional conservatives to embrace Trumpism instead. At least that's what I hope it is. Otherwise we're screwed.,mafco,2025-05-04T19:04:59,3
"Half the country is pro-religion in Government, pro-white nationalism, Pro-Oligarchs, and anti-education.  This combination is enabling them to vote out the rest 50% of the time and the damage they do cannot be repaired fast enough to recover so we're declining rapidly.  Unless this group sees the damage (unlikely) we're causing for a class/cast society where the bottom 50% will be ""untouchables""(ala India) within 50 years.",zonearc,2025-05-04T19:55:05,3
"The polarization isn't actually new:  - The colonies were divided around whether or not to seek independence; especially when that result required war. That polarization continued through at least Adam's first term.  - The American Civil War is probably the end marker on one side of the polarization scale.  - WWI   - WWII  - The Civil Rights movement (although this was largely concentrated in the South)  There's many others, but these are probably the top five. Our short-term economic prospects are absolutely declining - its barely been 3 months and we're already seeing the warning signs of trouble. Long-term will depend on how long this stupidity continues.",ParentalAdvis0ry,2025-05-04T19:09:25,2
"The damage that Trump and his Republican enablers have done already to the American economy will take decades if not a century to reverse.  And that’s not just in terms of growth, but international trust.    Our former trade partners are going to find alternate suppliers amidst this tariff uncertainty and they’re simply not going to switch back.  Nobody will make significant or lasting deals with America because the electorate can’t be counted on to vote against inconsistent or hostile leadership in the next term.  We also rely a lot on tourism, and that’s already seen a sharp decline as international travelers avoid the US for safety and ideological reasons.  Where I live, I fear the Canadians snowbirds that help power our economy are simply not going to come back at the end of this year.  They’re fucking pissed, and they have a right to be when the POTUS keeps saying he wants to annex them.    We’ve already had one quarter of negative growth, so we are well on our way to an official recession.  Store shelves are going to be bare in just a couple weeks, and people will start hoarding supplies.  More lay-offs will occur.  Our federal government’s been gutted, so nobody’s getting assistance there.  Insiders think that Social Security checks are likely to be interrupted, and that’s not even counting if they get outright slashed in the budget bill alongside Medicare.  (And yes, I KNOW, Trump and the Republicans keep saying that they won’t touch either.  But the math says that they’re lying about that unless they redraft the budget.)",willowdove01,2025-05-04T20:23:28,2
"Political division isn't at fault, but economic prospects for the US are cratering. The future for the US will involve:  * the dollar losing is status as the reserve currency * hyperinflation as the dollar loses value * virtually no leverage in trade deals * a collapse of the impory/export market * the dissolution of most social safety nets * demographic collapse no longer slowed by immigration  Let me put it bluntly. The US is doing every single wrong move for a country in its economic position. There is no bottom floor for this type of reckless stupidity.  This the result of stagnation or division. It is the result of one side winning and enacting their policies by emergency decree, over the advice of every expert on economics or history.",ManBearScientist,2025-05-04T20:27:02,2
American post war growth was largely due to being the only significant industrial economy still standing.    The growth of government had retarded economic growth.,IntrepidAd2478,2025-05-05T09:37:54,1
"I think we need a combination of policies and shouldn't just follow one path. The UK has universal healthcare, more robust and generous social programs, and higher taxes on the rich. These are all things advocated for here in the US. Yet the UK is in decline and people are struggling to get by. I think we need tax incentives to encourage entrepreneurship and common sense regulations that let businesses thrive. That in conjunction with social safety nets is the path I think we should follow. It may sound counter intuitive and the thought is we need to increase taxes to pay for social programs. But I think reducing taxes and creating an environment for business to thrive would bring in more revenue which could be used for social programs.",Ham-N-Burg,2025-05-06T17:53:36,1
"To be completely honest, the way I see it playing out is one of many different scenarios. Republicans either hold control in 2026 and 2028 or they lose twice and allow a little bit of sanity back into our internal and external economics. The Republican Plan is completely outrageous and it has been essentially since Reagan tried it. Cut taxes and hope that props up the economy enough for it to hold. Key issue though is that it almost never works. Cutting taxes doesn’t necessarily end recessions nor does it accomplish the things people say it does. It doesn’t spark extended periods of job growth nor does it stimulate the economy, keep in mind it costs a hell of a lot of money too. It’s been 30 years since Reagan was in office and the wage gaps have only increased, and nothing has really changed. If this plan is launched and they keep it in place, our economy will lower and I see it as bottoming out compared to what we know, before becoming the new standard and everybody taking credit for that",XxCaptainJayxX1,2025-05-07T11:34:44,1
"It's both happening at the same time, rising and collapsing.  Trump does an action. Republicans follow, and the actions either looks like more self destruction, or external destruction.  Trump bans soy beans from being sold in china. On the one hand USA loses money, on the other hands Republican who rely on making money with soy beans lose power.  The Question is which is happening faster,  Imagine a world where All Republican voters were abducted by aliens. Nobody standing in the way of Universal healthcare, or free college. Nobody trying keep trying to keep Coal mines open. Or cutting funding on scientific research.  People supporting trains instead of relying on trucks that tear up our road system.",ComprehensiveHold382,2025-05-09T04:17:44,1
