Comment,Author,Date,Score"The prospects are dim, expect a major depression/recession.  We essentially need the politicians to come together recognize and be serious about solutions.  We have been running debt forever, but over the last ten years and accelerating over COVID, where it was fine before, it is taking a life of its own and it is not controllable without severe pain.  We wont recognize it until it is too late.  The problem is the basic understanding of economics, money and MMT.  We can all agree that if we were incredibly productive, we would have tons of products/goods/services, real wealth, enough for everyone, they would be cheap and we would be prosperous.  The economic system is built to encourage people to produce.  The problem get to be in how we divide wealth and if the right proportion of products are being made, traditionally guns vs. butter.  That is where money comes in, it is simply how we divide/claim things of actual value.    The problem is that the Federal government spends much more money than it collects.  It claims goods, and produces, well mostly paperwork, albeit with some roads, and guns, etc.  It is too big, about 35% of the GDP, so not enough butter.  The problem is that we are in debt more than the GDP, we owe 29/36 T (the first part is owed to the public, with the second includes that part the government holds itself).  The point is that 1.1T dollars of the  deficit was interest payments on this debt.  It is compounding, it is accelerating towards a crisis.  Some modern economists want to dismiss the problem. But we can either fund more debt (hastening our default), simply have the government just keep paying the bills from uncollected funds (print money), or they say (MMT Kelton)  can grow with the debt, say GDP growth of >3%(not  dependable possible for about 20 years now).  But that is not going to happen, we have an aging population, low birth rate, and immigrants tend to be poor requiring years to develop to produce the tax revenue we need.   We desperately\\need more rich people and businesses to tax.  If we print more money to pay our deficits rather than issuing bonds, we are stealing value from the dollar, which hurt all dollar holders, which will cause selling of dollars worldwide.  The inflation that is caused does not necessarily lead to the right kind of economic growth.  For instance, if you flood the economy with dollars via the Fed Reserve to mostly goes to the wealthy.  What are they going to buy?  Real estate.  What are we going to build more luxury homes, not more food, or start homes or apts, so what happened during Covid?  The basic reality is that we need to add to the supply side, we need to produce the necessary and correct goods for the non-rich public that are taken by the government (or otherwise not produced in lieu of government funding), no monetary theory can change that.  UPenn and Wharton have been studying this, but we are so far gone that the cuts they propose will almost certainly, will not happen for the next few years (if ever for the Democrats).  I think Trump thinks he can grows us out of it by promoting business in the US, but he will be stymied by people who down understand.  Lastly, all we need is one more war to fund or recession, and it becomes impossible to work our way out.",kenmele,2025-05-10T16:00:33,1
"There is also another elephant in the room that Americans seem to be ignoring. That is, it's unrelenting support for Israel and the ongoing genocide in Gaza.  The US is currently on the wrong side of history here and have underestimated the extent to which Europeans, in particular, see this as a red-line situation.  It seems that Americans do not understand the differences between antisemitism, and criticism of Israeli foreign policy.  This flawed view was highlighted in the recent hearings for the appointment of ambassadors to European countries. Republican senators seemed to be unable to understand both Irelands and the Netherland's approach to Israeli actions in Gaza, together with the International Criminal Court. This may seem irrelevant to Americans but what you don't realise is that European policies are driven by the mandate of the citizens. Almost all European citizens oppose US and Israeli policies in the middle east, which only hastens and strengthens our resolve to completely disassociate ourselves from America in every possible way.  It's not a good look when European citizens phones are checked for criticism of Israeli foregin policies. All this does is to discourage any European from travelling to the US for either business or pleasure.  This is already having a detrimental effect on tourism in the US.  It's as if Americans are completely oblivious to what's actually going on in the world around them.",Lopsided_Drawer_7384,2025-05-05T04:16:32,1
Our “worst that could happen” is actually pretty good. I don’t even want to think about the “worst that could happen” with the right.,chamrockblarneystone,2025-05-04T21:46:16,25
"> the right has a fundamental misunderstanding  Depends on who you mean by 'the right.'  I would bet that at least half the Republicans in the Senate have been freaking out from the get-go, but are too afraid to speak up.",ColossusOfChoads,2025-05-05T03:03:32,10
"On one hand, tariff fucking the whole world wipes out american companies, on the other hand, there havent been enough push for reshoring if manufacturing ability and throwing money at it isnt always the only solution. The CHIPS act was a step in the right direction but there ought to be penalties for companies not actively moving away from China.    The best case scenario, trumps tarrifs gives some greedy corpos a kick in the ass to reshore their manufacturing ability while generating mass in countries not adversarial to us. Then when we finally get someone with their head screwed on straight, then maybe mend our relationship with allies and lower some tarrifs to allow companies to survive and reorganize without going bankrupt.   I can agree with some of trumps end goals like europe needing to step up, reforming shipbuilding, the stance against China and reshoring manufacturing ability to the U.S. But the way hes gone about these things is fucking dumb.",i_rae_shun,2025-05-05T05:35:14,-2
"I disagree. This movement has just evolved. The confederacy to the Nixons southern strategy and Reagan revolution to the MAGA movement, this is the core of the conservative movement. The main motivation of the movement is racial politics and they make up the overall base of the conservative movement.",PreparationAdvanced9,2025-05-04T20:53:57,11
I second that. Traditional conservatism was about preserving American values and institutions.  Like the Constitution.  MAGA is taking a wrecking ball to all of that in favor of authoritarianism and far-right extremism.,mafco,2025-05-04T18:31:23,37
"Conservativism is ultimately about undoing the Enlightenment, so they are very much conservative.",das_war_ein_Befehl,2025-05-04T20:39:46,8
There sure is an interesting overlap though.,Oneoftheotherpeople,2025-05-04T18:45:40,3
"This morning, while reading the latest on the administrations' attacks on the courts, I thought to myself ""the Democrats are the conservatives now.""",ColossusOfChoads,2025-05-05T03:04:51,1
Do you think the birth rate will increase if abortion bans take effect in the majority of red states?,morrison4371,2025-05-05T20:16:48,1
Could end up putting china and the EU in a better relationship. Catastrophic for the US but possibly better for other nations,weealex,2025-05-04T18:12:55,3
It’s a root level problem that the U.S. is now politically unstable and has politics that resemble that of a developing country.   Economic growth comes from stability and long-term investments/coordination of national resources. Big policy shifts every 4 years just mean whiplash and stagnation. Really resembles Argentina in many ways.,das_war_ein_Befehl,2025-05-04T20:42:26,4
It wouldn't be stuck if MAGA Repubs were voted out. Repubs are the problem & they have been since Nixon.,Successful-Extent-22,2025-05-04T19:34:03,5
"1) The majority of US states (41 out of 50 states now) are now under Medicaid expansion laws that covers unemployment so your hilariously incorrect take on most Americans being too scared to protest because of losing health insurance doesn't face with reality in that the majority of Americans have access to healthcare even during unemployment.   2) PISA scores put America below Canada, Australia, and Ireland but higher than France, Spain, Norway, and Germany: [https://www.datapandas.org/ranking/pisa-scores-by-country](https://www.datapandas.org/ranking/pisa-scores-by-country)  3) In addition to Medicaid expansion for the utterly vast majority of Americans by now, there's also WIC for baby care and pregnancy, SNAP/EBT for general food purchases, LIHEAP for electricity and home heating and cooling, Section 8 for subsidised rent, SSI/SSDI for disability (although this needs reform), Lifeline for government-paid mobile phones, and TANF for temporary welfare assistance. Paid leave is definitely something the US falls behind even accounting for employer-based leave policies [https://www.bls.gov/charts/employee-benefits/paid-leave-sick-vacation-days-by-service-requirement.htm](https://www.bls.gov/charts/employee-benefits/paid-leave-sick-vacation-days-by-service-requirement.htm), however, progress have been made with 3 states concerning paid leave mandates.   4) That's a hilarious take considering Bernie Sanders and possibly even Nancy Pelosi is now arguably to the left of Sir Keir Starmer right now.  5) Around 32% of Americans own guns which is roughly on par with a few European countries so the 99.9999% of guns figure is simply a made up number out of your behind: [https://www.reddit.com/r/MapPorn/comments/12ukc44/gun\_ownership\_rate\_in\_european\_countries/#lightbox](https://www.reddit.com/r/MapPorn/comments/12ukc44/gun_ownership_rate_in_european_countries/#lightbox) . Regulations and mandated training, of course, are better in these European countries with high gun ownership rates but to state that all of Europe bans guns is a lie concocted by myopic Anglo-Irish media consumption.",mbandi54,2025-05-07T03:39:17,1
"More like thirds.  A third is for that, a third is against it, and the other third either doesn't give a shit or doesn't know what to think.",ColossusOfChoads,2025-05-05T03:13:38,3
"Germany's planning to deport a US citizen, a Pole, an Irish for pro-Palestinian activities.   [https://www.dw.com/en/eu-us-citizens-face-deportation-from-germany/a-72142014](https://www.dw.com/en/eu-us-citizens-face-deportation-from-germany/a-72142014)",mbandi54,2025-05-07T03:02:18,1
Bout to find out,btone911,2025-05-05T19:00:30,6
"OK, but that's worse, though. You do understand how that's worse, right?",Zadow,2025-05-05T07:29:11,24
Reshoring manufacturing is one of those pipedreams conservatives hold onto that is simply not realistic. Companies aren't going to expend the resources and decades to rebuild more costly manufacturing in a country that can't seem to avoid electing a complete moron and mob-like felon who will seek to extort and control them.,frisbeejesus,2025-05-05T07:12:09,18
"Reshore manufacturing? Trump’s policies are *closing* existing and planned factories in multiple industries, including steel and automotive.",Persea_americana,2025-05-05T21:50:03,1
Conservatives have been actively hostile toward American values and the Constitution for longer than anyone posting here has been alive. It's always been disingenuous bullshit.,GreenZebra23,2025-05-04T19:27:13,23
"Yep, along with the complete perversion of Christianity, by the same people who claim to hold it dear.",RChrisCoble,2025-05-04T18:32:49,19
Not true. This is a realignment with what they really meant the whole time.   Conserving power structures. This is aligned with capital's (the elites) interest in maintaining capital's power. That's all it's ever been. Disenfranchising the poor and limiting their ability to organize to fight for better conditions. This is exactly the way it's been since the coal mining says where they used the first police forces to track down runaway slaves and execute protesting miners who fought for better conditions.   They would love to return us to some techno feudalism world where the poor are basically servants for a few ultra wealthy.,Oddblivious,2025-05-05T16:57:12,1
Our republic was supposed to have been the product of the Enlightenment.,ColossusOfChoads,2025-05-05T03:07:05,1
Maybe? I think most states have voted to keep the rights more or less where they are since Dobbs,bunsNT,2025-05-05T22:40:36,2
"I don't think it will benefit anyone, the USA as a country was the pillar that kept most countries in check. Gained a lot of it, and the rest of the world allowed it. Stability comes with a price. The EU isn't that united, it's an economical union, not a military one. Won't be easy to make it a reference like USA used to be. And China is China, we are all feeding the dragon that can bite us anytime",Spirited_Hamster2606,2025-05-04T18:18:52,6
"As that French guy pointed out, the developed world is beholden to the whims of the voters of Wisconsin.",ColossusOfChoads,2025-05-05T03:08:54,3
"And? Why is that surprising? It's Germany. A country so cobbled and blinkered by guilt that that they trip over themselves trying NOT to criticise Israel. It took an enormous amount of self reflection for them to even put the Iron Cross back on their aircraft, for God's sake. Thankfully, the majority of German's are beginning to see common sense.",Lopsided_Drawer_7384,2025-05-09T04:39:48,1
"Yeah, I suppose it is.",ColossusOfChoads,2025-05-06T03:36:58,2
"Well it's not realistic with conservative policy, which is the ironic thing. It would take a massive government effort to nationalize resources and a planned economy to get anywhere close to ""reshoring manufacturing"".",Zadow,2025-05-05T07:31:50,6
"Well, I dont know if the election part has as much to do with this as the costs of paying workers and the environmental red tapes that complicates building large factories.   Corpos need to learn to invest in the future and in its workers rather than maximizing returns for investors. Its the shortsightedness that is more concerning.",i_rae_shun,2025-05-05T07:20:57,1
"You may be right about the party leaders. But I know rank and file conservatives who love the Constitution as much as the Bible, still get misty-eyed when they hear the Star Spangled Banner and think Russia is evil. Unfortunately their brains were addled by a constant barrage of misinformation from Trump, Republicans and the right-wing media to the point they believed Trump would 'save' America rather than destroy it.",mafco,2025-05-04T19:46:54,7
"European here. That ship has already sailed, I'm afraid. We are already well underway to uniting both militarily and economically and, judging by the recent hearings in relation to the appointment of US Ambassadors to European countries, the current administration has no idea what the current geopolitical situation is in Europe right now. In fact it's a certainty that, within 5 years, Europe will have developed deep ties with China and will have pivoted completely away from the US both militarily and economically. Our politicians are mandated by us to ensure that this occurs and there will be no turning back. Europe will never trust the US again.",Lopsided_Drawer_7384,2025-05-05T04:01:50,5
"In regards to the EU, China's just about turning a ~~buck~~ euro.  Maybe I'm an optimist, but they won't be able to pull the same debt trap shenanigans they've been pulling in the developing world.",ColossusOfChoads,2025-05-05T03:10:26,2
[deleted],[deleted],2025-05-04T19:09:18,1
"You could have said the same thing with your incorrect take on Americans' view on Israel which has now turned majority negative. It's weird that you separate Germany's government actions to that of the German people's opinion on Israel but don't do the same for America, especially as the American people also now turn sour on unconditional aid (or even just aid in general) to Israel. It's like you are completely oblivious to the recent Gallup polling (or any recent 2025 polls) on American people's views on foreign affairs and what's going on.",mbandi54,2025-05-09T10:57:18,1
"To be fair, global economic collapse might cause some reshoring in tandem with massive declines in standards of living.",jetpacksforall,2025-05-05T10:07:08,4
>Corpos need to learn to invest in the future and in its workers rather than maximizing returns for investors.  You want the capitalists to stop being capitalists?,Zadow,2025-05-05T07:33:14,4
"You mean the rank and file that have been voting for these party leaders and Republican representation that is expressly anti-American for decades.  Conservatives do not love the Constitution, the Constitution applies to everyone in the U.S.    Conservatives push an ideology that the Constitution should only apply to specific people they approve of and everyone else are excluded.  What made Trump popular with Conservatives wasnt a promise for jobs or economic prosperity it was opposition to social progress and anger about a black man being President.  Right before the election you had the Ferguson protests, systemic issues within law enforcement boiling over and Conservatives resisting any effort to address it.  Resisting efforts to ensure the U.S. Constitution was enforced across the board and everyones rights were protected.  Trump promised to set back the clock.  Look at the policies Trump supporters latched onto.  The whole anti-woke culture war.    Illegal immigration isnt actually a significant problem for the country, people focus on it because they are racist.  unempathetic and selfish, rather see people suffer than help them even when there is a shared benefit.  Exponentially more money is being spent to control immigration than illegal immigrants cost U.S. tax payers.  A fiscal conservative would look at 'Conservative' immigration policy and scream in terror.  The fact of the matter is that a tax and spend Democrat is not only a fiscal conservative in the sense that they are against deficit spending, but that they are for 'limited government,' when compared to 'Conservatives.'  Conservatives support increases in government spending for the top of the food chain while cutting resources to the bottom to the detriment of the country, while Democrats generally support increases in government spending across the board.  The absurd Republican Trickle Down theory, in combination with corporate influence since the 70s has basically been responsible for 120 trillion dollars being stolen from the bottom 90% to give to the 1%.  Its Republican policy driving increases in the size of government, increases in spending, increases in inflation and consumer prices.  Conservatives have long since dropped any pretext of supporting a Constitutional Republic in favor of Italian styled fascism.  Republicans are fiscal radicals and economic terrorists.   The reality is if the U.S. wanted to reduce illegal immigration it would change its foriegn and domestic policies to stop destabilizing South and Central America.  Trump passed sanctions on Latin America and used his private security to try and overthrow Venezuela, which increased the immigration into the U.S. and was responsible for the large influx of Venezuelans.  Again it was Republican border states that started busing mostly Venezuelan immigrants into L.A., Chicago, NYC, Denver, etc... With zero communication with local authorities as a political ploy to cause economic damage to Democratic controlled cities.  If Conservatives gave a single shit about any of the issues they pretend to care about none of this would have happened.  Its the same reason the far right has gained popularity in Europe.  Europe exploits Romania for its manufacturing and cheap labor, exploits its former colonies in Africa that only gained independence in the 60s and 70s.  And when immigrants arrive on boats they lose their shit?  Europe joins the U.S. in interfering in Middle Eastern affairs, contributing to generations of war destabilizing the entire region and then turn around and complain when people flee to someplace safer?  Sorry, but the rank and file hated Obama because he was black, voted for Trump because they were racist.  The modern Republican party is a racist fascist Christian nationalist party.  They are modern day Nazis.  Republican voters cant disassociate from that.",neverendingchalupas,2025-05-05T08:01:09,8
"If balance of power can be peacefully achieved, I would agree with you, but I’m not sure how likely that is. There have been revanchist states that have been salivating at the prospect of the erosion American capabilities so how the world reacts to them will determine how the future order will be shaped.",alacp1234,2025-05-04T20:03:56,5
"Probably true, but unfortunately the US is a nuclear power and cannot be allowed to descend into chaos.",jetpacksforall,2025-05-05T10:16:46,3
"A fair point if this would be sustainable. But I think most business leaders are just preparing to weather the storm till Trump is gone, so we get the worst of both worlds.",Zadow,2025-05-05T10:27:10,3
Manufacturing chases poverty. So the US will need take a few massive steps down before it can be competitive with other countries that have worse labor laws and next to no environmental protections.,punktualPorcupine,2025-05-05T17:57:27,2
I mean if you want to reduce everything into ideology and slapping labels then there's really nothing to discuss lol.   There are definitely still examples of companies that invest heavily on research and still maintain good benefits for their workers. They also maintain quite a competitive edge in their fields. It may be that the nature of their fields demands as much (something lile aerospace) but other companies really ought to do the same.,i_rae_shun,2025-05-05T07:43:43,1
I could sue you for giving me whiplash nodding vigorously with most of what you wrote.,jetpacksforall,2025-05-05T10:12:32,2
[deleted],[deleted],2025-05-04T20:11:12,-3
Agreed. You would have to be 100% out of your mind to invest billions in new manufacturing supply chains in the US based on a tariff regime that changes on a daily basis.,jetpacksforall,2025-05-05T12:27:10,5
"Your agreement would be stronger if you actually provided an example.  Also… to reiterate the person above, you want capitalists to stop being capitalists?",CubaHorus91,2025-05-05T09:52:54,1
"Yeah, let's go back to how it was in 1913.  The Concert of ~~Europe~~ the Globe, held together in harmony....",ColossusOfChoads,2025-05-05T03:11:43,5
