Comment,Author,Date,Score
![gif](giphy|YYfEjWVqZ6NDG),twstdbydsn,2025-04-01T09:24:17,37
"Let's show Elon he can't buy his way into elections. Fuck you Elon Musk, go cry to Daddy Vladdy",OhioRanger_1803,2025-04-01T09:56:00,28
Do we have a shot at this? I'm just learning about this election today and have felt disconnected and unmotivated since November. Would be really nice to feel some hope again,NeonCuy,2025-04-01T12:01:59,19
Talk to every single neighbor and relative. Tell them our country is on the line. Vote Susan Crawford.,nurdmann,2025-04-01T14:28:25,5
"God, I hope she wins!",IdahoDuncan,2025-04-01T15:12:41,6
"Good luck, Wisconsinites! I love your cheese! I didn't like your state going red last election, but the cheese is a pretty good compromise.",JustAnotherFag69,2025-04-01T14:39:59,5
Let freedom ring.,Aggravating_Tax_4670,2025-04-02T03:02:31,1
I would argue we're the favorites,FearTheBlades1,2025-04-01T14:57:49,9
It's Florida-6 that I'm praying for,piggiefatnose,2025-04-01T16:20:10,4
