Comment,Author,Date,Score">Here's the thing. Literally everything you have said is a lie you have been told. You bought in to the idea that Harris had no plan and was single-handedly responsible for Gaza and interest rates and whatever the fuck else. And it's all a fucking lie.  This right here is why I hesitated even bothering with this conversation. I'm not continuing with this. You win, I lose. She was actually a great candidate and dumb gullible people like me is why she lost and why we're dealing with Trump now.",PutsPaintOnTheGround,2025-04-28T12:21:53,1
"Trump got elected thanks to a massive and coordinated disinformation campaign specifically constructed to disenfranchise the public. But you don’t give a fuck about that, so long as you can get your hate on for Americans.",-jp-,2025-04-28T09:06:10,1
"Anyone with the ability to do the faintest amount of research would be able to see Trump is the worst option. That doesn’t even count the fact that he has been clearly racist, sexist, xenophobic, and is a newly convicted felon. You haven’t been able to provide one logically sound point.   For an example if a disinformation campaign could convince you 2+2=5 or the earth is flat then you’re the opposite of smart.",DumboWumbo073,2025-04-28T09:22:59,0
Man there was an entire fucking book about convincing people 2+2 is five. It’s the one you got that example from. It is absolutely possible to manipulate people into believing absurdities and you fucking well know it.,-jp-,2025-04-28T09:39:15,1
"> It is absolutely possible to manipulate people into believing absurdities and you fucking well know it.  Yeah when it’s something ambiguous with no clear answer. 2+2=4 not 5, there is a clear answer. It’s a fact. It’s not debatable. You can’t have an opinion on it. Whoever is able to believe 2+2=5 after originally knowing it’s 4 is objectively stupid.",DumboWumbo073,2025-04-28T10:26:46,1
"Man. It's from *Nineteen Eighty-Four* and the ENTIRE FUCKING POINT was that it doesn't fucking matter if it's ""debatable."" It ain't about being stupid. It's about being oppressed.",-jp-,2025-04-28T10:32:34,1
