Comment,Author,Date,Score
" As a reminder, this subreddit [is for civil discussion.](/r/politics/wiki/index#wiki_be_civil)  In general, be courteous to others. Debate/discuss/argue the merits of ideas, don't attack people. Personal insults, shill or troll accusations, hate speech, any suggestion or support of harm, violence, or death, and other rule violations can result in a permanent ban.   If you see comments in violation of our rules, please report them.   For those who have questions regarding any media outlets being posted on this subreddit, please click [here](https://www.reddit.com/r/politics/wiki/approveddomainslist) to review our details as to our approved domains list and outlet criteria.    We are actively looking for new moderators.  If you have any interest in helping to make this subreddit a place for quality discussion, please fill out [this form](https://docs.google.com/forms/d/1y2swHD0KXFhStGFjW6k54r9iuMjzcFqDIVwuvdLBjSA).    ***   *I am a bot, and this action was performed automatically. Please [contact the moderators of this subreddit](/message/compose/?to=/r/politics) if you have any questions or concerns.*",AutoModerator,2025-04-27T14:09:24,1
"I disagree. Majority of Americans are dumb. It’s due to erosion of public education and misinformation leading to low voter turnout. If they weren’t dumb, we wouldn’t be in this shit situation.",BigAddam,2025-04-27T14:13:39,698
"Trump campaignedand said a bunch of terrible shit and he got elected. People are so miserable that as long as the people they decided to hate are treated like shit, they're happy. I do not know how to shake it in to Republicans heads that giving all the money to the rich is bad economics.",a_little_hazel_nuts,2025-04-27T14:21:29,77
"Trump won again in 2024.  Not everyone in America is dumb, obviously. But too many are.",wonkalicious808,2025-04-27T14:57:35,48
They were dumb enough to vote for an oligarch.,parkerplotkin,2025-04-27T15:17:17,22
"Actually Bernie they are, very much so.",Boopoopadoope,2025-04-27T15:48:41,17
"Lol no.  Bern is cool and all, but this is naively optimistic, or he’s trying to inspire via flattery.",Tainted_Bruh,2025-04-27T14:27:31,61
we very clearly are.,Asleepingin,2025-04-27T14:22:00,34
"On the fence on this one.  I know what oligarchy is, the people in my circles mostly know what it is, and if not all you gotta say is ""rule by the rich"" and they understand (and correctly notice that's an apt description of how the current system behaves).  However, some people do just shut down when you use ""fancy"" or ""big"" words. And those people are not gonna respond well to a 9 letter 4 syllable word like ""oligarchy"".  So you're kinda caught between showing faith in the capabilities of the people and also trying to reach those that just do not mesh well with so called ""big"" words.",Notlookingsohot,2025-04-27T14:25:46,14
That’s one thing he’s definitely wrong about it…,enlamadre666,2025-04-27T14:17:24,31
I think maybe 25% of americans could loosely define that word,TdrdenCO11,2025-04-27T15:20:00,6
yes they are.,GaimeGuy,2025-04-27T14:18:29,14
"Bernie’s greatest stumbling block is believing Americans are smart.  If he was not a self-proclaimed socialist, he would have served two presidential terms by now.   He should just have socialist policies and call it “gooder stuff for big good Americans”",Y0___0Y,2025-04-27T15:15:39,25
"Sorry, just say ""rich people"".  That's enough of a description for the average voter.",mhouse2001,2025-04-27T14:33:46,4
He probably needs a new prescription for those glasses to have a look around and see what's going on...,fatbunyip,2025-04-27T14:49:23,6
"Oh Bernie baby, they are.",Eat_the_Rich1789,2025-04-27T14:39:29,3
“Oh yes they are!” Or is it we?,PapaGilbatron,2025-04-27T15:19:11,3
"Bernie I love you but have you *met* Americans?  What in the world leads you to think they're not dumb, let alone that they understand the definition of a word with as many syllables as ""oligarchy""?",ejp1082,2025-04-27T15:20:14,3
"Nah, no way. People only know what that words means nowadays because it was a buzzword and used nonstop a month or two ago, but even then, the average person who does “know what it means” will likely think that it’s exclusive to the rich even though it’s not, like the case with Iran where the power lies in the hands of the clerics.",SuperBackup9000,2025-04-27T15:44:49,3
"I donno Bernie, many of our neighbors voted for it.",Erasmus_Tycho,2025-04-27T17:22:33,3
Americans don’t understand how tariffs work so I highly doubt they understand oligarchy.,Romano16,2025-04-27T17:38:27,3
"One of the few things I disagree with Bernie about.  The average American is barely literate, willfully ignorant and has the emotional maturity of a toddler.",zombie_girraffe,2025-04-27T17:40:09,3
Sigh. *This* is the fatal flaw of Bernie Sanders. Faith in the masses.   I work with the public. At *least* 50% are dumb as fuck. They aren't *bad people* in the sense that they mean anyone any harm. They just don't like thinking because it takes too much effort.,Nux87xun,2025-04-27T21:48:44,3
"Sanders has the right message but not the right branding. Indeed, Americans are very dumb. The left really needs a slogan which is easy to understand and can be advertised all over the place, just like MAGA. There needs to be something supporters can say or show off to signal solidarity and advance the cause. Fight Oligarchy isn't going to fit well on a bumper stick and isn't catchy.",Scarlettail,2025-04-27T14:25:01,8
cmon Bernie. Are you serious? If Americans weren't dumb why is Trump in office again?,Rich_Housing971,2025-04-27T14:36:34,8
They voted for Trump.   Yes they are.,Forsaken_Hermit,2025-04-27T15:04:34,5
They're pretty dumb,Moist-Cow-6506,2025-04-27T15:10:38,4
"Bless Sanders.  No, the people who are making less than 100K a year and voted Trump in don't know what oligarchy means, otherwise they wouldn't have voted for him.  It's not that the Americans are stupid. It's more like that personal exceptionalism and American exceptionalism hit gard. Find the country that isn't negatively affected by alt-right algoriths on social media, propaganda, columnists and influencers who act as though they had as much weight as true journalists, etc. The U.S. is not unique in that regard. Are there a lot of uneducated people in the U.S.? Yeah but other countries aren't exempt of uneducated people either. Y'all's issue is that too many of you think they're so goddamn special, untouchable, and ""above it all"".",ChibiSailorMercury,2025-04-27T14:57:34,6
"***From Rolling Stone’s Peter Wade:***  Sen. Bernie Sanders has faith that the American people understand what “oligarchy” means, defending his use of the term from fellow Democrats Sen. Elise Slotkin and Minnesota Gov. Tim Walz, who have argued that it doesn’t resonate with voters.  Watch and read more: [https://www.rollingstone.com/politics/politics-news/bernie-sanders-americans-arent-dumb-oligarchy-1235326101/](https://www.rollingstone.com/politics/politics-news/bernie-sanders-americans-arent-dumb-oligarchy-1235326101/)",rollingstone,2025-04-27T14:12:48,2
"Well, some Americans do and aren’t… Bunch of people jumped on the pro-tariff bandwagon that didn’t understand the basic concept of how they work (who actually ends up paying them).",Cryhunter059,2025-04-27T15:46:19,2
The majority of American voters at the very least decided they were okay enough with a convicted felon and rapist who already tried to end US democracy after he lost the first time and is one of if not the most prolific liar in US history becoming president over a competent but imperfect politician to not vote against the rapist. Sorry but that's pretty fucking dumb.,Mr_Meng,2025-04-27T16:01:10,2
I mean..:: look who the president is…. If Americans weren’t dumb would we be in this situation…,bigt503,2025-04-27T17:15:15,2
False.,ReddyMcRedditorface,2025-04-27T18:24:09,2
Over 30% of the voting eligible population voted for Trump twice over 60% didn't vote against him.   I hate to tell you Bernie but yeah they are fucking dumb,redditlvlanalysis,2025-04-27T18:50:41,2
It upsets me how frequently I hear smart people tell me all of the dumb people aren't dumb when they so clearly are.,niknacks,2025-04-27T20:06:57,2
40% Americans are dumb as hell.,OneNaive56,2025-04-27T21:23:32,2
First time I've caught Bernie out lying.,y___o___y___o,2025-04-27T23:35:45,2
Don’t underestimate the stupidity of the average person. lol look at where we are at,AttitudeAccording899,2025-04-28T03:40:59,2
"No, they’re just dumb.",Nature_Sad_27,2025-04-27T14:59:05,3
Who’s gonna tell him?,PFAS_All_Star,2025-04-27T15:40:14,3
"I think oligarchy is the wrong word.   It is more accurately a plutocracy.   An oligarchy is just rule by a few people, but a plutocracy is ruled specifically by the wealthy.   America is a plutocracy with all the influence of money in politics and a billionaire President Trump who is letting a billionaire (Elon Musk)  be the Chief Operations Officer.",OhioValleyCat,2025-04-27T14:22:28,3
I know he's just trying to play the good guy politician who gives the people the benefit of the doubt. I'm sure even he acknowledges that most of the MAGA cult are straight up morons.,TuffNutzes,2025-04-27T14:58:00,2
"I like Bernie and agree with him on many things but no, my fellow citizens have proven time and time again they couldn’t get themselves out of a wet paper bag if need be.",Pegasus_digits,2025-04-27T15:18:58,2
"This submission source is likely to have a soft paywall. If this article is not behind a paywall please report **this comment** for “breaks r/politics rules -> custom -> ""incorrect flair"""". [More information can be found here](https://www.reddit.com/r/politics/wiki/index/#wiki_paywalls)  *I am a bot, and this action was performed automatically. Please [contact the moderators of this subreddit](/message/compose/?to=/r/politics) if you have any questions or concerns.*",AutoModerator,2025-04-27T14:09:25,1
"Kind of hard to take any source seriously when they get the names of people wrong. It's Elissa Slotkin. Maybe they were thinking of Elise Stefanik, but that's someone from a different party representing a different state.",mkt853,2025-04-27T14:32:05,1
"Nah, Americans aren't Dumb, they are not curious and don't care to learn about what doesn't affect them a majority of time. It is difficult when you need to put food on the table.",Talbaz,2025-04-27T14:41:32,1
50% are either dumb or ambivalent.,therealvladimir_0,2025-04-27T16:03:52,1
Americans are fucking idiots.  Source: me an American idiot,Bulky_Play_4032,2025-04-27T16:09:05,1
Most Americans (said as one myself) don’t know at all.,RyanCdraws,2025-04-27T16:20:54,1
No they don't and yes they are,edgars_teeth,2025-04-27T16:32:50,1
Bernie unfortunately the America of today is actually very dumb.,diastolicduke,2025-04-27T16:34:00,1
How about a slogan that doesn't sound like it was created by a white college graduate in a DC think tank then?,SurroundTiny,2025-04-27T16:36:53,1
"Also, Americans just elected trump so are sure about them not being stupid?",IgnobleSpleen,2025-04-27T16:38:10,1
"Americans aren't just dumb. They're REALLY dumb. And as easy as it would be to blame them for it? It's intergenerational. Stupid arrogant boomers voted to dismantle and sabotage the quality of their kids' education. Who then did the same thing to their own kids. And so on. Now we've reached a point where Christian ""homeschooling"" has devolved into so-called ""unschooling"" movement, where parents are intentionally keeping their kids as ignorant and uneducated as possible.  I appreciate his optimism. But, no. Americans are dangerously stupid.",PotluckPony,2025-04-27T16:41:42,1
Bernie is right on so many things… But not this one. Sadly.,neromoneon,2025-04-27T16:42:24,1
Oh yes they are. I bet you the majority of Americans have no idea what oligarchy means. Let me text 10 random people in my contact list and I bet you none of them will know what it means,larryathome43,2025-04-27T16:44:07,1
Dude needs to listen to th bulwark focus group podcast. Americans are so dumb.,starkraver,2025-04-27T16:47:18,1
I’d say it’s about 50/50 at best.,chesterforbes,2025-04-27T17:04:46,1
“What is an oligarchy?” was a top search on google after it became topical in the news.  Americans do not know shit about government.,Joint-Tester,2025-04-27T17:05:18,1
"On point #1, I’m not so sure.  On point #2, nice try, but no, they go be that dumb. ",Commonpleas,2025-04-27T17:47:47,1
4 syllables... 2 too many for most Americans.,killazdilla,2025-04-27T17:48:19,1
"I love Bernie, but a lot of us are stupid",Kindredgos,2025-04-27T17:53:10,1
"Ah may not be a smart man, Jenn-ay, but Ah know what oligarchy is",Voodoo_Masta,2025-04-27T18:03:25,1
The average American reads at a 6th grade level. They are the dumbest nation in the developed world.,Various_Tutor8661,2025-04-27T18:08:02,1
"I think a lot of people “generally” know the definition, but don’t actually understand what it means.   We should bring back calling them Robber Barons",CommanderAGL,2025-04-27T18:19:39,1
50 percent can’t read past a 6th grade level….,StruggleExpensive249,2025-04-27T18:26:21,1
They elected orange asshole... twice.. i am pretry sure the majority is dumb as fucking pig shit,justbecauseyoumademe,2025-04-27T18:37:47,1
What's oligarchy?   Americans: *gesture vaguely at everything*   Close enough. ,Brokendownyota,2025-04-27T18:42:32,1
"Sorry Bernie, but I'm trapped in one of the reddest states in the entire country. I'm surrounded by people that are, in fact, just *that dumb*. They happily clap along to this BS like lobotomized seals.",Iemongrasseyelids,2025-04-27T18:44:52,1
"Oh, dear Bernie. Do I have news for you...",tingkagol,2025-04-27T18:45:11,1
"I personally believe the vast majority of Americans are dumb, but if you are a politician it is generally good practice to not to say or imply you think so. This, (among other reasons) is why I'm not a politician.",Archenic,2025-04-27T18:57:20,1
"Eh, a lot of Americans *are* dumb.",Sideshow_Bob_Ross,2025-04-27T19:05:06,1
 He’s been saying America was becoming an oligarchy since the 90s. Time for him to say it actually is.,sixtus_clegane119,2025-04-27T19:05:19,1
They aren't mutually exclusive,Ok-Photojournalist94,2025-04-27T19:19:31,1
Neither of those claims is true,Slob_King,2025-04-27T19:25:41,1
Actually… all the tools that voted for trump are indeed dumb,abaconsandwich,2025-04-27T19:29:31,1
[Its Officially Reached A Whole New Level...](https://www.youtube.com/watch?v=30zII1rcs-E),Electrical-Fortune7,2025-04-27T19:47:37,1
"Actually, some of them are *really* dumb.  Those would be the voters who put this orange disaster in office because they believe his lies.  No.  No one was eating cats and dogs in Ohio.  Fill in the rest with all his other lies.",JAFO444,2025-04-27T19:53:22,1
30% are dumb.,10v1,2025-04-27T19:58:46,1
Idk…. Oligarchy is a multisyllabic word. Do they still teach kids what a syllable even is?,consumeshroomz,2025-04-27T19:59:33,1
Sanders always misses the forest for the trees.,abritinthebay,2025-04-27T20:07:10,1
… but they dumb tho.,originalbraindonut,2025-04-27T20:39:37,1
Bernie is wrong here. 80 million people voted for Donald Trump. Half of this country is filled with morons. Democrats keep underestimating the stupidity of the American populous.,AmbitiousYam2557,2025-04-27T21:20:37,1
"Thats cap, they are definitely dumb",Tipnfloe,2025-04-27T22:33:31,1
I'd argue that 31% of Americans do not know what oligarchy means.,gustoreddit51,2025-04-27T22:45:29,1
Just call oligarchs what they actually are in a simple enough way everyone can understand: Leeches.,el_moosemann,2025-04-27T22:48:20,1
A millionaire who's been in a major seat of political power for over 30 years?  Yep sure do.,Meppy1234,2025-04-27T22:54:53,1
Yeah it's not an oligarchy when the entire Republican Party and at a minimum 1/3 of the entire country wants to overthrow democracy.,atreeismissing,2025-04-27T23:30:02,1
"Like, I know what it is, but fuck me on pronouncing it   Not that it matters, if I tried talking about it here they would just laugh  I tried explaining tariffs before the election and got made fun of for being a “nerd”",Lilsammywinchester13,2025-04-27T23:49:32,1
Bernie... the vast amount of Americans can't say oligarchy much less know what it means. Let's go with one and two syllable words. Baby steps.   There's a reason audio books became so popular.,ThunderDungeon02,2025-04-27T23:59:24,1
"How can Bernie Sanders be so based and yet so naive at the same time? Is he not aware of how and why were in this shitty situation in the first place? If Americans knew what oligarch means, then Trump wouldn't be in office rn. Apprantly Sanders still thinks that the 2024 elections is still ongoing and the reality hasn't hit him yet. ",iFlashings,2025-04-28T00:33:36,1
Americans are dumb. Obviously.,deerfoot,2025-04-28T00:51:30,1
"They can know what oligarchy means and be dumb, the title to this is deceptive that way",D4NG3RX,2025-04-28T00:58:38,1
I figured he was going senile like the rest. This confirms it because Americans are def end stupid. ,DifferentSquirrel551,2025-04-28T01:00:19,1
"I mean, maybe Bernie has to say that, but compared the rest of the developed world, the average American is hella dumb. It’s not even close.",know-your-onions,2025-04-28T03:03:53,1
Has he met very many Americans? Because I'm not so sure.,ValuedQuayle,2025-04-28T03:35:31,1
They don’t even need to know what it means they just need to know it’s bad. How many people can’t explain what socialism or communism is despite believing it’s the worst thing possible?,BrookerTheWitt,2025-04-28T06:38:13,1
"[https://www.thenationalliteracyinstitute.com/post/literacy-statistics-2022-2023#:~:text=Literacy%20Data%20and%20its%20impact,a%20book%20in%20a%20year](https://www.thenationalliteracyinstitute.com/post/literacy-statistics-2022-2023#:~:text=Literacy%20Data%20and%20its%20impact,a%20book%20in%20a%20year)",naughtydad4u,2025-04-28T07:53:21,1
"Yeah, no. A majority of americans are definitely dumb. They wouldn't have been in the sh*thole they are now and further sinking into, if they were not.",gamefan5,2025-04-28T07:55:00,1
But they sure are stupid.,UsedPart7823,2025-04-28T08:36:38,1
Bernie is awesome but I respectfully disagree. Americans are dumb. the last election proves it,Miserable_Natural,2025-04-28T08:43:28,1
 And will be getting worse as the administration slowly decimates public education  Keep them poor and keep them stupid. Republicans 101,Wonder-Machine,2025-04-28T10:59:51,1
Yes we are,Zizaku,2025-04-28T17:20:43,1
Yes we are tho,PugLove69,2025-04-28T18:00:24,1
"Wow..I would contribute to this thread, but quickly realized there's no diversity of thought among almost all of these super smart, higher-ups in the IQ world. Everyone is dumb, except you. No debate here!",No_Boysenberry5061,2025-04-28T19:43:27,1
By 2028 he and AOC will just bow back down to the DNC elite (that bows to the oligarchs). The rich gets richer. The revolution is dead.,BestAd6480,2025-04-27T15:10:56,1
"Sorry bernie, love you but americans are dumb as hell",pragmaticmaster,2025-04-28T06:07:47,1
"No offense to those Democrats, but obviously what they have been doing doesn’t resonate with voters. They lost an election to the human incarnation of a fart.   But in the larger picture, this is emblematic of Democrats’ problems. Slotkin and Walz should feel absolutely free to reach out to the voters that don’t respond to Sanders and Ocasio-Cortez. Nobody is stopping them. But don’t try to stop politicians that obviously have captured the heart of a significant portion of the electorate.   Imagine you are just getting back from a rally that was attended by 30,000 other citizens on a non-election year. They inspired that many people to give up a day of their lives to be politically involved. You get back home, energized by the rally you just participated in - and you read these quotes. Are they trying to disenfranchise these voters?",no_kids-and-3_money,2025-04-27T15:06:36,0
"I don't think it's the winning message but it's better than Slotkins' dumbass ""weak and woke"" shit.",Moon_Noodle,2025-04-27T16:01:42,0
"When a real estate developer comes in and bulldozes a community that’s been there for centuries, you know what oligarchy means. Developers kill citizens. They are the oligarchy",highroller_rob,2025-04-27T16:06:39,0
"it should be no surprise that one of the most popular and respected politicians in the country is someone who refuses to talk down to people.  and for everyone else in this thread: you are *not* smarter than MAGA. you are not fundamentally different, and they are not fundamentally flawed. don't invite hubris.",whycarbon,2025-04-27T16:20:20,0
"If you’re a democratic politician and you’re discouraging politicians from calling out the oligarchy, you’ve got an uphill battle to convince me that you don’t support the oligarchy.",dclxvi616,2025-04-27T16:23:36,0
"He should have another look at the statistics, a lot of US citizens are either stupid or uneducated",donjamos,2025-04-28T05:56:49,0
"I loathe the imbeciles in politics that assume their constituents are nothing but backward country bumpkins. This lack of respect is why most people have moved away from this entire mess. It is time to put these pretentious lackwits in their place. The entire lot is complicit in the destruction and wholesale butchering of our country. It is far beyond time they were ALL held accountable. Enough of this foolhardy effort to concede our future to stains that assume we have none. The right is lost, brainrotted to a degree they can’t be saved. The far left is beginning to show the same decay, brought on by the very same vitriol they denounce in the opposition. There will either be a very real reckoning by means of bloodshed, or the people will rise above the steering their rancher handlers are engaged in currently. But given the lackadaisical effort thus far from intellectuals and individuals capable of reason, I’d say we are doomed to a future led by a feckless moron and his fascist lackeys.   The vote has died.  Democracy has died, though here, it never really lived, so death is a pretty ambiguous term.   We are damned to our fate. We abdicated our control for a false sense of safety. We shit on our future for an easy ride. Look where your luxury stretch handcart brought you all.   That funk ass smell? Brimstone.   This hell is your hell, this problem is your problem. If you, the represented body, are unwilling or unable to secure your future, don’t expect to have one.",Companyman118,2025-04-27T18:04:16,-1
Let's not forget that Biden's farewell speech was warning of oligarchy. The DNC just hates Bernie. Nothing new here,adult1990,2025-04-27T18:19:01,-1
"Over 50% of adults in our country couldn't read The Hunger Games if you paid them to try. I love Bernie, but he's being overly optimistic. We're not *actually* a smart country, we just play one on tv.",Beneficial_Soup3699,2025-04-27T14:37:59,232
"Oligarchy might sound like a big weird word. But the underlying message is quite basic and simple. It does what appears to be the right way to handle politics: give people *scapegoats*. Define policies in terms of punishing people who make our lives shit. At the same time, Bernie's message is *also* truthful as it correctly identified the source of the problem, and it's backed up with policies that actually help the common folk, not just channel their anger at the scapegoats.  ""Rich people are the predators. They're the evil elites above the law. They have immense power. You are their victim. Your life sucks because they rig the system in their favor. You work hard, yet they rob you of your hard-earned shit.  This is why the prices are high. This is why you can't afford shit. This is why you're in debt in the richest country in the world. This is why you live with your parents in your 30s while they make money doing nothing, out of thin air. This is why you die of cancer while the health insurance death panel decides whether it's cheaper to give you the cure you paid for, or cheaper to risk a lawsuit that won't save you anyway so you probably won't bother.  Here's how we can unrig the system.""  This is a simple, powerful message. It's not hard to understand at all. It is self-evident if you take a moment to think about it. It resonates with people on all sides of the spectrum. It makes people feel that Bernie is sincere, an actual person who gives a shit. I really don't see a complexity problem here.",AbcLmn18,2025-04-27T15:58:48,15
"I think.about this quote from MiB of all places almost daily. ""A person is smart. People are dumb, panicky dangerous animals and you know it. Fifteen hundred years ago everybody knew the Earth was the center of the universe. Five hundred years ago, everybody knew the Earth was flat, and fifteen minutes ago, you knew that people were alone on this planet. Imagine what you'll know tomorrow.""",msfamf,2025-04-27T14:54:35,41
"I'm split between yes and no on this. I think some Dems are scared of using the word oligarchy because they're worried it's hard to define. But I think they need to take a hand out of the Republican playbook.   The GOP has been remarkably successful at defining broad concepts, such as CRT and DEI, on their own terms. They've managed to do so in such a way that rejects all nuance and discussion from the left. We should do the same with oligarchy. Hang it around the necks of Repiblicans like a damn albatross.",fuckishouldntcare,2025-04-27T16:00:47,16
