Comment,Author,Date,Score"Even if Americans know what the word means, they definitely do not know what _being in an Oligarchy_ means for them. The consequences are dire, yet pernicious.",ManyInterests,2025-04-27T16:23:48,5
"I agree with you and I'd venture Bernie does as well, but he also knows you don't rally support by calling people dumb",D13_Phantom,2025-04-27T17:03:02,2
People don't like hearing they are dumb,2ndprize,2025-04-27T19:16:34,3
"Americans *aren't* dumb. The problem is Americans are *actively and deliberately being lied to*. If, whatever the reason, someone did not vote for Harris in November, it's because whoever told them, whatever that reason was, that person wanted Donald fucking Trump to win.",-jp-,2025-04-27T15:05:30,14
It's hard to get the dumb people on your side if you do call them dumb.,SunsetCarcass,2025-04-27T21:00:23,3
"Not necessarily dumb but ignorant and too stubborn to admit it, as nobody likes to admit to being wrong.",SausageClatter,2025-04-27T17:37:01,2
"To tack onto this, one doesn’t have to agree with a critique from a swing state Senator (Slotkin, etc) on Sanders’ approach, but if you’re rushing to dismiss it  without any consideration then you should maybe think a little bit about more about whether winning hard races matters to you.",eggoed,2025-04-27T17:45:41,2
Very hard disagree as well. They were dumb enough to vote for Trump two times.,mrbigglessworth,2025-04-27T17:59:05,2
"I don’t think they’re dumb, as in they don’t have the capacity to learn, but they’re wildly ignorant (and arrogant about it too). Best country on EARTH! why would we learn anything new when we are NUMBER 1!?!? USA USA USA.",Tack-One,2025-04-27T14:58:03,4
"Florduh, and desantis moves we're fkd 🤡🤡",0inxs0,2025-04-27T14:31:07,2
"I also don’t really believe that most Americans could definitely “oligarchy,” but personally disagreeing with Sanders on that relatively minor matter doesn’t mean that I can’t also think Slotkin’s critique is still a crock of horseshit.",NotTheCraftyVeteran,2025-04-27T18:27:57,2
Bernie outside a store: Ma’am do you know what oligarchy means?  Woman: Is that the new foreign Greek yogurt all those young kids are wasting their money on?   Bernie 🤦‍♂️,chefybpoodling,2025-04-27T19:25:48,1
I mean it looks like most people want to deliberately stay stupid. Mind blowing,Lauriev7,2025-04-27T20:44:27,1
"Id argue it not an exactly an erosion of public education, I say it an erosion of the culture that treats education as unimportant and undesiable. I work with kids, these kids are basically brought up to feel like their education doesn't matter and the schools struggle to undo that programming but it's an uphill battle that they aren't really going to win. If you can't change the culture, you can't really educate dumb people",ABearDream,2025-04-27T20:57:00,1
Fellow Ohioan here. Well said mate! Our situation is absolutely a result of the misguided masses that kiss that orange ass without fail.,donedoer,2025-04-27T21:25:32,1
"College educated people have lived in a bubble their whole lives. They assume everyone is like them. They never stepped foot in a Walmart.   I was a truck driver, I've been in terrifying ""The hills have eyes"" kind of towns. The people act more like animals than humans.",MXKIVM,2025-04-27T22:11:36,1
I think the majority of Americans know how to google it and are smart enough to go “oh yeah that’s what we’re becoming”,BennyBingBong,2025-04-27T22:53:41,1
>imagine how stupid the average person is then realize half of all people are stupider than that.  George Cariln,WRXminion,2025-04-28T01:26:51,1
"They are **very** dumb, but it’s not like Sanders can say that if he wants anyone to listen.",KinkyPaddling,2025-04-28T01:36:07,1
How can it be the erosion of education when the majority of MAGA was educated 40-50 years ago?,Buff-Cooley,2025-04-28T12:59:48,1
"They’re still learning what “tariff” means, and it has half as many syllables.",SingleMaltShooter,2025-04-28T14:31:57,1
"He should call it the ""Oliga-gargle my balls tour.""",emperor_dinglenads,2025-04-27T19:06:40,1
Techbros voted for Trump,[deleted],2025-04-27T17:36:28,0
Swing and a miss.,Built-in-Light,2025-04-28T00:28:29,0
People are so *desperate* for change that they will give Trump a chance instead of anyone who says they will keep things mostly the same.,Prior_Coyote_4376,2025-04-27T16:37:58,20
">People are so miserable that as long as the people they decided to hate are treated like shit, they're happy  Donald could run for 2028+constitutional amendment to make that possible on ""everybody gets punched in the genitals once a day, but if you're not white, straight, Christian and a man you get another punch for each category you miss.""  People would line up for miles to get their punch in the balls and pay him their life savings for the privilege.",AnOrneryOrca,2025-04-27T19:25:49,3
Strong man strong. Me like strong. Vote strong man.   - actual thoughts inside MAGA-head,Effective-Avocado470,2025-04-27T23:15:37,6
"Bernie, the people who come to your rallies aren’t dumb. They’re also not representative of a plurality of the electorate, sadly.",MyNewsAccount2011,2025-04-28T06:36:56,2
"Well saying ""Americans are dumb"" probably isn't a great platform to get people to vote for you.",anonymous_matt,2025-04-27T16:04:28,34
"People aren’t stupid. They’re uninformed, demotivated, and desperate, but that’s different than just being stupid. Otherwise you’re helping those who argue against democracy.",Prior_Coyote_4376,2025-04-27T16:37:15,5
"Okay, so we have to dumb down any progressive platform planks to the level of “see spot run”? Is that the solution?   There comes a point where marketing to the literal lowest common denominator is counterproductive.  It’s *this* kind of shit that’s dumb as hell, arguing with someone you ideologically *agree with* over using a word that scores a few too many Scrabble points, jesus fucking christ. I don’t exactly see Slotkin or Walz touring the country to spread the Good Word of telling billionaires to fuck off. Could that be because they take campaign donations from billionaires who need to fuck off? Probably.",zernoc56,2025-04-27T22:39:17,2
"People don’t respond well to words they don’t think they need to know. If oligarchy is suddenly being mentioned everywhere all the time, people will want to know what it is and why it’s important now. If only a handful of politicians are using the term because the rest are scared of upsetting their oligarchic donors, that’s going to make it harder to show people they need to know it.",Prior_Coyote_4376,2025-04-27T16:39:26,2
"Essentially he believes in the good in people, a bit optimistic but honestly it is pretty refreshing to hear that a politician believes people can overcome their flaws and have the innate curiosity to learn. Unfortunately that isn't reality.",Ipokeyoumuch,2025-04-27T17:09:52,8
"Even the grassroots stuff sucks at this. The recent ""hands off"" and ""50501"" protests are absolutely terrible in terms of branding and messaging. I don't understand how the people running everything can be so incredibly bad at it. ",Bakedads,2025-04-27T14:41:11,-1
"If Americans are dumb, why aren’t we able to exploit that with billions of dollars at our disposal?",Prior_Coyote_4376,2025-04-27T16:42:41,1
"> otherwise they wouldn’t have voted for him  Well to be clear the oligarchy existed even if you voted in Harris. Look at how Mark Cuban openly brags about influencing her, and how she let him override her tax policy as a campaign surrogate.   Americans aren’t stupid. They know the oligarchy has bought lots of influence on both sides, even if they don’t know the word. They’re not educated on terminology but they know the rich have rigged the system. That’s why they don’t trust status quo campaigns and want change. Bernie sees that.",Prior_Coyote_4376,2025-04-27T16:42:05,1
"You are correct.  However I think neither term resonates with Americans or evocates emotion.  We need something similar to ""Deep State"" to really get people thinking about the problem here.",HandsLikePaper,2025-04-27T14:29:11,2
People are.on line.looking at propaganda all.day.,PoopieButt317,2025-04-27T15:33:36,1
"Also, they probably don’t know what oligarchy means.",know-your-onions,2025-04-28T03:04:14,1
"It's true. In some respects though, voters got top comfortable. Recency bias told them civil rights alone wasn't enough, moderate progress wasn't enough because they forgot how bad it truly was before all the weak kneed Democrats voted for the laws that shaved SOME of the sharp edges off life.",Public_Front_4304,2025-04-27T16:46:28,1
"Slotkin unseated a Republican to get her house seat, and won her Senate seat in a state that went to Trump.  What she’s doing is actually working. And it’s working in competitive districts. Rally sizes don’t translate to winning elections. Why do people keep trying to say they do?  What Sanders and AOC have done are win safe districts and non competitive races.",mightcommentsometime,2025-04-28T00:33:38,1
The message that she uses to actually win competitive elections?,mightcommentsometime,2025-04-28T00:35:36,0
"She isn’t saying that. You should try reading the article. She says:  > Her strategy also focuses on language and tone. She said Democrats should stop using the term “oligarchy,” a phrase she said doesn’t resonate beyond coastal institutions, and just say that the party opposes “kings.”  Changing the verbiage doesn’t significantly change the message",mightcommentsometime,2025-04-28T00:39:17,2
What does this have to do with the DNC? Which member of the DNC is speaking up here?,mightcommentsometime,2025-04-28T00:34:33,1
"To use a sports metaphor, a low floor, high ceiling kind of country  … and we are discovering with Trump that the country’s floor has, perhaps, always been so much lower than anyone wanted to believe.",nanobot001,2025-04-27T17:44:10,64
"This is smart rhetoric from Bernie. He's a politician, he's not going to undermine his support and push away potential converts by insulting large swathes of Americans. Anyone who sees this quote and doesn't know what an oligarchy is will at least be incentivised to look up its definition. It's smart. Bernie also probably believes that those 'dumb Americans' people like to insult are probably undereducated because of the systemic results of oligarchy.",AlexanderTheGate,2025-04-27T18:36:25,29
"*Hunger Games*?!! Whoa there buddy, let’s start with something a little more in the “adolescent” category, like *Goosebumps* or *Animorphs*.  You can’t spring that “young adult” shit on people whose reading comprehension skills are somewhere between grade school and middle school.",PerniciousPeyton,2025-04-27T18:54:31,4
"This is in reference to corporate democrats like Elissa Slotkin saying we shouldn't be calling Trump an ""oligarch"" and instead call him a ""king."" This debate is reflective of the larger divide in the Democratic party right now.  It's not about whether or not most Americans are ""dumb""--the fact of the matter is most do, in fact, know what the term ""oligarchy"" means. *This* is the point that Slotkin and co. are trying to discredit. Because they don't want people like Bernie and AOC to point the finger at the ""oligarchs"" because that makes the enemy the rich, the corporate class, the 1%, etc.--and that makes an enemy of the moneyed interests that support them.  Making this debate about whether or not Americans are ""dumb"" is taking the bait. Again, the fact is most Americans *do* know what the term ""oligarchy"" refers to, and the more Bernie and AOC lead from the front and get out there and talk about it, the more Americans learn that the enemy is not the ""kings"" (as Slotkin would favor for political reasons) but the ""rich."" This is about defining who the enemy is, and some people do *not* want the finger to be pointed at coroporations. And this is what scares Elissa Slotkin, Rahm Emanuel, James Carville, etc.",bleepingsheep,2025-04-28T08:40:31,1
"> scapegoats   This puts a negative spin on it, but voters are justified in wanting politicians to describe problems and solutions clearly. Democrats have not been doing that, outside of Bernie who accurately points to oligarchs and greed. Republicans are really good at this, blaming everyone from immigrants to George Soros to China for their problems.",Prior_Coyote_4376,2025-04-27T16:35:31,4
[deleted],[deleted],2025-04-27T16:12:43,1
"The problem is we have an increasing number of flat Earthers, many of which have US citizenship",Psephological,2025-04-27T16:48:42,12
"you got those flipped. 1500 years ago everyone knew earth was flat, 500 years ago everyone thought earth was the center of the universe",Fun_East8985,2025-04-27T16:05:25,3
The problem isn’t in word choice but media strategy. Dems are using a playbook that was outdated in 2005 while Republicans are embracing every new tech platform they can find to spread their message.,Prior_Coyote_4376,2025-04-27T16:33:24,12
"The problem is that Dems don't like leading. The job of a politician is not to figure out where the wind is blowing and follow it. A politician's job is to LEAD and educate the public on their ideas and plans. If the public doesn't support something they believe in, they need to teach them and persuade them on the idea. Sometimes the public agrees afterwards and sometimes they don't. Point is, Bernie is right.",Individual-Nebula927,2025-04-27T21:45:21,3
[deleted],[deleted],2025-04-27T16:13:54,2
"Personally, I think they don't want to use oligarch as a word because if that's their target then their base will have to come to terms with the idea that many of the Democratic leadership could also qualify as oligarchical. They certainly aren't as blatant and disgusting about it as the GOP but if they tell their base to fight oligarch, that means that Democrats who take money in exchange for political power or business opportunity will find themselves with the ire of their voters.  The left being obtuse in their definitions is, for better or for worse, out of the question, I think. The left is the side of people with formal educations (in most cases not all) and I don't know if I'd really feel comfortable myself intentionally misinterpreting the meaning of a word just to fuck with the GOP. Oligarch is the correct term for what people want to see an end to and the nuance behind the term is what makes it important too.  I get the impulse to hang it on the GOP because they are the most egregious but I don't want to *become* then in the process.",EdgyCole,2025-04-28T07:38:14,1
"And it’s in a politicians job description to *explain it* to their constituents. Which is *exactly* what Bernie and AOC do at every one of their stops on this tour. Don’t just throw up your hands and say “the people are too stupid to understand a single slightly hard word even if we drill it into their head with context clues repeatedly”, because the GOP have already proven the people don’t need to understand the specific words used. My fellow Americans largely did not fully grasp the meaning of the word “tariff” but they still voted for the guy who said tariffs were the solution to their problems.   It is not a dealbreaker to use words the people do not necessarily fully understand in political messaging. The DNC *need* to learn this lesson.",zernoc56,2025-04-27T22:58:09,2
100% people are failing to give credit to the massive right wing disinformation machine,ManfredTheCat,2025-04-27T19:26:54,6
50% of American adults read at or below a 6th grade level. If this isn’t “dumb” then I dread to imagine what would be.,The_Knife_Pie,2025-04-27T20:34:50,3
Same thing you just added extra words,DumboWumbo073,2025-04-27T22:30:17,0
I didn't vote for Harris because she was a dog ass candidate who didn't deserve my vote. I still voted dem down ballot. I didn't vote for trump,PutsPaintOnTheGround,2025-04-28T03:51:16,-4
"Republicans only have one type of change, and it's not the type of change working class citizens want. Funnel all the money to the top and take away rights, that's it. I have known this for decades, but racists are plentiful and that's the only reason the republican party still exists.",a_little_hazel_nuts,2025-04-27T16:42:38,11
"He already had a chance. He crashed the market and millions of people died preventable covid deaths.  At which point do we accept that this is what the people want?  This is 200 years of ""america fuck yeah"" finally coming to a head. From here there's 2 roads. One ends with another russia. A miserable populace ruled by oligarchs that is convinced they are better than the rest of the world while they live in filth, freeze and die at the ripe age of 50 from alcoholism. Or the people realize that america frickin sucks right now and needs decades of proper stewardship to turn the ship around.  I know where I'd put my money. Wouldn't be at all surprised to see a republican win in 2028.",DonkeyPunchCletus,2025-04-27T20:49:53,3
"I am not in any sense a physically strong person yet have no doubt whatsoever I could easily take him in a fight. He's not smart. He has the thinnest skin imaginable.   In what sense is that frail, stupid, hotheaded asshole ""strong""?",PortalWombat,2025-04-28T06:51:40,3
Worked for trump,Special_Meaning8006,2025-04-27T16:36:57,21
"Although the Democrats are in a good position to frame the issue as another good reason to advocate for improving public education, access to universities, and responsible laws surrounding news reporting so we don’t have corporations like Fox News having their cake and eating it too while presenting as a news channel to their audience and an entertainment company to judges when their false claims land them in court.",maikuxblade,2025-04-27T16:36:47,1
"While I wish I could tell you with confidence that that is not the move, based on the general populace, I'm not sure that I can. It's a fact that 54% of Americans read at below a 6th grade level (the Harry Potter books are about this level for reference). It's also a fact that attention spans are plummeting. This is the general populace, and whether we like it or not, we do have to speak their language if we want to engage them.  From what I know of Slotkin (which is little tbf) she seems to be your typical centrist, and is such is almost certainly attached to the green teet of the elite. Walz however is coming at this from his background as a coach, he excels in connecting with the everyman. It's unfortunate he isn't touring more to reach people, but he has held some events, and he has not minced words (openly calling MAGA the nazis and fascists they are).  Perhaps the answer then lies at both ends? Bernie and AOC should be doing what they are, while others instead of criticizing them should be out there also talking to the American people. Perhaps the issue is not that progressives are using the $10 words, but that the people who think they're on the right track but should use different verbiage, aren't going out and doing it themselves.",Notlookingsohot,2025-04-27T23:02:44,0
"Yeah it’s really naive if you ask me and this isn’t just Sanders. It’s the every Democrat politician.  The Republicans know that the American voter is a fucking moron. Like, you can tell an easily disproven lie to their faces. They’ll believe it if you’ve conditioned them properly. If you have a really unpopular policy position, just lie about it. They’ll believe it!  And Republicans understand that you need to dumb down your messaging SIGNIFICANTLY to get middle america to understand it.   Democrats are far too technical. And far too often trust that Americans will know who to blame for the country’s problems without them having to “dirty” themselves by casting blame.  They don’t know who’s fucking up the country. You need to tell them. Loudly.",Y0___0Y,2025-04-27T17:12:40,8
"You're more than welcome to contribute to the movement, they need all the hands they can get. So if you have ideas for better slogans that are easier to for the public to digest, then pitch it to the organizers!",brain_overclocked,2025-04-27T20:39:09,3
"The current movement is the result of 50 years of work by right-wing elites to dismantle the progress of the Civil Rights Movement.   They cut social programs, privatized services, built propaganda outlets, used the War on Drugs and War on Terror to disrupt communities with law enforcement, pressured colleges as wealthy alumni, busted unions, drove up the cost of living, and did a lot of other stuff to make sure that people couldn’t organize well again.   We’re basically relearning all our tactics and rediscovering our leaders because the last heavy government crackdown stripped us of those.",Prior_Coyote_4376,2025-04-27T16:53:57,2
"Okay, so if this branding is so fucking terrible, why hasn’t anybody proposed something better? What would you suggest, oh Wise Marketing and PR Guru?",zernoc56,2025-04-27T22:43:05,2
"Echo Chambers.   They’re thinking while being inside a Bell 🔔.   Too many yes men that do not want to oppose or lose their jobs just say: Yes sir, great idea. And the trend continues.",HectorJoseZapata,2025-04-27T15:30:33,2
Because everyone is dumb,DumboWumbo073,2025-04-27T22:33:00,0
"Do you think saying that the party is not ""woke"" will work on a national level? Because to me, campaigning as ""anti-woke"" means anti-LGBT, anti-black, anti-vaxx, etc.",Moon_Noodle,2025-04-28T11:23:13,0
We are not confronting kings. We are confronting an oligarchy.,dclxvi616,2025-04-28T07:49:21,0
That's a sports metaphor?,Mavian23,2025-04-27T19:49:55,10
"It’s not rhetoric.  He’s behaved this way for 40+ years, he believes what he says. Even when he’s wrong.",abritinthebay,2025-04-27T20:08:00,2
I think we might want to take it down several more notches and get folks to understand The Lorax before moving onto books with no pictures.,joshdoereddit,2025-04-27T20:42:53,4
"I'm pretty sure Hunger Games is written with a middle schooler in mind, and I'm pretty sure Goosebumps and Animorphs were written with elementary schoolers in mind.  America is full of morons.",tawzerozero,2025-04-27T19:08:32,4
"I think this ties to the ""Kamala doesn't have actual policies"" vs. ""Trump doesn't have actual policies"" debate.  Kamala didn't have policies *that explicitly hurt somebody*, put a blame on somebody for the problems people were facing, so many people (incorrectly) felt like she wasn't going to change anything, she wasn't interested in impacting the balance of power.  Anti-symmetrically, Trump didn't have policies that help that the common folk, he was purely focused on scapegoating. People who don't have any interest in hurting others were (correctly) pointing out that none of this would help anybody.  Progressives very clearly offer actual policy that clearly reshapes the balance of power and clearly helps the common folk. No matter how you look at it, no matter what you think a solution could look like, this is a simple, resonating, emotionally charged, unifying message.",AbcLmn18,2025-04-27T16:57:56,2
"No, that's purely my interpretation of his usual message.",AbcLmn18,2025-04-27T16:13:31,3
Do we actually have an increasing number of flat earthers?  I have never actually met one in real life and I have met some extraordinarily ignorant people.   I know as Americans we seem to like to enjoy watching dumb people so there are a lot of people that claim to be flat earthers online and on TV.  Is there just an increasing number of people willing to pretend to be dumb in order to get likes and followers to create an online following?,sleepyhead_dad,2025-04-27T17:45:03,3
Just watched that scene on YouTube to be sure and no I have the quote right.   Edit: actually he says people not humans so I did fix that,msfamf,2025-04-27T16:10:09,2
"> 1500 years ago everyone knew earth was flat  Nah, the Ancient Greeks realized the Earth was round.",bootlegvader,2025-04-27T18:08:50,2
"No, they didn't. Ancient people believing Earth is flat is a myth. People knew Earth was round 2500 years ago. During the Middle Ages, the prevailing doctrine was that Earth was round. The Church agreed with it. Flat Earth became an idea people actually believe in the late 19th century.  [https://en.wikipedia.org/wiki/Myth\_of\_the\_flat\_Earth](https://en.wikipedia.org/wiki/Myth_of_the_flat_Earth)",rintzscar,2025-04-28T01:25:00,1
"They're slow, but it does seem like they may be catching up. I've seen a handful doing podcast interviews recently. Hopefully more will catch on.   I also think there's some value to these in person tours and town halls. Lately, when Republicans do them, you end up with headlines about someone being tased or dragged out. Dems don't get those same headlines.",fuckishouldntcare,2025-04-27T16:41:45,3
"The problem with this is “rich” is the greedy man’s version of the American dream and you are *not* going to be able to untangle that in a way that that doesn’t cause blowback. In a capitalist society, “rich” can mean “very successful”.  Doctors and lawyers can be rich, relative to the blue collar workers you are trying to reach. They aren’t part of the societal problem that oligarchy represents though and you don’t want to demonize them.",maikuxblade,2025-04-27T16:33:49,15
You are being too dismissive of literacy. Reading at a sixth grade level is sufficient to understand basically anything that doesn’t require some specific expertise.,-jp-,2025-04-27T20:45:27,4
I directly refuted the argument. You should probably reread if you think otherwise.,-jp-,2025-04-27T22:33:28,1
