Comment,Author,Date,ScoreWhy did you think you don't deserve your own vote? Using your vote to get Trump elected while also voting for every Democrat that doesn't matter is stupid.,NewSauerKraus,2025-04-28T04:30:40,4
"I'm sorry that they lied and won. Yeah, that's unfair. The fact is still that, like the other poster said, Republican leaders showed a vision of something other than the status quo, and the idea of a united America (even if one that doesn't include people like you and I), and Democratic leaders did not think it was at all necessary. This is exactly what happened in the 2008 election except the roles were reversed.   The Biden and Harris campaigns assumed that people loved the economy as it is, loved their healthcare as it is, loved their foreign policy as it is, just like John McCain's campaign did.",PeliPal,2025-04-27T17:54:43,0
"I’m making a joke about “strong men” it’s a classic dictator thing   It’s not that he’s actually strong, it’s that he gives the vibe of being “strong”. Ie doing what he wants and not caring about others, it’s more about the myth than the actual man himself",Effective-Avocado470,2025-04-28T08:06:12,2
"It did, indeed... especially for those who could relate personally to being dumb.",phosdick,2025-04-27T16:43:49,8
Slotkin unseated Republicans to take her house seat and her Senate seat. She’s actually winning competitive elections. I’d say what she’s doing is actually working.  Progressives don’t have success in competitive districts. Dismissing everything that your allies say out of hand because they aren’t as progressive as you isn’t a winning strategy,mightcommentsometime,2025-04-28T00:24:44,1
That *is* the issue. This honestly feels like centrists dems finding *anything* to bitch at actual progressives about. It’s not like Bernie and AOCs’ speeches don’t *explicitly* and *repeatedly* spell out who and what the oligarchy is and why they should be fought by the everyday american.,zernoc56,2025-04-27T23:17:53,1
"It doesn't just stop at Bernie. Since I started tuning in to CNN and then MSNBC after I ditched the former, I have heard pundits on both networks say repeatedly, ""The American people aren't dumb.""  Every time I hear that, I will roll my eyes, scoff, or verbally respond to the TV people who can't hear me from their cushy studio that the American people are in fact really fucking dumb.  They should just let Pete Buttigieg get on social media and explain everything. He seems to have a knack for getting a point across.",joshdoereddit,2025-04-27T20:53:32,3
Slotkin is none of those “antis” that you listed. She doesn’t campaign as that. You should actually read up on her before making things up which are completely false,mightcommentsometime,2025-04-28T11:34:42,0
"The point is that most people are not going to understand what that term means, especially outside of “coastal institutions” which is exactly what the quote reads. It’s not about being 100% accurate— it’s about reaching more people.  Obviously there are exceptions, but a high school educated farmer or a working class laborer from the midwest, or even in general, is likely not going to know what an oligarchy is or what it implies, and many will even stop listening when they hear it. Who is going to care about learning what an oligarchy is when they have to put food on the table for their family? At the end of the day that’s all most people care about and have time for.   However, most people, even working class non college educated people, know what a king is, and they likely have a grasp on why the United States does not, and should not, have a king.  Everyone is always criticizing the Democrats for being elitist. Adjusting the language is not a bad suggestion, and it doesn’t significantly change the message at the end of the day. It is a country of we the people for a reason.",ironyinsideme,2025-04-28T09:59:20,1
It’s a common way to describe teams or players when it comes to evaluating their potential,nanobot001,2025-04-27T19:56:55,8
"I don't mean' rhetoric' in the sense that it is cynical speech designed to manipulate, I just mean to say that it is convincing speech and that it would be a poor rhetorical tactic to insinuate that Republicans and other Americans are just dumb. All the people disagreeing with this take are missing the point, this is about growing support, not attacking a group of people.   All this divisive shit needs to stop. Dems and other resistors need as many Republicans on-side as possible, because this is one of those cases where both sides can find common ground in the notion of Democracy; y'all need as many people as possible fighting with you, because it's going to get bad.",AlexanderTheGate,2025-04-27T22:30:36,6
"Sort of a dark series for a middle schooler, but not a bad way to teach them what to expect when they get older I suppose.",PerniciousPeyton,2025-04-27T19:16:56,1
" > Kamala didn't have policies that explicitly hurt somebody, put a blame on somebody for the problems people were facing, so many people (incorrectly) felt like she wasn't going to change anything, she wasn't interested in impacting the balance of power.  Well she openly said multiple times in interviews that she wouldn’t change much from Biden. She called herself a pragmatist and said only a few “bad apples” were to blame for price gouging. Actually she was moving to the right of Biden to keep some of Trump’s first term cuts if you look at her tax policies. It wasn’t clear how she was interested in changing anything that would directly help people deal with the cost of living. Her tax credits were narrow and her price gouging ban was widely considered ineffective even by an Obama administration economist.   Trump was explicit about immigration and trade deals being the reasons he thought people were struggling. He said Democrats were too obsessed with DEI to be effective. Then he spent most of his time emphasizing those ideas by mindlessly yelling into a mic about them. People didn’t think he was a genius, they just thought he had an actual vision for change. Right-wing media spun the details as needed so that people, even immigrants, thought he was only targeting prisoners or violent criminals.  > Progressives very clearly offer actual policy that clearly reshapes the balance of power and clearly helps the common folk.   I agree here, progressive policy should be framed as cutting out special interest groups to focus on directly investing in workers. Single payer healthcare, free public college, higher minimum wage, and other progressive policies are simple and effective. It correctly places blame on oligarchs and corporations for creating an unfair corrupted market. The problem is that a lot of Dems still take donations from that class of people, so we can’t embrace obvious solutions to stopping Republicans from arguing the government can’t do anything",Prior_Coyote_4376,2025-04-27T17:25:29,2
Being ironically stupid is still spreading stupid.,Psephological,2025-04-28T01:59:27,1
"Hmm. Because I’m pretty sure that in reality, we knew the earth was round 500 years ago, and then we figured out the earth wasn’t at the center (Galileo)",Fun_East8985,2025-04-27T16:13:29,6
"I agree, “rich” doesn’t really describe the problem.  Every country on earth has rich people. Oligarchy is better suited because it describes a system where rich people rig the rules in their favor, undermine regular people’s voice in government and pull the ladder out from under them.",PerniciousPeyton,2025-04-27T19:00:20,4
You didn’t refute it. You just gave one of many  reasons why Americans can be considered dumb. You didn’t give evidence of the opposite.,DumboWumbo073,2025-04-27T22:36:30,-1
"If it's not totally clear to you what was wrong with Kamala as a candidate then I don't think there's anything I can say through reddit that will change your mind, since people usually just turn it into a pissing match. Also I live in an almost 100% rural Trump district so my vote didn't matter anyways. If I was in a more competitive district I might have been convinced out of pragmatism to vote Kamala but considering my location i voted for my conscience instead.",PutsPaintOnTheGround,2025-04-28T06:14:17,-2
"Harris campaigned on strengthening unions, helping with down payment for home buyers, including nursing home care with medicare, building on to the affordable care act. Trump campaigned on pardoning January 6 violators, mass deportation, tariffs, and we all know about his fraud and rape charges. Oh yeah all that awesome change.",a_little_hazel_nuts,2025-04-27T17:58:07,6
"Which turns to my last paragraph, instead of complaining about Bernie having too much faith in the intelligence of the electorate, why not hold your own events and use the verbiage you think he should be using? Or even just join his tour and speak to the massive crowds he's gathering?",Notlookingsohot,2025-04-28T00:33:08,2
"So she isn't campaigning on ""weak and woke"" then? I thought that was the slogan.",Moon_Noodle,2025-04-28T11:52:42,1
"If you adjust the language to say the party opposes “kings” and kings aren’t actually remotely close to a problem then what you’re saying is that there isn’t a problem. Name all the kings that you can off the top of your head. At best you can probably name one living king. Is Putin a king? No. Is anyone in America trying to become king of America? No. What are we saying, we oppose the king of England?      Meanwhile there’s an actual problem with an oligarchy in America. If you distract the issue to deflect upon kings which aren’t a problem and that we don’t actually even oppose, well, there’s no better way to sweep the issue of the oligarchy under the carpet.      Americans may be fucking dumb, but if you feed them bullshit expecting them to hallucinate they’re just going to feel like you’re bullshitting them and completely out of touch. You’re not going to convince even the most uneducated 12 year old that kings are a problem that hasn’t been dealt with hundreds of years ago.      Edit to add: Welcome to the, “We think you’re too damn stupid to have an honest dialogue in our common tongue,” Party 🤷‍♂️",dclxvi616,2025-04-28T10:08:00,1
It's a common way to describe the potential of lots of things. It's a pretty generic metaphor.,Mavian23,2025-04-27T19:59:30,5
Yeah we should stop all this divisive shit and take a lesson from the Jews who worked with the German party that was rising in 1932. I'm sure that worked out well for them.,NewSauerKraus,2025-04-28T04:28:53,-1
"It's ... Really not dark. It's a kid-safe rip-off of Battle Royale. That one, I read in middle school, and is actually dark. If you think kids are learning 'the dark side' of life from something as tame as hunger games, then I can see why we have so many people with heads buried in the sand these days.",Spa_5_Fitness_Camp,2025-04-27T21:09:13,1
Thats completely besides the point. It's literally a word for word quote from a famous movie and not even the relevant part of the quote.   If i remember correctly Tommy Lee Jones flubbed the line and they kept it but I may be misremembering.,msfamf,2025-04-27T16:17:56,9
You don’t have to be stupid to be lied to. What the fuck kind of stupid DARVO bullshit attitude is that.,-jp-,2025-04-27T22:40:57,3
If you can’t put to words what was wrong with “dog ass” Harris maybe there’s a reason for that.,-jp-,2025-04-28T08:58:37,2
"""Building on the Affordable Care Act"" is Trump's ""concept of a plan"", there was never any serious policy presented to making healthcare affordable for all Americans. The down payment for first-time homebuyers would actually an upward transfer of wealth if you think about it for more than two seconds, because the only first-time homebuyers who could afford to buy homes in the first place are children of existing homeowners. The at-home healthcare for seniors would have been good thing but incredibly minor in the grand scheme of things, and 'strengthening unions', again, ""concept of a plan.""  There was no core vision of how society should function, in any way other than picking at the edges of the status quo. There were no answers for why we still had a for-profit healthcare system, for why we still had millions of people underemployed or unemployable not getting the money they need to live in an inflating economy. Between Harris and Trump, Trump was the only person telling people 'you'll be taken care of', even if it was a lie and even if it was devoid of specifics. Harris effectively promised to continue cutthroat competitiveness where you have to prove your usefulness to a global market, and people didn't like that. That was why Trump was consistently rated as more trustworthy on the economy than her.",PeliPal,2025-04-27T21:40:10,3
"Massive crowds don’t mean shit. He’s always been able to draw them, and can’t win nationally.  What she’s saying is that use language that resonates more with people who aren’t in safe dem regions or “coastal institutions” in her words.",mightcommentsometime,2025-04-28T00:44:07,1
Look at her voting record. She has a 100% LGBTQ record from the Human Rights Campaign.  You’re trying to invent your own meanings which make Slotkin bad. That’s absurd,mightcommentsometime,2025-04-28T11:57:04,0
"But the point is that you’re saying Democrats support the oligarchy because they’re suggesting adjusting the language, whereas the point of the criticism is actually that they want to reach more people and don’t think the term oligarchy will resonate as much as king will.  Regardless of if you agree with that point or not, it doesn’t mean Democrats are out here supporting the oligarchy. They want to reach as many people as possible *about* the problem of the oligarchy and this is just one suggestion about how to do that. It feels like a dishonest way of framing the argument to just paint them all as corporate oligarchy loving shills just because of that one criticism.",ironyinsideme,2025-04-28T11:11:03,1
If you say so,nanobot001,2025-04-27T20:03:56,-2
I would call this a false equivalence,AlexanderTheGate,2025-04-28T17:30:35,0
"Yes, you do if the person has lied to you and others repeatedly in the past. You’re not making any sense.",DumboWumbo073,2025-04-27T23:01:43,-1
"And if you are unwilling to critically look at your candidates or their platforms and just opt to ""vote blue no matter who"" then there is one of your reasons why you'll continue to lose working class voters.",PutsPaintOnTheGround,2025-04-28T09:03:12,-2
"So why isn't she doing that? Because all I see is people complaining about Bernie and AOC not dumbing down their messaging. Why isn't she joining him onstage to talk to the American people? Why isn't she holding her own events if she thinks their methodology is flawed?  Criticism is all well and good, but if the people criticizing Bernie and AOC aren't willing to put their money where their mouth is, all they're doing is getting in the way.",Notlookingsohot,2025-04-28T00:48:22,3
"That's not what I'm saying. I'm saying the branding on the message doesn't do it for me because it's surrendering to the conservative message of ""woke bad.""  You're twisting my words and trying to start a fight. I'm not going to engage with that. I spend every day fighting for my existence as a trans man.   Woke means that someone is awake to injustices. Tell me how being woke is a bad thing.",Moon_Noodle,2025-04-28T12:13:21,2
"Messaging is about optics. I understand the point they’re trying to make, but it matters not whether or not you support the oligarchy if your messaging is congruent with the messaging of someone who supports the oligarchy. If I supported the oligarchy I’d propose we shift messaging away from saying we oppose the oligarchy to saying we oppose some boogeyman like kings. So now your messaging and optics are identical to what someone supporting the oligarchy would put forth. And we can note that they are in fact opposing the oligarchy, but the reason we’re even having this conversation is the notion that the reality isn’t nearly as important as the messaging and optics.      It’d be analogous to saying we oppose wealth inequality but people are too stupid to understand wealth inequality so let’s just tell them we oppose gold and silver-backed dollars. Like okay, go ahead, but all you’re achieving is the reinforcement of ignorance in the ignorant, and appearing to not oppose wealth inequality to those that are not ignorant. Like sure, we’re not even going to begin to try to educate you about what our concerns are because *that is not what is important*. That’s the messaging and optics you want? That’s the approach of oligarchs, whether you want to admit it or not.",dclxvi616,2025-04-28T11:26:33,1
"I have far more often heard the metaphor used outside of a sports context than I have within a sports context. I most often use it to describe video games, where the floor describes how accessible the game is and the ceiling describes how much room for complexity and skill there is. I've also often heard it used to describe the potential of students. I'm not trying to nitpick, I just thought it was interesting hearing it referred to as a sports metaphor.",Mavian23,2025-04-27T20:25:09,10
"For one, you're asking for people to work together _against_ the [German party], not with them.",dbalatero,2025-04-28T17:39:25,1
Man what person. By “person” do you mean basically the entire fuckin’ 4th estate? Because that’s who *I* mean. You’re not stupid for trusting fuckin’ journalism as a concept.,-jp-,2025-04-27T23:06:58,1
Yeah there you go again. I voted for Harris and the only possible explanation you can think of is that I am incapable of critical thinking. You can’t explain WHY you believe that. You just know. For reasons. Not because of a decades-long disinformation campaign. Just reasons.,-jp-,2025-04-28T09:36:22,0
Because joining Sanders ego boost tour isn’t actually doing anything material to fight Republicans.  She’s actually working on developing strategies to win elections and making plans to strategize how to actually win back majorities. Sanders and AOC are having glorified political cheerleading rallies and not actually strategizing or doing anything which moves towards winning back a majority in Congress.  She wins competitive elections. Neither Sanders nor AOC ever have,mightcommentsometime,2025-04-28T01:42:08,1
The term woke has been co-opted by the GOP to now mean “bad”. Moving away from that messaging while keeping the meat of the policies isn’t a bad thing.,mightcommentsometime,2025-04-28T12:30:39,1
"“If I were someone who liked eating boogers, I’d shift the focus away from boogers and say I liked eating sushi. Now my take is the same as someone who actually likes eating boogers.” ??? That’s the same logic.",ironyinsideme,2025-04-28T12:29:24,0
"Yea that absolutely has not been my experience, having followed all of those areas with interest.",nanobot001,2025-04-27T20:40:00,-5
The same media saying Democracy is at risk for 8 years now. You’re not proving your point very well. “Play *stupid* games win *stupid* prizes” You know you’re wrong.,DumboWumbo073,2025-04-27T23:16:44,0
"If you're genuinely interested then here are my main few reasons. I'm hesitant to bother typing this out because pretty much every dipped in the blood Democrat I've said this to has told me the only reason Kamala lost was because Americans are too sexist and racist to vote for a black woman.  She was part of the administration which oversaw the absolute disgusting destruction of the Palestinian people, while gaslighting people the whole time about how tirelessly they were working for peace. Her ""I'm speaking"" moment that liberals fawned over made me wanna vomit and was the moment I knew she was gonna lose in a bit way.  She is an empty suit that has picked up and dropped policies  like it's a game of Simon says. And the policies she ultimately ran on were annoyingly specific and technocratic nonsense that nobody could clearly explain who they were going to help or why.   She spent the most critical weeks of the campaign keeping her secret weapon in Tim Walz on the back burner while she campaigned with Liz Cheney and talked about owning a Glock and how they wanted to be tough on immigration but the Republicans wouldn't let them.   She advocated at the convention for the US to the most the lethal fighting force on the planet. Liberal Democrat by the way.  Shes a cop, that's gross enough as it is.   Her and the entire democratic media apparatus spent 2 years gaslighting people by saying that Biden was totally competent and the economy was great. Inflation was under control, interest rates were dropping, stocks are at all time highs. Ignoring the reality that the economy wasn't and hasn't worked for the working class in a very very long time.   But above and beyond all of that she's truly just did not have a real bold platform of materially improving the lives of working class Americans. I've said it elsewhere but you could have run a hot steaming bowl of shit on a progressive Bernie Sanders style platform and won in a landslide.",PutsPaintOnTheGround,2025-04-28T11:47:57,1
"Unless those strategies are genuine change for the betterment of the common man and not the ruling class, and a **metaphorical** sequel to Sherman's March to the Sea, it's not actually going to do anything.  The Democrats approval rating is 27% because they don't stand for anything. Supporting the status quo is not a rallying cry to the people left behind by the status quo, the people are hungry for change, and they are willing to burn the whole damn world down to get it based on Trump's reelection. We need radical policy changes like FDR brought to our forebears in the 1940's, not more appeasement to a ruling class that already has everything and still cries that it needs more.  But I'm about to get back to reading my book for a bit before I go to bed, so you have a nice night/morning.",Notlookingsohot,2025-04-28T01:53:46,3
"Letting the fascists have a win like that isn't something I can condone. My point is I don't think that's going to work as far as messaging goes. I *never* attacked her actual positions, and you put that on me.   I hope you have a good day.",Moon_Noodle,2025-04-28T13:04:21,2
I clearly don’t have enough time or crayons to explain it to you. Enjoy the boogers.,dclxvi616,2025-04-28T17:51:03,2
"Ha. If you think Democracy is not at risk now, or for the previous eight years, or indeed since its fucking inception, I don't *need* to prove my point. You're going to ignore the evidence of your eyes and ears regardless.",-jp-,2025-04-27T23:20:26,2
"I *am* genuinely interested or I wouldn'ta asked, and I also would be over the moon if someone ran on a Sanders-style platform. I'm coming at this from the perspective of not letting the perfect be the enemy of the good, get me? That said let's go point-by-point.  > She was part of the administration which oversaw the absolute disgusting destruction of the Palestinian people  This is CATEGORICALLY not true. Nothing Harris did, nothing Biden did, whether or not you agree with them on their Israel policy, amounted to anything CLOSE to ""overseeing the destruction of the Palestinian people."" You KNOW that the person who is to blame is Benjamin Netanyahu. HE is the one responsible for the genocide in Gaza.  > She is an empty suit that has picked up and dropped policies like it's a game of Simon says  This one is a MAGA lie. She had a platform. If you aren't familiar with it, there's frankly a reason for that.  > She spent the most critical weeks of the campaign keeping her secret weapon in Tim Walz on the back burner while she campaigned with Liz Cheney and talked about owning a Glock and how they wanted to be tough on immigration but the Republicans wouldn't let them  This one isn't even a reason to dislike her. This is her appealing to conservatives and that not being a very smart idea. Why would your opinion of her be predicated on that?  > She advocated at the convention for the US to the most the lethal fighting force on the planet.  I honestly don't know what this point is referring to, so if you'd care to elaborate I'll inform myself.  > Shes a cop, that's gross enough as it is.   And Trump is a fucking authoritarian dictator. You wanna weigh him against ""a cop?"" I ask because we literally did that in November and you obviously made your choice.  > Her and the entire democratic media apparatus spent 2 years gaslighting people by saying that Biden was totally competent and the economy was great. Inflation was under control, interest rates were dropping, stocks are at all time highs. Ignoring the reality that the economy wasn't and hasn't worked for the working class in a very very long time.   OF COURSE the economy wasn't ""great."" There was a literal fuckin' plague. But it was better than it was anywhere else. You gonna disagree?  Here's the thing. Literally everything you have said is a lie you have been told. You bought in to the idea that Harris had no plan and was single-handedly responsible for Gaza and interest rates and whatever the fuck else. And it's all a fucking lie.",-jp-,2025-04-28T12:05:22,0
You said American aren’t dumb I’m saying they are because Trump got elected.,DumboWumbo073,2025-04-28T06:46:04,0
