Comment,Author,Date,Score
"""I had a dream about you, President Trump.  You were in a grand parade.  The streets were lined with people for miles.  Tens of thousands of people all clapping and cheering as you went by.""  ""That's such a beautiful thing to hear, so fantastic.  I must have been wearing a suit, which tie was I wearing?""  ""No idea, it was a closed casket.""",I405CA,2025-04-11T21:20:53,127
This poster rocks. Right wing grifters like Alex Jones love to talk about how we're paid Soros plants. Well we're not. We're just regular people who haven't been brainwashed so we know how fucked up all this is.,big_guyforyou,2025-04-11T20:01:46,106
I've been hating on Trump for 35 years now,WillCle216,2025-04-11T21:47:22,32
Donald Trump is a DEI employee -- Demagogue Egomaniac Insurrectionist.,Daktaligu,2025-04-11T21:48:20,19
"Yo Elon, if the other side is beating you cause they're secretly being funded, why can't your open funding beat that? You're the richest man in the world. *just pay people not to protest*. Money is the only thing that motivates them, and you have the most, like cmon man, do we need to figure out everything for you?",jancl0,2025-04-11T23:34:44,14
https://preview.redd.it/wd5t5vnqjbue1.jpeg?width=726&format=pjpg&auto=webp&s=050844b8a52714ee5e307fe0ae3c061c60847cbe  Looks a little taller than it should!,godlesspika,2025-04-11T21:56:29,20
Best. Sign. Ever.,ScotchCigarsEspresso,2025-04-11T19:40:26,6
FOR FREE? BUT THATS COMMUNISM.,[deleted],2025-04-12T06:53:14,6
"I don't have any personal hatred for the man, but I will be as active as I can be to help dismantle his protectionist, nativist, and isolationist policies.",maybemorningstar69,2025-04-11T19:13:07,15
Too bad he doesn't know how to read,RedRoom4U,2025-04-12T08:57:19,5
That’s a good sign,Smooth_Brain_Liberal,2025-04-12T01:23:44,4
Love it,Far_Out_6and_2,2025-04-12T01:16:56,3
That poster speaks volumes. It's time to stand up against toxic rhetoric and division.,drewsy4444,2025-04-12T01:35:09,3
Finally somebody ,WoodpeckerFluid4297,2025-04-12T06:06:40,3
I love this!,kerryfinchelhillary,2025-04-12T08:25:49,2
That's awesome!,aunttocats,2025-04-12T19:31:53,2
I would pay money for me to be there. Nobody is being paid.,Legal-Freedom8179,2025-04-17T15:39:21,2
"Hands down, the best sign I've seen yet.",Own-Improvement3826,2025-04-14T00:42:35,1
"""It is better to be feared than loved if you cannot be both.""   Trump is neither.",immortalfrieza2,2025-04-16T02:27:29,1
[removed],[deleted],2025-04-12T03:57:24,-10
405 represent 🫡,monsterdiv,2025-04-11T21:23:23,31
It’s the irony. He has paid supporters at his events along with the local thoughtless minnows that make up his base.,dwindle_centric,2025-04-12T07:24:06,20
"Of course WE are Soros plants b/c MAGAfrequently has to pay for people to show up to their cross burnings.  EVERYTHING they say is PROJECTION.  Whatever they accuse their critics of or whatever they say libs are doing, they say it b/c that’s what they are doing.  PLUS, it’s universally accepted by humans on earth that racism and bigotry are things that BAD people do.  They are desperate to rationalize their behavior so they don’t have to take responsibility for being bad.  It’s why they cling to Leviticus saying gay is an abomination but disregard that Leviticus says accumulating wealth when there’s poverty is the SAME abomination.  This is so they can tell themselves ‘I’m not a bigot, just religious’.  They lack the introspection, let alone HONEST INTROSPECTION, to understand this is why they do this.  They aren’t religious.  They are just shitty humans rationalizing their behavior.  Neither Trump nor MAGA made them shitty.  Trump and MAGA gave them permission to be proud to be shitty assholes.",jayparker152,2025-04-16T21:11:05,2
[removed],[deleted],2025-04-12T07:38:07,-17
"Or a Degrading, Erratic Imbecile",Mr_Fahrenheit_112,2025-04-13T07:11:48,6
Agreed  https://preview.redd.it/r02gz9rs4due1.jpeg?width=828&format=pjpg&auto=webp&s=e85fc733fce13b6b56e7005e1b0f85efc94058bf,JamozMyNamoz,2025-04-12T03:15:40,4
"""Objects in the mirror are smaller than they appear""",Tough_Counter_5254,2025-04-14T03:12:52,1
"Just need to carve a sentence beginning with ""Here lies"" and it'll be the best monument to Donald Trump ever. The cheeseburgers will make it happen soon enough.",immortalfrieza2,2025-04-16T02:32:21,1
Then you haven't been paying attention.,3d_blunder,2025-04-12T01:14:07,27
"A positive sign, even.",iHo4Iroh,2025-04-13T10:55:29,1
I wish I were filled with so much unbridled delusion that I could project this much bullshit onto a picture-perfect neutral expression :|,AlphaScorpiiSeptem,2025-04-12T04:35:08,7
[deleted],[deleted],2025-04-12T08:18:06,3
![gif](giphy|wzxK9cmYgIPDy),i-Ake,2025-04-12T08:16:26,2
Trump is definitely playing the role of the heel to a T. Haven't figured out why yet but I'm sure there is a lot going on behind the scenes. His handlers directing him like a wrecking ball and busting down the walls of a corrupt institution? I dont love or hate him for any of it. I just wish I knew what the end game was. The headlines are confusing and definitely designed to get people pissed off.,christophlc6,2025-04-12T08:26:15,5
"""Deranged /Demented Erratic Imbecile"" works fine, too.",2GreyKitties,2025-04-13T16:36:38,4
"Eh, I'll never hate someone I've never met, but that's just me",maybemorningstar69,2025-04-12T19:11:50,-2
"“The headlines are confusing and definitely designed to get people pissed off.”  You realize they’re just reporting on all the bullshit he and his administration are doing right? And if you think it’s designed to piss people off, maybe that’s because this administrations actions are fucked up and pissing people off?",Agitated-Raisin6197,2025-04-15T15:58:31,2
"How do you feel about historical figures?  Do you have to meet them to hate, say, Pol Pot?  Ted Bundy?",3d_blunder,2025-04-12T19:13:23,6
"I think they're bad people, if I met them I'd say something along the lines of ""you've done so many terrible things, why have you done these things? You should feel ashamed, and spend the rest of your life in prison, etc."" But hate them, no.  People tend to image history's worst figures as these comic book style villains, evil incarnate, when in reality they're just regular people who chose to do some very awful things. Rather than hate them, we should just say ""here's an example of something bad, let's make sure that doesn't happen again.""",maybemorningstar69,2025-04-12T19:18:47,-1
"Hate is a strong word.  One I rarely use.  But he has both earned and deserves my hatred.  What he is doing to this country AND its people, and the fact that he is even able to sleep at night should tell you all you need to know about this man.....and his cohorts.",Own-Improvement3826,2025-04-14T00:41:45,4
