Comment,Author,Date,Score
" As a reminder, this subreddit [is for civil discussion.](/r/politics/wiki/index#wiki_be_civil)  In general, be courteous to others. Debate/discuss/argue the merits of ideas, don't attack people. Personal insults, shill or troll accusations, hate speech, any suggestion or support of harm, violence, or death, and other rule violations can result in a permanent ban.   If you see comments in violation of our rules, please report them.   For those who have questions regarding any media outlets being posted on this subreddit, please click [here](https://www.reddit.com/r/politics/wiki/approveddomainslist) to review our details as to our approved domains list and outlet criteria.    We are actively looking for new moderators.  If you have any interest in helping to make this subreddit a place for quality discussion, please fill out [this form](https://docs.google.com/forms/d/1y2swHD0KXFhStGFjW6k54r9iuMjzcFqDIVwuvdLBjSA).    ***   *I am a bot, and this action was performed automatically. Please [contact the moderators of this subreddit](/message/compose/?to=/r/politics) if you have any questions or concerns.*",AutoModerator,2025-05-09T08:53:40,1
All of Trump's cabinet picks are meant to destroy the country and whatever institutions the pick is in charge of.  He did the same thing during his first administration and this murderous quack is no different.,ToNoMoCo,2025-05-09T09:15:27,11
"Remember when Surgeon General Jocelyn Elders had to resign because of this statement:  >""As per your specific question in regard to masturbation, I think that is something that is a part of human sexuality and it's a part of something that perhaps should be taught. But we've not even taught our children the very basics. And I feel that we have tried ignorance for a very long time and it's time we try education.""  Meanwhile, Typhoon Bobby is running the place.",VaguelyArtistic,2025-05-09T09:59:57,8
So she should.   He’d children will likely suffer or die with polio.  She after all is hoping to bring it back with the worm brain RFK  They only care about putting money in their own pockets.,Alternative_Sir_8960,2025-05-09T09:05:38,4
"Trump’s picks are nothing but evil people, grifters, hacks, and drunken Fox News personalities",Pankosmanko,2025-05-09T11:41:59,2
"Apparently there isn't a point where the GOP in Congress decides no, these ever-more-insane idiot picks are affecting me and my family personally and fucking up my investments, and we must stop this. They're all leaping off the cliff together and taking the rest of us with them.",oculeers,2025-05-09T09:49:17,3
Nothing some crystal healing can't fix.,30mil,2025-05-10T06:47:14,1
