Comment,Author,Date,ScoreAlso true of men who voted. ,Donkletown,2025-05-09T08:52:50,3
What bullshit. The vast majority of people out on the streets protesting this are white.,Amenian,2025-05-09T08:42:00,2
There's pictures of him meeting with the Senator from Maine while he's down there.,dancefan2019,2025-05-09T19:58:43,2
"No, he's not dead. Bukele is actually nervous about the whole thing, so he is making sure he is safe.",Newswatchtiki,2025-05-10T00:44:20,1
Betraying the nation.,SnooDonuts5498,2025-05-09T07:43:43,0
Ha! I’d love to see the treasonous court try.,SnooDonuts5498,2025-05-09T07:44:07,-4
Keep living that fantasy.,Quixkster,2025-05-09T09:02:35,1
My County sentences dog killers to prison time. Our judges have no mercy when it comes to dogs.  She would definitely be in prison here for that.,Newswatchtiki,2025-05-10T01:06:34,1
"Even Bukele is getting uncomfortable about it. Now asking the U.S. for documentation that these prisoners were criminals or proven members of violent gangs. He is finding out that many of them were not criminals or gang members and he is puzzled about what Trump is doing and why - he, as a known dictator, is beginning to see that Trump pushed for a rushed and reckless deportation.",Newswatchtiki,2025-05-10T00:53:05,1
everyone pays attention to the prototype before you roll it into production,themattboard,2025-05-09T07:45:34,6
Can’t show weakness. That would show how incompetent they are,InFairCondition,2025-05-09T12:17:26,3
"He's the litmus test. If they can just ignore this order scot-free, they can ignore the rest.",Background_Home7092,2025-05-09T10:45:57,2
I guess the final order that protected him from deportation is just something you’re ignoring because it’s not great for your dumb take?,InFairCondition,2025-05-09T12:18:53,3
"It’s not, El Salvador is not a sovereign nation here, they are our contractor. El Salvador is imprisoning him on our behalf because we pay them to.   I hate Trump, but I don’t think the next president can just scoop him up, send him to a foreign prison, and then show up to court and say “sorry judge, this is a foreign affair.”",Donkletown,2025-05-09T09:32:04,5
">SCOTUS ordered Trump to remove all obstacles, he ha  What evidence do you have that Trump has tried when he has repeatedly said he won't?",loki2002,2025-05-09T21:39:00,1
"What's the 'humanitarian action' here? Do you want the rest of the world to sanction the US? (You seem to be doing it to yourselves already)  Do you need food aid? Medical intervention for AIDS and Ebola epidemics? Wells for remote villages? Schools?   Or are you calling for other countries to invade US and enact forcible regime change? What?   US is still one of the richest, most developed countries in the world. You have the tools and resources to fix yourselves, you simply have chosen to not do that, repeatedly.",Finwolven,2025-05-09T06:47:18,14
"What the hell are they supposed to do? They can't physically do anything without declaring war on the US, and that kind of goes against the fact of being military allies.   They can call the administration or send a strongly worded letter advising against current administration actions, but they can't do anything else.   When would other countries get involved? The moment the US puts one military boot on foreign soil in aggression. If we actually take military action to make Canada the 51st state or try to take Greenland. At that point, we nullify our own treaties, and they can act accordingly. I honestly don't think Trump is stupid enough to actually invade Canada. But Greenland, they might be just that stupid.",Kordiana,2025-05-09T06:59:44,5
"I think a lot of Americans underestimate how many countries are *still* far more authoritarian than this shithole administration. Certainly the size and political / economical weight of the US makes it a bigger deal than say, Belarus, but American exceptionalism doesn’t make us special in having moron assholes in charge rn.",grizzlby,2025-05-09T07:16:48,3
Why is it treasonous to require the executive branch to abide by the Constitution?,ME24601,2025-05-09T10:25:29,4
"Wierd.  She has explained time and time again that he never abused her,  and that taking out the order was precautionary because her previous relationship was extremely traumatic....  I guess she's just not believable to you for some reason.. 🤔",PaydayJones,2025-05-09T10:55:27,7
Does that justify no due process?,SlipNSlider54,2025-05-09T10:45:08,4
SD Voters legalized cannabis years ago. They ignored it. This is what she does.  Couldn't possibly have had anything to do with her husband who sells crop insurance. Nothing to see there!,thirtynation,2025-05-09T07:15:00,668
"can confirm: all our taxpayers dollars for her stunts at the texas border, ignoring the damage of the flooding that we received in June 2024...etc etc etc etc etc......She did come to our town to ""assess"" the flood damage, but it was just a trumped up photo op for her and her glam team.....jfc...",golfball7773,2025-05-09T07:21:12,103
"She milked the poor bastards for a whole lot of plastic surgery, designer outfits, and luxury trips while in office.  She essentially got the state to pay for her launch as a MAGA instamodel.",oldbastardbob,2025-05-09T09:35:10,40
At least several of the Tribes had sense enough to ban her from their reservations.,zsreport,2025-05-09T07:39:03,61
"I know this is small in the grand scheme of things but in 2019 she kicked a young girl out of girls state for taking a picture of her with “lets party like it’s trumps impeachment day” sticker and if you see the texts behind it where they’re bullying this teenager. I think it really paints a picture of how she needs to control others.   This woman is deeply insecure, small, and unhinged.  It’s an old article on Dakota free press if anyone wants the sauce.",Constant_Minimum_108,2025-05-09T09:31:10,24
Why did the public stop tarring and feathering people like this?,PotaToss,2025-05-09T10:05:09,2
Yeah but they wanted it and were begging for more given who owns all levers of power in the state,ihaveaboehnerr,2025-05-09T08:36:56,1
Does she have a Only Fans for this?,brickne3,2025-05-09T18:38:15,1
"Charging the state credit cards to hundreds of thousands of dollars.  She is a vile, evil and disgusting person",UnbelievableTurmoil,2025-05-09T22:03:51,1
How were puppies fucking over South Dakota?,Gold_Assistance_6764,2025-05-09T12:38:20,0
"Why are we even paying taxes anymore? To pay the interest on trillions of more debt this fucking guy is responsible for, to fund a military so full of corruption and waste it’s impossible to pass an audit, and to whatever scam of the hour him and his billionaire cronies are defrauding us out of.",go_outside,2025-05-09T08:37:04,52
"No, no, no. See, they’re *on the team*. You? You’re just a lowly serf; one of the dirty proles. You don’t get to ignore the law.   You remember the quote: “something, something *binds but does not protect*.”",YeOldeBootheel,2025-05-09T07:12:58,105
Without the will to enforce it the law is just words on paper.   The Constitution itself is just words on paper without the will to enforce it.,Nf1nk,2025-05-09T09:32:21,14
Or issue a citizens arrest,Empty_Sea9,2025-05-09T10:36:57,1
Hey Kash is very busy finding enemies of the state at Las Vegas nightclubs. He never sleeps.,brickne3,2025-05-09T18:49:11,1
"> ust sitting there and saying, essentially, “whatever, bite m  That was 100% going to happen after Biden pulled off the blanket pardon for all of his family for anything they may or may not have done in the last 10 years.  Politician, on both side, have been getting away with everything for soo long... now they are just open about it.",Free_Mission_9080,2025-05-09T10:25:29,-5
"It’s usually the majority party that flouts the law, both sides guilty, knowing the majority will not hold itself accountable. Regarding Garcia, only his president can authorize a return to the US. The US gov has no authority to extradite citizens from their home countries.",Potential-Anything54,2025-05-09T08:02:19,-27
"Those haven't popped up on my Hulu feed, yet.",zsreport,2025-05-09T08:27:51,10
"I get those wannabe ""America's Most Wanted"" ads from her, all the ""Trump's bringing back steel"" ads, it's driving me crazy",IssueOk363,2025-05-09T09:04:23,2
"Yes and no.   Remember, she was the front runner for his VP pick before that book.  Arguably this lets her steal more money from us, but she was set to take over when the Orange Felonious kicks it in office.",ragnarocknroll,2025-05-09T10:25:59,1
Yep. She saw that trump and his fascist cohort revered cruelty as a virtue. So she wanted to prove that she could be cruel and thus put the story of her murdering her puppy into her book.,VanceKelley,2025-05-09T10:34:36,1
He's never been a pet person has he.,brickne3,2025-05-09T18:53:11,1
"I'm a pet person but ""murder"" is human unlawfully killing another. What she did was more akin to animal abuse.",haarschmuck,2025-05-09T21:23:30,1
"Some dogs are considered puppies up until they’re 2 years old, but for most dogs the cutoff range is 12-18 months. Regardless, I call all dogs puppies because they’re all so fucking adorable and amazing",Outrageous_Golf3369,2025-05-09T07:37:36,15
"The dog wasn't violating the law, the owner was. She's clearly a bad dog owner and should have never been allowed to own dogs.",zsreport,2025-05-09T15:58:38,3
>Edit: my internet points :/ guys stahp  You waited an entire 14 minutes before putting this edit in? 🤣,Inevitable-High905,2025-05-09T07:16:10,18
Wanting to kill puppies doesn't make you a cat person. It makes you a fucked up sadist.   It's weird that you feel the need to broadcast that.,inquisitive_guy_0_1,2025-05-09T07:04:02,54
So you support shooting dogs for no reason? ,BLiNKiN42,2025-05-09T07:03:17,22
"I'm a cat person and I'd never condone what she did, we do NOT claim you, psycho",Low_Chance,2025-05-09T07:14:25,24
Even Donut and Mongo are appalled at your comment.,Anonymouse-C0ward,2025-05-09T08:00:09,2
Don't worry. I too understand when a joke is made. Sorry Reddit is full of Assburger neck beards.,Hungover247,2025-05-09T07:15:10,-32
"And if Trump decides to run for a 3rd term, which is very clearly against the Constitution, all those ""Constitutionalists"" would absolutely vote for him. Because they can't let some Democrat win and destroy the Constitution and ruin America with their corruption and tyranny.",QbertsRube,2025-05-09T07:53:23,202
>The “Constitutionalists” have shredded the Constitution.  This is because they've been engaging in doublespeak this whole time.,YourFreeCorrection,2025-05-09T11:14:03,11
"Profits that will never be realized because the kleptocrats are mid-smash-n-grab as they destroy the country from the inside out, with Putin bootlicking traitors and Fox Barbie propagandists (female and male) masturbating to the destruction, while P2025 Christo-fascists sit by or manipulate behind the scenes so that they can exploit the wreckage to ensure the self-fulfilling result of a climate extinction event that they will interpret as Armageddon. Oh, what savior shall arise from his billionaire bunker to rule as a god over the land once the nuclear fallout levels have tapered off?",Vast_Ad_8515,2025-05-09T10:21:45,6
"""Constitutionalists"" = ""Only White Guys Decide What The Constitution Says"" Party",DetoursDisguised,2025-05-09T11:45:27,4
And decades of Fox News / Right Wing talk radio propaganda.,UberKaltPizza,2025-05-09T11:59:30,4
And this is why Mitch McConnell can go fuck himself with his feigned indignation at Trump. They had the political capital on Jan. 6 to end it right then and there. The country supported it. He could have given enough Republican Senators cover. And he let Trump walk. He’s to blame.,MIZ_09,2025-05-09T08:07:53,152
Senate Republicans blocked even presenting evidence in the first impeachment.,Dispro,2025-05-09T10:07:58,17
"Conservatism.  Conservatism is (by definition) a poltical theory focused on maintaining an aristocracy in a post-monarchic world.  They don't convict Trump because their morals are subservient to their desire to be the new Nobility. It doesn't matter what the rules are, the rules don't apply to Lords.  And they know that if they show weakness, capitulate and play by the rules, they're in danger of losing their spot in the nobility. Either because the system will change too much, or they'll lose an election to angry Trump fans.",snatchi,2025-05-09T14:28:35,3
>I’m not sure why people don’t see those behaviors as utter failures of checks and balances for blatantly impeachable offenses.  Because it wasn't?  Sometimes in a democracy you don't have the votes to get the thing you want.,i_am_a_real_boy__,2025-05-09T12:06:28,-9
And disbar their lawyers,iStayedAtaHolidayInn,2025-05-09T08:36:06,26
SCOTUS has no way to enforce it. The DoJ won't do anything about it.,BGOOCHY,2025-05-09T07:59:49,25
Apparently law and order always relied on the honor system and in the current system of government honor seems to be lacking.,therapistofcats,2025-05-09T05:45:34,158
This is objectively false.,ElderSmackJack,2025-05-09T06:19:17,-27
"The problem is, those responsible for ""making him"" just aren't doing it",MarkDoner,2025-05-09T09:02:04,5
"But exactly WHO is going to do that? They are the ones in charge of everything. That's why they can just ignore the law as a minor inconvenience. Even if it did get to the point of *someone* physically arresting them, they'd have a pardon issued immediately.   They are the ones charged with enforcing the laws.",catch10110,2025-05-09T08:58:06,4
Force them to prove they won’t.,joegetto,2025-05-09T06:52:47,498
"The Courts can deputize another law enforcement body to make arrests for them. DC's MPD would probably be a bad choice because of the precarious federal relationship, but a nearby jurisdiction that leans more left and/or actually believes in law and order? Arlington PD might run afoul of Youngkin, but maybe Montgomery County?",SecondhandSilhouette,2025-05-09T07:07:41,97
So fire them. Taxpayer waste and all.,do-not-want,2025-05-09T06:53:56,17
Then pam gets to keep the cell warm until the others arrive,HereForTheComments57,2025-05-09T07:12:47,9
"If the Marshalls are in contempt, issue warrants for them too.",Miguel-odon,2025-05-09T09:44:05,7
"The issue is that the Marshalls were put under the Executive Branch in the first place, instead of acting, as originally intended, as juciary police. The solution is or the Judiciary Branch to establish an enforcement agency made up elisors.",rocc_high_racks,2025-05-09T07:43:50,2
"This is why I think there needs to be some kind law enforcement entity that answers only to the Supreme Court. And then also some entity that only answers to the House and Senate, etc. They'd have just enough resources to guarantee that any unlawful confrontation would be sufficiently violent enough to be a deterrent from straying from the peaceful path of resolving problems (courts, legislation, etc).  This prevents the Executive from getting away with having some kind of praetorian guard that can allow them to take over.",steavoh,2025-05-09T13:27:52,2
Word on the street was the judge will deputise military contractors.  Like the paramilitary groups we sent to Afghanistan.   I'm sure a group of retired military will form and volunteer if it's needed.,Desperate_Big_2851,2025-05-09T18:10:28,2
"Can the Supreme Court deputize their own Marshalls and have them do it? I don't actually know, genuine question.   Also I already know they never would even if they could, this is purely a hypothetical thought exercise.",Chaotic-Catastrophe,2025-05-09T07:45:32,1
Deputize the military and round them up.,OutlawGalaxyBill,2025-05-09T08:18:15,1
Sounds like they are not fulfilling their oath to the constitution either,piratecheese13,2025-05-09T12:47:48,1
"It's a good thing judges can deputize who they want, then.",EWAINS25,2025-05-09T14:37:31,1
Guess that’s the end of the story then lol.,SniperPilot,2025-05-10T13:26:53,1
"While accurate, the executive branch would have to execute that contempt order. We all know that isn’t happening.",Bosa_McKittle,2025-05-09T08:26:52,6
The lawyers are not the ones with the information about Garcia or the power to bring him back.,i_am_a_real_boy__,2025-05-09T11:56:56,2
"Article III, Section 1  ""The judicial Power of the United States, shall be vested in one supreme Court, and in such inferior Courts as the Congress may from time to time ordain and establish. The Judges, both of the supreme and inferior Courts, shall hold their Offices during good Behaviour, and shall, at stated Times, receive for their Services, a Compensation, which shall not be diminished during their Continuance in Office.""  ""The Supreme Court has repeatedly held that federal courts possess inherent authority to punish contempt—i.e., disobedience of a court order or obstruction of justice—and to impose other sanctions on parties or attorneys who engage in misconduct.""",beeblebrox42,2025-05-09T07:49:27,18
"Every time these people in charge of the guard rails balk at actually using their authority, they make violence more likely.",aradraugfea,2025-05-09T06:48:22,70
"Not just useless, complicit.",[deleted],2025-05-09T07:20:17,25
You know they're kicking themselves every day for admitting to the administrative error at the beginning.,DadJokeBadJoke,2025-05-09T12:26:28,6
"Only a matter of time before the rule of law breaks down. If the big wigs making the decisions don't have to follow the law, why should anyone else? The societal contract is nearly broken.",mountaindewisamazing,2025-05-09T07:09:52,121
"nah, its states thst get to ignore federal laws now.",warblingContinues,2025-05-09T07:20:21,5
Watch me,ConchChowder,2025-05-09T09:50:17,2
"Talking out of my ass here, but is there any legal precedent being set here? Like could lawyers point to what's happening (or rather not happening) in other trials?  It'd be an interesting scenario if this played out across the country. Either courts have to be able to follow through and have the resources to enforce their rulings or they don't and rule of law breaks down.",Shadow_SKAR,2025-05-09T10:23:38,1
They don’t believe in anything. Just whatever brings them more power and money.,Hooper627,2025-05-09T08:59:49,3
"Hahaha, true",Hooper627,2025-05-09T10:55:50,1
">He’s not a classic racist  Are you sure about that? He does believe everyone else is less than him, but he hates black and brown people most of all.",Smaynard6000,2025-05-09T07:59:58,9
He literally said that immigrants are poisoning the blood of our country. I'm pretty sure he's a racist.,Mavian23,2025-05-09T10:28:23,3
"""its time to move forward as a nation in unity""",TheVoiceInZanesHead,2025-05-09T06:30:34,50
Defeatism is so annoying ,JugDogDaddy,2025-05-09T08:26:34,9
">In the darkest of times, hope is something *you give yourself*. That is the meaning of inner strength.  --Uncle Iroh  That being said, I am hopeful that we can get out of this peacefully, but I'm not counting on it.",Mavian23,2025-05-09T10:31:29,2
"Absolutely agree. We’ve seen firsthand what happens when a President dismisses SCOTUS, something nobody not least of all the founding fathers would’ve anticipated. As a supreme law the Constitution is a remarkable document and for the most part it works very well. However, more checks and balances are needed.",Ok-Bar601,2025-05-09T22:21:40,2
It doesnt even have the first when theyre fine with the government detaining and deporting people for their speech and discharging people from the military for their expression,TyrannasaurusGitRekt,2025-05-09T08:31:15,5
Isn’t it funny that the GOP played every dirty trick in the book to stack the Supreme Court in their favor and that’s still not enough for them? They still find a way to be even more despicable.,kummer5peck,2025-05-09T08:29:17,5
The military has nothing to do with this,miscellaneous-bs,2025-05-09T08:58:48,3
"I stole this joke, but it was too good not to steal haha",gradi3nt,2025-05-09T08:58:55,1
We can't get them to do anything.  All we can do is protest and then vote Democrat in the midterms and in 2028.,dancefan2019,2025-05-10T01:08:15,2
[Here is some more info if you want to see for yourself. The first graph gives you options to choose from. Use the drop-down menu.](https://www.pbs.org/newshour/politics/interactive-how-key-groups-of-americans-voted-in-2024-according-to-ap-votecast),Fickle-Molasses-903,2025-05-09T09:10:43,1
"Fact: Of those who voted, 60% of wt men and 53% of wt women voted for Trump in 2024. The irony of your post is that people put more effort into protesting than to come out and vote. Protesting is no concrete indicator of the way America voted as a whole. Simple question: If you saw people protesting in Florida, do they represent the majority population of white people voting?",Fickle-Molasses-903,2025-05-09T08:49:30,-2
Upholding the constitution is treason?,L0rdofDankness,2025-05-09T07:54:49,2
"If Bukele releases him and let's him come back, Trump would have to accept.   We know that isn't going to happen.   Even if it did, guess what....he gets deported to another country, or maybe even back to El Salvador because the order of withholding is no longer valid.   Either way, Garcia is never going to live in the U.S. as a legal citizen.",Todd1225,2025-05-10T09:42:14,1
"Yes.  I want the remainder of the developed world to sanction the US.     Y'all seem to think we're capable of fixing this ourselves, but it should be inherently clear to you by now that we're incapable of the most basic tasks.     In case you haven't been paying attention, our president is skirting the laws and bypassing due process.       If we don't make this a worldwide problem now, it'll be a bigger one soon.",JoEdGus,2025-05-09T07:17:52,3
">US is still one of the richest, most developed countries in the world. You have the tools and resources to fix yourselves, you simply have chosen to not do that, repeatedly.  We're like that meme of the kid holding the boot on our own faces. We're doing this to ourselves, even if the majority of the country doesn't like it. They had the choice not to do this. Not enough people chose to stop it.",Kordiana,2025-05-09T07:06:18,3
> What's the 'humanitarian action' here?  The UK or Germany could offer him asylum.,Fragrant-Luck-8063,2025-05-09T07:37:32,1
"This doesn't have to be through military action, ever.    Make it tough for them to make deals, nullify trade, make them explain themselves to the American people.   Expell them from your country and close up the embassies.       Stop dealing with them.          The issue is, our military tech is too desirable and this will never happen.",JoEdGus,2025-05-09T07:24:20,1
Any obstruction of the border security and removal of unauthorized aliens present in the United States is definitionally treasonous.,SnooDonuts5498,2025-05-09T10:37:50,-5
"There is literally audio of the court proceeding where she is pleading for a protection order against him due to the abuse. Being pushed, slapped, and having hair pulled.   So yes, it’s not easy to believe her because what she’s saying now doesn’t add up to what she accused him of before. It’s also not surprising that a victim of DV recants and tries to protect their abuser.   Does this mean he should have been deported? No. But the way Reddit portrays him as this loving “Maryland Dad” is laughable.",KenseiShadow,2025-05-09T11:26:18,-6
"Oh that's not just because of Noem - that's just business as usual in SD. It's a very corrupt state.  For example - https://www.npr.org/2017/02/01/512730065/south-dakotans-voted-for-tougher-ethics-laws-but-lawmakers-think-otherwise  > South Dakota's citizen-led experiment to ""drain the swamp"" of political corruption appears to have lasted less than three months. Lawmakers in the state Senate voted 27-8 Wednesday to repeal the voter-approved initiative. It targeted South Dakota's status as the only state that allowed lobbyists to give politicians unlimited and undisclosed gifts.   I have inlaws in Sioux Falls and Pierre who have many stories about open corruption and local politicians over the decades. Expensive vacations, bundles of cash, business for State contracts going to family members, kickbacks etc.",xlvi_et_ii,2025-05-09T07:22:28,373
Can confirm,SoDak_Kid,2025-05-09T10:59:25,2
Im Not sure I follow the implication. She blocked cannabis implementation because it’s a conflict of interest with… crop insurance?,firechaox,2025-05-09T14:32:03,2
"I mean, when you elect the worst people then you get the worst outcomes.",InsuranceToTheRescue,2025-05-09T08:21:52,39
Well she didn’t so a very good job,jgilla2012,2025-05-09T12:13:32,2
...MAGA instamodel and *future Presidential candidate.* Ugh.,Wurm42,2025-05-09T12:13:52,2
All of the tribes did. Wish the rest of the state would've grown a brain and done the same thing.,Lepoth,2025-05-09T10:15:12,21
"All of his goons are out of control with spending apparently, too. This Kristi woman is set to run out of money in July because she is overspending on ICE and not spending money on other threats; actual, real threats.   These goons were installed to spend, spend, spend and funnel money to their cronies. This is all a scam on a massive scale. You guys are getting fleeced like there is no tomorrow. ",coconutpiecrust,2025-05-09T08:54:32,34
