Comment,Author,Date,Score"For what it's worth, I don't think the military itself is full of corruption and waste. We know that they've repeatedly asked Congress not to appropriate funds for certain projects, like all those crappy jets they didn't want, but Congress did it anyways. It's Congress that's giving the military unlimited funding and overpriced contracts with manufacturers.",Mordred_Tumultu,2025-05-09T10:08:31,3
"You pay those taxes because he has that army. That's essentially the ""deal"" now, since it's highly unlikely they'll allow any competitive elections from this point onward, or allow any inconvenient laws to stop them from doing whatever they want. It's the same deal any authoritarian government offers.",barryvm,2025-05-09T11:45:04,1
"lol, but I am part of the team! Build the wall, Trump 2028! See, now we all can disobey the law as written. It’s all stupid and useless anyway. Like regulations, law should be “default gone, not default there”. I am quoting a genius here, mind you. Let’s go back to when there were no laws!   Ah, ‘twas such a prosperous time! Everything was natural! No chemicals!!",coconutpiecrust,2025-05-09T07:33:33,16
"Wilhoit: Conservatism consists of exactly one proposition, to wit: There must be in-groups whom the law protects but does not bind, alongside out-groups whom the law binds but does not protect.",VanceKelley,2025-05-09T10:32:27,2
"> You remember the quote: “something, something binds but does not protect.”  Shit. I should have not used the rope instead of condom.",Vimes-NW,2025-05-09T08:23:16,1
"Yes! Can’t wait until the defence of our friend Kash is used in court. I mean, he’s one of them top dogs, if he can do it, we all should be able to do it. He’s a shining beacon, he sets the tone, we should all follow his example, right? Just say that your interpretation is different. Boom, zero consequences, just like Kash.",coconutpiecrust,2025-05-09T09:59:17,1
"This is crazy talk.   You can sometimes infer many things, but this is not it. We have statistics as of today.   How many democrats have defied the law compared to Trump and his goons? How many of them said they had a different interpretation of the constitution? This is not a valid argument.   Biden issued pardons because he knew a vengeful criminal is about to assume the highest office in the US. Honestly, this is the bare minimum of what he should have done. ",coconutpiecrust,2025-05-09T10:32:09,4
BUT WHAT ABOUT (insert unrelated talking point here)?!?!,DurtyPurvis,2025-05-09T15:31:49,1
"Are you for real… that is not true. Both sides the same is not it. You can understand the difference between food poisoning and cyanide poisoning, right? They’re both poisonings, but boy are they not the same. ",coconutpiecrust,2025-05-09T08:24:17,13
Hey why stop there.  It's not abuse if the animal is dead right?  What she did was send it to a happier place where she isn't there,flickh,2025-05-10T01:21:07,1
Support? No.  Indifferent or uninterested? Yes.,Unoriginal-,2025-05-09T07:03:51,-94
"Elon, is that you? Is comedy ""legal"" again yet?   Nobody is missing that it was supposed to be a joke. But telling a bad joke advocating for the sadistic tendencies of an evil person currently trying to destroy the country does not entitle a person to upvotes. Sorry :(",Chaotic-Catastrophe,2025-05-09T07:43:49,17
"Nah, it’s called reading the room.  I’m a dog person and horribly allergic to cats on top of not being a fan at baseline. I don’t see a thread of comments about how someone’s cat was killed by their neighbor intentionally running over it with their car and comment that I’d like to take the neighbor out for a drink on behalf of the area birds and rabbits.",badger0511,2025-05-09T07:59:41,12
We understood it was an attempt at humor. It just wasn't funny. Calling something a joke does not exempt it from criticism. You can go over to any conservative subreddit for that specific kind of brainworm disease.,Hitthe777,2025-05-09T07:40:48,18
"He doesn't have to ""run"" for a third term if he simply refuses to leave the White House. Who's going to stop him?",NedRyersonsBing,2025-05-09T13:07:11,10
"If you look at the original constitution as ratified in 1789 it does not mention term limits.   Fuck all the originalists who bother to consider the amendments at all, they're not original!!1!!1",tangerinelion,2025-05-09T14:26:04,6
"If the people vote for him why not?  I mean at some point you have to realize the population sucks or the media sucks or our culture is complete trash where we don't care about the rules only money.  Our TV and movies are all about scumbag people.  Our reality shows give power to shitty people that don't deserve the time of day.  We don't honor social workers, volunteers, people who don't get paid a lot but we love to follow influencers that live a posh life but do nothing for society  Trump is a symptom of our country is in decline and apparently everyone is too fricken lazy to care.",giabollc,2025-05-09T08:37:45,-5
"What do you want, its super old and most can't even read, so it's just kinda guesses.",ieatmuffincups,2025-05-10T06:51:45,1
"When checks and balances only exist on paper and partisan actors refuse to enforce them because theyre either a) committed to protecting a president no matter how horrible they act or b) terrified of threats and violence from that presidents supporters (which legislators have admitted periodically including after that trial), then you don’t really live in a functioning democracy. Your checks and balances are symbolic.",False-Bee-4373,2025-05-09T12:42:11,7
"Yes they do, any judge can deputize their own Marshalls. It is just the last line of defense and if that fails and the DOJ fights it we’re done.",travers329,2025-05-09T09:30:09,22
There’s no honor among thieves,Ok_Series_4580,2025-05-09T07:07:43,42
"Every system ultimately relies on violence.  Most people don't need actual violence to comply with the law, but imagine if the state wasn't allowed to use violence at all.  Would you still pay a fine if nobody would ever come to collect?  Would you pay your mortgage if you couldn't physically be evicted?  Would you go to jail if all they could do was ask nicely? Some people wouldn't.  You're seeing what happens when one man can't be forced to do anything.",Hell_Is_An_Isekai,2025-05-09T07:40:14,27
All we really need to stop all this is for four GOP Senators to choose country over party but they won't do it.,punkr0x,2025-05-09T07:08:10,49
All laws everywhere depend on people upholding them.,Mavian23,2025-05-09T10:20:20,3
Is it?  Jefferson famously flouted a Supreme Court order with no real consequences.  This shit isn't new.,9_to_5_till_i_die,2025-05-09T06:35:53,24
It appeared to work well because it depended on people having a degree of honor and shame.,BotheredToResearch,2025-05-09T07:02:30,6
Seems like they were barely working if it was this easy for one administration to just ignore them all.,Ren_Kaos,2025-05-09T06:27:48,19
"Exactly.  Each other branch followed his lead and realized there was nothing forcing them to do their job, either.",Meecht,2025-05-09T10:45:49,3
Hopefully someone has a plan. These co-equal branches aren’t able to adequately check each other’s powers.,RioRancher,2025-05-09T10:44:06,1
"Exactly, we ended up here because of preemptive compliance and that is not going to get us out of it.",we_are_sex_bobomb,2025-05-09T07:13:50,329
"Right? There's so much 'we can't do that' and 'he can't do that' going around, and the country's laws are crumbling beneath us either way. FORCE the vote. ENforce contempt of court. 'He'll just ignore it' so try anyway. 'They'll keep doing it' so I guess do nothing and complain that you've tried nothing and you're out of ideas?   People out here on both sides really choosing the 'can't keep it' part of 'a republic--if you can keep it' phrase...",darsynia,2025-05-09T07:56:12,39
Yeah I’d love to see this,Memes_Haram,2025-05-09T07:03:06,34
"This, and then the courts do have the power to deputize people to fulfill the Marshall's duty and those people do not report to the Gestapo",skit7548,2025-05-09T15:36:17,1
Montgomery county would be itching to oblige I imagine.,Memes_Haram,2025-05-09T07:09:27,16
"Unfortunately, I see that this is how this is ultimately going to play out. Eventually, the Supreme Court will say states can arrest these people as well, and they will be confined to red states within their own country.",Valuemeal3,2025-05-09T07:22:05,28
They can simply make up their own LEA.,rocc_high_racks,2025-05-09T07:44:48,3
Trump decides that.,TapTapTapTapTapTaps,2025-05-09T07:00:02,0
But then you get to a point where you have the Spider-Man pointing at Spider-Man meme,Memes_Haram,2025-05-09T09:46:01,1
Illegal orders cannot be followed. The Constitution matters.,Ging287,2025-05-09T14:51:39,1
The military is under the control of the president though,Memes_Haram,2025-05-09T08:22:35,1
"There is no mechanism to impose sanction of arrest. The greatest sanction is contempt of court. They have no power to arrest anyone.  The Supreme Court is a part of the judicial branch of the government,not the executive or law enforcement branch. The only people who can arrest the President and his cabinet is the FBI. When the head of the FBI is a Trump crony, that cannot happen. See 18 U.S.C. § 3052 which grants FBI agents the authority to make arrests for federal offenses.  Amazing how little Americans know about their country and their civics. No wonder your country is a mess.  Not surprising I guess.",Vanga_Aground,2025-05-09T19:24:34,1
"Very nice cut and paste. Perhaps you can explain to people who will do the arresting of the President and his cabinet?  Here's a quote to help you.  "" “The Supreme Court does not have law enforcement powers; it cannot arrest or detain individuals.” — United States Courts, Administrative Office of the U.S. Courts",Vanga_Aground,2025-05-09T22:14:11,1
ERM THREATENING VIOLENCE YOU'RE BANNED!  Never mind the people leaving me PMs saying they'll rape my cat to death and burn my fingers off when they invade Canada that Reddit won't enforce the rules against.,Mysterious-Job-469,2025-05-09T11:55:10,7
"The racial slurs they must scream in their homes at night over this guy. The amount of damage he is causing them, and he’s not even in our country",OldPiano6706,2025-05-09T14:19:39,5
Yeah I want this to be used as a defense in every court case out there.  If those who are supposed to oversee the system won't abide by it really sends the message that it should be free to be ignored.,UnquestionabIe,2025-05-09T07:37:16,55
It's already happening all across society. Running Red lights? Speeding? DUI's? All seem to becoming more common as all the poors realize there is no justice unless you fit a very specific demographic.,choate51,2025-05-09T07:15:41,53
"ICE coming to Court Rooms in particular to deport people showing up for legal proceedings is extremely dangerous because it means noncitizens are just going to ignore court summons, making them fugitives.  It also means noncitizen victims won’t press charges or try to get legal assistance if they are wronged.  At that point they have no reason to follow the law and nothing to lose. Denying migrants due process because they are ‘criminals’ is a self-fulfilling prophecy.",banned-from-rbooks,2025-05-09T09:37:31,4
Because they have a whole army of thugs ready to break down our doors and drag us into unmarked vans to ship us off to El Salvador,Jota769,2025-05-09T07:52:40,8
"Around us, it already is. People are running red lights constantly. There is zero traffic enforcement whatsoever on any of the highways around us and literally everyone is speeding 20+ over. There's this sense that nobody is going to do anything about it, so why not?",BGOOCHY,2025-05-09T08:10:41,2
The State has a monopoly on violence.,ThisIsNotRealityIsIt,2025-05-09T09:34:37,1
"For anyone not familiar with the idea: the social contract says that  the members of a society consent to be governed as long as the government takes care of its citizens.     I always thought that was behind Jefferson’s tree of liberty quote, which has been coming to mind more frequently.",notsurewhereireddit,2025-05-09T10:42:30,1
Congress or bondi can sue states rights.....States should have 2nd amendment companies for citizens requirements is my plan,Night_Raid96,2025-05-09T11:23:41,1
"After the Central Park 5 insanity, I literally can't imagine anyone thinking Trump ISN'T racist.",brickout,2025-05-09T10:20:22,4
Maybe I don’t know.  Either way I think amnesty is coming by Christmas or he’s at least paving the way for it by then.,slow_down_1984,2025-05-09T11:16:21,1
“I’m not here to talk about the past. I’d rather focus on the future”,Shanknuts,2025-05-09T07:39:09,16
"Yep, same here, although not very hopeful. Definitely making preparations if the crazies force it into something darker than that...",brickout,2025-05-09T10:39:48,2
"Oh, the first and second amendments now only protect loyalists. Pledge yourself to the All Powerful Leader and you're rewarded with those privileges.",digicow,2025-05-09T08:48:40,4
"Yes it absolutely does. You have absolutely no power to compel the government to do anything if you dont have control of any force to impose your will. Scotus can literally call for his arrest, but they have no force to put him in jail for contempt. He controls the police and the military. He'd literally have to go willingly.  This already happened with Andrew Jackson. He just sais 'fuck you' and continued what he was doing.",xicor,2025-05-09T09:07:07,3
"> The irony of your post is that people put more effort into protesting than to come out and vote.  The ones out there protesting also showed up to vote.   Way more people showed up to vote than have turned out to protest. So it was a cute little turn of phrase, it just has no bearing on reality. ",Donkletown,2025-05-09T08:54:40,4
Fact: 90% of your post history is bashing on white people. You have an agenda.,Amenian,2025-05-09T08:52:25,0
"Facilitating the invasion and subversion of the United States is 100% treason, and something the Judge handling this case is guilty of.",SnooDonuts5498,2025-05-09T09:11:39,-2
">If Bukele releases him and let's him come back, Trump would have to accept.  Would he? He has repeatedly said that it is not the case and so have all his lieutenants.   >We know that isn't going to happen.   Even if it did, guess what....he gets deported to another country, or maybe even back to El Salvador because the order of withholding is no longer valid.     We don't know what the outcome of his due process will be or what the courts will say. Your assessment that the order preventing him from being deported is no longer valid is not a valid legal analysis.   >Either way, Garcia is never going to live in the U.S. as a legal citizen.  No one can possibly know that until his case is resolved in court.",loki2002,2025-05-10T10:01:06,1
"I hate to say it because other posters are right also but I agree with you. The world needs to completely shut us out until this ends. The way our government is designed, we can’t really do anything once the regime is in place. The only option the citizens actually have would be an uprising, unfortunately the US has shown time and time again its willingness to use military force on normal citizens.  We want a revolution, but America is fucking huge and the military is the largest and second largest in the world. What the fuck are supposed to do?",Everyone_Suckz_here,2025-05-09T07:22:16,4
"Hard to sanction you harder than your orange King isn't already doing himself.  Sanctions have not nor ever will cause regime change in a large nation. You're going to have to deal with your dictator yourselves. If you can't,  that's not on 'the World' but on you.",Finwolven,2025-05-09T08:17:19,1
"Yes.  You can make fun all you want, that's nice.      Not sure if you live here or not, but there have been massive rallies and protests every week since the inauguration.        This is not funny.     The last thing the world needs is another, stronger, wealthier, more technologically prepared, Nazi Germany.",JoEdGus,2025-05-09T07:20:47,-1
Someone would have to extract him from the prison first.,Finwolven,2025-05-09T08:14:22,1
"I mean, trade is already fracturing because of tariffs. They aren't making deals. They are finding new trading partners.   But you're right. They aren't going to close embassies. Not yet. If they start shipping US Citizens not tied to any immigrant, like a political rival or something, off to a foreign prison/concentration camp. Or they declare martial law and stop elections, then other counties will take a much stronger stance against the US.  But honestly, they might not do that. The world has watched and pointed the finger at the oppression of North Korea for decades and done nothing. They probably won't do anything to the US other than isolate us, which honestly i think the current administration is perfectly fine with.",Kordiana,2025-05-09T07:36:28,2
So just say outright that you don't believe that Donald Trump has to follow the law then.,ME24601,2025-05-09T10:41:55,4
"Whew, you really went off on that creative writing exercise.",Jorycle,2025-05-09T11:38:09,5
"She also did not continue to appear in court for the remainder of the scheduled dates... And when asked explained the following...  After surviving domestic violence in a previous relationship, I acted out of caution after a disagreement with Kilmar by seeking a civil protective order in case things escalated,"" Vasquez said. ""Things did not escalate, and I decided not to follow through with the civil court process.  But yeah... Let's ignore her.",PaydayJones,2025-05-09T11:54:01,5
And they have the nerve to call Illinois corrupt because we throw our governors in jail when they break the law. Only difference is they are openly corrupt but don't punish their officials.,Sharobob,2025-05-09T08:15:23,166
My family is in brookings and they say the same thing,ashumisprime,2025-05-09T08:20:49,16
Yeah but you have to live in the worst possible place. No amount of money could make me live in that hell hole.,APhotoT,2025-05-09T10:27:12,6
Were they the ones that had that congressperson that killed a man while drunk driving or was that North Dakota?,brickne3,2025-05-09T18:40:00,1
r/usernamechecksout,JayMac1915,2025-05-09T13:15:12,1
"He sold/sells federally subsidized crop insurance which legally couldn't/can't cover hemp. If under the passed legislation farmers decided to change their operations to grow hemp they would have to get insured by other means, meaning the husband would lose the business of those farms that swapped to hemp.",thirtynation,2025-05-09T15:37:19,1
"The way you word it, makes it seem like the person you’re responding to - who seems to know what the problem is you’re referring to - asked for this. I’d guess that if they’re one of the ones who can correctly see what the problems are that come with shitty politicians, that they’re probably not one of the ones who voted these people in, and they’re just stuck with shitty representation. It’s more that the people there are being lied to by these reps. And it’s easier to lie to people and get away with misrepresenting them when you include decades of misinformation and gerrymandering. Not everyone in these shitty political states voted for the political situation they’re stuck in. There’s a lot of people who voted against the crap we’re getting. I think your statement oversimplifies the problem.",RttnAttorney,2025-05-09T12:04:34,2
The new and shinier Michelle Bachmann!,oldbastardbob,2025-05-09T12:29:51,5
Noem becomes *Nemo* so easily…,oliversurpless,2025-05-09T14:32:01,1
From a text I sent a friend back in November...  >Ever looked at those state rankings and wondered why all of the Red states under complete Republican control for decades always rank in the bottom third?  >We're about to see the entire country run the same way.,vandreulv,2025-05-09T10:36:15,6
video from a senate hearing about exactly what you said:  [https://www.murphy.senate.gov/newsroom/press-releases/murphy-to-secretary-of-homeland-security-kristi-noem-your-department-is-out-of-control](https://www.murphy.senate.gov/newsroom/press-releases/murphy-to-secretary-of-homeland-security-kristi-noem-your-department-is-out-of-control),scaredoftrumpwinning,2025-05-10T06:56:54,2
"They haven't passed an audit since they have been required to.  That's not on Congress.  Although I agree the continued funding is all on Congress. I guess if you're rewarded with more money by being incompetent or fraudulent, there is little incentive to improve.",go_outside,2025-05-09T10:28:48,2
"> How many democrats have defied the law compared to Trump and his goons?  You want a comprehensive list or you know, just the usual examples of Nancy Pelosi insider trading her way to 100m+ on a 150k year salary? Obama being the king of drone strike ( including american citizen), Hilary Clinton getting away with murder for decades and, you know, Biden blanket pardon to everyone in his family cause that's not suspicious at all.  >Biden issued pardons because he knew a vengeful criminal is about to assume the highest office in the US. Honestly, this is the bare minimum of what he should have done.   something something ""my tribe is OK your tribe is not OK"". Remember when dem literally turned misdemeanour into federal crime just to they could prosecute Trump in new york? like... Real estate crime in New York,  as if there's a single honest landlord in all of new york.",Free_Mission_9080,2025-05-09T10:55:56,-4
"So there is breaking the law and then really, really breaking the law? Not sure I follow. My point is that our government is corrupt. On both sides. Who’s more corrupt is irrelevant because being less corrupt is not ok.",Potential-Anything54,2025-05-09T19:33:53,1
[ Removed by Reddit ],BLiNKiN42,2025-05-09T07:05:57,23
Except the second. That’s original.,criscokkat,2025-05-10T00:01:20,1
"> If the people vote for him why not?   Because we are a nation of laws, that's why. The law isn't and shouldn't be what we feel like. It should reflect our highest ideals. Yes, the rich and powerful bend it, that's not a problem inherent to law. Voters, and voting systems can be, have been, and are actively being manipulated by outside forces, hostile to the interests of the United States. Presidential terms, have limits, they always have, it's why we have presidential elections every 4 years. After FDR won multiple terms, congress saw that could be problematic and acted. If we don't have limits, we have a ruler. Something the founders of the country understood well. If the other branches of the government fail to act in their appointed duty, we don't have a government, we have a dictator who does what they want on a whim. That leads to the collapse of nations. China will rush in to fill the power vacuum left by the US on the global stage, and there will be long term consequences from that upheaval of 80+ years of global stability and order. Democracies rarely go to war with one another, it's not so with other forms of government.  That's why you should care.",RbHs,2025-05-09T09:19:35,17
"Because some of us actually meant what we said when we took an oath.   Because, despite the best efforts of scumbag people, some of us won't shut up and sit down.  Because some of us believe so strongly in the Constitution that we haven't given up and we refuse to.  Besides, was it over when the Germans bombed Pearl Harbor?",ScoopaTroopa,2025-05-09T09:46:42,3
"This is the problem with the Overton Window slips too far to the right. There have been minimal policies that solve deeping problems in America. We are the world's richest country, and there has never been a country like us.  We only had two options in the 2024 election cycle: retain the status-quo or slide backward. When the options are fascism and fascism-lite , people are just going to choose fascism. Voter apathy led to the fall of the Weimer Republic. We're experiencing something similar.  Our Constitution was written by a bunch of rich people who believed that citizens were too ignorant to govern themselves. It's supposed to be a living, breathing document, but the Constitution hasn't been amended since 1992.   Powerful corporations have bought out our lives, just as they have done in the past. 60% of the country's wealth is in the hands of the top 10%. This is the biggest wealth inequality in US history.  What needs to happen is organization, movement, and education.",Juonmydog,2025-05-10T09:33:03,1
"No, they aren't symbolic.  You just didn't get the outcome you wanted.  Because there weren't enough votes.",i_am_a_real_boy__,2025-05-09T16:34:52,-4
Do you think that is realistic? Do you really think that is going to happen?,BGOOCHY,2025-05-09T09:32:20,8
And what marshall will run through secret services to arrest Trump? Who will enforce the judge order when the administration have the military on their side? What stop Trumps from issuing blanket pardon to everyone like Biden did?,Free_Mission_9080,2025-05-09T10:27:34,3
"And the government has a monopoly on violence. We certainly aren't ""allowed"" to use it.    https://en.m.wikipedia.org/wiki/Monopoly_on_violence",therapistofcats,2025-05-09T07:44:55,12
"Might makes right, and unfortunately that is why everything sucks. We're in the period where the bad guys are stronger than the good guys.",LordSiravant,2025-05-09T07:49:56,6
and every democrat to actually vote like democrats,arachnophilia,2025-05-09T07:28:23,22
