Comment,Author,Date,Score
" As a reminder, this subreddit [is for civil discussion.](/r/politics/wiki/index#wiki_be_civil)  In general, be courteous to others. Debate/discuss/argue the merits of ideas, don't attack people. Personal insults, shill or troll accusations, hate speech, any suggestion or support of harm, violence, or death, and other rule violations can result in a permanent ban.   If you see comments in violation of our rules, please report them.   For those who have questions regarding any media outlets being posted on this subreddit, please click [here](https://www.reddit.com/r/politics/wiki/approveddomainslist) to review our details as to our approved domains list and outlet criteria.    We are actively looking for new moderators.  If you have any interest in helping to make this subreddit a place for quality discussion, please fill out [this form](https://docs.google.com/forms/d/1y2swHD0KXFhStGFjW6k54r9iuMjzcFqDIVwuvdLBjSA).    ***   *I am a bot, and this action was performed automatically. Please [contact the moderators of this subreddit](/message/compose/?to=/r/politics) if you have any questions or concerns.*",AutoModerator,2025-05-09T05:13:51,1
Not surprising considering this is a woman who gleefully shoots puppies for acting like puppies.,zsreport,2025-05-09T05:14:12,3858
"So we're officially at a point where the Constitution's system of checks & balances has failed, right?",mattmcc80,2025-05-09T05:25:45,2274
What should be happening:   John Roberts has Noem/Rubio/Miller arrested and puts them in jail until Garcia (and every other illegally removed person) is returned. Then they are charged appropriately for their crimes.    What will happen: Nothing ,beeblebrox42,2025-05-09T06:07:10,1461
DHS Secretary admits guilty in human trafficking.,thistimelineisweird,2025-05-09T06:17:27,251
"Okay, Roberts.  Who are you deputizing to bring her in?  You either send someone to drag her out of her house and into prison or you give up on American representative democracy.  Which is it?",aradraugfea,2025-05-09T05:40:48,652
"""he's made us look utterly incompetent so we're super mad at him""",hurdurBoop,2025-05-09T05:15:04,201
"Well that's it for the legal system, everyone. We can ignore court rulings now.",30mil,2025-05-09T05:23:07,384
Neo nazi fucks,Hooper627,2025-05-09T06:05:06,127
"I wonder how history will view this situation, and how their actions reflect on the characters of the people in it. Was reading Robert Harris's historical novel about the Dreyfus scandal in France over 100 years ago - history has shown how ugly the racially-motivated actions of Dreyfus's persecutors were, and how inadequate the French military justice system at dealing with the case. In 50 or 100 years, what will history have to say about Ms Noem?",Hairy_rambutan,2025-05-09T05:41:19,41
"I can't wait to use this whataboutism with my dad. ""So what if Biden had said that there's no scenario that he doesn't forgive student loan debt even though the SCOTUS told him no?""",wolferman,2025-05-09T07:14:29,41
"They can’t let him come back. If he comes back, he talks. If he talks people will hopefully be absolutely enraged.",slaffytaffy,2025-05-09T06:57:51,29
Lock her up for refusing to comply with a judges order,thekillercook,2025-05-09T07:02:52,32
So we are knee deep into telling SCOTUS to go F themselves.  And this ugly hearted brunette is on board. I see no reason to feel “American” anymore. Nothing about this administration says “America”. It a different place and it’s going to catch up to us all very soon.,yorapissa,2025-05-09T06:04:43,64
I look forward to the hearings and listening to this administration explain themselves for breaking the law when they’re all out of power in 2028.,Luke_Cocksucker,2025-05-09T05:58:54,49
"So, she needs to be arrested for obstruction of justice and held in contempt. We need to sho these fools that they are not above the law. Use state police if the feds won’t do it.",Fomentor,2025-05-09T07:07:46,26
"So basically when Trump finishes his term he’s going to pardon every single person working for him in this government so that they cannot be prosecuted for ignoring SCOTUS rulings. The Constitution needs to be changed:  -1. Remove the President’s power to pardon and remove immunity from acts which undermine Congress or SCOTUS as they would contravene the oath taken by the President to uphold the Constitution.  -2. Make the US Marshals come under the authority of the SCOTUS to enforce its rulings, in effect it would have its own law enforcement agency that is independent of both the executive and legislative branches of government and takes precedence over the Justice Dept and the FBI.  -3. Remove emergency powers from the President that thereafter can only be granted through an act of Congress with a limited time frame as stipulated by the SCOTUS. If a clear and present danger exists to the United States in the form of an invading force or domestic upheaval with the aim of overthrowing the govt through such acts as terrorism the President can act accordingly as time is of the essence. However, to wage war on a foreign country Congress must give its consent or SCOTUS can grant an emergency reprieve as time allows with a view to seeking Congress consent asap. Failure to do so will automatically put the President on notice and be asked to rectify his stance if he refuses to follow protocol and could be removed from office by US Marshals.",Ok-Bar601,2025-05-09T07:26:07,24
I cannot wait until this criminal clown is indicted,Flippin_diabolical,2025-05-09T06:12:14,15
The supreme courts window for saving democracy is closing rapidly. They don't seem to mind. If this issue is not solved before Trump has complete control of the army the Supreme Court effectively has lost all power.,damnedfiddler,2025-05-09T07:00:01,15
Put her in jail.,kindredfan,2025-05-09T07:00:39,14
"The rule of law is dead. Fascism is here, and civil war will likely soon follow. We had a good run, but like all human ventures, we were ultimately doomed to self-destruction.",LordSiravant,2025-05-09T07:53:32,12
"Contempt of court.  Deputize Marshals.  Detain her until she agrees to abide by court orders.  Yes it will be a shitshow. That's far better than hand wringing, pearl clutching, and hoping somehow MAGA will act differently.  MAGA has decided to operate with brute force.  Wagging a finger and saying ""you better stop"" is not going to reign in a rogue Executive Branch.",oldbastardbob,2025-05-09T09:32:34,12
"I'm tired, boss...",clearly_cunning,2025-05-09T05:16:11,47
Noem and Bondi are in a race to the bottom for most fascist thing in the cabinet.,AdHopeful3801,2025-05-09T07:04:55,11
"if Noem ever had a dog in this fight, she shot it dead long ago.",Frognaros,2025-05-09T07:05:36,10
"Lock her up.  Make Trump pardon her for defying the Supreme Court.  This is complete bullshit, what she is doing is clearly illegal.",LLCoolJim_2020,2025-05-09T07:41:43,9
"So when the fuck does she get jailed for contempt? If this doesn't happen, it's the last thing standing between us and Trump having reign to openly operate death camps.",Officer_Hotpants,2025-05-09T08:00:32,8
"Don't worry, the 2A heroes will recognize this affront to the Constitution, surely a harbinger of tyranny, and bring their ARs to the capitol to....  What do you mean they agree with her?",llamapositif,2025-05-09T05:58:38,35
"So it's treason then. Ignoring the Constitution and the rule of law, no one in this administration could be considered less than a traitor at this point.  It's my hope that a number of lawyers have started compiling, in a legal sense, every treasonous act this administration engages in, gathering an much evidence as possible and getting prepared for a potential future where justice can be served. Every last cabinet member, every department head, and a massive number of lower officials are all guilty beyond a shadow of a doubt. There must come a reckoning.",Rusdino,2025-05-09T09:18:07,8
The way it should work now is that the US Marshals arrest the DHS Secretary thus enforcing the power of the Supreme Court of the United States.,AlliedR2,2025-05-09T19:57:38,8
Every day she looks more and more like a re-animated cadaver .,AlecMac2001,2025-05-09T06:00:03,13
So she’s blatantly ignoring and defying the Supreme Court? Lock her up what the fuck?,Everyone_Suckz_here,2025-05-09T07:18:51,7
Arrest them for contempt.,shadowdra126,2025-05-09T07:55:29,7
I’ll be damned if I am gonna let a puppy killer intimidate me  Fuck her.,shadowdra126,2025-05-09T07:56:01,5
If they don’t give a damn about the law… why should I?,reddithater212,2025-05-09T08:01:54,6
I hate that the narrative is on this ONE person when ALL are there illegally.,Crystaldaddy,2025-05-09T08:11:23,6
Deport her sorry plastic ass to the moon,butt_butter_baker,2025-05-09T08:41:46,6
"Put this bitch in a hole in Gitmo. Go back to court and ask Trump for another representative.   Goddamn, man. Red states better be shitting their pants. They’re going to end up like the Soviet Eastern Bloc states. Poor shitholes with no economy, no freedoms, and absolutely terrified of their government. ",ARazorbacks,2025-05-09T08:42:08,6
"It's not ""chilling"" for the balance of powers.  It's a demonstration that the US *has* no balance of powers, and has already become a dictatorship.",Retlifon,2025-05-09T08:43:54,6
Why is she allowed to live in our society?    That's not rhetorical.,Any_Leg_4773,2025-05-09T18:40:28,6
"They all need to come back, ALL OF THEM! And then due process",letuswatchtvinpeace,2025-05-09T19:38:24,5
"At this point, with how Kash Patel is running the FBI, I wonder who will be the first one wacked",latticegwop,2025-05-09T06:42:13,6
She seems to be not upholding her oath of office. Remove her.,biaggio,2025-05-09T08:09:50,5
Traitor against the Constitution,gjenkins01,2025-05-09T08:16:07,6
"An Innocent man is in jail because a political party wants him there.  That party claims it's is the representatives of Law and Order.  They just don't want you to know the actual laws, and they want to silence and neuter the judges and lawyers who do.  Why, so they can do it again, to anyone else they want to.   That's not America. That's Russia. Is that who you want to be?  Because 'letting it slide', 'it's just one guy"", means you do.",Pale-Berry-2599,2025-05-09T08:20:47,5
Why are they digging their heals in on this one? They even acknowledge he shouldn’t be there.,kummer5peck,2025-05-09T08:21:36,5
Jail her in contempt.,Striker40k,2025-05-09T08:29:05,5
Any dem running in 2028 on a 'lets move on and get back to normal' platform deserves to lose. I want these people in prison.,HelloIHaveNeckPain,2025-05-09T08:44:52,5
She's such an ugly human being.,diphenhydrapeen,2025-05-09T08:47:16,5
Like look at that face. There is no soul or life behind that slab of makeup,OlorinRidesAgain,2025-05-09T08:52:36,5
Cool throw her in jail for contempt. What are they waiting for?,miscellaneous-bs,2025-05-09T08:55:32,5
DHS Secretary and Former Dog Owner,gradi3nt,2025-05-09T08:57:09,5
Can we arrest this psycho already? No MAGA really gives a shit about her. We can start with her and move up from there.,DJPho3nix,2025-05-09T09:38:30,5
If Democrats ever take power again all of these people need to be thrown in jail.   No more let's come together bullshit. Every single person who lends aid to this administration should be prosecuted.,PeppermintMocha5,2025-05-09T10:17:40,5
"This is a damn joke. The Supreme Court gets ignored by government officials and nothing happens, no enforcement, no accountability. If any of us pulled this, we’d be in jail. The system protects its own and punishes the rest. This isn’t justice, it’s tyranny in a suit.",watchTheWorldBurn247,2025-05-09T10:18:07,4
"I can’t wait til she’s in prison without her hair extensions, spackle, eyelashes, Botox or camera.",ViolettaQueso,2025-05-09T18:08:57,5
Jail her,krispru1,2025-05-09T18:32:53,6
So we can add more descriptors to Trump: human trafficker and tyrant.,Zealousideal_Ask9760,2025-05-09T06:46:13,5
Federal marshals: Lock her up.,FinnMacFinneus,2025-05-09T06:52:52,3
Federal marshals: Lock her up.,FinnMacFinneus,2025-05-09T06:52:59,4
"Okay then, time to arrest these fascist fucks already. We're waiting, John...",FlickleMuhPickle,2025-05-09T07:11:01,4
Impeach her!  She took an oath.,wkomorow,2025-05-09T07:26:46,4
We are the supreme supreme court if they do not want to do their jobs we will.,LifeofRiley72,2025-05-09T07:44:48,4
"Tear it down folks, this government isn't working. Break it down and start over",MajinSkull,2025-05-09T07:46:15,4
"It’s time to cosplay maga, y’all. Maybe infiltrate from within. Resist in plain sight.",RevolutionaryCard512,2025-05-09T07:54:59,4
sounds to me like she's openly admitting to violating an order from the supreme court,Quirky_Cheetah_271,2025-05-09T07:59:40,4
The Supreme Court's authority is dead. Their rulings mean nothing.,Few-Line4715,2025-05-09T08:13:29,4
An innocent person was sent to a foreign concentration camp without any trial or due process.  Trump is a tyrant and a fascist just like Hitler.,The-M0untain,2025-05-09T08:38:23,5
Who is going to put this woman in jail? If the Democrats win in 2026 and Norm doesn't go to prison I'll never vote for them ever again.,im4peace,2025-05-09T08:39:06,4
"I know  “flouts” means a disregard, but it feels too soft of a word. This isn’t ignoring a request or purposefully not inviting someone.  This is a blatant declaration from the executive branch that the judicial branch will not be heeded.  Effectively, the judicial branch can agree with the executive or might as well be silent.  Thus: there is no check on the executive.  Thus, there is no judiciary.",FourWordComment,2025-05-09T08:50:41,4
Then SCOTUS need to go to the military or the Sgt at Arns for a bench warrant for these obvious indignant blatant contempt,jessizu,2025-05-09T08:52:32,3
Another reason people should avoid traveling to the US.  The World Cup next year will be awesome.,wickedweather,2025-05-09T09:08:12,5
Even more confirmation that the guy is already dead.,Common-Ad6470,2025-05-09T09:13:52,5
"Well, I won't feel bad when you're given a long jail sentence then.",Im_gumby_damnit,2025-05-09T09:16:22,4
"When will a judge grow a pair and actually hold Trump or his people in contempt?   Amazingly, we still have people in this very subreddit who don't believe that we've been taken over by fascists. They keep thinking we're going to have free and fair elections in 2026. As if fascists allow elections.    If even the redditors in this subreddit where we are constantly reminded of Trump's fascist outrages still don't get it, I can't imagine how the American public is ever going to figure it out.",Independent-Roof-774,2025-05-09T09:51:11,5
Arrest her.,tryingathing,2025-05-09T09:55:51,4
"Okay, so now we *ALL* get to ignore the law, guys.    Justice doesn't exist, it's war.",WhatEverYouSayBudd,2025-05-09T09:57:46,5
She needs to be found in contempt and frog marched to a jail cell.,OPMom21,2025-05-09T10:00:22,4
No scenario where history will look kindly on this fascist bitch,ShitStainWilly,2025-05-09T10:36:53,5
She doesn’t have immunity. Please let her be the one to be jailed for contempt. Please please please,cvanhim,2025-05-09T12:05:37,4
Sounds like contempt... For the courts,hopefulskeptik,2025-05-09T18:58:02,4
I can’t wait til a Dem is in power and we deport every person in this administration for their actions.,aterriblegamer,2025-05-09T20:41:53,3
"Remind me, how do you spell “contempt of court?”",RyanCdraws,2025-05-09T21:32:30,4
"SCOTUS has instructed you.  You listen.  You are stripped of your position, and you go to jail.",writingNICE,2025-05-09T22:17:21,3
"Hope you’re prepared to go to jail for Trump honey, cause he ain’t going to jail for you",Innacurate_Dentist,2025-05-09T23:26:28,5
Sounds like we should send her to prison.,bloodychill,2025-05-09T23:52:32,4
This is the same woman who can not step on 30% of her own state lands.   She is not welcome on any tribal lands.,Glad-Attempt5138,2025-05-10T00:28:09,4
"She's such a brilliant Homeland Security Chief, isn't she? /s   Just bring the man back and determine the facts and disposition of his case here, in our courts!    IDK why they have dug in their heels on this case, when there is so much indication that he should not have been deported to El Salvador, in addition to a court order stating that specifically.        She and Pam Bondi are not using logic here at all. Hopefully with public stances like this, both of them can be held accountable for contempt of court, sentenced and fired.",Newswatchtiki,2025-05-10T00:34:09,5
Are we sure she's aware what the supreme court is/does,Objective-Act-2093,2025-05-09T06:51:04,3
There probably isn't even a scenario where she's arrested and held in jail for contempt either.,PoundNaCL,2025-05-09T07:02:00,3
Wanna bet?,APirateAndAJedi,2025-05-09T07:06:31,3
Imagine being this heartless.,darkoh84,2025-05-09T07:35:53,3
These people are mental,vasta2,2025-05-09T07:47:18,3
SCOTUS has no power. The USA is cooked,Be-skeptical,2025-05-09T07:53:08,3
I can think of a few scenarios ,Nickbotv1,2025-05-09T07:54:48,3
"Well there is one scenario, but it ends up with the people rising up to send her and all these maga cronies to El Salvador.",Dry_Pressure_6704,2025-05-09T07:55:31,3
"Cool, no one cares what you think, the law is clear.",thischaosiskillingme,2025-05-09T08:02:06,3
Well I'm sure everyone suspected this was coming.  If there are no consequences except court orders they're just going to keep ignoring court orders.,TheDevilsAdvokaat,2025-05-09T08:09:50,3
Is there any scenario where they let him out of prison at least... considering he didn't break any laws or do anything to warrant being sent to a torture camp? Or are they so obsessed with trying to scare immigrants that they will happily torture innocent people?,mademeunlurk,2025-05-09T08:12:35,3
"This is telling truth of the sad state of our country.  This is the United States of America.  If an agency declares you a threat you will be removed. You won’t come back, it doesn’t matter your case, doesn’t matter the reason. If you are at the wrong place at the wrong time and labeled a threat you will be removed and won’t come back.  If you plan to protest and stand against this government… this administration… communicate to your loved ones that you love them. Hug them, embrace them, be still with them… if arrested you will never see them again. They will never see you again.  This is the United States of America.",Cruckel2687,2025-05-09T08:15:51,3
Lock her up!,IolausTelcontar,2025-05-09T08:23:04,3
These people are all lawless and in charge of our country.  We better hope that we can fight these people legally. That there are still enough good people in high places.,some_person_guy,2025-05-09T08:25:46,3
Lock her up,zippoguaillo,2025-05-09T08:30:14,3
SCOTUS should send court police to arrest her for contempt of scotus. Otherwise they are powerless.,ballrus_walsack,2025-05-09T08:39:39,3
The maga brand has made me hate these people more than I should for not knowing them but I still wish them the absolute worst,Distinct-Winner-6117,2025-05-09T09:45:25,3
"Whenever I see her snarling face, filled with contempt for goodness, and a hatred of all things kind, I wonder what it will look like on her last day, while she's begging for her life in a cage during her show trial?",generally_unsuitable,2025-05-09T10:11:47,3
No scenario where the puppy she killed comes back either.   Puppy killers and rapists run our country. So disgusted with anyone who voted for this.,UnhappyStay535,2025-05-09T10:15:47,3
What are the odds people in this administration end up in prison over this after Trump is gone?,natural_disaster0,2025-05-09T10:24:23,3
Why hasn't she been arrested for contempt?,RockyMtnOutpost,2025-05-09T10:32:38,3
"Can't any of the Supreme Justices issue an arrest warrant, bench warrant, or am I out of my league, here. Let Noam cool her high heels in a Anacostia slammer for a few hours until Trump pardons her, then reissue the warrant, rinse & repeat, until Trump declares martial law to deal with a radical fascist socialist wacko SCOTUS not doing whatever he wants, law be damned. Discuss...",Stellar_Stein,2025-05-09T10:32:55,3
Face lift puppy shooter says what,rafits,2025-05-09T11:08:32,3
Nuremberg trials for all these Nazis please,PropofolMargarita,2025-05-09T11:10:25,3
Start fucking arresting people.  Throw them into general population and maybe they'll start to take SCOTUS seriously.,Stillson,2025-05-09T11:58:46,3
"So now she's not only in contempt of court, she's in contempt of congress?  These people need life sentences.",ASYMT0TIC,2025-05-09T12:42:57,3
The media needs to really focus on this event.   Because it represents a moment where an administration is ignoring the laws of its own country.,Jorgen_Pakieto,2025-05-09T12:52:43,3
Why do they hate this man so much.,Anxious-Dig-5736,2025-05-09T14:34:20,3
"Lawless crooks and buffoons in government must be driven from office and never allowed to return. SCOTUS was very clear, ya fascist authoritarianism thugs who hate the US Constitution. You hate it so much move to Russia. Garbage ass evil people.",Ging287,2025-05-09T14:50:07,3
Do you want to be cited for contempt? Because that’s how you get cited for contempt.,Fun_Volume2150,2025-05-09T15:11:19,3
*keep her talking...*,newmoonchaperone,2025-05-09T15:12:06,3
History will prove that she is wrong and Abrego will come home and many others.,SkillFlaky,2025-05-10T05:56:49,3
"Cruel D'Ville enjoys making peoples lives miserable, it doesn't matter that it's unlawful. The people that could hold her accountable are just as cruel as she is.",RAMacDonald901,2025-05-09T05:46:04,6
That’s because this is a fascist shithole in which children have a shit future,thoptergifts,2025-05-09T06:51:13,7
"While my country has never been perfect it has made numerous attempts to take accountability and redress their mistakes ( Civil Liberties Act, Indian Claims Commission, funds to Veterans and Vietnam for Agent Orange).  My country no longer has any stomach or spine for personal accountability, fixing its mistakes and attempting to make amends. It’s not merely disappointing but genuinely sad and suggests nothing quite so much as our weakness.   We are now too weak to acknowledge our mistakes and work to repair those mistakes. There’s nothing strong about this.",_A_Monkey,2025-05-09T08:28:55,2
The very definition of a constitutional crisis.,blargblargityblarg,2025-05-09T09:00:30,2
"The constitution, SC and Congress mean nothing to this bunch of autocrats. We voted for this so we are to blame.",individualine,2025-05-09T09:03:41,2
She needs to concentrate on banging Corey Lewandowski and less on being a bitch,mishma2005,2025-05-09T09:04:07,2
Why are they not being thrown in jail??,CactusPrick4U,2025-05-09T09:06:34,2
Contemptible,Aretirednurse,2025-05-09T09:08:02,2
"Ffs, this isn’t the Bible!  you can’t just pick and choose which parts of the US constitution you’ll follow today",hammilithome,2025-05-09T09:08:13,2
"There is a scenario where he comes back. It’s called just go and pick him up. They won’t though, because it’ll look bad on the Administration that they admitted fault. It’s all optics to them.",Random_Man-child,2025-05-09T09:11:47,2
checks and balances.....where is it at?!,hawksdiesel,2025-05-09T09:14:53,2
"Can someone please explain to me, as a non-American, how the USA can't ban civilians owning assault weapons because that is protected under the second amendment of the constitution, which is the greatest document ever written and is sacrosanct!  But at the same time, the constitution also says that the government has to follow supreme court rulings, but the government can just ignore that part.  It is Schrodinger's Constitution. It is sacred and unviolatable, but at the same time, the government can violate it whenever they want.",Icehawk101,2025-05-09T09:28:26,2
If his lips are moving...,Tremulant21,2025-05-09T09:33:22,2
🖕🏻her,bapeach-,2025-05-09T09:34:31,2
Then put her in fucking jail.,Personal-Cable6616,2025-05-09T09:41:33,2
Lock her and the entire corrupt administration up!!!!,garion3535,2025-05-09T09:44:06,2
I for one would like to offer Noem in trade for Mr. Garcia.,57_Eucalyptusbreath,2025-05-09T09:56:30,2
This woman is a psychopath animal murderer,rottenavocadotoast,2025-05-09T10:21:44,2
Dog killer listens to and obeys her master putin's voice.,Groon_,2025-05-09T10:32:05,2
I can't wait until we turn this country around and she and trump get to join him.,ElSmokerOG,2025-05-09T10:35:01,2
Straight to jail for contempt.,galacticbackhoe,2025-05-09T11:12:44,2
"Oh, there’s a scenario, but this fucking piece of shit can’t comprehend it because she believes they hold absolute power.",BL0w1ToutY0A55,2025-05-09T11:30:42,2
She’ll be in prison soon- very soon I hope.,Adorable-Constant294,2025-05-09T12:10:33,2
"It’s some sort of sick point of pride to them that they have the power and control to keep him there, whether he should be or not. Win at all cost, they must. They have no respect for the legal system or the Constitution.",R_Lennox,2025-05-09T12:33:55,2
Arrest her,bakcha,2025-05-09T12:36:15,2
Sounds exactly like contempt of court.  I'm sure there's some kind of punishment for that.,rkicklig,2025-05-09T12:40:31,2
So fucking arrest her.  Oh wait you won't.,SemiAutoAvocado,2025-05-09T12:45:29,2
SCOTUS needs to issue an order of contempt pronto,getthatrich,2025-05-09T12:49:34,2
