Comment,Author,Date,ScoreI have a strong desire to watch her eat her words.,monkeyhind,2025-05-09T12:49:41,2
"This is like comically evil and sounds like dialogue they would write for the movie adaptation in 15 years where they really want to show who the bad guys are in the trailer, before they cut to whoever the young attractive actors playing Abrego Garcia and his lawyer will be.  Like this just feels like, assuming that justice wins out and we get through this hell of a administration, we're getting a hidden figures type movie and this lady is providing half the quotes for the trailer.",Dyde21,2025-05-09T12:55:53,2
"Why does the administration have such a hate boner for this guy? Or is it a case of ""we're never wrong and we must be obeyed?""",NeutralBias,2025-05-09T13:02:51,2
You know someone as callous as her probably hurt animals in her past.,Thor_Returns,2025-05-09T13:17:15,2
Issue a bench warrant.  Pretty clear cut when one party blantonly flouts a judges lawful ruling.  Anyone else would be in a cell.,TimeConcentrate0,2025-05-09T13:40:39,2
How is this NOT contempt of court?,BuckyRea1,2025-05-09T13:41:10,2
She has a lack of imagination then. I can imagine a few different scenarios in which he comes back.,sugarlessdeathbear,2025-05-09T14:04:14,2
The Constitution is for suckers.,MisterStorage,2025-05-09T14:19:12,2
Willingly destroying innocent lives for personal gain. If this isn't evil i'm not sure what is.,custardBust,2025-05-09T14:32:14,2
"I guess the Supreme Court has no authority.  She and Trump can just do whatever they want, and there is no one who can stop them.",dancefan2019,2025-05-09T16:20:36,2
DHS is going to run out of money with 2 months left in the year. Things will get really interesting then,reactor4,2025-05-09T16:27:54,2
Arrest her. Simple. Arrest her.,Wild_Alternative_138,2025-05-09T17:40:39,2
I propose a hypothetical scenario: He is a legal resident. He has no crime proven.  How can they formally justify imprisoning a person in a foreign country in such a scenario?,sum_force,2025-05-09T20:09:17,2
Maybe the judge should hold her in contempt and put her in jail until he is back.,Raspberries-Are-Evil,2025-05-09T08:17:55,4
Well let’s toss her in jail for contempt and see what happens next. She can come out when he returns or she can sit and stew and contemplate her choices in life that led her there.,LazloHollifeld,2025-05-09T08:20:50,2
The majority of White people who voted wanted this to happen.,Fickle-Molasses-903,2025-05-09T08:40:02,4
"There's the scenario where he testifies at your treason trial in 4 years, bitch.",DominoAxelrod,2025-05-09T06:42:32,2
YALL the reason why in no scenario does he come back is because he is dead. There were satellite photos of the site where he was held and that site has a lot of concrete in which one area of the detention area is stained red and it's noticeable via satellite. Pretty good chance he has been executed that's why there is nothing happening.,zmunky,2025-05-09T18:07:16,2
Arrest them!,LifeofRiley72,2025-05-09T06:36:51,1
"That’s ok. She’s now on record.   When cholesterol hopefully does its job soon, and/or integrity comes back to the US government, add Noem to the list of people who will be thrown in jail.   It might take a while, but all of these fucking idiots on various forms of permanent media admitting they are breaking the law will have their reckoning.",DoomdUser,2025-05-09T07:05:57,1
So at a minimum we’re going to stop paying to have him incarcerated in CECOT?,Jurango34,2025-05-09T07:20:37,1
The current occupant better start writing those pardons now. It’s going to take a long time to fill out that many of them.,ToLiveInIt,2025-05-09T07:24:43,1
Your honor the plaintiff would like to submit into evidence candidate one for contempt charges and imprisonment,dlaymo,2025-05-09T07:31:22,1
Where are the courts,Readgooder,2025-05-09T07:33:19,1
We have long memories,sunbeatsfog,2025-05-09T07:34:17,1
She is treasonous.,eiseleyfan,2025-05-09T07:36:44,1
Start putting these fucks in jail. They're going to keep calling bluff until someone stops fucking bluffing.,Aern,2025-05-09T07:39:39,1
Start holding people in contemp of court.....,wigglied,2025-05-09T07:43:39,1
Lock. Her. Up.,BigTribs914,2025-05-09T07:45:29,1
DHS secretary is in contempt of court .,SayVandalay,2025-05-09T07:54:15,1
So what does the Constitution say should happen when the president and his cabinet ignore a court order?,LostmydadtoCOVID,2025-05-09T07:54:26,1
The intention is to move forward without due process while castrating the judicial branch. Congrats Supreme Court! You’ve unified power in the worst possible person for the country!,Mean-Cheesecake-2635,2025-05-09T07:59:02,1
It’s time to start holding cabinet members in contempt.,Smart-Effective7533,2025-05-09T08:13:52,1
Scrotus,OzzieGrey,2025-05-09T08:16:04,1
"Well, you know, the Supreme Court is allowing this to happen by doing nothing. Hold her and everyone else at DHS in contempt, deputize everyone with a pulse and haul all of their asses off to prison.",OutlawGalaxyBill,2025-05-09T08:17:12,1
Sooo what you're saying is 2A now for anyone not in a uniform and marked car. Got it.,happymomma40,2025-05-09T08:18:11,1
It’s treason then.,DocAk88,2025-05-09T08:21:15,1
How about if we jail her for contempt ? She is she changes her mind.,Velocoraptor369,2025-05-09T08:27:17,1
Free Abrego,hobopopa,2025-05-09T08:27:33,1
"I can think of a scenario, but it involves ousting these vile pieces of shit from the current administration.",Professional-Box4153,2025-05-09T08:42:00,1
Patience,Many_Trifle7780,2025-05-09T08:50:53,1
Oh I can imagine several scenarios.... All of which begin with this Karen Prime specimen being fired,OlorinRidesAgain,2025-05-09T08:51:50,1
Then SCOTUS need to go to the military or the Sgt at Arns for a bench warrant for these obvious indignant blatant contempt,jessizu,2025-05-09T08:55:19,1
[deleted],[deleted],2025-05-09T09:00:49,1
Over her botox infected body,kafkadre,2025-05-09T09:05:16,1
This is gross,wickedweather,2025-05-09T09:06:46,1
She is so disgusting!!,anitrump,2025-05-09T09:29:50,1
sure be a shame if her ass was sent to CECOT,Apocalypso777,2025-05-09T09:36:50,1
"I hope if we get a fair election next go around that they go after every single one of these assholes. Maybe leave that El Salvador prison in place and stick them all there, that would be the start of justice.",floog,2025-05-09T09:38:26,1
Then put her in jail.,AmbivalentFanatic,2025-05-09T09:40:41,1
They are pure evil,TheBackSpin,2025-05-09T10:15:43,1
"If there was a poster child for stupid, Noem's face would be on it...    I look forward to her imprisonment in a few years. Can you imagine the Before and After pics of that?",APhotoT,2025-05-09T10:26:07,1
Noem is an ugly facist nazi. I hold she gets hold in Contempt.,MarqSleep,2025-05-09T10:46:41,1
More lawsuits need to be filed,Kind-City-2173,2025-05-09T10:53:13,1
Arrest her,fluidgirlari,2025-05-09T10:57:56,1
This is  like Jim Cramer picking stocks. He's totally coming back,matastas,2025-05-09T11:12:05,1
"That seems like as about as clear a brazen defiance of a court order can get.  So....  Contempt hearings, when?",BattleFries86,2025-05-09T11:54:45,1
Have we gotten any confirmation that he's still alive?,dzocod,2025-05-09T12:00:48,1
Hopefully some day we can say the same about you.,Junior-Addendum88,2025-05-09T13:01:54,1
How is this NOT contempt of court?,BuckyRea1,2025-05-09T13:40:50,1
The nerve of these idiots,SoundSageWisdom,2025-05-09T15:09:40,1
Who cares about SCOTUS?,Alwaystired254,2025-05-09T15:35:22,1
Dog killer ,FraGZombie,2025-05-09T15:57:20,1
Just like her puppy..?,williamgman,2025-05-09T17:46:01,1
"The only way America heals, is if all these bigots serve time in jail for years.",SocialPunk03,2025-05-09T17:46:34,1
Why? Why are they making such a big deal out of this? Just bring the dude back for fucks sake. This is such reprehensible and childish pettiness beyond anything I've ever seen,Enginemancer,2025-05-09T17:48:12,1
And when democrats win back the government they will preach decorum and bend over to every republican demand and court order.   Cat is out of the bag.,Jumba2009sa,2025-05-09T06:48:21,-2
Why do they care so much about this one guy?,JazzRider,2025-05-09T07:26:09,1
"TOW still in effect = Deported to another country other than El Salvador   TOW not in effect = Deported to El Salvador  She is correct, he was ordered deported twice, the TOW decides where.   No scenario exists where he comes back and lives in the U.S.     SCOTUS ordered Trump to remove all obstacles, he has.   If he has a plane waiting on Garcia to come back and Bukele says ""No""...end of story.  The judges who say ""go get him and bring him back"" have no authority in foreign affairs.   SCOTUS can't interfere with foreign affairs either.   It's a foreign affairs issue at this point.",Todd1225,2025-05-09T09:21:49,-7
Lots of haters here! Criminals before Americans! The New Democrats Motto!!,idontcare69FU,2025-05-09T13:35:25,-4
"You know... we're all complaining about this as a country, but where the hell are our allies?     Why haven't we seen literally ANY other country do something about this?   We constantly try to bring about change through humanitarian action around the world.  When is it going to be our turn?     It feels like, despite giving so much to our allies, we're getting nothing in return because... Tariffs?",JoEdGus,2025-05-09T06:41:27,-13
Thank you Secretary Nielsen for putting this treasonous and unpatriotic judge in his place!,SnooDonuts5498,2025-05-09T07:43:29,-8
His wife can breathe easy now knowing she’s free from her abuser,KenseiShadow,2025-05-09T10:40:36,-15
And fucking over her entire state over and over again.,Southdakotan,2025-05-09T06:27:13,996
"Kash Patel, when asked if he understands that his actions break the law, just sitting there and saying, essentially, “whatever, bite me” is another recent example of Trump goons having zero respect for US laws.   So I ask again, when can everyone stop respecting US laws? They are so inconvenient, if Kash and whatever her name is, Kristi, I think, can just ignore the law, when can everyone?",coconutpiecrust,2025-05-09T07:08:00,331
"That’s not even the problem. The problem is she writes about gleefully shooting puppies, to advance her political career, *and it works*.",dizekat,2025-05-09T07:45:02,46
"They have ads on Hulu with her in her best Border Barbie costume talking to people telling them to GTFO. I was aghast, less so that they did something so awful like paying to produce and run an ad that looks like a tourism video for Opposite Land (that’s just par for the course at this freak  show), but that Hulu took that money.   We’re canceling our subscription",EchoAquarium,2025-05-09T08:15:20,38
They're going to broadcast Kristi Noem shooting John Roberts in a gravel pit on Pay-Per-View,doctor_lobo,2025-05-09T08:05:45,15
I can't believe it actually worked. Putting the dog story actually got her a position in trump's admin,Kaiisim,2025-05-09T08:19:43,17
"She needs to be held in contempt, then. She doesn't have immunity.",FinancialArmadillo93,2025-05-09T08:31:22,13
"She murdered her dog because she couldn’t be arsed to train it. And then bragged about it on TV, as an audition for the Trump inner circle.  That lady is a psycho, and Trump loves it. I repeat: He put her in charge of immigration because he liked how she murdered her dog.",flickh,2025-05-09T10:52:42,13
And a goat who looked at her funny after she shot the dog,PassThePeachSchnapps,2025-05-09T07:14:15,17
And then publishes a book she recalled the story in.,Acceptable-Bus-2017,2025-05-09T07:19:21,5
"Does she have a LAW DEGREE?   Did she study any Constitutional Law?   Or, is she another DEI hire?",LakeSun,2025-05-09T11:40:45,2
"I have a dumb question. Can a future Democratic President just arrest all these Trump appointees for violating Supreme Court without giving them due process and ship them to El Salvador or Libya even if all republicans cry crime ?  Do these folks then worry about it at all? Because they are recording all this right. And with a country that is split in the middle, odds are at some point Democrats will again.   And these folks will still be around then too perhaps as civilians.forgot to add even if his Trumpness pardon them. I mean they are defying the courts. So what’s stopping a Democratic President from jailing them.",Safe_Psychology_326,2025-05-09T15:02:49,2
"Well it wasn't a puppy at that point, right? Wasn't it like 18 months?  Regardless, you don't shoot a dog in a gravel pit. It sounds like she was just a shit trainer. Plenty of other people would be happy to re-home that dog. If the dog isn't dangerous, there's no need to destroy it.",PoliteIndecency,2025-05-09T07:26:12,4
"I am not a conservative or a republican but I want to call you out for the petty talking point about Noem. Obviously, Noem was thoughtful in her explanation in her book about why she had to put down her 14-month old dog; the dog was killing the neighbor's chickens. Dogs who attack and kill livestock can and should be put down. It's actually expressly lawful in my state in Iowa Code Section 351.27. It's legal in South Dakota too.   Generally, the culture of my state is strongly in favor to put down animals who are aggressive towards people, livestock, or wildlife. I have a dog. I treat her like my family. But if she were to start killing my neighbors livestock, and I live on an acreage next to people with livestock, I would have to do the responsible thing to my neighbor because my neighbor is lawfully capable of doing that too. The neighbor could but might not hold me liable for damages if I do the right thing so they don't have to. I can pay $300 to let the vet do it or I can use a couple bucks worth of bullets I already have. I actually think Noem did the right thing, even if it is convenient to label her a puppy killer.",VeryPogi,2025-05-09T09:15:19,-9
"As a cat person, I actually don’t mind her as much now  Edit: my internet points :/ guys stahp",Unoriginal-,2025-05-09T07:00:20,-155
"The “Constitutionalists” have shredded the Constitution.   Of course most of us saw it coming, and somehow we still failed to stop it because the rich sane-washed them all in exchange for profits.",RIPCurrants,2025-05-09T07:09:37,808
It failed when Republicans didn’t convict Trump in the Senate during both impeachments. Seriously. I’m not sure why people don’t see those behaviors as utter failures of checks and balances for blatantly impeachable offenses. Jan 6 was the executive branch violently attacking the legislative branch through an intermediary (cult like Trump supporters),False-Bee-4373,2025-05-09T07:34:54,252
Xinis needs to issue a bench warrant for Noem and Bondi and let them try to make that argument in court in person.,bruoch,2025-05-09T07:19:09,110
"depends if SCOTUS does anything about this. if people see jail time, then we have hope. if people get a wag of a finger and strongly worded letter, we're fucked.",Rombledore,2025-05-09T07:19:59,54
"Yes. We were already there, but I suppose a lot of people would debate at what point the ""officially"" part came in.  Supreme Court made a ruling. Executive branch is defying that ruling. Congress is nowhere to be seen.   America is dead.",pierre_x10,2025-05-09T07:37:22,41
They barely worked in the first place.,TheeHughMan,2025-05-09T05:31:32,157
Yes. We’re past that point.,ol_dirty_applesauce,2025-05-09T06:40:02,27
"The Constitution relied on everyone working in good faith.  All it took was one man to say ""make me"" for it all to come crumbling down.",Meecht,2025-05-09T08:32:56,10
A scenario would be that she gets locked up until he comes back.,RioRancher,2025-05-09T07:48:36,6
We have been there for a while my man.,zatchstar,2025-05-09T08:04:07,4
Yes.,doctor_lobo,2025-05-09T08:06:23,4
Yes.,SmartWonderWoman,2025-05-09T08:17:06,4
But we’ll still have to respect every pardon and decree he makes despite the constitution not being in effect anymore,screech_owl_kachina,2025-05-09T08:29:00,4
"When the response is ""*I don't know...*"" to whether one has the responsibility to uphold the Constitution as a president, I think the answer is pretty obvious.",bigtice,2025-05-09T09:29:30,3
9 - 0 The Supreme Court so rarely agrees on anything.,blackout__drunk,2025-05-09T08:53:48,2
We are at the point where republicans have declared war (by repeated attacks) on constitutional law.,Dgnash615-2,2025-05-09T08:46:50,1
We passed that back in January.,My-1st-porn-account,2025-05-09T09:34:49,1
"correct.       It is now (has been for a bit really, but its incontrovertible now) apparent that the GoP has no interest in following the constitution, and Trump has an actual and not just theoretical position of dictatorial power.",BrainofBorg,2025-05-09T10:06:40,1
The system of checks and balances failed during trumps first term when it became obvious the one thing it couldn’t deal with was a president simply saying “no”.,coconutpete52,2025-05-09T10:28:59,1
"Without enforcement, it’s just a piece of paper.",smitty4728,2025-05-09T11:16:14,1
"Well, yes and one step further;    Literally no one cares. We are off the rails.",still_salty_22,2025-05-09T12:28:25,1
"Have been, and considering nothing is going to be done, the new precedent is that the scotus can be ignored if you want. Why should any future president listen to them?",blackmobius,2025-05-09T13:31:21,1
SCOTUS just eating shit… John Roberts is a fucking joke.,Msdamgoode,2025-05-09T16:50:08,1
"Sure, I know what the konstitushun is. Some guys wrote a buncha words in 17-something saying I can have as many guns as I want. See?",Wenzdayzmom,2025-05-09T21:01:12,1
Nearly. It’s still running through the courts.  Courts move very slowly.  :(,upsidedown-funnel,2025-05-09T21:35:44,1
Bet Biden regrets not doing something about Trump by now.,ArmyOfDix,2025-05-09T08:38:56,1
"Yep. The right wing has taken over the scotus and they seem ok giving up their checks and balances to a right wing executive branch. Republican have the green light to do whatever they want until a scotus reform happens, which will not ever happen",mostdope28,2025-05-09T09:35:38,0
Issue is Pam bondi has already said the U.S. Marshalls won’t arrest maga members,Memes_Haram,2025-05-09T06:43:55,390
SCOTUS and the courts can’t charge someone with a crime. The justice department would have to; and that’s been captured by the MAGAts.  They can jail them for contempt though. And I’m all for that.,Anonymouse-C0ward,2025-05-09T08:01:41,44
Disbar the lawyers. That’s how you get them to listen and how you warn future lawyers not to fuck around.,iStayedAtaHolidayInn,2025-05-09T08:38:39,7
"This is fucking insane. They admit they've wrongly deported the dude, but just refuse to rectify their error.",YakiVegas,2025-05-09T15:27:44,2
Congress had already voted those people,Night_Raid96,2025-05-09T11:17:22,1
Always listen to congress power and actions for administration branch and they can do whatever they want,Night_Raid96,2025-05-09T11:19:43,1
That is not what should be happening.  The case is currently before the lower court.  Not John Roberts.,i_am_a_real_boy__,2025-05-09T11:55:05,1
"Everyone involved quietly decided to just give up on oaths, rule of law, the republic...",still_salty_22,2025-05-09T12:30:51,1
"Should be an automatic impeachment, requiring 2/3 majority to reverse. That will scare the accountability back into these traitors!",theEndIsNigh_2025,2025-05-09T13:43:44,1
💯💯 What are the chances all of this is documented and these MAGA fucks have their comeuppance when a new administration is put in place?,fistswityat0es,2025-05-09T08:10:45,0
"Well yeah, but with what army? John Roberts controls some court security at best.",The_DanceCommander,2025-05-09T11:01:59,0
[removed],[deleted],2025-05-09T07:33:23,-11
Tbf her boss did learn from the best.,A012A012,2025-05-09T07:07:20,31
"Unfortunately, Roberts is a useless whiner, so we know which one it is.",MaASInsomnia,2025-05-09T06:37:28,180
"The ONLY thing this man is about for this administration is sending a message. They are so obsessed with seeming powerful, and this “case” has blown up so much, they will stop at nothing to keep him gone. It’s not about this one man, they don’t give a shit. He’s just a person.",OldPiano6706,2025-05-09T08:30:32,24
WE can't...,Angedelanuit97,2025-05-09T05:25:55,329
Pam bondi is the new scotus and we have to listen her.....,Night_Raid96,2025-05-09T11:21:24,1
shes so ghoulish. i wonder if they believe their own bs,Tazx20,2025-05-09T08:29:42,14
We can drop the neo part,Top_String5181,2025-05-09T10:54:32,2
Don’t need to go back to Dreyfus. 85ish years back is enough…Nuremberg is calling!,StrictNewspaper6674,2025-05-09T06:35:08,26
History will forget about this we’re six months away from Trump declaring blanket amnesty.  He’ll make some claim that he “deported all the criminals” anyone left is free to become a citizen. He’s not a classic racist he believes most people regardless of race are below him he just wants to look tough.,slow_down_1984,2025-05-09T07:24:27,6
All depends on who comes after. Usually these people are followed by much worse.,TheRegardedOne420,2025-05-09T08:48:21,1
"He won’t care. No one who supports Trump cares about the hypocrisy. You’ll just get some mealy mouthed version of “Extremism in defense of liberty is no vice. Moderation in pursuit of justice is no virtue.” Biden was evil, but Trump *must* defy the constitution to root out the deep state rogues and blah blah blah. It’s a cult. You can’t rely on logic.",codyashi_maru,2025-05-09T09:09:54,31
"They'll just threaten to cave their own eyes out by furrowing their eyebrow and go ""I don't care, get trigger lib"" while literally trembling with anger.  Ask me how I know.",Mysterious-Job-469,2025-05-09T11:56:55,3
"They don't frame it as legal vs illegal.   The Republicans are the Good Guys with the White hats and there is literally no action they could take that would rob them of that immutable Goodness.  Democrats are the Bad Guys, the Black hats, and any good they appear to be doing is just some complicated form of Evil that isn't immediately self evident, but if you wait long enough the media echo chamber will provide you with that explanation.",Ok-Potato-95,2025-05-09T17:57:27,2
Very optimistic.,MrCannabeans,2025-05-09T06:26:53,45
Absolutely no chance any of these shitstains ever face justice. Nixon never did. Reagan never did. Bush never did. Why would we start now?,Chaotic-Catastrophe,2025-05-09T07:47:38,11
I wish I had anything close to your level of hope.,brickout,2025-05-09T10:20:45,2
"US has succumbed to dictatorship.  If you still don't see it, then you are blind.  There are now laws to top section.",Groomsi,2025-05-09T07:52:35,1
"Nope, just a strongly worded letter.",boltsnuts,2025-05-09T09:20:36,1
LMAO. That’s cute.,SniperPilot,2025-05-10T13:29:48,1
Great ideas but only if lifetime SCOTUS apointments are changed to 18 years too!,PopIntelligent9515,2025-05-09T12:24:05,2
"Haha good plan! Now let’s just go change the constitution, good luck with that",tarfu7,2025-05-09T08:58:01,1
Already closed,espinaustin,2025-05-09T08:41:40,4
I think we all feel like John Coffey right about now.,nerdingout78,2025-05-09T06:41:18,16
"Don't you know, the Constitution only has the first and second amendment now. They threw out the rest of it",MoodInternational481,2025-05-09T07:42:35,4
And those fake eyelashes look ridiculous.,dancefan2019,2025-05-09T16:56:44,1
Because it normalizes them just ignoring the Supreme Court going forward.,aflyingsquanch,2025-05-09T08:23:37,9
Scotus has no real power because the military is controlled by the executive branch. This won't be the first time a president ignored their ruling.,xicor,2025-05-09T08:58:22,3
I laughed a little too hard at this,Specialist-Garbage94,2025-05-09T08:57:51,2
They won't be.,Switch_Empty,2025-05-09T13:05:11,1
"rapist, sadist, evil moron, antithesis to everything decent in humanity...",duzies,2025-05-09T07:26:42,3
"Or charge and convict them, and send them to Alcatraz.    They all can earn prison points by renovating it themselves for which we will provide them hand tools.",Newswatchtiki,2025-05-10T00:40:12,3
I know its not even her decision to make.,darkenthedoorway,2025-05-09T11:12:06,2
"Odds are we end up in prison on nonsense charges if this administration isn't out in a month or less.  I mean, it's only may. And look at what's happened. The constitution is more or less unofficially suspended.",Racecarlock,2025-05-09T10:33:54,1
And shooting her dogs and goats..,TraditionalCopy6981,2025-05-09T09:22:51,2
A criminal was voted into the top law enforcement job. Thats the short version.,darkenthedoorway,2025-05-09T11:03:54,2
"The Constitution has remained sacred and inviolable because until now we had never elected anyone who didn’t respect it, or the rule of law. The problem is Donnie Two Dolls and the Complicit Taintlickers.",sweetcherrytea,2025-05-09T11:05:16,1
"Uh, you know about the dog, right?",roman-de-fauvel,2025-05-09T14:42:42,2
"True, Trump has immunity so he can what he wants. She doesn't have immunity. Although he will pardon anyone charged I am sure.  But how do we get the Justice Department to charge when the Attorney General should also be charged with similar crimes?",Newswatchtiki,2025-05-10T00:59:38,1
Make the department move into some Army tents or old Quonset huts on the Mall since they are running out of money. Why are we paying for this kind of agency functioning?,Newswatchtiki,2025-05-10T00:56:14,1
