Comment,Author,Date,Score"For sure. The Cross is a terrible-reminder turned symbol-of-hope; at least that what it's supposed to mean. So, when someone who claims to believe in it hurts or misguides another (especially in such a depraved way), not only are they hurting that first person, they are leading themselves away from it as well. It doesn't change the meaning of the Cross itself, but now their wrongdoing is associated with it in the mind of that first person.       I'm not here to try and change your mind, but if it helps, know that ""sin"", as an action, just means ""to miss the mark"". It's an old archery term, and that's how it's meant to be used in relation to Christianity.       That ""missing the mark"" is going to look different for different people; most are accidental, too many are deliberate. But all of them fall short of the correct target. That's all.       Anyway, take care!",Multipurpose_Bagel,2025-05-07T17:18:13,2
"I am also a person who thinks that Catholic employers should be forced to provide reproductive healthcare against their religious beliefs, I’m not arguing that they shouldn’t be legislated. But that is how many religious Catholics see it",Fearless-Sorbet5546,2025-05-06T11:49:22,0
"All the next Pope needs to say is, ""All abuse reported to any church official, in any setting, must immediately be reported to local law enforcement officials. Any person, whether they are a member of the church or not, who does not report abuses reported to them or made known to them shall never enter the Kingdom of Heaven.""",Bhockzer,2025-05-06T08:53:14,5
how old are you?,whatsupeveryone34,2025-05-07T14:19:57,3
"We're glossing over the fact that 99.999% of people going to confession are doing so to confess small habitual sins, not abuse. And, of the abusers out there, only that small fraction are Catholic anyway. Setting that aside...      The lawmakers and those who are strictly anti-Catholic know what's going on. They don't care about Catholics or their beliefs (they probably don't care about anyone's beliefs, but that's secondary). They do not care to bother learning what the Catholic Church teaches about abusing or hurting children.       Some would rather remain ignorant and pretend that ""Catholic and pedo are synonymous"" instead of learning that Catholicism is about putting the ban on evil (meaning stamping evil out of society, violently if necessary), but they simply have failed to live up to that for a long time.    Also, they KNOW that most priests will stay true to their vocation, and should any hear of abuse, they'll advise this person to do the only right thing they can and talk to someone about it, but, they cannot compel them. If someone finds out and arrests that priest (how would they find out), then that's another priest out of the way behind bars.  For most people, it \*is\* about children's safety, but given how pro-abortion our culture is, I'm not convinced children's safety is at the top of everyone's list of priorities. It's plausible that some see this as a hopeful way to simply have less priests overall, but you won't hear them spell it out like that. The children come second.",Multipurpose_Bagel,2025-05-07T16:55:26,0
Fortunately the number of practicing and professing Catholics is ever falling.,flypirat,2025-05-06T12:14:06,1
"Good idea, pity no one is going to have the guts to.",RavensQueen502,2025-05-06T08:54:42,1
You should be asking yourself that,Cats_are_evil543,2025-05-07T14:35:11,0
"Dumbest take I've seen in this thread.   Their actions speak volumes. People are listening and watching and walking away. The churches are causing this.   Also what a fantastic way to whitewash the atrocities committed by the Catholic Church  🙌  ""With or without religion, good people can behave well and bad people can do evil; but for good people to do evil - that takes religion.""",oh-ya-its-me,2025-05-07T17:01:07,1
"I only ask because I looked at your early post history and a few years back it seems you were creeping on a 14 year old girl in there (deleting old posts only does so much)... so either your around 18, which means you don't know dick about dick, or you're older and this topic upsets you because it literally affects you directly.",whatsupeveryone34,2025-05-07T14:49:22,2
"I actually resisted saying your comment was the most ignorant take earlier. Whoops lol      ""Nowhere in the law is there any requirement to break any tenants of a religion. That would be an absurd violation.""   If it were to go through and priests must break the Seal of confession, that's what would be happening. I get why - it's the safety of children in question. Again, I just don't see the reasoning as completely altruistic like that, because not everyone in our society cares about the well-being of children.       You yourself have demonstrated what I'm talking about.       ""The regime is on the forefront of breaking down freedom of religion and separation of Church and state. Keep your religion out of our government.""  It's primarily about the government for you, not the safety of kids.       As you said, we don't burn heretics anymore, remember? Not that we should, but you think there'd be as much of a worry about ""repeat offenders"" if that were on the table?  Lol, please. The Church will be here long after you and I (after having lived hopefully long and healthy lives) have both died. Speaking of dying, I hope Weinberg is resting in peace. He was wrong though. If you can determine what is good or bad, and act accordingly without religion, then you don't need religion for a good person to turn and commit a bad action.   Anyway, that's enough reddit for one day. Cheers.",Multipurpose_Bagel,2025-05-07T17:50:13,1
"I’m 17, which honestly for you looks quite bad, firstly you give up argumentation and resort to ad hominem. I was quite respectful but you childishly cannot take criticism.",Cats_are_evil543,2025-05-07T15:48:41,0
"As one of the people that was able to give input to those in crafting the bill to make sure that it covered smaller religions, including the Jehovah's Witnesses and Mormons to make sure it covers the way they sweep child sexual abuse under the rug all using the same privileges the Catholic Church demands... 🖕!!   Get your head out of one narrative and do some goddamn research about this issue outside of the Catholic church. Coming at me with caring about repeat offenders and not caring about children🖕.  At least I'm not part of any organized religion that continually demonstrates they care Fuck all about children. Anyone who continues to support them is culpable. Enjoy your pedo haven.",oh-ya-its-me,2025-05-07T18:13:54,1
