Comment,Author,Date,ScoreWho cares? Reporting child abuse is more important than following traditional customs.  This law literally came about because Jehovahs Witness church covered up abuse of children. Several of the abused testified that church leaders ignored the information. This isnt a hypothetical harm that the state is trying to correct its a harm that actually happened.,devnullopinions,2025-05-06T23:17:27,0
Wanna know whats also a violation of church and state? Molesting children,asevans1717,2025-05-06T08:35:48,23
"Wonderful doublespeak here to claim that separation of church and state means Catholic pedophiles should be given *exemptions* to a law that binds everyone else, the very definition of showing preference. Maybe they should just stop protecting their fellow child rapists.",H2shampoo,2025-05-06T10:01:14,12
Separation of church and state shouldn’t be prioritized over preventing actual child sexual abuse.,devnullopinions,2025-05-06T23:22:07,2
"That Catholics have double spoke themselves into a hole where it is more imperative to protect pedophiles than it is to see justice for victims is the Church's own problem. It's not ritual, it's abuse of the systems both within their own dogmas and the political landscapes. Per their own books, their god does not want that.",TheGreatHornedRat,2025-05-06T11:40:00,2
So pedophilia done in the name of god is good?,3slimesinatrenchcoat,2025-05-07T07:44:40,1
They’re offended because they’re almost always the offenders,jackalope503,2025-05-06T13:21:30,20
"My God! Lindsey graham is such fucking weasel, man... Actually! No. Weasels are pretty cute.   Anyway...   Unrelenting cuck. Ima go with that.",can_ichange_it_later,2025-05-06T12:04:12,13
"Not even a trans person, but someone in trans cosplay",veryverythrowaway,2025-05-06T13:35:42,6
Except you are wrong it was not the law at all in WA. Internal Church policy does not count because hear me out... It's not all about Catholics.,oh-ya-its-me,2025-05-06T16:07:10,3
You are right of course. I was just trying to point out another one of the infinite examples of moral contradiction within the MAGA universe.,blue_quark,2025-05-06T09:04:29,11
"Such acts are antithetical to Christianity. Any form of abuse or assault (against anyone, but especially a child) is anti-Catholic, whether the abuser is a Catholic priest, regular layman, non-Catholic, non-believer, etc. Every case of abuse is anti-Catholic.",Multipurpose_Bagel,2025-05-07T16:38:51,0
"No, it's the same sickness. It's just a different excuse. Nobody is called by God to sin. Not priests. Not teachers. Not David Berkowitz. Nobody. It doesn't matter if you believe in God or not when someone claims such things; it's an excuse.",Multipurpose_Bagel,2025-05-07T16:37:30,2
"Where I live in Canada section 68 of the Child and Family Services Act requires certain professions, including priests and clergy men to report suspected abuse. Full stop. Look it up.",blue_quark,2025-05-06T15:22:50,4
"Several religions that have no analog that fit the Catholic confession model use the same privileges to sweep knowledge of child abuse under the rug no matter how it is learned. Including a victim going to their elders for help.  Catholics made it about themselves because they heard ""child abuse"" and turned around as if their name was being called.   Why should the institution most synonymous with child abuse be given an unconstitutional denominational privilege from having child abuse reporting laws apply to them?",oh-ya-its-me,2025-05-06T16:11:49,6
It does. The institution most synonymous with child abuse wants an unconstitutional denominational privilege.,oh-ya-its-me,2025-05-06T16:13:18,5
">Nobody else has their focus on confidential confession  This is not true.  As someone who was involved when this bill was first introduced three years ago: the requirement to report even confessions comes because Jehovah's Witnesses and Mormons constantly claim their internal investigations are their closest equivalent to a confessional and are therefore covered by confessional privilege because it's baked into their doctrine.  I can cite multiple cases for the JWs, and the Mormons [took theirs to the AZ Supreme Court and won](https://apnews.com/article/mormon-church-child-sex-abuse-e02ae4470a5a53cbeb9aa146ff2762ac).  The decision was because of JWs, Mormons, and Scientology constantly attempting to abuse confessional privilege.  You can't exempt Catholic confessional without opening the door to these abuses.  Five other states already don't exempt confessional, including Texas and Rhode Island (the most Catholic state in the US).  The Catholic lobby strategy has been to claim the bill was about them.  It's a self-victim complex.  Even though that was never the intent of the legislature, they've managed to shove this into people's mind, and you're playing into it.     If this is left in for the Catholics, it becomes a loophole abused by others.",MyLittlePIMO,2025-05-06T16:12:29,2
"Yeah this is the situation, it’s not some Trump DOJ bs.  Catholic priests are bound in their religion from divulging information told to them in the confessional. It’s incredibly serious for them and has been for centuries. It could mean they are defrocked or excommunicated.   I can see why a ton of people would say “it’s worth it to be excommunicated to report on child abuse,” but you’ve got to understand that for these people, it could become a question of following their religion or the law. Never a good situation  Edit: I know that you guys don’t care about their beliefs, that’s totally fine. I’m not saying their beliefs should trump the law, I’m just saying that this is the reason there’s pushback coming in when it seems crazy to push back in the first place. I don’t think that abusers should be sheltered or something",Fearless-Sorbet5546,2025-05-06T09:02:10,-12
"If the pope came out and went: ""we have been fucked up. We will be better. "" I would have SO much respect for him.",Crusty_Musty_Fudge,2025-05-06T09:08:46,3
They dropped and excommunicated thousands of priests and cracked down with the Dallas reforms of 2003 the vast majority of abuse happened from 1960-2000 given that now days an average of 5 reports happen a year in the US I’d say they did a decent job of fixing the situation.,Cats_are_evil543,2025-05-07T08:37:48,2
"> So it is a freedom of religion thing.   No, it's not, it's a freedom of abusers thing.  Therapists and other mandated reporters are required to break confidentiality in cases like this, religious figures should be no different.  I don't care if it goes against their moral beliefs; if their beliefs condone hiding child abuse, their beliefs are reprehensible.",h3r4ld,2025-05-06T08:30:06,20
It’s insane what the religious can get away with hiding behind this veil. No one should give a fuck about some made up seal of confession when children are being hurt. Putting this religious cosplay over the rape of children is disgusting ,Emotional-Channel-42,2025-05-06T08:28:21,10
And instead the priest lets the abusers be free of the sin.,TintedApostle,2025-05-06T08:22:51,11
"That's the basic rules but the priest can report if it is in order to stop or prevent harm. At any rate they are already religiously obligated to disobey laws that are unethical or immoral, so there's no reason why the state should be required to carve out an exception in these cases. ",Sad_Pangolin7379,2025-05-06T08:32:06,6
That seems dangerously close to putting religion above the law.,ManiaGamine,2025-05-06T09:56:28,5
so a bullshit sky-fairy law should supersede protecting the most vulnerable? That's a centuries old out-dated answer.,whatsupeveryone34,2025-05-06T11:09:32,5
"I'd argue it's not laws interfering in a major religious ritual, rather a religious ritual is interfering with basic law.",flypirat,2025-05-06T11:44:35,2
"It's worth noting that this decision wasn't made because of Catholics, but because JWs and Mormons repeatedly abuse ""clergy penitent privilege"" by claiming that since their religion requires internal investigation of sins, their internal investigation is their equivalent of confession.  Happy to provide court cases if you'd like.     So if you exempt confession, you also open this loophole that other religions abuse.     Also, I'd argue that exempting confession because \*only the Catholics do it\* is also showing favor to a religion.  If a religion says other crimes are ok, we don't make exemptions for them.     The Catholics are demanding special treatment in the law and saying that not granting it is anti-Catholic bias, even though there's a proven history of JWs and Mormons and even Scientology abusing the privileges the Catholics ask for.     The legislature decided this based on the JWs, not the Catholics.",MyLittlePIMO,2025-05-06T16:28:24,1
"What are those reasons?  Hiding evidence of child abuse behind ""religion"" is the same as supporting child abuse.  EDIT: Nevermind. I see that evey one of your posts are about religion so I don't expect any actual logic.",BlotchComics,2025-05-07T08:53:23,1
"That's not what the bill says though.  The bill says it requires members of the clergy to report child abuse, with no exceptions.  The bill says nothing about confession.  That's an editorial insertion.     It's just that the Catholics are the predominant users of confession as a reason not to report, so they're making it about them.  (JWs and Mormons actually use it too, and in a way more abusive manner, claiming their internal investigations are their equivalent of a confession and therefore protected.  That was the reason for the bill not exempting confession.)",MyLittlePIMO,2025-05-06T17:42:21,1
"Ok but if you tell a doctor that you are causing or intend to cause harm to yourself or another person, they are legally obligated to alert authorities..",shallow_kunt,2025-05-06T17:57:11,3
You're more than welcome to challenge my statement if you believe it to be in error. What do you believe is the most charitable view on the core value(s) of conservatism? ,Shido_Ohtori,2025-05-07T11:25:59,1
You are really defending child molestation?  I have no “dogma”  yours is defending child molesters?,donttakerhisthewrong,2025-05-07T09:11:16,1
"I guess you're right... We should just allow serial child rapists to walk free and continue to ABUSE CHILDREN when they admit their heinous crimes to clergy because of the importance of the sacraments.  Obviously that's not the only thing people confess to, but if you think that when it is confessed it should not be reported, you are basically abusing children. so congrats.",whatsupeveryone34,2025-05-07T09:56:48,2
"As I noted, it could possibly be a violation of Catholic religious practice that predates the laws of the state and the nation. It’s a centuries old practice to keep the sacrament of reconciliation/penance a private confession. As it’s a sacramental practice, it is also a prayer, in other words it has a religious purpose, not primarily a mental or physical health practice (as in the case of doctors/therapists).    I’m all for clergy being mandatory reporters. However, I believe it would be a violation of religious practice to break the seal of the sacrament.",edemberly41,2025-05-06T18:20:45,0
[deleted],[deleted],2025-05-06T23:30:10,0
"Dude...  it's in the first sentence of the article.  It's about violating the Seal of Confession.  You can disagree all you want but this law won't make it past the appeals court.  It clearly targets Catholics for acting Catholic, and participating in a Sacrament to boot.  This is about as clear a civil rights violation as there is.  Priests are still mandated reporters, outside the confessional.  I know this because I have appropriate training for coaching CYO sports.  ",Sufficient_Emu2343,2025-05-06T16:13:51,-7
Sorry.  I should have put a /s on that.  Didn't think anyone would mistake that for anything but a sarcastic comment.,Za_Lords_Guard,2025-05-07T16:52:05,1
"If that's true, it goes against the Catholic teaching on the Seal of Confession, which would be anti Catholic.  A priest would have to decide if he would comply or not, which I'm guessing would be a serious conundrum.  Anyway, not really comparable to our pretty robust religious freedom in the States.  You will see that when this is struck down.  ",Sufficient_Emu2343,2025-05-06T15:41:38,-1
"\> Catholics made it about themselves because they heard ""child abuse"" and turned around as if their name was being called.  That alone just screams child abuse is an institutional issue then within the Catholic church here.",Frowny575,2025-05-07T19:38:10,2
"Signing on to what you’re saying. While other churches may not have the same history, there is nothing stopping them from creating one. Using the logic of those defending the confessional seal, no matter how heinous the crime, any other church could launch a religious defense for knowingly contributing to crime or failing to report crime.   Psychiatrists “duty to warn” came about in 1974. Prior to that, psychiatrists felt as strongly as priests that what they heard should be kept private. When the law was passed, many cried foul, but today it’s the accepted standard.   Religious freedom shouldn’t be greater than law or the lives of others.",70sBurnOut,2025-05-07T03:34:02,2
"Lol you cannot imagine how little of a shit i give about their beliefs in the context of concealing admissions of child abuse. They should follow morality and the law, their religion can suck it.",Rough_Athlete_2824,2025-05-06T09:45:21,25
No. This is absolute bs. Are you saying that a doctor who dedicated their life to their education and career shouldn’t have to report just because it breaks hipaa?,Emergency_Rub8527,2025-05-06T09:11:40,13
Where I live priests have had to divulge confessions of child abuse since 2017.,Purify5,2025-05-06T09:25:37,12
"Their nonsensical beliefs do not even remotely matter. If you wanna believe in fairy tales as an adult, you’re allowed to. What you’re not allowed to do is not report that children are being abused. If you don’t do that you don’t deserve fictional eternal happiness in the first place",Nicki-ryan,2025-05-06T11:24:40,4
"See [my other comment](https://www.reddit.com/r/politics/comments/1kg3j5j/comment/mqyelxp/) - it's very important to note that this bill was not targeted at the Catholics.  JWs and Mormons constantly claim clergy privilege over everything to prevent reporting.  If this is left in for the Catholics, it becomes a loophole abused by others. That's why the bill is this way.  Other states have it too.",MyLittlePIMO,2025-05-06T16:14:01,1
"Excommunication isnt enough. If you have to serve prison time for marijuana, then you have to for abusing kids.",asevans1717,2025-05-07T09:25:59,1
"Yeah, I'm not talking about the morality, just the legality. If it helps, there's the option of assigning 'confess to the cops' as penance.",RavensQueen502,2025-05-06T08:25:19,-6
"Logic, hah! What a funny word coming out of your mouth ",Cats_are_evil543,2025-05-07T13:45:11,0
"Because this now makes confession useless, while ridding child abuse is noble the government has now set a precedent that will further invalidate the church. Confession is a holy thing but the priest still tells the penitent to go to the police and can withhold the Eucharist because the person is living in sin.",Cats_are_evil543,2025-05-07T09:03:37,-1
"Hierarchy is not a necessary factor of conservatism, I don’t have much faith in the government and I don’t look to any living figure as an ideal to worship. If you are insinuating that trump or any other person is the supreme example of conservatism I’ll need you to provide that such person. Conservatism is a values based ideology where classical ideals are the foundation, whether biblical or humanistic. If I’m mistaken on your point please feel free to correct me ",Cats_are_evil543,2025-05-07T13:34:47,0
"Hardly true, 99.99999% of confessions aren’t related to child abuse, when a priest hears about it they have every right to tell the penitent to go to the police or the priest can withhold the Eucharist or invalidate the person’s confession. You have zero knowledge about the inner workings of the sacraments but blabber like you do ",Cats_are_evil543,2025-05-07T09:14:33,1
"That’s not how confession works, it’s not therapy. When you go to confession you have to actively acknowledge and make a real commitment to not sin. The priest will actively push you to go to the police. They can also withhold the Eucharist until you do given that it’s sinful. There are many avenues within the church especially nowadays to weed out abusers. Most dioceses have report boards that are given over to law enforcement. To act as if confession is the only way to get rid of people is ignorant.",Cats_are_evil543,2025-05-07T10:02:56,0
"As long as all religions are treated equally, I'm not sure it's an issue.  The age of the religious practice does not matter.  There are ancient religions that still exist that advocate for stoning of sinners, too, and we don't accept that their religious belief means the law can't regulate stoning people.     The main issue comes from the fact that it is being repeatedly abused by other groups.  When you have multiple groups stating that their religious doctrine requires secrecy of things said in ""judicial committees"" and the like, and then every case of child abuse is turned into such a committee...     I don't see how there's a good way to prevent those abuses while also leaving the Catholic tradition in there, without picking religious favorites.",MyLittlePIMO,2025-05-06T18:52:48,2
Yes absolutely parents should be required to report that. A law not being perfect in its coverage doesn’t make it a bad law. If we only allowed perfect laws we would have no laws at all.,devnullopinions,2025-05-06T23:43:58,2
"Dude... A biased article repeating the Catholic lobbying arm's rhetoric is not the bill itself. I know, I worked on the bill. With Catholics.   It all came about after reporting on the Jehovah's Witnesses cover-up of abuse.   I'll say it again slowly. Internal. Church. Policy. Is. Not. Law.  The only thing holding them accountable to those policies is the institution that pays out billions of dollars in settlements and judgments for child abuse. Forgive me, I don't give a shit what they think.  I can't makeyou understand the fact that clergy of all faiths in Washington are not mandated reporters until this law came forward.",oh-ya-its-me,2025-05-06T16:18:32,8
"All good. To be fair, I didn't think you were serious. I've seen that phrasing used plenty of times elsewhere - ""what, did God tell you to do \[xyz\]?"" - sarcastically, mocking, etc.",Multipurpose_Bagel,2025-05-07T17:00:25,2
You should realize that this is not a new issue and that a number of U.S. states already have similar laws on the books and have for years.,blue_quark,2025-05-06T16:39:36,3
"Preach.  I coach an after-school youth cycling program twice a week, and I have to complete ""mandatory reporter"" training \*every year\* in order to be allowed to continue. I'm required to report to the appropriate authorities if I so much as *suspect* that one of my kids is being abused. I'm not allowed to sit on the knowledge, or investigate further. I HAVE to report it so that the authorities can investigate and clear the suspected parties of wrongdoing in the event that it was a false alarm.  We don't have room in civil society for authority figures who have a *religious objection* to reporting confessions of child abuse. I don't care what it does to their religious tradition of protecting abusers-- it's sick and stupid and obsolete.",Beer_Is_So_Awesome,2025-05-06T12:30:33,3
"I’m not arguing in favor of one or the other. I’m saying that priests and likely many lay members of the church see this as a bedrock part of their religious practice, and don’t think it should be legislated about in any circumstance. It comes with serious implications for them, so it makes sense they aren’t thrilled.",Fearless-Sorbet5546,2025-05-06T09:14:21,-2
"So you live in-   Texas, West Virginia, North Carolina, Oklahoma, Rhode Island, or Guam?  All of which pierce clergy-penitent privilege for child abuse.  Figures the Trump admin only gets mad when a blue state does this",MyLittlePIMO,2025-05-06T17:36:06,1
"The church actively supports law enforcement in getting rogue priests arrested, wdym???",Cats_are_evil543,2025-05-07T09:44:06,1
"The church actively supports civil authorities in locking up rogue or excommunicated priests,wdym???",Cats_are_evil543,2025-05-07T09:45:46,1
"Its a freedom of religion things sure, but I don't se the church making an effort to find a way either.",TintedApostle,2025-05-06T08:29:17,4
"Hierarchy is *most definitely* a necessary factor of [conservatism](https://www.merriam-webster.com/dictionary/conservatism) , as -- by definition -- it is ""a political philosophy based on tradition and social stability, **stressing the importance of established hierarchies and institutions** (such as religion, the family, and **class structure**), and preferring gradual development to abrupt change"".   Biblical ideals demand respect for and obedience to a *celestial hierarchy*. Humanistic ideals -- such as belief in the essential goodness of the human race, freedom for the individual from arbitrary authority, and protection and promotion of political and civil liberties -- are tenets of [*liberalism*](https://www.merriam-webster.com/dictionary/liberalism), a political ideology opposite to that of conservatism.   You claim that my statement is an ""uncharitable straw man"", but consider how opposed to modern values conservatism must be for conservative propaganda to steal and use tenets of their *opposing ideology* (""freedom"", ""liberty"", ""individuality"") to market themselves.",Shido_Ohtori,2025-05-07T14:36:01,1
Fuck that. Why do you want to protect child molesters?  That is sick. What part of your religion calls for this?  Especially knowing the churches role in protecting child molesters and moving priests to molest children in another countries to molest more children  Your made up guy in the sky is not more precious than protecting children.,donttakerhisthewrong,2025-05-07T09:23:33,1
"Sorry, I can't argue logic with someone who is not equipped for such a thing.",whatsupeveryone34,2025-05-07T11:35:53,3
Catholicism has never been a religious favorite in the United States. But liberty is important even to Catholics.,edemberly41,2025-05-06T18:55:37,1
"Does the new law require a Catholic priest to break the Seal of Confession? If it does, and a priest does so, he risks excommunication.  This is an impossible dilemma, and will be tested in court.  You may not care about such consequences, but Catholics do.  Not a Trump admin fan, but I do appreciate how solid it's been on religious freedom.  Imperfect advocate, but I'll take it.   ",Sufficient_Emu2343,2025-05-06T16:43:53,-3
"That's the sad part.  To some people, a cross is a panacea for sinning, not someone to aspire out of sinning for.  Not that I believe in sin.  I just try to live by Wil Weaton's rule.",Za_Lords_Guard,2025-05-07T17:02:50,1
"I saw that, and i had no idea.  I never thought that any law would target an essential Catholic sacrament like that, but i was wrong. Breaking the Seal of Confession risks excommunication.  It's an impossible dilemma for a priest.  Child abusers deserve absolution just as much as any other sinner, and the risk of being reported shouldn't be an impediment to that.  If you think that's heinous, please note that in Catholicism, a mortal sin is no more or less worse than any other, except for the degree of penance required for absolution.  Everyone deserves forgiveness, if they are willing to accept it.    ",Sufficient_Emu2343,2025-05-06T16:53:10,-1
It absolutely should be legislated about. Separation of church and state means no religious excuses for criminal activities.,flypirat,2025-05-06T11:41:54,4
"I appreciate the clarification, and hope others do take it as clarification and not defense.   That distinction is lost on so many people.",NinjaLanternShark,2025-05-06T10:49:16,2
Exactly. The Church ought to figure a way out. They can surely think up some loophole?,RavensQueen502,2025-05-06T08:38:41,1
You wouldn’t know logic if it died in your bed,Cats_are_evil543,2025-05-07T13:27:28,0
The secular law on child protection is the law. How a religion deals with the law is on them. Nowhere in the law is there any requirement to break any tenants of a religion. That would be an absurd violation. But it doesn't stop the opponents of this from framing it that way.  We no longer allow them to burn their heretics or apostates at the stake either.   The regime is on the forefront of breaking down freedom of religion and separation of Church and state. Keep your religion out of our government.,oh-ya-its-me,2025-05-06T16:48:40,2
