Comment,Author,Date,Score
" As a reminder, this subreddit [is for civil discussion.](/r/politics/wiki/index#wiki_be_civil)  In general, be courteous to others. Debate/discuss/argue the merits of ideas, don't attack people. Personal insults, shill or troll accusations, hate speech, any suggestion or support of harm, violence, or death, and other rule violations can result in a permanent ban.   If you see comments in violation of our rules, please report them.   For those who have questions regarding any media outlets being posted on this subreddit, please click [here](https://www.reddit.com/r/politics/wiki/approveddomainslist) to review our details as to our approved domains list and outlet criteria.    We are actively looking for new moderators.  If you have any interest in helping to make this subreddit a place for quality discussion, please fill out [this form](https://docs.google.com/forms/d/1y2swHD0KXFhStGFjW6k54r9iuMjzcFqDIVwuvdLBjSA).    ***   *I am a bot, and this action was performed automatically. Please [contact the moderators of this subreddit](/message/compose/?to=/r/politics) if you have any questions or concerns.*",AutoModerator,2025-05-06T07:44:04,1
Republicans: We're tough on crime!  Also Republicans: Whoa whoa whoa! Who ever said abusing children is a crime?,pierre_x10,2025-05-06T07:49:18,478
"Had to read this three times to believe that the MAGA DOJ, who delight in calling everyone a pedophile, would be against a law specifically passed to identify and eliminate child abuse. Then again I guess we can be shocked but not surprised.",blue_quark,2025-05-06T08:00:58,171
"For this to be 'anti-catholic', that would mean the catholics are pro-abuse.",Impossible-Owl-66,2025-05-06T08:13:44,99
[deleted],[deleted],2025-05-06T07:56:54,26
"* GOP not in power: Those in power protect pedophiles in high places!  * GOP in power: We protect pedophiles in high places!   For once, consistent on an issue..",professor_fate_1,2025-05-06T08:26:06,17
"Kinda telling on yourself if you think being against child sexual abuse is ""anti-Catholic""",Annual_Strategy_6206,2025-05-06T08:31:42,20
Trump is running hard to be the next Anti Christ,redviiper,2025-05-06T07:46:40,34
"I can't respect anyone who sits there, knowing children are being abused, and gives money to the catholic church.   If the church weren't claiming to represent morality, this wouldn't be half as evil. But the fact they claim to be holy and moral and abuse children? I wouldn't be caught dead in a catholic church.",Crusty_Musty_Fudge,2025-05-06T08:23:24,25
"Just when you think you've heard everything that these sick sycophants can envision, you read this, and your brain is numbed. To investigate a law that says that Catholic clergy have to report child abuse as anti-catholic is absolutely bizarre. I guess what they mean is that the law should only apply to religious leaders of other faiths and not to Catholics, right? Or that we do not report child abuse at all?",TopEagle4012,2025-05-06T08:08:25,11
Classic Fox News. Comment section is people saying they wished “the squad” got beat and that protecting children from rape is a bad. ,Emotional-Channel-42,2025-05-06T08:26:22,9
This feels like pedophiles protecting other pedophiles to me. MAGA is fucking creepy and weird.,m1j2p3,2025-05-06T09:30:36,6
The Republican party is pro-pedophile.,PenImpossible874,2025-05-06T14:21:03,3
"Republicans: We hate ""pedophiles"", but we sure do love child sexual abuse!!",PotluckPony,2025-05-06T16:28:58,3
>...requires members of the clergy to report confessions of child abuse or neglect...  Calling that anti-Catholic is really telling on themselves.,Paul__miner,2025-05-06T23:17:43,3
This is preposterous. It sounds like the DOJ approves of child abuse — especially against little altar boys. The Catholic Church doesn't need help from the DOJ for people to think they're a sexually corrupt organization.,invalidpassword,2025-05-06T08:16:24,5
Any MAGAts want to defend this one?,BlotchComics,2025-05-06T08:18:43,5
I’m catholic and how the fuck is that anti catholic? Wow,Genoblade1394,2025-05-06T08:39:47,5
I'm not surprised that Republicans would stop a child abuse investigation.,The-M0untain,2025-05-06T08:51:22,4
Who could have predicted that the frequent Epstein flyer would go to bat to protect pedos?,DragonPup,2025-05-06T08:55:13,5
Maga are all pedos as it turns out,ToNoMoCo,2025-05-06T08:46:17,4
So the maga DOJ is pro child rape?,Lord-Velveeta,2025-05-06T08:48:33,2
"The comments section on that article is wild. People are saying that if attorney/client privilege exists, so should priest/confessor privilege. Holy fuck do we have some dummies in the USA",shallow_kunt,2025-05-06T08:55:33,4
"The *sole* value of conservatism is respect for and obedience to \[one's perception of\] traditionally established hierarchy, and hierarchy dictates that those on top (in-groups) are rightfully idolized and receive privileges, credibility, and resources, while those on the bottom (out-groups) are demonized/dehumanized and bound by restrictions, scrutiny, and lack of resources.  To them, the second-greatest injustice imaginable is for those \[they perceive to be\] on the bottom \[of social hierarchy\] to have access to the rights, credibility, and resources reserved for those on top. The first greatest injustice is for those on top to be bound by the restrictions, scrutiny, and lack of resources reserved for those on the bottom.  ""Know your place"" is their mantra.",Shido_Ohtori,2025-05-06T11:18:56,3
Pizza places are where the real crimes happen.,Tall_Court_9241,2025-05-06T13:51:26,2
protecting pedophiles is good if it protects the church... this is pretty much the whole argument against the catholic church in how many countries with clergy sex abuse scandals?,VOIDsama,2025-05-06T08:15:43,5
Figures... Republicans love their cheese pizza. Sick fucks...,addled_and_old,2025-05-06T08:22:27,3
What in the actual fuck?,liburIL,2025-05-06T08:44:45,3
The Trump administration will stop at nothing to bring back child sexual abuse where it can. Guy ran  his club like an underage brothal for the likes of Epstien and other elites.,Any_Wrangler_4822,2025-05-06T08:55:37,3
"I'm not sure being ""pro child abuse"" is the win the GOP thinks it is.",atreeismissing,2025-05-06T13:41:33,4
"America. Fucking. Sucks. There's no hiding it anymore. There is systemic infiltration of bad actors at every level of every institution who are able to push through corrupt, disgusting, and often times illegal agendas. And nobody is fucking stopping them.",t0matit0,2025-05-06T09:19:04,2
Would clergy tell on themselves? Nah,mountaindoom,2025-05-06T09:41:55,2
Fuck the DOJ 🖕,ProfessionalCraft983,2025-05-06T13:28:00,2
"INFO: I thought that when you do a catholic confession it's anonymous: you are in a little, darkened booth, the priest is in any adjacent, darkened booth and the only connection is a speaker grill.  So how could the priest ID you?  Or have things changed?  (it's been a while since I went to confession)",Catspaw129,2025-05-06T08:56:00,2
FUCK THAT  If you are fighting a law like this your organization need s to be shut down,donttakerhisthewrong,2025-05-06T10:40:53,1
That doesn't seem anti-Catholic. It's anti-abuse. But I wouldn't expect a group of pedo enablers like the church or Trump's administration to understand the difference.,Ouibeaux,2025-05-06T13:27:12,2
Awful,BreakMaximum5807,2025-05-06T11:13:49,1
"This stuff doesn't even make sense any more. This requires thousands and thousands of people working together to do these things. This would be a giant coordinated conspiracy to allow pedophiles to operate in society, enabled by government.  This is everything that both sides rail against as proof of corruption.  I just don't understand who all these people are that are for collapse.",meatspace,2025-05-06T11:18:46,1
"Most states require clergy to be mandatory reporters but, they make an exception for the seal of the confessional. Washington State could make a law that’s similar to California in which clergy are mandated reporters outside of the sacrament of penance/reconcilation/confession.",edemberly41,2025-05-06T12:16:36,1
Pam Bondi and all the SS stormtroopers in the DOJ are pro child abuse is what I’m taking away from this,powderedmilf,2025-05-06T12:22:10,1
Ah look at that. Still not a drag queen.,rubyshoes21,2025-05-06T12:37:44,1
"This is why every anti-groomer anti-pedo “advocate” is performative nonsense. If MAGA or trump voters cared, this would be the only topic of conversation. It’s shocking how people in this country just act like it’s no big deal.",beadzy,2025-05-06T12:47:08,1
I found myself wondering how child abuse fits into the First Amendment's *peaceful assembly* phrase.,chockedup,2025-05-06T12:50:21,1
Because child abuse is pro-Catholic?,h8hannah8h,2025-05-06T16:23:44,1
"The second a church - any church - starts protecting child rapists / molesters should be the second that they lose any any and all government-allowed fiscal benefits.  Take away their tax-free status. Take away any tax breaks that the communities have given them. Tax their land, tax their holdings, and drive them into the fucking gutters, where they can [_weep and gnash their teeth._](https://en.wikipedia.org/wiki/Weeping_and_gnashing_of_teeth)",tuxedo_jack,2025-05-06T17:24:06,1
Never been so proud to say I am from Washington,yogaguy9_11,2025-05-06T17:26:29,1
"So like, could someone explain like I’m 5 why the fuck reporting child abuse is anti-Catholic?",TonyStewartsWildRide,2025-05-06T18:15:50,1
"Lol, it's telling that a law against child abuse is considered ""anti-catholic""",MrsClaireUnderwood,2025-05-06T10:32:57,1
"As a Catholic, this is NOT anti-Catholic, and anyone who says otherwise will burn in Catholic hell for all eternity with their worst nightmares.",mercedesnn,2025-05-06T17:29:38,1
I understand the argument they're making and it may even be correct...it's the fact that they're making it that is killing me though. The DOJ can only focus on so many things and one of the things they picked is protecting priests from having to report child molesters and abusers to the police?,esoteric_enigma,2025-05-06T10:08:38,1
"this is disgusting. and the people bending over backwards to make the ""religious privilege"" case are probably worried their confessions may come back to bite them.",whatsupeveryone34,2025-05-06T11:02:38,1
So it is anti-Catholic to protect children by reporting child abuse?? Am I reading that right?,gnatdump6,2025-05-06T21:42:48,1
People still wonder why I deliberately distance myself from anyone Christian.,Supporttroll,2025-05-06T10:51:39,0
Hmmm how is this profitable?,_mikedotcom,2025-05-06T09:35:06,0
State's rights and all that,Those_Silly_Ducks,2025-05-06T11:31:17,0
"Yeah, pedophilia is a god-given catholic right!",Intro-Nimbus,2025-05-06T15:51:26,0
They can’t be serious….,BoredCrusader1899,2025-05-06T10:39:50,0
"It’s the part of the law that makes breaking the seal of the confessional that could possibly be a violation of religious practice.   It’s important that clergy be mandatory reporters. Many states have laws that make an exception for the sacrament of confession/ penance, including California. It’s this nuance that makes WA’s law different.",edemberly41,2025-05-06T09:54:08,-3
Hahaha! That’s rich!,LolaSupreme19,2025-05-06T10:36:45,-2
"The problem is, this can be a Freedom of Religion issue.  The law requires clergy to report abuse - even if it is revealed to them in the Confessional.  The Seal of Confession is a major thing for Catholics - even if there is risk of potential harm, the priest isn't allowed to disclose whatever is told them in Confession.   They can refuse to give absolution unless the person gave themselves up to the cops, but they themselves can't report. And even that option is closed if it is the victim than the abuser who tells them what happened.   So this law is effectively interfering in the ritual of Confession, which can be taken as a violation of the separation of Church and State.",RavensQueen502,2025-05-06T08:24:32,-14
"Republicans do have a history of that, so it makes sense they're offended.",Individual-Nebula927,2025-05-06T07:51:05,111
"It's because they are primitive savages that don't belong in civil society.    Republicans, and any*body that enables them, should go live in the backwards countries that they love so much. They are the only party in America that supports the shit they do and should have always been treated as such.   Here are troglodytes championing child marriage.   https://www.newsweek.com/jess-edwards-teen-child-marriage-opposed-republican-ripe-fertile-age-1897512   Here are the same troglodytes trying to put kids back to work in factories   https://www.npr.org/2023/03/10/1162531885/arkansas-child-labor-law-under-16-years-old-sarah-huckabee-sanders   Here are the troglodytes shutting down free speech (which isn't even against our own country, which is even more disturbing)*   https://www.politico.com/news/2024/04/27/republican-states-colleges-free-speech-israel-gaza-complicated-00154702   Here are the troglodytes voting with tyrants over the free world.   https://news.sky.com/story/us-joins-russia-north-korea-and-belarus-to-vote-against-un-resolution-on-ukraine-war-13316417     Anyway, these are just a couple reasons that Republicans are anti-American, don't hold any of the same values that Americans do, and don't belong in our country. And yes, flip floppers like Lindsey Graham and Nikki Haley are counted here too. Who cares what you say on video of you vote with and for the anti-americans anyway?   *Typos",Youcantshakeme,2025-05-06T09:11:20,80
"When they say they're tough on ""crime"", what they mean is ""tough on people they don't like and call criminals for merely existing"".  ""Laws for thee, not for me"".",ProfessionalCraft983,2025-05-06T10:00:02,15
"Well they consider that a trans person reading a book out loud is abuse, so I guess that's something...   /s",STBadly,2025-05-06T09:22:40,10
GOP: we are pro life  Also GOP: once its born its on its own.,R-2-Pee-Poo,2025-05-06T14:00:48,3
“We just want to protect the kids!”,Violet-Journey,2025-05-06T22:02:00,1
"Catholics are pretty evenly split, rep and dem, probably more dem these days.  Also, this law is about violating confession confidentiality, not tough on crime republicans.  I think this law will be smacked down with prejudice.",Sufficient_Emu2343,2025-05-06T13:13:51,-2
"Nothing to do with crime.  Clergy are mandated reporters if they see something or hear something, like teachers or coaches.  The law in question requires them to report on confessions.",Sufficient_Emu2343,2025-05-06T13:00:17,-2
"here is the thing - MAGA is loaded with pedos, top to bottom.   it’s all projection.",BaconHammer9000,2025-05-06T09:06:11,89
"You have to remember, to the maga crowd pedophile doesn’t mean “someone who sexually assaults a child”.   In maga world pedophile means “gay”.",sax87ton,2025-05-06T12:10:45,19
"Set MAGA aside for a second The main group pushing for this has to be the Catholic Church. After so many years of not protecting children, and then so many years of apologizing and complaining that no one will “just drop it” and forget that they had a policy of hurting children.  What assholes",xyz_rick,2025-05-06T08:40:48,33
"It looks like the only way to read this is that child abuse is inherently catholic and being against child abuse is anti-catholic. So as long as you wear a cross around your neck while you rape a child, it shouldn't be reported or investigated",dafunkmunk,2025-05-06T12:12:45,5
"If you are called by God to diddle children, it's completely different than those who came to it out of personal sickness.",Za_Lords_Guard,2025-05-06T09:26:41,3
I think you're forgetting that with MAGA every accusation is a confession.,Gwyndion_,2025-05-06T09:53:22,3
"You read it three times and couldn't figure out that the law requires the clergy to report on confessions, a Catholic sacrament, which is between the confessor and God?  A priest can't violate that!  This'll be smacked down in court, likely with prejudice.  ",Sufficient_Emu2343,2025-05-06T13:05:01,-3
"Well they're calling it anti-Catholic because it targets confessions. Other religions don't really have that as a requirement. Protestants don't have to tell their pastor their sins to be forgiven. And if a Protestant told their pastor that they molested a child, there would be no expectation for that pastor to keep that confidential.",esoteric_enigma,2025-05-06T10:14:49,12
"It also never even mentions Catholics in the bill. The text of the law says:   > ""Member of the clergy"" means any regularly licensed, accredited, or ordained minister, priest, rabbi, imam, elder, or similarly situated religious or spiritual leader of any church, religious denomination, religious body, spiritual community, or sect, or person performing official duties that are recognized as the duties of a member of the clergy under the discipline, tenets, doctrine, or custom of the person's church, religious denomination, religious body, spiritual community, or sect, whether acting in an individual capacity or as an employee, agent, or official of any public or private organization or institution.   Seems to me that applies equally to all religions.",GrinningPariah,2025-05-06T15:53:42,8
Indeed. They're playing into stereotypes.  The law against divesting from Israel propagates the conspiracy theory around who controls money and global influence. This propagates the idea that Catholicism treats child abuse as a de-facto sacrament reserved for priests. I'm pretty certain that the idea is to put people against each other as part of the distraction clown show.,CitySeekerTron,2025-05-06T08:57:22,16
"It's ""targeting Catholics"" because   > requires members of the clergy to report confessions of child abuse or neglect  Nobody else has their focus on confidential confession.",NinjaLanternShark,2025-05-06T08:56:12,6
No.  It's anti Catholic because it requires priests to violate confession confidentiality.  Even if this law is not rescinded in court (which is will be by a steep majority) no priest will violate confession confidentiality.  ,Sufficient_Emu2343,2025-05-06T13:18:40,3
"Major crimes are also required to be reported by the church. You do not get protection for confessing to a murder or being a pedophile. That is something that has changed in the wake of scandals, and US law has never protected against. Everyone forgets the repentance part of confession, too. A priest can tell you facing your crimes is repentance. You don't confess and immediately get absolved.   The more this administration tries to win favor with Catholics, the clearer it is that they do not understand the religion at all",whichwitch9,2025-05-06T09:45:55,11
Prove that this is protecting pedos,Cats_are_evil543,2025-05-07T08:38:46,0
There are all sorts of Faustian transactions surrounding him and his actions.,BringOn25A,2025-05-06T09:45:02,3
Huh! I thought he was running to be the next pope.  Silly me.,Catspaw129,2025-05-06T08:57:43,2
The anti christ isn’t one person it’s a spirit ,Cats_are_evil543,2025-05-07T08:38:13,1
"Who needs an anti-christ? When you look at the history of Christianity, it’s been nothing but violence and subjugation since the beginning.",Supporttroll,2025-05-06T10:49:55,1
"Even if they were claiming to represent morality, if they would at least take the smallest initiative in punishing priests instead of engaging in a massive coverup. They dont have a solid history on admitting they were wrong though.",asevans1717,2025-05-06T08:39:16,11
"I'm Protestant and was raised in Protestantism, however I have spent a lot of time around Catholics as several of my mom's friends are devout about the Catholicism (both Catholicism and Protestantism are Christian but to overly simplify this, the Catholics believe in a ton of things that Protestants do not).  One of the things Catholicism believes in that Protestantism rejects is the idea that you have to confess your sins to your preacher who can then offer you forgiveness from the Holy Spirit. So if you beat your wife, cheat on your husband, have homosexual ""thoughts and urges,"" enjoy daydreaming about brutally murdering people who annoy you a little too much, sell sex to feed your family, watch porn, contemplate getting divorced because you are unhappy in your marriage for whatever reason/s, get an abortion (or even consider it), have premarital sex and/or extramarital sex, disagree with the pope, struggle with substance abuse, gossip about celebrities, play with Ouija boards, smack your children around your house or generally do literally anything that Catholicism has deemed to be sinful, you have to confess it to your preacher (""Father"") who will then forgive you for your sins by having you recite what he determines to be an appropriate number of Hail Mary prayers and Our Father prayers. The pastor is also supposed to keep anything you tell him absolutely confidential, you and him and God are the only ones who are supposed to know what happens when you are confessing to your sins in there.  There's no such thing as ""confession"" in any Protestant church and if you start confessing some sins to a Protestant preacher (such as physically abusing your spouse and/or children for example) there is no expectation that he or she will forever stay silent on the situation.  I am 1000% supporting any abuse getting reported to the appropriate authorities, especially if it's physical and/or sexual abuse (or the threat of such) being inflicted on particularly vulnerable people like women, children, disabled people and senior citizens regardless of literally anything else.",bakerfredricka,2025-05-06T11:19:23,3
"The issue is that it would require priests to report abuse if it is told to them in the Confessional.  The Seal of Confession is a major thing for Catholics - even if there is risk of potential harm, the priest isn't allowed to disclose it. They can refuse to give absolution unless the person reported themselves, but they themselves can't report.  So it is a freedom of religion thing.   If an abuser confesses, or if a victim mentions the abuse in confession, the priest would be required by this law to break the Seal of Confession - which means the state would be interfering in a major religious ritual.",RavensQueen502,2025-05-06T08:20:49,-11
"Wow, you weren't lying. Fox News audience is pro pedo alright.",ToNoMoCo,2025-05-06T08:50:20,9
Schools must also follow your garbage strain of logic ,Cats_are_evil543,2025-05-07T08:30:41,1
Not a maggot just a normal person with perfectly honest reasons for hating this law,Cats_are_evil543,2025-05-07T08:31:58,0
As a Catholic myself the seal of confession is a dogma of the sacrament ,Cats_are_evil543,2025-05-07T08:33:50,2
It's because it targets confession. The church are (and should) be mandatory reporters with everything outside of confession.,Help-Learn-Kannada,2025-05-08T11:52:47,1
"It's ""targeting Catholics"" because   > requires members of the clergy to report confessions of child abuse or neglect  Nobody else has their focus on confidential confession.",NinjaLanternShark,2025-05-06T08:58:16,-1
"I saw people making this argument in testimony for this bill, it was fascinating.  Priest/confessor privilege does exist in the law, btw.  I have no problem with it IMO.  It should be treated *exactly* like doctor/patient confidentiality used by therapists (which also exists in the law; and is pierced in cases of child abuse).       Which is what this bill did.  Clergy-penitent privilege is analogous to doctor-patient confidentiality, but the Catholic lobbyists want it to be seen as equivalent to attorney-client privilege.",MyLittlePIMO,2025-05-06T17:45:18,2
This is a DOGMA… some people in this country are religious and have perfectly honest reasons for disliking this law.,Cats_are_evil543,2025-05-07T08:28:10,1
This sounds well thought out but as a conservative this is a really uncharitable straw man ,Cats_are_evil543,2025-05-07T08:29:26,1
It’s rampant across all denominations of Christianity.  I wouldn’t trust the protestants either!,Supporttroll,2025-05-06T10:48:08,3
So break a 2000 year old dogma because you’re mad? Nah🙄,Cats_are_evil543,2025-05-07T08:11:21,1
"Priests can’t report anything from confession, that’s the point this isn’t new.",Cats_are_evil543,2025-05-07T08:02:23,1
So you expect people to just give up one of the most important sacraments because yall are whining? You act as if confession is mainly used to confess child abuse,Cats_are_evil543,2025-05-07T08:05:39,0
"WA's law isn't unique.  Texas, West Virginia, Oklahoma, Rhode Island, North Carolina, and Guam all pierce clergy-penitent privilege for confession.  Note: almost every state pierces doctor-patient / therapist confidentiality for child abuse too.  Treating clergy the same as therapists/doctors seems pretty fair to me.  Second note: The Jehovah's Witnesses and Mormons frequently claim their internal investigations are protected confessions and it has won them the right to not report *anything* they internally ivnestigate in several states. [Example case](https://apnews.com/article/mormon-church-child-sex-abuse-e02ae4470a5a53cbeb9aa146ff2762ac). So exempting confessionals creates a giant loophole other religions will abuse.",MyLittlePIMO,2025-05-06T17:49:41,2
