Comment,Author,Date,Score
"It's always hilarious seeing Black dudes at MAGA gatherings, you already know the older white dudes as soon as they get back in their trucks are like ""I can't believe I fist bumped a N..."" you know what.",Shadow_Strike99,2025-04-07T14:08:56,18
"this guy is notorious, I have a picture of him the day after the election that said ""Kamala you dumb bitch"" outside trump tower. it's like bro, you just won, and that's the best you got?",BeerluvaNYC,2025-04-07T14:49:54,8
Has anyone ever read Uncle Tom’s Cabin?,mlineras,2025-04-07T17:39:02,2
"Higher costs and 401k shrinks  ,what a bunch of dumbasses,",ArmadilloWonderful22,2025-04-07T19:28:37,2
He didn't win anything. Not then or ever in his life. That's why he's there.,DoTheRightThingG,2025-04-08T03:55:13,3
"This is exactly what I was thinking looking at that group, just a bunch of lost, angry, misguided dudes full of toxic masculinity and small dick energy. They need some hugs from dad",slobs_burgers,2025-04-08T13:59:43,1
