Comment,Author,Date,Score
" As a reminder, this subreddit [is for civil discussion.](/r/politics/wiki/index#wiki_be_civil)  In general, be courteous to others. Debate/discuss/argue the merits of ideas, don't attack people. Personal insults, shill or troll accusations, hate speech, any suggestion or support of harm, violence, or death, and other rule violations can result in a permanent ban.   If you see comments in violation of our rules, please report them.   For those who have questions regarding any media outlets being posted on this subreddit, please click [here](https://www.reddit.com/r/politics/wiki/approveddomainslist) to review our details as to our approved domains list and outlet criteria.    We are actively looking for new moderators.  If you have any interest in helping to make this subreddit a place for quality discussion, please fill out [this form](https://docs.google.com/forms/d/1y2swHD0KXFhStGFjW6k54r9iuMjzcFqDIVwuvdLBjSA).    ***   *I am a bot, and this action was performed automatically. Please [contact the moderators of this subreddit](/message/compose/?to=/r/politics) if you have any questions or concerns.*",AutoModerator,2025-04-25T15:57:12,1
"I think all incumbents should have primaries.  They should earn their spot every two years, not just given them because they are in a deep blue district.",MentalTourniquet,2025-04-25T17:52:04,6
"They're not exactly in charge of anything, so ... But, sure, why not have a ""Dems in disarray"" article for old-time's sake.",Grandpa_No,2025-04-25T16:15:43,23
Remember   AIPAC primarying Dems : 😃  Hogg primarying Dems :  😡,The-Real-Number-One,2025-04-25T17:33:04,11
"Good, get the DINOs out of office",throwaway-dysphoria,2025-04-25T16:02:32,6
Democrats look challenging maga republicans,Legal-Maintenance282,2025-04-26T16:54:01,1
So strange that I don’t remember articles from the DNC about AIPAC funding primary opponents.,6a6566663437,2025-04-26T23:42:43,1
"No need to source me but for the author, I can confirm Pelosi will run for re-election until she dies and then if AI is up to par by then, Pelosai will run for election.",ParappaTheWrapperr,2025-04-25T16:27:09,0
It’s sad especially when you see automatic reelections.,skullfers,2025-04-25T22:46:37,1
I can't wait for a Common Dreams article complaining about Biden,Threeseriesforthewin,2025-04-25T17:08:16,13
">By the numbers: At least seven House Democrats — nearly all north of 70 years old — are staring down primary challenges from younger insurgents.  >In some cases, the age gap is yawning: 85-year-old former House Speaker Nancy Pelosi (D-Calif.) is facing 39-year-old political operative and software engineer Saikat Chakrabarti.",tech57,2025-04-25T17:56:56,4
I think they're already rerunning Biden articles but with a search-and-replace of Joe Biden to Chuck Schumer.,Grandpa_No,2025-04-26T10:26:38,2
