Comment,Author,Date,Score
"You knew all those demonstrations, outrage and protests was about the money … going to be harder to blow 2.5 billion next presidential cycle without NGO treasury payments ..,.",Cultural_Ad4874,2025-05-06T19:32:58,54
This is accounting 101.  At a company every payment either has an accompanying P.O. number or account code or a check isn't cut.  It's not that hard for the government to do something similar to associate a payment with an appropriation and stop cutting checks when the appropriation is depleted.,SeemoarAlpha,2025-05-06T20:46:02,47
This is why the establishment is so anti Trump. He's threatening their grift and they're lashing out with lawsuits. It'll all come out in the wash.,social_dinosaur,2025-05-06T19:29:25,66
"My mom saw this headline, and said that in her experience of receiving FEMA money/grants for local governments, it's been going on for years.  She'd just receive funds with no descriptions, or even a timeline.  Some FEMA payments were so delayed it was hard to match them up to the recipients",JerseyKeebs,2025-05-07T07:43:02,7
Hint hint hint this wasn’t an accident it was on purpose and it’s a huge reason they hate an outsider like trump 😱😱😱,Funny-Apricot-0712,2025-05-09T09:14:55,0
