Comment,Author,Date,Score"Happened to my grandmother as well. Most people would have described her as cranky in life, but after she got dementia she became the sweetest person and was like that for years. It’s hard to believe it was the same person as all those years before.",7askingforafriend,2025-05-03T06:04:32,3
"A stupid move is a stupid move, no matter the motives",JrYo15,2025-05-04T06:36:15,1
"A lot of people have a stroke and recover fully.    But honestly that was not my opinion, I wanted him to resign back then too.",PatchyWhiskers,2025-05-03T12:11:14,1
🤨 he’ll make them pay,CLE_browns_optimist,2025-05-02T19:54:26,1
Your point is valid and I see nothing to disagree with; my point is that if Fetterman was a lockstep Democrat his health wouldn’t be a concern.  When the guy couldn’t speak or absorb written information—everyone was like that’s fine.  Just odd to me.,Unique-Wasabi3613,2025-05-02T15:26:32,-9
But that is an insurance matter. They can't prove he was being reckless.,manfromfuture,2025-05-02T18:00:45,1
"But I’m not, he has sided on Trump with some things this is true. But he still against some of the more blatant unconstitutional things Trump is doing. Meanwhile we have a congress that seems to be okay with not doing their job and letting trump torch the constitution.  Blue no matter who simply is a phrase that indicates anyone is better than what the Republican Party has to offer. And this is still true, is consider a pig in makeup better at making choices then I would a gop member.",a_rabid_buffalo,2025-05-02T13:19:40,3
[deleted],[deleted],2025-05-02T13:24:48,-1
I’ve never encountered someone whose whole platform is weed but this is good anecdotal information for me to keep in mind if I do.,DriftingIntoAbstract,2025-05-03T07:20:40,3
Private prisons would take all of the fun out.,takenoprisonersnoshi,2025-05-03T12:32:24,0
"Eh, we’ll see. I will say, Mayor Pete has at least done a bunch of shit after being Mayor.",Sitting-on-Toilet,2025-05-02T21:56:16,17
"Which is the point.  His big issue was legalizing marijuana, which is fine. But he built a lot of his “Progressive” bonafides through his work towards legalization as PA Lieutenant Governor. And I’m not going to pretend he didn’t do anything, or his work didn’t have any impact, but it was largely just empty listening tours and new study groups on the issue, rather then actual qualifiable results.",Sitting-on-Toilet,2025-05-03T15:06:41,1
"That is a possibility. My dad went through something similar. He had this stage of staggered mental decline in his late 60s, and then popped a big stroke in his mid 70s that basically finished the job. I remember being at the hospital when the one doctor commented on the signs that this wasn't his first time, but it was thr one he wouldn't recover from. This not being the first was news to me, but apparently he'd been having a roughly quarterly mini-stroke for the last decade.",Affectionate-Memory4,2025-05-02T15:50:08,96
The real strokes were the friends we made along the way.,SecareLupus,2025-05-02T17:29:48,44
Who isn’t having small strokes regularly though?,BootlegOP,2025-05-02T16:21:16,27
"My local dem committee is already talking up Lamb. I think the PA dems know that Fetterman has been such a disappointment that their voters are not going to hold their noses and vote for him.  Fetterman, if he can keep it somewhat together, will make a fortune as a Dem that has “seen the light” once he’s out on his ass",RedHuntingHat,2025-05-02T16:04:43,20
I was quite pro fetterman. Pre stroke I thought he had the profile to do well at national level: post stroke I supported him and I’m glad he beat out dr oz. We didn’t need that seat red last year.   I don’t sing my fetterman song anymore tho,thiosk,2025-05-02T14:08:30,50
Dude has a history of violence: https://www.inquirer.com/politics/election/john-fetterman-black-jogger-2013-shotgun-20220425.html,gringledoom,2025-05-03T09:11:34,2
This sub has this pervasive  undercurrent of ableism,boobsandcookies,2025-05-03T10:53:37,0
Totally agree. It’s physical brain damage and it’s permanent.,gringledoom,2025-05-02T16:21:31,7
"Because his health issues are none of anyone's damn business *as long as he does his job*. And because the article and most of the comments are wild speculations about his unfitness *relative* to his medical problems.  *It's not about his medical problems, and it shouldn't be.*   Don't like his policies? No? Then vote him out. You don't have to accompany it with insults against stroke survivors.    We have had batshit-insane-fully-incompetent people camp in Congress for *decades*. Lucky for them, I guess, they don't have obvious medical issues to attack.   This isn't about his mental health, this is about his *policies*.",Gleemonex4Pets,2025-05-02T14:14:31,-20
"Do you have evidence that medical issues are affecting job performance?   Or do you just have insinuations and assumptions that medical issues are affecting job performance?  If the issue is *job performance*, then focus on the job performance. It's not that hard.",Gleemonex4Pets,2025-05-02T16:32:18,-4
"It was crazy. Herschel Walker is an actual psycho, held a gun to his kid's fucking face and on multiple occasions threatened to slit his wife's throat, and that's the assclown put forward by the party that claims to protect kids and put family first? Embarrassing for the country, far more embarrassing for Georgia, downright humiliating for every worthless shit stain that voted for him.",WillemDafoesHugeCock,2025-05-02T22:37:38,16
How did you feel about democrats defending his place in congress when he couldn’t speak a complete sentence and republicans were saying exactly what you just said?,Top_Key404,2025-05-02T17:29:22,-4
I wonder if it would have been different if it was Tim Walz at the top of the ticket.,Darth_Malgus_1701,2025-05-02T17:54:19,13
">Kamala did not have time to mount any semblance of a successful campaign  Kamala wasn't able to mount any semblance of a successful campaign when she did run in primaries. She didn't even make it to Iowa! Outside of Biden, she just wasn't someone people ever really wanted as President.",ribosometronome,2025-05-02T20:56:26,0
>Biden 100% should have stepped aside sooner and that absolutely had an impact on Kamala's chances.  No it didnt. Kamala wouldnt have made it out of a primary if they happened,fordat1,2025-05-02T21:45:33,0
"It's not entirely true that incumbency is always an advantage. One of the things history shows is that when there's a major economic downturn during a President's initial term, the incumbency advantage often becomes a disadvantage. And honestly, Harris held onto that disadvantage in her campaign by not distancing herself from Biden enough (or, really, at all).",cyphersaint,2025-05-02T16:18:04,8
Incumbency is a great advantage - if you're not mentally unwell.  He was a bad candidate as his brain is made of pudding and she was a bad candidate as people did not turn out for her.  You can deny those two things if you want but they're true.  >That election was never going to be about mental competency(as proven by trumps re election)     You seem to think that the election is about convincing voters to vote one way or another.  It is a matter of turning out our voters.  The people who voted for Trump were never going to vote for ANY Democrat.  The people who vote for Democrats stayed home in a lot of places. Because our candidate sucked.,LawGroundbreaking221,2025-05-02T13:45:25,17
"Biden was down double digits in the polls for months. If those knives hadn’t come out we never would’ve gotten Kamala and it would’ve been a much bigger bloodbath. Senate seats in MI, WI and AZ would probably be flipped red.",dukecityvigilante,2025-05-02T16:08:58,14
"Bro even if they’d circled the wagons, he still would have lost. It doesn’t matter if the core of the party stays strong if voters don’t believe in his ability to handle the job. Unfortunately, perception matters far more than truth. Just like the economy was basically “fine” but because people were paying more for goods, they didn’t feel like it was fine. Democrats haven’t figured out how to message in this new media environment and until they do, republicans will still be defining the narrative for the average American that gets their news from Facebook and TikTok.",hotgirl_bummer_,2025-05-02T16:57:22,4
This is it. Which is why people still find ways to Blame Biden or Harris or democratic senators for the situation we're in rather than **the Republicans actively doing these things to us.**,ClaretClarinets,2025-05-02T14:22:54,3
">people on the left  Notably, it was people in the center left. Bernie and AOC and the like were notably sticking by Biden longer than most. https://nymag.com/intelligencer/article/why-are-aoc-and-the-squad-backing-biden-so-forcefully.html  The center of the Democratic party is neither fit to govern or win races.",ribosometronome,2025-05-02T20:58:18,1
"Gotcha, yes I was thinking of this story about non-committal. Guess he never said it publicly. https://www.politico.com/news/2019/12/11/biden-single-term-082129",gouramiracerealist,2025-05-02T13:43:25,9
"OMG. Keep fighting this battle."" Well technically he didn't say it"" while he was heavily implying it is the worst kind of right.",bungpeice,2025-05-02T13:40:29,-6
That says more about the voters than the candidates,rollin20s,2025-05-02T14:18:28,7
That is what Trump claimed versus the fact that he was jet lagged and suffering the flu.   Note he was fine the next day and delivered a big speech.,CT_Phipps-Author,2025-05-03T06:39:58,1
"It's not tyranny to apply the law. Biden let the AG dick around for four years because bi-partisan optics were more important to him than democracy.  The voters also dumpster fucked us all, but Biden could have done something",Satanarchrist,2025-05-02T13:39:46,15
The incompetence of the Democrats is what allowed a MINORITY to take control,bungpeice,2025-05-02T13:41:32,6
It’s the job of a political party to breakthrough  that and convince voters. The Democratic Party failed to do that..,rimbaud1872,2025-05-02T17:25:43,2
"Absolute nonsense. And the people that ""circled the wagons"" were the centrist/moderate dems. People like AOC and Bernie were supportive of Biden/Harris because they knew they would be scapegoated otherwise.   And still here you are blaming the left.  Absolutely deranged and detached from reality.",Overton_Glazier,2025-05-02T15:40:01,2
Yep - and sought the forgiveness of the Black community.  [https://www.smithsonianmag.com/history/how-a-failed-assassination-attempt-pushed-george-wallace-to-reconsider-his-segregationist-views-180980063/](https://www.smithsonianmag.com/history/how-a-failed-assassination-attempt-pushed-george-wallace-to-reconsider-his-segregationist-views-180980063/),Paisleyfrog,2025-05-02T13:13:49,48
Who says acute and sudden lead poisoning is a bad thing.,tallandlankyagain,2025-05-02T13:08:18,28
"It made sense, but it wasn’t convenient.  Now it is.  It’s all very silly. Both sides are hypocrites of convenience.",Unique-Wasabi3613,2025-05-03T12:12:35,1
He has his own emoji.🤣,Octavia9,2025-05-02T19:55:41,2
"Libs dont like looking in the mirror which is what your making them do. There was nothing this guy could do wrong before. But now that hes more middle of the road and trying to reach across the isle ""hes dangerous to everyone around him including his loved ones get him out now!"" They wont even blink an eye about how hypocritical they are. They are the definition of real politik.",Unhappy_Usual5028,2025-05-02T21:49:00,-3
"Hitting someone from the rear is at least a tailgating ticket. They also had witnesses who attested the car was going faster than the flow of traffic, for most people you’d getting hit with multiple tickets.   [https://law.justia.com/codes/pennsylvania/title-75/chapter-33/section-3310/](https://law.justia.com/codes/pennsylvania/title-75/chapter-33/section-3310/)  [https://law.justia.com/codes/pennsylvania/title-75/chapter-37/section-3736/](https://law.justia.com/codes/pennsylvania/title-75/chapter-37/section-3736/)",felis_scipio,2025-05-02T18:11:22,1
[deleted],[deleted],2025-05-02T13:22:32,0
"If Americans want to choose between something other than shit and shit-lite, then the electorate has to nominate non shitty candidates.  TLDR; Fix the problem by creating an electorate where the overwhelming majority are informed, intelligent, decent people.",VanceKelley,2025-05-02T13:35:08,3
"Pennsylvania still makes the stand, and the strongest in the country against marijuana's state legalization.",takenoprisonersnoshi,2025-05-03T12:33:50,0
> The real strokes  When do they go on tour,goldenflash8530,2025-05-02T19:13:32,21
Enough said LOL.,takenoprisonersnoshi,2025-05-03T12:38:17,1
Master of my own domain,cugeltheclever2,2025-05-03T00:06:35,3
"Thanks for the reminder -- as disappointing as Fetterman has been, he’s better than that jackass Oz.",UltravioletAfterglow,2025-05-02T16:10:19,25
"I'm aware of this incident, like every other person who follows PA politics.  It's more than a little bit disingenuous to suggest that this constitutes a history of violence sufficient to rehabilitate the previous comment.",SamuelDoctor,2025-05-03T09:22:03,1
"Eh, I think it's more that there are a lot of people who feel that it's permissible to say and do anything to give JF a black eye since the war in the Levant started.",SamuelDoctor,2025-05-03T12:52:40,1
"Read the article, he doesn’t appear competent to do his job. And if you’ve never been around someone with a brain injury, you’d understand how complex it is to intervene, they don’t believe they are behaving irrationally. So yeah, I would go to the press if I was in this situation.",DriftingIntoAbstract,2025-05-03T07:27:48,2
"What do you call everything his staff are reporting in these articles if not evidence?   One of them was given specific flags to watch for by a doctor and had written an email noting several of them, including erratic mood swings, saying things that aren’t true, and physical coordination issues.   Plenty of people have directly tied this to his performance with his political stances since his stroke, like the pivot to embracing MAGA from his mostly progressive campaign before.",Prior_Coyote_4376,2025-05-02T16:51:20,10
"I honestly think if Walz was at the top of the ticket democrats would have won in 2024, however close it may have been. Gender and race are factors, but ultimately I think voters were clamoring for someone new.  Democrats had already shot themselves in the foot by allowing Biden to run again. Then they picked Harris after Biden dropped out far too late, not giving the voters a say in the matter. Harris's campaign failed to energize a largely debt-burdened population struggling to get by in a post-COVID landscape. And when she said things like ""I wouldn't change a thing"" when it comes to policy it left the impression that it would just be more of the same Biden-esque centrism and incrementalism.  Walz was like a breath of fresh air. Incredibly popular and down-to-earth, with a record of strong advocacy for workers and the lower/middle class. For me personally, he felt like a real leader and a stark example of what a democrat should be. It reminded me of how I felt casting my first vote for Obama in 2008.   I don't think I'm alone in that reaction to him. If democrats had capitalized on this fresh new voice and pro-worker ideas then I think there's a good chance they could have picked up the votes they needed to win.",glassbellwitch,2025-05-02T18:52:57,17
> You can deny those two things if you want but they're true.  I don't think anybody here is going to deny that the American people are too awful to be asked to elect a woman (and particularly a woman of color) at this point. We've been shown pretty clearly who we are.,Painful_Hangnail,2025-05-02T17:04:06,8
"Mentally unwell is trumps specialty, biden was a bad pick, most dems i knew wanted someone younger, and tough on policies that win votes",Jonny5is,2025-05-02T17:57:18,1
Biden decided to run for reelection... you want to distract with the GOP while ignoring the fact that the people we elect to fight the GOP are incapable of doing it,Overton_Glazier,2025-05-02T15:05:42,2
"Whining about the person who stabs you in the face ain't gonna stop them from stabbing you in the face. They're face stabbers. That's what they do! Now, if you had someone around for the express purpose of keeping you from being stabbed in the face and all they really did was go ""Hey, look, they're a face stabber"" when everyone already knew that, I mean, you might start thinking maybe you need to try something different to keep your face unstabbed.",ribosometronome,2025-05-02T21:03:25,1
Centrists Dems actually win more in competitive districts than those farther left iirc,dukefan15,2025-05-02T21:14:48,0
“Keep fighting this battle”  They’re just correcting a false statement. You’re being weird about it though.,HashS1ingingSIasher,2025-05-02T13:48:35,15
Pretty much where I was going with that.,tigojones,2025-05-02T15:32:18,3
Trump took advantage of the due process he was afforded as a citizen. He also took advantage of friendly judges. There was nothing legally to be done to hasten Trumps trials. You are asking Biden to have ignored courts and due process the same way trump currently is.,dukefan15,2025-05-02T15:28:21,1
Everytime the Dems pass legislation helping Americans they get punished for it by Americans voting them out of office.,dukefan15,2025-05-02T15:29:00,5
">Racism is a worldwide problem, and it's been like that since the beginning of recorded history and it ain't just white and black, but thanks to George Wallace, it's always a little more conveinent to play it with a Southern accent.   > Wallace spent the rest of his life trying to explain away his racist past and in 1982 he won his last term in office with over 90% of the black vote. Such is the duality of the Southern thing...  The Three Alabama Icons - Drive-by Truckers",wkw3,2025-05-02T14:12:59,24
Bothsides! Bothsides!,PatchyWhiskers,2025-05-03T12:46:04,1
I would say the same think if Fox News started praising him after saying he wasn’t fit to be in the senate.  The guy had a stroke and couldn’t comprehend what people were saying. Democrats didn’t care then.  Both sides are hypocritical.  It’s boring.  R/politics is basically R/Democrats. It’s an echo chamber.,Unique-Wasabi3613,2025-05-02T21:56:07,2
"Police are trained to judge speed. Civilians are not. My parents got rear ended 3 times at the same traffic light over about 20 years. Insurance is exchanged but nobody gets a ticket. At the very least, they have the discretion to ticket or not and they chose not to.",manfromfuture,2025-05-02T19:09:58,-1
Look it man i don’t know what to tell you. I don’t like Fettermen but he was still  better pick. Just because he agrees with some things Trump agrees with he doesn’t agree with it all. That’s the key here. What’s worse trying to compromise and work with the majority party because you and your party can’t get anything passed or being the majority party and not giving a fuck about what the president is doing?,a_rabid_buffalo,2025-05-02T13:27:25,2
The world tour?,woolgirl,2025-05-02T20:24:38,7
yeah people are forgetting he was running against dr oz,lordcthulhu17,2025-05-03T09:32:41,2
I was going to say the same. His incompetence probably the lesser of two evils when stacked against Dr Oz.,DriftingIntoAbstract,2025-05-03T07:24:40,1
"okay...  I'm going to try to engage in this discussion in good faith because I honestly believe you are trying to have a good faith discussion.   ""Plenty of people"" tying performance to a stroke is not ""evidence.""   Former staffers talking to journalists is not evidence.  That's called *rumors*.   What we have here are insinuations.   Insinuations are not evidence. Assumptions are not truth.   What *is* evidence is *medical evidence.* Medical evidence comes from his *doctors*, not from ""anonymous staffers"" and ""former employees.""   Erratic mood swings, lying, and conspiratorial thinking *may be* tied to a physical problem, but it *also may be just tied to him being a power-hungry asshole*. Plenty of people with no stroke history have changed their tune once elected.   The problem is that people *immediately blame the health issues and jump to him being unfit*.  Is he unfit? I don't know. But I disagree with anyone who says that being ""erratic"" is an automatic disqualifier from political office.  We have hundreds of years of evidence to suggest the contrary, including current administration.   If people want to talk about Fetterman's performance, I am here for it.   But if people want to repeatedly insinuate that a stroke made someone unfit for office, I am not.   If this article didn't run on rumor, insinuations, and assumptions, what would it look like?",Gleemonex4Pets,2025-05-02T17:08:22,-3
"He strongly implied it, or did massive chunks of the electorate have mass psychosis? He clearly indicated he would be a transitional president.  From the Hill   “Biden’s top advisers and prominent Democrats outside the Biden campaign have recently revived a long-running debate whether Biden should publicly pledge to serve only one term, with Biden himself signaling to aides that he would serve only a single term,” reported Ryan Lizza. “While the option of making a public pledge remains available, Biden has for now settled on an alternative strategy: quietly indicating that he will almost certainly not run for a second term while declining to make a promise that he and his advisers fear could turn him into a lame duck and sap him of his political capital",bungpeice,2025-05-02T14:00:30,-2
"Oh my bad you're right. If I or anyone else had done what Trump did, the AG would have dicked around for four years to avoid looking political, and then everyone would have just shrugged at the idea of putting me in jail for 34 felonies.  You're right, everyone's hands were tied",Satanarchrist,2025-05-02T16:53:06,0
[deleted],[deleted],2025-05-02T13:36:34,0
The real world tour,Shibbystix,2025-05-03T09:53:38,2
"> ""Plenty of people"" tying performance to a stroke is not ""evidence.""  If a doctor says “watch out for these things”, and then those things happen according to the people the doctor told that to, and those people felt concerned enough to tell that doctor, I consider it enough evidence to be concerned myself. Especially when this is about one of the most powerful positions in the world and this behavior directly impacts other people.  > Plenty of people with no stroke history have changed their tune once elected.  Yes, and plenty of people who have had strokes undergo a sudden change in personality and behaviors that are worth exploring.   > But I disagree with anyone who says that being ""erratic"" is an automatic disqualifier from political office.    No one has said this here.  > If this article didn't run on rumor, insinuations, and assumptions, what would it look like?  If it met your standards, what kind of evidence would it actually include?",Prior_Coyote_4376,2025-05-02T17:16:09,5
You say he “clearly” indicated he would be one term. But the source you cite said “quietly” indicated. Those are not the same. At all,dukefan15,2025-05-02T15:26:20,6
"Well i didn’t put fettermen into power, and i personally think he should resign. So now you are putting words my mouth. But the platform fettermen ran on is leagues better then what the gop ran on.",a_rabid_buffalo,2025-05-02T13:40:10,2
">Yes, and plenty of people who have had strokes undergo a sudden change in personality and behaviors that are worth exploring  Worth exploring by whom?  Are you conducting research into the effects of Traumatic Brain Injury?  No, you're making conjectures from reports of rumors and insinuations.  >  >No one has said this here.  Of course they have. His ""erratic behavior"" and personality changes are literally the entire premise of the article and the reason his staffers have supposedly contacted the press.  And If you can't answer the question about how this article would look if it stuck to only facts, I suggest you spend some serious time learning how to tell the difference between fact and opinion.",Gleemonex4Pets,2025-05-02T17:25:51,-1
I didn't realize you need to yell to communicate clearly,bungpeice,2025-05-02T19:40:15,-1
