Comment,Author,Date,Score"Serious - isn't there a differentiation in brain activity between people who are more conservative versus liberal. It has to do with nuance and the fear reaction maybe? It seems like actually stroke induced brain damage = greater conservative thought tendencies.   ""**No Direct Causation:**It's important to note that this research doesn't suggest that a stroke causes conservatism. Instead, it suggests a correlation between the location and extent of brain damage and political beliefs.""",michkennedy,2025-05-02T12:30:21,41
LMFAO! To put it bluntly. That's what the article makes it sound like.  It's sad honestly. From everything I've read he sounded like a really good person before.,Bruce-7891,2025-05-02T12:28:39,22
"Yah he has even admitted it. Something about it definitely changed his whole personality, which can be a thing that happens with people who get traumatic brain damage.",Winter-Huntsman,2025-05-02T13:08:55,6
Cte and brain damage is a leading cause of MAGA.,ItsMinnieYall,2025-05-02T15:58:38,2
Bush jr said he drank everyday from age 20 to 40 with some bolivian marching powder now and then. Then he became a born again. Slow brain damage is a thing.,artwarrior,2025-05-02T13:09:15,2
Yeah he's the prime example for that,Philypnodon,2025-05-02T14:07:26,1
"he had a stroke, yes",ShortBrownAndUgly,2025-05-02T14:17:26,1
He was always a terrible person.  https://www.nbcnews.com/politics/2022-election/fettermans-gun-incident-rattles-black-democrats-pa-senate-race-rcna25649,ShootingVictim,2025-05-02T17:24:13,1
"Ironically, his initials are JKF",Impressive_Ad_5614,2025-05-02T18:02:22,1
"You say that like it’s two separate things.  All jokes aside, the conservatives actively pursue the mentally ill, it’s part of their strategy.",darth_hotdog,2025-05-02T19:19:06,1
Tracks,Successful-Winter237,2025-05-03T06:21:36,1
Just yesterday I saw a video of him arguing with a pilot about why he wasn't putting his seatbelt on.   He's going full maga,pedantic_dullard,2025-05-03T07:26:22,1
Tale as old as time.,lvnlife,2025-05-03T11:33:23,1
"Not long ago, you would've been downvoted en masse for suggesting voting in a Senator with literal brain damage was a bad fucking idea.  Remember when people were celebrating his refusal to wear proper attire to congress as just him being different and a maverick?",SpectreFire,2025-05-02T15:15:06,2
They’re the same picture.,Brainrants,2025-05-02T13:03:20,1
"To be fair, most democrats are actually Republicans in policy and democrats in rhetoric and campaign speeches only.",Sarcarean,2025-05-02T14:10:59,0
No,aslan_is_on_the_move,2025-05-03T01:15:59,-1
SPINAL FRACTURES! Damn he is unable to make any sense of a situation. No airbag in front of the back seat passengers..,PoopieButt317,2025-05-02T13:19:12,35
Maybe she was laying down sleeping?,fucksilvershadow,2025-05-02T15:28:20,8
"Have you seen the size of Fetterman? She was in the backseat, but still beside him. He has to remove the front seat and stretch into the back like that dude in Police Academy.",jackleggjr,2025-05-02T13:16:42,11
"Lordy my dad [lost his frontal lobes](https://i.imgur.com/M1em05a.jpeg) in 1979 to cancer. He lived until 2021. He was an absolute sonofabitch because of his brain damage. He was brutally violent, lacking in consciousness, volatile, and impulsive.  We were estranged from 1990 until 2019, then I took over his affairs because everybody else had abandoned him and he was languishing in a nursing home. I didn't cry when he died.",MNWNM,2025-05-02T17:49:42,59
"They become conservative, in other words.",joefred111,2025-05-02T14:18:01,63
"This sounds just like my sister who suffered a stroke when she was 30. Her whole personality changed from very shy and really chill to boisterous and sooo aggressive. She is so, so mean now. It’s like she’s 13 years old again and going through puberty. She also became a LOT more gullible and fell prey to more than one scam. She just has absolutely zero patience, and it can be really hard to remember that it’s not her fault.",Viocansia,2025-05-03T00:58:57,8
It's weird to me that so many people are convinced he was always a wolf in sheep's clothing. Are they saying all the progressives who voted for him were bamboozled? I feel like people are comparing this to a drunk person who says what's *really* on their mind.,VaguelyArtistic,2025-05-02T14:27:28,8
Or that you're seeking a short-term profit from his supporters.,Those_Silly_Ducks,2025-05-02T13:16:59,42
Manchin and Sinema had no brain damage to excuse this.,PatchyWhiskers,2025-05-02T12:49:38,53
at least there were never any pretenses about who Manchin was.,mequetrefe-,2025-05-02T13:30:37,11
"Manchin was holding down one of the reddest states in the country for the Dems, a state that probably won't blue again in the next century. Sinema and Fetterman I'm much less understanding of.",ry8919,2025-05-02T15:24:46,14
I think the real problem is that Republicans have so homogenized they don’t have a liberal faction of swing voters anymore.   The senate 25 years ago regularly had cross party lines votes in both directions on all kinds of issues.   The rightward shift of republicans along with them being 100% uncompromising is a far greater problem than the small conservative faction of democrats.   I still hate it though because those dems run one way then vote another.,RhinoKeepr,2025-05-02T15:16:57,3
Bennet Omalu  planning his next research area as we speak,Lanky-Perspective568,2025-05-02T13:03:26,3
"Wow.  ""You can’t reform a carton of sour milk,” Fetterman told Ben-Ami, according to notes from the meeting, referring to the Palestinians. Fetterman said he did not believe in a two-state solution and claimed he had never met an Arab person who would condemn Hamas. “Correction,” the notes from the meeting stated. “Only a single Arab he has met with that staff was present for wouldn’t outright condemn Hamas.”  Fetterman went on to make statements that shocked people. In opposing a cease-fire, he said, “Let’s get back to killing.” A person who heard the conversation told me, “He said, ‘Kill them all.’” In a statement, Fetterman denied the account, adding, “Any reference to killing was solely about Hamas, and I do support the destruction of that organization, down to its last member.”",Teasturbed,2025-05-03T01:35:22,4
He’s turned into Trump.  Hmm.,Octavia9,2025-05-02T17:05:37,5
"I saw just this excerpt before reading the full article, and I assumed it was about Tr*mp.",beckis_notbecky,2025-05-03T12:14:38,1
"If it's any solace, [he wasn't the only person to leave that kind of stain recently](https://coloradosun.com/2025/05/01/yadira-caraveo-staff-mistreatment-allegations-colorado/).",hunter15991,2025-05-02T13:48:19,5
"It’s sucks but brain injuries do have a lot of complications so unfortunately people should be evaluated. I know it’s hard to deal with stigma, especially for something outside of your control, but unfortunately there is some reason for it in this case. He is not the only example of mental competency effecting a politicians ability to carry out the functions of the job.",DriftingIntoAbstract,2025-05-03T07:39:32,2
"Nah some of the mood changes, paranoia etc are signs of brain damage.",Wide-Pop6050,2025-05-03T09:25:17,1
Not necessarily. My mother had a stroke over twenty years ago and has never been a conservative. Ever. Some people will use a brain injury as an excuse though.,Ohnoherewego13,2025-05-02T14:00:38,1
Everybody has had a drug. Maybe they are just not good enough. They'd cause side effects I'm sure.,takenoprisonersnoshi,2025-05-03T12:54:03,1
"That is a ridiculous comment. Exactly the nonsense you think.yoi are calling others out on. Do better, be.more intellectually discriminating.",PoopieButt317,2025-05-02T13:23:20,-11
"Suffering a stroke and going from popular to disliked seems reasonable. I once had to speak for a family business and your argument holds water. It's the same for a Doctor, or a prison guard.",takenoprisonersnoshi,2025-05-03T12:57:45,1
Criminalize cannabis! Everywhere.,takenoprisonersnoshi,2025-05-03T12:59:32,1
I deal with this kind of behavior all the time. This happened top soon. This could have had cause to his relationship with the world earlier in his life. I've seen it.,takenoprisonersnoshi,2025-05-03T13:33:52,0
I do not believe that is the case here. I see hardship not tribulation. Honesty is reaching the surface.,takenoprisonersnoshi,2025-05-03T13:15:27,0
Then you use a tendency and start a collection taking it as far as possible by using marijuana.,takenoprisonersnoshi,2025-05-03T13:02:47,1
"That is what I'm saying. Who wanted marijuana legal in the first place, and Democrats and Republicans",takenoprisonersnoshi,2025-05-03T13:04:42,0
Blame the bloodthirst(y) on bias.,takenoprisonersnoshi,2025-05-03T13:16:29,1
For someone who preaches cannabis legalization would be sure to take any medications.,takenoprisonersnoshi,2025-05-03T13:22:16,1
Democrats and Republicans are essential,takenoprisonersnoshi,2025-05-03T12:52:25,1
I truly disagree.,takenoprisonersnoshi,2025-05-03T13:01:29,1
"Oz would have obsessed about medical marijuana, not recreational use. Medical marijuana users know the difference. All in moderation except for moderation.",takenoprisonersnoshi,2025-05-03T13:09:14,0
I completely agree.,takenoprisonersnoshi,2025-05-03T13:13:26,1
Shedding skin works like this. It is not trial and error to use the extreme. It's muscle memory that last a life time.,takenoprisonersnoshi,2025-05-03T13:37:35,1
America is a big place with lots of freedom to run to. But the law remains the same everywhere.,takenoprisonersnoshi,2025-05-03T13:11:41,1
And liberalism.,takenoprisonersnoshi,2025-05-03T13:19:34,1
"As a fellow person from the 216, it probably also causes Browns fandom.",Octavia9,2025-05-02T17:06:51,2
Libertarian- because of facts (not a dream).,takenoprisonersnoshi,2025-05-03T13:17:52,1
I believe that you are referring to America. America is the land of the free. It's not the land of the freedom of choice.,takenoprisonersnoshi,2025-05-03T13:39:47,1
It appeared so- frontal lobe dementia. I noticed that the term is broad coming from Reddit.,takenoprisonersnoshi,2025-05-03T13:07:32,1
"If he’s a pudding head, then what was your nickname for Joe Biden? Honestly, the hypocrisy Is astounding.",Heidishiff1020,2025-05-03T10:38:30,-7
Going conservative as they age is a sign that America was wrong.,takenoprisonersnoshi,2025-05-03T13:35:33,1
Fetterman’s stroke might have even been unsurvivable when the constitution was written.,Octavia9,2025-05-02T17:08:19,4
"I have tried to answer your question. This is how I know it. I voted for Donald Trump at the beginning. If he's a criminal so am, I. The both of us should have been lock up. I'm saying it because I'm opinionated. Try giving Americans cognitive tests before becoming American. It should start at birth no matter the upbringing.",takenoprisonersnoshi,2025-05-03T13:43:36,0
"I believe that is what he is saying. Let everybody know that uses to ask for Hydroxyzine, maybe Gabapentin. Idk",takenoprisonersnoshi,2025-05-03T13:06:17,1
No comment.,takenoprisonersnoshi,2025-05-03T13:30:25,1
Shapiro? Is there any relation to Sheriff Arpaio,takenoprisonersnoshi,2025-05-03T13:26:19,0
Strokes will do that to you. They make you look like a Meth Dealer King Pin. He looks kind like marijuana users though. I'm wondering if he'd any cocaine.,takenoprisonersnoshi,2025-05-03T13:29:06,1
"A dude where I work had a small stroke, and was able to come back to work the next week without major deficits. It's actually pretty common for people to have strokes and have full or near-full recoveries.   Since he's had clear personality changes, the stuff about texting while driving is a concern since it indicates he might not have recovered as much as initially presented. So people have new information and are changing their opinions based on it, which is what you're supposed to do when new information comes in.   Consistency itself isn't a virtue, especially if new information gives you reason to change your viewpoint",fleemfleemfleemfleem,2025-05-02T14:52:04,14
It’s so funny to me that it took brain damage for him to become a MAGA shill.,EphEwe2,2025-05-02T14:43:51,6
Pretty bad that he was clearly at fault and the troopers on camera are like “eh we’ll let it slide”,felis_scipio,2025-05-02T14:38:49,1
Maybe if he gets someone killed. He needs charges.,Felon73,2025-05-03T04:49:05,1
We trust our opinion.,takenoprisonersnoshi,2025-05-03T13:23:46,1
It seems that he'd strolled into the darkness- where the grass is greener on the other side- no pun intended.,takenoprisonersnoshi,2025-05-03T13:31:58,0
His entire political stance and general behavior changed after his stroke.  The man has brain damage.,Octavia9,2025-05-02T17:03:58,6
Still better outcome than voting for a Republican or a non-viable third-party candidate.,cabbagery,2025-05-02T13:09:31,15
Wasn't his GOP opponent Dr. Oz?,VanceKelley,2025-05-02T13:18:18,8
Better than Cotton or Tuberville.,PoopieButt317,2025-05-02T13:17:17,3
"Show him calling out bs. I guarantee it’s not bs. I’ll wait.  And we know it’s a foreign concept, holding people in your own party accountable. Youre watching Trump ruin your economy and you just cheer it on.",TheWorkLifeBalance,2025-05-02T18:56:24,1
"> Fetterman got into a car accident, driving home from the airport after an early morning flight well over the 70-mph speed limit on I-70. His wife in the back seat suffered a pulmonary contusion and spinal fractures, and Fetterman told one of his staffers that he had fallen asleep while driving.   From the article.",Any-Ask-5535,2025-05-02T12:29:58,33
I think you don't understand the difference between mental and physical health.,AlarmingBeing8114,2025-05-02T12:31:06,20
"This isn't policy disagreements, it's about reckless and negligent behavior.          >[former chief of staff] Jentleson wrote, adding that “Fetterman was avoiding the recommended regular checkups with his doctors. He also wrote that the senator was driving his car recklessly, often speeding while texting, making FaceTime calls, and reading entire news articles behind the wheel.      .      >One month after the letter, Fetterman got into a car accident, driving home from the airport after an early morning flight well over the 70-mph speed limit on I-70.      .      >In an incident earlier this year, Fetterman was filmed on a flight to Pittsburgh arguing with the pilot about wearing his seat belt correctly.      .      >In another instance in 2023, one of his staffers reported hearing from a journalist that Fetterman had walked into the street and was nearly hit by a car. A short time later, a Senate doctor called Fetterman’s office to report that the senator walked into a group of people and nearly knocked him over near",toby-sux,2025-05-02T12:38:21,20
"Even if I'm breaking your point down in a non-partizan manner; a serious health crisis that involves your brain, thereby changing most of your beliefs overnight, would be a cause for concern.  So obviously, if he recovers and there are 0 traceable psychological changes, then the brain damage is very minor or was mitigated.  So here's a mental exercise for you:  If your guy Trump has a stroke and then comes out the other side, still renaming oceanic basins and talking about invading ally countries. Everything is still tremendous and yuge. You're still comfortable with that, right?  But if he comes out saying that Barack Obama was the best president ever. Hillary is super cool. And admitting his faults... I think you would change your tune pretty quickly.",FartyJizzums,2025-05-02T12:42:05,12
"His mental health issues did not become obvious until after the election. You should read about the marked changes in his behavior and about what really happened during his hospitalization for ""depression."" All you'd have to do is read a bit and your evident confusion about this would clear right up. Do it. Read the article.",ToNoMoCo,2025-05-02T12:39:19,10
"Yeah many Democrats are decent human beings and are going to give somebody a chance to recover. Unfortunately, in this case he's not able to recover. It looks like he's fighting a battle he can't win and he isn't able to be in the office anymore.   It's called compassion. You can try it sometime if you wish.  ""I'm just sitting here on a bench."" -- Fetterman, in a recent video, responding to a woman who was challenging him and trying to be heard.",oldfrancis,2025-05-02T13:14:39,5
He’s an imposing straight white male who dared to look across the aisle.,StillFly100,2025-05-02T12:31:46,-43
There was a lot of outrage. What reality are you from?,GaulzeGaul,2025-05-03T11:06:20,2
"Remember that this guy left his child and went out of his way to chase a black jogger down the street with a shotgun because he ""thought"" (wrongly) he was involved in a crime and Fetterman thought he was the f'ing Punisher or something.   This was before the most recent brain damage. He's always been a weirdo with crackpot violent tendencies.",HPLREH777,2025-05-02T12:47:39,732
"I'm in his district. He was always sketchy. Even before his stroke, he was barely showing up for his job and he has missed the most votes by far of any Senator. He is a do-nothing Senator and that is not what people voted for. His wife is entirely complicit btw. They both did a book tour recently with Republican Senator Dave McCormick, but Fetterman can't find the time to do a town hall. He is toast here, and he knows it. Now he is just looking to see if the Republicans will give him a job in 3 years.",Psychicgoat2,2025-05-02T13:11:10,271
The fact that he’s purchased a firearm recently is terrifying. I hope she does what she needs to do to stay safe.,aliceroyal,2025-05-02T14:03:02,22
"Strokes cause brain injury, but not traumatic brain injury, FYI   > stroke causes a type of brain injury known as a non-traumatic brain injury (nTBI), specifically an acquired brain injury. Unlike traumatic brain injuries (TBIs) caused by external forces, strokes result from internal factors like blocked or burst blood vessels in the brain.  ",RemarkableMouse2,2025-05-02T16:53:21,8
The story reads very much like his wife was a source for it. Cry for help.,JoeBourgeois,2025-05-02T23:36:48,7
"He had a stroke, not a Traumatic Brain Injury (TBI).",crepesandbacon,2025-05-02T17:17:44,3
He graduated from Harvard.,takenoprisonersnoshi,2025-05-03T12:27:14,1
Anyone else think the detail about his wife being in the backseat during the car accident weird?,REOspudwagon,2025-05-02T19:59:21,1
"Dude, whatever your politics are, it's gross to insinuate that he's violent or abusive because he had a stroke.    That kind of statement assassinates your own character more than anything.",SamuelDoctor,2025-05-03T08:23:23,1
"I’m pretty sick of people extending bizarre sympathy to the wives of these terrible people. There is no fucking way in hell I would stick around for this kind of behavior and abuse of power, vows can be broken, it’s called divorce. Everyone tries to do this crap with Melania too.",buggybugoot,2025-05-02T16:13:40,-5
Also assuming she bangs that dude… gross,SleepsNor24,2025-05-02T14:56:59,-6
That's pretty great,MarsupialPristine677,2025-05-02T14:09:12,8
It's quite telling that he got brain damage and then went conservative,btross,2025-05-02T23:34:31,89
"Have had a cousin who had a TBI after a bad mountain accident as a teenager. They have been this odd half-truth of themselves since. One minute it sounds like my best friend as a kid, then it’s scary how conspiratorial / scared / paranoid they turn.  That one dumb accident robbed me and our family and many, many others of an incredible person. And I want to be clear, they still are an incredible person- the passion they have is just as present as it was before. But it’s wildly off the mark more often than not now. It breaks my fucking heart.  Brains are capable of being our worst enemies. Total assholes.",kittencrazedrigatoni,2025-05-02T22:07:33,39
Has your family or friend ever been the senior senator from Pennsylvania?  Edit: forgot PA elected a new senator after Fetterman making him the senior senator.,frink99887,2025-05-02T13:58:14,52
Right for the wrong reasons.  No chance they call for resignation if he was one of their own,Churrasco_fan,2025-05-02T13:32:50,259
Now they love him,SunnyCali12,2025-05-02T13:43:13,39
"They just wanted oz to win, they had no concerns about his actual health",gramathy,2025-05-02T16:00:15,13
Funny how they are silent now.  If this were Sanders or Warren they would be screaming about this,Yougotanyofthat,2025-05-02T15:20:16,6
"I'm not a Republican and I kept arguing that he should drop out of the race after his stroke. And /r/politics almost universally said that I was being ""ableist"" and that he's fine, that his brain still works he just has some problems speaking.  The dude's brain was clearly scrambled.",mediocre_remnants,2025-05-02T18:24:02,2
Biden did step aside.,dukefan15,2025-05-02T13:18:42,52
"Everyone's party's thirst for power supersedes what is right and inevitably will not risk their influence to do so.  The Dems have a bigger problem because it is seemingly so much more difficult to onboard successors, much due to the DNC's old guard but partly because progressive voters are so much more nuanced in their beliefs and many demand absolute alignment with their own beliefs (see opinions on Palestine). In contrast, any Republican speaking or voting out of line can be instantly replaced by the next grifter who has no problem following the script and checklists.",superbum42,2025-05-02T13:31:15,1
Can’t disagree with you on this one at all.,DriftingIntoAbstract,2025-05-03T07:30:47,1
"We kicked out Al Franken and he should have stayed.We need an age limit, term limits and cognitive evaluations by impartial professionals.",NoGrocery3582,2025-05-02T16:05:57,1
"Hey, Ron Wyden just announced his intentions to be a senator into his 90s. Don't try and discourage that! /s",Sarcarean,2025-05-02T14:12:56,0
Has anyone ever had an older relative get a stroke or dementia and suddenly become really left-wing?,PatchyWhiskers,2025-05-02T12:44:07,148
I see what you did there. Bravo 👏,jrfinny,2025-05-02T18:23:49,1
"Stroke causes large parts of the brain to die off from lack of oxygen, conservatism then follows.",RabidGuineaPig007,2025-05-02T12:38:21,53
"Yes actually, in more conservative brains the amygdala — centre of fear response — has greater influence compared to more progressive people.  When the amygdala is in control, the brain acts out of fear while the higher reasoning circuits in our prefrontal cortex activate less. ",SpiritedEclair,2025-05-02T12:33:27,58
"After her stroke, Sharon Stone and her then-husband said that her personality changed, and they still loved each other, but were no longer compatible.  It can and has happened before.",Sahasrlyeh,2025-05-02T12:41:37,13
Conservative brains do show lower neural activity in regions associated with empathy. Conservative brains have a diminished capacity to feel empathy to those outside of their immediate circle.  Several studies have supported these findings.,frink99887,2025-05-02T14:00:17,10
People who get more activation in the fear responses trend towards being conservative,BODYBUTCHER,2025-05-02T13:28:12,6
I’ve heard that studies have found the fear center of the brain is more pronounced in conservatives.,SunnyCali12,2025-05-02T13:40:59,7
"In Denmark and Sweden there was this really great pro-immigration lawyer, worked his ass off for asylum cases and what not.  Then he fell on a skiing trip and hit his head, pretty badly. Now he's famous for setting fire to Qurans and starting a political party that is do anti Muslim and anti immigration it even makes some skinheads blush.",The-red-Dane,2025-05-03T01:28:00,1
"Indeed I remember.. ultimately though it is about being professional. I go to work, I do my job well, I get compensated for it, I abide by my contract and workplace’s rules and standards.  If he was a maverick he should have been when it comes to legislation and what he stands for. Turns out the maverick is just a Rick, or even better a Richard. ",SpiritedEclair,2025-05-02T15:18:24,3
This shocked me too. I didn’t know about the accident and damn she had to be in a lot of pain!,DriftingIntoAbstract,2025-05-03T07:32:48,1
I'm sorry you went through that.,hahaheeheehoho,2025-05-02T20:57:23,10
Bingo,jrfinny,2025-05-02T18:25:04,11
he had a huge hero complex before his stroke. I donated a bit to him and regret it. There isnt anything wrong with admitting you screwed up and could have made better decisions with the information available at the time,fordat1,2025-05-02T21:50:00,8
"People talk a big game about mental health being real. But when someone with mental problems (as fetterman post stroke almost certainly has) exhibits symptoms they are treated as if the expression of those systems is a personal and moral failing.     people 'know' someone has mental problems, yet expect them to behave as if they do not.  ",Bluearctic,2025-05-03T04:23:19,3
They've done studies about people who prefer short term to long term gain.  Guess which group was more cognitively deficient?,JrYo15,2025-05-02T13:42:55,18
Right? They just wanted to make a buck. Fetterman is literally just messed in the noggin',southernfirefly13,2025-05-02T12:55:05,16
