Comment,Author,Date,Score"Technically true. Although it would also be true to state that Manchin's seat was held by a Democrat for 66 years straight and that West Virginia was perhaps the bluest state of the 20th century, going for Democrats even in the landslide elections of '80 and '88 and having the highest union membership per capita of any state in the country. It would also be true to say that current Republican Senator Jim Justice was elected governor as a Democrat.  This isn't all Manchin's fault, of course, but it speaks to the larger issue of diminishing blue-collar support for Democrats nationwide.",Different-Gas5704,2025-05-02T15:35:45,8
"unpopular opinion but you shouldnt be in office for the healthcare or while dealing with serious issues. We have a population of how many and not everything needs to ""be represented"" in Congress",fordat1,2025-05-02T21:56:40,6
"This entire subreddit has devolved into attacks against the disabled.   The NYMag report on Fetterman has opened my eyes to what my fellow ""progressives"" think about people with brain injuries and mental-health issues.  I have learned that the left doesn't think I'm suited to lead, to run for office, or to make my own medical decisions.  And I have seen from them what I have seen from *many others,* that they will use medical issues as a bludgeon to silence the disabled and to ensure that they remain powerless.  I do not like Fetterman. I do not like his policies. I do not think he has comported himself in a way that deserves public approval.  But I also will not blame his health problems for that, or insinuate that he is medically unfit.  He is ethically and morally unfit. And that's what really matters.",Gleemonex4Pets,2025-05-02T13:32:54,-3
Lol clown comment,logjammn,2025-05-03T16:51:47,1
"Republicans are essential for the rich to get richer, so if that is the goal then you have a fair point.",ByWillAlone,2025-05-03T13:30:04,1
He wants to say that he knew this was coming.,takenoprisonersnoshi,2025-05-03T13:10:00,1
Turning Republican would be the only thing to do.,takenoprisonersnoshi,2025-05-03T13:12:53,1
So my browns fandom isn’t my fault! 😂,CLE_browns_optimist,2025-05-02T17:08:45,1
Close down Brown Town.,takenoprisonersnoshi,2025-05-03T13:18:56,1
I didn’t have a name for Biden. I voted for him. I voted for Harris. It was a joke. But let me know the next time you wanna climb up on your cross. In case you need help being nailed to it. Honestly go have a sandwich.,CardinalMcGee,2025-05-03T11:24:45,2
"The governor of Pennsylvania, and no, what on earth are you talking about.",flaaaacid,2025-05-03T14:31:27,1
I just find it funny how things flip. Republican Ideologues were pounding the table that the guys unfit and the Dem machine was protecting him. A couple years later it flipped and no one bats an eye. If he was still a rubber stamp this wouldn’t be an issue.,Unique-Wasabi3613,2025-05-02T14:54:48,-11
What do you think they should have done?,manfromfuture,2025-05-02T15:33:12,1
"I don’t agree with a lot of his votes but when he explains the votes, his answers have overall been thoughtful, not unhinged.",LLMBS,2025-05-02T17:08:17,-3
"Facts, while I think fetterman is a dud he’s still 10 times better than a gop member that will roll over and expose their gut to be slashed by the knife that is Trump.",a_rabid_buffalo,2025-05-02T13:16:27,8
[deleted],[deleted],2025-05-02T13:19:08,-6
He was actually staring blankly into space.,ToNoMoCo,2025-05-02T12:39:50,14
"I remember getting downvoted into oblivion and being called a conservative troll for bringing up this specific fucking incident in local Philly and PA subs back when he was running for senate (during the primaries.  People seem to forget that just because you are pro-weed legalization doesn’t mean you aren’t problematic.   He has always had this weird ‘enlightened centrist’ bit, and had a massive fucking ego to boot. Guy always thought he was the only person in the room, and had a heroism fetish. Well before his stroke he would regularly talk about how he single-handedly saved the small town he was mayor of and take credit for initiatives he led (like, for example, the weed legalization initiative in PA) that, while exciting, had very little actual impact.  As someone who has worked in local government, I can stiffen out shit like this. Grandiose claims about “saving” their town as mayor are huge red flags. Anyone who knows anything about local politics knows that while a mayor can be part of the success of a town’s turnaround, they will never be the reason for it, and a mayor going around like that is almost always a sign that you might want to start sniffing out the truth.",Sitting-on-Toilet,2025-05-02T19:37:09,125
This. The stroke may not have helped but he was always shitty if you looked into his history close enough,AwkwardTraffic,2025-05-02T15:20:20,208
i think the stroke was just his excuse to stop pretending to be a democrat,dqql,2025-05-02T16:12:45,23
I say that happened in New York.,takenoprisonersnoshi,2025-05-03T12:28:19,1
"His “district” is the entire state of PA, and he had the stroke during the senate campaign. That happened before he took office. I’m doubting that he runs again as Lamb is gearing up for another shot, which he hopefully wins.",Steve-Dunne,2025-05-02T13:40:45,138
I’ve heard the same about him from friends in PA. They weren’t happy w him before the stroke.,SunnyCali12,2025-05-02T13:38:15,39
He frequently shows up as an example in diversity training about why you shouldn't judge someone by appearance. His recent behavior is really undercutting that message.,Isekaimerican,2025-05-02T14:40:19,22
">that is not what people voted for.  I thought they voted to keep Mehmet ""Crudités"" Oz out of the Senate. I understand being disappointed with Fetterman, but he's still better than the alternative.",vthemechanicv,2025-05-02T15:57:28,25
"I wouldn't characterize her as complicit. In the full nymag article there's some quotes from staffers showing her as pretty exasperated with her husband's behavior. She also released a statement kinda debunking those quotes, but the journalist stood by their source and included them anyway. Considering her previous status as an undocumented immigrant and the Trump's talk about denaturalizing citizens calling her a hostage in her marriage might not be a stretch.",ordermaster,2025-05-02T14:16:57,30
"Correct. He was always a dick going back to his earliest days in local politics.    I’ve been screaming for 6 months that they should be working 24x7 to find his successor.  He’s on the Kirsten Sinema/Tulsi Gabbard fake Democrat bullet train.  There’s a few things that sometimes help win elections, and sometimes don’t matter.  But the one thing that gives the best odds is when you have extremely high candidate quality.  It’s how the Dems have certain people elected in places like Georgia and Nevada and Arizona.",AntoniaFauci,2025-05-03T01:47:18,6
Am I just imagining him being a darling of the party and everyone falling over each other to sing his praises for a hot minute?,spacehog1985,2025-05-02T16:45:26,1
She was in the back seat of the car he wrecked going over 70mph. T he article states she broke her spine.    I hope she is safe. ,tossaway78701,2025-05-03T00:04:51,11
"You know when you get frustrated at a video game, so you set the controller down and you take a walk? Imagine if you lost the very brain circuitry that told you to do that. Brain injuries can absolutely make people give in to angry impulses than they would’ve resisted previously.  https://www.stroke.org.uk/stroke/effects/emotional/changes-to-behaviour",gringledoom,2025-05-03T08:40:10,3
"I dunno, this one feel more like an ""in sickness and in health"" issue to me. The guy's brain literally doesn't work the same as it used to, in a way that's very scary to a lot of people who were accustomed to his previous level of ""being an abrasive jerk"".  (I do agree that in the interest in her physical safety, she would be wise not to stay with him.)",gringledoom,2025-05-02T16:16:40,10
"I have a sister who had a seizure disorder, brain surgery to correct it, quit drinking abruptly, then  went into a massive manic episode which ended in her being hospitalized involuntarily for a month. She isn’t quite the sister I knew anymore and it’s so heartbreaking and hard. I’m so happy and proud she is coming out the other side and doing her best to take care of herself, and I love her tremendously, but I’m so very sad that this particular relationship, which was incredibly important to me, is now forever changed.",suze_jacooz,2025-05-03T08:10:53,2
"He’s the senior senator from Pennsylvania, Dave McCormick is the junior senator as this is his first year in the senate.",Goddamnpassword,2025-05-02T14:11:46,6
"The issue is that he isn't a good leader. *Not that he has medical issues.* The fact that you and many others can't see the difference is, quite honestly, sad.",Gleemonex4Pets,2025-05-02T14:01:28,-23
> No chance they call for resignation if he was one of their own  Well they clearly love useful idiots,Catch_22_,2025-05-02T15:48:18,30
Look at Herschel Walker. How the fuck anybody calls themselves a Republican when that literal psychopath ran for Senate is beyond me.,WillemDafoesHugeCock,2025-05-02T21:08:08,22
"Not entirely- he runs his mouth for attention but votes with Dems a huge percentage of the time. He's certainly bettern than Manchin, Sinema, and about a half dozen others.",Any_Will_86,2025-05-02T15:50:54,15
And now you hate him.,Top_Key404,2025-05-02T16:42:35,-8
"Months too late being generous, though.   Reelection shouldn't have even been a consideration. The timing kinda fucked us over since we couldn't really do a proper primary, and the gamble with just pushing Kamala ended up failing.   Not trying to pin our current situation entirely on this, but it certainly didn't help.",koolaidman486,2025-05-02T14:16:20,106
If he had stepped aside before the primary we would have had a real primary and a real chance.,LawGroundbreaking221,2025-05-02T13:32:45,36
"I read that Bidens people actually had him pursue at cognitive test which he did well on. But I also have known people his age and once you hit 80 coming back from the flu or even have a couple of bad nights sleep throws them so much more than even a 60 year old. Who you get can be day to day. Unfortunately, they did a crap job planning his schedule ahead of the first debate so he showed up jet lagged, tired and fighting off a sickness. I'm nervous about holding the seats but am fairly grateful that Durbin, Sheeheen, Smith, and Peters all decided to call it a day while still in good form. Sheheen even mentioned in an interview how painful it was to watch Feinstein's decline.",Any_Will_86,2025-05-02T15:55:42,3
Not soon enough. He said he would be a 1 term president and blew up our chances with that disastrous debate.,gouramiracerealist,2025-05-02T13:23:29,16
Sadly not before his brain malfunctioned to an undeniable degree on live television in front of 80 million people,rollin20s,2025-05-02T13:23:46,10
At the 11th hour after working tirelessly to do nothing to stop Israel and nothing to stop trump,Satanarchrist,2025-05-02T13:25:52,4
More like forced out after throwing a month's long tantrum and leaving us without any time to hold a proper primary.  That would be the same as RBG stepping aside by retiring after the 2014 midterms.,Overton_Glazier,2025-05-02T15:04:15,2
Biden should have said he's a transitional president from the start.  It's insane that wasn't the plan.,HNL2BOS,2025-05-02T20:24:38,1
Only because he realized he'd run out of money.  He's made it very clear he believes he should have remained the candidate,siphillis,2025-05-02T23:58:38,1
No but George Wallace did a complete 180 on segregation and civil rights for black people after getting shot,420_E-SportsMasta,2025-05-02T12:47:37,183
"Had a distant cousin with dementia. Prior she was a bit of a sour, very devout catholic who made sure that her gay son knew she loved him, even though she was very sad she wouldn't see him in heaven.   Once the dementia really set it, she was absolutely the kindest, loveliest person I'd ever met. She simply could not say enough nice things about everyone in the room. Later, when she couldn't remember her husband of 40 years, she would say, ""isn't he the nicest man? I don't know who he is, but he takes such good care of me.""   Heartbreaking disease, but I'm glad I got to meet that version of her.",chicklette,2025-05-02T14:12:15,40
I think that only happens after they do shrooms.,orionrose,2025-05-02T13:17:39,10
Sounds like the plot of Regarding Henry.,Thirty_Helens_Agree,2025-05-02T12:47:05,7
"So many people I know find this. Dementia makes the Right seem reasonable, and in a complex world where different perspectives are being heard, their injured brains are drawn towards the simplistic. That's why the right loves to use ""verb the noun"" slogans like ""axe the tax,"" it's pablum for the demented, brain injured and cognitively impaired.",Strange_Depth_5732,2025-05-02T17:56:09,2
"My mom had dementia. She was a BIG Republican, she even flew to DC some years after Dad had passed in 2002 to attend a Newt Gingrich fundraiser and had a seat close up front.  Even after the dementia really started kicking in, she was Republican.   She never liked Trump though. She said he boosted her investments, but he was trash otherwise.",pedantic_dullard,2025-05-03T07:31:14,1
"I had NO idea she had a stroke. Looked it up, apparently while she was recovering she had 18 million dollars stolen from her as well. Wow.",outinthecountry66,2025-05-02T12:47:58,15
I mean it was pretty easy to vote against Lamb and even easier to vote against Oz. I dont view it as a screw up or that I made a bad decision. His opponents were pretty shit and didnt even pretend to align with my values,ForceItDeeper,2025-05-04T03:42:38,1
"That's a hard distinction to make, though. A person in survival mode will likely make a different choice compared to someone else that isn't in survival mode.",Those_Silly_Ducks,2025-05-02T20:42:45,2
"I mean, he's still making a buck. he has no problem accepting aipac money.",mvfrostsmypie,2025-05-02T14:15:51,2
"It is so funny to me the twists and turns of politics:  When Fetterman couldn’t form a sentence or comprehend briefings dems were like “he’s fine, he’s our guy, nothing wrong!”     Now he is no longer a rubber stamp for the party and he starts supporting some Trump policies and suddenly “this guy is dangerous, not thinking clearly and  unfit for office.”      I don’t have a horse in the race, but I did think he should have been forced out after the stroke, but for heavens sake be consistent not just when it is convenient.",Unique-Wasabi3613,2025-05-02T14:46:06,-6
they got screwed by third way'ism of Clinton,fordat1,2025-05-02T21:52:19,3
"I agree, you are representing the people that elected you so if you can’t do the job, you need to take leave. I’ve dealt with this is regular workplaces where people won’t take leave and won’t give up their assignment and it really impacted projects. I feel so much sympathy for those people because leave in US is a scary thing and I totally understand why they don’t want to take it. But it doesn’t change the reality of the fact that things are getting done. In a job, you can usually muddle through and make it work but something as important as government, I’m not sure that’s the best course or fair to the people that elected them to represent them.",DriftingIntoAbstract,2025-05-03T07:43:53,1
"Nope.  And if you have someone to blame for a head injury that made you a Browns fan, You Know Who to Call.",Octavia9,2025-05-02T17:10:38,2
"It doesn't seem like you're actually responding to what I wrote, just making your same point again?",fleemfleemfleemfleem,2025-05-02T15:17:02,13
Given him a ticket for reckless driving because without proof the car in front was doing something stupid the rear car is always the one at fault.,felis_scipio,2025-05-02T17:44:17,2
They are weird and rambling.  Kind of like Trump.,Octavia9,2025-05-02T17:08:54,5
[deleted],[deleted],2025-05-02T13:17:46,-4
"When the choice is shit and shit-lite, isn't shit-lite the better choice?",VanceKelley,2025-05-02T13:20:58,6
"I remember all that shit and it made me side eye him, but at the same time the left gets accused of gatekeeping and purity testing  and I think we just...Trusted him.     Big mistake.  Sometimes it's hard to tell when they are going to have a stroke or are just lying the whole time!",Carnivelle,2025-05-02T23:51:04,23
"Fetterman's behavior is pretty typical for somebody who's only political issue is Weed. Because they lack any sort of compass besides weed, they're willing to be the worst kind of opportunist scumbag as long as they advance the weed agenda.  I've had weed dudes argue for private prisons and mandatory military service because it would advance legalization somehow.",Karlend41,2025-05-03T00:11:08,26
">Grandiose claims about “saving” their town as mayor are huge red flags. Anyone who knows anything about local politics knows that while a mayor can be part of the success of a town’s turnaround, they will never be the reason for it, and a mayor going around like that is almost always a sign that you might want to start sniffing out the truth.  Watch out . That is dangerously close to disparaging ""mayor"" Pete /s",fordat1,2025-05-02T21:40:29,8
"As someone who lives in NY, he had some good press where he came off as a cool dude for the people. I read an interview with him where they talked about the town and he seemed level headed and credited everyone coming together. Strokes remove your filter for many so it makes sense that now his true colors are showing loud and proud rather than it being a full change in ideology.",DriftingIntoAbstract,2025-05-03T07:18:18,2
"I too remember him thumping his chest on Bill Maher or at Tedx about saving Braddock. Which, yes, its incredibly poor but it's also a bizarre anachronism of PA municipalities. It's only a half square mile big!",timmyintransit,2025-05-03T07:35:28,2
"> As someone who has worked in local government, I can stiffen out shit like this  If you want to keep working in local government, you better keep that shit in your pants. Or not. I dont think anything matters anymore. I just wanted to make a dick joke.",yarash,2025-05-03T10:11:23,1
Pennsylvania has not legalized any form of marijuana.,takenoprisonersnoshi,2025-05-03T12:31:03,1
Or maybe he was having small strokes all along?,Partigirl,2025-05-02T15:27:04,92
"Hopeful that Lamb gets traction, he's a good model of what can work for rural and swing state Democrats.",SpezIsALittleBitch,2025-05-02T14:12:35,45
I am still flabbergasted Fetterman was able to sell himself as soem miraculous lefty and get all the support/$/Energy from people lashing out at establishment. He greatly underperformed the other Ds in Pa in 2022 and we are lucky he won. But it was bizarre just how strident people were about getting him as opposed to Lamb who was more moderate by a very consistent Dem.,Any_Will_86,2025-05-02T15:48:06,16
"Hi, PA resident here. He was the Lt. Governor and the mayor of a small, down-and-out town before that, so he didn't really have that many responsibilities to affect Pennsylvanians before becoming a Senator. To me he stood out as Lt. Governor by flying an LGBTQ & cannabis flag off of his office balcony at the capital. He was kind of progressive... at least for a Pennsylvanian politician that got into a position serving all Pennsylvanian's. And ""mostly progressive"" is how he ran his Senate campaign.   That was all before the stroke & his win. He seriously sucks now.",aspirationless_photo,2025-05-02T13:59:37,62
You mean Mehmet “Wegner's” Oz?,crepesandbacon,2025-05-02T17:22:24,10
"Fetterman ran to the “left” of Connor Lamb, a moderate-left dem, in the primaries. When people say that, I would imagine that they are saying they voted for Fetterman over Lamb, not Fetterman over Oz, because Fetterman came across as being more progressive (though I say ‘came across as’ purposefully, because it wasn’t exactly hidden that he wasn’t nearly as liberal as the platform he was running on or the image he had carefully sculpted of himself).",Sitting-on-Toilet,2025-05-02T19:51:34,2
"Yeah, there's a real pathology, and there are people who do have these symptoms as a result of brain injury.    That's not what I'm taking issue with; despite the fact that it's possible that anyone who has a stroke can develop this kind of issue, it's not the case that every person who suffers a traumatic brain injury will have this specific problem.  It's gross to insinuate that JF is violent or abusive in such a speculative, unsupported way.  It's also stigmatizing and shitty for everyone else who has a TBI to suggest that because some presentation is possible, it is also plausible and likely.  That thinking is a century old, unscientific, and prejudiced.",SamuelDoctor,2025-05-03T08:50:44,1
"If homie is capable of being a senator, he's capable of being responsible for his own behavior.",ribosometronome,2025-05-02T20:54:20,3
"I guess it’s a grey area, but this is who he is now. I don’t think he’s “coming back” from this.",buggybugoot,2025-05-02T16:20:02,2
"Why not both?  It's also not like he's ever going to step down as senator, unless maybe stroke number 2 comes by to finish the job.",frink99887,2025-05-02T14:04:15,21
It sure sounds like the medical issues are impacting his ability to be a leader. If he wants his medical issues to be private he shouldn't be a senator.,Ganon_Cubana,2025-05-02T14:12:04,20
You don’t think medical issues can impact job performance?,Prior_Coyote_4376,2025-05-02T16:29:15,8
Honestly if Fetterman was senile and just did whatever his staffers told him to that would be much much better than this,Wide-Pop6050,2025-05-03T09:23:44,2
And that election went to a runoff too. I lived in Georgia at the time and even though I’m not from there I felt embarrassed seeing that.,Peroovian,2025-05-02T22:29:32,12
"I don't hate him, I'm worried about him and think he needs to step back and take care of his health. The Senate is too high risk to have someone clearly in mental decline and suffering from bouts of instability having a seat. That shit has real impact on real lives and with the Senate so close one vote can have drastic impacts on tens of millions of people.",Deep-Friendship3181,2025-05-02T17:27:05,12
"Biden 100% should have stepped aside sooner and that absolutely had an impact on Kamala's chances.  When he won I thought there was no way he'd run for a second term. When he did run, and later stepped aside, I knew the battle was lost – there were some glimmers of hope here and there, but Kamala did not have time to mount any semblance of a successful campaign.",jgilla2012,2025-05-02T17:11:36,26
Perhaps. But the incumbency is a real studied and proven advantage. What really killed us was the democrats and people on the left being so willing to pull the knives out as soon as Biden showed any vulnerability. Instead of circling the wagons like the GOP does they allowed the party to tear itself apart over one bad showing. That election was never going to be about mental competency(as proven by trumps re election),dukefan15,2025-05-02T13:39:27,7
He never said he would be a 1 term president.,dukefan15,2025-05-02T13:32:15,9
Brain malfunction didn't seem to hinder Trump's chances.,tigojones,2025-05-02T13:42:48,14
His brain had been malfunctioning at least 6 months before. But democrats and the White House were doing everything they could to dispell those rumors by claiming it was fake news or deep fakes. It only took 10 minutes of a live broadcast to blow that up.,Sarcarean,2025-05-02T14:18:37,9
"It was a perfect storm of Biden already starting to have ""bad days"" coupled with an exhausting travel schedule and very little prep.  He very likely had some kind of panic attack out there, and it's partly on his staffers for ensuring he looked as awful as possible",siphillis,2025-05-02T23:59:54,1
Oh no Biden didn’t become a tyrant to stop a tyrant! JFC. The apathy of the American people is what empowered Trump. No one else.,dukefan15,2025-05-02T13:35:48,1
If folks on the left would have circled the wagons he would have been more competitive than Kamala. The attacks on him from all sides did more damage than those 80 minutes,dukefan15,2025-05-02T15:30:42,1
Intentionally become a lame duck president that inhibits his ability to get legislation passed?,dukefan15,2025-05-02T21:15:21,0
What were Dems gonna do? Not fund trumps opponent lol,dukefan15,2025-05-03T00:16:59,1
Didn’t he actually become a major proponent of civil rights?,TheCommonGround1,2025-05-02T13:05:26,37
Good example!,PatchyWhiskers,2025-05-02T12:51:58,38
I actually was never taught that. Which tracks since I had a conservative homeschooled background where I was taught that all he wanted was for things to be “fair” for the “white people”. Had no clue he changed his tune until years later.,SunnyCali12,2025-05-02T13:39:35,11
Upvote for correct usage of 180,unfortunatehatsize,2025-05-02T13:22:52,14
Hmm.,EliteEinhorn,2025-05-02T13:16:10,4
"He was like, “oh shit, gonna meet God earlier than planned.”",pomonamike,2025-05-02T13:17:14,5
"But guess who didn't turn 180? House Maj Leader Steve Scalise. Doubled down on his 2nd amendment MAGA stances. Brain injury before the bodily injury, i guess.",warpcoil,2025-05-02T19:57:50,1
Ah that’s nice to see it go the other way sometimes,PatchyWhiskers,2025-05-02T14:16:10,12
