Comment,Author,Date,Score
" As a reminder, this subreddit [is for civil discussion.](/r/politics/wiki/index#wiki_be_civil)  In general, be courteous to others. Debate/discuss/argue the merits of ideas, don't attack people. Personal insults, shill or troll accusations, hate speech, any suggestion or support of harm, violence, or death, and other rule violations can result in a permanent ban.   If you see comments in violation of our rules, please report them.   For those who have questions regarding any media outlets being posted on this subreddit, please click [here](https://www.reddit.com/r/politics/wiki/approveddomainslist) to review our details as to our approved domains list and outlet criteria.    We are actively looking for new moderators.  If you have any interest in helping to make this subreddit a place for quality discussion, please fill out [this form](https://docs.google.com/forms/d/1y2swHD0KXFhStGFjW6k54r9iuMjzcFqDIVwuvdLBjSA).    ***   *I am a bot, and this action was performed automatically. Please [contact the moderators of this subreddit](/message/compose/?to=/r/politics) if you have any questions or concerns.*",AutoModerator,2025-05-02T12:18:42,1
He was supposed to be our Shrek but he ended up being Fat Bastard.,Casual_hex_,2025-05-02T12:37:07,3608
This is disturbing but as a retired RN I’m not surprised. So many negative after effects from brain injury are only seen by the family and those closest to the affected person. It rings true to me reading it. I don’t think this is a case of disgruntled staffers. It’s tragic. I donated money and voted for him. If true it is gutting for his family and all of us that supported John.,timbrelyn,2025-05-02T12:44:10,910
He needs to go. He is actively harming the democratic cause by staying,oupheking,2025-05-02T12:44:36,596
If anyone actually has bothered to read the reporting on this it is /really/ bad and goes way beyond politics.,OrnamentJones,2025-05-02T13:39:17,99
Didn’t he get brain damage and turn republican? ,SpiritedEclair,2025-05-02T12:22:19,969
">> One month after the letter, Fetterman got into a car accident, driving home from the airport after an early morning flight well over the 70-mph speed limit on I-70. His wife in the back seat suffered a pulmonary contusion and spinal fractures,  In the back seat? That’s….odd.",SheibeForBrains,2025-05-02T12:52:13,115
"Facts: Many people with frontal lobe dementia and many styles of strokes do indeed become aggressive, show lack of empathy, lack of critical thinking, and exhibit narcissistic behavior.",Lazy-Abalone-6132,2025-05-02T14:01:20,149
Supporting Trump is a good indicator that your mental health is declining.,reddittorbrigade,2025-05-02T12:23:21,255
"As a PA voter, Fetterman's biggest selling point was that he was not Mehmet Oz.",Aggressive_Ad3174,2025-05-02T14:48:47,38
Fetterman and Slotkin are the new Manchin and Sinema.,Different-Gas5704,2025-05-02T12:28:15,125
"""Disgruntled staffers""....lmao.   Amazing how all of the worst people in Washington are always the ""victims"" of disgruntled staffers.   Just like with Nancy Mace. Anyone wanting to work for Nancy Mace is already awful by default, imagine how terrible she is to actually drive the kind of despicable vomits that work for her over the edge.   This brain damaged goon is on the same path and he'll see these stories coming out as just another crackpot ""conspiracy"" against him.",HPLREH777,2025-05-02T12:41:43,65
His brain broke.,Tails6666,2025-05-02T12:48:03,29
Sounds like he was in a good treatment plan and abandoned it. Fucking shame.,GreenAnder,2025-05-02T13:43:17,9
"https://archive.ph/2025.05.02-125500/https://nymag.com/intelligencer/article/john-fetterman-struggle-mental-health-clinical-depression.html  >“We often see the kind of warning signs we discussed,” Jentleson wrote. “Conspiratorial thinking; megalomania (for example, he claims to be the most knowledgeable source on Israel and Gaza around but his sources are just what he reads in the news — he declines most briefings and never reads memos); high highs and low lows; long, rambling, repetitive and self centered monologues; lying in ways that are painfully, awkwardly obvious to everyone in the room.”",ScissrMeTimbrs,2025-05-02T16:07:10,19
What a dud this guy turned out to be,chairman-me0w,2025-05-02T14:32:06,8
"I hate that he didn't pan out to be the candidate people wanted him to be but I hate more the stain he is going to leave for people with depression, disabilities and or brain injuries serving in government in the future.",clutch727,2025-05-02T13:46:12,24
This explains a lot.,sane_sober61,2025-05-02T12:32:51,6
His term isn't up until 2028 but now's a good time to find candidates to primary him.,atreeismissing,2025-05-02T13:19:53,7
"I hate fetterman and always have, but it’s hard to tell from just these incidents if his brain is cooked or if he’s just an asshole. One thing I worry about is driving him into Trump’s camp if the Dems try to force him out though.",airbear13,2025-05-02T22:34:21,7
"What normal people aready knew...brain damage, whether it's CTE, a stroke, worm eating brains, etc... is synonymous with conservatism, Republicanism, MAGAism.",HPLREH777,2025-05-02T12:31:45,49
So brain damage leads to conservative thinking. Gotcha.,AbnoxiousRhinocerous,2025-05-02T22:27:57,12
This explains his turn to the right.,MorningGlory439,2025-05-02T13:12:40,5
"This is really sad. I was hopeful that Fetterman would be a great new and unique voice for the dems and progressive values but it seems like that is not the case. The people of Pennsylvania deserve a Senator in full control of their faculties. This whole thing is really tragic and I hope Fetterman can be pressured to step down without too much drama.   Besides, having a new election in Pennsylvania would be good for the democrats to cut their teeth on a post Trump 2.0 high profile race. Test out messaging in a swing state etc. This environment should be beneficial to dems as well since they tend to perform better in off year/ special elections now than republicans.",KindaStableGenius,2025-05-02T13:39:53,5
Imagine suffering a stroke and the result is going from popular to disliked,BobLonghorn,2025-05-02T17:43:55,6
Public officials should be required to be more transparent with their health and wellbeing. It’s been very clear that the stroke has effected his mental state and hearing that he is not adhering to the doctors recovery regime should be extremely alarming to everyone who cares especially the people of PA.,Healthy_Jackfruit_88,2025-05-03T00:56:55,6
">is unrecognizable to his past and present staff, prone to “conspiratorial thinking” and “megalomania.”  These are valued qualities by about half of the American voters.",HabitantDLT,2025-05-02T13:27:48,8
"I will forever blame the stroke for taking from us what could have been an amazing figure in the party.  My Dad had a stroke and is similarly still functional at first glance except he has a lowered emotional threshold.  He can't deal with bad news or sometimes reality in general. He used to be the chillest guy, too.",SFShinigami,2025-05-02T18:30:00,10
"It’s very unfortunate but I think regardless if he’s acting conservative or if he has kept his progressive promises, I think he deserved a chance at recovery but we now need open and honest medical records and an assessment and removal from office if reporting is confirmed.",clowncarl,2025-05-02T12:59:30,8
Pennsylvania really let us all down last year,Kitakitakita,2025-05-02T17:18:30,4
His brain is rapidly deteriorating. He should probably go into a care home before someone gets really hurt. He is a very big man whose uncontrolled rage is a danger to those around hoping. Send trump into lock up next. He’s poses a different kind of danger but we need to protect society.,Nyingjepekar,2025-05-03T10:06:46,4
When you get a TBI it literally changes your brain. You can develop a different personality and suffer from memory problems.,momob3rry,2025-05-02T13:11:16,5
"I love Fetterman. He’s the one who admitted out loud that if you sustain enough brain damage, Republican points of view begin to make sense.",LamentableCroissant,2025-05-03T02:48:16,9
It’s really sad honestly. He had so much promise.,kummer5peck,2025-05-02T13:30:47,3
We could have had Connor Lamb but people are obsessed with the dumbest vibes.,MiracleMan1989,2025-05-02T14:19:29,3
"Went here and sorted by age: https://en.wikipedia.org/wiki/List_of_current_United_States_senators the good-ish news is there are 23 senators younger than fetterman. The bad news is that list includes the absolute worst of them: Cotton, Hawley, and Ted fkn Cruz!",DrSixSmith,2025-05-02T14:53:12,3
How can the electable pool be so full of shit,logjammn,2025-05-02T14:59:53,3
"I never thought about his fall being a medical condition. I thought it was more of his ""true"" self showing through, but maybe not.",ratpH1nk,2025-05-02T16:40:35,3
Well that explains his weird bloodthirsty push to bomb Iran...,MaverickTopGun,2025-05-02T13:33:55,5
">New York magazine reports that Fetterman, who suffered a stroke in 2022 one month before being elected to the Senate, is unrecognizable to his past and present staff, prone to “conspiratorial thinking” and “megalomania.” His former chief of staff, Adam Jentleson, wrote his concerns in a May 2024 letter to Dr. David Williamson, the neuropsychiatrist who oversaw Fetterman’s treatment at Walter Reed Army Hospital in Washington, D.C.   >“We do not know if he is taking his meds and his behavior frequently suggests he is not,” Jentleson wrote, adding that Fetterman was avoiding the recommended regular checkups with his doctors. He also wrote that the senator was driving his car recklessly, often speeding while texting, making FaceTime calls, and reading entire news articles behind the wheel.  It turns out that strokes can affect personality permanently.",vicegrip,2025-05-02T14:14:42,5
His brain damage is turning him into a Republican. Wild times.,Auerbach1991,2025-05-02T17:27:14,4
"Can we quit calling him a ""democratic senator"" yet? He's obviously not...he shares no common principles with democratic ideals. Maybe he once did, but that's not what he is now.",ByWillAlone,2025-05-02T22:44:43,5
"Kinda crazy how he has a seizure, is basically brain dead, and then all of a sudden started supporting republican agenda. Makes you wonder if the criteria to be a republican is to be brain dead. Seems like it",oldassveteran,2025-05-02T14:04:48,10
The fact that it was either him or Dr. Fucking oz to choose from was alarming.,Fabulous-Soil-4440,2025-05-03T07:35:30,4
It's incredible to see the resemblance of his attitude now that he has brain damage to that of MAGA. The venn diagram is almost a complete circle.,sandyandybb,2025-05-02T13:42:20,7
"He's not a democrat.  He may have run as one, but he shed his skin earliest chance he got.",ERedfieldh,2025-05-02T14:43:14,6
"This is bad but to all those saying in he’s a conservative now, no he isn’t. Yeah he breaks from the left on Israel and border security, but he still strongly supports repro rights, LGBTQ rights, environmental regulations, social safety nets, Dreamers, and unions, to name a few.   According to the article, it sounds like his personality has changed, and he may not be fit to serve. Since the stroke, he’s more stubborn and more of a contrarian, but those traits are also a big part of why he got elected in the first place. It’s a sad and complicated situation, not as simple as “he got brain damage and turned republican.”",acetime,2025-05-03T10:20:37,5
"""O, what a noble mind is here o’erthrown!""  Hamlet (3.1.)",OptimalAd3007,2025-05-02T13:22:31,2
Someone needs to primary this guy,SSCLIPPER,2025-05-02T13:48:41,2
He needs professional help.,pkeffect,2025-05-02T16:00:56,2
"I was really high on Fetterman as a future presidential candidate.  Strokes suck, man…",PM_ME_UR_RESPECT,2025-05-02T16:53:53,2
That’s a shame,DanFrom503,2025-05-02T22:39:09,2
He was always a one man show. Could not see him working on a committee. The tears he shed while on the PA Board of Pardons were totally cringed.,Not_EdM,2025-05-03T17:25:35,2
What I get from this is that conservatism comes from brain damage.,OsawatomieJB,2025-05-02T13:39:43,6
So incurring brain damage causes one to become conservative? Huh,CLE_browns_optimist,2025-05-02T15:46:38,3
"As maddening as this is, its also ironic that a brain injury can objectively push you to the right.",RipErRiley,2025-05-02T20:09:32,4
"If you're gonna spiral, I wish you all the best, but please gtfo of office first you seemingly piece of shit.",-Wicked-,2025-05-02T17:17:51,2
I’m wondering if his stroke caused frontal lobe dementia.,No-Independence-6842,2025-05-02T23:17:39,3
Time for ol puddin head to go.,CardinalMcGee,2025-05-03T06:30:02,3
"I contend that this proves that all those that go conservative as they age, and become complete ignorant assholes, are actually suffering from brain damage.",ResignedFate,2025-05-02T13:14:13,5
"This is why there should be a cognitive test for elected officials. Yes, I know it could be rigged. They already said that about elections. Yes, it's not in the constitution. But the life expectancy was much lower. So we add it to the law. Yes, I know there are unforseen consequences to this. BUT, if we cannot convict someone for a crime because of their mental capacity. Then why do we allow someone with mental deficit to hold office?",KuLeBreeZ,2025-05-02T15:09:23,4
"ideally they'd let him take the senate pension (which it sounds like hes gonna need) and get him to resign. but I could easily see, if he is even partially rational, wanting to serve out the full term to qualify for that pension",Iyellkhan,2025-05-02T13:08:17,2
He was sitting outside a coffee shop in DC looking like he was hoping to be recognized. What a tool.,numberjhonny5ive,2025-05-02T13:19:58,2
So is this why he took a hard right turn?  I hope he gets the help he needs and starts taking his meds.,Gunningham,2025-05-02T22:57:43,2
"“One month after the letter, Fetterman got into a car accident, driving home from the airport after an early morning flight well over the 70-mph speed limit on I-70. His wife in the back seat suffered a pulmonary contusion and spinal fractures, and Fetterman told one of his staffers that he had fallen asleep while driving.”  Great husband.",Successful-Winter237,2025-05-03T06:23:42,2
“So-called” should always be used before the word democrat/democratic in regard to loser fetterman.,Alacrityneeded,2025-05-03T12:51:39,2
"Well, when you willingly collaborate with fascists, you endanger everyone",WillisVanDamage,2025-05-02T13:54:47,3
Any senator that is willing to drape themselves in an Israeli flag is completely lost and they don’t deserve to be employed there,Far_Arm2006,2025-05-02T16:54:23,1
"This submission source is likely to have a soft paywall. If this article is not behind a paywall please report **this comment** for “breaks r/politics rules -> custom -> ""incorrect flair"""". [More information can be found here](https://www.reddit.com/r/politics/wiki/index/#wiki_paywalls)  *I am a bot, and this action was performed automatically. Please [contact the moderators of this subreddit](/message/compose/?to=/r/politics) if you have any questions or concerns.*",AutoModerator,2025-05-02T12:18:43,1
How do recall elections get started?,MommyLovesPot8toes,2025-05-02T15:14:23,1
Prob should be on SW,billboibagginz,2025-05-02T16:04:29,1
I loved him when he was voted in. Ur it sounds like they need to let him go. We need to show the right that we hold our folks accountable.,maharg2017,2025-05-02T16:28:16,1
"Sorry if I missed it, and yes obvious, but: Who would be most likely to replace him?",Any_Blacksmith1587,2025-05-02T18:42:42,1
He gives off the vibes like he dosnt care about anything he should just resign,Highthere_90,2025-05-02T19:37:31,1
Um trump also....nuts how it's different for Dems and Republicans,alu5421,2025-05-02T19:54:25,1
Doesn’t he have to be present in the senate ? It is not possible to hide this kind of behavior for long.,PralineNo65,2025-05-03T00:59:49,1
He is fifty-five.,takenoprisonersnoshi,2025-05-03T12:24:05,1
Maybe a second stroke will fix his brain.,Dialectics_1312,2025-05-02T15:09:15,1
They should have kept him in the asylum,rimbaud1872,2025-05-02T16:57:15,1
Impeachment?,r2v-42nit,2025-05-02T18:13:38,1
Recall?,Ok_Ant2566,2025-05-02T21:48:19,1
I hope this is the first move toward resigning. Let Shapiro appoint a decent replacement.,flaaaacid,2025-05-02T22:07:18,1
He likes looks like a low rent Meth Dealer King Pin in that photo!,firecall,2025-05-03T01:40:55,1
"One of these days, he's gonna walk into a frozen Mitch on top of a flight of senate hall stairs.",Sublimotion,2025-05-03T03:33:48,1
Maybe George Clooney could tell him to step aside and then Pelosi gets in his ear. It worked before.,Felon73,2025-05-03T04:51:14,1
Interesting. Y'know the headline holds true if you replace fetterman with trump.,its-a-baka,2025-05-03T08:43:16,1
That’s cute you call him a democratic senator.,Kaizen2468,2025-05-03T14:56:23,1
"It is so funny to me the twists and turns of politics:  When Fetterman couldn’t form a sentence or comprehend briefings dems were like “he’s fine, he’s our guy, nothing wrong!”   Now he is no longer a rubber stamp for the party and he starts supporting some Trump policies and suddenly “this guy is dangerous, not thinking clearly and  unfit for office.”    I don’t have a horse in the race, and thought he should have been forced out after the stroke, but for heavens sake be consistent not just when it is convenient.",Unique-Wasabi3613,2025-05-02T14:31:32,-4
This article seems a bit sensationalized. Here's a video of after his car crash which happened last August.  https://youtu.be/z8cg-vzFADg?feature=shared.,manfromfuture,2025-05-02T13:28:32,0
He’s a tool that looks like a bum. And I’m not a republican.,Udosari,2025-05-02T15:21:14,0
Brain damage may have made him more conspiracy minded and supportive of Trump and his policies? I'm shocked.,The-Animus,2025-05-02T16:00:26,0
So...our next President?,productiveslacker73,2025-05-02T17:49:16,0
This is why you never trust a politician who claims to be just like you.,Familiar_Invite_8144,2025-05-02T22:00:09,0
"I don’t give a fuck about that traitor, let him do whatever he wants to himself",TransQueerLeftistVet,2025-05-02T22:15:35,0
"You were the chosen one!  It was said that you would piss off the right, not join them!  You were to bring hope to PA not stroll into the darkness!",Darth-Shoes,2025-05-03T08:27:47,0
"*But other accounts show increased black-and-white thinking on issues such Israel’s massacre of Gaza, which has alienated many of his staffers, and an inexplicable show of support for certain Trump administration polices, drawing a backlash from liberal supporters. It seems that Fetterman’s health is raising the question of if he’s fit to continue serving in politics.*  And there you have it…they don’t like the fact that he has not been an automatic vote for the Democrats agenda, so they have initiated a smear campaign.  His voting clearly has to be due to mental illness.",LLMBS,2025-05-02T16:50:33,-10
Fetterman is a right-wing Israeli asset that has infiltrated the Democratic party. He is a pseudo liberal.,DonSalaam,2025-05-03T09:19:21,-1
He’d be fine if he just wore a suit.,misteakswhirmaid,2025-05-02T14:14:51,0
"First to bend the knee… he always told yall he had a bad knee, yall didn’t listen",rain168,2025-05-02T15:08:28,0
"Not fettered enough, it would seem",rpluslequalsJARED,2025-05-02T18:33:36,0
Retire ogre.,robertevans343,2025-05-02T19:01:28,0
Does he have fucking brain damage?,turbo_time4422,2025-05-03T00:53:08,0
U think the cia moved on from a heart attack gun to a stroke gun,TheGabeCat,2025-05-02T22:34:11,-1
Cool. Guess Oz should have won.,No-Entrance9308,2025-05-03T13:08:14,-1
[deleted],[deleted],2025-05-02T13:01:15,-13
[ Removed by Reddit ],Rednoy12,2025-05-02T20:09:02,-2
Of course he is a danger. Fetterman has called bull $hit on many of the Dems B.S positions. Fun watching the Democrats eat their own😁,Signal_Tear_5058,2025-05-02T13:35:41,-15
"Democrats were ok with him when he had a damn stroke, but now that he doesn't agree with everything they agree with...he's not in ""good health"". ",anticixx2,2025-05-02T12:28:31,-57
"Remember that guy, you know the one who couldn’t form a coherent sentence or find his way off of a stage and was the leader of the free world for the past four years. You know, the one the media lied to us about and covered his cognitive decline? Where was the outrage then?",Heidishiff1020,2025-05-03T10:37:15,-6
I remember when Fetterman spoke for hours with Rogan. Less brain damage than Kamala.,Greedy_Celery_7757,2025-05-02T13:17:59,-24
"I was hoping he was being more of a jerk because his presidential ambitions had been dashed by the stroke, but that he had always been this guy behind the scenes.   I feel so awful for his poor wife trying to deal with this. Especially since TBIs can make people less able to resist momentary violent impulses, and he is a very big guy. It must be scary living with him, or working with him as a staffer.",gringledoom,2025-05-02T12:41:15,817
I have some good news for you https://www.reddit.com/r/PritzkerPosting/s/ma6acrl2TM,DevinGraysonShirk,2025-05-02T13:44:56,30
Even Fat Bastard redeemed himself much more than Fetterman ever will.,riomx,2025-05-02T14:07:12,12
Nailed it.,williamgman,2025-05-02T14:12:09,4
Corn?! I didn’t have any corn!,midtnrn,2025-05-02T16:48:50,3
Dammit… this sounds like it was his stroke. That’s tragic. He WAS our Shrek. He’s not the same person anymore…,somuchacceptable,2025-05-02T18:50:02,1
That’s not fair to fat bastard. He at least recognized his hate and made changes to improve himself at the end of the movie.,CallMeWalt,2025-05-02T20:03:56,1
The alternative was Dr. Oz. :/,Criticism_Cricket,2025-05-02T22:00:35,1
From “Champ” to the crazy dude from the corner in a hoodie.,Msdamgoode,2025-05-03T03:37:56,1
He’s still Shrek.  The onion who makes us cry.,GotMoFans,2025-05-03T05:08:52,1
He is such an utter disappointment   I was rooting for him but he turned out to be a Russian agent,Successful-Winter237,2025-05-03T06:20:47,1
He’s a Traitor,bzzty711,2025-05-03T07:47:55,1
He is a stupid brain worm stroking brain pile of steaming shit and is not fit for anything but playing basketball in his shorts.,photosofmycatmandog,2025-05-03T08:27:39,1
"Ah. As soon as he has his own mind, he's a fat bastard? No wonder everyone is leaving dems.",Old_Captain_9131,2025-05-02T14:09:01,-20
"I definitely dont think its the staffers especially because he took a very abrupt and hard-right turn after experiencing brain damage, and all evidence suggest it altered his personality and outlook.",StoppableHulk,2025-05-02T13:16:10,237
My sister in law had some sort of brain injury and is just a completely different person now.  She went from being the most accomplished person I know to living in a van behind her parents house.  It's really scary to see how radically ones personality can change and nobody can really seem to help her in any meaningful way because she presents to the rest of the world as a capable adult while her entire life has fallen apart.,JermStudDog,2025-05-02T15:41:27,124
">I don’t think this is a case of disgruntled staffers.  yeah, because every time I've been *truly concerned* about a family or friend's health, I contact the journalists of NYMag and put out an article.",Gleemonex4Pets,2025-05-02T13:42:40,-58
A lot of republicans were calling for his dismissal after he had his stroke. They were right it turns out,Top_Key404,2025-05-02T13:08:08,262
"The Dems never learn. RBG, Dianne Feinstein, and Biden all should have stepped aside.  No one in the party seems to be willing to have difficult conversations",DiscoBobber,2025-05-02T13:12:14,96
He..and all of Democratic leadership are harming the Democratic cause.,1-800-WhoDey,2025-05-02T17:42:05,1
Should never have been elected in the first place. But Democrats were defending his literal brain injury as a big nothingburger.,SpectreFire,2025-05-02T15:16:33,-4
"Yeah, it's easy to think that ""risk to everyone around him"" is political shade of some kind, but no. Guy is experiencing decreased situational awareness in situations where lives are at stake (including family), and not compensating for it. Car crash from falling asleep at the wheel should be an _immediate_ wake-up call.  Ironically, he could certainly continue participating in politics, so long as he can make some lifestyle changes to avoid safety risks - personality change or not, that's something to litigate in 2028.",henryptung,2025-05-02T20:58:57,43
"Yep, that's usually how it goes.",OnlyFollowing1,2025-05-02T12:32:04,703
"I don't know if ""turn republican"" is fair.  From the article, it seems like he has far worse brain damage than people really know, is incredibly unpredictable mentally and emotionally, and is becoming conspiratorial and distrusting.  Like claiming his family and doctors are wearing wires type stuff.  It seems like he's just a shell of himself and is making wild statements guided from what he reads on Twitter...although the more I type this out, the more he sounds like many Republicans lol",dkirk526,2025-05-02T13:22:02,44
Sadly TBI Fetterman is better than Dr. Oz,Np1511,2025-05-02T14:05:05,10
Yes. Lol,Lontology,2025-05-02T12:25:33,50
