Comment,Author,Date,Score
"[A reminder for everyone](https://www.reddit.com/r/PoliticalDiscussion/comments/4479er/rules_explanations_and_reminders/). This is a subreddit for genuine discussion:  * Please keep it civil. Report rulebreaking comments for moderator review. * Don't post low effort comments like joke threads, memes, slogans, or links without context. * Help prevent this subreddit from becoming an echo chamber. Please don't downvote comments with which you disagree.  Violators will be fed to the bear.  ---  *I am a bot, and this action was performed automatically. Please [contact the moderators of this subreddit](/message/compose/?to=/r/PoliticalDiscussion) if you have any questions or concerns.*",AutoModerator,2025-03-24T12:50:06,1
"He's right. An ideologically incoherent group of Democrats took the heat so that vulnerable members avoided angering the base. Seems like a fair reading of the situation.  Though it's still a weird reversal from all the votes (Laken Riley Act, Cabinet) before that they went along with, base be damned.  Regardless though Stewart being correct is another part of why people are so mad with Schumer and the Senate. Poor messaging, seemingly no strategy, little coordination with the House, it goes on. The fact that Schumer the day before hinted at drawing a harder line and risking a shutdown only to fold 24 hours later? And waited until then to begin articulating why this was the necessary? Stupefying.   Even if you think this was always the likely outcome the way it happened is leading to a lot of people feeling like Democrats either aren't taking them seriously and/or got rolled.",Seriousgyro,2025-03-25T01:39:52,236
"They didnt get a single concession. Give me a break. They could have stood for SOMETHING. Childrens cancer research, Medicaid, SNAP - JFC ANYTHING AT ALL. It sleaks volumes to anyone who is listening.",akazee711,2025-03-25T05:10:50,64
Schumer led the charge. The more I see of him these days the less I like him. He needs to go.,jackparadise1,2025-03-25T11:36:52,22
"Absolutely. This wasn't 10 defectors going against the party.  This was the party deciding the bill was better than no bill, but passing just at the margin needed in protest. If the magic number had been 15 they would have had 5 more vote that way.",Dr_thri11,2025-03-25T08:13:28,5
"The basic problem is that if the Democrats had voted to shut down the US government, it would have been a disaster, both politically and actually.  I think Trump would love to shut down the US government, I'm sure Putin would love that. And any heat from Americans could easily be aimed at Democrats, since in fact it would have been them that shut down the government. Trump thrives on chaos, and shutting the government down is the ultimate chaos.  The whole idea of shutting down the government is absurd in my view. It should never happen for any reason. Nothing positive ever comes from a government shutdown.  Unless you think that the whole system is so sick it needs to be eliminated, Trump would absolutely love that!",billpalto,2025-03-25T09:11:06,28
"Yeah, it’s rotating villain theory. They got as many votes as they needed, +1. I’m sure there are some Dems who genuinely didn’t like it, but I’d imagine there’s a bunch who would’ve done what they were told. Controlled opposition, malicious incompetence, you call it.",TeachKids2BeTrans,2025-03-25T19:35:15,4
"Stewart’s wrong. They were caught flat footed by the House passing the bill, had no messaging to fight the epic torching they’d have gotten if the government had shut down, and Schumer’s strategy to pretend he was bravely opposing the bill got blown up. It was not coordinated, it was chaos. Schumer is now a vulnerable Democrat.",BigSprocket,2025-03-25T08:43:52,8
It’s almost always political theater.    Look tough but do what has to be done.   It’s really the fault of the voters who want party wins over what’s best for the nation.,Funklestein,2025-03-25T07:04:16,6
"I absolutely LOVE Jon Stewart, but I am a little tired of him constantly wanting it both ways. Either Democrats play the game and he gets upset that they're just politicians doing politician things, or they vote their morals and he says they're not fighting back or cutting corners. I think the Democrats collectively decided this was the right play and organized themselves accordingly. Jon disagrees with the decision but I'm not sure it should go further than that.  All that being said, I do think it's time for new leadership. Schumer should be preparing for the right opportunity to fall on his sword for the party and then retire.",Ghost_man23,2025-03-25T18:51:24,4
How do we know musk isn't threatening to primary democrats now too if they don't play ball?,Marchtmdsmiling,2025-03-25T11:33:41,2
"Because a government shutdown is ***not*** in the Dem's best interests, such an event allows Trump to purge the government without recourse far more easily.     So, yeah, in the political calculus, the Dems won this round.",aarongamemaster,2025-03-25T00:52:13,8
"If it was theatre as stewart suggests, then that indicates to me it was the right thing to do     Basically these 10 senators,are NOT the ""weak outcasts"" everyone has seized on     I dont know all the positive and negative arguments here but those i do know support this action     1) you are not deal with normal caring human beings here. Trump and Musk will get a big laugh out of seniors dying unneccessarily or people becoming homeless because they shut down the government for once     2) ultimately they will get and do what they want so why not take,some victories when you can?..it is,so sad that keeping the status quo is a victory     3) with govt shutdown, so easy to just fire en mass and dismantle entire departments",Rivercitybruin,2025-03-25T01:04:44,3
"Yes, Stewart is spot-on correct with his assessment.  The votes were whipped accordingly, hence the ideological misalignment of strange bedfellows.",NoExcuses1984,2025-03-25T10:41:03,2
">Will shielding vulnerable senators from a tough vote actually help them win re-election — or just delay the backlash? Could this strategy backfire and make more Democrats — not just the 2026 class — targets for primary challenges?  I think it depends on what the Democrat strategy is in the next several months. No one really knows what they can do to resist Trump in a meaningful way or a way that would reward Democrats political points. Without some coherent strategy, this will delay the backlash (aka Republican wins) and will not have much of a primary challenge (what are you going to run on when theres no coherent strategy in fighting Trump).   >or would Republicans do the same thing if the roles were reversed?  I firmly believe they did that with McCain when McCain voted no to repealing ACA.",Medical-Search4146,2025-03-25T04:42:38,1
[removed],[deleted],2025-03-25T06:37:59,1
Totally agree. They are idiots if they really believe there's going to be any elections in 2026.,AncienTleeOnez,2025-03-25T15:47:44,1
"OP, check out what Rep. Massie was saying in the days leading up to the Senate vote. He was the only Republican in the House to vote against it.  https://x.com/RepThomasMassie/status/1899577763981365297   Long story short, he said  the CR is pretty much just an extension of Biden's spending bill. He says it's giving the Democrats exactly what they want and the ""fighting"" in congress is fake and is just political theater. Massie claimed that Johnson likely already had a deal with enough Democratic senators to pass it, and he (correctly) predicted that within a few days of that video he recorded, Schumer would announce that he supports passing the CR, along with 9 other Dem senators.  Now, the fact that every Democrat up for re-election voted ""no"" shows that what the Dem politicians want is different than what their voter base wants. They get 10 Senators (NOT up for re-election) to vote against the filibuster, thus allowing the Dems to get their budget through while the other Dems can ""pretend"" to be standing up for their constituents.",please_trade_marner,2025-03-26T08:09:13,1
It's fun watching tye Democrat party losing Stewart.  Not saying he's shifting but he's tired of the Democrats political games,Puzzleheaded-Ad2735,2025-03-27T00:34:20,1
Jon's spot on!!! Why bother voting if you are unwilling to take the risk... aka: vulnerable,dugger486,2025-03-28T14:19:55,1
"*What's in this comment is what I remember, my opinions, etc.*  RESPONSE TO THE ORIGINAL POST:  There is a reason there is a US Senate Democratic Leader, a US Senate Democratic Whip, etc.  It's those people's jobs to do such an easy and popular thing and not end cloture.  I frankly have been finding it very tiresome and irksome that Jon Stewart acts as if he knows how the US Congress works just because he was able to use his celebrity to get Republicans to vote for an almost universally popular bill among the American people.  Paris Hilton probably far more knows how the US Congress works given the bill she got passed wasn't even a public problem until after she made the American public aware of 'The Problem Teen Industry'.  Emma Vigeland of The Majority Report is likely correct. US Senators Chuck Schumer and Kirsten Gillibrand have Wall Street and such campaign money and Wall Street didn't want a Government Shutdown.  And US Senator Schumer wanted to be able to sell his book and he somehow thought he could charm his way into the American people agreeing with his strategy and then he could go on his book tour.",beeemkcl,2025-03-25T04:35:41,-1
"Most of what we see professional politicians do is theater. Fetterman denounced the shutdown fight as pure theater.       “In recent years, despite thousands of bills introduced into Congress every year, only a small percentage (approximately 5%) become law. Of course, what matters for laws is quality not quantity. But why would legislators bother to introduce so many hopeless bills? What if they are not even designed to pass? What if they are instead designed to make money? The cold harsh reality in Washington is this: the very conditions that are so maddening for most Americans —gridlock, problems being ignored, hyper partisanship — are the very conditions that are most lucrative for the Permanent Political Class. Washington may not be working for citizens, but it's working quite well for members of the Permanent Political Class who profit handsomely.”   EXTORTION, **""How Politicians Extract Your money, BuyVotes, And Line Their Own Pockets,** Peter Schweizer, HMO, NY, NY, 2013, p. 7, 8.",DyadVe,2025-03-25T10:29:16,1
"the dems got a continuation of the Biden spending levels.   They absolutely crushed this one.      It gives them some political talking points on how the republicans aren't serious about cutting spending since the republicans passed such a huge wasteful spending package, even though its what they were passing for 3.5 years.      the dems only problem is overselling the public on how evil , terrible Elon is and how he must be stopped at any cost.  which was about as true as ""democracy is in danger""     don't focus on what your fellow ""vote blue no matter who"" friends will say, they will vote (D) next election.   focus on swing voter messaging.  the dems have a good avenue of attack, but they are focused on the wrong attacks.",discourse_friendly,2025-03-25T00:36:56,-19
"It seems everything the Democrats do is political theater. From staged Tesla dealership protests to millionaires Bernie Sanders and AOC ""fighting the oligarchy"" with the donations of billionaire Democrats, to primaries you're not allowed to vote on, to cancelled elections. It's all a show.",DuckTalesOohOoh,2025-03-25T08:03:45,-7
"I feel like part of the reason for democrats poor messaging is either a poor message or none at all.  Anyone in the dems trying to push a platform other than ""go back to the status quo"" is sidelined",Rodot,2025-03-25T09:26:23,28
"If that’s the case, why did 10 Democrats vote for the bill when the GOP only needed 9 of them?   Any one of these 10 dems could have not voted for it. That leads me to believe they voted for the bill because they liked the bill. Why would 10 vote for it??",Y0___0Y,2025-03-25T06:29:01,27
">Though it's still a weird reversal from all the votes (Laken Riley Act, Cabinet) before that they went along with, base be damned.  It seems worth pointing out that cabinet picks can no longer be filibustered and now pass with a simple majority.",fury420,2025-03-25T11:37:02,4
>An ideologically incoherent group of Democrats...  Isn't that the entire party?,-ReadingBug-,2025-03-25T04:09:39,16
"The problem is that the media is almost entirely owned by the fascists, meaning that any strategy or messaging is going to be destroyed or buried, just like how Biden's messaging got buried in 2024.     If I were the Democrats, I would be looking into how to make the media be brought to task when they win big enough because not doing so will only allow them to do it again and again until you do. In essence, be a good prince and strip many media outlets of their economic and political power; since they backed an enemy of the state, they'll be ***treated*** like one.",aarongamemaster,2025-03-25T02:16:28,13
Thanks for the thoughtful comment - looks like we’re mostly on the same page.    I wrote more about it here if you want to check it out here:   [https://leonardstevenswrites.substack.com/p/jon-stewart-called-out-senate-democrats](https://leonardstevenswrites.substack.com/p/jon-stewart-called-out-senate-democrats),erg99,2025-03-25T14:37:38,1
The Laken Riley Act was a trap. Opposing it meant you are ok with illegal immigrants suspected of a crime being let free.,checker280,2025-03-25T16:32:57,1
Really well put!,regolith-terroire,2025-03-25T21:26:22,1
"A few days before Schumer announced he supported passing the CR, Rep Massie (only Republican in the house to vote against the CR) said that it is all top to bottom political theater. He said that the CR is essentially just a continuation of Biden's budget and gives the Democrats what they want. He said they're ""pretending"" to want to vote against the CR in order to stand up to Trump (which is what their voter base wants) but he correctly predicted that in a few days Schumer and 10 other senators would announce they're voting against the filibuster.  They specifically chose 10 not up for re-election. What is clear as day happening here is that what the Democrat higher ups want is very different than what the voter base wants. So they put up the *guise* of wanting to vote against the CR while finding a way to try and pass it through without hurting re-election chances in 2026.  That's what happened.",please_trade_marner,2025-03-26T08:18:47,1
Schumer explained his message. He clearly states in several interviews that a shutdown would’ve allowed Doge and Republicans to damage more government programs by deciding they weren’t valuable and to just not refunds them .  Plenty of programs already struggling from cuts would lose what funding they have left. And most importantly the courts the only system for fighting Trump would be shut down . That’s why he voted to stop the government shut down .It’s not his fault people can’t understand that message.  Democrats do tons of stuff that people take for granted or ignore. Biden was on the picket lines and supporting workers yet when it came time to vote tons of unions and union workers didn’t support Kamala. People complained about Democrats messaging and Republicans. Republicans messaging is easy because they lie and say simple solutions to complex problems. It’s easy for a lie as a simple message . While the democrats have to provide real solutions and plans not just catchy buzzwords .,AmazingAd5517,2025-03-26T11:32:38,1
I think Schumer had a good reason for avoiding the shutdown - judges need to be working to stop unconstitutional executive orders but he didn’t get that out till it looked like he folded. I think the suggestion they would all vote know was a threat to get the Gop to change things but they don’t have that Mob boss mentality that Trump has to just let it rip be damned. They definitely need to be sharper with messaging.,hereiswhatisay,2025-03-30T20:49:06,1
"They didn't have any leverage. Republicans knew they wouldn't be able to sustain a shutdown for very long. All they'd have to do is wait them out, while getting to blame them for the shutdown *and* any fallout from Trump's policies. If Trump's tariffs cause a recession in 6 months, say, Republicans would point to the shutdown and claim it was Dems' fault. And even though it would be nonsense, a lot of low-information voters would believe it.",Material_Reach_8827,2025-03-25T13:27:46,4
"I think maybe you lack an understanding of how this all works. Democrats demanded concessions from Republicans, and Republicans chose to call the Dems bluff, give them nothing, and put them in a completely unenviable position of either voting for a bill that they played no role in shaping, or shut down the government, which they would have been blamed for by many voters, and which would have strengthened Trump's hand to continue gutting the government. The only way they could have gotten a chance of getting any concessions at all is by shutting down the government, which would hurt millions of people, and wouldn't have had any guarantee whatsoever of actually getting them anything at all besides political blame and an even worse federal government.   So you are saying that they should have taken a huge political risk, with a guaranteed chance of hurting many vulnerable people, for the sake of some theoretical concessions that may or may not have ever happened. Can you really blame them for not choosing that path?  Additionally, I think many Democrats such as yourself are unaware of the fact that the Dems lost the 2024 election fair and square, and that losing elections has consequences.  Trump campaigned on doing exactly what he is now doing, and won. Did you whole-heartedly support Kamala Harris? Did you donate to her campaign, or the campaigns of any Democrats running for House or Senate? Did you engage in any real activism whatsoever? Because if you didn't do any of those things, you are one of the people who is partially responsible for putting us in the situation we are now in, and you don't really have any right to complain so bitterly about what is happening.   It bothers me that many of the same far-left activists who seemed to hate Kamala Harris and do everything they could to undermine her are now extremely mad because the Republicans are gutting the government, even though we already had all the available information to know that this outcome would occur if Harris lost. I hope you aren't one of those people!",nyckidd,2025-03-25T10:15:58,-6
"One of the biggest issues with the Democratic party, it's a protection racket that is highly deferential to seniority and those who blindly support leadership with no actual desire for meritocracy or impact.  Very little turnover in leadership other than occasionally shuffling around DNC chairs.  No accountability.  No willingness to debate in public (scared of appearing in disarray).  On top of Schumer and Jeffries keeping their roles despite being awful, Pelosi whipping to get Connolly the Oversite Chair role just to spite AOC is the absolute epitome of Democratic failures.  Pushing for a 74 year old cancer patient who has no juice and rarely uses his role that is supposed to be very public facing to do any actual media over an articulate, rising star who is fantastic with the media just shows why the party has been so ineffective for decades.",Sptsjunkie,2025-03-25T15:21:56,17
"Yeah, in this regard I don't think people really get what the republicans in office actually want. They don't _want_ the government to function.   People are pointing out that no concessions were really given, and that's true... if you assume the republican party don't simply want to tear as much of the government down as they can with as little political blow back as possible.  They'd have _loved_ the ability to turn everything off and blame democrats for it.  And if it does turn off... What exactly is _this_ administration going to turn back on?",thatHecklerOverThere,2025-03-25T09:45:29,15
"> I think Trump would love to shut down the US government, I'm sure Putin would love that. And any heat from Americans could easily be aimed at Democrats, since in fact it would have been them that shut down the government. Trump thrives on chaos, and shutting the government down is the ultimate chaos.  We've been through this before. The government shutdown during his previous presidency was bad for Trump's popularity. And government shutdowns have generally been bad for Republicans since the 90s. And those shutdowns didn't have the added context of DOGE illegally firing federal workers en masse.",balletbeginner,2025-03-25T10:17:39,9
">I think Trump would love to shut down the US government, I'm sure Putin would love that. And any heat from Americans could easily be aimed at Democrats, since in fact it would have been them that shut down the government. Trump thrives on chaos, and shutting the government down is the ultimate chaos.  Every last bit of polling showed that voters would overwhelmingly blame Trump and Republicans.  The Democratic base wanted them to have a spine.  This was just political malpractice and demotivating to the base who again sees the party cower from a fight and not listen or be responsive to voters.  Dead party.",Sptsjunkie,2025-03-25T15:23:50,5
">I think Trump would love to shut down the US government,   Then why did all the Republicans vote for the bill?",Snatchamo,2025-03-25T09:50:41,5
TBH - watching the 10 or so ultra-extreme Freedom Caucus members nuke McCarthy and cause all sorts of havoc and ruckus to the national embarrassment of the party on TV . . .  I thought there was NO WAY the House could pass a bill without D consent either.  So I can understand why Schumer did what he did because he had no choice.,neosituation_unknown,2025-03-25T09:36:50,8
"The sad part is, Stewart is an entertainer, and his job is to get ratings, and what gets ratings is bitching about Democrats, for Democrats to watch, to get mad at Democrats. That's what we want, apparently.  How do we not see how incredibly fucked in the head we are? Look at what's going on over *there,* maybe, with the people who currently hold all the power. Schumer wasn't going to stop that by making some fucking Bill Pullman speech. There was never *any* strategy behind the shutdown.",Miles_vel_Day,2025-03-26T00:45:39,5
"It's not really fair to say they won. They didn't extract any meaningful concessions. At best, they mitigated a loss. It isn't nothing, but it's not a win.",A_FellowRedditor,2025-03-25T01:22:19,36
"Dems didn't ""win"" a damn thing. Republicans passed the bill they wanted, and democrat leadership in the senate pissed off their base even more with a 180 the day of the vote. You can argue political calculus all you want, but trying to paint this as a Democrat achievement is ridiculous.",LightOfTheElessar,2025-03-25T02:05:40,43
"While that makes sense, why didn't Schumer and co. shout this from the rooftops?  ""Trump admin will purge the government if there's a shutdown"" is a highly compelling talking point that makes them look like bastions against fascism. Instead they've come out of this looking like a bunch of spineless rats. It's a very bad look and the response to this has been almost universally negative.",BlackfishBlues,2025-03-25T05:37:37,8
"Saying that the Democrats want anything seems like a gross misrepresentation of what happened.  We are literally just talking about degrees of them losing. Did they lose as badly, or a little bit less badly?   They’re doing goddamn horrible right now.",Murky_Crow,2025-03-25T05:52:20,2
"> So, yeah, in the political calculus, the Dems won this round.  I agree that a government shutdown is not in the Democrat's best interest but this is absolutely **not a win**. This is controlled hit on the Party. They had two poison pills and they took one.   This can evolve from deflecting into a win if Democrats can form a strategy around it. One idea I like is that Democrat Senators take this moment to resign their actual office or position of power. Their replacements will have a easy argument on how they're different (e.g. I'd have voted no on the CR) or Democrat Party could show they are reforming by shaking up leadership. Democrat voters are tired of the Party barely hanging on because of 70+ year old people. Want to be progessive and be the Party of tomorrow, get out of the way for new blood to come in.",Medical-Search4146,2025-03-25T04:39:43,1
"I hope people are also aware that if Schumer and the Senate had gone through with a shutdown there would have been no ""attaboy, way to stand up to Trump!"" It would have **immediately** been ""There's no strategy for this shutdown! Trump can do whatever he wants now!""  What a bunch of miserable fucks we are. Are we being tricked into this shit? Like, David Sirota is doing an *Inception* thing on us, or something?",Miles_vel_Day,2025-03-26T00:47:11,1
Let the GOP take the fault then.,Special_Transition13,2025-03-25T03:45:17,-1
"Please do not submit low investment content. This subreddit is for genuine discussion: Memes, links substituting for explanation, sarcasm, political name-calling, and other non-substantive contributions will be removed per moderator discretion.",PoliticalDiscussion-ModTeam,2025-03-25T19:08:57,1
"Agreed, Stewart has been cosplaying as a pundit for decades now, and it's about time his audience understand that he's not making things better AT ALL.",wut_eva_bish,2025-03-25T10:18:41,3