Comment,Author,Date,Score"No it wouldnt. It doesn't take a magician to convince a barely watching populace that anything that happens this term isn't the fault of the party that controls all three branches. Fucks sake, Dems, y'all gotta get on the same ""play dirty"" train that republicans do and take some fucking risks. Just bailing out a sinking boat will get you nowhere fast  Any party that has an iota of messaging experience would be able to use a shutdown to turn heads and act as a bullhorn to a sleeping public about what doge is actually cutting.",DogadonsLavapool,2025-03-25T09:49:48,-1
"That’s my point, yeah",das_war_ein_Befehl,2025-03-25T09:26:50,2
"Polls show most people don't see trans issues as important, and many people who do see them as important are likely trans and LGBTQ+ people who'd abandon the Dems en masse should they do this-look at how much they swung against the GOP just due to their messaging.  I honestly think the main reason Kamala lost was because she was left-wing all the way up until the campaign began, when she took a bunch of right wing positions. This is the main issue with Democrats-inconsistency. Things like this piss of those that supported them and allow the opposition to just use old clips to stop any gains. Politically speaking, Democrats need to pick what positions to hold.",IvantheGreat66,2025-03-26T08:24:53,9
"Yes, yes, what voters *really* want is for democrats to become the conservative party now that Republicans have gone full fascist.",Decent_Cheesecake_29,2025-03-26T06:01:03,3
"If Dems want to win, they need to fight for free and fair elections. None of this matters if they [keep letting Republicans shift votes](https://electiontruthalliance.org/clark-county%2C-nv). Yep, 2024 was stolen - in multiple ways, actually. Millions of voters challenged, purged, blocked, mail lost... and literal votes being shifted at the tabulation level.  So let's stop debating this ridiculous nonsense about 'what went wrong.' We know what went wrong: our elections have been gamed and cheated to death.",lurker1125,2025-03-28T09:12:05,1
Fetterman was the first Democrat to support the bill.,Y0___0Y,2025-03-25T10:32:14,5
"I agree. Any Dem under the age of 70 would have found some way of promoting themselves and thier agenda on social media. Not that I would ever vote republican, but I'm tearing my hair out over the total ineptitude of Dem leadership.",speedingpullet,2025-03-25T10:47:10,3
[deleted],[deleted],2025-03-25T12:44:02,1
"Fair point, but do you really think maga reads their news? The fairness doctrine would affect their intake of news for sure. It would curb FOX, OAN, NEWSMAX, etc, and it would affect YouTube and right-wing nut jobs on the radio. The media used by maga the most.  Edit: deleted first reply because it was removed for adding a ""t"" to the end of a word",rbrt115,2025-03-25T08:02:33,-3
Nope. Empirically false,JKlerk,2025-03-25T12:41:45,0
All those outlets are still in operation.,bl1y,2025-03-25T13:58:51,1
"I've been told my entire adult life that Democrats don't need the left's votes. We tried to change her policy position to save her campaign in spite of decades of dismissal, and she shot herself in the foot instead.   Now you blame us for it. Eat a bucket of sand.",GrandMasterPuba,2025-03-25T14:04:35,-1
[removed],[deleted],2025-03-25T12:29:45,3
"> Republicans blame Dems for everything, regardless of responsibility. I truly don’t understand why people think the Dems sitting out means they won’t be blamed. Have y’all not been paying attention? >  >   Yea but only republicans believe that bullshit.  Independents make their own decisions.  Right now 70% of the people dont like how trumps handling the economy.  That would all shift to dems fault in a shutdown.  Let it go till november when the next bill comes. The economy will either be in the shitter or fine and they can use the leverage at that point.  No difference.",HumorAccomplished611,2025-04-01T14:10:44,1
"I agree. In any normal circumstance, the Republicans would not have been able to keep every member voting for it. In this case, they knew they could stick it to the Democrats.",billpalto,2025-03-25T10:26:31,3
">We just gave the admin everything they want  That's not true at all, no matter how often you repeat it to yourself.  >Heads need to roll, starting with the 10 traitors that voted for this bullshit.  Calling Senate Democrats traitors for doing the right thing is beyond awful. You're just MAGA in a blue trench coat.",nyckidd,2025-03-25T14:49:11,2
You guys are on crack. Johnson has to be the least impressive person relative to the amount of power he has that I've ever seen. Can you seriously not see the hand up his ass?,Miles_vel_Day,2025-03-26T00:42:37,1
"I’m saying there is value to both, and he continues to do both. I should know what the opposing party (I reject the term enemy) is doing, but I’m helpless to change their behavior. I’m not helpless to change my own behavior and be aware how my behavior influences their behavior.   If you think he was focusing exclusively on republicans back then you’d be wrong. He spent hours and hours admonishing CNN, and also saved time for msnbc and democratic politicians. His audience was also probably more diverse back then, or at least more open minded for lack of a better term. Even the Colber Report had conservative fans. In comparison, John Oliver basically won’t touch anything negative about the left and most people I know in the center don’t care for him but feel positively about Stewart. ",Ghost_man23,2025-03-26T13:58:32,1
"True. Just as someone pointed out above, the Dems messaging is a mess. Not only to their voters but also to the opposition. Sadly, even though it was probably the correct choice, they managed to make it into a political defeat by floating playing hardball then backing down. Pissing off your own voters unnecessarily is idiotic. They need more organised and visible leadership.",Low_Witness5061,2025-03-25T03:46:28,8
The whole thing unfolded just a couple of days before the vote. I saw a video of Schumer explaining his reasoning and it included the point that they would be able to do more damage with the government shut down. I don’t care to rewatch videos so I can spoon feed you the timestamp. But the idea that Trump could just close down whatever he deemed inessential was a key part of the reasoning to vote for the continuing resolution.,bubblevision,2025-03-25T07:37:34,9
"Obviously - that's what happens when one party has all three branches of government and almost iron-clad party discipline. In this situation, MAGA would rather have shut down the government than get meaningful concessions, ergo, it was never possible for Dems to get such concessions, ergo, anyone blaming Dems for failing to get them just doesn't understand what's going on. The Dems took the least bad of two possible paths, both for them specifically and for the country generally. That's as close to a win as was possible here.",dan_scott_,2025-03-25T09:51:09,3
"... you are just that much of a political idiot, then. Doing a shutdown is far more negative for the Dems than anything they would gain from it. The GOP will simply use this to implement Project 2025, so you lose anyway.",aarongamemaster,2025-03-25T04:04:10,6
"Let me be blunt: who else are they going to vote for? Are they going to cut off their nose to spite their face like these idiots who didn't vote because of the Palestine issue? What's better? Getting some of the things you want, but not all, or handing over the future of the country to MAGA?",regolith-terroire,2025-03-26T08:47:54,5
I agree wholeheartedly! The dems suck horribly at their messaging and logic of their arguments for many issues.,regolith-terroire,2025-03-26T19:08:27,1
"I was poking fun at his habit of not voting for bills, but I should have realized he would be front row if it fucked over his constituents.",ResidentBackground35,2025-03-26T09:33:27,3
"> It doesn't make any sense to me how people can both blame ""the media"" for what they perceive to be the problems with our government and then in the next breath champion ""defending democracy"" and expanding voting rights as many Democrats do >  >   Why?  Seems pretty simple that our media and our social media is captured by bad actors and billionaires.  While saying that voting rights shouldnt be infringed.  Also plenty of democrat policies pass in florida despite them never voting for democrats.  >If you believe people are voting for politicians based on media falsehoods that you can see through and you think the solution to that is to go after the media and then the results will be different, you're admitting you don't believe people have the agency/competency to make their own informed decisions and thus it's senseless to argue for expanded voting rights. You can't have this both ways  People are stupid.  50% believed the stock market was at an all time low as it hitting all time highs day after day.  Same with beliefs in being in a recession.  No excuse for the stock market belief but being stupid.  We let stupid people vote and now we got trump.  But republicans work to only allow those stupid people to vote.",HumorAccomplished611,2025-03-25T13:28:02,4
"Fox, OANN, and Newsmax are all cable channels. They aren't broadcast over the air, so they wouldn't be affected by the Fairness Doctrine.  YouTube is obviously a website, so also not affected by the Fairness Doctrine.   Assuming the Fairness Doctrine was brought back and not struck down, it would only really affect AM/FM radio and the local TV news affiliates, but like I said, it would probably be struck down.",Moccus,2025-03-25T08:08:45,11
"> Fair point, but do you really think maga reads their news?  FFS, just double down on what has gotten you to where you are, why don’t you?",MurrayBothrard,2025-03-25T10:30:59,0
"... are you blind? No, I'm asking a serious question. The reality is that the media took sides. You can argue all you want about it not doing so, but you can't fight reality.     They either bury or vastly diminish any accomplishment via the good ol' half-truths and context removal, all the while supporting Trump via sane-washing.",aarongamemaster,2025-03-25T12:46:30,2
Just banning them from whitehouse and other such things.,HumorAccomplished611,2025-03-25T14:18:12,1
"Who told you that? Of course we need the left's votes. What you've actually been told that as a rational actor the Dems are the only game in town. Conservatives vastly outnumber liberals. So Dems need moderates to swing things. A moderate inherently has more in common with Rs and less to lose if they win, so they also have more pull in the party. That's just the way it is. You don't see rabid pro-lifers sabotaging Trump for positioning himself to the center on abortion. Because they're smart.  If you *actually* care about the issues, you'll vote Dem even if they don't budge an inch, or even insult you to your face. Because they're still better than Republicans on the issues you care about, even if only slightly (in your view). If you just care about moral preening and being pandered to, you sit home and let Trump win.",Material_Reach_8827,2025-03-25T22:54:30,2
"She literally consistently called for a two state solution that included security for Palestine.  Hardline Israeli's were pretty pissed about it.  Trump has essentially told Israel, ""do what you want.""  There is definitely a bleaker option for Palestine.  To believe it can get no worse there is such an incredibly naive and privileged view, it's essentially impossible to take you seriously.",Inevitable-Ad-9570,2025-03-25T15:15:20,6
[removed],[deleted],2025-03-25T14:47:49,1
"Keep it civil. Do not personally insult other Redditors, or make racist, sexist, homophobic, or otherwise discriminatory remarks. Constructive debate is good; mockery, taunting, and name calling are not.",PoliticalDiscussion-ModTeam,2025-03-25T19:29:09,1
">That's not true at all, no matter how often you repeat it to yourself.  You got any receipts or you just gonna ""nuh uh"" me? Trump was roasting Massie for initially being against the cr and then he thanked the 10 dems for their vile treachery. He wanted it, the rest of the R's wanted it, and the 10 spineless turn coats wanted it. You can lie to yourself but don't try to bullshit other people.",Snatchamo,2025-03-25T16:45:02,1
"Yep agreed.  This move pissed off Democrats and made anyone outside of the party see a weaker, dysfunctional party. The optics alone were damning, and it’s an indictment on the absolute sloppiness and meandering nature of the party.",InTheMorning_Nightss,2025-03-25T03:58:58,9
"You would think that, but the reality is that the media is almost entirely fascist, meaning that they'll bury any messaging or destroy any strategy.",aarongamemaster,2025-03-25T03:57:13,-2
"I remember Schumer explaining this exact thing to Chris Hayes in an interview on MSNBC. He did it twice, and yet some people can't seem to understand that the Dems had no leverage. Time was up, there was no dragging it out or filibustering for concessions. It was a shit sandwich that exists not because the Dems suck, but because voters put the GOP in power across all 3 branches of government (also, it didn't help to have Fauxgressives trying to spread FUD and split the Dem votes.)",wut_eva_bish,2025-03-25T10:15:40,0
[deleted],[deleted],2025-03-25T10:22:07,-1
"Schumer says that every time a govt shutdown looms. It's always 'we're doing this to stop the republicans for harming the American people', or some such BS. Every. Freaking. Time.   Schumer needs to go. And all the rest of the septuagenarian Dem leadership. They're as complicit as the GOP in this",speedingpullet,2025-03-25T10:52:33,-1
" Frankly, I don’t care. As long as MAGA supporters suffer economically, I'm happy. I care more about my state and those who reside here than I do about those living in the Red States. Trump was duly elected, so I hope his supporters enjoy a decrease in the quality of life and feel the brunt of his policies.  As a resident of a blue state, I'm tired of my taxes subsidizing Red states.  Since the economy is interconnected, we will all likely suffer, which is why I am calling on the Dems to fight back, but if it doesn't work out, then I'm going to sit back and let the MAGA supporters eat themselves up when they lose all their wealth and social services they take for granted.",Special_Transition13,2025-03-25T04:07:36,-5
"Yeah, many LGBTQ+ people will abandon the Democrats and just vote third party or stay home. Hell, many allies of them will do the same-me included. I don't like the Democrats on the economy, foreign policy, immigration, and kinda gun control and environmentalism at this point. I'll still vote for the ones that at least pretend to care, but I'm not going to endorse them throwing trans people, including my friends, under the bus-which is what they would take my vote as should they win. If either of them wins, at least I didn't help them.",IvantheGreat66,2025-03-26T09:04:52,9
"Yes, yes they will.",thatjewdude,2025-03-26T18:21:17,2
The stock market isn't the whole economy.,RddtIsPropAganda,2025-03-25T17:14:31,1
[deleted],[deleted],2025-03-25T14:27:14,0
"I disagree. I think people are sick of the one sided bullshit from both parties, one more than the other, but most are over it and I think would embrace a point counter point programming change. It doesn't effect free speech to give each side the same opportunities.   It has to be reintroduced, so include all media necessary.   Times change, and some of our laws need to evolve with the times.   There's a reason why the constitution is called a living document. It was created to be amended as societal changes occurred it was never intended to be static text.",rbrt115,2025-03-25T08:17:54,-3
I'm a realist. I don't know any maga cult members that actually read their news.   JFC why are you afraid of change?,rbrt115,2025-03-25T10:40:12,1
Outside of Fox/WSJ and MSNBC the MSM didn't take sides.,JKlerk,2025-03-25T12:51:45,1
None of them have been banned from the White House.,bl1y,2025-03-25T14:29:40,0
">If you actually care about the issues, you'll vote Dem even if they don't budge an inch   This is the most pathetic thing I've ever read.   None of it matters any more anyway because the United States is dead. Trump is not some consequence of Democrats not getting their way - he is the inevitable conclusion to the Democrats achieving everything they ever wanted. Liberalism ended the American experiment.   May whatever deity you believe in protect you and your family through what comes next.",GrandMasterPuba,2025-03-25T23:44:51,-1
"Keep it civil. Do not personally insult other Redditors, or make racist, sexist, homophobic, or otherwise discriminatory remarks. Constructive debate is good; mockery, taunting, and name calling are not.",PoliticalDiscussion-ModTeam,2025-03-25T19:29:26,1
"I don't have anything more to say to someone who calls Dem leadership traitors. Any proof I provide you won't be good enough, because you don't exist in reality.",nyckidd,2025-03-26T09:39:31,-1
Newsflash: your ignorance is not my responsibility. It’s low information voters like you that got us into this mess (ignoring the very likely possibility that Trump and Musk used their paid petition to add votes to hacked machines.) Exactly the type of person to whine that “Biden hasn’t done anything to help the average person.” Equally plausible that you are a troll bot to get people riled up.,bubblevision,2025-03-25T16:20:22,1
"... this is horrific in all respects. If you want to kill the US, this is the method, and you'll be playing to Putin's tune.",aarongamemaster,2025-03-25T12:38:44,2
"""At least i didn't help them"" is a really weird way of looking at it. It's selfish, if I'm being honest. Your conscience is clean, but we all have to suffer through Trump 2.0 or whatever. Personally, my conscience won't allow me to do that. I won't let my LGBTQ friends suffer through another MAGA administration just because a hyperminority aren't having the rights they think they should. I'm not talking about throwing all Trans issues under the bus, just the difficult to defend ones",regolith-terroire,2025-03-26T09:26:42,6
"And they'd be terribly selfish, short sighted, and wrong for it. They cause real harm to real people and I'll never forgive them.",regolith-terroire,2025-03-26T19:05:59,-1
>The stock market isn't the whole economy.  Every measure of the economy said it wasnt in a recession.    The stock market was such an easy verifiable question of what actual reality was.  And 50% of people got it wrong.,HumorAccomplished611,2025-03-25T19:17:41,2
>You're advocating for your own defeat  Generally its ok when stupid people get elected provided its not fascism.  Advocating for things that hurt you requires things like integrity.  Like rich that dont mind getting taxed more to better society.,HumorAccomplished611,2025-03-25T14:34:14,3
Fairness Doctrine would never get the 3/4 super majority of states needed to amend 1A.,bl1y,2025-03-25T08:40:04,4
"> It doesn't effect free speech to give each side the same opportunities.  The government telling me as the owner of a radio station that I have to broadcast certain programming against my will is compelled speech, which is most definitely a 1st Amendment violation.  Each side has the same opportunities because each side is equally free to establish their own cable channel, website, YouTube channel, etc. to get their viewpoint out to people. It's not necessary to force an existing channel to carry speech they disagree with.  > It was created to be amended as societal changes occurred it was never intended to be static text.  You're free to try to amend it, but Americans are understandably resistant to messing with free speech. It would be highly unlikely to get 3/4 of the states to agree to ratify it.",Moccus,2025-03-25T08:28:40,1
"Who do you think is reading newspapers? I’m not talking about the New York Times and Washington Post. It’s old, conservative people.    But keep up the condescension. It should make the turn toward electoral domination any day now",MurrayBothrard,2025-03-25T10:41:42,2
Only MSNBC didn't take a side; everyone else ***did***.,aarongamemaster,2025-03-25T20:30:07,1
Yea just attacking them  https://www.reuters.com/business/media-telecom/trump-says-he-would-like-see-funding-end-npr-pbs-2025-03-25/,HumorAccomplished611,2025-03-25T14:34:56,1
"> This is the most pathetic thing I've ever read.  Who is better on your issues? Dems or Republicans? The answer dictates your vote if you actually base your vote on issues. You can be upset with that as much as you want, but it's just a cold hard fact. I don't know if leftists cost us 2024 (evidence is weak), but they certainly cost us 2000 and 2016. Can you imagine what a different world we'd be living in right now if Al Gore and Hillary Clinton had been president, for all their flaws? No Iraq and possibly no Afghanistan. Maybe even no 9/11. Maybe some actual strides on climate change. A 7-2 liberal SCOTUS if not better, and all that entails (no Citizens United, no Dobbs, etc). No DOGE or any of the other outrages Trump has committed or has yet to commit. If Stein voters had gone for Hillary, she would've won and Republicans would've learned the lesson that they need to go back to reasonable candidates like Mitt Romney if they want to win.  Not all the blame can go to liberals. There are some people who are just lazy and sat things out. But liberals had the ability to stop *all* of this and they pissed it away on protest votes and whining that served no purpose and that no one will remember.  The funny thing is, if Dems were a lockstep coalition that could handily win against Republicans, that would actually give the left more leverage. It'd force Reps to moderate to win, which would make them more palatable to left-leaning voters, which would give them more leverage to demand concessions. Or Dems would have such a large advantage that leftists could reasonably demand a leftward shift in policy (after 50% + 1 vote you're just running up the score as far as the election goes).  But no. You have to let the perfect be the enemy of the good, every single time. Republicans keep winning because they are, somehow, smarter about this. As one of them memorably put it in 2016, ""I am voting for the conservative party. And if this jackass just happens to be leading this mule train, so be it.""",Material_Reach_8827,2025-03-26T00:11:21,4
MAGA supporters are already killing the U.S. I don’t see your point.,Special_Transition13,2025-03-25T13:38:37,-1
"Your stance is understandable, but I still don't want both parties to become anti-trans-especially assuming the Democrats not only decide that being anti-trans works should they win, but that they should double down.",IvantheGreat66,2025-03-26T18:18:21,8
"Majority of Americans families are living paycheck to paycheck. This is an indisputable fact. Most American families have less than $1,000 in savings. If the rich are making bank in the stock market, it doesn't trickle down to these families who can barely afford to even buy stocks.    Democrats did not address this along with a plethora of other issues.    You should go ask a teacher who makes $30,000 per year how they survive.    The only thing the stock market tells us is if people have a paycheck or not. ",RddtIsPropAganda,2025-03-25T22:57:12,1
Agree to disagree.  No point in talking about it at this point.,JKlerk,2025-03-25T21:04:13,0
"And the commenter up above thinks it's not only okay to make those criticisms or pull government funding, but to full scale treat them as enemies of the state.",bl1y,2025-03-25T14:57:14,1
"I've had this conversation a hundred times; it never leads anywhere. Democrats will never accept the left's position because they fundamentally disagree with them. I am not a Democrat, and I will not automatically vote for the Democratic party ""just because.""",GrandMasterPuba,2025-03-26T09:39:38,2
"This is the problem, they don't have to become anti trans, it's these specific sub issues that are especially abrasive to those not exposed to liberal lifestyles and communities. Most people just want to live their lives and don't want to have to tell anyone else how to live theirs. But issues like trans athletes runs straight into other people's freedoms. It becomes a wedge issue that pushes voters away. It's not worth the squeeze at this moment in time. We need to focus on a path to winning back congress and winning the WH. Votes. That's all that matters right now, we can discuss the other things once democracy is saved.  Thank you for understanding my stance.",regolith-terroire,2025-03-26T19:04:24,2
