Comment,Author,Date,Score"> Majority of Americans families are living paycheck to paycheck. This is an indisputable fact. Most American families have less than $1,000 in savings. If the rich are making bank in the stock market, it doesn't trickle down to these families who can barely afford to even buy stocks.  >  >   Lol this is absolutely disputable.  The median american family has 8000 in their checking account.  AKA not paycheck to paycheck.  That doesnt even include the rest of their wealth with the median having 20K in stocks.  You got duped by a survey from a payday lending company.  60% of americans own stock.  And since babies and under 18s dont generally hold stocks thats gonna be most adults and familes.  >Democrats did not address this along with a plethora of other issues.   They did. The real median wage is up past inflation.  The bottom 50% had huge gains in income relative to inflation.  >You should go ask a teacher who makes $30,000 per year how they survive.   Funded by your local and state government?  The avg teacher in a blue state makes double or triple that.  Sorry red state shitholes dont pay teachers.  >The only thing the stock market tells us is if people have a paycheck or not.   The stock market was up.  50% of people got that question wrong means they dont live in reality.  If I ask you if its raining and you cant look out a window to see then youre not a reliable source.",HumorAccomplished611,2025-04-01T16:03:54,0
Might as well.  No difference in how they would treat trump given the sane washing and ushering him back into power for their billionaire owner profits  I see no difference in whats going on now with or without journalism and their inability to handle a despot means the profession itself is useless and in fact detrimental  If people had to actually listen to trump they would know he was an idiot,HumorAccomplished611,2025-03-25T19:16:37,0
"I genuinely don't care too much about the issues as long as it's not something crazy like defunding the police. There's almost nothing Dems could do at this point to lose my vote, even if Bernie were running the show.  It would be impossible for every faction to get what they want, or even a significant portion of it, because there are many factions and combinations of issue preferences within them, but only one combination the party can be in at any given time. It's simply a fact though that the more elections Republicans had lost over the last few decades, the better off the country would be both objectively and from the standpoint of the left, irrespective of any policy demands that weren't met.   There are only two possible outcomes from any given election, and any left-winger sitting it out is effectively voting for the Republican party. What I said is factually true - if Stein and Nader voters had voted for the Dem instead, Trump and Bush would not have been president. Even Trump is smart enough to grasp this:  > Cornel West — he’s one of my favorite candidates, Cornel West. And I like — I like her also. Jill Stein. I like her very much. You know why? She takes 100% from [Biden]. [West] takes 100%.",Material_Reach_8827,2025-03-26T10:10:01,1
Meanwhile in reality    https://www.cbsnews.com/news/saving-money-emergency-expenses-2025/,RddtIsPropAganda,2025-04-01T18:16:02,1
Meanwhile in actual reality that doesnt rely on surveys of banks but actually looks at accounts associated with people  https://www.federalreserve.gov/econres/scf/dataviz/scf/chart/#series:Transaction_Accounts;demographic:all;population:1;units:median,HumorAccomplished611,2025-04-03T11:21:19,0
Are you comparing US economy to a failed state like Argentina that pays an yearly tithe to the IMF like clockwork. LOL,RddtIsPropAganda,2025-04-03T16:41:01,1
What are you talking about youre pretending everyone was broke when the avg person had 8K in checking and 20K in stocks.,HumorAccomplished611,2025-04-07T09:16:17,0
