Comment,Author,Date,Score
Budgets don’t matter if the wh ignores them,das_war_ein_Befehl,2025-03-25T02:31:47,8
There's absolutely no chance that much of the Biden funding goes anywhere it's supposed to.,gquax,2025-03-25T01:01:25,9
A temporary win that screw’s themselves in September when a reconciliation bill is passed that cuts a whole lot of that spending that you think are just talking points.,Funklestein,2025-03-25T07:06:19,4
"Republican messaging comes from one source and is on point. The Democratic party is one of multiple constituencies. Yes they are under one tent, but it's a three ring circus with some feeling they represent progressive ideology, some supporting workers, some supporting minority groups etc. and the venn diagram seldom are unified on anything. Congress would probably work better and we might see some good legislation if they were all this way. Instead, the Republicans are half the venn diagram and the various Democratic factions make up the other half and they rarely overlap.",PennStateInMD,2025-03-25T21:19:07,15
"What are you calling status quo? Biden era policies? It's pretty clear that positions like trans athletes and gender affirming care for minors is NOT popular with the majority of Americans. You know what's funny? The majority of Americans don't hate trans people, they just think these specific issues are a bridge too far. It's too much of a cultural shift.   Now the difficult question becomes: are democrats willing to drop certain issues like these from their platform in order to win back some of the middle? Because that's the ONLY way we win back power.   This isn't about me hating trans people, I don't. I support people living their true selves, but I don't want to see this country go further towards MAGA and fascism because we couldn't figure out how to do political calculus.",regolith-terroire,2025-03-25T21:35:35,1
"Added security, they might have been worried someone would defect last minute. Or someone like Fetterman wasn’t included in the plan and just voted however he felt like.",TechnicLePanther,2025-03-25T07:30:19,40
"It deflects them from being held directly responsible. You can't point at any one of them and say it's their fault, because it still would have passed without any one of their votes. Stupid logic, but effective enough.   Plus it's really all they have as a line of defense if someone does confront them with it. The old, 'I voted for what I believe was the better of two bad options, but ultimately my vote didn't matter because it still would have passed without me.'",Jeff0fthemt,2025-03-25T09:03:45,17
“Why 10?”   Deniability like being on a firing squad?,checker280,2025-03-25T16:33:41,7
"You're kind of missing the point they're making. The Dems who voted to pass aren't just the conservative wing of the party or anything like that. That indicates that the decision was not made on ideological lines, but rather strategically chosen members who would be able to take the heat.",Cranyx,2025-03-25T06:46:11,43
">...strip many media outlets of their economic and political power; since they backed an enemy of the state, they'll be ***treated*** like one.  Have you considered that you sound exactly like the ""fascists"" you're angry about?",The_Law_of_Pizza,2025-03-25T05:05:43,16
The Fairness Doctrine needs to be reestablished. Reagan was literally the most overrated president who started this shit ball of hate rolling.  Edit: punctuation,rbrt115,2025-03-25T07:39:52,3
You're assuming Democrats aren't complicit like the media. From what I can see both are in league with the Republicans.,-ReadingBug-,2025-03-25T04:13:22,0
Not evening remotely true.,JKlerk,2025-03-25T06:19:34,1
"> since they backed an enemy of the state, they'll be treated like one.  Excellent. Let's start with the NYT, NPR, and MSNBC. They can all be shut down by the Trump administration as enemies of the state.",bl1y,2025-03-25T08:41:24,0
"Guess what? Republicans will blame Democrats regardless. Democrats don’t have to be responsible for Republicans to blame them. So if you’re going to be blamed anyways, might as well fight for something.",jamvsjelly23,2025-03-25T22:22:38,15
"> Additionally, I think many Democrats such as yourself are unaware of the fact that the Dems lost the 2024 election fair and square,  This isn't correct. [Data analysts caught the GOP shifting votes to Trump in the most common brand of tabulator.](https://electiontruthalliance.org/clark-county%2C-nv)  2024 was stolen.",lurker1125,2025-03-28T09:14:15,1
Kamala Harris deserved to lose for not budging on any of these demands of the left vis a vis Palestine.   And they should have shut down the government. The people who voted for this deserve to feel pain. Maybe if they put their hands on the stove they'll finally learn that it's hot.,GrandMasterPuba,2025-03-25T11:20:34,2
">""put them in a completely unenviable position of either voting for a bill that they played no role in shaping, or shut down the government""  And this is why they fail. The message should have been **""Vote WITH US on a clean CR, or find the votes yourself to do it your way""**.  Why is it the \*Democrats\* who are responsible when the GOP controls literally everything? Are you writing headlines for the NYT, perchance?",CaroCogitatus,2025-03-25T19:52:31,0
So very much this.,jackparadise1,2025-03-27T05:31:37,3
"That's exactly right. If you haven't been paying attention to the goings on in the federal civil service, you probably don't get why this was so dangerous. Basically, there was an Executive Order that ordered agencies to begin plans for ""large-scale reductions in force"" (civil service layoffs) and ordered that one of the priority groups for people to be laid off included ""all components and employees performing functions not mandated by statute or other law who are not typically designated as essential during a lapse in appropriations.""  Basically, POTUS said ""if you don't work during a shutdown, you should be fired."" A lot of people don't see anything wrong with that - if you're not important enough to work during a shutdown, you probably don't add value is the thought. But that's ignoring that who works and who doesn't isn't determined by whether what you do is important to the functioning of the government, it's about whether you're involved in the direct protection of life or federal property. The people who do food safety inspections don't work, while the guard at the FDA building does. ""Essential"" isn't ""critical,"" it basically just means you're there to make sure nobody burns the building down while everybody else is at home.  Oh, and the people who DO work? They don't get paid until the shutdown is over. So if a shutdown drags out for weeks, you've got people who are going to have to take a good hard look at resigning in order to take a job that actually pays.  So there's an EO that says ""target people who don't work during a shutdown to be fired."" And then there's a shutdown threat. And [Musk wanted a shutdown](https://www.wired.com/story/elon-musk-has-wanted-the-government-shut-down/) so he can push closer to that magic $1 Trillion savings number.  Republicans really put Democrats into a ""heads we win, tails you lose"" situation.",Corellian_Browncoat,2025-03-25T15:14:39,4
I think allowing trump to own his own crash instead of being able to blame a dem shutdown for the crash is better.  What good would have come from a shutdown.  Negotiations for what?  And if they never did come around?,HumorAccomplished611,2025-03-25T13:38:38,3
"They are legitimately just a fundraising call center at this point. All they do is raise money and email and text about raising money. They don't do a goddamn thing. Trump can rip up the entire government, but every single thing Biden tried to do got stopped by random ass arcane legal nonsense.",lurker1125,2025-03-28T09:15:58,3
"So that they could put the Democrats in a terrible position where they either vote for a bill they don't like, or get blamed for a government shutdown. It's an incredibly obvious political strategy, and every single liberal vigorously attacking our own leadership for making a tough but ultimately correct decision is playing into their hands.",nyckidd,2025-03-25T10:04:52,15
"Schumer had done no messaging prep to be able to stand up against the GOP on the shutdown if it was needed. Painted himself in a corner, and then tried to have it both ways, pretending to be tough while knowing he was in no position to do anything but cave. His own caucus knew he was full of crap, so the whole thing collapsed on him. I don’t know what the right vote was, big picture, but it was a strategic disaster for Schumer and he needs to be replaced.",BigSprocket,2025-03-25T10:25:07,6
"> ""watching the 10 or so ultra-extreme Freedom Caucus members nuke McCarthy and cause all sorts of havoc and ruckus to the national embarrassment of the party on TV . . .""  Irony is, it worked out well for the House GOP, because Speaker Mike Johnson, irrespective of how one may feel about him ideologically, is undeniably competent at his job, certainly more so than Schumer or Jeffries. Senate Republicans, furthermore, smartly went with McConnell's protégé John Thune as Majority Leader in lieu of a rabble-rouser like Rick Scott, who finished third (behind Thune and John Cornyn) and had to settle for Steering Committee Chair. Shit! Team Blue's staid, stolid ineptitude is blindingly apparent.  All in all, internecine intraparty infighting and political fratricide (e.g., McCarthy's ouster) can yield positive outcomes.",NoExcuses1984,2025-03-25T10:44:58,3
"I’m not entirely sure I agree. Stewart admonishing how republicans behave to an entirely democratic audience isn’t that useful.   I’m a big fan of Sam Harris as well and this was always a similar complaint. He, like Stewart, loathes Trump and the current brand of right wing politics. And he sees, as Stewart does (albeit for different reasons), the left as making mistakes that is making the right and Trump stronger. Instead of complain about the right, which does nothing to an audience that already hates them, it’s more useful to change the minds of the people on the left who can change their behavior and weaken the appeal of Trump to the moderate voter. ",Ghost_man23,2025-03-26T06:14:50,1
"... no, they managed to keep the Biden budget, which is a victory.     People forget that men like Machiavelli are almost entirely on the ball when it comes to how politics plays out.",aarongamemaster,2025-03-25T02:11:13,-7
It’s definitely fair to say there was no real winning here. But I think Dems had no plan if a shut down happened. Reopening the government would look optically worse because it becomes a war of attrition and Republicans could drag it out far longer than Dems could. Dems would have to cave to Republicans eventually and put a stamp on something to reopen the government and that would look soooooooooo bad.,notapoliticalalt,2025-03-25T08:28:48,6
"... that is so much ignorance that it's astounding. You look at an ideological-only small picture, not the grand picture of politics.     Face it, men like Machiavelli are surprisingly on point when it comes to politics, and you're so ideologically charged that you are not seeing it. A shutdown only allows Trump and MAGA to win ***big***, so the only way forward is not to have a shutdown.",aarongamemaster,2025-03-25T02:13:12,-14
He did say that. People just don’t listen.,bubblevision,2025-03-25T06:01:51,14
... here's the problem: doing a shutdown will hurt the Dems far more than it would help them. The political calculus is sadly ironclad in that regard.,aarongamemaster,2025-03-25T03:55:41,7
"Okay, but if the White House is going to ignore the law anyway, what good is a clause that say “spend the money the way we passed it”? It’s so strange people think what is essentially additional proceduralism and rules is going to be the thing to control Trump and Republicans.",notapoliticalalt,2025-03-25T08:33:17,3
Thank God for that,discourse_friendly,2025-03-25T10:20:15,1
yeah DOGE has been proving that.,discourse_friendly,2025-03-25T10:19:46,1
Awesome.  I'm hoping we see like a 4T-4.5T budget but compared to biden's last 6T I suppose I should be happy with 5T,discourse_friendly,2025-03-25T10:21:21,0
The right has multiple constituencies as well with ranging beliefs and policy preferences.,Crossfox17,2025-03-30T13:13:00,1
"And you've got the progressive circle deluding itself that it can carry the entire party with their ideology. It doesn't matter how many of their platform issues I agree with (or disagree with), the progressives are living in lala land when they say dumb shit like oh Kamala lost because she courted the Cheneys. Like that lost any significant number of voters **eye roll**. You know what DID lose a bunch of voters? Trans athletes and gender affirming care for minors. That fucking ad saying Kamala is for they/them, Trump is for You was a monumental effective campaign. It might not have pulled everyone in the middle towards MAGA, but it pulled enough.   If dems want to win, and they MUST, they have to drop these types of difficult to defend issues from their platform. Focus on Women's healthcare, universal healthcare, and climate change. The oldies, but goodies that matter to more Americans than those other issues.",regolith-terroire,2025-03-25T21:44:19,2
They also probably assumed Fetterman wouldn't vote.,ResidentBackground35,2025-03-25T09:10:11,9
"They are blaming the media for their own party's elites' cowardice. All the while all of them get plenty of media coverage. Heck they could have made a TikTok, posted on bluesky, FB, etc. They didn't. somehow it's the media's fault while Bernie and AOC are able to get their message across clearly. make it make sense. ",RddtIsPropAganda,2025-03-25T06:34:51,16
The fairness doctrine is at odds with the first ammendment in todays world of limitless choices. It kinda made sense when you had 3 channels and views would not otherwise be broadcast.,Dr_thri11,2025-03-25T08:17:55,4
"The Fairness Doctrine only ever applied to broadcast media like AM/FM radio and over-the-air television. Any attempt to apply it to other forms of media would be struck down as a 1st Amendment violation, and I wouldn't be surprised if it were to be struck down for broadcast media as well if there was an attempt to bring it back.",Moccus,2025-03-25T07:53:38,10
"... the Fairness Doctrine is not what is needed, I'm afraid.     People hate me for saying this, but the American mentality of freedom-maximal is what got us into this mess. Why fight your enemies on the battlefield when you can effectively hack their brains?     You can't use normal countermeasures with information warfare, and using conventional means against memetic warfare is an exercise of insanity. The sad reality is that -under both the freedom-maximal and 'rights and freedoms are static' mentalities- we have to start taking up authoritarian elements. Information and speech controls, for a start.",aarongamemaster,2025-03-25T12:32:27,1
"It's ***absolutely true***, I'm afraid. If you actually look through the 2024 elections, outside of ***one*** media outlet, Biden got buried while Trump got sane-washed and created the environment where Russian hybrid warfare operations flourished. Face it: ***the media took sides***, and they sided with the fascists.     Essentially, they went Bond Villain ala Elliot Carver (the Bond series stand-in for Rupert Murdock).",aarongamemaster,2025-03-25T12:36:26,1
Hes already doing that,HumorAccomplished611,2025-03-25T13:37:11,-1
"Yes, it's true they're going to try that no matter what. No reason to give them ammunition that makes the attack more effective. If the market crashes tomorrow, no one's going to believe it's the Dems' fault. They're cooked. If we were in the midst of a government shutdown, maybe they would. It could even theoretically precipitate it for real with all the chaos they've been sowing the last couple months.  Maybe it'd be worth it if we got something worthwhile out of it, but it's just 6 months worth of funding. I have yet to see a single pro-shutdown person outline what they want to get out of it that's worth a shutdown, and how the shutdown actually gets us from here to there. There is literally nothing Dems could put in the CR that could force DOGE to stop - they'll be stopped by the courts or not at all until the midterms. That's what happens when you lose control of government at every level.",Material_Reach_8827,2025-03-25T22:59:58,1
"This niche statistical analysis in Nevada is not in any way proof that the election was stolen. If it was stolen, why hasn't the Harris campaign or the Democratic party filed any lawsuits? Surely if this was good evidence, it would hold up in court. Why haven't any large, credible media organizations reported on this? Probably because they had experts evaluate this evidence and determined it was totally useless.  This is literally the Democrat equivalent of Republicans claiming the 2020 election was stolen. Do better.",nyckidd,2025-03-28T09:25:06,2
"If leftists helped Kamala to lose because she wouldn't ""budge"" on their demands, they deserve everything that's going to happen to them and Gaza. Talk about shooting yourself in the foot. Though I guess it has the upside that maybe they'll learn what an actual genocide is, complete with a brand new Trump vacation destination.",Material_Reach_8827,2025-03-25T13:30:59,11
"I don't know how to explain to you just how wrong you are about literally everything you just said. Because when I've tried in the past, I don't ever get anywhere with you people. You believe what you want to believe and no one can change your mind because of how high you are on your own self righteousness. The very fact that you are looking at this as ""Kamala Harris deserved to lose"" means that you are partially responsible for bringing us this disastrous Trump administration.  Shame on you.  The Palestinians who you claim to support are now going to face an even bleaker future than before because of your actions and the actions of those you align with. It's clear you actually don't care about them at all, and it's disgusting for you to use them as a cudgel against Democrats while you implicitly support the perspn (Trump) who wants to completely remove them from their land.   If I really said what I think about you and your ilk, I would get banned. I sincerely hope that you never find any way to get near political power, and I'm confident you won't because you are so delusional and lack a basic understanding of what actions are worth taking to help the most people.",nyckidd,2025-03-25T11:36:24,4
"Because it wouldn't be the republicans failing to find the votes. All 53 Republicans, a majority, were prepared to vote for the bill.   It would be Democrats very intentionally filibustering from a minority position. It's worth noting that all of the previous republican attempts to use the debt ceiling for political leverage from a minority position have been received negatively and have mostly been disasters for them.",A_FellowRedditor,2025-03-26T00:28:17,4
"Republicans blame Dems for everything, regardless of responsibility. I truly don’t understand why people think the Dems sitting out means they won’t be blamed. Have y’all not been paying attention?   I guess it’s better to just concede and let Republicans get whatever they want and do whatever they want. That will certainly lead to better outcomes that doing any amount of resistance.",jamvsjelly23,2025-03-25T22:27:10,6
You're 100% correct here.,wut_eva_bish,2025-03-25T10:12:03,4
">So that they could put the Democrats in a terrible position where they either vote for a bill they don't like,   Don't like? Dude the lack of earmarks in the cr  means the trump admin can now do whatever they want with the budgeted money. We just gave the admin everything they want and didn't even fight for it. Heads need to roll, starting with the 10 traitors that voted for this bullshit.",Snatchamo,2025-03-25T12:40:15,2
"I agree, he served his country, but it is time for him to give up power to the next generation with fresh ideas.",neosituation_unknown,2025-03-25T10:45:11,6
">it was a strategic disaster  It's really funny, in effect the ""strategic disaster"" is ""made people on his own team sad.""  We focus on the stupidest god damn shit.",Miles_vel_Day,2025-03-26T00:41:21,2
"Johnson has done a very good job, politics aside, thus far.  However, I think the freedom caucus only caved THIS TIME due to Trump's clout fresh off the victory . . .  He will be truly tested next time the budget or debt ceiling fight happens.",neosituation_unknown,2025-03-25T10:48:21,3
">I’m not entirely sure I agree. Stewart admonishing how republicans behave to an entirely democratic audience isn’t that useful.   Why not?  Do you think the Democratic audience is fully aware of what Republicans are doing, or that it's fully well-equipped to explain it to less political friends and family? There is a *massive* value to telling people what their enemies are doing rather than letting them absorb whatever imprecise picture social media is giving them.  In the Bush administration, back before liberals' brains snapped like twigs, Stewart focused on Republicans and Fox News almost exclusively.  This is setting aside the fact that there is a **heavy** invisible psychological cost to everyone, even its supporters, only talking about the Democratic party in a negative context.",Miles_vel_Day,2025-03-26T13:22:36,3
"Get off your soap box. I'm not arguing what the right or wrong choice was regarding the shutdown. It's a nuanced discussion that had valid arguments on either side. My problem with the situation, same as most people who are still pissed off about it, is the way Schumer pretended he was going to take a stand on this just to cave when it came time to vote. If the shutdown was never an option for him, he should have owned up to it from the start. Instead, he riled people up for a fight before promptly turning around and throwing in the towel. It's no wonder the approval rating for the democratic party is so terrible when its leadership is lying to its base so blatantly.  It's an example that's about as poignant as it gets in terms of showcasing how the party of the working class has actually represented those same people in recent decades.  Edit: And for the record, avoiding the worst-case scenario and saying it's a win is pathetic. When you fall and break your leg, you don't say you won because it was only one leg that got broken. You still broke your fucking leg. That's a loss, and it's just common sense to acknowledge it as such.",LightOfTheElessar,2025-03-25T04:23:51,21
"I believe you’re spot on and I’m similarly frustrated by those who just want to always cry the Democrats only lose, and the emotional driven conclusion they have is ultimately the right one.   But the underlying concern here is that this gave indication to Trump that a government shutdown terrifies the Democrats so he has a massive leveraging point and bargaining chip.",InTheMorning_Nightss,2025-03-25T03:25:37,6
[deleted],[deleted],2025-03-25T06:41:38,-4
"The fault was in not pulling sufficient leverage to modify the bill prior to the vote, I think. MAGA set up a win-win scenario for themselves",EyesofaJackal,2025-03-25T05:34:20,4
"Quite frankly, doing nothing doesn’t help anybody. If the government needs to shut down, so be it. People need to suffer to stop taking things for granted. Maybe then will people call their representatives more and potentially change things.   Why is nobody mentioning that Trump and DOGE would be at fault for firing workers if they’re the ones engaging in those efforts? Democrats are not at fault in any way. They’re not the ones advocating for government cuts, the MAGA supporters are.   I’d rather see a shutdown that loses our democracy permanently by working with the enemy. Shut it all down if you have to. The Dems need to grow a spine and fight back. MAGA supporters are a lost cause. Let them suffer, I don’t care.   Many Red states take in more government money, so let them feel the brunt of the policies they voted for.  If all hell breaks lose, then so be it. There's a portion in the Declaration of Independence that stands out to me that I’d like to highlight:   “We hold these truths to be self-evident, that all men are created equal, that they are endowed by their Creator with certain unalienable Rights, that among these are Life, Liberty and the pursuit of Happiness. —That to secure these rights, Governments are instituted among Men, deriving their just powers from the consent of the governed,  —That whenever any Form of Government becomes destructive of these ends, it is the Right of the People to alter or to abolish it, and to institute new Government, laying its foundation on such principles and organizing its powers in such form, as to them shall seem most likely to effect their Safety and Happiness.  Prudence, indeed, will dictate that Governments long established should not be changed for light and transient causes; and accordingly all experience hath shewn, that mankind are more disposed to suffer, while evils are sufferable, than to right themselves by abolishing the forms to which they are accustomed.”",Special_Transition13,2025-03-25T04:01:55,-2
