Comment,Author,Date,Score
" As a reminder, this subreddit [is for civil discussion.](/r/politics/wiki/index#wiki_be_civil)  In general, be courteous to others. Debate/discuss/argue the merits of ideas, don't attack people. Personal insults, shill or troll accusations, hate speech, any suggestion or support of harm, violence, or death, and other rule violations can result in a permanent ban.   If you see comments in violation of our rules, please report them.   For those who have questions regarding any media outlets being posted on this subreddit, please click [here](https://www.reddit.com/r/politics/wiki/approveddomainslist) to review our details as to our approved domains list and outlet criteria.    We are actively looking for new moderators.  If you have any interest in helping to make this subreddit a place for quality discussion, please fill out [this form](https://docs.google.com/forms/d/1y2swHD0KXFhStGFjW6k54r9iuMjzcFqDIVwuvdLBjSA).    ***   *I am a bot, and this action was performed automatically. Please [contact the moderators of this subreddit](/message/compose/?to=/r/politics) if you have any questions or concerns.*",AutoModerator,2025-05-06T15:59:51,1
"Oh by all means please do, I think she’ll find winning over all of Georgia is a bit harder than winning her backwards little deliverance corner of the state ",Cactusfan86,2025-05-06T16:12:57,71
Primary absolutely general probably not,redditlvlanalysis,2025-05-06T16:00:30,17
"greene couldn't get voted in as dog catcher let alone back into Congress. She has shown she is a fucking idiot.... Her actions should piss off the people that put her in office. Her big mouth has gotten her into trouble many times. Her backing tRump as well. Now that she knows this, she is bad mouthing tRump....yeah..as if anyone going to believe a word that wackadoodle has to say..........",Harry_Mud,2025-05-06T16:09:32,8
"Good luck with that, Sporkfoot.",These-Job-9063,2025-05-06T16:09:45,9
But She can’t even win an argument!,Sarcasmgasmizm,2025-05-06T16:05:13,3
"Forgot the specific pollster, but a Kemp-less poll was done for the 2026 GOP primary and she was the clear winner. Same pollster then compared how she'd do against Ossoff and, interestingly enough, she comparatively performs the worst of the entire field.",St1ng,2025-05-06T16:34:57,4
Please run!,Faucet860,2025-05-06T16:16:06,3
"She's saying ""I think the entire state is as dumb as my district.""",mahamoti,2025-05-06T16:37:43,3
"AJC poll conducted about a week ago...  Kemp +3 over Ossoff  Ossoff +17 over Greene  She was dead last out of all of potential Republican candidates.  She won't win the Republican primary, the question is, will she finish last?",Haulingsworth,2025-05-06T17:09:27,3
"If she loses, I guarantee she'll claim it was stolen.",frigatesspc,2025-05-06T17:18:45,3
I'm kind of hoping pope Frances is watching that unfold in spirit.  Then suddenly it starts raining frogs on her house.  ,arilupe,2025-05-06T16:13:43,6
She absolutely can not but lordy do I want her to try,solohaldor,2025-05-06T16:06:51,2
"Please run. Even if she doesn't win and get crushed in the general, you know she'll go scorched earth on whatever repubs she's running against in the primary and take them down a few notches.",ellipsisdbg,2025-05-06T18:42:40,2
"Please let her spend all her ill-gotten millions on this race and then lose, and preferably slink away forever.",MostWorry4244,2025-05-06T19:09:45,2
But not the election ,Designer-Contract852,2025-05-06T16:46:18,1
The fix is in folks.,shakergeek,2025-05-06T17:16:59,1
this is how we win :adamsandlerface:,fate3,2025-05-06T17:58:22,1
"Please, please,  please.  Ossoff needs all the help he can get",SurroundTiny,2025-05-06T19:02:08,1
You guys are naive....she wins if she runs... It will be a message to American voters that mid terms and forward results will look a lot like Russian outcomes.   SCOTUS's work is almost complete.   I have to think there are some folks on both sides in the house and Senate that are getting closer to a position of recognizing that their cutting down the giving tree,goderdammurang,2025-05-06T21:49:07,1
There's a reason no one wants in on this race.,Altruistic_Mix_290,2025-05-07T00:01:01,1
"“No, please don’t…”",Little-Ad3220,2025-05-07T00:55:58,1
She might be right. Extremists tend to vote pretty heavily in primaries so she stands a good chance.,Traditional-Win-3368,2025-05-07T04:00:25,1
"Please, PLEASE (!!!) run for the Senate, MTG!!! We're literally BEGGING YOU!!!    Oh & BTW: Convince Herschel Walker to run again while you're @ it! 😆 ",HansSolo69er,2025-05-07T08:07:00,1
"I think I'm going to refer to MTG with the pronoun ""it"" from now on. :)",Zahgi,2025-05-07T08:39:20,1
"Go Cro-Maga Barbie, go. Watching you flameout in the general on a bed of magat donor cash would be pure delight.",SoupSpelunker,2025-05-08T02:39:34,1
Just imagine her campaigning in Atlanta.,Sad_Importance7789,2025-05-06T16:14:17,21
"If she does it and loses, does that mean she loses her current seat too? Would love to see her pull a Katie Porter.",davezilla18,2025-05-06T19:12:46,9
Deliverance LOL 😆 She looks & sounds even less intelligent than those backwoodsmen depicted in that movie. ,HansSolo69er,2025-05-07T07:58:50,1
Didn't georgia vote for Trump in 2024?,homebrew_1,2025-05-06T18:45:19,0
"Her winning the Georgia GOP Senate primary would be a gift to the Dems.   Ossoff is vulnerable against almost any non-crackpot GOP candidate, but he beats MGT by double-digits.",direwolf71,2025-05-06T16:24:28,24
She’s been re-elected to her district before. She can probably win re-election in her district. Doubtful she’ll win a senate race,mightcommentsometime,2025-05-06T16:48:08,8
"That’s a weird way to say she has won 3 elections in a row by a wide margin in her district.   She is popular with maga republicans. She will win her next primary for her house seat if she runs.   Then she will win the general because low information voters will see the R next to her name.   What she can’t win is a statewide race, especially not in the current climate. ",aaprillaman,2025-05-06T18:04:59,4
Republicans don't need to win arguments. They can be Jerry Springer guests as long as they wave the Confederate flag,EmployAltruistic647,2025-05-06T17:10:43,3
"Not just bad, but awful.  Ossoff leads her by 17% in a potential matchup up.  The rest of the state fucking detests this ghoul of a woman.",LugubriousFootballer,2025-05-06T18:03:17,4
As far away as possible,sirhackenslash,2025-05-06T16:29:35,5
The rest of the state fucking hates her.  Ossoff has like a 17% lead over her in a general election matchup.,LugubriousFootballer,2025-05-06T18:04:18,3
Bff with Danielle Smith aka Canadian Sarah Palin,EmployAltruistic647,2025-05-06T17:09:11,3
"This will be a more ‘blue wave’ style election.  Plus red states do have a history of rejecting particularly vile candidates, see the fact Alabama temporarily had a democratic senator",Cactusfan86,2025-05-06T19:25:46,9
"He could absolutely defeat Large Marge easily, however, Ossoff is in a really good position just in general. Early polling shows him leading every likely Republican opponent except for Kemp. And, even if Kemp hadn't bowed out, he only had like a three point lead, so well within the margin of error.",Subliminal_Kiddo,2025-05-06T17:33:43,9
Yup I'm hoping she runs if she still wins whatever it means we are beyond fucked which we are already there anyway,redditlvlanalysis,2025-05-06T17:33:16,5
He ist though. He has a healthy lead against all candidates not named Brian Kemp.  You can search for the AJC poll from a few days ago.  Ossoff even leads Brad Raffensberger by 9%,LugubriousFootballer,2025-05-06T18:00:46,4
She’ll win her district as long as she runs. She’s toast in any statewide race.,LugubriousFootballer,2025-05-06T18:05:18,7
"Still hard to believe they were collectively dumb enough to get rid of the very prosecutor (Doug Jones) who'd put away the 16th Street Baptist Church bombers in favor of an ex-football coach (Tommy Tuberville) who'd go on to tell a reporter that the 3 branches of government were ""...You know, the House, the Senate & the Executive."" 😂 ",HansSolo69er,2025-05-07T08:03:36,2
I won't hold my breath.,homebrew_1,2025-05-06T19:51:32,1
Exactly,LugubriousFootballer,2025-05-06T18:01:03,1
Kemp is interesting. Probably the person Trump hates the most but still a viable candidate.,Zerilos1,2025-05-08T11:46:57,1
"Nope. Her people are really pissed off at her and have said so. She was at a townhall meeting and insulted the people that voted her into office. One said that she, as it stands now, she doesn't have a chance to get reelected. A Senate bid, she has no chance.................",Harry_Mud,2025-05-07T09:49:44,1
That’s my thinking. I almost want her to win the GOP primary to make the race easier for the Dems,mightcommentsometime,2025-05-06T18:21:44,1
Being stupid unfortunately wasn’t offensive enough,Cactusfan86,2025-05-07T11:42:06,1
Georgia has two Democratic senators,tipjarman,2025-05-06T20:50:22,5
For now. And Georgia went Republican in 2024.,homebrew_1,2025-05-07T08:25:47,1
"Assuming you mean presidential vote. Georgia is pretty purple. Have gone back and forth. It went for Barack Obama both times. Then Donald Trump in 2016. Then Joe Biden in 2020... so its not a ""red"" state in the same way texas or other southern states are .",tipjarman,2025-05-07T09:24:05,1
