Comment,Author,Date,Score
" As a reminder, this subreddit [is for civil discussion.](/r/politics/wiki/index#wiki_be_civil)  In general, be courteous to others. Debate/discuss/argue the merits of ideas, don't attack people. Personal insults, shill or troll accusations, hate speech, any suggestion or support of harm, violence, or death, and other rule violations can result in a permanent ban.   If you see comments in violation of our rules, please report them.   For those who have questions regarding any media outlets being posted on this subreddit, please click [here](https://www.reddit.com/r/politics/wiki/approveddomainslist) to review our details as to our approved domains list and outlet criteria.    We are actively looking for new moderators.  If you have any interest in helping to make this subreddit a place for quality discussion, please fill out [this form](https://docs.google.com/forms/d/1y2swHD0KXFhStGFjW6k54r9iuMjzcFqDIVwuvdLBjSA).    ***   *I am a bot, and this action was performed automatically. Please [contact the moderators of this subreddit](/message/compose/?to=/r/politics) if you have any questions or concerns.*",AutoModerator,2025-04-23T09:33:48,1
So they cut down USAID and replaced it with bullshit propaganda?  Sounds about right for this circus of noodles.,jpcapone,2025-04-23T09:48:16,7
Talk about fraud. Disgusting waste of taxpayer money. Cosplaying figurehead can't protect her own purse. 🤷‍♂️,Cha0s4201,2025-04-23T10:33:31,3
"“Criminals are not welcome here in the united states”?? Honey, go look ip your boss’s record!",Lillienpud,2025-04-23T10:38:39,4
.... there are US immigration ads?,PlentyAny2523,2025-04-23T11:10:18,2
