Comment,Author,Date,Score
" As a reminder, this subreddit [is for civil discussion.](/r/politics/wiki/index#wiki_be_civil)  In general, be courteous to others. Debate/discuss/argue the merits of ideas, don't attack people. Personal insults, shill or troll accusations, hate speech, any suggestion or support of harm, violence, or death, and other rule violations can result in a permanent ban.   If you see comments in violation of our rules, please report them.   For those who have questions regarding any media outlets being posted on this subreddit, please click [here](https://www.reddit.com/r/politics/wiki/approveddomainslist) to review our details as to our approved domains list and outlet criteria.    We are actively looking for new moderators.  If you have any interest in helping to make this subreddit a place for quality discussion, please fill out [this form](https://docs.google.com/forms/d/1y2swHD0KXFhStGFjW6k54r9iuMjzcFqDIVwuvdLBjSA).    ***   *I am a bot, and this action was performed automatically. Please [contact the moderators of this subreddit](/message/compose/?to=/r/politics) if you have any questions or concerns.*",AutoModerator,2025-05-01T16:37:12,1
"Misleading the voters by making it appear as if they support women and abortion in their wording on the ballot? What a bunch of crap.  If this is really what people want, why are they so afraid to state exactly what they are doing? Because they know that they would lose.",Initial-Toe-9512,2025-05-01T16:59:11,14
"Fing Missouri.  Just, ... ... ... ... ..., there's not words in the whole universe to describe our level of stupidity.",HonoredPeople,2025-05-01T17:07:47,3
"Alternative title: Missouri Republicans Exist.   They do this shit for fucking everything that gets passed by props and amendments. They just lie, cheat, and break the law over and over again until these precious little snowflakes whose parents never loved them get their way. They’re basically engaged in never ending tantrums about everything.",JahoclaveS,2025-05-01T17:31:50,3
Will of the people,Alwaystired254,2025-05-01T17:40:52,3
"This submission source is likely to have a soft paywall. If this article is not behind a paywall please report **this comment** for “breaks r/politics rules -> custom -> ""incorrect flair"""". [More information can be found here](https://www.reddit.com/r/politics/wiki/index/#wiki_paywalls)  *I am a bot, and this action was performed automatically. Please [contact the moderators of this subreddit](/message/compose/?to=/r/politics) if you have any questions or concerns.*",AutoModerator,2025-05-01T16:37:12,1
They’ll never stop until running as an anti choice republican is as politically toxic as running as a communist.,ioncloud9,2025-05-01T20:19:45,1
"No words, only a banjo.",Life-Topic-7,2025-05-01T18:45:27,3
