Comment,Author,Date,Score
" As a reminder, this subreddit [is for civil discussion.](/r/politics/wiki/index#wiki_be_civil)  In general, be courteous to others. Debate/discuss/argue the merits of ideas, don't attack people. Personal insults, shill or troll accusations, hate speech, any suggestion or support of harm, violence, or death, and other rule violations can result in a permanent ban.   If you see comments in violation of our rules, please report them.   For those who have questions regarding any media outlets being posted on this subreddit, please click [here](https://www.reddit.com/r/politics/wiki/approveddomainslist) to review our details as to our approved domains list and outlet criteria.    We are actively looking for new moderators.  If you have any interest in helping to make this subreddit a place for quality discussion, please fill out [this form](https://docs.google.com/forms/d/1y2swHD0KXFhStGFjW6k54r9iuMjzcFqDIVwuvdLBjSA).    ***   *I am a bot, and this action was performed automatically. Please [contact the moderators of this subreddit](/message/compose/?to=/r/politics) if you have any questions or concerns.*",AutoModerator,2025-04-23T14:13:55,1
"Of course. How are we supposed to become a great country using immigrant talent?     Only homegrown talent is good enough for us!   People like Sergey Brin Igor Sikorsky, Nikola Tesla, Enrico Fermi, Albert Einstein were just a bunch of useless bums.",Independent-Roof-774,2025-04-23T14:26:05,5
"Just as with Mao's Cultural Revolution, the authoritarians are targeting intellectuals first.  Anyone with a brain is an existential threat to the radical police-state right...",Beantown-Jack,2025-04-23T14:36:13,5
"This submission source is likely to have a hard paywall. If this article is not behind a paywall please report **this comment** for “breaks r/politics rules -> custom -> ""incorrect flair"""". [More information can be found here](https://www.reddit.com/r/politics/wiki/index/#wiki_paywalls)  *I am a bot, and this action was performed automatically. Please [contact the moderators of this subreddit](/message/compose/?to=/r/politics) if you have any questions or concerns.*",AutoModerator,2025-04-23T14:13:56,1
They can’t seem to find all their famous ““millions”” of illegals …  …so they have to fabricate them.,5minArgument,2025-04-23T15:38:20,1
