Comment,Author,Date,Score
Here is the CNN article about this:  https://www.cnn.com/2025/04/12/economy/toy-prices-us-china-tariffs/index.html,wenchette,2025-04-15T16:41:01,1
Kids don’t need toys when they’re working 12 hrs a day in factories #maga,Previous-Car1534,2025-04-15T16:50:26,358
It’s the real war on Christmas.,specqq,2025-04-15T16:46:16,89
https://preview.redd.it/q9o5lemzj2ve1.jpeg?width=1170&format=pjpg&auto=webp&s=f67afafff8b1af9ca0c31328493dc3efa36faee5,Out_For_Eh_Rip,2025-04-15T16:45:19,40
Trump’s War on Christmas. Literally,Oceanbreeze871,2025-04-15T17:17:38,23
"Trump loves all this, it’s just putting him in the news and the center of attention.",stinkypeach1,2025-04-15T16:51:49,13
The pipeline from Minecraft to mine shaft is real.,Key-Teacher-2733,2025-04-15T17:19:08,29
"Just give trump a million dollar dinner, and you get exceptions! Get it together toys execs.",frozenqrkgluonplasma,2025-04-15T17:02:38,10
Meanwhile Orange Ass is planning his multi million dollar b-day parade. I don't know about you but I'm having a genuine North Korea moment,floofnstuff,2025-04-15T18:24:22,9
A year without a Santa Claus.,petal14,2025-04-15T17:08:56,6
"GOP is gonna lose the toddler vote in a landslide  Who are we fooling? Republicans don't give a shit about kids, unless it's their own. They'd throw all their toys out and tell them to go play with sticks in the back yard and drink backyard water out of lead pipes. They are interested in child labor, though.",KR1735,2025-04-15T20:43:09,5
Should’ve bought a house when i was 3 years old 🙄 what was my baby ass doinggg,jdbll,2025-04-15T18:27:27,7
"Well, trump is going to twist the constitution so that he will be elected again in 2028, so.. maybe in late 2030’s?",GatorNator83,2025-04-15T16:48:44,3
https://preview.redd.it/v5ify1c8s6ve1.jpeg?width=784&format=pjpg&auto=webp&s=fba4177a6d356c783c57b26c31d3586c7a2adb2a,mick601,2025-04-16T06:58:36,4
"Christmas is cancelled.  Thanks, Obama.",trycuriouscat,2025-04-15T17:48:45,4
Starting to see a resemblance between Burgermeister Meisterburger and trump.,procrastinatorsuprem,2025-04-15T17:31:05,3
Santa might not be as giving this Christmas.,NimDing218,2025-04-15T17:38:06,4
I don’t know.,Ryan29478,2025-04-15T16:39:02,1
When they are all on the ground.  The tariffs … of course.,perfectdownside,2025-04-15T17:23:46,1
Dildo will be more expensive?,Only_Pianist_6979,2025-04-15T17:59:13,1
"It’ll end when republicans stop voting against themselves, so never.",Pxlfreaky,2025-04-15T18:30:45,4
Play for what???,Thelastsamurai74,2025-04-15T18:31:18,1
Not until the Republican poor and middle class wake the fuck up,PiaggioBV350,2025-04-15T19:14:52,7
"It'll end when either certain republicans realized how screwed they are, and remove, or he keels over, or someone takes him out, or when the military has had enough. That is the only options there",Deranged-Pickle,2025-04-15T19:42:57,5
War on Christmas,Lucky_Diver,2025-04-15T19:48:50,0
When he ends...and it won't be soon enough.,southerndemocrat2020,2025-04-15T19:55:16,0
Not the toys!,MuthaPlucka,2025-04-15T20:00:42,1
It’s a good time to pick up the ol’ hoop and stick!,fookinpikey,2025-04-15T20:34:27,2
Wrecking the board/miniature gaming industry as well.,JustinKase_Too,2025-04-15T21:34:14,2
"While a lot of things we need will have crazy high prices, there is also a ton of stuff the entire planet can do without. So there is a silver lining.",roblewk,2025-04-15T21:55:41,3
"OMG dude,no thanks,it will destroy my fantasy and it's the only joy of life without tariff$...For the moment",Only_Pianist_6979,2025-04-16T03:12:48,1
No xmas toys🧸 for the little kiddos this year 😢 thank your present government 🤮,RedRoom4U,2025-04-16T06:32:19,0
When trump is powerless,still-on-my-path,2025-04-16T06:32:59,0
"It won't until they have weakened the dollar enough so their bitcoin scams make them perportionaltly more rich than any country.  Then they win, because they ""have the cards"".  This GOP Administration is disgusting and diabolical.",joylightribbon,2025-04-16T13:40:36,1
"I would love to say it will end in January 2029, but who knows if we’ll be having another presidential election. America is a dictatorship (which is something I never thought I would say).",Mongoose-7909,2025-04-16T14:10:01,1
We need to stop counting on Politicians to reign in FACIST politicians. We call them shit hole countries but clearly we haven't the balls to take care of these Nazis. Nobody is coming to save us  Sri Lankans handled shit themselves. The last head of state had to flee his palace to save his life.,dolcevita1955,2025-04-16T14:32:02,2
"Tariffs hurts USA as much as China. The tariff war will cost both side jobs, inflation will soar, everyday goods and needs will cost more and middle will have less savings. GOP needs to step up side with the democrats and get a trade deal done. Fear of Trump is not an excuse for letting your state down.",BigTiger18,2025-04-16T15:15:13,2
"Nooo, I collect plushies 😭",MegWaters012502,2025-04-16T16:18:48,1
It's going to put a lot of toy companies out of business. Most collectibles are made from China and bought by adults also.  Not to mention all the small Mom and Pop retailers too.,SixOneNiner2113,2025-04-15T19:01:51,1
Or picking fruit,Out_For_Eh_Rip,2025-04-15T16:53:48,110
![gif](giphy|xT5LMyjTSpW51cFdSw),bananasban,2025-04-15T19:36:39,17
The children crave the mines...,duelinghanjos,2025-04-15T19:04:27,7
On the night shift at 14 yrs.,EggKey6859,2025-04-15T20:14:42,5
Wait till people realize this is goi g to ruin Christmas for most people   ( 95% of Christmas is gift giving for people you care about or obligated to care about),Matthmaroo,2025-04-15T17:25:10,36
This is like Trump’s fifth or sixth war on Christmas.,rjrgjj,2025-04-15T17:40:45,17
And we'll see countless stories on why Democrats are to blame,Beer-Me,2025-04-15T19:27:27,5
It say thank you and wear suit!,Zippier92,2025-04-15T17:02:44,17
The JD memes have really gotten out of hand,Acceptable-Bench1386,2025-04-15T17:04:22,11
He's such an egotistical f****head it's sickening,FluteLordNeo,2025-04-16T07:24:51,2
"An exception that becomes a non-exception in the next tweet.  They may as well save their money, they will need it to keep the lights on.",MyStoopidStuff,2025-04-16T01:26:41,2
Right? I hope it goes horribly horribly wrong.,Cluefuljewel,2025-04-15T19:47:46,6
![gif](giphy|KoPfTfLV3f4l2|downsized),ObligatoryID,2025-04-15T19:55:28,2
Or a Constitution.  I guess I know what I'll be asking for if Santa ever returns to the US.,MyStoopidStuff,2025-04-16T01:28:13,5
"Yeah, we'll have a president who is 95 years old and still bragging about his ""superior body and mind"".",LivingIndependence,2025-04-15T20:43:04,1
Broke,mick601,2025-04-16T07:03:38,1
He’ll have a grift deal on these.  https://preview.redd.it/fijutz35i3ve1.jpeg?width=760&format=pjpg&auto=webp&s=65ce9985e6ce4112e279bf4f7a8632cf7b4657ab,ObligatoryID,2025-04-15T19:56:46,2
"I have much older sister-in-laws who still think this was all a good idea and that Trump is doing a great job. They were upset that the ""out of touch Democrats"" wouldn't standup and clap for the girl that Trump brought to his State of the Union Address.   They will not talk about their increased taxes, that they maybe losing their social security checks, they have already lost a lot of VA care and benefits, and grocery prices are through the roof.  Still, they think Trump is doing the best job ever.  They are going to give master classes on how Trump made racism, disguised as patriotism, while using mafia style tactics with his administration, the most popular political issue in a presidential election.",Ayste,2025-04-16T09:05:45,1
Or working in the coal mines! *banjo solo*,pistilpeet,2025-04-15T17:01:35,85
History repeating itself. I remember my great grandmother talking about picking cotton with her mom (they were enslaved African Americans) when she was a young child.,ScrollTroll615,2025-04-15T17:26:00,26
Indiana made it legal for 14-year-olds to work overnight shifts.,hellotypewriter,2025-04-16T00:19:26,10
"The Simpsons predicting the future, again.",hsvbob,2025-04-16T10:52:33,8
"We can make our Christmas gifts out of corn cobs and all those soybeans that won't be going to China.  We'll just call it ""Craftsmas""... but don't call it that anywhere near the state morality monitors.",MyStoopidStuff,2025-04-16T01:24:19,9
What tour?,fannyalgerpack,2025-04-15T21:18:10,3
"And his fifteenth or so war on this country! He hates America, and eveything we stand for",Similar_Wave_1787,2025-04-15T20:27:48,9
https://preview.redd.it/wjfl3a7fv2ve1.jpeg?width=1170&format=pjpg&auto=webp&s=2a4c0024299181d2af4f64d07d1b94981dbffa8f,Out_For_Eh_Rip,2025-04-15T17:49:37,23
That doesn’t sound like thank you to me,rjrgjj,2025-04-15T17:41:15,26
Like the trophy he dropped,thelastofthewolves,2025-04-17T04:50:34,1
I'm hoping for a monsoon,floofnstuff,2025-04-15T19:53:43,6
"Send his ass to N Korea for the birthday parade, and hopefully, they will  https://preview.redd.it/9nneapexs6ve1.jpeg?width=1079&format=pjpg&auto=webp&s=c0bf83524075de0f7eadb0adb2a6205deae5ba88  keep him.",mick601,2025-04-16T07:02:31,2
I heard these kids are desperate to get down to the mines. They can’t wait!,AJohnnyTruant,2025-04-15T17:12:46,43
My grandma talked about picking cotton in 1920’s after we drove past a huge California cotton field.,Oriencor,2025-04-15T18:23:56,12
"Geez, can’t see where this is headed, can you?",jayparker152,2025-04-16T07:51:28,5
"Gosh, so effing proud of my state. Why the hell do I still live here? Want to go back to Illinois, where the governor seems to actually give a shit about his people.",Atomic-E,2025-04-16T10:48:46,3
"Dump-Trump already said, a bit ago, that he was/had it legal for 14 y. o. to work the night shift.  We are Little Russia with a healthy dash of China.",Alternative_Gate4158,2025-04-16T20:28:56,2
That's a work of art. I stole it.,Hyperactiv3Sloth,2025-04-16T21:58:35,1
What did you expect from a peasant?,Sodom_Laser,2025-04-15T19:16:42,8
It’s almost as if…they yearn for them.,Smooth_Weird_2081,2025-04-15T17:32:18,32
![gif](giphy|C3gxCOt1pnP15m5Q5p),Ssshizzzzziit,2025-04-15T17:41:44,26
I like my bullet cases made from child labor. The little fingers polish the bullet cases perfectly from the inside!,Davefinitely,2025-04-15T17:29:29,20
"Minecraft MAGA propaganda confirmed, Jack Black gone to the dark side.",rjrgjj,2025-04-15T17:40:09,14
"ya know in a way mining for coal is like playing a game. maybe you get money maybe you get black lung, its exciting!",Loud_Judgment_270,2025-04-16T14:40:23,2
As Schindler explained to the SS.,DeGodefroi,2025-04-15T17:33:50,19
