Comment,Author,Date,ScoreHe doesn't see himself as a president. He sees himself as a king.,iamthejuan,2025-05-07T02:17:34,2
That’s how dictators work,Aggressive-Staff-845,2025-05-07T05:20:19,2
Let's not forget that the parade is on Flag day...,BabyFlaboog,2025-05-06T20:26:51,1
Yet another reason I hate that I share my birthday with him.,gValo,2025-05-06T21:47:52,1
Army confirms military parade for its 250th anniversary will be held on Trump’s birthday  https://www.pbs.org/newshour/politics/army-confirms-military-parade-for-its-250th-anniversary-will-be-held-on-trumps-birthday  I post this because we should be wary of misinformation and sensationalism from both sides.  They're all spinning us something,Nuke_Me_I_Beg_You,2025-05-06T23:07:36,1
He shares a birthday with the US Army. The Army is celebrating its 250th anniversary this year with a parade. The article completely omitted this.,DoktorMantisTobaggan,2025-05-06T13:20:11,-11
Our taxes are just a tribute to the orange circus peanut 🥜,Johnqpublic25,2025-05-06T18:48:22,55
he also plans to build a ballroom in the white house and replace the grass in the rose garden with “beautiful stone floors”   but apparently he’s gonna pay for it himself with his mountains of cash. and he’s uniquely equipped to lead the renovations because he had a ballroom equipped to mar a lago.   laundry day!,BravestCashew,2025-05-06T20:47:37,23
And good luck fixing all those roads after the tanks roll through. Also tax payer dollars.,SpiritTalker,2025-05-06T23:26:20,7
stop paying them.,oooortclouuud,2025-05-07T01:14:34,1
Maybe DOGE should look into it.,BottleTemple,2025-05-07T07:49:20,1
It’s not.  Children’s cancer research is a waste of taxpayer money.,Odd_Method_2979,2025-05-06T19:43:40,0
I was just wondering if this is going to end up turning into the US version of Tiananmen Square,Equivalent_Hawk_1403,2025-05-06T09:42:22,902
"I plan on doing this.  I agree with Gen. Selva:  > Trump asked Selva what he thought of the parade, Selva said he grew up in Portugal, which ""was a dictatorship — and parades were about showing the people who had the guns.""  >""And in this country, we don't do that,"" Selva said. ""It's not who we are.""  >Trump then asked Selva whether or not he liked the idea, to which he responded: ""No."" He added, ""It's what dictators do.""",Andovars_Ghost,2025-05-06T15:09:18,43
"That would make a great image in all the newspapers the next day, all over the country!",Perpetual_change9009,2025-05-06T09:44:23,64
"If no one showed up to watch the parade, that would upset the Cheeto way more, much like his small inauguration turnout.      It's not an explicit sign of resistance, but it would be highly effective nonetheless.",Mike-In-Ottawa,2025-05-06T11:32:30,43
"I almost guarantee that there will be a shoulder to shoulder police presence (or military??) along the parade route.  Which is, of course, an awful optic for them.",ContractorConfusion,2025-05-06T11:53:25,31
Protesting now is more effective than waiting until  we’re in a dystopian future.,VectorVictorVector,2025-05-06T14:39:26,11
"Yeah, people should just keep interfering with progress in the parade so it doesn't ever go anywhere.   Every time a person gets in the way is another second the parade can't move.   And the more chaos that happens, the less likely it can even go forward. It'd be really funny to see a parade being led by a whole bunch of cops shooting people with paintballs filled with pepper spray.  There's literally no way to look good If the people leading the parade are causing violence.  It wouldn't be like a white supremacist parade where they're seeking attention. These people are supposed to be the good guys and there's violence all around them. Never good optics.",simpersly,2025-05-06T15:03:39,9
"This will not happen. the police will form a police brigade around the first wave of protesters, arrest everyone and then form a perimeter around the parade. For an effective citizen blockade to work there needs to be tens of thousands of people who rush the street simultaneously.",WhiteClawandDraw,2025-05-06T14:08:26,8
"Fun fact, I AM SPARTACUS.",Shagwagbag,2025-05-06T12:39:19,4
He would love the attention.   You also know that he's going to thank all of the protestors for coming out for his birthday just to piss them off.,MinistryOfCoup-th,2025-05-06T11:34:42,8
Americans are far too selfish to do that. Maybe if they lived next door to the route then maybe,ppineapplepizzalover,2025-05-06T09:59:04,3
I wonder what would happen to me if I brought rotten tomatoes to throw too,kodaboka,2025-05-06T14:47:07,1
"Not sure what Spartacus has to do with this but this is an example of peaceful protesting thats been done in India before, and it mirrors the tank man from 1989 tiananmen square. It can be a very powerful form of protest as its highly disruptive but its also very threatening to the protesters themselves- from what I remember seeing, in India the protesters were workers who were being denied work by the British in control, so they lined up one by one and got beaten.",P0pu1arBr0ws3r,2025-05-06T16:22:36,1
Or multiple human chains. Like those road spikes the police throws out.,Henshin-hero,2025-05-06T17:50:06,1
Great idea.,hoowins,2025-05-06T18:12:48,1
"“No, I’m Spartacus!”  One of the best movie scenes ever",SandiaRaptor,2025-05-06T20:05:14,1
I’m worried about this. Trump endorsed what the Chinese government did at Tiananmen Square. And he’s spent 8 years dehumanizing anyone who opposes him in the eyes of conservatives.,MovieGuyMike,2025-05-06T21:00:19,1
"Shit that’s my 23rd anniversary, wonder if I can get out of it by doing that ?",WTFYU,2025-05-06T21:30:26,1
Madness? THIS IS SPARTICA!!! *kicks tank*,atari26k,2025-05-06T23:43:47,1
What would it look like on TV if there were hoards of people lining the streets for the parade….  who all turned their backs as it rolled past?  Now THAT would be a worldwide spectacle of epic proportions.,JerryInOz,2025-05-07T00:22:35,1
"'And they all had placards with Trump, or King on them, it was glorious'",eugene20,2025-05-06T09:33:11,105
"Let's be honest, he's gonna believe that anyway. Dude has no connection to reality.  He probably thinks he's had four birthdays this year, teaches Crossfit and lives in the Galapagos. About the only thing he knows is that his name is ""Trump"".",Delamoor,2025-05-06T11:04:52,45
This is why it'd be much better to have a protest that litters the parade route with so much stuff that they can't do it anymore... or people need to show up to block the tanks,geoffbowman,2025-05-06T12:45:37,4
No they're saying.... Boo-urns.... Boo-urns...,Gram64,2025-05-06T14:54:15,2
"sorry but ""beautiful"" has to many syllables for that doofus to stay in his brain",waxlez2,2025-05-06T12:29:25,1
i like this idea. then his birthday should be a national day of silence. blackout. everyone should fly a flag upside-down.,TElrodT,2025-05-06T09:31:35,553
Naw. Do it by physically blocking the tanks he's using to glorify his rule on parade day. Give him a Tank Man/Tianneman Square photo moment ,LangyMD,2025-05-06T09:35:06,101
"Oh, that Trump baby balloon gonna fly. Gonna be hard to say they're celebrating him.",whichwitch9,2025-05-06T09:30:56,44
[deleted],[deleted],2025-05-06T10:22:03,22
"""They had this wonderful parade for me and now all of the people they're saying they were so inspired by it that they're all going out there screaming 'noookings' to celebrate the parade. They want it very much and it's very American and one of the most American things that they've ever seen""",postsshortcomments,2025-05-06T09:50:06,9
Merit.,timnphilly,2025-05-06T09:24:08,13
"This would be brilliant. Overshadow the hell out of his stupid parade. A lot of good ideas on this thread. Upside down flags, the Trump baby balloon.  I hope there's something in the works. I'm going to reach out to the 50501 folks.",joshdoereddit,2025-05-06T10:32:35,3
"I think they want this. So they can false flag and label anyone who protests a terrorist.  No immigrants, they need prison labor to work the farms.",Snoo-35041,2025-05-06T10:34:47,2
"Or “Look at how many people came out to be run over by my military parade, what a great birthday present!”",KinkyPaddling,2025-05-06T10:52:08,1
[ Removed by Reddit ],nerdybynature,2025-05-06T12:41:03,1
"Nah, shut that shit down. Block the parade from happening.",HelveticaTwitch,2025-05-06T13:36:07,1
He's going to say that no matter what.,Drawmeomg,2025-05-06T14:18:01,1
He would be entirely delusional if he did that. I'm sure the signs that the protestors carry will clearly state otherwise.,CreativeDifficulties,2025-05-06T15:41:54,1
all the alternate events people planned during the SotU were duds. al green is the only one who got it right.,RichardSaunders,2025-05-07T03:54:18,1
Cinco de Quatro vibes,Puzzled-Grass785,2025-05-06T10:28:38,1
"Yea, or instead of having people go to DC, have them go to their own government centers.",Dorkamundo,2025-05-06T10:38:54,1
Sic Semper Moronis,AdmiralCunilingus,2025-05-06T10:19:36,57
You sure about using the words of that kook who shot the Emancipation Proclamation signer and Confederacy defeater?,Penguinmanereikel,2025-05-06T10:15:26,-22
"Yeah, don't show up to this bullshit parade, have a huge rally somewhere else.",tviolet,2025-05-06T10:35:26,86
Anybody in the military want to weigh in on how soldiers would most likely respond to a civilian incursion into their parade route? I want to say it would actually play out rather calmly since I don’t think anyone would actually have any malice towards any of the soldiers or the soldiers towards the civilians. Soldiers might just stand around and wait them out until they can get through or something. but I would love to hear that reassuringly from a current tank driver 👍🏻,Kermit_the_hog,2025-05-06T10:35:24,35
Thank you.,Stong-Excitement,2025-05-06T17:51:52,2
One month before Bastille Day.,BigJLov3,2025-05-06T22:50:07,2
Oh yeah. He said as much in his interview with ABC. He’s not budging and according to him it’s so cheap that we can’t afford not to do it.,Haunting-Warthog6064,2025-05-06T11:10:52,15
"Farmers only show up when you threaten their sweet, sweet welfare checks and protectionist policies that benefit them at the expense of everyone else.",ApostateFarmer,2025-05-06T12:33:41,21
"You can say we don't do them all you want, but we're about to do one.",Mavian23,2025-05-06T22:44:03,2
Lead the way.,Mavian23,2025-05-06T16:33:58,3
"Yes, but it's not smart. Trump will use it as an excuse to smear your protests. It's not wise to carry weapons unless you're some super, super good shooter who will only need one bullet in one shot. But kidding aside, don't give him the opportunity to turn things against you. Your protests are not only watched by Americans but also by people outside the American borders. Well, honestly, maybe my opinion turns out to be wrong, but in the end, take care of your safety and save the USA, because if you don't, who will?",ApplicationUpper1614,2025-05-06T12:32:05,2
The Republican Party has betrayed its own name by advocating for a monarchy. Republic means public affair in Latin and is used in the official name of most Republics around the world.,DanPowah,2025-05-06T20:10:27,1
We have a day off for him and he didn't even work here!,cowboydanhalen,2025-05-06T14:16:24,2
"My man, if he wants riots to justify martial law, he won't rely on them happening organically. I dare say it wouldn't be the first time either.",tepid,2025-05-06T10:54:28,26
"> You don’t want to give him the excuse to use declare martial law.  These notions are so quaint.   If Trump wants martial law, he will simply declare it. If his morons think he needs an instigating event, he will get it.  Remember, someone set bombs in front of the RNC and DNC on January 6th, 2021.",RobutNotRobot,2025-05-06T15:52:56,5
People fearmonger like this before every fucking protest and then NOTHING happens. Cops don't even bother to show up to most of these protests. Trump already basically declared martial law anyways.  Trump supporters support is so low now they don't even roll down their windows to flip us off anymore.   I mean do whatever you need to do to feel safe I guess but there are a lot of people getting scared off by shit like this when it's unnecessary.,angiosperms-,2025-05-06T13:28:15,1
Been that way for awhile :(,Hannymann,2025-05-06T12:07:15,7
And the day before Father's Day. Ironic since he's a motherfucker,DadJokeBadJoke,2025-05-06T19:47:27,1
Fly them at half mast. We know how much he hates that,brd55,2025-05-07T08:33:02,1
It could turn into another tank man photo   https://en.wikipedia.org/wiki/Tank_Man,fork_yuu,2025-05-07T06:19:22,1
"I've heard that it may not be a good idea to hold the protest at his parade because they'll just spin it as ""huge turn out"". They'll report the numbers but won't mention that many were there to protest, etc.",hazardling,2025-05-06T09:13:10,28
"Hate to say it, but any vet or armed forces member who participates in that shit are exactly that… a chump and sucker.",capz1121,2025-05-06T11:31:43,7
And guess who is paying for it? And now guess who is not. They’ll be the ones attending and holding his imaginary court.,areialscreensaver,2025-05-06T15:08:40,7
"Because the people who want to show up to boo and jeer will look like they’re booing the military, when that’s not the proper focus. The military has been fighting Trump to prevent this stupid parade for years now, it’s not their fault. They shouldn’t be booed and jeered because Trump‘s an asshole.",Galliagamer,2025-05-06T09:29:56,45
"Because it boosts the crowd numbers, which is all trump will want to talk about ",RichyRoo2002,2025-05-06T09:54:35,9
He'll Boo-urns it,ArticulateRhinoceros,2025-05-06T11:11:20,2
"That will just increase crowd size and feed the propaganda machine, and a few choice pictures will be taken of anyone that looks ""prototypically liberal"" and show them booing the military again feeding the propaganda machine. It is best to ignore it or host a larger gathering elsewhere.",Dangerpaladin,2025-05-06T14:22:13,1
"LA Kings, Sacramento Kings, Kansas City Royals?",blueraspberryfan410,2025-05-06T17:56:23,2
Or he will lie and say people were violent. The military will be on hand to quell any protests too. It’s a dumb idea to protest AT the parade. And I also think this “no kings” shit isn’t as effective as anti facism.,vaguelysarcastic,2025-05-07T07:00:25,2
Why?,Affectionate_Neat868,2025-05-06T16:09:30,1
r/beatmetoit,Rebatsune,2025-05-06T14:42:44,1
Organize marches in other cities. Would be so sad if the parade in DC had a smaller crowd than protests in NYC or LA…,BalkanbaroqueBBQ,2025-05-06T10:36:42,13
and hows that happen when they have a majority?,haroldthehampster,2025-05-06T12:11:58,2
"I have great news for you then.  The official position of this administration is ""Let them eat cake!"" ",putdownthekitten,2025-05-06T09:23:00,14
“Let then eat cake!”,som_juan,2025-05-06T10:08:22,1
Surely government waste can be reported to DOGE 🤔,TauCabalander,2025-05-06T19:41:42,2
"Collective action. Not much you can do on your own, but together the people are the most powerful force.",Affectionate_Neat868,2025-05-06T16:08:27,1
They already thought of this. The organization’s website has a section for hosts and it says “don’t register an event in DC. We’re making the center of gravity on June 14 everywhere Donald Trump isn’t.”,Accomplished_Owl1210,2025-05-07T10:44:40,2
It'll do more than you whining about people who are actually making an effort like a loser.,CaptainStabbyhands,2025-05-06T14:31:53,3
It’s for the semiquincentennial birthday of the freaking US Army. I wonder if you’ll ever look back and think you were manipulated by the media. This protest is a joke anyway. Y’all should focus on doing anything beneficial for the country if you ever want to win an election again.,RegularImplement2743,2025-05-06T12:40:10,-8
As much as I love this idea it just doesn't seem likely to me that we will be able to avoid talking about him anytime soon. He is our president and that situation is always inherently attention-grabbing by the nature of our political reality.,bakerfredricka,2025-05-06T13:30:46,2
The Republican Party have referred to Donald Trump since their Christmas Day social media post in 2016. You're nine years behind.,TheAquamen,2025-05-06T15:19:57,4
"No, but it is solidarity and pressure and a reminder that they don’t have the mandate they pretend to have.  It is a start.  Local politics, town halls, pressure on Congress.  Every drop counts.",Historical_Bend_2629,2025-05-07T11:32:41,2
"The protest is literally named ""No Kings"". They're protesting the dictator in chief, not the army. Take your virtue signalling elsewhere.",Despair-Envy,2025-05-06T20:45:17,7
Either one is fundamentally incompatible with the US constitution.,MadRaymer,2025-05-06T20:18:43,4
Trollbot,G8083r,2025-05-06T12:38:14,6
"""American"" kings is where the wrong comes in.",ToNoMoCo,2025-05-06T13:47:26,5
Nothing if they are the Burger variety.,Several_Rock3276,2025-05-06T13:59:09,7
"Because the war was a lot of our business.  We made a ton of money off it, and we got to essentially destroy the armed forces of one of our primary geopolitical enemies without spilling a drop of blood. We're the largest arms dealer the planet has ever seen, and that strategy has allowed us to extend global hegemony for decades.",Despair-Envy,2025-05-06T20:41:35,6
Russia is the enemy of the United States Ukraine is a democratic ally being invaded by that enemy.   This is very simple. It was and is the right thing to do. It hurts an enemy foreign dictator. The equipment being given to Ukraine was otherwise going to be disposed of at high cost. It was a total win win from a geopolitical standpoint. But unfortunately Trump is a Russian asset and traiter to democracies worldwide.,Fiscar,2025-05-07T02:25:06,3
Those are all of his best friends!,PowderedToastFanatic,2025-05-06T14:41:08,305
"He admires and strives to be a strongman dictator like those you mentioned. He's delusional and all the money men, legacy media, tech bros and naxi sidekicks need to be punished by the people. Don't watch/read their lies, don't buy stuff you don't need from them and break yourself from the addiction of social media. Meet up with people in person when you can, try barter and trade and swap services. It's been done before and taking their money - the only thing they worship - away. The 'greatest country on earth is a lie. No healthcare or child or elder care, crappy infrastructure, no high speed trains or affordable housing and the one last thing to lose is democracy. Has it been working, no, but we stood a chance for change but letting a drug addict Felon, rapist and traitor to be our leader. We are a step away from being N Korea",Maoleficent,2025-05-06T17:03:06,65
"All Trump needs is fake military uniform with a bunch of medals and some aviator sunglasses.  Boom, Needy Amin.",Carbonatite,2025-05-06T19:48:09,24
he's a hair's breath away from walking around in a military uniform and ordering 20-foot portraits of himself painted on buildings,playlistsandfeelings,2025-05-07T08:13:48,1
"> Cowards and despots throw military parades - Russia, Iran, China, North Korea, Turkey, etc.  Rubbish. India, the largest democracy in the world, and the mother of democracy, also hold military parades all the time. Even we use to do military parades as well. JFK had one.",xibeno9261,2025-05-06T16:52:51,-4
"Makes me nostalgic for simpler, less batshit crazy times...",RiseUpAmericans,2025-05-08T02:47:53,2
The best way to celebrate the US Army anniversary is with a No Kings protest.,robinthebank,2025-05-06T22:19:51,27
"There are protests being planned for that day. The First Felon's firing of military officers and leaders of the national guard have been replaced by those in line with him. It will be like Kent State and the '68 Dem convention and all the other peaceful protests - a shoot to kill order will be issued and he will delcare martial law. Beyond peaceful protests, it may be time to plan for a work shortage. Remember that many if not most of the protests began peacefully until the cops got involved. By chance my grandmother and I were caught in the middle of the protest in '68 and saw exactly what the police were doing. There are several documentaries of that time.  This is all in the Project 2025. The Felon is an incompetent fool - the distracting clown in the spotlight while the dark forces behind Project 2025 are working to put their plan in place qiuetly while letting him shoot off his anal shaped mouth. Please note that many other countries are also protesting against him - let's not let France show us how it's done.",Maoleficent,2025-05-06T21:44:55,1
No US president has ever ordered a parade for the Army's birthday either!,Slackluster,2025-05-06T10:55:07,113
Most unfortunate. You know the turd is going to use this as cover to exalt himself.,Primordial_Cumquat,2025-05-06T19:23:58,3
And flag day,deadsoulinside,2025-05-06T11:37:54,0
 M my u u no. Nonobonon onononobono. O onononob o no nonobonono,aprilinseptember,2025-05-06T18:02:44,0
"This allows them to phase shift at will between ""the protesters hate our soldiers"" and ""what a triumphant birthday for our beloved leader""",Schmimps,2025-05-06T18:18:48,0
Let's all go to make believe land where this stupid shit was going to happen even if Harris was President. Because that is what you are presenting here.,RobutNotRobot,2025-05-06T15:46:00,12
you mispelled penis,atari26k,2025-05-06T23:42:17,1
I hope he doesn't leave the Navy out - I want to see a submarine on a trailer in this parade.,One_Mycologist_4655,2025-05-07T15:14:17,1
If you didn’t buy your kid 250 pencils you’d have more money for the chemo!,porgy_tirebiter,2025-05-06T19:49:02,12
"It’s either that or when nobody can afford their homes or food anymore that will make people see what this regime is. A massive shock to the populace or the removal of bread and circuses.   Everyone will have to make a decision that day. Lie down and take it, grovel and support it, or fight and destroy it.",Spastik2D,2025-05-06T11:22:14,367
"""When the students poured into Tiananmen Square, the Chinese government almost blew it. Then they were vicious, they were horrible, but they put it down with strength. That shows you the power of strength. Our country is right now perceived as weak."" -Trump",liberal_texan,2025-05-06T12:13:03,45
"Trump has long admired how violently the Chinese massacred the protesters at Tiananmen Square stating “When the students poured into Tiananmen Square, the Chinese government almost blew it. Then they were vicious, they were horrible, and they put it down with strength. That shows you the power of strength.” https://repmcgovern.medium.com/on-the-anniversary-of-tiananmen-protests-trump-seeks-to-emulate-chinas-authoritarianism-to-c2e6fe2461c  During the height of the Black Lives Matters protests, trump asked his then defense secretary to “Can't you just shoot them?"" the former president asked. ""Just shoot them in the legs or something?"" https://www.rollingstone.com/politics/politics-news/mark-esper-trump-shoot-black-lives-matter-protesters-1346079/",Amon7777,2025-05-06T12:24:27,94
"I frequently wonder what would have happened if Tienanmen square had taken place when there was widely-used social media. The CCP put a lot of effort into suppressing media related to it, and I don't think suppressing something like that is even possible in this day and age. If anything it'd be turned into a meme ""Who would win, 100 patriots or a Tank""",ArchitectofExperienc,2025-05-06T12:07:57,35
It would be a lot harder to cover up with the prevalence of cameras today.,Mavian23,2025-05-06T11:50:48,9
It's in the US so it would be another Kent State.,Worried_Dot_7552,2025-05-06T12:36:50,6
[removed],[deleted],2025-05-06T10:16:43,39
You can stop wondering now.  The security there will be insane and I doubt these protesters have an imagination on how to sneak where the parade will be.,Ethan_Schitt,2025-05-06T12:25:48,4
"That would be a best case scenario actually.   The issue we're suffering from is a warming pot of water. We'll adjust until we're boiled.   If the band aid got pulled like that, that quickly. This country will correct before the entire world gets pulled in to a Russia like expansion of power situation. Now...that could go full blown civil war to forcing the fascists to pull back.",AgitatedStranger9698,2025-05-06T13:03:47,4
Or a “fly my pretties” moment…,TheMagicalSquirrel,2025-05-06T11:36:29,2
Please not🤞,Maleficent_Pay_4154,2025-05-06T13:29:50,1
That would be a trust test of whether both the military and 2A supporters hold up their end of their clams of what they stand for.,Kevin-W,2025-05-06T15:24:24,1
Didn’t Trump praise that incident?,Rinzler253,2025-05-06T15:33:43,1
"tbh would it matter in 2025 ? Back then the strategy was to censor , hide and pretend it didn't matter . Nowadays it would be all over the internet , videos of people getting ran over , 4k close ups of their mangled corpses , and within hours you would have all the right-wing talking heads justifying it , saying ""well it's tragic but they had no choice . I mean what kind of idiot stands in front of a tank ? Those people were woke traitors who hate our country and our military and are trying to sabotage Trump !"" . Within days , half of Americans would agree that killing the protesters was justified . Within a week or two it would be out of the news cycle . Rinse and repeat .",Foxintoxx,2025-05-06T15:50:48,1
