Comment,Author,Date,Score"Cool, who gives a shit. Celebrating your countries military is pathetic sad and embarrassing. We happen to have the biggest stick right now. Swinging it around in public for all to see makes us look weak.",Dangerpaladin,2025-05-06T14:18:14,8
inb4 [ Removed by Reddit ],VroomCoomer,2025-05-06T15:07:19,29
So where is all this going *if not* a giant civil war (…at best),BamMastaSam,2025-05-06T17:25:34,15
"> We hold these truths to be self-evident  That's the Declaration of Independence, not the Constitution. I'm with you 100% though.",loondawg,2025-05-06T17:40:30,12
">I think the most harrowing realization that a lot of americans are going to make over the next few months or years is that there is no ""making people see what this regime is"" . They ALREADY see it and it's EXACTLY what they want .  We have 77 million examples. Every single Trump supporter without exception wanted this, regardless of what they claim otherwise.",immortalfrieza2,2025-05-06T21:27:09,5
Hardtack doesn't have any eggs...,Condottiero_Magno,2025-05-06T12:29:41,15
"Interesting bit of history, when Marie Antoinette famously said, ""let them eat cake."" to the mass starvation of the French people, she actually said brioche. Brioche is a type of bread with egg in it and no one at the time could afford to eat it due to the high cost.",Impressive-Cable7708,2025-05-06T12:54:46,27
Right there with you. Part of me just wants it to fuckin’ happen already and for the bandaid to get ripped off but I know way too much about how this plays out historically. We are not going to be a superpower after this regardless of the outcome.,Spastik2D,2025-05-06T14:52:38,14
"The difference is that Russians have been beaten and trained into subservience since they lost to the Mongols in the 13th century, and the country was too big and isolated for any of the things that broke feudal Europe to affect it. Russia has essentially been one long unbroken train of ""*sucks, things look like they might be getting better actually no nevermind it sucks even harder now*"".  The US however has basically always been on an upward trajectory it's whole life AND has the taste of a few decades of being the literal top of the world.",ParagonFury,2025-05-06T15:18:38,13
"And now Russia is the most powerful, wealthiest nation on earth!!!  I can’t type that with a straight face.",TheCommonGround1,2025-05-06T13:31:15,10
How many weapons did the average Russian have. I don't think Americans can fight their government. But guerilla tactics in cities would make it extremely hard to control the entire country. They will meet resistance if they tried it in a way that the Russians couldn't have responded.,amootmarmot,2025-05-06T13:58:28,4
[That and the Chernobyl disaster.](https://www.keele.ac.uk/extinction/controversy/chernobylandussr/). At least according to Gorbachev.,richal,2025-05-07T11:55:15,1
Imagine finding a way to hijack the speakers so that FDT by Yg blares over the speakers.,Spastik2D,2025-05-06T16:42:39,2
"This is going to sound like a cop-out answer but one person can’t do it alone right now.   People are too comfortable in spite of all of the nonsense happening right now to follow the leader, especially if they think it’ll lead to death by drone strike. Bills are just barely paid, mouths are just barely fed, and there’s enough vidya and social media to go around to placate people. It’d be different if those needs weren’t met and the distractions were gone.",Spastik2D,2025-05-07T12:01:52,1
"KSU is a liberal island in the MAGA hellscape that is Portage County Ohio. Take a drive through there and based on all the spray painted maga signs around it's clear nobody outside of Kent would care if everyone at that college died. In fact, there's a sign just south of Randolph that says ""Send illegal students to Guantanamo."" Nice place.",cinch123,2025-05-07T05:14:19,1
"I don't think the US is an exception at all, its just different forms of control. Hell, even in those countries that *do* heavily restrict western media influence (in one form or another) can only do so much to restrict access, and not a single country on earth has total control",ArchitectofExperienc,2025-05-06T14:41:46,2
"Reeducated, grew to accept that that's how it is, as many people do by their 40s-60s, or either he or his family and friends are in danger if he says anything against them.",Malgus20033,2025-05-06T18:15:04,5
I’m going to go off on a limb and assume most of it was propaganda,Scout_1330,2025-05-06T14:55:32,7
China is unique. They can control what info reaches their people from outside and they basically have their own internet,trumpsucks12354,2025-05-06T19:00:19,2
"You need to make a *critical mass* of people not believe what they are seeing, and that would not be as easy as you think if there are hundreds of different recordings of a mass slaughter.",Mavian23,2025-05-06T16:22:47,3
"Look at how this administration has minimized January 6th, 2021.",thebowedbookshelf,2025-05-07T03:17:14,1
1984,highinthemountains,2025-05-07T07:30:29,1
"The level of control the CCP had over the populace and the media at that point is considerably different from what they have now.   If this ends up being a situation like Tiananmen and Trump authorizes that kind of action, the outcomes will be FAR different from the original.",Dorkamundo,2025-05-06T10:42:22,30
> Do you know how that day went after the famous photo?  People stopped acting like things will go back to normal.,fockyou,2025-05-06T10:31:11,30
> You sure hope it does? Do you know how that day went after the famous photo?  Yes. And?,fasterthanpligth,2025-05-06T11:29:58,-1
Revolution sometimes requires blood,Jokkeminator,2025-05-06T10:56:13,16
Then roll over for fascism already. Getting really fucking annoyed by your country acting like you can stand up to fascism without any risk of consequences. It's an awful thought but it's the truth of the matter so decide if you've got the courage to risk your life over peaceful assembly or not,[deleted],2025-05-06T11:28:06,18
Maybe I'm hopelessly naive but at the end of the day I still trust the enlisted guy at the controls to see protesters as fellow citizens and not threats. Don't think it would go the same - that needs to be demonstrated.,Ben2018,2025-05-06T11:28:10,6
"Very true, but there is a *lot* of MAGA country within a 2 hour drive, such as most of West Virginia.",Hwicc101,2025-05-06T14:34:37,5
They're also cowards.  And usually are not willing to live fire into a crowd at a parade.,Corporate-Shill406,2025-05-06T13:56:19,-3
What point do you think you're making?,Welsh_Pirate,2025-05-06T15:21:49,2
"Ooooooooh—we should have his favorites—Obama and Biden! He says “Biden” so often it should be a drinking game, I bet it would make his skin crawl to see a “thank you, Joe Biden” parade and everyone absolutely going nuts for his arch-nemesis! That plus protests against the Turd Reich™️ would get his diapers in a ketchup-throwing twist.",New-Purchase1818,2025-05-06T10:05:38,29
I’ll be wishing Mr. Obama a happy early 64th birthday on June 14.,LegitimateBeing2,2025-05-06T10:39:17,8
Take a photo of your ass and paint an orange mop on top of it.,Cryonaut555,2025-05-06T12:09:37,4
The self portrait that he hates,stonkstonk69,2025-05-06T14:31:31,1
Or his mugshot,captaincanada84,2025-05-06T14:45:51,1
Both. Why not both?!,Fay3fay3,2025-05-06T13:54:55,7
"Now would be the time to try, they don't have total control yet.",MissionCreeper,2025-05-06T10:09:56,48
Stephen Miller would gleefully hop in there and run through the crowd.,Bob_A_Ganoosh,2025-05-06T11:49:10,14
bro that low level driver will get a congressional medal and all you can eat McDonald's for life and speaking gigs around the country.   I bet you there are more than a few that would volunteer.,Valuable-Chemist440,2025-05-06T11:10:17,25
I live in a conservative hellhole in the South and that would not even be the end of him. These brainwished MAGA morons would probably cheer him on. They wouldn't give a shit unless they were personally ran over by a tank.   I can totally see it being the catalyst for Civil War part deux though.,basketcasey87,2025-05-06T10:39:17,30
If Jan 6th couldn't convince our country to abandon cheeto man then I highly doubt killing protestors would make people abandon Trump. I can't remember so correct me if I'm wrong but I also think Jan 6th was on national TV so it wouldn't change much.,Mobile-Olive-2126,2025-05-06T12:13:41,6
"We already have records of him from the last term ordering BLM protesters to be shot “In the legs or something,” and those mother fuckers voted for him *again*. Why would it change their mind this time? According to them, we’re the enemy. They don’t care if he uses force against us.   https://www.rollingstone.com/politics/politics-news/mark-esper-trump-shoot-black-lives-matter-protesters-1346079/",AzarothEaterOfSouls,2025-05-06T18:14:19,1
You are a braver human than most. ,brenster23,2025-05-06T18:14:59,1
"Fuck all nazis, grammar nazis too.",Noctulicious,2025-05-07T02:55:03,1
"Those idiots will find a way to criticize Democrats no matter what.  To some extent I agree we shouldn't give them unnecessary ammunition, but that can only go so far.  The only way we can avoid criticism is to completely muzzle ourselves, which is what they want anyway.",flip314,2025-05-06T12:19:32,15
"Then I’ll make them play mental gymnastics with all of the nonsense that they say and do, because its quite easy.  If a clear Nazi Salute from Musk can be interpreted as “giving his heart out” I can say Sic Semper Tyrannis and not mean any relation to booth.",d_4bes,2025-05-06T12:09:42,7
"Idiots are idiots, and they can make whatever idiotic inference they want, they will regardless anyhow.",BlimmBlam,2025-05-06T12:27:09,5
" Look, I'm going to say the quiet part out loud for the people that haven't figured it out yet:  You noticed how most of the protests that have been happening are specifically being organized EVERYWHERE, but rarely are people trying to gather everyone in a traditional big show location?  The reality is, this administration is weaker than it look, but it loves to put all of it's eggs in one basket and push. Add in that Trumps gang of idiots aren't smart enough to know that shooting tank rounds into a crowd of a million people is the fast way to a revolution and a very painful suicide for the soldiers involved. Things like fluid dynamics and 'crowd crush' get involved.  But if things go down that way, we're never putting anything like a country back together again. The bad blood will go so deep the various American Nations will be at war for each other for the next century. Probably longer. And yes, things can get worse. So much worse than you can imagine even now.   But without protests, we're fucked because the politicians need to be aware of the citizens as much as Trump.       So, the answer is to never provide Trump a opportunity where he is allowed to dream of the 'swift, decisive victory', where he feels he can just let the army loose and kill everyone. Massive protests in every city in the US? He can't and won't split up his forces enough to fight that. Too much of a chance of non loyal troops being isolated from the controlling infrastructure, too much of a chance of his precious military toys being captured and him looking the fool. He'll just hunker down, afraid, and pontificate as his mind goes.  The more he hunkers down, the weaker he looks. A empty parade in a empty DC, while Arlington and Baltimore and Philadelphia are filled with protestors tells a different story, and one that will provide pause for even Trump's worst enablers.",Triple_M_OG,2025-05-06T13:49:19,33
Technically the whole of the American people could point theirs at any politician right now and claim self defense.,NemesisShadow,2025-05-06T22:29:01,1
"I think it's foolish to think the military is going to save us. A lot of the types to join the military are the same aimless, angry, white nationalist types that join the police.   They could at any point intervene if they really wanted to. I'd love to be proven wrong, and maybe the parade will be what does it, but I'm doubtful given past ""checks and balances"" being ignored.",MagicOtters,2025-05-06T14:39:03,2
"The military is not going to save us, but it might kill us.",RobutNotRobot,2025-05-06T15:55:05,1
"We already have Veterans Day, Memorial Day, and Armed Forces Day. The entire month of May is also to honor those in the military.  We don't need another fucking parade. Especially not one that will cost near 100 million.",SparkyMuffin,2025-05-06T15:22:15,5
"Let’s see, the army announces that they will be hosting a military parade to celebrate their 250th birthday and you crazies took that to mean a military parade to celebrate Trump just because Trump and the Army share a birthday. You’re choosing to protest because of the parade which again, is to celebrate the Army and therefore you are protesting the army.",Thin_Cherry_9140,2025-05-07T00:59:18,0
"It reminded me of the classic ""fell down an elevator shaft onto some bullets""",AltF40,2025-05-06T19:49:15,36
"The Army's birthday lands on a Saturday this year so most troops will already have the day off, minus those in the field or deployed.",PatriotGabe,2025-05-06T14:09:46,-17
"Army personnel get 30 days of leave per year, plus various federal holidays.",derekakessler,2025-05-06T11:41:24,-21
They're also for celebrations. See: Military parades after WWI and WWII.,derekakessler,2025-05-06T11:29:06,-39
I got a 3 day ban for mentioning revolution in a comment.,Desperate_Bite_7538,2025-05-06T19:08:27,14
Reddit is dead. Move on,RedditIsDeadMoveOn,2025-05-06T18:12:15,-5
"Russia. It’s a dictatorship disguised as a democracy. Any retaliation or protest is squashed. People there have been beaten down to acceptance. We will only get one chance to reverse course, after that the U.S. will be extremely similar to Russia.",I_Love_To_Poop420,2025-05-06T17:58:25,24
"yes it is, my comment about him shitting on the constitution is referring to when asked if it’s the presidents job to uphold the constitution, trump said “i don’t know.” and also his blatant disregard for the 5th amendment.",RedditAtRyan,2025-05-06T17:45:01,2
Nope it was Jean-Jacques Rousseau who said it. It was false just to push the revolution,mushaaleste2,2025-05-06T13:43:48,16
"The cake was was more than likely in reference to the bits of flour that end up coating the sides of the oven, but Marie Antoinette never said it.  [What was so wrong about Marie Antoinette saying “Let them eat cake”? ](https://www.reddit.com/r/NoStupidQuestions/comments/qbyxo2/what_was_so_wrong_about_marie_antoinette_saying/)",Condottiero_Magno,2025-05-06T14:07:59,5
> We are not going to be a superpower after this regardless of the outcome.  Good. We  never deserved it.,RedditIsDeadMoveOn,2025-05-06T18:14:44,6
Always has been.,SilverCats,2025-05-06T13:33:54,0
"Wouldn’t put it past them to use bluetooth speakers with factory default passwords… could be fun.  Anything disruptive but not violent should be on the table. Drop 1000 thrift store backpacks with thrift store electronics in them in the area, call in and report every one as suspicious, keep them so busy chasing ghosts that it becomes too much trouble/too much perceived danger to start the parade.",too_soon_bot,2025-05-06T16:48:31,3
The possibility of physical risk you point out means the stakes will never be small. The question is whether you will take the risk that you are asking others to accept.,cutelyaware,2025-05-07T15:18:43,1
Yeah I went there— townies are openly hostile,sevens7and7sevens,2025-05-07T07:27:00,1
"I don't really understand what you mean with ""not a single country on earth has total control"". Many totalitarian dictatorships have had near total control the last 100 years. You could argue that during the last 100 years more people have lived under the oppression of a totalitarian regime than in democratic societies with free speech.  There's no need for total control for total oppression. Fear is the motivating factor. If people are afraid there will be total control in a practical sense. I feel you have a pretty bad grasp of how a tyrannical oppressive society works.  It relies much on the populace oppressing each other to keep their own head down. I think maybe you are so used to having free speech that you have trouble imagining the possibility of not having it. But imagine a point where ""woke opinions"" are considered  treasonous. What are ""woke opinions""? Who knows? Whatever the powers that be consider uncomfortable.   Imagine if people who are outspoken start dissappearing. There are no courts to rely on for a due process because their function is to legitimize the oppression by playing along. Now imagine you hear your coworker say something ""unpatriotic"". What do you do? Do you inform on them? or do you put yourself at risk by interacting with someone you know harbor unamerican sentiment.  Now imagine your children are being tought in school that their loyalty lies with their country before anything else. They learn that it's heroic to tip of the secret police if they hear anything unamerican. They learn that they should even betray their parents if they are ""terrorists"" that want to destroy america. What do you do at home? Even if you trust your children, will you put that on them? Suddenly you can't even speak freely in your own home.  Then you get a ban on public gatherings. The libraries are being emptied from literature that might give you some thoughts of how a different society might look. Then search results are getting strange. History aren't described as you remember it, but everyone else is just playing along. Information you knew existed before arent avaiable to you anymore. People forget very fast and adjust just as fast you know. In a couple of years it's just normal to self censor.   Imagine if there was tools that could look through your entire social media and look for ""unpatriotic"" opinions. And the government has access to this (in america this is already true that the goverment have access to all your private data even though you aren't a suspect in any crime because of the patriot act). Now will you go on facebook to rant about Trump? No because you might dissappear for a couple of years to a work camp. Picking the vegetables that noone wants to pick or working in some random mine.  I realize I sound like I'm exhaggurating, but it has happened MANY times in other countries and there is nothing in the current state of the US that shows signs that there are any breaks what so ever on this development.  I'm pretty sure it's a pipe dream to think that Meta, Google, Tictoc or X will stand strong when they are being threatened with being outlawed. If anything social media will be the first to capitulate because they are just companies out to make money of you.",Tegurd,2025-05-06T15:57:04,9
"> can only do so much to restrict access  Yes. And the other side of that coin is punishment. You make an example of enough people and the rest will not want access to restricted content.   Look at Republicans now. We call it ""bubbles"" and ""echo chambers"" now.",tech57,2025-05-06T15:08:11,3
Based on what? Their covid reporting was absolutely way under.,SolarTsunami,2025-05-06T22:21:35,1
"They won't be watching a mass slaughter of innocent civilians, they'll be watching the army protecting the country from illegal domestic terrorists. It'll be the terrorists who started it. It will be them who didn't back down. It will be the terrorists who were aggressive and the military had every right to defend itself from a threat.  So I don't think it will be ""you didn't see this"", it will be ""this is what you are seeing, trust us""  I don't think the critical mass of people believing that is high at all. Many Fox news viewers will swallow that up and wished they were there helping the military out",Tegurd,2025-05-06T16:31:28,5
That’s right. It’s totally bizarre to me that there isn’t any real outrage about a president who attempted a coup pardoned the people who stormed the capitol to violently take over the government and hang the VP.   I can’t let go of how weakly the American public has responded to this. What the hell is going on over there?,Tegurd,2025-05-07T03:32:28,2
Based on what empirical evidence? Everything I have seen from this government very much shows compliance with this administration’s goals.    Who is going to hold them accountable? Trump is literally trampling on the constitution and congress is shrugging as they rubber stamp it all.,punkguy1219,2025-05-06T12:13:28,3
Always* requires,Historian2988,2025-05-06T11:27:43,22
Imagine typing this in response to someone saying they dont want peaceful protesters to get run over and washed down the storm drains,UltimateToa,2025-05-06T11:41:18,3
Remember Kent State?,Condottiero_Magno,2025-05-06T12:31:24,4
True that.,Barbarake,2025-05-06T18:45:01,1
"Uhh so very wrong. The police here have zero remorse for shooting into crowds, best example is when they were pursuing that UPS truck years ago.",Rinzler253,2025-05-06T15:35:01,13
"Were you asleep during the BLM protests of 2020? They straight up beat the shit out of foreign reporters in the land of ""freedom of the press"": https://www.youtube.com/watch?v=jBPJNohU7xE",cracked_egg_irl,2025-05-06T15:58:19,11
>What point do you think you're making?  I wasn't aware that I was supposed to be making a point.,MinistryOfCoup-th,2025-05-07T05:36:08,1
"If Trump saying “Biden” was a drinking game, I fear the only state in the union to exist after a week would be Wisconsin",oshkoshpots,2025-05-06T10:30:31,15
He likes his mugshot,oshkoshpots,2025-05-06T14:53:38,1
"Hate to say it but yep.   What happened when that white kid murdered a protester? Did he face any real consequences? Republicans canonized him.   It's a mistake to assume Republicans won't be evil, cultivate evil, and celebrate evil.",Hadrian_x_Antinous,2025-05-06T14:03:17,6
"Their face would be plastered all over the internet. They would be shunned by the vast majority of people. Even if someone volunteered, I don't think they understand what would happen to their life. Actions have consequences, after all. I don't think it would happen.",Classicman269,2025-05-06T11:24:15,7
"Yeah, they're all for running over protestors. It's happened a few times, but they're always fantasizing about it in comments when there *is* one covered by a local station.",innosins,2025-05-06T10:59:23,23
I believe several states have made it legal to run over protestors,FinishImmediate6684,2025-05-06T11:50:36,13
Maybe hot take but some of the MAGA group wouldn't care if they got run over either because they'd say they're sacrificing themselves for Trump or something like that.,Mobile-Olive-2126,2025-05-06T12:22:57,8
"When you said conservative hellhole, I immediately wondered if you were around Greenville, ha. My sister actually volunteers for Republicans in Oconee and Pickens counties. I just can’t understand it.",aboutlikecommon,2025-05-06T12:53:05,5
There is a significance difference between a mob that Trump sent off that killed people and Trump ordering the military to kill US protestors for his birthday.,LangyMD,2025-05-06T13:37:19,5
"The military doesn’t ever need to do anything, you’re misunderstanding me. They would only ever really be useful on a short term basis, anything prolonged and it would tear itself apart with infighting just like the rest of the nation. Knowing to what/whom the forces would initially stay faithful to is what really matters. ",Kermit_the_hog,2025-05-06T14:49:33,2
You don't think it would irreparably tear itself apart just as much as the general population? The services are hardly a monolith.,Kermit_the_hog,2025-05-06T15:59:17,1
"> Let’s see, the army announces that they will be hosting a military parade to celebrate their 250th birthday and you crazies took that to mean a military parade to celebrate Trump just because Trump and the Army share a birthday.   Yes, because the Army doesn't do this. Trump does. Trump wanted this. Not the army.   You think that these two points have nothing to do with each other, because Fox News has conditioned the ability to critically think out of you. The rest of us can still think rationally. That's why you and the rest of the cult think we're crazy.  Because we still think.  > You’re choosing to protest because of the parade which again, is to celebrate the Army and therefore you are protesting the army.  Nope. It's to protest the dictator that is currently organizing a military parade for his birthday. You can deny reality all you want, but these are simple facts that exist regardless of how hard you and the rest of the right melt down in a flurry of indignant virtue signaling.  Facts, famously, do not care about your feelings.",Despair-Envy,2025-05-07T02:59:44,2
ah a viewer of fine cinema,mekomaniac,2025-05-07T06:06:58,4
"Or the sequel “fell down some stairs, and into a golf course”.",Weak_Sloth,2025-05-07T07:28:25,2
"🤓  Then it'd be a 3-day, or 4-day weekend.",Man_with_the_Fedora,2025-05-06T20:29:45,7
So give them another one instead of giving them more work for no reason,SparkyMuffin,2025-05-06T12:04:03,36
I see. and what accomplishment of the same level as winning a world war and the return of thousands of soldiers are we celebrating here?,hobofats,2025-05-06T11:34:43,45
The birthday of the Army is not cause for celebration though.,Slackluster,2025-05-06T11:43:21,21
"It's dead, yet here you are commenting on a topic with 20k upvotes. Lame ass troll.",TheGCO,2025-05-06T23:25:52,3
