Comment,Author,Date,Score"I've always been wondering that, would they really do it? Would the US Government really rather kill its own citizens in broad daylight than change its ways?",IceCreamMeatballs,2025-05-06T16:40:33,1
Times Square,ElongThrust0,2025-05-06T12:12:43,1
"Just in relation to tanks running over protestors? Yes.  That’s cause tanks didn’t run over protestors at Tiananmen Square.  Soldiers attacked with small arms, not using their tanks as battering rams, and the famous video of the Tiananmen Square Tank Man is of the tank actively avoiding to run him over till someone comes over and pulls him away",Scout_1330,2025-05-06T14:46:26,1
"This will be what Americans envision Tianamen square was like. Realistically what happened in Tianamen square is closer to January 6th, especially when you consider that protests were funded by anti communists in Hong Kong.",MeZooey,2025-05-06T15:38:40,-1
You're going to stand in front of a moving tank?,Tigerballs07,2025-05-06T19:16:08,3
it would also really confuse the CCP algos that ban any imagery of the sort. I wonder if the Chinese media would even report on it because the imagery is such a parallel to their own event lol,Skiinz19,2025-05-06T09:59:03,54
"But it only takes a small percentage of protesters to stop the parade, while it takes a large percentage to ensure empty crowds. ",jericho,2025-05-06T12:09:19,44
"It's not about sending him a message, he's so thin skinned any number of everyday forms of resistance will get to him. It's about sending a message to the population.",F9-0021,2025-05-06T15:01:47,4
There will be cultists there. Can’t stop them from gobbling. ,MetallicGray,2025-05-06T13:29:26,2
" Many smaller protests spread out over the city, not just one big one. They can’t handle 10 1,000 demonstration. Only 1 10,000 one",Do_What_Thou_Will,2025-05-06T14:01:49,6
"If you have a group you can simply push the cops out of the way.  They're still just people (well, by some definitions).",Corporate-Shill406,2025-05-06T12:21:38,11
"Military...,.... we're headed that way. So much for protecting us from domestic enemies.",ikesbutt,2025-05-06T17:08:24,1
"50501 has designated Philly the ""national anchor event"" specifically to keep the attention away from DC.",somethrows,2025-05-06T11:40:24,26
"Signs, placard is too much of a big word for him.",laukaus,2025-05-06T14:23:34,30
LOL xD,Neat_Secretary_7159,2025-05-07T18:26:07,1
There's only one island that orange buffoon is aware of and it has nothing to do with Charles Darwin.,Bass2Mouth,2025-05-06T15:22:33,9
Exactly. He’ll say it no matter what. It’ll be better if we’re all there with protest signs.,CaptainDroopers,2025-05-06T11:34:57,2
lol thanks you needed the laugh,LikeIsaidItsNothing,2025-05-06T16:54:25,1
How very Tiananmen Square of you,Ziograffiato,2025-05-06T13:07:31,1
"Hear me out.  You know what's more fun than protesting a parade?  It's [joining a parade you're not supposed to be a part of.](https://i.imgur.com/qFUyz7e.mp4)  And I know you're thinking, ""I don't want to be a part of a parade that's in Trump's honor"" -- but really, if enough people join a parade, [those people basically get to decide what the parade is about](https://i.imgur.com/jddpjcR.mp4).  This parade is scheduled for June 14th.  [What kind of parade TYPICALLY happens in June](https://en.wikipedia.org/wiki/Pride_parade)?  If enough people join wearing precisely the right kind of garb and waving precisely the right kind of flag, I wonder how Trump will enjoy the optics of ""his"" June parade?",Piogre,2025-05-07T02:07:50,1
I believe Cliff Clash / We Are The Flood are planning to line the parade route with people holding upside-down flags.,litesgod,2025-05-06T09:36:48,149
"Exactly—get EVERYONE into the streets the day before and have them fly upside-down flags and protest this unmitigated travesty; then, let it stand in stark contrast with the couple hundred MAGAts having their compensatory circle jerk with US military personnel and vehicles. It’ll look impotent and laughable compared with the protests filling the streets the day before.",New-Purchase1818,2025-05-06T09:59:46,90
"It is literally ""Flag Day"", so that seems appropriate.",0002millertime,2025-05-06T09:46:12,58
There’s enough inbred MAGA shit-fucks to make it look like there was a turnout. I live on the other side of the country and I know multiple people going. …in support of him.  There needs to be a bigger crowd protesting and the MAGAs celebrating. There needs to be unrest. People have to clash. This has to turn into a massive fucking optics mess.,Getatbay,2025-05-06T15:39:28,2
I love the idea but knowing him he will order the tanks to run them over. ,brenster23,2025-05-06T09:37:03,57
Exactly! Where the hell is the leadership?  ,Early_Gen_X,2025-05-06T10:30:54,7
"They're far too busy laying low and seeding news stories about how ""there's a global movement away from Trumpism - the far right's extremism is turning off moderates, who will flock to vote for Democrats any day now!"" so they can excuse continuing their ""centrist"" horseshit while they sprint further towards the right 👍",SamsonGray202,2025-05-06T11:10:31,7
DOGE has been a net cost.,xvx_k1r1t0_xvxkillme,2025-05-06T11:19:38,3
*Merica.,som_juan,2025-05-06T10:05:44,2
"Sic Semper Moronibus, as 'moron' would likely a third declension noun",CadensLuna,2025-05-06T11:04:41,33
Sic Semper Diaperus,tinathefatlardgosh,2025-05-06T14:33:47,1
"Rick ""Semper"" Moranis",deadlybydsgn,2025-05-06T20:24:52,1
"Sic Semper Tyrannis is actually much older than that. It's Virginia's state motto, for one, but it has a strong association with the American Revolution and was used by many of our founding fathers. While I don't think it actually appears in any ancient Roman texts, it's closely associated with the assassination of Cesar.   It's not just ""that thing John Wilkes Booth shouted"", he was referencing a long history that doesn't need to be erased or poisoned because of that event.",NoBizlikeChloeBiz,2025-05-06T10:35:37,35
"Setting aside that Booth doesn't own that phrase, if it's used as a rallying cry for resistance to the last Republican president (overly hopeful, I know but let a man dream), it has a nice poetic irony to it. Used incorrectly on the first, and properly on the last. Were I writing a multi-generational epic storyline, this is the kind of thing one would expect to see.",Xaero_Hour,2025-05-06T11:09:22,7
I would think it would truly be a shame if the parade route would be completely blocked by thousands and thousands of protestors.,SpookySP,2025-05-06T11:57:35,44
>somewhere else  in practice this would likely mean split between dozens of other locations with smaller and unimpressive crowds.  we all remember what al green did during the sotu. nobody remembers  aoc or ron wyden's alternate events.,RichardSaunders,2025-05-07T04:16:26,1
There’s something like 200 police forces in DC. They’d be removed by them or likely not even be able to get close to the equipment/route,bibrexd,2025-05-06T10:54:54,39
"I was almost arrested in DC protesting during the Bush II “free speech cage” era when being within sight of the capitol or White House was not allowed.   If they handle it about like that, the civilian police will line the street in riot gear. Visible snipers on the roofs. If you go out of your designated free speech zone mounted police will threaten you with violence immediately.   My guess is this will be worse and the civilian police will be the ones who actually do get violent if needed (or more like Charlottesville).   I do not think the military will run over anyone unless they handpick tank drivers from white nationalist militia backgrounds, in which case all bets are off. I do though think it’s unlikely any meaningful sized protest will be allowed close enough for it to be an issue and I honestly think DC should be a ghost town for this with widespread action elsewhere. Don’t give the man what he wants. ",sevens7and7sevens,2025-05-06T13:15:27,29
I might be wrong but I think military members have no jurisdiction on US soil. They would have to stand there and take it. Is the police or White House security that would probably arrest anyone resisting.,Haunting-Warthog6064,2025-05-06T11:06:42,6
"i think the ones at the parade volunteer to be there, so it wouldn't be good  i might be wrong",haroldthehampster,2025-05-06T12:15:58,0
We can't afford the department of education but we can have a parade.,simpersly,2025-05-06T14:56:34,16
this is “peanuts” compared to everything else according to him,2018MunchieOfTheYear,2025-05-07T03:43:20,2
"Well, they are certainly at risk of losing their socialism.... that's for sure.",Several_Leather_9500,2025-05-06T12:49:49,14
There are more of us than there are of them. I have to have faith that eventually we will all rise up together. I know at some point he’s going to cross a line we all agree was too far and then we can mobilize and use our rights.,NemesisShadow,2025-05-06T14:21:29,4
Oh I don’t doubt it but we still don’t need to hand a match to the guy with all the dynamite.   All that being said and my hope for non violence across the board aside- I admire how the French get shit done and I’ll leave it at that.,FeebysPaperBoat,2025-05-06T13:17:16,1
Do a really cool concert across the street and draw the crowd away from him. Out sweet 16 him.,Vegetable-Bend-3748,2025-05-06T09:17:55,9
> It appeared that there had even been demonstrations to thank Big Brother for raising the chocolate ration to twenty grammes a week.,SteveMcQwark,2025-05-06T09:18:48,10
Still worth it to send a message,MyNameCannotBeSpoken,2025-05-06T09:15:58,1
Exactly,milelongpipe,2025-05-06T16:05:47,1
"And you just know the propaganda factories like Fox News and Twitter would spin that as ""The left is booing our service members! How dare they!""",ToeSniffer245,2025-05-06T09:32:22,28
"“I was saying 'Too-rump'""",peeja,2025-05-06T10:15:25,2
Booing the military is good too. It's an added bonus.,MagicOtters,2025-05-06T10:12:20,1
"I mean, sure. I’m not a sports person but all of those are preferable to a king.",Beneficial-Fold0623,2025-05-06T17:58:43,1
"Hmmm... What happens when people of a certain color gather together to protest? If only we had something to remind us like, I dunno, George Floyd and the BLM protests.  You don't think that the Trump administration would absolutely **love** to do a mass arrest of dark folks? After the Colombian AMSR video, do you really think they're not salivating at the thought of doing the same to Black people?  White people did this, so get out there and stop hiding behind minorities. It's pathetic.",TheGhostOfArtBell,2025-05-06T16:32:09,3
He would still say it was in support for him!,anicenap,2025-05-06T11:15:56,0
this is the time when people start standing up.,Junior-Addendum88,2025-05-06T19:09:37,1
I just want an excuse to buy a “Robespierre was right!” Shirt,DerpEnaz,2025-05-06T09:28:03,8
And how does a military parade for the army benefit the country?,SparkyMuffin,2025-05-06T12:57:43,5
"Wasn't it just a few days ago during a town hall that an elderly woman was forcibly removed for simply questioning Trump's tariffs, and no one stepped in to stop it? I admit I'm commenting from the privilege of never having to find out how useless I myself would be in this situation, and don't know all the details, but it feels like the time for solidarity and protest was nearly a decade ago. It's much harder to climb out of a dictatorship than it is to slip into one, and America seems dangerously close to that tipping point. I truly hope for the best for all of you though.",soulunion4life,2025-05-07T12:59:16,1
No they are protesting the army’s birthday parade like weirdos,Thin_Cherry_9140,2025-05-06T22:42:36,-2
Don’t forget the one who died in prison,Weak_Sloth,2025-05-06T17:23:31,99
Wonder if he’s gonna invite them to the big White House sock hop he’s throwing.,Cpap4roosters,2025-05-06T20:22:49,1
Those are all the ones he admires and aspires to be like!,Preacher987,2025-05-07T08:14:33,1
High five!,Otisthedog999,2025-05-06T21:58:24,3
"Don't anyone ask him if he'd like one, and don't send him a stupid-ass one, cuz he'll wear it otherwise get one, and then the USA is one step along the conveyor.",Kamelasa,2025-05-06T22:18:52,2
"He's like an unfunny version of Sacha Baron Cohen's character from The Dictator, 'President/Prime Minister/Admiral/General Aladeen.' ",HansSolo69er,2025-05-08T11:05:59,1
"No love for the Navy, Air Force or Marines either, I assume?",MyMorningSun,2025-05-06T12:26:15,-9
"Well, it is the Army's 250th birthday.",derekakessler,2025-05-06T10:57:50,-28
Ah yes...we all remember the parades from coast to coast for...Flag day.,RobutNotRobot,2025-05-06T15:45:01,4
"We hold these truths to be self-evident, that all men are created equal, that they are endowed by their Creator with certain unalienable Rights, that among these are Life, Liberty and the pursuit of Happiness. That to secure these rights, Governments are instituted among Men, deriving their just powers from the consent of the governed, **That whenever any Form of Government becomes destructive of these ends, it is the Right of the People to alter or to abolish it, and to institute new Government, laying its foundation on such principles and organizing its powers in such form, as to them shall seem most likely to effect their Safety and Happiness.**  deporting US citizens without due process and refusing to return them, shitting on the constitution, and ignoring court orders is pretty damn destructive to my life, liberty and pursuit of happiness.",RedditAtRyan,2025-05-06T12:54:02,237
"I think the most harrowing realization that a lot of americans are going to make over the next few months or years is that there is no ""making people see what this regime is"" . They ALREADY see it and it's EXACTLY what they want .      It's asking me think of [this story](https://www.nbcnews.com/news/us-news/online-fundraiser-woman-used-racial-slur-raises-675k-racist-support-rcna204923) about a woman calling a 5 year old kid the N word and receiving tons of support for it (675k $ fundraiser) . If the video wasn't out , I could imagine someone putting a lot of effort trying to find the video , the proof , telling themselves ""once I unearth the truth , once I prove it to everyone , then they'll see what she is ACTUALLY like and they'll change their minds !"" only to realize that this was just absolute naïveté.",Foxintoxx,2025-05-06T16:01:27,25
"Just not the kinds of bread with egg in it, nobody can afford those",Corporate-Shill406,2025-05-06T12:20:31,35
I have the sad feeling that’s going to be sooner than later and I’m feeling scared.,Professional_Ad_8,2025-05-06T13:22:08,12
I wouldn't be so sure. Soviet union killed millions of their own people and then went on to survive for 70 years. What did them in was a coup by the rebel group that though that the existing government was not oppressive enough. A housing and a food shortage might not be enough to undermine Trump's government. They could just blame it on the Dems and become even more entrenched.,SilverCats,2025-05-06T12:39:06,22
[ Removed by Reddit ],too_soon_bot,2025-05-06T16:19:15,5
iPhones and hot chips while the Kardashians are on in the background,thebochman,2025-05-06T13:58:47,2
"If they wait til they don’t have food, they’ll be too weak to fight.",SwingingtotheBeat,2025-05-06T14:22:45,1
Well said.,idOvObi,2025-05-06T16:24:27,1
Show us how,cutelyaware,2025-05-06T16:37:51,1
"When the Kent State (and Jackson State) massacres happened, there was a prevailing opinion among many local non-college residents that the murdered students might have deserved it. Those people are out flying maga flags instead of American flags now and so are a lot of their adult children. ",sevens7and7sevens,2025-05-06T12:55:57,69
"It’s totally possible to suppress social media today.   Russia, China and Iran has total or heavily restricted western social media.   Turkey and India have both temporarily blacked out Facebook, tictoc, twitter and instagram during political unrest.   You’re fooling yourself if you think the US is an exception to this.",Tegurd,2025-05-06T14:07:10,21
"I met a guy who was a student shot during Tienanmen Square. He was a software engineer in the US. He played soccer with us during lunch and had a scar on his leg.  I posed a negative question about how he must hate the Chinese government and he looked mortified and said something to the effect of ""no, no, you will never understand"".  I'm still confused by that.",CerebusGortok,2025-05-06T15:51:44,7
"I would say look to how china handled covid for an answer on that.  They listed the death-toll as only about 4000 for at least a year, but some estimates by satellite photo of the crematoriums suggested that as many as 100 million could have died from it.  Im being somewhat conservative from my own recollections, as the highest end estimations even went as far as to suggest it made china’s population dip below 1 billion. Though how much of that was anti-china propaganda is hard to tell.",DSharp018,2025-05-06T12:35:33,17
Not really. You just need to make people not believe what they are seeing. Or at a minimum not do anything about what they are seeing. That's easy.  People turn their heads all the time and just let shit happen. As long as it doesn't affect you it's never mind the bollocks,Tegurd,2025-05-06T16:19:15,8
Or another [Orangeburg](https://en.m.wikipedia.org/wiki/Orangeburg_Massacre).,CassandraCubed,2025-05-06T14:02:35,2
You sure hope it does? Do you know how that day went after the famous photo?,emeraldeyesshine,2025-05-06T10:24:06,50
uhh i dont want blood and guts of squished peaceful protesters covering our streets thanks,koolkat182,2025-05-06T10:42:33,3
"If I have to, yes.",Andovars_Ghost,2025-05-06T19:17:53,8
"And as long as some sycophants show up, they will make it look well attended. So it's better to actively protest or interfere with the parade.",amootmarmot,2025-05-06T13:59:53,21
"The parade will be in Washington, DC, right? I don't think it will be difficult to convince 'a large percentage' to not show up.   (Washington DC is overwhelming democratic. Harris got 92.5% of the vote, Trump only got 6.6% in the 2024 election.)",Barbarake,2025-05-06T13:30:18,0
"In the US, police are heavily armed, willing to kill people, and legally protected when they do.",Spunky_Prewett,2025-05-06T13:16:55,27
"Yes, bastards are people too.",amootmarmot,2025-05-06T14:00:15,3
"Even in countries where the police aren't blindly loyal to the head of government/state, police would fight back if pushed. In here, you're gonna get teargassed, brutalized with batons, tazed, maced, and maybe even shot, and ultimately handcuffed. They're cowards if there's a lone shooter and they're underequipped, they're able and willing if it's an unarmed group of civilians.",Malgus20033,2025-05-06T18:19:49,3
This is pretty far from the truth. For a lot cops their ultimate dream is to get all suited up in full riot gear and go crack some protesters skulls.,RabbleRouser_1,2025-05-06T18:46:43,2
Trump: I'd like to thank all the people at the national anchor event for coming out for my birthday!,MinistryOfCoup-th,2025-05-06T11:42:11,7
Backs to the parade.,Eloquent_Sufficiency,2025-05-06T21:10:31,2
I like the idea of holding up giant photos of Presidents not DT.,oshkoshpots,2025-05-06T10:01:59,35
"The sign I've been using for protests is just a drawing of a pig with a picture of Trump's face pasted on its body, that simply says ""Trump is a fascist pig.""   I think if we make signs like that, it makes it pretty clear that we're not there to support him.",x_xHaunter313,2025-05-06T13:29:43,1
"Fly a rainbow flag instead, and watch their brains melt.",Steinrikur,2025-05-06T11:51:10,29
"Yeah, even if he did, I doubt the tanker would do it. No low-level tank driver is going to be the one known for running over an American protester.",Classicman269,2025-05-06T09:50:15,67
"To be frank, if he did it would probably be the end of him. Yeah, it would suck for whoever dies if the tanker actually did it (which they probably wouldn't) - but intentionally killing protestors on national TV is one thing that could very, very reasonably snap the country back to sanity.   Even the records of him ordering that would be enough to bury him if it got out even if the killing never actually happened.",LangyMD,2025-05-06T10:13:37,18
I think unless things get horrifically bad & very quickly that Americans are going complain about the hot tub's increasing temperature but not bother to get out and fix the problem.,aspirationless_photo,2025-05-06T09:45:45,20
"Hopefully not but if they do, I’d rather Americans see their true colours in one moment than wait for the slow frog boil",Waste-Gene-7793,2025-05-06T10:11:47,15
"As gruesome as it is, that may be the catalyst people need to wake up to his tyranny: Killing peaceful protestors in the streets is a good way to get public opinion against you and corpses are much harder to spin as justified, unlike arrests.",InsuranceToTheRescue,2025-05-06T11:04:52,2
"I, for one, would be honored to be squished by a tank in the fight against fascism.",AzarothEaterOfSouls,2025-05-06T18:02:09,1
"If he did, it would drastically accelerate him being ousted.",Dorkamundo,2025-05-06T10:39:58,1
This guy Latins.,blueraspberryfan410,2025-05-06T17:52:45,9
"The only good Nazi is a grammar Nazi, and they are sorely missed on this site. Thank you for the correction",AdmiralCunilingus,2025-05-06T13:33:41,8
"I know, but still, idiots will screenshot this and say ""Democrats want to relive how they killed Lincoln"" or something like that.",Penguinmanereikel,2025-05-06T10:49:45,-11
Are we really gonna create the opportunity for a US Tiananmen Square to happen under this regime though?,cob_maximus,2025-05-06T12:53:48,28
skydive,cubanobay,2025-05-06T12:33:39,4
"Good point, and I’d guess that route perimeter isn’t first set up the morning of or anything so it’ll probably be thoroughly padded by district/capitol police. Phew. That’s a little relieving. I can’t see anything good coming from antagonizing any of the soldiers who are out just trying to do the parade marching. ",Kermit_the_hog,2025-05-06T11:01:14,-1
"That has always previously been true for very good reason. Hegseth has been purging career military leaders and Trump has been issuing executive orders saying he can use troops in the US (starting with the border).  It may come down to actual military members to obey their oath and the constitution and refuse illegal orders, but hopefully not?",sevens7and7sevens,2025-05-06T13:19:12,14
I know! Let’s have tariffs on foreign films!,heiberdee2,2025-05-06T15:57:22,7
"Every major change took years. The American War of Independence lasted eight years; many people then believed that fighting against the British was suicide, and yet, you won. Your Civil War lasted four years; many thought it was the end of your country, and yet you succeeded. Women's rights—the fight has been going on for decades; LGBT rights, African-American rights. Many years ago, there was also a dictator in my country. He led us into a war that resulted in foreign powers bombing us. It was feared that he would never leave power—in the end, he did. Power is in the hands of the people, not the government. You shouldn't let your thoughts fool you because protests lasting a long time means they're maturing and building foundations. My country is also currently experiencing protests because our government is corrupt to the bone and is obviously supported by the EU, Russia, and the West.",ApplicationUpper1614,2025-05-06T14:38:01,3
Don’t point your gun at someone who has a gun. They can kill you and claim self defense.   Even if that person originally shot someone and you’re just trying to detain them.  They will lawyer up and claim self defense. And be turned into a martyr.,robinthebank,2025-05-06T22:25:16,1
Oh no! Well anyways...,RobutNotRobot,2025-05-06T15:54:41,1
I thought it might be a good idea to moon him. 😆,heiberdee2,2025-05-06T16:00:06,1
Exactly!,Galliagamer,2025-05-06T10:27:54,1
Foolish. We might literally need their weight to get us out of this mess if this continues for the next 4 years. Creating the image of a general public belligerently hostile to our own soldiers would only serve to push them closer to Trump (who tells them he loves them out of one side of his mouth while calling them “suckers and losers” out the other.),Kermit_the_hog,2025-05-06T10:42:47,2
"Sure, but it's bad optics.",Dorkamundo,2025-05-06T10:42:53,0
"""Charles-Henri Sanson for AG""",iKill_eu,2025-05-06T09:32:10,5
"How does any parade help anyone? It’s called esprit de corps, pride in one’s purpose & belonging.",RegularImplement2743,2025-05-06T15:09:05,-6
Nope. That's just what Fox News is telling you. It's not what's happening in reality.,Despair-Envy,2025-05-07T00:46:01,2
you mean hung himself on his own accord without any external parties involved?,ys-_,2025-05-06T19:45:08,39
So? There wasn't a massive parade for the 100th or 200th.  Maybe instead of a big expensive parade it would be better to give those army personal the day off to spend with their family instead.,Slackluster,2025-05-06T11:40:29,53
Their Float in this year’s Rose Parade celebrating 250 years included Tuskegee Airmen…the ones he ordered removed from websites etc..,MissAmyRogers,2025-05-06T11:42:02,19
"so? military parades are for dictators, not democracies.",hobofats,2025-05-06T11:27:51,44
