Comment,Author,Date,Score
" As a reminder, this subreddit [is for civil discussion.](/r/politics/wiki/index#wiki_be_civil)  In general, be courteous to others. Debate/discuss/argue the merits of ideas, don't attack people. Personal insults, shill or troll accusations, hate speech, any suggestion or support of harm, violence, or death, and other rule violations can result in a permanent ban.   If you see comments in violation of our rules, please report them.   For those who have questions regarding any media outlets being posted on this subreddit, please click [here](https://www.reddit.com/r/politics/wiki/approveddomainslist) to review our details as to our approved domains list and outlet criteria.    We are actively looking for new moderators.  If you have any interest in helping to make this subreddit a place for quality discussion, please fill out [this form](https://docs.google.com/forms/d/1y2swHD0KXFhStGFjW6k54r9iuMjzcFqDIVwuvdLBjSA).    ***   *I am a bot, and this action was performed automatically. Please [contact the moderators of this subreddit](/message/compose/?to=/r/politics) if you have any questions or concerns.*",AutoModerator,2025-05-06T09:04:17,1
No president in US history has ever ordered a parade for their own dumb ass birthday.,Slackluster,2025-05-06T10:23:45,2418
What a waste of taxpayer money.,Brownmunde88,2025-05-06T10:20:28,525
"Have people stand in front of the tanks, one at a time. Whenever someone is removed, another takes their place, thereby delaying the parade. Maybe have 'em yell out ""I'm Spartacus!""",Condottiero_Magno,2025-05-06T09:38:59,1615
“Every city was filled with people in the streets singing Happy Birthday to me. All with tears in their eyes. It was beautiful. Unlike anything the world has ever seen.”,Ziograffiato,2025-05-06T09:27:55,495
"I think do it the day before so he can't say ""Look how many people came out on my special day just for me""",ToeSniffer245,2025-05-06T09:09:25,1067
Sic Semper Tyrannis.,d_4bes,2025-05-06T09:26:39,225
I would think having the protests at other locations while his parade is going on would highlight how poorly attended it is. Especially if they compare crowd sizes. Imagine his fury when a protest draws 3 or 4 times the number of people as his parade.,Upbeat_Sign630,2025-05-06T10:22:49,227
I say block the parade,RattlinDrone,2025-05-06T10:01:27,95
"I see the American remake of ""The Tank Man"" incoming. Hopefully not as bloody.",sharpknot,2025-05-06T10:10:25,35
June 14 for anyone interested,baitnnswitch,2025-05-06T10:33:16,31
So they are following through with this military parade? For real?,IHazSnek,2025-05-06T10:18:23,26
Our budget is apparently so overblown that this scumbag is willing to garnish the wages of students but we have the money for this ridiculous bullshit.   MAGA does not give a single fuck about America or Americans.,markodgtouch,2025-05-06T15:05:02,27
"Adolf Hilter and Kim Il Sung are the only leaders to celebrate their birthday/day of sun with large displays of military power so far.  As an American, this is incredibly embarrassing. I have never felt such shame as this in my life and I'm going to see if there are any folks protesting this near where I live. I live in a multi-cultural community with lots of immigrants, so we don't see much action on the protest front due to fear of deportations.",Luzion,2025-05-06T13:46:26,47
"Please protest away from the parade route (unless there are farmers willing to dump manure along parade route). If you're going to be near the parade route, signs that read 'fuck flotus' will really get under his thin, orange skin. Book all the hotels close to the parade as well so magats have to pay more.",Several_Leather_9500,2025-05-06T09:40:47,71
"It strikes me that a month from now, store shelves will be bare and people will be panicking.   And the fat old fuck will be leaning forward on his toddler chair shitting his pants and wanting to clap at all the tanks as they go by.   Disrupt.   This.   Parade.",RobutNotRobot,2025-05-06T15:43:13,17
"It is the duty of every citizen there to interrupt that parade.   This is America, not some tin pot dictatorship.  We don’t do military parades for our presidents birthday. That’s some dictator shit.",CombinationLivid8284,2025-05-06T17:33:09,17
Shut it down. Occupy DC Surround Capitol and WH. 5 million strong. Don't let it happen,LostEarthDog,2025-05-06T13:42:26,14
Don’t we have the 2nd amendment so we the people can arm ourselves against a government that attempts to force a monarchy. Just saying.,NemesisShadow,2025-05-06T09:59:36,20
"While I'm pro-anything-that-is-anti-Trump, a ""no kings"" protest is about Trump. I prefer the ""post pictures of Obama online"" or maybe even make it ""national Obama/Biden appreciation day"".   Nothing would upset him more.",sagmag,2025-05-06T13:13:17,17
"And somehow that will get twisted into:  ""See, nobody liked Martin Luther King.  Why do we have a holiday for him?""",Catspaw129,2025-05-06T10:00:57,6
"Remember to be non violent, folks. You don’t want to give him the excuse to use declare martial law.   Take precautions. Don’t take your children to this protest just in case.   Masks are your friend. Coordinate off social media. Try to avoid taking your phone but do take a burner if you can.   Stay hydrated but be aware you’re gonna have trouble finding a bathroom.   Don’t park near the event if you have anti administration bumper stickers. You’ll just invite people to vandalize. Speaking of- don’t vandalize. Every person caught doing stuff like this will be used to reflect on all of us.   Do not bring weapons or anything that can be seen as one. Even if you have a CCP. Why? Because the secret service does not fuck around with threats and you don’t want to be sniped from a roof because of optics.   If you are arrested do not put up a fight. Do not say anything unless you have a public defender assigned to you or your own lawyer.   If you’re any shade other than white… you’re really fucking brave going to any protest these days and especially if you go to this protesting. I wish I had advice for you. Just wishing safety for all.",FeebysPaperBoat,2025-05-06T10:20:46,49
It's also flag day on June 14th. Make sure you fly your upside down flags!!,house343,2025-05-06T11:58:02,13
I prefer the fight against oligarchy instead of a king. Trump is not the singular problem. Please don't interpret what I say to downplay Trump. But the Oligarchy is what keeps driving this.,GeeBeeH,2025-05-06T12:59:21,7
Don’t forget to post pictures of Obama that day  (June 14).,turb0_encapsulator,2025-05-06T13:40:51,7
Vets that care about democracy should go and block it along with all of us. ,nunchucks2danutz,2025-05-06T18:03:32,6
[deleted],[deleted],2025-05-06T09:07:36,13
"Oh man, protests nationwide will be perfect, while he wastes so much of our taxpayer money on his stupid birthday.",ScenicPineapple,2025-05-06T11:32:36,6
A lot of people are going to get hurt. The people protesting know this. And I commend them for their willingness to go through it. Trump will truly look the tyrant he is when he has his goons strike down peaceful protesters.,alabasterskim,2025-05-06T14:44:40,7
"Your founding fathers fought King George, and y'all elected King Gorge 250 years later.",Oprah_Pwnfrey,2025-05-06T15:23:13,5
"""Real power isn't staged in Washington,"" the group said. ""It rises up everywhere else.""",proxcarrentaluae,2025-05-06T09:56:12,17
So the chumps and suckers are going to give trump his parade?,Altruistic_Survey_95,2025-05-06T11:27:48,5
What’s truly sad is this is supposed to be to celebrate the 250th founding of the US Army which he hijacked into his birthday parade.,milelongpipe,2025-05-06T15:02:27,6
10 1000-person peaceful protests around DC would likely shut down the parade.,L1QU1D_ThUND3R,2025-05-06T15:12:11,4
It's June 14th.  Put it on your calendar.,koi-lotus-water-pond,2025-05-06T18:21:23,4
Why am I not seeing anyone mention that people can simply show up to boo and jeer.,mowotlarx,2025-05-06T09:16:20,24
The only king I want in the US is Burger King.,Beneficial-Fold0623,2025-05-06T13:34:18,4
No Kings. No CEOs.,DickabodCranium,2025-05-06T14:16:35,4
If they’re not disrupting the parade what’s even the point?,IcyCat35,2025-05-06T17:01:06,4
"This is a bad idea. It should be the day before. If it's on that day, he will spin it as supporters.",k8ecat,2025-05-06T19:07:36,4
All it's going to take is one dude with a shopping bag standing in front of your tanks. Document it all...,terminalxposure,2025-05-06T19:28:40,4
If it puts this into perspective. He is spending more than your lifetimes contribution in taxes to throw himself a dictatorial birthday party,NullToes,2025-05-06T22:04:38,5
This is the way to do it. These once a week protests are going to exhaust people and sap their enthusiasm.   Plan a *huge* protest instead of seemingly weekly smaller ones.,Three_Licks,2025-05-06T13:36:27,7
"It goes without saying, but Black folks should enjoy the day off. Hang out with friends and family and stay away from this shit. Don't give them what they want.",TheGhostOfArtBell,2025-05-06T14:32:21,8
Count me the fuck in!,tannerbo,2025-05-06T10:53:11,3
Free your country Americans,Substantial-Part6377,2025-05-06T12:56:58,3
"News & Media outlets should intentionally go out of their way to exclude any Trump related media for the day. Run historical pieces on historical figures, run an overview of Obama's accomplishments that day (etc).",ATDT_No-Carrier,2025-05-06T13:34:44,3
[No gods or kings only Man. ](https://www.youtube.com/watch?v=QfZ30sfjdLY),Stewart_Games,2025-05-06T13:52:49,3
Time to move our 401k’s to include more Chinese companies.,Uuuuuii,2025-05-06T16:20:38,3
Anyong going to stand front of tanks?,DaDibbel,2025-05-06T18:25:37,3
Sure feels like a Tiananmen Square moment is coming.,TheMalibu,2025-05-06T22:18:11,3
"Also, many are planning to make Obama appreciation posts all over social media. So, if you can't protest, drop some favorite Obama memes and pics.",Efficient-Water2384,2025-05-06T23:58:58,3
Stay HOME on that day!! You do not want to get counted as a supporter! Trump loves to see crowds and numbers in his honor. If people protest he will only see the people in the streets as support for him. Protest any other day!!!,anicenap,2025-05-06T09:38:52,14
They're still planning on this military parade?  JFC.,Dorkamundo,2025-05-06T10:37:18,2
[ Removed by Reddit ],byrningman,2025-05-06T10:41:22,2
Oh good it's a Saturday!,chpbnvic,2025-05-06T10:44:41,2
I just talked to my dad about how this should happen I'm glad it is.,After_Flan_2663,2025-05-06T10:52:54,2
Great idea,indierockrocks,2025-05-06T11:16:00,2
I hope the military branches make the convicted felon’s parade participation optional for the enlisted people.,Tribal_Hermit,2025-05-06T11:43:46,2
Congress should pass legislation barring wannabe tyrants from behaving like a monarch- “No Kings Acts for the United States”,leepal700,2025-05-06T12:21:37,2
Those are hero’s because I think trump will ask the military to fire.,AdventureThink,2025-05-06T12:41:18,2
I’m reminded of Lt. Scheisskopf in “Catch-22.”,Neverdropsin57,2025-05-06T12:46:46,2
Someone tell Trump that the parade is being held at Kings Dominion and see if we can get him to retweet it.,Several_Rock3276,2025-05-06T13:15:32,2
Rockin' and a Rollin' Splishin' and a Splashin' Over the horizon what could it be?,Retinal,2025-05-06T14:29:55,2
Count me the fuck in.,proves,2025-05-06T16:46:46,2
"July 4 is only 3 weeks later. Isn't that the best time to celebrate our country?  Oh, wait. It's not about the country, is it. It's because of The Birthday.  The anti-Trump demonstrations should be massive with this much prep time and motivation. Also, by mid-June, the economy should be tanking pretty badly.  I think ""Donnie 2 Dolls"" can do without his big, beautiful parade.... (Hopefully, he won't have a tantrum that will destroy us all when he doesn't get his way.)",FIlm2024,2025-05-06T17:52:02,2
Line the streets and boo his birthday celebration for miles,staaarfox,2025-05-06T20:24:12,2
"I'm thinking about how to maybe trick some MAGA family into attending No Kings Protests instead of attending/watching Dump's ""Big Boy"" Bday Party. Some of them swear to support veterans, so I was thinking of sending a flier for the Army's Anniversary Veterans Parade in their respective home towns. Hopefully, they'll rant on FB about how the parade was just a protest, so I can thank them for joining the Resistance.",DecidedlyCatBirdian,2025-05-06T21:11:45,2
I wanna see how Trump would feel if he was locked in a cell by himself with no praise. I think he’d just combust,IndigenousVagabond,2025-05-06T23:48:46,2
"Trump’s prob banking on being able to quell a huge protest, with really available military resources",moogly2,2025-05-07T05:22:55,2
"hes gonna interpret the protests as support, then be on tv saying nobodys ever had this much support.",chongo-martinez,2025-05-06T12:31:55,3
"Mark my words...This is going to turn into the 2025 version of the Reichstag Fire.   The administration is either going to:  - Allow some bad actor to successfully launch a minor attack - Stage some bad actor to successfully launch a minor attack - Claim protesters are agents of terror  And they're going to use this as rationale to take the next big steps against the left wing. Ever said something bad about Trump on Facebook? Go ahead and delete it - it doesn't matter, Zuck already indexed it and he'll be happy to turn it over to whoever needs it after his recent buddy-buddy moves with Trump.   If you do protest this day - especially anywhere in the same city as the parade - please be very careful, take care of yourself, and look out for each other.",fauxzempic,2025-05-06T14:27:50,4
"Don't go, the less people that are there the better and anyone who goes there will just be added to the FOX propaganda network showing Donald Trump is celebrated like he's a ""King"". Don't go to that old fools parade. You'll make him look stronger than what people assume he is.",Azraiel1984,2025-05-06T18:07:55,4
Somehow it feels like we’d be giving too much attention to feed his narcissism. At this point even the confetti probably has his face.,mbasyal,2025-05-06T11:27:32,3
"We don't need a no king's protest . what we demand is a removal of this administration for treason,coruption, fraud and an endless list crimes period.",Junior-Addendum88,2025-05-06T12:02:27,2
he will 100% think the protest is there to celebrate his bday...,cowboi,2025-05-06T13:34:12,2
"He is making it easy for the next Pearl Harbor having all his assets lined up in a parade in one place, truly the time for China to attack",Grumptastic2000,2025-05-06T15:11:43,2
"May I suggest that we honor our military and let them know that we honor and thank them for their service on that day. That we are proud of them.   And, that we shun Trump:  we do not mention his name, we do not post photos of him in any format on that day.   I am concerned that Trump will conflate the two. He will complain that the protest is against our military to try to divide us.  I am the Proud mom of a prior service Marine and current Army Reservist. I will make the day special for him, because it means a great deal for me to recognize them, their service and their sacrifice.",OldLadyCard,2025-05-06T17:08:45,2
"Can’t lie, some of us just want cake without political cosplay",TinkeringToon,2025-05-06T09:12:06,-2
"He already said he has something ""big"" prepared for his birthday.   So who knows what that is, could just be a really huge, quite possibly the best, in fact will be the best, the largest, the biggest Big Mac America has ever seen, and its going to be great.",Combatical,2025-05-06T11:44:57,1
L’Etat c’est Orange,Far-Reaction9238,2025-05-06T11:47:49,1
"I don’t think even using that word at all in reference to him is a smart idea, it only feeds the beast in the end",waveyyyyyyyyyyyyy,2025-05-06T13:28:04,1
Count me in!,Silverdog_5280,2025-05-06T15:26:18,1
Why are all the good protests outside of rotten tomato season?,PeculiarAlize,2025-05-06T15:26:52,1
What can the average person legally do to prevent $92 million of our tax money going to the president’s birthday parade? A billionaire is using $2 million of taxpayer money for a birthday parade. Do we just have absolutely no say in wasting money?,unorganized_mime,2025-05-06T15:27:54,1
How about preventing the parade then ?,Foxintoxx,2025-05-06T15:47:19,1
"In times of tyranny and injustice, when law oppresses the people, the outlaws take their place in history.",TeamRocketGrunt420,2025-05-06T15:51:54,1
"So what happens in 2026, we all have to livestream singing happy birthday dictator Don?",Useful-World1781,2025-05-06T15:52:20,1
"My ""No Kings"" protest was staged on election day, this one sounds pretty cool too though.",Specific-Parsnip9001,2025-05-06T16:00:30,1
How do I sign up?,Fritzy525,2025-05-06T16:08:03,1
Maybe block the fascist parade route?,Glittering-Voice-409,2025-05-06T16:15:26,1
Already excited to see sign ideas coming out of this group!,awesomevedo,2025-05-06T16:26:01,1
Post Obama,HoosierRed,2025-05-06T17:18:23,1
"Are we taking Slotkins advice and ditching oligarchy? Going with “King”? A king is one guy. Donald Trump isn’t the sole problem, the republicans are also a huge problem. A lot of our current structure needs to be investigated",Silver_Double4678,2025-05-06T17:41:52,1
Funny will be when more members of the military show up to the protest than to Trump's personal ball washing event.,AdHopeful3801,2025-05-06T17:57:15,1
“I’m not saying someone should……”,wickednyx,2025-05-06T19:13:59,1
Part of me feels the military would only agree to do this to stage a coup!,Reciter5613,2025-05-06T19:34:54,1
Goddamn this parade rubs me the wrong way.,kurimiq,2025-05-06T20:41:16,1
If it was actually even remotely about celebrating the country or armed forces it would be on July 4th or Veteran's Day.  He doesn't give a fuck about anything but himself.,picketpocker,2025-05-06T21:05:36,1
"No gods, no kings, just men -Andrew Ryan",therealBLU13,2025-05-06T21:25:48,1
Do you guys think making a stuffed Trump puppet on a stick and then setting it on fire like that one scene from The Patriot would be too much or...?,Rich-Leg510,2025-05-06T21:45:29,1
“Someday in all of [America] there'll be a celebration all because of me.” ~~The Wicked Witch~~ Trump,champagne_pants,2025-05-06T22:39:25,1
Book up the hotels and screw em.,Themohohs,2025-05-07T00:08:47,1
"King is putting it too kindly.  More like ""No Fuhrer"" day protest.",InternetGamerFriend,2025-05-07T00:54:19,1
45 million in taxpayer dollars. Just wow.,yellowwirm,2025-05-07T01:02:02,1
I'd like to see June 14th celebrated as bone spurs day.,DancingBear62,2025-05-07T01:19:32,1
Advice - you need to shut down his birthday. If you protest in LA it will be a footnote on the news while 2 hours is dedicated to trump. You need to be loud and seen and point out how ludicrous this all is our you're just cosplaying the opposition.,timbit87,2025-05-07T04:36:50,1
"You know what's better than a military parade? We have a thing called fleet week. Instead of marching down some road, military shows up to a port city, does some demonstrations in the parks and then get's to site see and have fun with the people of the city. It's a reminder to the people that the military are made up of folks just like them. It's a great show of capability and reasurance that we're strong but also humanizes the military to the civilians, and the civilians to the military.  A parade is a fucking joke.",DChristy87,2025-05-07T06:41:32,1
How about a no facism protest and AWAY from the parade? He’s going to use the opportunity to lie about his numbers or lie about protesters being violent.,vaguelysarcastic,2025-05-07T06:50:42,1
I’d love for everyone to attend his parade and just turn their backs for the duration.,PuffPuffFayeFaye,2025-05-07T09:58:38,1
It's too late. Trump is already the King.,defendTaiwan,2025-05-07T22:39:19,1
King? Seriously he's a princess at best.,sotiredaboutus,2025-05-08T03:59:15,1
"unlike the last 21358230952739058273509238502358205923 protests, THIS is gonna be the one that finally does something",PhoenixPolaris,2025-05-06T13:31:29,1
"What instead they chanted ""The Nation Will Remove All Kings""",fungussa,2025-05-06T12:33:09,1
Block the parade.,Atoms_Named_Mike,2025-05-06T18:51:53,1
"I like the idea of protestors blocking his vanity parade, but how secure do they make the parade path? Would it be hard to get there?",SparkyMuffin,2025-05-06T12:03:01,0
"It's sad that something that absolutely deserves a parade (a very carefully planned one), the 250th birthday of the Army, will be co-opted to become an ego stroke just because his birthday happened to fall there.    Protestors will be accused of disrespecting those who serve the country/veterans. Regardless, he will get to project the image he's always wanted. To assume that he'll be thinking about anything else, is delusional.",AstralStrudel,2025-05-06T13:05:18,0
"There should be a free concert by ""woke"" artists in a venue near DC. If Obama and Kamala could stop in and be the guests of honor...  And on that day, everyone should not mention orange face at all on social media. Total tfg/repub name blackout. Not even in code.  Not even to talk about his shit parade, make fun of him, talk about his policies...nothing.  His head will explode if  less than half the country has his name in their mouths...or on their fingertips, as it would be...",Mistress_Jedana,2025-05-06T12:37:27,-1
"Bad idea, it galvanizes the opposition into ""Yes Kings Day"", the ratcheting of extremism continues unabated",RichyRoo2002,2025-05-06T09:52:26,-6
And add a lot of shark stuff to the protest because Trump is obviously afraid of sharks.,RedLanternScythe,2025-05-06T10:35:44,0
Honestly these might be the way to get him to cancel it. Ego so fragile if he thinks the crowds at these could be bigger it’s possible he scraps the idea.,Due_Street3216,2025-05-07T04:15:02,0
This feels like bait but also the longer it goes on,haroldthehampster,2025-05-06T12:17:20,-1
[No Kings! T-shirts!!! Get one!](https://wearenttrump.com/products/no-kings),SUNSareOP,2025-05-06T21:31:33,-1
"A genuine question for Americans: What do you hope these protests will achieve? The people in power have repeatedly shown that they don't care about public opinion, and even the media is helping in suppressing news about the protests. Do you really believe that holding signs saying #NotMyPresident will somehow make Trump have a change of heart and step down in disgrace?",soulunion4life,2025-05-07T06:11:28,-2
"always a protest, never a strike.",dysthal,2025-05-06T12:02:47,-3
"Oh yes, protest the army’s birthday",Thin_Cherry_9140,2025-05-06T15:34:50,-13
He's not a king he's an Emperor big difference.,Troll_King_907,2025-05-06T10:01:27,-19
[deleted],[deleted],2025-05-06T09:06:58,-38
What's wrong with kings?,LamermanSE,2025-05-06T12:28:41,-13
Where was the outrage when we were sending billions to Ukraine to fund a war that was none of our business?,BabyFlaboog,2025-05-06T20:29:23,-13
"Because it makes you look WEAK.  Cowards and despots throw military parades - Russia, Iran, China, North Korea, Turkey, etc.",randomisation,2025-05-06T11:25:13,1485
"Your comment made me curious: what did other presidents do on their birthdays?  Biden had [brunch with his grandkids](https://amp.cnn.com/cnn/2022/11/20/politics/joe-biden-80th-birthday)  Obama [played basketball and went bowling](https://abcnews.go.com/amp/Politics/president-obama-celebrates-birthdays/story?id=32876546) at Camp David   W. Bush [really, really enjoys cake](https://amp.cnn.com/cnn/2017/06/22/politics/tbt-george-w-bush-loves-birthdays) and seems to embrace the classic, traditional birthday party  Clinton usually has private gatherings, but his August birthday [often lends itself to a DNC Fundraiser]( https://www.c-span.org/program/white-house-event/president-clinton-50th-birthday-party-speech/157213#!)  H.W Bush [raised $58M for his favorite charities](https://begalamcgrath.com/what-we-have-done/41-80) at a weekend celebration, but famously went skydiving for multiple birthdays   Here’s a few more [notable presidential birthdays](https://www.history.com/articles/all-the-presidents-birthdays). Mostly they use these celebrations to announce their candidacies or for charitably purposes. ",turquoise_amethyst,2025-05-06T18:43:55,78
The US Amry was planny to do something for their 250th birthday. Who knew it would be the marker for the end of democracy for America,Ok-disaster2022,2025-05-06T16:08:55,97
He's a dictator idiot. Canada PM schooled him in a meeting.,Simple-Leopard4516,2025-05-06T17:50:04,16
You know why you throw your own parade?  *Because no one will throw one for you.*,ShaggysGTI,2025-05-06T20:22:15,7
"It’s also the anniversary of the Army, it just happens to be on his birthday.",stater354,2025-05-06T10:50:44,25
"He's hiding it behind the ""it's the army's birthday which so happens to be my birthday""",volanger,2025-05-06T17:56:57,2
[No Kings! T-shirt!! Get one!](https://wearenttrump.com/products/no-kings),SUNSareOP,2025-05-06T21:32:51,2
"Well of course Trump wants a military type parade,  just like Putin, his idol. But Trump has a better chance of having a parade not destroyed by missiles and drones. I would have never believed such an idea as a military parade here, in the land of the free. Russia YES, China YES, North Korea YES but America, not in a million years. But look who is in charge, the boy child.",No_Consequence7919,2025-05-06T21:44:31,2
