Comment,Author,Date,Score
"I've had ""but her emails...."" running through my head all day long...",_ChicagoSummerRain,2025-04-01T15:41:04,337
"First read that as Walz as in Tim Walz and thought he knows better!   Oh, Michael Waltz. That tracks. I wouldnt be surprised if they used Proton of some darknet email but that would take more techical know how that they have.",WhiteAndNerdy85,2025-04-01T15:59:41,70
We could have had the email lady,gallan1,2025-04-01T15:39:02,138
Of course they did. Wouldn’t have expected any different.,Spottswoodeforgod,2025-04-01T15:29:13,68
Breaking laws with no consequences,supercali45,2025-04-01T15:39:58,61
How hard is it to use the right email account ffs,Epicritical,2025-04-01T15:53:02,23
Gmail? Really?,[deleted],2025-04-01T15:52:46,12
And of course maga will have the audacity to make excuses for this. After they lost their minds over hilary smfh,Any-Variation4081,2025-04-01T15:57:00,20
The party of lawlessness and disorder living up to their name once again,nana-korobi-ya-oki,2025-04-01T16:05:56,8
Wait till it comes out that Putin has been cc’d on this shit too. This is next level incompetence. Fuck these asswipes. Sue this administration at every opportunity - flood the judicial zone. And ffs make Congress Blue before the bottom falls out of the markets and we have to start learning to speak Russian or Chinese.  https://preview.redd.it/lnx1lb4nlase1.jpeg?width=1125&format=pjpg&auto=webp&s=1802391823b3a92a0c2d7126bc0882311f50c1a2,dantekant22,2025-04-01T16:36:25,8
But but her emails,Rainbow-Mama,2025-04-01T16:17:16,8
![gif](giphy|8cKxzucx7yx3v0ILV9),Wise-Lawfulness2969,2025-04-01T15:44:32,6
.....but HER EMAILS...,MillieMouser,2025-04-01T16:01:16,6
Do we still wanna lock up? “ Lockem all up “,New-Cupcake4479,2025-04-01T16:01:34,5
"Something, something, Hillary Clinton, emails?",FairyOrchid125,2025-04-01T17:34:25,3
This is like a cartoon show nobody nows what they are doing it’s like  Homer going to the nuke station to work with no idea what he’s doing,NecessaryChemical622,2025-04-01T18:19:08,3
Buttery males!,Snrub1,2025-04-01T15:52:31,7
"Well, …at least it wasn’t Hotmail.  /s",urlock,2025-04-01T16:07:59,3
EEEEEEMMMAIIILLLLZZZZZ *2016 flashbacks*,amievenrelevant,2025-04-01T16:16:03,3
![gif](giphy|xUPGcfMxCwc5CJVqcE),ReleaseFromDeception,2025-04-01T16:43:11,3
"Do they share a group on Grindr, too?",mbw70,2025-04-01T18:07:56,3
I bet they hit “reply all” too often.,[deleted],2025-04-01T18:57:23,3
"Bro after this and Signal shit leaking, I don't want to hear, ""...but her emails..."" anymore.",EchoZeroEleven011,2025-04-02T14:25:01,3
Nothing will be done about it. Why are they wasting time reporting it when there are bigger stories affecting our lives.,Birdman330,2025-04-01T15:48:24,5
"These people should be forbidden from going out their doors and windows, and never allowed to go outside or use the internet or telephone or any kind of writing or computing device again.  ![gif](giphy|11num5UvQgBWNy)",Think-Hospital7422,2025-04-01T16:03:15,2
Would have been more responsible if they had just talked about their plans on CB radios.,PengJiLiuAn,2025-04-01T16:38:50,2
Doesn’t Gmail routinely mine email for information?,guttanzer,2025-04-01T17:38:29,2
Oh good grief— they are obsessed with emails…smdh!,Mystery812,2025-04-01T17:41:01,2
Hope the males are still buttery,Appropriate_Golf2558,2025-04-01T17:51:27,2
They are making him fall on the sword.,Witty-Entertainer524,2025-04-01T19:25:52,2
"LOCK HIM UP!  Stand by your convictions, Republicans.  Do as you say.",mackinoncougars,2025-04-02T10:13:29,2
#But Hillary!,HotSprinkles10,2025-04-01T16:07:41,3
Oops!,forrestfaun,2025-04-01T16:05:39,1
Great. If he broke the law then prosecute him. See how easy that is? I didn't have to do any mental gymnastics to defend it. Has to go for both sides though.,scienceisrealtho,2025-04-01T16:12:22,1
Posted something about state legislators having personal gmail accounts.  But my message was misleading. After a few reasonable skeptics asked me for examples I found my examples had both state issued and personal contact info on their state legislature websites.  So sorry for the snipe hunt. I deleted the original comment.,One_Abalone1135,2025-04-01T16:15:12,1
That’s what she said ,Rubberbandballgirl,2025-04-01T16:30:19,1
Lock them up?,steppingstone01,2025-04-01T16:48:30,1
Buddies emails!,Particular_Milk1848,2025-04-01T17:47:26,1
I don't care. they can use tik tok to run the federal reserve. nothing would approach the current clown show,jawshoeaw,2025-04-01T18:22:48,1
After I had to acknowledge the BS about personal email from USDA before I could do anything this morning?,I_love_Hobbes,2025-04-01T18:37:46,1
"No, case closed they said!  Case *Closed*!",mrkruk,2025-04-01T19:11:31,1
"I feel like G-mail provides a level of security for their classified conversations that is on par with their amature-hour OPSEC acumen.    I mean, who would think to hack their Gmail account? Punks and Losers!",RedShirtPete,2025-04-01T19:31:41,1
![gif](giphy|AaQYP9zh24UFi),BronzeRider,2025-04-01T22:08:05,1
what could go wrong,Rage-With-Me,2025-04-02T08:56:42,1
Right now he's at Target buying gift cards to pay Norton for his overdue subscription payment.,VaguelyArtistic,2025-04-02T13:44:56,1
Should he not be using Signal ?🥳,Jos999999,2025-04-02T14:26:13,1
"Oh, it gets deeper...   [Mike Waltz in hot water: Journalist reveals Trump's National Advisor follows gay porn account](https://www.wionews.com/trending/mike-waltz-in-hot-water-journalist-reveals-trumps-national-advisor-follows-gay-porn-account-waltz-leaked-yemen-war-plans-8887613)",1v0ter,2025-04-02T16:54:29,1
Democrats don’t have the cards! They haven’t even said thank you!,Tight_Cry_5574,2025-04-03T13:08:56,1
This cosplay has to be stopped.,CroMaggot,2025-04-01T16:23:20,1
[deleted],[deleted],2025-04-01T15:31:08,0
"What about Hillary is the default excuse for anything, that follows the logic of someone that can’t perform basic math",Own-Resource221,2025-04-01T16:58:00,0
And I thought it couldn’t get anything worse than this,Oshawott_68,2025-04-01T15:59:04,0
"Knowing the democrats,  if this is true, they'll make Tim step down AS OPPOSED to the republikkkans who just DOUBLE DOWN ON THEIR WRONG DOING....",Huge_Strain_8714,2025-04-01T16:54:20,-2
"She tried to warn everyone with her ""basket of deplorables"" comment.",Snrub1,2025-04-01T15:53:47,152
Not we. I voted for the most qualified candidate for POTUS we ever had. I'm with her.,LotsofSports,2025-04-01T16:25:04,53
Mmmmm… buttery males… 🤤,CoffeeMinionLegacy,2025-04-01T15:58:39,17
https://preview.redd.it/22jnef7ysbse1.jpeg?width=680&format=pjpg&auto=webp&s=2405a93b077b879fad10ae3eb79e1fdbbf69b81a,rotll,2025-04-01T20:39:16,6
Gmail is certainly not FedRAMP compliant,Low-Woodpecker-5171,2025-04-01T19:22:06,7
"So many buttery, buttery males",dandrevee,2025-04-01T20:31:29,5
Who's we?,noobprodigy,2025-04-01T16:40:14,4
I have a hat that I’ve been wearing faithfully since 2017,M2NGELW,2025-04-01T17:07:49,2
You’ll probably also see plenty of conservative dumbasses (who only read the headlines and nothing else) come out and say “see! This is proof that Tim Walz is corrupt!!!”,Soup-a-doopah,2025-04-01T16:33:40,21
Same!,Glittering_Luck2865,2025-04-01T16:21:11,6
"I’m convinced that’s why Elon made such a fuss about Walz recently, to get people confused.",Worried_Government39,2025-04-01T17:23:41,7
As did I.... 😉,Jakesma1999,2025-04-02T08:08:04,1
Hillary would have been the best president to never get anything done because of Republican bullshit,3--turbulentdiarrhea,2025-04-01T16:38:59,47
Nope! But Hillary’s emails …what a joke Trump and his entire administration are …,ComplexWrangler1346,2025-04-01T15:31:04,44
Didn't expect it to be revealed so quickly.    https://wapo.st/42dVyTk,Laura9624,2025-04-01T15:45:17,15
His whole life.  Don the Con!,JerseyDevil75,2025-04-01T16:13:38,26
It's even more baffling because imo Gmail kinda sucks for business-related things,Rakhered,2025-04-01T16:32:19,2
"Most jobs require qualifications, like job experience and education. Politicians get the job just by being liked enough.   These guys aren’t qualified for the job.",LoudCrickets72,2025-04-01T16:32:22,2
Maybe they want certain people (Putin) listening in?,WickedKitty63,2025-04-02T22:07:46,1
"At least she had the foresight to do it on her own server...  Gmail is the sluttiest email, everybody has one and probably has several viruses as a result. Pretty much guarantee that the Kremlin has The NATIONAL SECURITY ADVISORS emails pinned on the break room wall...",TreebeardsMustache,2025-04-02T10:49:57,1
"If Hillary had to go to jail so *all* of these clowns went to jail, well, sorry Hillary. Time to be a martyr for the cause",LoudCrickets72,2025-04-01T16:35:02,4
"Dude we are currently living in the G.I. Joe reality which resides next door to the Transformers one. Just one fucked up plot after another. Here's one that will make your head hurt. Straight out of Joepedia... The Money to Burn Episode: ""Cobra Commander works with Xamot and Tomax to orchestrate a conspiracy to ruin the American economy. Cobra has invented a ray that causes Federal Reserve Notes to vaporize, making all American money disappear as well as preventing the U.S. Mint from printing more. The United States immediately becomes an impoverished nation and Cobra Commander transmits a broadcast that it has been punishment from Heaven for America's sins. Cobra says the new currency of the United States are gold coins with cobras engraved on them, and that Americans are to go to the nearest Extensive Enterprise building to trade valuables or agree to a term of slave labor for Cobra in order to earn some of the new money.""  You know you're living in hell when real life is playing out like a plot out of an 80s cartoon. And no, not in a good way 😞😭  https://www.instagram.com/reel/DH57Qmyxst4/?igsh=MWFxbDV3bmI0Njhkeg==",WoodenMarsupial4100,2025-04-02T12:17:31,2
"This one took me a second, but I love it",Frickin_Brat,2025-04-01T16:18:45,2
"Or YahooMail or AOL, but we don't know they didn't use those as well.  Everyday, there seems to be a new breach of protocol.",robcwag,2025-04-02T12:52:05,1
Stay tuned. It’s only Tuesday.,JoeyDawsonJenPacey,2025-04-01T18:53:29,2
It’s just another page in the fuck up book 📖,LoudCrickets72,2025-04-01T16:34:02,2
He used his PERSONAL Gmail not govt issued email,ComplexWrangler1346,2025-04-01T15:32:38,14
"Waltz, not Walz",Online_Active_71459,2025-04-01T19:08:35,2
And boy was she spot on.,forrestfaun,2025-04-01T16:07:03,90
"""Deplorable"" is such an understatement.",cef911f1,2025-04-01T17:31:11,47
She was also right when she accused tr8ump of being in love with Putin,Weakera,2025-04-01T19:58:11,24
She put it way to kindly,intendeddebauchery,2025-04-01T20:56:09,8
"She was kind. She said that you could put HALF of his supporters in a basket of deplorables. More like most, if not all",Fit-Struggle-9882,2025-04-03T06:24:54,1
![gif](giphy|Zk9mW5OmXTz9e),LoudCrickets72,2025-04-01T16:30:44,14
"I read something once along the lines of “Somewhere there’s an alternate reality where Hillary Clinton is president, 10 Americans died from covid, and right wingers insist it’s the greatest presidential disgrace to ever happen.”",dthains_art,2025-04-01T16:42:01,60
"I do wonder how it would have played out. There were a lot of GOP from her time as Senator that said they liked working with here because she was good at finding compromises and getting legislation passed. I don’t know if they would have blockaded more, or if she would have been more shrewd in politicking. I also don’t know if we would have gotten mixed bag legislation we would have complained about not knowing what the alternative timeline looked like.",SenorSplashdamage,2025-04-01T17:00:27,5
And Google accounts require phone verification and secondary recovery email accounts these days. There’s even more security issues with privacy they’re giving. They also probably didn’t turn off using personal data for ad tracking.,SenorSplashdamage,2025-04-01T17:03:32,2
My husband had emails requesting off from work never get sent before. His work doesn't have access to the email because he had to make it through Google when he was hired so only he has access to the account.  Gmail is a mess.,No-Appearance1145,2025-04-01T19:49:48,2
"So, according to maga, they would be DEI hires?",Neat-Comfortable-666,2025-04-01T16:37:55,2
Yes it’s sad to see that we are living in cartoon plus scary,NecessaryChemical622,2025-04-02T12:52:24,2
"Announcing a new breach with, “🛎️You’ve got mail!”",urlock,2025-04-02T15:18:31,1
My point exactly.  I was surprised to see how many state legislators have gmail accounts as their contacts.  Not government issued accounts.,One_Abalone1135,2025-04-01T15:34:59,5
I know the Tango and the 2 step...,Huge_Strain_8714,2025-04-02T09:43:39,1
Right??? Everyone got pissed but she wasn’t wrong,eggz627,2025-04-01T17:51:25,45
Who would have thought back then that there could possibly be something worse than deplorable?!?,JoeyDawsonJenPacey,2025-04-01T18:50:35,17
I'll never forgive the media for making such a big deal out of it...,_ChicagoSummerRain,2025-04-02T06:39:17,9
I saw a video last year about how Dutch politics had a huge scandal because a politician was caught lying.,SenorSplashdamage,2025-04-01T17:01:34,23
"💯. If COVID happened under a Dem, they would’ve impeached them, even if we had a near-perfect dismount. These GOP fucks are a bunch of hypocrites. And I used to be one of them! I voted down ballot R until Obama and finally switched during Trump. Now, I am just country over party.",Excellent_Pirate8224,2025-04-01T17:29:35,26
DUI in Hegseth’s case…,ukexpat,2025-04-01T17:33:06,7
State legislatures are not handling classified military documents.  Not really the same thing.,focalpointal,2025-04-01T16:05:37,2
like who? I checked and found none,Ok-Fly9177,2025-04-01T15:59:30,1
"Not everyone, A LOT of people agreed with her.",LLFD1982,2025-04-01T19:34:47,29
"Hell, if anything like this went on under a Dem president, they would have not impeached him/her; they would have drawn and quartered him/her.",PreferenceFalse6699,2025-04-02T11:26:04,2
"There are people who *STILL* don't care, and support this horror show.        It was never about emails, and it was always that the deplorable American population have been waiting since Nixon and Reagan to get another truly reprehensible candidate to mirror their behavior and give then permission to be monsters.",StrobeLightRomance,2025-04-01T20:25:42,31
