Comment,Author,Date,Score
" As a reminder, this subreddit [is for civil discussion.](/r/politics/wiki/index#wiki_be_civil)  In general, be courteous to others. Debate/discuss/argue the merits of ideas, don't attack people. Personal insults, shill or troll accusations, hate speech, any suggestion or support of harm, violence, or death, and other rule violations can result in a permanent ban.   If you see comments in violation of our rules, please report them.   For those who have questions regarding any media outlets being posted on this subreddit, please click [here](https://www.reddit.com/r/politics/wiki/approveddomainslist) to review our details as to our approved domains list and outlet criteria.    We are actively looking for new moderators.  If you have any interest in helping to make this subreddit a place for quality discussion, please fill out [this form](https://docs.google.com/forms/d/1y2swHD0KXFhStGFjW6k54r9iuMjzcFqDIVwuvdLBjSA).    ***   *I am a bot, and this action was performed automatically. Please [contact the moderators of this subreddit](/message/compose/?to=/r/politics) if you have any questions or concerns.*",AutoModerator,2025-05-09T11:58:08,1
I guess this guy will just keep trying in every state.  There is something broken with our system.,TintedApostle,2025-05-09T11:59:10,13
Ohio GOP endorses guy who never showed up to his position in the federal government before being dropped?,mattgen88,2025-05-09T12:16:17,11
It’s their loss,MrSnrub_92,2025-05-09T12:01:14,5
DEI hire and known non-white Vivek Ramaswamy endorsed by woke OH GOP party.,steve_ample,2025-05-09T12:23:00,3
I forgot he was a thing ,ClusterFoxtrot,2025-05-09T12:37:21,2
For once I'm glad Ohio is as racist as it is. No way this tool gets elected. Boy I hope I'm right!,Kihlshot,2025-05-09T12:06:54,3
"This submission source is likely to have a soft paywall. If this article is not behind a paywall please report **this comment** for “breaks r/politics rules -> custom -> ""incorrect flair"""". [More information can be found here](https://www.reddit.com/r/politics/wiki/index/#wiki_paywalls)  *I am a bot, and this action was performed automatically. Please [contact the moderators of this subreddit](/message/compose/?to=/r/politics) if you have any questions or concerns.*",AutoModerator,2025-05-09T11:58:09,1
"Interesting, I figured that Jim Tressel would have it locked down.",OmniManDidNothngWrng,2025-05-09T12:30:40,1
How much money will it take for Vivek to learn that nobody likes him.,30mil,2025-05-10T07:13:20,1
Every public office should require the candidate to have lived in the district for at least 3 years. Allows people to establish roots and get a better understanding of their community and it's needs and prevents people like this from hopping from one election to another.,Alleandros,2025-05-10T17:55:04,1
"Money. Most people get just one shot to do something great, but with enough money you can just keep trying no matter how many times you fail. The life story of upward-failing clowns like the two most recent Republican presidents.",Sad_Importance7789,2025-05-09T13:04:15,3
Most likely because he paid them for it.,metalkhaos,2025-05-09T13:02:47,1
You underestimate the power of the (R) next to your name in Ohio...,Prudent-Blueberry660,2025-05-09T12:48:21,3
Didn't even the current governor (corrupt as he is) say this was a bad idea?,NPVT,2025-05-09T14:02:14,2
