Comment,Author,Date,Score
" As a reminder, this subreddit [is for civil discussion.](/r/politics/wiki/index#wiki_be_civil)  In general, be courteous to others. Debate/discuss/argue the merits of ideas, don't attack people. Personal insults, shill or troll accusations, hate speech, any suggestion or support of harm, violence, or death, and other rule violations can result in a permanent ban.   If you see comments in violation of our rules, please report them.   For those who have questions regarding any media outlets being posted on this subreddit, please click [here](https://www.reddit.com/r/politics/wiki/approveddomainslist) to review our details as to our approved domains list and outlet criteria.    We are actively looking for new moderators.  If you have any interest in helping to make this subreddit a place for quality discussion, please fill out [this form](https://docs.google.com/forms/d/1y2swHD0KXFhStGFjW6k54r9iuMjzcFqDIVwuvdLBjSA).    ***   *I am a bot, and this action was performed automatically. Please [contact the moderators of this subreddit](/message/compose/?to=/r/politics) if you have any questions or concerns.*",AutoModerator,2025-05-07T13:43:34,1
utah is a town with a mix of people.,justaheatattack,2025-05-07T13:45:59,11
I'm kind of amazed a state banned any kind of flag - clear cut violation of the first amendment.,NewLifeNewAcct,2025-05-07T14:32:54,7
They need to replace the rainbow flag with the Maga flag. They need to own the flag and tell republican bigots that it represents the LGBT… community and ideals. Then watch MAGA meltdown.,321sleep,2025-05-07T15:21:58,3
I absolutely fucking love this. 🥰  Heartwarming.,laseralex,2025-05-07T14:13:18,2
Very cool! So now someone flying any of those flags can legitimately say they're flying their city's flag.,mobileagnes,2025-05-07T15:22:59,1
I’m convinced SLC proper lets the world think it’s all backwards conservatives so that people don’t flock there,ButtDonaldsHappyMeal,2025-05-07T14:04:55,8
Utah's politicians do fuck all for the people that live here and spend most of their time focusing on the culture war bullshit,Remarkable_Spite_209,2025-05-07T14:43:58,7
Make America Gay Again 🏳️‍🌈🏳️‍⚧️,hypotheticalthrow,2025-05-07T15:50:32,6
Not being able to get a decent drink helps with that too.,justaheatattack,2025-05-07T14:24:54,3
At least you guys have the best social safety net out of all the red states. I mean it's not a high bar but you've got it!,Dispro,2025-05-07T15:20:14,3
"There isn’t just a majority of conservative Mormons in the legislature, it’s a super majority. Salt lake has also been split into 4 separate districts to limit democratic influence.",pastafarian19,2025-05-07T15:39:51,3
Yeah and they've been ordered to implement fair districting right? But they refuse to do it because who will make them,Remarkable_Spite_209,2025-05-07T15:42:27,2
