Comment,Author,Date,Score
" As a reminder, this subreddit [is for civil discussion.](/r/politics/wiki/index#wiki_be_civil)  In general, be courteous to others. Debate/discuss/argue the merits of ideas, don't attack people. Personal insults, shill or troll accusations, hate speech, any suggestion or support of harm, violence, or death, and other rule violations can result in a permanent ban.   If you see comments in violation of our rules, please report them.   For those who have questions regarding any media outlets being posted on this subreddit, please click [here](https://www.reddit.com/r/politics/wiki/approveddomainslist) to review our details as to our approved domains list and outlet criteria.    We are actively looking for new moderators.  If you have any interest in helping to make this subreddit a place for quality discussion, please fill out [this form](https://docs.google.com/forms/d/1y2swHD0KXFhStGFjW6k54r9iuMjzcFqDIVwuvdLBjSA).    ***   *I am a bot, and this action was performed automatically. Please [contact the moderators of this subreddit](/message/compose/?to=/r/politics) if you have any questions or concerns.*",AutoModerator,2025-04-25T11:06:20,1
Why would California want a British politician who supported Trump as their governor?,ThistleroseTea,2025-04-25T11:11:32,18
Get the fuck out of the California Republic.,RedAndBlackMartyr,2025-04-25T11:22:47,11
Deport him.,EmperorBozopants,2025-04-25T11:12:17,9
I fully support this shithead wasting his time and other people's money.,mrnuts,2025-04-25T11:19:45,6
Doa,Silly_Elevator_3111,2025-04-25T11:11:22,3
"This submission source is likely to have a soft paywall. If this article is not behind a paywall please report **this comment** for “breaks r/politics rules -> custom -> ""incorrect flair"""". [More information can be found here](https://www.reddit.com/r/politics/wiki/index/#wiki_paywalls)  *I am a bot, and this action was performed automatically. Please [contact the moderators of this subreddit](/message/compose/?to=/r/politics) if you have any questions or concerns.*",AutoModerator,2025-04-25T11:06:20,1
Nah.... we good!,ejohn916,2025-04-25T12:15:45,1
