Comment,Author,Date,Score
" As a reminder, this subreddit [is for civil discussion.](/r/politics/wiki/index#wiki_be_civil)  In general, be courteous to others. Debate/discuss/argue the merits of ideas, don't attack people. Personal insults, shill or troll accusations, hate speech, any suggestion or support of harm, violence, or death, and other rule violations can result in a permanent ban.   If you see comments in violation of our rules, please report them.   For those who have questions regarding any media outlets being posted on this subreddit, please click [here](https://www.reddit.com/r/politics/wiki/approveddomainslist) to review our details as to our approved domains list and outlet criteria.    We are actively looking for new moderators.  If you have any interest in helping to make this subreddit a place for quality discussion, please fill out [this form](https://docs.google.com/forms/d/1y2swHD0KXFhStGFjW6k54r9iuMjzcFqDIVwuvdLBjSA).    ***   *I am a bot, and this action was performed automatically. Please [contact the moderators of this subreddit](/message/compose/?to=/r/politics) if you have any questions or concerns.*",AutoModerator,2025-05-08T22:54:20,1
It's hard to tell who is twiddle-dee and who is twiddle-dum.,jrsinhbca,2025-05-08T22:56:25,22
Would you trust your child with this nasty creep?,ImpressSeveral3007,2025-05-08T23:04:32,20
"and introducing the latest addition to the team, Jeanine Pirro... Brain rot indeed!   Isn't she like the 22^nd Fox news host in his administration?",monkeywithgun,2025-05-09T00:03:51,10
More like a junk drawer than a cabinet,ggaassghd677,2025-05-09T06:43:23,10
Skipidi toilet cabinet,hobopopa,2025-05-09T00:14:22,5
I wouldn’t serve tea to any of these assholes,01wax,2025-05-09T00:31:25,4
apposite (adj) : highly pertinent or appropriate : APT apposite remarks apposite examples  https://www.merriam-webster.com/dictionary/apposite,nopeofnopenope,2025-05-08T23:44:58,2
A good old fashioned witch hunt.,kgl1967,2025-05-09T05:05:29,1
Quick! Someone feed his brainworm some protein. We need some good decisions coming up here,Parking_Syrup_9139,2025-05-09T05:17:07,1
All freaks in a fuckin sideshow!,abudz5150,2025-05-09T06:05:12,1
"I miss Biden's cabinet, the best cabinet in modern history.",The-M0untain,2025-05-09T08:50:30,1
The most important and probably only qualification: Loyalty - do not speak against Trump and do not even think about using the 25th amendment. Otherwise do whatever you feel does the most harm.,SeenItAllHeardItAll,2025-05-09T10:19:39,1
"The Brain Rot, Clown Car, shit show…",Jamizon1,2025-05-09T11:05:18,1
"No.  I also would not trust that  nasty creep with any animal, insect, plant, et al.  That quack likely thinks that succulents can magically cure brain tumors and boost testosterone.",ResidentKelpien,2025-05-08T23:35:55,7
a junk drawer of nothing but allen wrenches and dead batteries,im_a_picasso,2025-05-09T10:42:26,1
what if the tea had a short half-life?,entrepenurious,2025-05-09T01:32:55,5
"I wouldn’t even trust him with my brainworm, poor thing will starve to death.",EinSchurzAufReisen,2025-05-09T07:23:35,3
