Comment,Author,Date,Score
"I kind of miss the thoughtful, measured, careful answers President Obama gave to a free press.  Not at all like the years of insane bullshit this moronic idiot keeps spewing.",YallerDawg,2025-04-30T06:39:47,100
Exactly.  Reich-wing media lost their shit when Obama wore a tan suit and put fancy mustard on a burger.,Lost-Task-8691,2025-04-30T06:18:13,47
"This is the real problem with the world, men like Trump are granted all the privilege while everyone else is punished and enslaved because we're not considered human",GrooveStreetSaint,2025-04-30T09:53:35,5
I’m sorry but the thought of Kamala Harris as US President will forever shake me to the core.  America had the opportunity to be led by perhaps the best president in American history but chose a lying narcissistic rapist instead.  What the actual fuck,LonelyGlass2002,2025-04-30T22:16:12,5
![gif](giphy|YTpODnvmTRQjvmAg0T|downsized),ranterist,2025-04-30T06:18:03,11
"Only people believing this isn't a racist country are 100% willfully ignorant for whatever agenda they think they need to be ignorant for.  This country does not exist in any capacity without overt, profound, and intrinsic racism.",PossiblyATurd,2025-04-30T08:36:29,8
Facts.,PhoenixRedditor7,2025-04-30T07:57:54,4
I've seen it called a whitelash,kerryfinchelhillary,2025-04-30T08:11:03,4
They will never get over Obama.,FrostyAcanthocephala,2025-04-30T12:06:42,4
"That's a true statement, white privilege sad times in America",Conscious-Deer7019,2025-04-30T08:27:46,5
😮😳 That literally hit me like a ton of bricks... Never even thought about that.,BabyBlueAllStar72,2025-04-30T15:00:13,2
"While I know there was racism in the way Obama was received in general, it’s not the reason why they didn’t accept his healthcare plan. They don’t want it no matter who is proposing it. It’s not like a white guy like Biden would suddenly get them to accept it.",Bakingsquared80,2025-04-30T06:37:15,3
Learn to crop,WolfColaKid,2025-04-30T06:04:15,1
"DJT, a stupid person's idea of a ""smart president""",SoluableButter,2025-05-01T11:37:26,1
"There are so many racist acts by the feds, states, and local governments that have made lives better for white folks. You've got to know the founding documents were just a marketing tool.",mirage110-26,2025-05-01T14:46:08,1
I love that Obama was so amazing at hiding all the terrible shit he did. And how everyone just ate it up. I'm not a fan of Trump,Icy-Tap-4695,2025-05-01T17:46:38,1
I hate racists. THey do things like generalizing an entire country for the actions of some of its members.,Bay1Bri,2025-04-30T07:19:55,1
"This is the classic democratic trap..  ""If you dont support socialism, you're a (racist/nazi/homophobe/bigot)""  Extremely divisive rhetoric.. case in point.. Biden is white.",isunktheship,2025-04-30T08:53:20,-4
"I cannot STAND to hear dipshit speak its like nails on a chalkboard to me. It's like someone took sentences, cut them up, threw them in a bag, and put them back together wrong. It's all just word salad.",SilverMcFly,2025-04-30T09:21:20,40
"He's never sounded Presidential and I am confident when we look back at it in hindsight, he'll still be an idiot! I owe Dubya an apology, looking back at him in comparison, Bush Jr. was downright articulate and waaaaay more presidential than Trump could ever be",Big-University1012,2025-05-01T06:51:44,6
Yep. A tan suit was scandalous but a coup attempt gets a free pass. Really says it all,Popular-Audience1593,2025-04-30T07:28:11,25
"Side note, but that show is SO good.",SilverMcFly,2025-04-30T09:20:00,4
*concepts of thoughts and prayers,DrCur,2025-04-30T10:27:29,2
Or Biden,EggKey6859,2025-05-02T12:39:30,2
"Trust! If Trump would have presented this, hey would’ve loved it.",Effective_Excuse_326,2025-04-30T06:52:26,6
"Actually, Obamacare copies the healthcare plan that Massachusetts adopted under a white guy you may have heard of: Mitt Romney.",No-Button5149,2025-05-01T01:24:57,1
"It's *racism* we're discussing here, not xenophobia. Nice try, though!",Alexever_Loremarg,2025-05-01T08:41:23,1
"Like most DNC/Dem statements, it’s not about actually doing anything, it’s about pointing out how you are morally/ethically/etc superior - which is a reason they lost in 2016 and 2024.  Dems are great at memes and talking, but boots on the ground or making a plans and enforcing them (like project 2025 - which I don’t like but was actually thought out on how to force through) they are not. There is no central party leadership, no shared values to game-plan and rally around, no power in the system with anyone under 70 years old.  Just status quo pushing everyone to agree to be “civil” and have “decorum” thinking that will bring people back",Lucky-old-boy,2025-04-30T10:46:10,-1
"I agree but his adoring followers eat up the shit he spews.  And although I understand some of the populist attraction of his policies by a certain segment of the population, the unquestioning adoration still baffles me.",VanDenBroeck,2025-04-30T12:13:22,11
Free passes for whites aren't unusual.,mirage110-26,2025-04-30T11:36:51,12
True.,FrostyAcanthocephala,2025-05-02T14:20:25,1
Trump could present a plan to murder every first born male and they would love it,Bakingsquared80,2025-04-30T06:55:03,13
Well that's because he their lord and savior,New_Aioli_6796,2025-05-01T16:20:53,2
Do you think that means conservatives in Alabama wanted it?,Bakingsquared80,2025-05-01T04:03:52,1
"That wasn't the point I was making.  But I do think that some people who would never accept something coming from Obama would happily accept the same coming from any generic white dude.  Because racism is still very much alive despite the election of a black president.  In some ways, it is very much alive BECAUSE of the election of a black president, sad as that is to say.",No-Button5149,2025-05-01T05:49:22,1
"Kamala Harris offered all of this. She expressed clear and decisive action, well thought out plans while trump offered “concepts” of plans along with false promises of “in two weeks…”.  Kamala lost because Americans are still too racist sexist and uneducated to see what’s right in front of them.  So stop blaming democrats for the fact that trump is a complete and utter lying douche bag",LonelyGlass2002,2025-04-30T22:23:07,1
There we go!,Lucky-old-boy,2025-04-30T22:24:14,-1
