Comment,Author,Date,Score
"This thread has been so heavily reported that I, Automoderator, decided to promote our other socials.  [Follow us on X.com](https://x.com/rcondiscord) and [join us on Discord](https://discord.com/invite/conservative).  *I am a bot, and this action was performed automatically. Please [contact the moderators of this subreddit](/message/compose/?to=/r/Conservative) if you have any questions or concerns.*",AutoModerator,2025-04-26T02:01:03,1
"Gonna take an unpopular stance here and say this is the wrong tactic to tackle the wrong problem.   Bias on Wikipedia perpetrated by the community editors doesn't have anything to do with the organization's tax status, and it makes exactly zero sense to fight fire with... taxation?  Wikipedia has little cliques of editors that control certain articles, and the proper thing to do is break up those cliques by beating them at their own game.  None of which has to do with weaponizing the tax code.  Wikipedia is (generally) a bright spot in a cesspool of AI generated or branded/advertising/sales content that dominates the web. As a whole, it needs to be nurtured and protected, even if parts of it veer off course - which should be corrected tactically/surgically - not bludgeoned with a blunt instrument.",Jaegermeiste,2025-04-27T12:23:20,5
[removed],[deleted],2025-04-25T21:35:10,62
"The far far left Wikipedia being investigated, I support that.",Whole-Essay640,2025-04-26T08:25:34,7
I’m fully expecting a very annoying “SUPPORT US!! DON’T LET THEM END OUR TAX EXEMPT STATUS!! ORANGE MAN BAD!!” banner or popup on every Wikipedia page shortly…… 🙄,ITrCool,2025-04-25T20:29:06,6
"Good they do nothing to prevent brigading and political weaponization. It takes a trivial amount of time for the left to bombard wikis of current events with outright lies. Such as most recently the artical on kilmar abrego garcia, which initially insisted he was a US citizen, then was changed to legal permenant residence. Ecen now it outright lies about the determination that he is a member of ms13, with no mention of the immigration court determining he was a member of ms13, and does not mention that the decision was upheld on appeal, resulting in his final order of deportation.   Or less recently, insisting that the assassination attempts on donald trump wer fake/staged. Then that they were perpetrated by right wing extremists, and still contains a substantial amount of spin.",ultrainstict,2025-04-26T08:06:06,5
Nice. Just read Trumps intro on there. The bias is insane. Hope this happens or they clean up their act.,MichaelSquare,2025-04-26T07:25:07,2
It is time to end the “games” on Wikipedia as described by its co-founder:  https://larrysanger.org/2020/05/wikipedia-is-badly-biased/,Ask4MD,2025-04-25T20:11:35,-7
"It is not about me; it is about the articles.  You don’t like them, just downvote them",Ask4MD,2025-04-25T22:30:33,-4
"Alright, I cleaned up my post.   A little.  Heh.",Ironman650,2025-04-25T22:34:49,-12
