Comment,Author,Date,ScoreThe Jim Crow South directly inspired the Nazis build-up strategy to the Final Solution   America is a country *founded* on genocide   If any nation deserved to be wiped from the face of the earth,yojimbo1111,2025-05-01T20:41:25,1
"They’re ultimately getting what they want. My kids aren’t stepping foot in a public school, at this point.",sonofchocula,2025-05-01T20:48:36,1
"The ""Activity Clubs"" being set up for kids around the country, pushing neo-nazi ideologies, sound a lot like Hitler Youth- Trump Youth, if you will.",bramley36,2025-05-01T20:56:22,1
"Ah yes, MAGA youth.",Welsh-Cowboy,2025-05-02T01:51:46,1
You can't force love.,chockedup,2025-05-02T02:49:27,1
Mỹ đánh bại người Trung Quốc bằng cách trở thành người Trung Quốc ,Relevant-Buyer7492,2025-05-02T05:31:26,1
Love what exactly? We don’t help out those in any type of need. We only seem to bail out the wealthy and farmers and practically no one else when times get tough. We haven’t won a war since 1945 despite most of our tax dollars going to the military for their wildly overinflated budget. We are currently shipping us citizens to another country’s prison camps without due process. We have more mass shootings and school shootings than anywhere else in the world. We haven’t properly funded schools since the 60’s. Schools are literally falling apart and are often the worst/oldest buildings in their communities. We refuse to provide students with access to food regardless of income. There are less serious job prospects for the future due to the exorbitant cost of colleges. Housing has become unaffordable for the vast majority of Americans. Girls will grow up with less rights than their mothers had. Some states and congressmen are trying to remove child labor laws. What the fuck are we supposed to make these kids proud about?,pagnoodle,2025-05-02T07:31:02,1
This is scary. You cannot teach someone to love a country. But you can teach hate.,NewfieDawg,2025-05-02T09:38:19,1
The best way to teach how to love is by giving love.  Miller doesn't seem like a loving person.,Sensitive-Option-701,2025-05-02T10:06:20,1
Maybe we should aspire to be a country worthy of the love he speaks of. Not forcing this on to kids but making us a better country through integrity and justice.,sometandomname,2025-05-02T10:14:09,1
"Kids need to be taught to think for THEMSELVES not blindly follow idiots like this who only see one way, THEIR way",tweek264,2025-05-02T10:21:22,1
"Ironically we are where we are because too many didn't pay attention in history, american government, basic science and math classes. They also can barely read so thrown in English. Fascism story time gonna be pretty much a waste of time.",nkassis,2025-05-02T14:58:34,1
You must love America. Your Dear Leader demands it.,pancakes1024,2025-05-03T16:48:53,1
"We need more people to love America. There is a significant difference between a patriot and a nationalist.   A patriot is someone who loves the country but wants to improve it. A  nationalist loves the country without criticism and becomes dangerous. I famous guy I think he was the 16th president of this country said that “a house divided against itself, cannot stand”. My ancestors were enslaved in this land and fought to improve this country, I refuse to throw away their sacrifice.  We need to teach people to honor the legacy of people that ended slavery, bought civil rights to everyone and reached for the moon. We need Americans to believe this country can be a force for good. Not that it is an unredeemable project that needs to be destroyed. Too many people blood has been spilled in its darkest time for people this generation to throw it away because of Marxist propaganda.",sdotdiggr,2025-05-01T16:55:59,-5
[removed],[deleted],2025-05-01T16:43:04,-7
Whereas the left teaches children to hate America and that they can choose their gender regardless of parental notification. I think I'll stick with Trump's plan,Top-Anybody1550,2025-05-01T19:13:58,-9
"He views America and Americans with contempt. He is supposed to represent the people of the United States, not just the people who bought him and his ego.",GoodIdea321,2025-05-01T16:54:05,53
"Well, you can't teach someone to ""Love"" a thing and it not be some form of indoctrination. You can teach something and people can choose if they love it or not.  You can share your passion about something but it doesn't mean anyone learning from you will receive that same feeling. The idea presented here is simply Nationalism which we as a nation have criticized in other nations (for example China for how they educate) and we are currently arresting people for political speech around supporting their nations, so this seems to be both hypocritical and non-American.",postmfb,2025-05-01T16:51:34,59
"No, they mean their version of America only.  Certainly not the diverse broad American society that we are and that made us successful.",Thisam,2025-05-01T19:46:46,17
[removed],[deleted],2025-05-01T16:47:00,-35
I don’t know if we can be certain he isn’t some of those things,chanslam,2025-05-01T17:46:03,17
He looks like a freshly shaven scrotum.,tendeuchen,2025-05-01T21:05:42,9
"""He only ended up in politics because his arms are too weak to strangle a sex worker"" is the gist of the meme going around about this guy. He's an enthusiastic kapo POS.",Multiple__Butts,2025-05-01T22:57:47,2
Or a vampire. I refuse to believe he is not one of the undead who can walk in sunlight.,ElfegoBaca,2025-05-01T18:56:50,9
"I grew up in the 90s.  Yeah, I was AWARE of there being some shit that wasn't spectacular, but I genuinely felt a pride to be American, and felt that, for our failings, we were heading in the right direction and were a nation all other nations should look up to.  Trump's first administration did to THAT fantasy what Hitler did to his dog.",aradraugfea,2025-05-01T18:19:49,26
C’mon. Look at this guy. Do you think he knows anything about actual love. And I look forward to the american children’s reaction to all this. I’m sure all the strict rules will go over real well and def not lead to any more shootings.,Luke_Cocksucker,2025-05-01T18:58:18,3
Exactly! There's very little to love about this country at the moment. We're a hot mess but it can still be saved.,ElfegoBaca,2025-05-01T18:57:51,1
Pee Wee German,MrFC1000,2025-05-01T19:40:14,10
Temu Goebbels,The_Wrecking_Ball,2025-05-01T23:41:01,2
As if precedent means shit anymore? They overturned chevron and Roe v Wade and court comitas got taken out back to the shed and brutalized with a sawed-off.   The issue is that people in power support what is happening. If they didn’t support it then things wouldn’t be happening because they would be meaningfully resisting what’s happening. That things are continuing on is the real disappointment.,ChilledParadox,2025-05-01T18:46:57,9
_if_,Ergok,2025-05-01T17:49:12,5
>and pledge their devotion.  They already make them do that.,Sly1969,2025-05-02T04:02:16,1
[deleted],[deleted],2025-05-02T01:50:25,1
"Canadian who moved to the US in high school the propaganda is very strong. Flags everywhere, ROTC, the pledge every morning. It was a culture shock.",nkassis,2025-05-02T14:59:48,2
"I learned about My Lai at a Jesuit high school 20 years ago before I could drive a car.  Watched the entirety of the Ken Burns Civil War documentary while in 8th grade too, before the Iraq War started, at a Catholic grade school.  We did the pledge and a morning prayer at both too.  Despite that, I still loved America, while acknowledging the stains. The biggest things that have hurt my sense of patriotism since then? The Iraq War and Trump. The call is coming from inside the house, and that’s why they’re doing this.  It’s scary to me how kids today, in this era, might be shielded from actual history and actual education in the name of brainwashing them into nationalism. Those lessons still stick with me today.",take_care_a_ya_shooz,2025-05-01T19:21:46,2
Thanks for all the breakdowns and citings. I'll be using your points in my posts regarding this issue; your time and commitment are not wasted.,Hopefulmigrant,2025-05-02T09:29:54,2
Theres already no coming back from whats happened. America fell.,Successful_Sign_6991,2025-05-01T19:43:34,1
"We need to make America something people want to love, not try to teach them to love it.",Gatonom,2025-05-01T17:12:06,10
"A patriot is like a parent looking at their child - full of love, but capable of doing wrong and occasionally in need of correction.  A nationalist is like a young child looking at their parent - they can do no wrong  and should be loved above all others.",h3r4ld,2025-05-01T17:20:41,4
"Sure, but the Trump administration is not the ones I trust to not go nationalist.",BotherResponsible378,2025-05-01T18:37:00,2
> We need Americans to believe this country can be a force for good.  So lie to them?,Key-Compote-882,2025-05-02T08:26:01,1
[deleted],[deleted],2025-05-01T16:48:32,5
Teaching kids uncomfortable truths about our country isn’t teaching them to hate America.   America is great when it acknowledges what it did wrong in the past and strives to be better.,wwhsd,2025-05-01T19:36:43,7
"""Truth and choice are bad y'all! I'm a freedom loving patriot!""",anti_pope,2025-05-02T06:14:57,2
"He thinks the country is a piece of property he just bought, his personal plaything to do with as he pleases. Anybody who doesn’t worship him is viewed as a trespasser.",Vyar,2025-05-01T19:32:07,28
Handmaiden tale covers this,Antique-Echidna-1600,2025-05-02T07:38:07,2
"No its not a fine line. Its not ok at all. You don't teach people to love their country. If you want to have the people truly love their country you make it a country worth loving. You make people happy that they are here, you take care of them and make sure they are supported.   Teaching someone to love the country is always about brainwashing.",TheJadeGoddess,2025-05-01T16:50:33,38
it's objectively true. Trumps entire campaign both times is that america is a haunted broken shell of it's self. nobody has had more constant and harsh criticism of every aspect of america today.,roastbeeftacohat,2025-05-01T17:43:14,13
The same people whose slogan is Make America Great Again - ie America Is Not Great Now - will teach kids to love America.  Give me a fucking break.,bin10pac,2025-05-01T17:58:00,13
>Teaching love for one's country is important  Is it?,Oscarfan,2025-05-01T18:02:50,9
He looks a lot like Nosferatu.,SharpCookie232,2025-05-01T19:47:46,9
[deleted],[deleted],2025-05-02T01:25:50,2
He sounds like Dr Evil,Chicagosox133,2025-05-02T04:23:23,1
"I feel like “we were headed in the right direction in the main” carried a lot of 80s-90s kid patriotism. Your high school education might have dwelled on the good parts more than the bad, but it also acknowledged that there were bad things that the good things helped fix—like, your MLK unit definitely was like “Jim crow was the literal worst, and we got better. Still work to do, but we started down the path.”—and then you’d see that reflected in the news: Obama becomes president. There are cases of racism vigorously prosecuted now. You just don’t say some things to some people.  I feel like the first part is still a fair, if tilted towards the home team as good guys teaching of American history, up to and including Trump 1 and Biden. As you note, it’s a lot harder to see in Trump 2.  Still, from an anti-patriotic point of view—I think there *is* something to be said about collegiate level courses tilting too far towards America bashing—that the white man was an evil oppressor, and that is the only narrative. That is not even giving the home team the advantage it deserves—like, the segregation of troops in WWII is bad and unfair, but also, the normal ass white dude’s bravery also deserves a fair bit of coverage. That balancing act is something collegiate level studies don’t do well.  Which is still to say that propagandizing kids, and not teaching that Jim Crow, the failure of Reconstruction, and Andrew Jackson’s crimes against Native Americans exist is good. But those things can be put in context of the long arc of American history without making the sins the only focal point.",kanakaishou,2025-05-02T10:09:20,1
"Well, the 2nd amendment isn’t being used for anything else…",lesmainsdepigeon,2025-05-01T20:52:05,4
That's gonna leave a mark.,DeeperThoughts57,2025-05-02T05:55:25,1
"I went to public school and we never really talked about Vietnam, majority of what i knew of it as a kid came from movies, like Forrest Gump, but there are so many stains its hard to tell what color the carpet even was. Now I'm not going to say America is special in its horrible history, just that the way they teach history is schools is already pretty propaganda-y. Heck look how many only recently learned of the tulsa massacre thanks to Empire.",Rezkel,2025-05-01T20:49:04,3
There's still some pissed off spooks with a deepfelt appreciation for the US Constitution. All hope is not yet lost. If you get my drift...,Zazen_Satori_Gaming,2025-05-01T19:46:06,2
"You can’t make something to love without loving it first. There is a reason why most younger people don’t vote because they don’t believe they can improve this country because they are grading it to their current morals. My ancestors loved, lived, and died for this country even when they were owned, hated, and abused by it. You make the change you want, not wait for someone to do it.",sdotdiggr,2025-05-01T17:19:45,-7
"Eh, that's debatable, but really it's about creating a national identity so people don't turn on each other. Not that that's playing out well right now...",genospikey,2025-05-02T08:50:24,1
You responded to an LLM bot,puchamaquina,2025-05-01T16:53:02,3
"I see California and that says it all. America has acknowledged, has made massive leaps forward but for leftists it's never enough. If we listened to you we'd believe Nazi's and the KKK teamed up and are running the country. Fortunately 78 million people saw through the lies and voted appropriately",Top-Anybody1550,2025-05-01T22:47:05,-8
Nazferatu,Pointothedexter,2025-05-01T20:09:28,8
"What's that in Vampire years though, 390 maybe?",ElfegoBaca,2025-05-02T06:43:06,1
This country has already collapsed. We're all just waiting for the effects.  Its going to be the biggest depression in history. Massive food shortages and starvation awaits.,Successful_Sign_6991,2025-05-01T22:50:52,1
"We can't love something if we don't have and see the merits of it. People need to be inspired.   One person can't make change, and people have many views often in opposition.   I would love if in The Land of the Free I could be free outside the internet and the four walls of my home, but it may take generations to achieve that.   My views are in the minority and under threat of attack, I make what should be plenty and live on the edge without upward mobility.   It's no surprise people feel they can't do anything to improve things. So many Americans are against those of us who would want to help and inspire.",Gatonom,2025-05-01T17:25:34,4
"Any country CAN be a force for good, America certainly CAN but does not do it.",Key-Compote-882,2025-05-02T08:54:38,1
"Sounds like you should just let California secede then, and the rest of America can live happily ever after. Dirt poor and even more glaring infrastructure issues than today, but happy nonetheless!",Daemor,2025-05-02T01:25:59,4
"Sure I’m sure that if Black Americans after being enslaved for 87 years and then suffered an actual apartheid somehow saw merits in America the generations that came after that struggle and improvement have no excuse except they don’t want to work for it.   The Civil Rights movement was 15 years of struggle, not 15 months, 15 weeks or 15 days. There was a clear goal with leaders that believed in the cause. People don’t want to put in the work and wants society to placate them when society is they way it because (majority) people made it that way.",sdotdiggr,2025-05-01T17:36:08,-5
"People are also individuals trying to get by, people are struck with a lack of unity.   We don't have leadership right now, and we can't be leaders without followers.   We don't have community, we can't build community. A lot of us are waiting on those who can, to do so.   People want to work for change, but are being stopped, and just get used to not being able to.",Gatonom,2025-05-01T17:44:38,3
"Do you really think that Black Americans in the 1950s as third class citizens that used inferior facilities were not trying to get by? They didn’t have the economic, political or cultural power people have now. Also they didn’t follow Dr. Martin Luther King Jr as their leader they believe in his vision of the future. That’s why we know about the “I have a dream” speech. No someone can go online and get millions of followers by speaking into their phone. In 1954 people knocked on doors, mailed letters, community organized.  I think it’s easier for you make excuses when people protested in the 1950s they could have ended up hanging from a tree the next day. Look up Emmitt Till, his age and what was done to him and give me more excuses.",sdotdiggr,2025-05-01T17:52:18,1
"*Someone* can get a million followers, but they aren't able to motivate those people toward causes.   Anything political gets ignored, tuned out, or shut down. Even if we agree on how things should be, it only highlights how we lack the ability.   So many of us will try to debate and figure everything out, question ourselves and be filled with doubt and worry, realize we may be wrong, and at the end of it all go to work every day all the same.   We need activists and protestors, but it's the beginning of a long road to motivate anyone, to even enable the rest of us to join.",Gatonom,2025-05-01T18:02:18,3
