Comment,Author,Date,Score"Unfortunately a lot of the Christian right is anti Catholic anyways so they will be all in on the pope Trump ""joke""",19chevycowboy74,2025-05-03T08:36:10,59
"Mom is a trump supporter. I shared this with her. She said the media is lying. Trump would never do that. And all of his own words are the media twisting it. Literally nothing, even Donald Trump himself, will sway people from this cult. It’s insanity at its peak.",entench0123,2025-05-03T12:22:04,11
Yup.  Curious how my catholic trump supporting extended family are taking this.  Its a direct direct slap in the face.  Im sure theyll overlook it but would loooove to hear their justification and/or shrug it off,b_tight,2025-05-03T13:57:26,2
He'll fit the role nicely because he already does sky daddy things. Like taking away resources from the poor and downtrodden.,aerialwizarddaddy,2025-05-03T14:15:08,2
They are loving just how much normal people are offended by this and it fuels his base. They are quite the hateful group of Christians.,SickARose,2025-05-03T14:49:05,1
"They don’t care because they never actually believed in any if that shit in the first place. Pope dies. Trump shows up in a blue suit, falls asleep, uses the event to talk ukraine. A fuckin week later, “I should be pope.” Any word from the catholics who voted for him, crickets. They got more upset at black santa in target than this obvious blasphemy. But whatever, like I said, they never really believed in any of that shit in the first place.",Luke_Cocksucker,2025-05-03T16:42:23,6
"I blame the Founding Fathers.   The only requirements they stipulated for being President of the United States are being over 35, born in America, and having enough electoral college votes.   _Maybe_ they should have put something in there about not having mashed potato brains?",Independent-Roof-774,2025-05-03T08:55:56,10
"I agree with you in principle. One problem posed by their flood-the-zone strategy is that people become divided over what deserves a response and what should be ignored. We need to get more skilled at speaking quickly and decisively on matters like this without allowing specific incidents to drown out larger themes. We don’t have to get angry about a hypothetical Trump Pope, but we can absolutely highlight his behavior. If he’s trolling, he’s an unserious person acting irresponsibly in dire times. If he’s serious, he’s either delusional or has nefarious plans.   Not everything needs to be a crusade, and we don’t need to spend equal time on all fronts, but there’s nothing wrong with articulating how unfit he is at every opportunity.",jackleggjr,2025-05-03T09:29:42,12
"The problem with that is that you never know what might be the straw that breaks the camel's back for his supporter's blind faith in him.  This is actual sacrilege for any Catholics that happen to support him.  If it gets some Catholics to open their eyes to the fact that he is fallible on this, it can lead the way to them questioning more of what he tells them until they are able to break through the brainwashing.  At the end of the day, anything that he does to show how much of a psychotic, thin-skinned con man he is should be shared, remembered, and pulled out when talking with anyone who might be susceptible to it as an approach to get them to see reason.",sarcasmsosubtle,2025-05-03T09:51:38,8
"This is disgusting behavior that any nations leader should be chastised for. This is the President of the USA, this is NOT a distraction.",FishCommercial5213,2025-05-03T15:12:12,2
"Nah, they’ll find a way to justify it in ways they would never justify it if somebody else did it.",Gold_Repair_3557,2025-05-03T09:23:48,19
They'll never even see this. Only goal here is to generate outrage,ntwild97,2025-05-03T11:06:49,2
Well said and to the point!,Harry_Mud,2025-05-03T10:18:41,1
Another fat grifter suspected of banging his daughter. Incredibly apt comparison.,Worried-Rub-7747,2025-05-03T08:28:28,9
"His supporters forget this quickly even if they are briefly offended. They just say “I don’t particularly like the guy, but Democrats are giving girls abortions in math class so I’m still voting for him.”",PatchyWhiskers,2025-05-03T08:52:01,5
"A notable portion of his supporters are evangelicals who already hate Catholicism or heretical ""Catholics"" who are verging on, if not already gone into, schism with RCC. I really doubt they will care.",IggyVossen,2025-05-04T14:56:16,1
"I don’t feel trolled, like I acknowledge this is really immature and unprofessional for someone in the presidency but like… fuck the pope, that’s a lot of child rape they protect",SpaceLemming,2025-05-03T09:16:05,0
While I steal your Social Security…,game_over__man,2025-05-03T12:34:17,1
We can point out how stupid he is for believing this stuff without being distracted from the evil he’s also doing.,scotcetera,2025-05-03T09:49:01,1
Tariffs though,PatchyWhiskers,2025-05-03T08:59:33,2
That’s actually not what the article says at all. Many were offended following the death of Pope Francis. Always good to read the article before commenting upon it.,edemberly41,2025-05-03T09:41:19,2
"They view people who freak out about things like this as weak. So it makes them feel better about how tough they are when it's just a joke to them. I don't really get upset from stuff like this, just view it as absurd or childish so I play stoic and they don't know how to react to that.",Mean-Goat,2025-05-03T11:40:50,1
"That is the beauty, they think it brings votes",Perfect_Toe_6526,2025-05-03T12:56:47,1
He got a gun under the robe so it’s OK.,OtakuTacos,2025-05-03T14:06:22,1
"Yes, this! Every rag & site. Far right to Far left shows this fuckers face and standing as the pope .  The media, all of them are worse assholes than Donnie von Shitsinpants!!!",BioticVessel,2025-05-03T14:02:10,2
Where did you get the 90% figure?,IggyVossen,2025-05-04T15:03:07,1
Imagine defending Trump lmfao,KaydenGotRizz,2025-05-03T14:01:25,0
The President of the United States behaving like an adolescent middle schooler and engaging in trolling behavior aimed at the 53 million American and 1.5 billion baptized Catholics worldwide is news.,Funky-Buddah,2025-05-03T14:15:56,1
"No shit, but it also shows what a huge asshole he is. And what little respect he has for everyone else",ModsBePowerTrippin12,2025-05-03T11:38:14,2
jury is still out on that lol,PennX88,2025-05-03T14:39:20,1
How is this “owning the libs” i would say catholicism and liberalism are not a huge overlap?,Lillythewalrus,2025-05-03T10:26:54,1
"I really am disgusted when people excuse his poor behavior on age. he’s reported to have been terrible his entire adult life. he is an asshole. you don’t grow out of it barring a kick in the ass when you behave like one, and he never has to face consequences",Creepy_Meringue3014,2025-05-03T13:32:57,80
Waiting for the lightning bolt,Intelligent-Travel-1,2025-05-04T16:18:37,2
“Do that thing with the compuder where you put my face like on someone else’s body” sounds like a late night addy fueled request from an old megalomaniac if I ever heard one.,myfakesecretaccount,2025-05-03T09:11:40,49
Cheung. Loathsome guy.,chrispg26,2025-05-03T10:32:23,10
"It was still someone in his office, posting it on his account first.  It didn’t go viral on its own or Trump just retweeted it.  He or his immediate circle made it.",CarmineFields,2025-05-03T12:50:31,6
I think the point is more that Trump re-posted this officially.,mademeunlurk,2025-05-03T13:25:15,7
"i´ve seen that picture the day the pope died, we can be shure he did not make that picture up. That was done by some more clever person that can use the thing with the display and the buttons better than djt",saxovtsmike,2025-05-03T12:52:46,3
"The 25th amendment isn’t something he’d use. It allows the VP and cabinet members to declare the President is unable to perform the duties of the office and they are voting to remove him and replace him with the VP. The President then has to prove to congress or the senate that he is capable of performing the duties of the office.   It could have been used the first time around too, but they didn’t.",BigAddam,2025-05-03T09:43:40,12
"He sure likes his own freedom of speech, but I don’t think he’s gotten around to reading past that one.  [The Declaration of Independence](https://www.reddit.com/r/Qult_Headquarters/comments/1kcd73m/what_does_the_declaration_of_independence_mean_to/) on the other hand… solid understanding of that one.",Ziograffiato,2025-05-03T10:34:57,3
The antichrist is actually JD vance.. only a loterql antichrist wouldn't know how to conduct themselves in such a holy place as a donut shop,A_Topical_Username,2025-05-03T12:39:35,4
Trump gave Catholics Roe repeal. Being an irreligious charlatan who openly mocks their faith and values is a small price to pay in their book.,Foxhound199,2025-05-03T10:39:00,18
"Exactly.  American Protestants denominations, especially of the evangelical or non-denominational flavor, view Catholicism as heretical  and Catholics as not Christian. In the extreme as satanic.     How some dumbass Catholics in politics and in society sided with the white Christian nationalists idk...wait i do..white ones.     Catholics and Mormons have always been viewed being in a cult and not Christians by the Baptists and  Pentecostal denominations, especially in the Bible belt.    And it is the Baptist, Pentecostal, and non-denominational evangelical groups that have been pushing for and defending the religious fundamentalist movements in America since Reconstruction.  Dominionism, prosperity theology, etc. all from this group.     Catholics in America should have paid better attention ww2 , know history repeat it, etc.",throwawtphone,2025-05-03T10:47:29,7
Yup.   Also the American Catholics I know who are Trumpers are turning away from catholicism now in favor of Trumpism anyway. Literally because they think the last pope ruined religion forever by being... not a massive homophobe.,ArmoredMirage,2025-05-03T12:37:30,5
She can see it herself on his truth social.  But I get your point; their cultish behavior is terrifying.   I am sorry about your mom.  That must be super hurtful and disappointing to see your mom so hateful and lost.,WithMaliceTowardFew,2025-05-03T12:27:25,7
I am not offended. The “religious” are his people.  We all knew he would turn on the maga eventually.  He always hated and was embarrassed by his dumb and the weak followers. Now he insults them to their faces. Again.,WithMaliceTowardFew,2025-05-03T15:09:12,1
"Well, in defense of the founding fathers, mashed potato brains was probably something of a rarity since by the time one is typically old enough to suffer from it in their day, statistically they will have already died from scurvy or being mauled by a rabid beaver or any number of medieval Oregon Trail ailments (Trailments?)  But yeah, I see your point.",Cubby_Grenade,2025-05-03T09:37:32,2
"To be fair to them, they couldn't have conceived of modern medicine that would allow 80 year olds to turn Congress, the White House, and the Supreme Court into care homes for dementia patients.",Mean-Goat,2025-05-03T11:50:33,1
Fallible (not infallible) but yes one hopes this turns off some of his voter/fans. I don’t think many old Catholics are necessarily clued in to the White House twitter feed or non-right wing news outlets but yeah I don’t see this increasing his popularity.,FrogFlavor,2025-05-03T11:04:04,4
Wishful thinking? I doubt this would actually offend anyone who is already a 2025 Trump supporter.,WhiteWolf3117,2025-05-03T13:47:30,1
"And it's since been posted on the White House Twitter account.   I'm an atheist and even I know this is wildly inappropriate in the wake of the Pope's very recent death, leading to the loss of the Church head for a billion (literally) people.",rabidstoat,2025-05-03T16:55:57,3
I agree with you that it's disgusting behavior. There's a purpose to these trolls and eliciting outrage is part of his tactic.,slapasaurus-rex,2025-05-03T18:50:41,2
"Yes of course this is disrespectful and unpresidential, but we canʼt fall for the trap. Trump did this, so the media would talk about it – instead of how heʼs destroying the economy. Letʼs focus on and raise awareness about the disrespectful things he does that are actually costing peopleʼs lives (such as his orders full of discrimination as well as the increasing poverty of course), and not on this distraction! He is trying to avoid protests because pretty much nobody will fight against an AI picture after all, but if the media would be allowed to do its job and report on the actual suffering caused by Trump daily, we would perhaps have more people – even some Republican politicians – protesting on the street",SmallCapsForLife,2025-05-04T04:33:26,2
I’d wager these unhinged moments don’t have the same “own the libs”appeal with half his base that it once did. He’s been overdoing the clowning this term since his megalomania is unchecked now. ,Sharp_Blueberry_6547,2025-05-03T09:38:26,5
I can’t find anything on the conservative sub lol. They always conveniently leave out the stuff that should really bother them lol.,LilSwede91,2025-05-03T08:57:41,2
"I think it’s a distraction because normally he says stuff and then says joking later, but he had said the shit with a serious tone. This time when he answered the reporter, his tone sounded like a joking tone to me. So why he feels the need to keep it going, seems like a distraction. He doesn’t give a shit about the Pope, but he’s getting *something* out of posting this.",MaddyKet,2025-05-03T10:07:49,1
"Agreed with caveats.  If you’re Catholic and this is a deal breaker great. One less voter and hopefully one more for the opposition. Just pointing out that in terms of evil shit, there’s a pyramid of crap piling up and it can all be obscured by infantile BS.",snoutmoose,2025-05-03T10:17:00,1
"He does something outrageous.  Dominates the spin cycle, then moves on to the next thing. He's been doing it since 2016.",SurroundTiny,2025-05-03T14:17:07,1
[Here](https://www.ncregister.com/cna/catholic-voters-favor-trump-over-harris-nationally-and-in-swing-states-exit-polls-show) but they are quoting WaPo. This wasn't really shocking to me though.,Johnhaven,2025-05-05T18:27:15,1
"You completely misunderstood my comment. Read my post history. My point was that every time this fuckstick does something idiotic, “the critics erupt”. And nothing happens until he does it again and “the critics erupt”.  And his cult eats it up and laughs it off.",ricks_flare,2025-05-03T14:25:40,0
username does not check out.,Nknights23,2025-05-03T14:42:32,0
"But it’s so easy to say “Geeze I was obviously joking but the left doesn’t understand sarcasm they’re so stupid”. Yes, it’s dumb as shit and irritating. But he obviously isn’t going to be pope so talking about it any further is pointless to the actual damage he is already causing",Becker_the_pecker,2025-05-03T14:18:30,1
Indeed.,CheesecakeHorror3410,2025-05-03T12:02:53,1
Because he’s getting a reaction out of people who don’t support him. He’s a narcissistic troll and gets off on this shit.,Hikari_No_Willpower,2025-05-03T10:28:49,2
He is but two things can be true at the same time.,currentmadman,2025-05-03T14:41:23,17
Both can be true. He was an asshole. Now he is an asshole with brain damage.,Nux87xun,2025-05-03T15:30:17,2
"Yeah by this logic, his entire life has been one long series of strokes",kooeurib,2025-05-03T14:19:47,1
"Agree, and we can't forget all the people supporting him and allowing this to happen. He has a lot of powerful people behind him.",tigertiger180,2025-05-03T21:55:51,1
Everything is compuder,Opsdude,2025-05-03T14:05:07,7
Miller.,CarmineFields,2025-05-03T12:50:44,2
">The President then has to prove to congress or the senate that he is capable of performing the duties of the office.  The President doesn't even really have to ""prove"" anything - all he has to do is submit a ""written declaration that no inability exists"" to Congress.  At that point, the ball is back in Congress' court and they have to have a two-thirds majority vote in \*both\* houses to remove him.",ScottRiqui,2025-05-03T12:53:08,3
JD Vance is an actual crazy person.,Daveaa005,2025-05-03T15:16:00,3
"It's worse, a lot of evangelicals think Trump was sent by God. They think of him as a divine ruler.",PathOfTheAncients,2025-05-03T11:40:39,4
That was made into a voting issue for evangelicals. The Republican party found that women supported it.,uniklyqualifd,2025-05-03T12:22:59,1
It’s so funny to me because Catholics are the OGs of Christianity.  They are the ones who started it all.  These Protestant sects came later.  It’s all ridiculous to me but the prosperity gospel folks calling anyone else not real Christians is hilarious.  Damn rubes are such dummies.,WithMaliceTowardFew,2025-05-03T12:59:59,3
"Its funny that you say that because my Sister in Law who is(or was) a super devout singing in the choir Catholic, and is also a huge MAGAt despite being a teacher and being the outlier in her family in this regard, started drifting more and more to one of those Bible banging nondenominational mega churches since a bit before the election.   Anecdotal but it shows there is something to what you said that they are abandoning one religion in favor of Trumpism in a way.",19chevycowboy74,2025-05-04T14:48:07,2
"Wow, that’s super kind and thoughtful of you. My relationship with my mom has actually deteriorated immensely due to her constant absorption of Fox News and trump propaganda. I am sitting at an ikea and just really comforted by your response. I appreciate you.",entench0123,2025-05-03T12:29:02,8
"Or on Twitter, now that the official White House account has posted a screenshot of it on Truth Social.",rabidstoat,2025-05-03T16:53:21,2
"I disagree. At the time that they made the Constitution the King of England was certifiably insane.  There's a whole movie about this (_The Madness of King George_).    There were plenty of other historical examples they could have drawn on going back to Nero.     The Founding Fathers were educated men who knew their history very well, and they were well educated in the Greek classics and in English literature, for example Shakespeare. All of those contain plenty of examples of powerful people who surrounded themselves with acolytes who would do anything for them. So it's inconceivable that none of this would have occurred to people like Madison, Washington, and Franklin.",Independent-Roof-774,2025-05-03T13:55:34,1
He is naturally hateful and spiteful and that’s his main motivation when he does these awful acts ; it’s just that the conservatives use his natural character at a sickening tactic.,FishCommercial5213,2025-05-03T19:29:03,1
"Maybe so, I get your point, but IMO we can walk and chew gum at the same time.",FishCommercial5213,2025-05-04T09:25:27,1
"A good reminder that Reddit is anything but a public forum, it's a highly curated series of siloed echo chambers, moderated and censored by anonymous morons. 100 people may have tried to post it and gotten it deleted or gotten banned. There is zero freedom of speech on this platform... You have your discourse deleted on this very sub for formatting violations.",starliteburnsbrite,2025-05-03T16:42:58,2
Yeah. Honestly if it was within his power I can see him appointing himself pope if he could. Theres nothing we can take for granted anymore.,snoutmoose,2025-05-03T10:18:19,1
And it's all free exposure.  The problem is the media!   The asshole is just a symptom.,BioticVessel,2025-05-03T15:09:02,2
"It says Catholics voted 56 to 41 for Trump. Not 90%.   Only 90% is that 90% of those who believe abortion should be illegal, not necessarily Catholics, voted for Trump.",IggyVossen,2025-05-05T22:23:50,1
"While it might feel futile to even bring this up, given the mountain of other seriously messed-up things he's involved in, there's another way to look at it. This behavior really highlights a deep lack of emotional maturity in someone who holds immense power over pretty much every aspect of our lives – our money, our safety, our health, our kids' education, you name it. What could easily be dismissed as just annoying online antics actually seems designed to drive us further apart, and that's something we really need to call out, loudly and consistently. Just my two cents.",Funky-Buddah,2025-05-03T14:32:52,2
"Is that it? Anytime someone says something that makes more sense but is in disagreement with your opinion, we should go with “two things can be true at the same time?” And if that fails, we can go with “it depends.”   Trump has a documented history of being unhinged. It goes back to his boyhood. You want us to take this documented personality and some alleged stroke and say “both can be true at the same time.” How about other factors? He is unhinged, has strokes, has syphillis, itchy balls, is demented, etc etc…because after all, all those things CAN be true at the same time.   Take a position and defend it.   We can defend trump being unhinged as part of who he is, we cant defend the opinion that trump has a stroke. Stfu.",Lanky_Trip968,2025-05-03T16:53:09,0
"I’m never angry with Trump tbh. I know he’s the poster child for the bs going on, but we all know he isn’t smart enough to draft an eo. he wouldn’t even be allowed to take communion so this pope stuff doesn’t bother me either. he’s fos    it’s every other person propping him up that brings out new levels of rage in me. I’m  very much looking fwd to the next Congress because this bs will finally be over. impeach remove convict. no pardons just fucking jail or hell.",Creepy_Meringue3014,2025-05-04T04:26:39,1
"Miller is loathsome too, but Steven Cheung is the comm guy.",chrispg26,2025-05-03T12:51:42,2
"I mean it makes sense. They probably feel like they have to go above and beyond to even compete. Isn't Catholicism not only older, but larger?   I'm not sure how much of the divide exists in practice, Catholics definitely like Trump, by and large. Coney-Barrett is catholic, as is Vance, and evangelicals like Trump as well.",WhiteWolf3117,2025-05-03T13:46:36,3
"I'm sad to say that you are not alone, as I am experiencing the same circumstance with my fox/maga mom.  He may well be the antichrist; families are getting torn apart.",timnphilly,2025-05-03T13:55:41,6
We have to be in this together. I am so glad I offered some comfort in this storm. Sending my best to you and hopes for your mom too!,WithMaliceTowardFew,2025-05-03T12:55:09,4
"That's just Catholics. Look at the article again, they are saying 56% of Catholics voted Trump and of them, 90% of the ones that are against abortion voted for him. Which, isn't how I put it anyway so it's a correction anyway. Thanks. :)",Johnhaven,2025-05-06T15:57:08,1
He will just say he’s kidding. This will not stick to him in any meaningful way,Becker_the_pecker,2025-05-03T14:33:25,2
I just meant dementia could be making things worse. People with dementia and/or brain damage can become aggressive and unpredictable and that’s a problem since trump was already a dumbass and a douche long before dementia came into the picture.   Some of the things he’s been doing just seem…off. Like that rally where he spent the better part of an hour doing a weird old man dance to Ave Maria. He shouldn’t escape responsibility or punishment for anything regardless but it is worth noting that a malicious idiot and a malicious idiot with a dying brain are not the same situation.,currentmadman,2025-05-03T17:34:42,6
Yikes. Calm down,Party-Interview7464,2025-05-04T05:50:50,1
I really think Miller is behind absolutely everything at this point.,CarmineFields,2025-05-03T17:34:06,1
I just read an interesting article from a Christian about how their faith is lives and they are really in it for the power after all.  Here is a gift link if you are interested.  https://www.nytimes.com/2025/05/01/opinion/trump-evangelicals-republicans.html?unlocked_article_code=1.EU8.2Bgo.HHVdOiVwVrLB&smid=nytcore-ios-share&referringSource=articleShare,WithMaliceTowardFew,2025-05-03T13:57:56,1
"So you have some examples of right-wing Catholics and think that they represent all  Catholics? Well, Biden is a Catholic, so is AOC, so is Sotomayor, so is Pelosi, so were Jack, Bobby and Ted Kennedy, so were... the list goes on.   To say that Catholics definitely like Trump is kinda misleading. The problem is not with Catholicism or Catholics but rather Americans.",IggyVossen,2025-05-04T14:52:49,1
I’m sorry for your loss of family. Thanks for sharing man.,entench0123,2025-05-03T17:01:13,1
True. But it might convince a few more people to wake up. Wishful thinking I know.,Funky-Buddah,2025-05-03T15:44:39,1
"He's definitely being portrayed as the guy calling the shots for Trump, but he's not alone, and he's not the mastermind.  Heritage Foundation and the Yarvinites have formed an unholy alliance.",chrispg26,2025-05-03T17:37:00,1
"Most Catholics are conservative, Catholic voters grew for Trump in 24. Token examples of liberal or progressive Catholics don't change the broader point. I'm not making a qualitative statement about Catholicism there, but to act like Catholics as a whole aren't conservative and that conservatives don't like Trump are incorrect.",WhiteWolf3117,2025-05-04T16:26:25,1
