Comment,Author,Date,Score
" As a reminder, this subreddit [is for civil discussion.](/r/politics/wiki/index#wiki_be_civil)  In general, be courteous to others. Debate/discuss/argue the merits of ideas, don't attack people. Personal insults, shill or troll accusations, hate speech, any suggestion or support of harm, violence, or death, and other rule violations can result in a permanent ban.   If you see comments in violation of our rules, please report them.   For those who have questions regarding any media outlets being posted on this subreddit, please click [here](https://www.reddit.com/r/politics/wiki/approveddomainslist) to review our details as to our approved domains list and outlet criteria.    We are actively looking for new moderators.  If you have any interest in helping to make this subreddit a place for quality discussion, please fill out [this form](https://docs.google.com/forms/d/1y2swHD0KXFhStGFjW6k54r9iuMjzcFqDIVwuvdLBjSA).    ***   *I am a bot, and this action was performed automatically. Please [contact the moderators of this subreddit](/message/compose/?to=/r/politics) if you have any questions or concerns.*",AutoModerator,2025-04-26T10:49:32,1
Flip flop flip flop flip flop,Ordinary-Figure8004,2025-04-26T10:56:24,19
Victory!  We avoided a brain drain crisis.,dbag3o1,2025-04-26T11:00:06,3
This is just a never-ending snip snap,namastayhom33,2025-04-26T11:31:13,3
Restored status of some international students.,Dinker54,2025-04-26T11:07:16,1
Those international students sure have learnt to STFU about Palestine and criticizing America. Mission accomplished.,xibeno9261,2025-04-26T13:29:47,-3
to eternal. And his Republicans supporters loves it.,Humble-Emphasis5982,2025-04-26T11:05:19,3
It’s the waking up each and every day and wondering what changes are still valid and what has been withdrawn. Who is flavour of the day today,Maleficent_Pay_4154,2025-04-26T16:32:26,2
"That might be too soon to say. He still got 3,5+years more of this.",Erikblod,2025-04-26T11:02:25,4
"Sadly this doesnt restore the status of deported students.  It just forced ICE to restore thousands of SEVIS records (""Student and Exchange Visitor Information System""), bY COURT ORDER.  Apparently being 'SEVIS-less' is a murky legal status because - even though having a SEVIS record is a pre-req to obtaining a student Visa, and is maintained for reporting purposes - a student's Visa is still ""valid"" even if the SEVIS record 'disappears'... although ... not in any pristine sense  Suffice it to say, ICE was ""messing with"" visiting student's records, and the court forced them to STOP and restore the records they had deleted.  ICE are worse law-breakers and felons than any student they've deported - the courts are having to CONSTANTLY keep them in check.",XSinTrick6666,2025-04-26T12:48:42,3
"That implies that people with brains will decide to subject themselves to flip flop of an authoritarian regime supported by a very sizable xenophobic political portion of country.     Validity of Visa makes it possible for brains to come and contribute in society. Society giving poplar vote to anti-immigration nutcase is a greater disease, not unseen by brains with self-respect and common sense.",Unhappy_Sugar_5091,2025-04-26T12:49:43,2
Victory in a game that should never have been played in the first place isn't saying a whole lot.,biscuitarse,2025-04-26T12:47:07,1
Plus all the new generation of international students who won't be considering coming to the US,spacewookette,2025-04-26T12:11:24,5
