Comment,Author,Date,Score
" As a reminder, this subreddit [is for civil discussion.](/r/politics/wiki/index#wiki_be_civil)  In general, be courteous to others. Debate/discuss/argue the merits of ideas, don't attack people. Personal insults, shill or troll accusations, hate speech, any suggestion or support of harm, violence, or death, and other rule violations can result in a permanent ban.   If you see comments in violation of our rules, please report them.   For those who have questions regarding any media outlets being posted on this subreddit, please click [here](https://www.reddit.com/r/politics/wiki/approveddomainslist) to review our details as to our approved domains list and outlet criteria.    We are actively looking for new moderators.  If you have any interest in helping to make this subreddit a place for quality discussion, please fill out [this form](https://docs.google.com/forms/d/1y2swHD0KXFhStGFjW6k54r9iuMjzcFqDIVwuvdLBjSA).    ***   *I am a bot, and this action was performed automatically. Please [contact the moderators of this subreddit](/message/compose/?to=/r/politics) if you have any questions or concerns.*",AutoModerator,2025-05-08T12:27:48,1
Making the world in his image and it's as disturbing as it sounds.  ,arilupe,2025-05-08T12:29:16,8
"Wasn’t there an Old Testament prophecy along these lines?    Also, I think I’ve seen that apartment in TheSims(tm).",Johnsense,2025-05-08T12:42:46,3
How fast do you think his name is going to come down off that bullshit once he suffers his first McDonalds-fueled stroke?,Tony2030,2025-05-08T12:44:17,2
It's a factory that makes money laundering,30mil,2025-05-09T06:34:31,2
"This submission source is likely to have a soft paywall. If this article is not behind a paywall please report **this comment** for “breaks r/politics rules -> custom -> ""incorrect flair"""". [More information can be found here](https://www.reddit.com/r/politics/wiki/index/#wiki_paywalls)  *I am a bot, and this action was performed automatically. Please [contact the moderators of this subreddit](/message/compose/?to=/r/politics) if you have any questions or concerns.*",AutoModerator,2025-05-08T12:27:49,1
That’s fine with me to be their problem,MariosBrother1,2025-05-08T12:40:09,1
It looks like the Dark Tower of Sauron. Just needs the eye on top.,Talentagentfriend,2025-05-08T12:56:33,1
I would not go near it.,Weird-Ad7562,2025-05-08T16:55:02,1
I’m for it if he moves there.,Constant-Notice849,2025-05-08T19:36:53,1
I fear it may be,Zealousideal-Mix2338,2025-05-08T13:39:36,1
