Comment,Author,Date,Score
" As a reminder, this subreddit [is for civil discussion.](/r/politics/wiki/index#wiki_be_civil)  In general, be courteous to others. Debate/discuss/argue the merits of ideas, don't attack people. Personal insults, shill or troll accusations, hate speech, any suggestion or support of harm, violence, or death, and other rule violations can result in a permanent ban.   If you see comments in violation of our rules, please report them.   For those who have questions regarding any media outlets being posted on this subreddit, please click [here](https://www.reddit.com/r/politics/wiki/approveddomainslist) to review our details as to our approved domains list and outlet criteria.    We are actively looking for new moderators.  If you have any interest in helping to make this subreddit a place for quality discussion, please fill out [this form](https://docs.google.com/forms/d/1y2swHD0KXFhStGFjW6k54r9iuMjzcFqDIVwuvdLBjSA).    ***   *I am a bot, and this action was performed automatically. Please [contact the moderators of this subreddit](/message/compose/?to=/r/politics) if you have any questions or concerns.*",AutoModerator,2025-04-25T21:44:58,1
"Actual footage of a U.S. president pushing Netanyahu on Gaza:  President: “Bibi, please let one (1) food truck go into Gaza, the people are starving.”  Bibi: “Lol no.”  President: “Okie dokie, here’s another shipment of bombs. It would really suck if you used this to blow up a cancer hospital, maybe don’t do that.”  Bibi: *blows up a cancer hospital*  Rinse and repeat.",get-the-marshmallows,2025-04-25T22:14:01,9
"Of all the atrocities committed by governments throughout history, the use of hunger as a weapon against a population is particularly cruel and never justified. I am sympathetic towards Israel for many reasons, but this policy is wrong and should be discouraged by sanctions.",Minguseyes,2025-04-26T00:15:51,3
Right.,ThistleroseTea,2025-04-25T21:46:15,4
Just add this to his pile of lies.,RamonaQ-JunieB,2025-04-25T22:22:09,2
"This submission source is likely to have a soft paywall. If this article is not behind a paywall please report **this comment** for “breaks r/politics rules -> custom -> ""incorrect flair"""". [More information can be found here](https://www.reddit.com/r/politics/wiki/index/#wiki_paywalls)  *I am a bot, and this action was performed automatically. Please [contact the moderators of this subreddit](/message/compose/?to=/r/politics) if you have any questions or concerns.*",AutoModerator,2025-04-25T21:44:58,1
He says a lot of things.,TSAOutreachTeam,2025-04-25T22:31:08,1
"> U.S. President Donald Trump said on Friday that he pushed Israeli Prime Minister Benjamin Netanyahu to allow food and medicine into the devastated Gaza Strip. > > No aid has been delivered to the Palestinian enclave since March 2. Israel has said it would not allow the entry of goods and supplies into Gaza until Palestinian militant group Hamas releases all remaining hostages. >  > Earlier on Friday, the U.N. World Food Programme said it had run out of food stocks in Gaza.",ishigoya,2025-04-25T21:45:12,0
As believable as he talked with Xi about a trade deal.,Elegant_Tech,2025-04-26T03:03:38,2
