Comment,Author,Date,Score
" As a reminder, this subreddit [is for civil discussion.](/r/politics/wiki/index#wiki_be_civil)  In general, be courteous to others. Debate/discuss/argue the merits of ideas, don't attack people. Personal insults, shill or troll accusations, hate speech, any suggestion or support of harm, violence, or death, and other rule violations can result in a permanent ban.   If you see comments in violation of our rules, please report them.   For those who have questions regarding any media outlets being posted on this subreddit, please click [here](https://www.reddit.com/r/politics/wiki/approveddomainslist) to review our details as to our approved domains list and outlet criteria.    We are actively looking for new moderators.  If you have any interest in helping to make this subreddit a place for quality discussion, please fill out [this form](https://docs.google.com/forms/d/1y2swHD0KXFhStGFjW6k54r9iuMjzcFqDIVwuvdLBjSA).    ***   *I am a bot, and this action was performed automatically. Please [contact the moderators of this subreddit](/message/compose/?to=/r/politics) if you have any questions or concerns.*",AutoModerator,2025-05-03T08:20:10,1
25th Amendment territory right here...,Everywhereslugs,2025-05-03T08:25:04,299
"""Hi, I'm Donald Trump. I'll be your Antichrist today.""",Tony2030,2025-05-03T09:07:24,87
If anyone was ever the Biblical Antichrist.,silvio_burlesqueconi,2025-05-03T09:05:36,42
Don’t worry “Christians”. He’s just trolling. You sold out all of your “principles.” Just accept it.  and accept that he is your infallible sky daddy now. Stay on your knees and wipe your mouth.,WithMaliceTowardFew,2025-05-03T08:23:29,141
"Wow, he's that kind of disrespectful. This should convince ""most"" Catholics into realizing he's not religious, just using it as a prop for attention.    ""Most"" is in quotes because they're going to mist these people again maybe.",Ok-Excuse1771,2025-05-03T08:40:07,18
Brains are mashed potatoes,Emotional_Signal7883,2025-05-03T08:36:38,13
This is the type of trolling we all just need to ignore. It's just a distraction.,slapasaurus-rex,2025-05-03T08:22:59,32
"This guy has absolutely no tact but plenty of ""tacky.""",TNStrong,2025-05-03T08:41:44,9
Delusion of grandeur.   Typical megalomaniac.,sandyWB,2025-05-03T09:02:17,8
"More of this please! I hope he keeps shaving off more slices of his base, in this case devout Catholics. ",Sharp_Blueberry_6547,2025-05-03T08:36:29,16
"MAGA will cry that he's just joking, but he's the president, not a jester. Though, he does love to make a fool of himself",7palles7,2025-05-03T10:10:06,7
Another Rodrigo Borgia,amartin141,2025-05-03T08:24:06,12
"he’s trolling, “the radical left”, but you can be sure, he’s also upsetting a notable portion of his supporters.",naonatu-,2025-05-03T08:39:20,5
He's such a moron.,Ace_Bearbus-73,2025-05-03T08:46:50,5
"Look! A distraction! Go, media, go!  Actual News:   Trump is suggesting Republicans in congress start expelling Democrats. While it takes two thirds to do so, there are democrats who are approving Trump nominees, I could pretty easily be convinced that those same idiots would vote to expel other Democrats.",Arkmer,2025-05-03T09:17:10,5
The official White House Instagram also posted this…,raabinhood,2025-05-03T12:19:32,5
Snl got their cold open,Riftreaper,2025-05-03T09:33:17,4
"This should piss off both Protestants and Catholics. And Americans.   Besides, just having US citizenship means that you can't hold any foreign titles, including 'Pope'. (Since the Pope is a foreign head of state)",aureanator,2025-05-03T09:44:43,4
Absolutely blasphemous... he's a fucking pig!,LumpyResolve2026,2025-05-03T14:39:04,3
"Haha. Come on, the guy was on a talk show with Barbara Walter's or someone when he was younger and said he did not believe in God. He was a democrat then republican. This guy goes whatever way the wind blows and will make him money and give him power. The end. It’s working for him because we are the idiots, not him. I say we generously because I didn’t vote for him.",anditurnedaround,2025-05-03T08:25:37,7
Look at the shiny wriggling hand.,bickering_fool,2025-05-03T08:30:00,3
"Distraction. Arresting judges, voting to deport American citizens and no movement on returning Abreo Garcia. Don’t fall for this bullshit.",snoutmoose,2025-05-03T09:46:26,3
"All jokes aside, and whether one believes in the Bible or not, Trump literally fulfills ALL of the Scripture pertaining to the 1st Beast, the Antichrist, mentioned and described in  Revelations 13, up to this point.  (Musk is the 2nd Beast, the False Prophet, confirmed by the number 666, which is synonymous with the richest person in the world [shocker!--it's otherwise just a number; it’s not something empowered or scary at all].)",IJustLookLikeThis13,2025-05-03T10:05:28,3
Here is a more accurate one:  https://www.reddit.com/r/AntiTrumpAlliance/s/ldiscewmEw,random48266,2025-05-03T10:08:11,3
"Seriously, how can Christian’s tolerate this?",twitch_delta_blues,2025-05-03T12:19:56,3
Imagine the amount of spray tan that would rub off onto the robes urrggh,Puncho666,2025-05-03T12:23:16,3
That sound you hear is the entire rest of the world laughing their asses off at us in the United States right now.,Independent-Roof-774,2025-05-03T08:49:48,5
Chinese manufactured red MAGA pope hats are about to become a thing.,biscuitarse,2025-05-03T08:42:13,2
This says it all: The United States is an unserious country with unserious leaders and an unserious electorate ,Additional-Software4,2025-05-03T09:12:45,2
"Catholics-""Meh. It's just Trump being Trump. That's just the way he is""",VirginiaLuthier,2025-05-03T09:15:32,2
Most disgusting President ever.,CurrentlyLucid,2025-05-03T09:20:21,2
The worlds biggest narcissist,itaintbirds,2025-05-03T09:22:03,2
We all know the next one will be him at the last supper and then he will declare himself as the second coming of Jesus.  His followers are waiting for it. ,Thirdnipple79,2025-05-03T09:22:40,2
He’s a sad old man who needs constant attention,zepol61,2025-05-03T09:30:18,2
This is a distraction from something more sinister.,ManateeGag,2025-05-03T09:33:44,2
I know this is HARDLY the most important part of all this but he isn't even catholic.,MinimumApricot365,2025-05-03T09:39:35,2
Pope Pompous the Dumb Fuck,commanderclif,2025-05-03T10:14:20,2
"Trump makes everything about himself, even the death of a pope.",capaho,2025-05-03T10:20:29,2
I can understand a clown being a clown. What I'll never understand is how millions of people think this 🤡is the right person for the position of POTUS.,ninjplus,2025-05-03T10:24:09,2
Donald Trump is a deranged old man.,New_Faithlessness384,2025-05-03T10:42:30,2
"If this doesn't convince you that all this religious grandstanding is utter nonsense. If this is what 'God' wants, I want nothing to do with your god.",Cha0s4201,2025-05-03T11:08:13,2
"I get bored by the ""What if Obama did this?"" argument because it is so easy, but in this case I just can't help it. Can you imagine the hysterics we would see from Fox News?",FourthSpongeball,2025-05-03T11:15:45,2
Unfit. How long can this go on,Zealousideal_Speed30,2025-05-03T11:27:34,2
"If it’ll get it him to step down from his current job…fuck it, let’s make him the Pope.  Let him lead masses and make a bunch of holy declarations. Let him dress like Papa Emeritus and have bishops kiss his rings. Let him live in a tiny country that won’t destroy the global economy on a matter of days.   What? You think he’s going his going to be worst pope ever? Ever??? You think this’ll tarnish the sterling reputation of the Catholic Church???  Heresy, smeresy, you know this the best option we have and the best we’ll ever get in the next four years.   Fuck it…Pope Donald I",rmarkmatthews,2025-05-03T11:32:56,2
More accurate version   https://www.instagram.com/p/DJJtWF9pcqU/?igsh=MW9nODVha3hpdmZiZg==,RudeAlarm,2025-05-03T11:37:00,2
Bahaha what a narcissistic loser.,Fantastic_Calamity,2025-05-03T11:45:54,2
Only a narcissistic cheeto eater would do this,Wooden-Net-9883,2025-05-03T11:57:01,2
This is a distraction. What else did he do that day that he's trying to get us not to notice?,Amenian,2025-05-03T11:57:40,2
"I mean it's not because we think he's going to make himself popw It's because it's disrespectful and to Catholics, and I'm okay if they think it's a joke but I told them all my life, the Protestants don't want you and will jettison you the *second* they don't need you to fight abortion for them. Pleased to see that's where we're at.",thischaosiskillingme,2025-05-03T12:09:02,2
He was having is clown hat cleaned.,AcanthisittaNo6653,2025-05-03T12:14:01,2
He does love all the raping,Moist-Cow-6506,2025-05-03T12:22:21,2
"Genuine question. Which sect of christians are supporting him? Is it all of them, or the snake tongues ones? I watched a show breaking down the origins of all christian sects and Im genuinely interested.",katiescasey,2025-05-03T13:08:59,2
Blasphemous asshole… can’t get rid of him soon enough..🤡🤡🖕🤡🖕🤡,fitforlife1958,2025-05-03T14:19:40,2
Blaspheme much?,stinky-weaselteets,2025-05-03T14:20:56,2
Interesting how this hasn’t made the round on the conservative sub yet. I wonder why….,TheOhrenberger,2025-05-03T14:35:52,2
This is just so stupid. How can anyone be impressed with this guy?,Dear_Divide7083,2025-05-03T14:39:39,2
A godless man making a mockery out of the church is a pretty fitting description,Space_Sweetness,2025-05-03T14:42:27,2
Blasphemer,workhard_livesimply,2025-05-03T14:44:06,2
"Look, everybody! The antichrist!",Timeformayo,2025-05-03T15:03:49,2
"Let him resign to be pope. He would do less damage to the world. If all the cardinals truly cared about the world, they should nominate him to be pope, but he has to resign as president of the United States.",xLaoztuYT,2025-05-03T15:27:22,2
"Honestly, at this point, why shouldn’t he be the pope too? Fuck it. Also make him king of England and Emperor of the Moon. None of it matters anymore anyway.",consumeshroomz,2025-05-03T15:38:17,2
Imagine going to a guys funeral and then dressing up as him a week later.,Comprehensive-Ad4815,2025-05-03T16:02:30,2
We are literally the biggest laughing stock in history,Fast-Audience-6828,2025-05-03T16:17:54,2
He is classless and clueless.,Marciamallowfluff,2025-05-03T19:47:26,2
I’m an atheist but you clowns elevated this piece of garbage and now you’re shocked that he’s acting like this?,Adventurous_Day_6159,2025-05-03T19:55:48,2
"Trump as the pope kinda makes sence since the catholic church facilitates pedophiles, is anti gay wedding and women can't be priests.   Kinda lines up with Trump's association with Epstein, walking in on children's beauty pageant contestants in the dressing room, his crusade on LGBT and his policy of firing women for being ""DEI hires"".",bosgeest,2025-05-03T09:11:07,4
Let’s see if we can make it to 5 popes in our lifetime,sofia1687,2025-05-03T09:11:51,1
"If it doesn’t involve golf, posts or photoshop, trump is not gonna be your savior",Fit-Significance-436,2025-05-03T09:12:24,1
Somebody call Tobias Forge. This new Ghost pope business is getting out of hand... /s,SolemnestSimulacrum,2025-05-03T09:26:09,1
"I am done!  Those who continue to promote, protect this idiot can go to hell.  Those that look the other way, fuck off and those not fighting, your just digging your own graves.  He has to go before he creates any more issues.  Imagine how Muslims view Americans now?  They must see a nation that only protects Christian briefs now promoting this  Catholic nonsense.",duzkiss,2025-05-03T09:26:47,1
"His tribal, lizard brained republican base won’t give a damn.",RipErRiley,2025-05-03T09:29:00,1
Would have been more convincing dressed as Lucifer.,damnthistrafficjam,2025-05-03T09:38:00,1
I keep expecting him to demand an American pope.,JFeth,2025-05-03T09:38:43,1
Absolute Madlad,stevenmoreso,2025-05-03T10:05:31,1
R/Catholic seems to not care,zubuneri,2025-05-03T10:17:07,1
The church would never let a rapist work there,RevolutionaryGuide85,2025-05-03T10:32:20,1
"If we ever had a time for god to smite someone, that would be now",Tiny-Professional827,2025-05-03T10:39:04,1
He likes the hat.,duckstrap,2025-05-03T10:39:36,1
Just send Trumpty Dumpty on a one way trip to Mars and make him emperor of Mars. Its a win-win-win all around,NerdyWildman,2025-05-03T10:41:20,1
"I love how every time he does something like this, similar to the hat that suggested a third term, they eat it up as trolling and talk about how mad it’ll make the libs. They love it *specifically* because it makes people angry, I just don’t get it. The president of the United States should not be spending his time trying to make people scared and angry on purpose for entertainment.   I guess my question is why do they love it so much? Is it sadism? Why do they get off watching people that they hate freak out and get mad? Why do people love the idea of someone holding office trolling so much when he himself has made it clear that it’s not trolling? For example he has said over and over that running again is not a joke, and they think him saying that is part of the joke.   They’re okay with Musk throwing a Nazi salute during the inauguration because of the reaction it provoked. They’re okay with the President calling himself a king, a pope, a dictator, because of the reaction. Someone is probably reading my frustrated comment right now and loving it because he got a reaction from me lol.",HeadfulOfSugar,2025-05-03T10:42:17,1
I like to check the republican and conservative subreddit when crazy stuff like this happens to see what they have to say and of course there are ZERO posts about it over there. They just pretend the crazy doesn’t exist.,AnotherThrowAway1320,2025-05-03T10:46:02,1
"First those NFT images, now the pope.  This guy does like his imaginary cosplay. It’s like he’s some pre-teen girl or something.",OddNothic,2025-05-03T10:51:53,1
Makes sense if you look at the Epstein flight logs.,DaySoc98jr,2025-05-03T10:56:46,1
its quite fitting because he really is The Poope,tensei-coffee,2025-05-03T11:13:06,1
If he put a Pope hat on it would burst into flames.,Rot-Orkan,2025-05-03T11:18:56,1
Does becoming a pope him leave USA?,Affectionate_Cook455,2025-05-03T11:25:21,1
trump can't read. also trump know how to use  ai and he posts to social media all the time.    guys: he isn't the person posting. he doesn't even know what's going on.   find the person who does and name and shame them,Tumbleweeddownthere,2025-05-03T11:56:56,1
just embarrassing and disrespectful. As others said yet another attempt to distract us from the reality of the deportations.,Crochetcreature,2025-05-03T11:58:41,1
"""Critics""",johnnybones23,2025-05-03T12:00:51,1
"If this would mean stepping down as POTUS and leaving the country, I'm willing to consider supporting it.",Multiple__Butts,2025-05-03T12:02:09,1
"I know it won't happen, but I think we need to focus more on what he actually does rather than what he says (which I admit, is bad enough most of the time). I honestly think that if he feels like he's not in the news enough, he just blurts out some nonsense like 'We should start making cars out of chocolate', and that dominates the news for a day or so until he says some other crazy nonsense.",elder242,2025-05-03T12:03:25,1
The next Dope!,ValentinaLove-,2025-05-03T12:18:19,1
"A decade ago this would have been the absolute end for anyone seeking the american christian vote, since evangelical christians have (or had) a fucking weird and warped view of catholicism as ""not christian"" and had an irrational hatred for it because they remember some hallucinatory version of sunday school lessons about the reformation. I've heard plenty of evangelical wackos call catholicism satanic.  But now they don't even pretend to have religious convictions of *any* kind, even the weird and ignorant ones. They don't give a shit about catholicism vs. protestantism. Religion is just a byword for their fascistic tribalism. They go to church to hear these nutjob evangelical churches literally give sermons about Trump. All they know now is that Pope = power and the want their ingroup to have power.   They idolize Trump and the ability to be cruel to people they hate. It is a movement of utterly intellectually and morally bankrupt fascistic narcissism and nothing more.",HerbaciousTea,2025-05-03T12:18:39,1
But did critics erupt when he sued the literal Chief Justice for power over the courts just this week?   Nah.,Mefromafar,2025-05-03T12:27:46,1
He’s not a serious person. He’s not a fit person for the office he holds. He’s a disgrace,Shawn_The_Sheep777,2025-05-03T12:31:11,1
Its  trump giving a  gentle reminder to the catholic scotus where there fealty lies . Mar a lago not rome.,becontrary,2025-05-03T12:31:24,1
this is completely sacrilegious! this man should be condemned. this is completely disrespectful on all accounts!,ResidentOwl3140,2025-05-03T12:33:43,1
"So the country that has no Kings, welcomes Pontifrex Trump.  Wild.",imamistake420,2025-05-03T12:37:51,1
"Given trumps experience with covering up SA and CSA, dare I say he is more qualified to lead the Catholic Church than he is the United States?",beadzy,2025-05-03T12:37:52,1
"People still fall for it. Nobody watches how he dismantles our country in plain sight while everybody is enraged about his stupid infantile stunts. Whoever he is working for, they could not have chosen a better front man for their cause.",BrilliantPositive184,2025-05-03T12:38:01,1
Americans are living in Trump’s psychotic world.,Smrleda,2025-05-03T12:38:24,1
His brain is mush - why are republicans covering for him,Altruistic_Mix_290,2025-05-03T12:38:27,1
Slug Virus is not even Catholic. ,Forsaken_Hermit,2025-05-03T12:42:25,1
A world wide embarrassment.,vikkids,2025-05-03T12:44:41,1
"It's a distraction, y'all",carrjo04,2025-05-03T12:48:55,1
Full tilt idolotry.,Logictrauma,2025-05-03T12:57:28,1
MAGA will sane wash this and put on it some else  besides Trump. Everything is a conspiracy to to them  EVEN when we see all of Trumps Unhinged and interviews from Terry Moran to Laura Ingraham,Ok_Sound9973,2025-05-03T13:06:47,1
Ignore this. It's a distraction from the EOs he's been signing and the other illegal actions he's been taking. It's absurdist garbage meant to get clicks and all you fucking addicts keep giving oxygen to the distraction. Stop it.,severedbrain,2025-05-03T13:13:59,1
Trying to distract from his failing administration,KeyInvestigator3741,2025-05-03T13:17:33,1
Trump 💩is Mentally Unstable,njman100,2025-05-03T13:28:22,1
Imagine if Henry the VIII did this!,Lothleen,2025-05-03T13:30:02,1
How long until he posts a photo of himself as the head of Berkshire Hathaway?,ShaveTheTurtles,2025-05-03T13:33:50,1
Fake president now wants to be fake pope.  At least wait for Halloween dude.,johnnybsomething,2025-05-03T13:33:54,1
Illegal in Texas?,Smedley_Beamish,2025-05-03T13:36:40,1
"He doesn't know a damned thing about the Bible.  When challenged to quote from it, he says he won't because it's deeply personal. So deeply personal that he doesn't attend church on Easter or Christmas and didn't put his hand on the Bible when being sworn in.",dramabatch,2025-05-03T13:43:07,1
satire at this point,neuroticfisherman,2025-05-03T13:51:53,1
So he got the attention he wanted then,SurroundTiny,2025-05-03T13:56:30,1
Cant wait for all the Midwest catholics to realize they arent part of the ‘in’ group religion in the eyes of evangelicals.  Minds will be blown,b_tight,2025-05-03T14:02:52,1
"On a platform full of cats and dogs, a fake pope is not something very special",antilopegedoe,2025-05-03T14:28:15,1
That is so sacreligious.,Rissie15,2025-05-03T15:13:58,1
"I think he got the religion wrong, he looks much more like a Buddha …",nznordi,2025-05-03T15:14:44,1
The problem is everyone treats everything he does so seriously - and then this stuff is just normalised. Dude says he’s a religious nut - the media takes it at face value. But when he posts this it’s a goof - those 2 statements are antithetical - yet the media just accepts,Slight-Obligation390,2025-05-03T15:19:40,1
Don't fall for his obvious attempt to distract from the Trumpcession.... ,StrangerFew2424,2025-05-03T16:11:51,1
Not even 10 Scaramuccis and he thinks he's Pope.,LunaticPoint,2025-05-03T16:19:31,1
I'd love it if he gets excommunicated for this. ,Zkenny13,2025-05-03T16:24:19,1
Pull my finger.. and I'll trump...,Kilmouski,2025-05-03T16:26:52,1
"I'm not even a Catholic, but ""May he burn in hell"".",We_Print,2025-05-03T17:14:56,1
"He’s mental, and unfit. Rights to weak to admit it, and his MAGATS you can’t even reason with.",Fishfindr,2025-05-03T17:16:24,1
He is disgusting as are the fascist Catholics who still support his demonic ass.,Ok_Departure_7191,2025-05-03T18:04:50,1
Devils horns and pitch fork is more like it,Certain_Moose_2284,2025-05-03T18:17:00,1
About 20% of Americans are Catholics and about 90% of them voted for Trump. If he pissed that group off he would be in trouble.,Johnhaven,2025-05-03T18:31:49,1
"I'm not Christian, but isn't that sacreligious?  Isn't Trump supposed to be a Christian?  That's like mocking his own religion.",loriwilley,2025-05-03T19:19:11,1
I want to see his Village People collection.  Kind of.,soothinganomalies,2025-05-03T19:22:51,1
I'm not Catholic but I'm disgusted by this.,geargramps,2025-05-03T20:40:52,1
Pope Guilty the Diddler,RoyH0bbs,2025-05-03T21:45:47,1
That’s maga at its best,heywanna,2025-05-03T21:54:18,1
Big deal. We don’t even need a pope,sorrysaks,2025-05-03T22:16:28,1
This is the distraction. Look at the other things in the news that now won’t get talked about.,zetlali,2025-05-03T23:38:40,1
I support that because it would get him out of our hair.,ImaginationLiving320,2025-05-03T23:42:27,1
Instead of „critics erupt“ it should say „idiots fall for the bait yet again“,bl8ant,2025-05-04T03:44:55,1
This guy is embarrassing on a global scale.   My heart goes out to the Americans who are being represented by this utter bellend. The rest of the world cringes as your country self implodes.,I-live-in-room-101,2025-05-04T04:00:41,1
"I frequently ask myself, do Trump and Vance are aware how dumb they are?",Szczeciner,2025-05-04T04:31:17,1
"He only does this because you people lose your minds every time he posts something.  He is taunting you and winning, just ignore him, you are not equipped to fight it.",organic_nanner,2025-05-04T06:49:51,1
The Nope,AdventureThink,2025-05-04T08:00:17,1
"you sick asshole, God damn you!",Old-Discipline-7489,2025-05-04T08:57:40,1
Standing next to him Cesare Borgia could be favorably compared to St. Francis of Assisi,ComprehensiveFoot649,2025-05-05T03:11:20,1
he’s a rapist and sexually abused teenagers so this fits,Catcaves821,2025-05-03T10:15:15,1
I thought this was a joke. Fucker got me.,LouDog0187,2025-05-03T08:46:39,1
"Critics “erupt” and the cult is just laughing  Edit; To anyone thinking Im defending this moron, you completely misunderstood my comment. Read my post history. My point was that every time this fuckstick does something idiotic, “the critics erupt”. And nothing happens until he does it again and “the critics erupt”.  And his cult eats it up and laughs it off.",ricks_flare,2025-05-03T08:55:20,1
It’s a clear troll- please don’t take up news time or brain power on this,Becker_the_pecker,2025-05-03T09:52:57,1
It’s a clear troll- please don’t take up news time or brain power on this,Becker_the_pecker,2025-05-03T09:53:05,1
Trump is trolling. He's obviously not a Christian.,CheesecakeHorror3410,2025-05-03T10:51:26,1
At least this Pope doesn't touch kids 😂💀,GiraffeOk1679,2025-05-03T13:37:00,1
Not news. Unless it’s part of a story examining the orange wad’s worsening narcissism and the danger to our nation.,unchosen_few,2025-05-03T14:33:45,1
Ragebait. He’s just trying to “own the libs” as usual.,Hikari_No_Willpower,2025-05-03T10:19:00,-2
"How moronic you gotta be to not realize he's distracting you all. While you are raging, kicking and screaming they are working on pushing their conservative policies.",Jujubatron,2025-05-03T11:36:07,-1
Ok. Hear me out: Pope Dolan would be amazing.,EmperorDPants,2025-05-03T13:13:25,-1
"[The Young Turks](https://youtu.be/alrbsFZRRT0?si=C-j-xbOFQELsW7ZJ) commented on the reporting that Fetterman is out of his mind after his stroke. I wonder if the Donald is having [strokes](https://www.theguardian.com/us-news/2020/sep/01/pence-standby-take-presidential-powers-trump-hospital-visit) which are destroying his brain. It would explain a lot of his behavior. But, yeah, we need an impartial medical evaluation and probably the 25th to get him out and into elder care.",merikariu,2025-05-03T11:25:46,58
Antichrist territory right here,Choppergold,2025-05-03T10:39:04,12
Most likely it was a nasty little alt-right social media guy that did this. I doubt that Trump knows how to generate AI pics.,PatchyWhiskers,2025-05-03T08:50:21,44
That paired with the knuckles argument gets us there easily.,here-for-information,2025-05-03T10:42:00,5
"He is in his 70s and has yet to, and likely will not ever, adhere to Constitutional Amendments sir.",AssociationWinter809,2025-05-03T09:32:34,10
Trump is Pope Fullofshiticus 💩,timnphilly,2025-05-03T13:24:20,3
"Antipope, no need to inflate his ego. Also Antipopes actually existed.",wswordsmen,2025-05-03T11:12:34,10
It would be Trump - Pope Fullofshiticus 💩,timnphilly,2025-05-03T13:28:13,5
