Comment,Author,Date,Score
" As a reminder, this subreddit [is for civil discussion.](/r/politics/wiki/index#wiki_be_civil)  In general, be courteous to others. Debate/discuss/argue the merits of ideas, don't attack people. Personal insults, shill or troll accusations, hate speech, any suggestion or support of harm, violence, or death, and other rule violations can result in a permanent ban.   If you see comments in violation of our rules, please report them.   For those who have questions regarding any media outlets being posted on this subreddit, please click [here](https://www.reddit.com/r/politics/wiki/approveddomainslist) to review our details as to our approved domains list and outlet criteria.    We are actively looking for new moderators.  If you have any interest in helping to make this subreddit a place for quality discussion, please fill out [this form](https://docs.google.com/forms/d/1y2swHD0KXFhStGFjW6k54r9iuMjzcFqDIVwuvdLBjSA).    ***   *I am a bot, and this action was performed automatically. Please [contact the moderators of this subreddit](/message/compose/?to=/r/politics) if you have any questions or concerns.*",AutoModerator,2025-05-05T19:50:39,1
"Despite the clickbait title, this has nothing to do with defending Biden's policies or access to abortion pills.  >The administration’s stances in both cases surprised many by backing policies favored by Democrats, **but at their core they are about preserving executive power and preventing courts from second-guessing agency decisions.**  >**The government’s stance in this case that the states lack standing** also comes as the administration is fending off challenges from California and other Democratic-led states, and could set a beneficial precedent in those lawsuits.",BukkitCrab,2025-05-05T20:12:56,20
"This is not uplifting news and is about retrenching executive power, not venue shopping or something else",cjwidd,2025-05-05T21:24:01,2
"This submission source is likely to have a soft paywall. If this article is not behind a paywall please report **this comment** for “breaks r/politics rules -> custom -> ""incorrect flair"""". [More information can be found here](https://www.reddit.com/r/politics/wiki/index/#wiki_paywalls)  *I am a bot, and this action was performed automatically. Please [contact the moderators of this subreddit](/message/compose/?to=/r/politics) if you have any questions or concerns.*",AutoModerator,2025-05-05T19:50:42,1
Thought so. I wouldn't trust trump to protect a woman right,WordOfLies,2025-05-05T20:16:16,9
