Comment,Author,Date,Score
" As a reminder, this subreddit [is for civil discussion.](/r/politics/wiki/index#wiki_be_civil)  In general, be courteous to others. Debate/discuss/argue the merits of ideas, don't attack people. Personal insults, shill or troll accusations, hate speech, any suggestion or support of harm, violence, or death, and other rule violations can result in a permanent ban.   If you see comments in violation of our rules, please report them.   For those who have questions regarding any media outlets being posted on this subreddit, please click [here](https://www.reddit.com/r/politics/wiki/approveddomainslist) to review our details as to our approved domains list and outlet criteria.    We are actively looking for new moderators.  If you have any interest in helping to make this subreddit a place for quality discussion, please fill out [this form](https://docs.google.com/forms/d/1y2swHD0KXFhStGFjW6k54r9iuMjzcFqDIVwuvdLBjSA).    ***   *I am a bot, and this action was performed automatically. Please [contact the moderators of this subreddit](/message/compose/?to=/r/politics) if you have any questions or concerns.*",AutoModerator,2025-04-23T09:47:47,1
"You know what would boost birthrate? Government subsidized childcare and universal healthcare.  Kids cost a shitton more than $5,000.",supes1,2025-04-23T09:48:40,49
"Well, that’s 2 months of baby daycare in most East Coast cities.  If he suggested $200,000, then it might work.",GrandFrogPrince,2025-04-23T09:49:33,11
Handouts?,Crusty_Musty_Fudge,2025-04-23T09:50:13,10
"$5k isn’t enough to justify having a kid. That doesn’t cover even a fraction of the pregnancy expenses, let alone the costs afterwards.",Ancient_Popcorn,2025-04-23T09:51:41,10
"[Kamala was going to give new parents a $6000 tax credit](https://www.cbsnews.com/news/kamala-harris-child-tax-credit-6000-dnc-what-to-know/), but conservatives hated her anyways",veggeble,2025-04-23T09:54:13,9
"Reeks of desperation, floating the $5K checks again.  Never going to happen.",BluWake,2025-04-23T09:50:25,9
Woo!  Almost covers ten percent what a hospital charges for a delivery with no complications! This will SURELY offset the dumpster fire of this nation!,feanornoldor666,2025-04-23T09:52:28,6
"Let's see, $5,000 towards the $300,000+ required to raise a child.  Hmm.  That should just about get you home from the hospital.",CockBrother,2025-04-23T09:54:33,5
"That won’t last longer than 3 months, much less 18 years.",BigDaddyBain,2025-04-23T09:51:27,5
$5000 when the tariffs hit baby products won't even compensate for the price increase nevermind actually boost anything.,FlyingRock,2025-04-23T09:55:45,5
"Hey we need a new refrigerator, let’s have another baby!",Choice_Cup_3624,2025-04-23T10:28:40,4
Oh so the child tax credit but worse? Got it,jimmydean885,2025-04-23T11:58:57,5
Guess who this plays well with? Advocates of ethnic cleansing.,schu4KSU,2025-04-23T09:50:55,3
"I mean, it's one child, Michael. What could it cost? 5,000 dollars?",orrocos,2025-04-23T10:18:38,3
"I mean, we could also tax billionaires and give everyone education, healthcare, and social services.",WhiskeredAristocat,2025-04-23T10:28:08,3
"American Lebensborn. The SS started the Lebensborn program 90 years ago, so why not here? So join today!\*  \*Racial conditions apply, contact your local ICE office for details. You may qualify for more money if you speak to Elon Musk for the wombs-for-rent-then-forced-silence programme.",steve_ample,2025-04-23T09:55:35,2
"I'll take Things That Will Never Happen for 2000, Alex.",Kattz,2025-04-23T10:07:57,2
"$5000 will pay for what, 5 months of childcare if you’re in a moderate COL area? Only like $70,000 short of what it costs for childcare until the child gets to school age. And that’s if you’re already in a relatively affordable cost of living area. I’d fall even shorter in pricier areas. Another half baked idea that no one thought through for even one minute.",RustToRedemption,2025-04-23T10:20:00,2
"Why do we need a higher birth rate in the first place? If we need to sustain our population, just let in more immigrants legally.   Oh sorry, I forgot, we don't want _those kind_ of people. Right. 🙄",climactivated,2025-04-23T10:38:27,2
Only with the correct Trump state sanctioned genes.,snowlion000,2025-04-23T09:51:29,1
Tell him to use his own money for that.,Other-Net-3262,2025-04-23T09:52:47,1
"The cost of having a baby without medical insurance is around $13k.  And most of those for whom $5000 will be needed in order to have a child are likely on medicaid.  Assuming they cut medicaid as they plan to do, and still provide $5000, that amounts to a $8k expense rather than a $5k windfall.",Bubbly-Two-3449,2025-04-23T10:00:05,1
"Hilarious they think this will do anything.  Sad thing is there are probably some pretty dim people out there who think this would be somehow a good deal.   Only thing it would do is give people already planning to have a baby a little cushion for the high price of having a baby in a hospital. Like 30k without insurance, or something like that.",Powerful_Artist,2025-04-23T10:02:14,1
How much could a baby cost America 5k dollars? ,postmfb,2025-04-23T10:07:11,1
"Well,  I liked this idea when Kamala proposed it,  so I also like it now.     Is that so hard? ",Late-Dingo-8567,2025-04-23T10:08:30,1
"But I thought women who had babies for bonuses were called ""welfare queens"" by the Republicans...",JFJinCO,2025-04-23T10:14:16,1
well they're trying it in Korea,MichaelPFrancesa,2025-04-23T10:21:39,1
"Isn't the average hospital cost of having a baby something like $10k? $3k for people with insurance?   $5,000 doesn't even cover THAT, let alone lost wages from work or the costs of raising a small person from infancy to adulthood. *Maybe* $5k/year from birth until the kid enters kindergarten.",Dogdiscsanddyes,2025-04-23T10:32:34,1
"It's a baby, Michael. What could it cost? $5000?",beatnik_squaresville,2025-04-23T10:55:39,1
"I read,Trump administration,could,give $5,000,and then I stopped reading.They're not asking the tough questions.But in what,conditions,to receive $5000 from TRUMP'S administration?",LycheePrevious7777,2025-04-23T15:24:34,1
"Stuff like this isn't nothing, but it isn't much.  One of the thing that really annoys me is that people claim we can't boost birth rates in the west with incentives. The fact is we haven't tried. Instead we claim things like a paltry payment like this or ticky tack crap like tax credits are incentives.  Child birth is dangerous. Child rearing is time consuming and costly. Having children is expensive in every way. Every ""incentive"" proposed and implemented in the west tries to make it less dangerous, less expensive, less time consuming, but it is still an overall negative to your health and economic well being to have children.  You know what I would like to see? Pay people a living wage to stay home and raise kids. Mom or dad or aunt or grandparent; I don't care. Give families $50k for their first and second kid. Make it a real job and career people can aspire to. I know plenty of people who, if they could be paid $100k to stay home to raise their two kids would take it in a heart beat.  And I say this as a person who will never have children. I would gladly pay more in tax to make parenting the real job that it is, because having and raising kids is probably the most important job for our society and like many of those types of jobs we simply expect people to do it out of the kindness of their hearts.",awildstoryteller,2025-04-23T09:57:22,1
Are people dumb enough to believe this? Oh never mind.,TheVoiceofReason6,2025-04-23T10:25:28,1
Especially because if you just give people 5K for kids but you don't put any kind of price restrictions on there then every health care provider is just going to increase the cost of a pregnancy by 5k.,Deinosoar,2025-04-23T09:50:03,15
"Best we can do is?  https://germanhistorydocs.org/en/nazi-germany-1933-1945/the-cross-of-honor-for-the-german-mother-three-tiered-medal-for-mothers-with-four-or-more-children-1938#:~:text=One%20manifestation%20of%20the%20Nazi%20“cult%20of%20the,name%20to%20mothers%20with%20four%20or%20more%20children.  Might want to call him “Shicklegruber” instead, as you know how the conservative mentality tries to deflect away from any comparisons, so let’s not make it too obvious?",oliversurpless,2025-04-23T09:54:11,4
"[37.5 million children](https://www.medicaid.gov/medicaid/program-information/medicaid-and-chip-enrollment-data/report-highlights) rely on Medicaid. Basically half of American children.  $5k covers like 1.5 years of health insurance, tops.",gradientz,2025-04-23T10:02:54,4
In my state the average cost for a hospital birth is $17k.,sugarlessdeathbear,2025-04-23T10:28:31,2
5k won't cover the delivery,deschain_19195,2025-04-23T10:11:39,1
Countries have tried policies like this for centuries going as far back as Ancient Rome. You can’t pay peoples to have kids. You have to make people’s lives more conducive to having kids.,fantasstic_bet,2025-04-23T11:29:08,1
Why can’t they take care of their own instead of relying on others?,Norbe_e,2025-04-23T15:08:25,0
America can't give $200k to increase birth rates because that's how much they're trying to give their friends in tax cuts.,MittenCollyBulbasaur,2025-04-23T12:30:08,2
No you see this ISNT socialism.,MariosBrother1,2025-04-23T09:57:15,8
My first thought too. Such hypocrites.,forceblast,2025-04-23T10:15:09,7
It is when the goal is to trick the poor and uneducated into a trap keeping them that way and not helping families,Dr4gonfly,2025-04-23T10:25:43,3
"They literally made up reasons to hate her.   I'm done with conservativism, tbh. I used to respect them. Nowadays, that's gone.",Crusty_Musty_Fudge,2025-04-23T10:20:59,5
"What if we take the program Democrats didn't do enough of but cut that program in half, modern conservatives in a nutshell",MittenCollyBulbasaur,2025-04-23T12:31:19,3
More like 2-3 months for an infant.,Ready_Nature,2025-04-23T10:33:53,1
It’s not going to be enough to convince anyone who wasn’t already planning on having a baby to have one. My wife and I were already thinking of having another so this could maybe get us to move that timeline up a year or so but I’m also not convinced Trump would stick with this plan long enough to get through the pregnancy and get the money.,Ready_Nature,2025-04-23T10:33:07,1
"There's another thing that should be fixed. You want people to have more children? Healthcare should be included for the taxes we pay. It should be that simple. You exist, you get healthcare. Anything less, that person does not want higher births.",MittenCollyBulbasaur,2025-04-23T12:26:33,3
Before the pandemic 1 in 6 children were food insecure. I can't imagine we're doing any better.,MittenCollyBulbasaur,2025-04-23T12:29:20,2
Insurance will,Norbe_e,2025-04-23T15:08:48,-1
"The administration's stated goal here is to boost birthrates. Saying ""pay for everything yourself"" isn't going to accomplish jack shit towards that goal.",supes1,2025-04-23T15:32:14,1
"Yea I'd call my rep to vote against this.   Since they wanna cut education and not care about MY kid, they can fund their own children.",Crusty_Musty_Fudge,2025-04-23T10:19:13,3
Depends on your insurance,deschain_19195,2025-04-23T17:44:06,1
