Comment,Author,Date,Score
" As a reminder, this subreddit [is for civil discussion.](/r/politics/wiki/index#wiki_be_civil)  In general, be courteous to others. Debate/discuss/argue the merits of ideas, don't attack people. Personal insults, shill or troll accusations, hate speech, any suggestion or support of harm, violence, or death, and other rule violations can result in a permanent ban.   If you see comments in violation of our rules, please report them.   For those who have questions regarding any media outlets being posted on this subreddit, please click [here](https://www.reddit.com/r/politics/wiki/approveddomainslist) to review our details as to our approved domains list and outlet criteria.    We are actively looking for new moderators.  If you have any interest in helping to make this subreddit a place for quality discussion, please fill out [this form](https://docs.google.com/forms/d/1y2swHD0KXFhStGFjW6k54r9iuMjzcFqDIVwuvdLBjSA).    ***   *I am a bot, and this action was performed automatically. Please [contact the moderators of this subreddit](/message/compose/?to=/r/politics) if you have any questions or concerns.*",AutoModerator,2025-04-29T08:45:37,1
[deleted],[deleted],2025-04-29T08:49:48,83
"This is why I don't own guns, because I'd read this article and just go shoot myself in the face",Kop_f_u,2025-04-29T08:52:23,24
"I clicked the article hoping there was some reason, any reason, but it turned out it really was a new moon so she couldn't see it in the night sky. ",PapasitoPenguin,2025-04-29T08:47:38,14
How do you spend 7 days not knowing the moon still exists? It's not like you can miss it when you just step outside and open your eyes?,Valyx_3,2025-04-29T08:48:50,9
"""They sometimes say stupid things, but on politics? They've got it all right!""   \- Trump Cabinet Supporter.  ""Well maybe the moon *did* disappear!""   \- A reply from another Trump Cabinet Supporter.",CitySeekerTron,2025-04-29T09:07:02,8
"“Fucking moon! How does it work?! It gets bigger, it gets smaller. Can’t explain that!”  Christ, dude. How do you get past grade school not knowing about the phases of the moon? It’s astounding that people this fucking stupid can even survive, let alone thrive, in the modern world.",Cobra-Lalalalalalala,2025-04-29T09:37:28,7
"Yesterday, the White House held its first briefing for non-traditional media outlets, access for those who consume their news from social media.   One of the people invited, Kambree Nelson, spent an entire week just last year convinced someone had removed the moon from space.",dailydot,2025-04-29T08:46:11,7
"That's no moon, it's a space station.",SharpNSlick,2025-04-29T09:09:37,12
Where do you even go to look for level of stupid?,Beantown-Jack,2025-04-29T09:07:50,5
"The WH tests for loyalty, not IQ.",IJustLookLikeThis13,2025-04-29T11:07:24,4
It's just a matter of time before he's telling us the earth is actually flat!,Phronias,2025-04-29T09:50:39,3
"Obviously, Gru stole it. There was even a documentary about it.",Traditional-Win-3368,2025-04-29T11:25:30,3
These people are in the stupidest evil cult of all time.,DiceMadeOfCheese,2025-04-29T11:55:57,3
Maybe the moon is made of spare ribs and someone ate it?,ZombieCantStop,2025-04-29T12:16:31,3
Only the BEST people trumplina,PatientTechnician765,2025-04-29T09:36:54,1
A guy called the police because he thought a UFO was following. It was the Moon. Orange should hire that guy for something.,ImaginationToForm2,2025-04-29T15:10:32,1
She doesn’t know about the moon cycle/phases then… that’s promising. 😐,ghastlypxl,2025-04-29T16:12:35,1
"“Oh, somebody who was wearing some kind of Ching Chong shirt said that some guy named, Piccolo, blew it up. See? The Jewish space lasers ARE real!”",DoomFan86,2025-04-29T20:18:31,1
"Is it just me, or does America have way more full-on tinfoil hat wearing crackpots than anywhere else?",Troubled202,2025-04-29T21:50:04,1
You CANNOT make this stuff up…,random48266,2025-04-29T22:50:46,1
[ Removed by Reddit ],PlayTheWarBanjos,2025-04-30T06:46:31,1
"This is so confusing. A Trumpster   I personally know was telling us recently that we have been having a lot more full moons lately than we used to.  I would question the science education of these folk, but I don't want to raise the profile  of another group of books that can then get banned.",Revolutionary_Air_40,2025-04-29T09:28:43,11
"The contempt and hate I feel for those third  party voters, republican voters, and people who just decided not to vote is off the charts.",finitefuck,2025-04-29T08:57:45,30
"Hey now. There were many things people didn't know in the ages before modern science, but they certainly knew the cycles of the moon. This is a uniquely -modern- kind of nuttery.",ijkcomputer,2025-04-29T12:12:27,5
Have you not seen Despicable Me? Maybe Gru stole it again?!,StrikingAnxiety5527,2025-04-29T08:52:54,6
[deleted],[deleted],2025-04-29T13:55:19,3
"No education, more votes for him. Sad.",antilopegedoe,2025-04-29T14:25:20,1
But have you tried shooting the moon?,longarmofthelaw,2025-04-29T08:59:51,11
"A new moon?  What was wrong with the old moon?  I'll bet that the old moon was costing us a bunch of money and DOGE had it replaced with a far more efficient, effective moon.  They are so amazing!  Down with the Biden Moon!    <vomit>",BadgeOfDishonour,2025-04-29T21:27:03,1
"New moon. So in other words, she thought it didn’t exist because she couldn’t see it.   Glad to hear that actual babies have more of a concept of object permanence than she does.",Sinjohh,2025-04-29T08:54:40,23
"I literally had a conversation with a 20- something at work similar to this. We were outside and he goes “where the moon? The moon disappeared” dead serious. I just said it’s a new moon he laughs, thinking I’m making a joke. I explain what a new moon is and how it works. I have known this guy was a box of rocks since he started.        Him  “how often does that happen?”        Me “ every month”",DrMendez,2025-04-29T15:03:23,2
Tides go in. Tides go out. You can’t explain that!   Conservatives have spent decades being absolutely dumbed down by the media that has been curated for them.,molkien,2025-04-29T21:16:06,1
She also appears to believe that the sun used to be more yellow and something has turned it white.,Delicious_Toad,2025-04-29T10:50:12,6
"Home ""schools""",BeeSuspicious3493,2025-04-29T10:29:25,6
"If someone has been homeschooled by one of the fundamentalist cults, the person's basic scientific education will be lacking.  Into that void flows all sorts of sewage.",Mindless_Listen7622,2025-04-29T13:16:08,5
Couldn’t agree more,ricks_flare,2025-04-29T09:50:15,4
Same IQ as roomtemperature,antilopegedoe,2025-04-29T14:26:39,2
"I've heard of shoot for the stars but never shoot at the moon.   I heard it's made of cheese, though, so maybe that's how they plan to feed all the poor kids they stole school lunches from and the elderly after they cut meals on wheels programs.",Financial-Special766,2025-04-29T09:11:06,6
Even a new moon can be seen if it isn't overcast and you allow your eyes time to adjust.,ERedfieldh,2025-04-29T09:02:05,10
"The reality is probably that she pretended to not know the moon was there for engagement, which if it worked would be very depressing",MazzIsNoMore,2025-04-29T11:14:22,2
"These idiots think the Moon is the nighttime equivalent of the Sun. If it's day, the Sun is visible, ergo...",heroic_cat,2025-04-30T07:16:59,1
This is like an actual conspiracy belief that a lot of people hold.,dailydot,2025-04-29T11:01:24,2
You've never played Hearts? Great game that.,Lostinthestarscape,2025-04-29T10:02:29,6
You never seen Cheech and Chong bruh? Like fr?,pick-axis,2025-04-29T09:40:02,0
"A new moon happens every single month.  Kambree (what a name) looks like she is at least 30.  So she's gone something like 360 months without ever looking up and noticing that once a month the moon goes through a new moon phase?  Our ancestors built fucking monuments to record celestial events and it took this bitch that long to figure out that the moon ""disappears,"" once a month.",WhatRUHourly,2025-04-29T09:30:51,14
"And it doesn't last seven days. Or even a full day, really.",accountabilitycounts,2025-04-29T09:34:04,6
It's harder to see it when you want to believe it's not there.,Delicious_Toad,2025-04-29T10:48:47,2
"""quiet you idiot!""",xtraprolific,2025-04-29T12:40:44,1
