Comment,Author,Date,Score
This piece of shit is a rabid dog who is just lashing out at anything and anyone.,Soggy-Isopod9681,2025-05-02T05:03:07,305
Trump showing how he drove a bunch of businesses into the dirt.,The_Lone_Apple,2025-05-02T05:14:38,209
Daily reminder that Trump is a rapist.,Meleesucks11,2025-05-02T04:57:58,614
"Article snippet:  >…Trump is gearing up for a wave of White House firings that could come as soon as late next week in a plan that West Wing aides have branded “The Purge,” Politico reported Thursday, citing an unnamed administration official.  >“A lot” of terminations are on the table, a second official told Politico. The plan reportedly involves firing staff in a massive wave rather than doing it piecemeal, starting with mid-level White House staffers.  >Trump has so far restrained himself from replaying the chaotic turnover that plagued his first term, but Mike Waltz’s ouster as national security adviser and swift reassignment as United Nations ambassador may be a sign of a brewing storm.  >…  >Trump reportedly held off on firing Waltz despite the major blunder partly to avoid the appearance that he was reacting to negative media coverage.  >“Waltz has been on thin ice for a while,” a White House ally told Politico at the time. “This made the ice thinner but at the same time… may actually save him for now because they don’t want to give Goldberg a scalp.”",progress18,2025-05-02T05:03:26,105
"It’s shock and awe delusions all day long with this circus. Same old shit, different term. Just wake up and see what offensive braindead concocted tweet is going to engulf the media for the first half of the day - so we’re not watching the markets. Then, later in the day some other platform will cover some more creation of idiocy from these clowns, so again, nobody notices the crashing of our economy.   Next day? Same thing.",outerworldLV,2025-05-02T05:39:02,93
"White House being run like a reality TV show. Ratings are down, need some shock and awe purges to get viewership back up.",LowFloor5208,2025-05-02T05:24:43,245
"I’m just tired man. Not just of him, but how nothing seems to matter. He is so goddamn fucking insane that the whole country is desensitized to it, and therefore there’s absolutely nothing he can do that’s over the top.   At least the first time it was still a genuine shock to people AND the Democratic Party had some credibility to push back on him. Now party approval is in the 20s and we have Chuck fckn Schumer as the main message-man like for fucks sake. I think once we have a candidate for president and a real de facto party leader it’ll be easier to have some hope, but right now it’s just hard to swallow.",cpatkyanks24,2025-05-02T05:30:03,294
[deleted],[deleted],2025-05-02T05:47:01,74
Can he start with himself?,Hamlet1305,2025-05-02T06:15:23,35
Only 3 years and 8 months left!!,Naptasticly,2025-05-02T05:35:03,15
"You mean he is going to blame others for his failures, again?  Way!",Specialist_End_750,2025-05-02T05:53:28,16
I was worried he was going to fire White House staff not his staff,MrIrrelevantsHypeMan,2025-05-02T05:19:58,13
Who will bring him his diet cokes when he pushes the button on his desk?,sunflower53069,2025-05-02T05:00:19,31
Being on any Trump staff is pretty much like being a small chunk of ice  as spring arrives.  :-),UnusualAir1,2025-05-02T05:54:27,8
"Well... any self-respecting person with any ethics or morals would not work for him. Of course, it is necessary for him to get rid of people once they have seen enough of his bs.",TheRealBlueJade,2025-05-02T06:05:48,9
"Well, on the bright side, that should slow down his destruction of the US for a while.",MARIOpronoucedMA-RJO,2025-05-02T06:37:32,9
The best purge would start at the top.,tqualks,2025-05-02T08:28:01,9
I thought he only hired the best people.,oscar-the-bud,2025-05-02T06:03:03,6
They should be focusing on getting this man out of the white house,DaniDoesnt,2025-05-02T06:30:02,9
[Link](https://txtify.it/https://www.thedailybeast.com/trump-is-plotting-shock-and-awe-purge-of-white-house-staff/) for those who don't want the paywall,bluebird0713,2025-05-02T06:42:49,8
Trump plans nothing. Our president is Steven Miller and Peter Theil and their president is Putin.,CroneofThorns,2025-05-02T07:43:21,7
No one is surprised. No one lasts long there. When is he bringing back his dumb kids?,BumpinThatPrincess,2025-05-02T08:09:53,6
Waits till jobs report comes out artificially showing all the firings and court ordered rehirings only to tank it for May.  He’ll claim he was responsible for April and revert to blaming Biden when May’s report comes out.,ViolettaQueso,2025-05-02T11:40:35,7
"Go ahead fire more ppl Just to find out a week later, oh shit we needed some of those people.",Tricky-Spread189,2025-05-02T13:49:14,7
"103 of 1460 days, 7% done….Not that I’m counting",Soggy_Train3150,2025-05-02T07:38:25,5
So much for him getting the best and brightest.  I guess the next batch of scapegoats will be betterer and brighterer?,SnowboardSyd,2025-05-02T10:07:23,4
Can he start with himself?,SaveBandit91,2025-05-02T13:48:29,6
Soooooooo like last time when just kept firing people,Rhg0653,2025-05-02T08:13:33,6
He’s such a piece of slimy garbage. How much longer must we tolerate this?,HaxanWriter,2025-05-02T09:53:40,5
"If he does it all in one night, and brutally enough, it might go down in history with an ominous name… like the Night of Long Knives or something.",Macqt,2025-05-02T11:52:09,5
In other words he's trying to get ahead of the next wave of mass resignations.  ![gif](giphy|3LCVXcSQ6qKxeb5ZDr),Think-Hospital7422,2025-05-02T15:31:43,7
"Hmm, I guess this does fit with my six-month idea. Still, if this is happening now, dear God.",Rosebunse,2025-05-02T05:57:19,3
More like Shock and Yawn from Dozy Donnie,Fitz_2112b,2025-05-02T07:13:42,6
As desert storm rages - in the desolation - of the wasteland - of dementia and narcissism,Many_Trifle7780,2025-05-02T07:24:54,4
i hope he fires Ron Vera,digitalluddite5280,2025-05-02T07:32:59,5
Pa leez there’s only so many employees left at FOX to replace them.,beavis617,2025-05-02T08:18:33,6
"I wonder if this could actually end up as a benefit in some way.  Fire a bunch of people, stall a few things with the turnover, potentially get a few key pieces to end up on the opposite side of the line (in support, not political ideology), etc.  Probably just a pipe dream.",WeR_SoEffed,2025-05-02T07:19:42,3
This is a domestic threat,MakeYourTime_,2025-05-02T07:43:03,3
Creepy demented moron does stupid thing yet again,bienenstush,2025-05-02T08:25:49,3
"This is what happens when you watch multiple seasons of Succession, and some other shows fit this as well, and no really good guys come along and changes a bad culture.",ravia,2025-05-02T08:49:55,3
"So, if competent people had been put in place from the start...ijs.",buddymoobs,2025-05-02T09:47:51,3
It’s not shock and awe.- we know he can’t get quality people. And we also know he can’t keep even the junkyard ones.,mabols,2025-05-02T09:50:11,3
Here’s the original article. Let’s not give shit websites like the Daily Beast views: https://www.politico.com/news/2025/05/01/waltz-ouster-backstory-00322187.,NoSlide7075,2025-05-02T09:50:11,3
![gif](giphy|HmY5vP7hXP5ba),Busy-Difficulty-4757,2025-05-02T10:01:29,3
I will be shocked and in Awe if he leaves office and brings all his people with him.,pr1ap15m,2025-05-02T10:12:00,3
Everything is normal... 🤫,Strontiumdogs1,2025-05-02T10:29:28,3
I'm sure there's another strongly worded letter headed his way,l0RD-ZUKO,2025-05-02T06:52:45,6
He would,Substantial-Meat-864,2025-05-02T05:11:39,2
Already?,Head_Project5793,2025-05-02T06:42:39,2
I’m sure that every staffer signed an NDA and Trumps army of attorneys will keep any info about ketchup on the wall from getting out.,DDSRDH,2025-05-02T14:24:05,2
"This does not matter the GOP is going to start deporting US citizens, stay focused on the real danger",sten45,2025-05-02T08:18:49,1
Survivor: 102 days of HELL,Dineffects,2025-05-02T08:40:00,1
These people love a purge reference.,RubyWaves75,2025-05-02T17:02:12,1
His hiring skills SUUUUUUCK.,stataryus,2025-05-02T17:11:57,1
He’s managed to find even more inept and idiotic people to staff the place?,zsreport,2025-05-02T19:46:44,1
Surprised there are still any left tbh,tsagdiyev,2025-05-02T21:11:50,1
Wonder if he will purge secret service protection?,doknfs,2025-05-02T22:33:57,1
"It sucks for people who work in the White House, but if he does that, I think it's just going to amplify the existing problems in running any type of administration.  It really baffles me why people voted for him and why people still line up to back him, given his history on how he treats his supporters.  Ah yeah, let me sell out my career and the American people to.....what exactly?",Explodistan,2025-05-03T02:11:11,1
"It’s about time, every three months.",3Quarksfor,2025-05-03T16:12:06,1
Thank you.,Honest_Journalist_10,2025-05-03T16:46:37,1
Trump is severely mentally ill and is a danger to the entire world!,Perpetual_change9009,2025-05-03T23:34:56,1
I don’t care. It’s not like last time when any of them were actually acting as guard rails.,MaddyKet,2025-05-04T11:02:31,1
It’ll get worse when the shortages start too,gringledoom,2025-05-02T08:39:28,11
And yet he’s our president.,clocksteadytickin,2025-05-02T06:31:16,38
"I love saying this to people and them saying ""he was never convicted of rape!""  Oh yeah?  What specifically was he found liable by two juries for doing?  ""Sexual assault by forcing his fingers into a woman's vagina against her will, which isn't rape!""  Okay buddy, you really proved me wrong!",L11mbm,2025-05-02T06:33:19,90
And holds the dubious honour of being the only President in history to come to power sporting 34 felony convictions.,TacticalAcquisition,2025-05-02T05:41:20,99
That's a fact. The evidence  and decisions  from a group  of peers  had more than enough  proof to find him guilty. There's more we may never know. Ppl are afraid of him rightly  so.,Substantial-Meat-864,2025-05-02T05:14:57,100
Maybe the actual shock and awe will be the new rape allegations from fired White House staffers.,tc100292,2025-05-02T06:10:18,23
"A financial fraud, the likes of which I’ve never seen. But sure, he’s a good choice to run the US said no one with an IQ.",outerworldLV,2025-05-02T05:40:51,33
And a pedophile and has 34 felonies.,Low-Argument3170,2025-05-02T09:38:04,3
"And with musk's help, stole the election",Plsmock,2025-05-02T10:01:01,3
Literally and metaphorically,mjc7373,2025-05-02T09:41:29,2
"I will never not upvote this. Needs to be on every introduction of that man: “ladies and gentlemen…twice-impeached, 34-count felon rapist Donald Trump!”",DreadnaughtHamster,2025-05-03T00:32:29,2
"Did nobody catch this? God, this administration is straight moronic.  https://preview.redd.it/zil0odu7bdye1.jpeg?width=1320&format=pjpg&auto=webp&s=4d34670ddf9a2e8343e010fbbb92d4583838d5ab",BlurryEcho,2025-05-02T08:08:10,88
Thank goodness the Daily Beast is here to summarize Politico and add a paywall   https://www.politico.com/news/2025/05/01/waltz-ouster-backstory-00322187,handsoapdispenser,2025-05-02T10:13:09,26
Something Something Tariffs.,SocietyOwn1099,2025-05-02T15:16:41,11
"That's exactly what's happening here, you nailed it!",supercali-2021,2025-05-02T06:52:30,62
Season 1 has been a downward spiral from hell.,BumpinThatPrincess,2025-05-02T08:04:26,30
![gif](giphy|3tTg6UVj3mV6QmgURz|downsized),Fantastic-Ice-1402,2025-05-02T09:26:40,5
💯,GenXmarksthespot_,2025-05-02T12:54:02,2
Tried to make it through an episode of The West Wing a couple days ago and kept tearing up. The show is feeler with real human characters who love America and Americans and the characters themselves have feelings and CARE! They care about people.   What the fuck has happened to this country?,Christ_on_a_Crakker,2025-05-02T08:24:05,63
"Desensitized is correct, but more like embarrassment I feel for this guy? bro, even your fascism is giga cringe and uninteresting, hell boring if I may dare. It’s like disciplining a damn child who doesn’t wanna listen. you’re just flailing everywhere.",[deleted],2025-05-02T06:12:08,47
"I'm not sure if it's desensitized or just uncomfortably waiting for the other shoe to drop.  Either he goes bonkers enough that people start to act in force (yes, we have protests now but until the MAGA fever breaks... if it even can... the political right is afraid to act against him) or he goes full Marshall law paranoid, and the pretense of democracy ends.  Until then, it feels like the entire planet is waiting to exhale.",Za_Lords_Guard,2025-05-02T07:05:10,21
I almost wish I were desensitized just to give my anxiety and sadness a break. Instead I would describe my state as ineffectual panic.,IYFS88,2025-05-02T10:37:25,12
It could probably come out that we're gassing the Mexicans and it would just be another daily scandal,OrangeVapor,2025-05-02T09:36:37,9
"Autocrats succeed by making you feel despair.  There is a lot of good going on right now. Protests are increasing, democrats are increasingly doing town halls in gop districts because republicans won’t show up.  These things by themselves don’t win elections, but they are encouraging signs.  Don’t just sit and stew.  Donate!  Join an advocacy group!  Run for local office.  Democracy is not a spectator sport.",Able-Campaign1370,2025-05-02T16:23:45,4
I feel every part of this. The WH Instagram has a racist post about DEI and immigrants. Why isn’t this all over the news? Why is this the norm? Why the actual FUCK are we here??,Cali-Doll,2025-05-02T17:37:32,2
"He hires the best people and he also hardly knows them, never met them.",chrissz,2025-05-02T06:40:20,44
All he’s got are shit “ideas” and idiotic distractions.,ratiofarm,2025-05-02T17:43:27,2
I wish,BumpinThatPrincess,2025-05-02T08:04:54,3
Optimistic,thebirdisdead,2025-05-03T21:32:40,1
Accountability?! Never heard of her.,BumpinThatPrincess,2025-05-02T08:05:25,3
Loomer will pull one out of the mini fridge while she’s down there on her knees anyway.,chrissz,2025-05-02T06:32:54,17
That person has job security out the ying yang,[deleted],2025-05-02T06:57:21,6
"""Not Funny!""",Randusnuder,2025-05-02T06:49:28,2
"By the looks of it, he’s going to run out of weirdos.",BumpinThatPrincess,2025-05-02T08:06:04,6
Depends on who he replaces these people with.  He might just be getting rid of the people who aren't on board for all the insane shit.,AsstacularSpiderman,2025-05-02T07:54:34,5
They already refused to do it,BoxBeast1961_,2025-05-03T01:25:01,2
I'm more worried he's just purging anyone not 100% on board for his more insane ideas.,AsstacularSpiderman,2025-05-02T07:55:35,6
🙏,MLJ9999,2025-05-02T14:18:12,1
Everything is fine…🔥,jenyj89,2025-05-04T04:57:33,2
[deleted],[deleted],2025-05-02T06:57:32,83
Is he though,ScumEater,2025-05-02T07:08:46,12
"Heres my go-to to script:  Your right, it wasn't rape, it was sexual abuse. That's because when assaulted her, he penetrated her with his fingers and not his penis.   I've done it a few time and it just ends all discussion, particularly with older MAGAs.",Flaxscript42,2025-05-02T07:08:38,50
"I know the mother of a teenage girl that thinks just like that. She sees a pedo under every rock, and thinks oprah eats babies but thinks we are all just picking on yam tits. It’s bizarre.",loohoo01,2025-05-02T07:21:26,16
"Man I wish that the people that I argue with even believed that much. They usually say “oh please, no he didn’t. The case was fake, and the judge was a liberal. They are always trying to bring him down. It was not real.”    I get so angry but realize that there is probably nothing that I can do to convince these people.",H2OMGosh,2025-05-02T11:57:13,5
...and 2 impeachments.,the_crustybastard,2025-05-03T02:21:04,1
"I did not know he was a pedophile. Please, could you inform me a bit about that? Thanks.",Honest_Journalist_10,2025-05-02T14:26:19,2
"“The truth is, these are not very bright guys, and things got out of hand.”   Same as it ever was.",botany_bae,2025-05-02T12:18:46,28
Hegseth was on Only Fans,lostsailorlivefree,2025-05-02T11:30:26,11
Thanks!,Far_Recommendation82,2025-05-02T10:22:14,5
Season 2,palefired,2025-05-02T08:19:02,16
"What happened to us?  Letting kids die in school from shootings.  Killing off education and science.  Going back to child labor.  Letting mothers die in childbirth.  We’ve straight up regressed to the nineteenth century.  It’s sad.  The GOP talks about promoting natalism while they are fine with letting kids be deported, exploiting them, and letting them die.  Soon, we will be sending them into coal mines.",Easy-Concentrate2636,2025-05-02T13:41:14,30
"I’m not embarrassed for him, I’m more embarrassed for his sycophants in these public cabinet meetings that are specifically set up for these people to suck his dick. The amount of “Thank you for your leadership, you’re so incredible, most votes in history, etc” it is SOOOO cringe.   Like I hope it’s so over the top because they’re making fun of him and he’s too stupid to realize it, which would at least give me more comfort than the other option- which is these highly educated politicians who went to elite schools, have impressive backgrounds, and who were otherwise at least publicly sane have completely and utterly sold their own self-respect to jerk off a man who’s response to “What does the Declaration of Independence mean to you” is “well it’s a declaration, of unity and peace, and it’s incredible” LIKE BRO WHAT THE FUCK. They treat him like Joffrey from Game of Thrones.",cpatkyanks24,2025-05-02T08:20:55,37
I am in chronic rage.,Cali-Doll,2025-05-02T17:48:04,2
Would be overshadowed in the news by an anonymous report that Joe Biden once accidentally mistook chocolate ice cream for strawberry in a meeting with world leaders in 2014.,cpatkyanks24,2025-05-02T09:43:44,13
"Oh believe me, I’m not personally quitting, but I can see the difference in the overall mindset of the electorate this time around. I don’t think it’s necessarily that Trump is more popular because he isn’t. It’s the unpopularity of our own party, and we have to find a way through that.",cpatkyanks24,2025-05-02T16:39:02,2
Plausible deniability  I didn't know who signed this executive order. I didn't know who send this guy in El Salvador,Realpazalaza,2025-05-02T16:00:18,6
Our tiny toddler tyrant,aggirloftoday,2025-05-02T10:16:02,14
Unfortunately,clocksteadytickin,2025-05-02T07:16:48,4
"The thing is, he was found liable by the jury for sexual abuse BUT the judge clarified that the act qualifies for the NYS definition of rape!",L11mbm,2025-05-02T07:13:04,44
"The argument over semantics is mind blowing. In WV, sexual assault is defined as penetration, by penis, finger etc, and clarified as “however slight.” So, had he assaulted Ms Carroll in WV and found liable of sexual assault, would they see it differently??? Would they then say, “Yes, he is a rapist and we do not support him being the president”??? Those who support him are as guilty and responsible as he is",Bogeysmom1972,2025-05-02T08:20:05,19
"Don't you dare speak bad about the second coming of Jesus, Mr president trump.",RecoverToday-,2025-05-02T11:31:56,6
It makes sense when you realize it’s a cult.,Cali-Doll,2025-05-02T17:57:51,3
Yam tits!! OMG that’s hilarious!!,jenyj89,2025-05-04T05:03:10,1
"It’s so sad, disgusting, and completely diabolical how much those who defend tfg believe how not guilty he is. 😡I feel like if he did it on live tv they’d still say: “it’s fake/AI/a witch hunt or whatever …the delusions run DEEP AND WIDE with his followers. And it’s just gross.🤮🤮",GenX-Fight_or_Flight,2025-05-02T12:12:51,7
"They are a cult, and the cult always follows  their  leader.",Honest_Journalist_10,2025-05-02T14:24:29,4
He raped her with Epstein. Epstein raped the little girl first and trump was upset saying he should have been first. I don’t have the link but you can look it up.,Low-Argument3170,2025-05-02T15:02:09,6
This is like the Road Rules Challenge but way worse,BumpinThatPrincess,2025-05-02T13:49:56,3
Great analogy. And why did they pander to Joffrey? Because he was a vindictive evil little shit and they were terrified of him. These people act in fear masked as love and admiration.,JLHuston,2025-05-02T23:43:25,1
In a tan suit.,SocietyOwn1099,2025-05-02T15:19:51,6
"Don't forget: Tiny, tiny little hands, too. 🖐️",Honest_Journalist_10,2025-05-02T14:21:33,6
"Right, now let's all sit with the fact that we're not disputing whether he raped her...We agree he did that and ""you"" (Republican Rapist supporter, not you the reddit commenter) only defend that he doesn't have a criminal conviction for doing that. Very cool. Stay the F away from me.",wigglex5plusyeah,2025-05-02T10:25:56,20
Fun fact..my mother knew a Moonie in the 80’s that wasn’t as nuts as these magas are.,loohoo01,2025-05-02T18:26:27,2
While smiling too much,Acceptable-Bench1386,2025-05-02T15:30:59,3
