Comment,Author,Date,Score
" As a reminder, this subreddit [is for civil discussion.](/r/politics/wiki/index#wiki_be_civil)  In general, be courteous to others. Debate/discuss/argue the merits of ideas, don't attack people. Personal insults, shill or troll accusations, hate speech, any suggestion or support of harm, violence, or death, and other rule violations can result in a permanent ban.   If you see comments in violation of our rules, please report them.   For those who have questions regarding any media outlets being posted on this subreddit, please click [here](https://www.reddit.com/r/politics/wiki/approveddomainslist) to review our details as to our approved domains list and outlet criteria.    We are actively looking for new moderators.  If you have any interest in helping to make this subreddit a place for quality discussion, please fill out [this form](https://docs.google.com/forms/d/1y2swHD0KXFhStGFjW6k54r9iuMjzcFqDIVwuvdLBjSA).    ***   *I am a bot, and this action was performed automatically. Please [contact the moderators of this subreddit](/message/compose/?to=/r/politics) if you have any questions or concerns.*",AutoModerator,2025-05-01T16:37:02,1
No one criticizes America more than Trump,Impossible_Walrus555,2025-05-01T16:41:28,318
"“The difference between patriotism and nationalism is that the patriot is proud of his country for what it does, and the nationalist is proud of his country no matter what it does; the first attitude creates a feeling of responsibility, but the second a feeling of blind arrogance that leads to war.”  - Sydney J. Harris",TintedApostle,2025-05-01T17:07:39,190
"Objective reality will never be consistent with their ambitions. Stephen Miller, absent his past his privilege, would most certainly have ended up as a (i) serial killer or (ii) school shooter or (iii) sexual predator.   I wonder what all of their assets are going to be directed towards.",Wide-Secretary7493,2025-05-01T16:52:50,67
"Those who do not learn from history are doomed to repeat it.   Those who do not WANT you to learn from history INTEND to repeat it.  Patriotism means knowing your country, good and bad. These are not patriots.  They are fascist traitors.",Professional-Buy2970,2025-05-01T17:01:00,48
"If the country they grow up in isn't a fucked up place, the majority of kids will love it of their own accord.  Edit: grammar",Cringeforcancer,2025-05-01T16:48:41,49
How about just making America something people want to love. Then you don’t have to browbeat children into fealty.,lesmainsdepigeon,2025-05-01T17:14:31,20
Doesn’t he make your skin crawl?,KakistocratForLife,2025-05-01T17:49:51,18
"If they want to set precedent that the federal government can exercise direct oversight over local school curriculum, they can have at it.  Will make the Third Reconstruction that much easier when liberals and progressives take power.",gradientz,2025-05-01T16:46:29,30
The only thing this dead eyed freak loves is causing suffering.,Spare_Philosopher893,2025-05-01T17:19:35,9
He looks like a cross between Joseph Goebbels and Gollum.  [https://www.dailykos.com/stories/2017/11/5/1687333/-Trump-s-Stephen-Miller-and-Hitler-s-Joseph-Goebbels-are-chillingly-similar](https://www.dailykos.com/stories/2017/11/5/1687333/-Trump-s-Stephen-Miller-and-Hitler-s-Joseph-Goebbels-are-chillingly-similar),RodeoSex,2025-05-01T17:23:12,6
Will they be given an endearing nick name?  Maybe Trump Youth?,hmr0987,2025-05-01T17:28:42,6
"They want jingoism and subservience. They want kids to never question, and pledge their devotion. This is some North Korea shit right here.",Devistator,2025-05-01T18:12:57,8
"Forcing people to love a thing isn’t love. Honestly, before Trump and Trumpism I was far more patriotic than I am now. Trumpism revealed a lot of moral rot in our society.  A free society, one worthy of living in, allows for self critique.",TruthandMusicMatter,2025-05-01T18:47:00,9
Stephan Miller is the modern day Joseph Goebbels.,AllMightyLantern,2025-05-01T19:45:01,6
I was taught patriotic values and to love america when I was in grade school.  Guess how that turned out?,panteleimon_the_odd,2025-05-01T17:49:52,7
Stephen Miller can go fuck himself.,AndrewY17,2025-05-01T22:00:27,6
"For anyone who's toying with the idea that blind nationalism could be a good thing, I invite you to explore the history of human civilization where blind nationalism has *never once* led to a positive long term outcome for a country or territory's citizenship. Ever. Not once. It's literally never happened in the history of our species.   It does, however, tend to enrich a select few at the top of the power pyramid over the short term. Which should give you some hints as to why these largely geriatric assholes are pushing this nonsense (hint: it ain't for *your* benefit).",Beneficial_Soup3699,2025-05-01T17:03:25,4
So….I live in Santa Monica where this thumb for a head is from and I find it laughable that this moron who grew up in this extremely privileged city and overall environment thinks he knows shit about what being downtrodden is like.  I’ve said this so so many times but as someone who works on some pretty high budget scripted movies and tv shows - all of these people are people who act like they work in media (only) and cosplay as political appointees.  Stephen Miller is another perfect example of this.  This guy is utterly clueless what what most of the country deals with on a daily basis.  All these guys are literally “theory fairies”,Queasy-Protection-50,2025-05-01T17:58:15,3
"Will they also be taught that this clown is a known white nationalist?   And maybe lil Stevie Miller here can learn some respect and teach his boy Donnie some too. The world and America is laughing at these people, rightfully so.",SayVandalay,2025-05-01T19:34:12,3
Miller is one creepy ass dude.,GWshark1518,2025-05-01T20:42:41,5
America already does this. We were shocked by it moving here 30 years ago. There was no pledge of allegiance or Netherlands the beautiful singing nonsense where I came from.,Respectable_Answer,2025-05-01T21:17:34,5
"Forced to obey america doctrine*. Funny, I bet North Korean kids LOVE their country.",_MrCrabs_,2025-05-01T21:59:21,4
If you have to force people to love their country you’re doing something wrong. Actions speak louder than words.,Jamira360,2025-05-02T00:35:44,3
"Steven Miller spoke about communists. So did this guy.   The streets of our country are in turmoil. The Universities are filled with students rebelling and rioting. Communists are seeking to destroy our country ... Without law and order our nation can not survive."" Adolph Hitler, 1932.",mces97,2025-05-01T16:57:47,6
"If it's the same as ""christian love"" then yeah, that's not going to be a good time for anyone.",Hidden_Landmine,2025-05-01T16:57:51,3
That’s exactly what he’s doing. This is exactly what Hitler did. Taught German nationalism in schools. They are going to attempt to raise an entire generation of kids who are hard-core loyalists. If we do not do anything to stop them… We will lose everything this country has ever achieved.,Small_Cutie8461,2025-05-01T18:39:40,3
Herr Miller the Nazi has spoken. ,Express_Ticket1699,2025-05-01T19:12:46,3
Hey Goebbels! STFU!,bob3905,2025-05-01T19:57:29,3
Trump doesn't even know what the Declaration of Independence was about.,Muronelkaz,2025-05-01T20:01:35,3
"I was taught to love America, and I still do. Not the current state of the country but instead what America stands for to me, to its people, and at one point to the world.  America should be the land of the free and the home of the brave, not the land of the oppressed and the home of the fearful. America should be one people, accepting and understanding of different views not persecuting and heckling each other allowing for division.  My America is the country that should come to the aid of any that ask. We are a rich nation and I am proud to be so, not to hoard it but to use it to help others in need.  I'm a 35yo straight white male that loves all my countrymen whether they be white, brown, yellow, green, he's or she's, them's or they's. My America welcomes all that comes to her mighty shores.  Lady liberty says right there; Give me your tired, your poor. Your huddled masses yearning to be free. The wretched refuse of your teeming shore. Send these, the homeless, tempest tossed to me. I lift my lamp beside this golden door.   That is the America I believe in. That is the America I will fight for, and yes that is the America I remember as I type this with tears on my face.",Pyro1934,2025-05-01T20:20:46,3
"Well, you certainly aren't supporting the 'love thy neighbor' message.",pentultimate,2025-05-01T23:07:41,3
By America they mean trump,ikeabahna333,2025-05-01T23:22:51,3
"""Children will be taught Nationalism.""   Listen, bud, we already indoctrinate with the pledge of allegiance.   And I know this because in 8th grade I was like, ""You know? What happens if I don't do this? Will I get in—""   I *absolutely* got in trouble, but being me, it told me that I was also absolutely on the right path. The very act of questioning a thing gets me in trouble? Yeah fuck doing whatever that thing is.   ""You're disrespecting the veterans!""   *Laughs* ""I'm exercising my right to free speech, fuck you very much."" The free speech that those very veterans died to protect.   Also, ""If we don't sing the song, the magic sky cloth won't freedom"" is very apt here. It's a symbol. As is the act of not standing, saying the words, or putting my heart over my chest since I was 14.   I don't believe in loyalty pledges. And, in my opinion, neither should you ",Magidex42,2025-05-02T00:29:37,3
Dollar-store Goebbels this SM guy.,sonnyempireant,2025-05-02T01:48:38,3
"If the shoe fits, Miller is a Nazi.",VengefulWalnut,2025-05-02T02:18:11,3
"This Loving America speak is alarming. Don't ignore it. What makes America great is being loyal to democracy and the balance of power, not being loyal to the people in power. Teach your kids that before they start hearing lies in school.    The narrative of being un American for not liking Trump and his dismantling of democracy is spreading like herpes. Before the election my friend said ""People hate Trump more than they love America"" in an anti-liberal rant. It blew me away. Look how this narrative is unfolding and spreading. It's a propaganda campaign.    My kids are surprising watching old anti-Nazi propaganda in school. It's a matter of time before that won't be allowed so it's in parent's hands to make sure the next generation knows right from wrong and can recognize manipulation. These people aren't dummies. They are racing to rot the next generation's minds so we have to keep ahead of them.",RateMyKittyPants,2025-05-02T02:55:48,3
Ok the other countries already think we are weird and creepy for doing the pledge of allegiance to the flag every single morning,Potatopamcake,2025-05-02T03:29:10,3
"To be fair, Miller is an avowed Nazi. So there's that.",Slow_Supermarket5590,2025-05-02T05:10:55,3
Fawning lecture about the dear leader,theTapIsOnDaBurnin,2025-05-01T17:03:35,2
Love is voluntary.,Terakian,2025-05-01T17:07:00,2
"How about banning the scouts and replacing them with ""TrumpJugend""?",_L_R_S_,2025-05-01T17:07:07,2
Right out of Philip K Dicks’s “Man In The High Castle”,snowlion000,2025-05-01T17:30:21,2
"It’s just beyond terrifying how Miller is basically Himler, Goebbles, *and* Reinhard Heydrich rolled into one unholy amalgamation.",hskfmn,2025-05-01T17:49:29,2
Weasley fuck.,Dewey081,2025-05-01T18:07:55,2
"Fuck America, dumb idiots",Remarkable-Bag-683,2025-05-01T18:24:23,2
Baby goebbels thinks he knows what is best for kids and the US. Bless his heart!,I-WishIKnew,2025-05-01T18:39:04,2
There’s no way this scumbag isn’t doing as many heinous crimes as possible behind closed doors. You don’t look like that and not have some serious shit to hide.,ReadingTheRealms,2025-05-01T19:03:57,2
"If they were actually taught those things, they would hate maga at its very core.  Something tells me they wont be taught ‘civic values’ and what it really means to be a patriot though",blackmobius,2025-05-01T19:04:18,2
This guy can fuck right off.,cf858,2025-05-01T20:07:29,2
I stopped reciting the pledge in High School. I'm going to make sure my kid knows they don't have to say it. The pledge is part of the grooming they all complain about to turn our children into useful idiots.,tendeuchen,2025-05-01T21:04:05,2
If you love something set it free Donny.,voice_of_Sauron,2025-05-01T21:05:30,2
So not grooming!,DevelopmentAble7889,2025-05-01T21:15:22,2
I wanna get off this ride Uncle Sam,FriendsWifBennys,2025-05-01T21:16:42,2
Uh-huh. Good luck getting standardized curriculum after you just abolished the Department of Education.,1877KlownsForKids,2025-05-01T22:23:44,2
Why are the GOP gone full cult over these guys? They are burning their own homeland for these guys? I just don't understand.,ShoppingDismal3864,2025-05-01T22:47:20,2
This is the purpose of the conservative K-12 curriculum from Hillsdale College. It teaches a nationalistic view of American history that subverts critical evaluation of the past. It is American exceptionalism masquerading as education.   Why should you care?  Because it is creeping into charter schools and widely used by homeschooling parents.  We will have a generation raised in this garbage.,tweakingforjesus,2025-05-01T23:16:58,2
"Criticizing your country when it’s fucked up IS loving your country. It’s wanting better for your home, not hating it. You can also acknowledge flaws without hating something.",Spastik2D,2025-05-02T04:11:10,2
We're already taught to love America in schools. Its after - when we all join our fellow slaves we realize what America really is.,Munkeyman18290,2025-05-02T05:46:02,2
boy sounds just like Nazi Germany to me or maybe North Korea,joestanh1,2025-05-02T06:34:22,2
How are they not already? Isn't the pledge done every day?   How about you make an America kids want to love?,nuckle,2025-05-01T20:00:37,3
"Reason number 1,000 why I’m not having kids",throwaway11334569373,2025-05-01T21:44:08,2
penis head,1_churro,2025-05-01T17:05:45,1
Steven Miller loves the North Korean approach to education.  Every classroom should have a poster of the Dear Leader.,Only_Mastodon4098,2025-05-01T17:06:53,1
"We'll also need an inspirational song!  Oh, here we go:  [https://www.youtube.com/watch?v=C6lpT6e8nAA](https://www.youtube.com/watch?v=C6lpT6e8nAA)",Catspaw129,2025-05-01T17:21:56,1
"I wish that he would use that spray-on hair fluff again. Not only was it funny, but it also toned down the glare reflecting from his scalp and slightly reduced the disconcerting 'dog's penis' aspect of his appearance.",FitWrap1959,2025-05-01T18:00:38,1
Didn't the government try this with Indian board schools?,OrbeaSeven,2025-05-01T18:22:23,1
Where’s the “get this stuff out of our schools! You aren’t the parents!” Crowd now?,BotherResponsible378,2025-05-01T18:35:59,1
"Trump doesn’t love America, he loves money.",01wax,2025-05-01T18:48:52,1
"That's an interesting juxtaposition of quotes in the headline and header image.    To a reader who's not familiar with the people involved (and like it or not, the political junkies *are* an extreme minority) this only reinforces the conservative narrative that Trump is pro-America, and that his critics just irrationally hate the country.   The article itself also pushes that narrative leaving heavily on the regime's talking points, and picking a handful of Xits as their ""other side"".",Konukaame,2025-05-01T18:49:16,1
"I was in school when we had to say the pledge and when they told us only the good stuff and how awesome America is, when they covered up the truth and glossed over the horrors. 37 years later and I'm sill learning of some new atrocity. Schools don't cause you to hate America the truth does.",Rezkel,2025-05-01T19:02:20,1
It sounds much better in its original German.  “The Children will be TAUGHT! Patriotism!”,PastorNTraining,2025-05-01T19:03:09,1
I don’t see children pillaging the constitution like someone does.,rubyshoes21,2025-05-01T19:14:48,1
"The current administration's war on education is undeniably reminiscent of how fascist regimes of the past have attempted to subvert the education system, attack the arts and intellectuals, and suppress opposing voices and viewpoints   But don't take it from me...  Jason Stanley, author of *""How Fascism Works,""* and *""Erasing History: How Fascists Rewrite the Past to Control the Future""* argues:  > Fascist politics attacks education to undermine democracy and pluralism. Universities and educational institutions are targeted because they promote critical inquiry when challenging the myths that fascist politics rely on   Stanley describes how anti-intellectualism is used to:  > attack the media, universities, and scientists when they contradict the strong man’s authority.  The MAGA movement embraces anti-intellectualism as a means to not only dismiss the legitimacy of the educated, experts, scientists and the media, but also to assert their superiority and the primacy of their beliefs.   The Trump administration has identified universities and public schools as places where ""radical left"" ideas and antithetical perspectives are taught. This becomes a justification for the use of draconian policies and executive orders that allow the government to take control over all academic decision making.  Robert Paxton, author of ""*Anatomy of Fascism*,"" explains the behavior of fascists:  > Fascism seeks to control education to instill its ideology in the youth, ensuring that future generations are loyal to the regime and its values.  > By reshaping educational curricula, fascist regimes aim to eliminate critical thinking and promote a narrative that supports their authoritarian rule.  Paxton also says that fascists value *""the superiority of the leader’s instincts over abstract and universal reason""*  This is what the Trump administration is hoping to accomplish by strong-arming universities, by fracturing the education system, by restructuring the curriculum and by overhauling programs and departments that don't promote administration-approved viewpoints.  This serves to stifle critical thinking and program younger generations to accept the leader's words and the party's dogma over everything else.  Additionally, the Trump administration's efforts to defund and dismantle the public education system will disproportionately impact underserved communities, which is a feature, not a bug.  There's also Lawrence Britt, who published *""Fascism Anyone?""*, which includes a list of 14 defining characteristics of fascism. One characteristic is the ""*disdain and suppression of intellectuals and the arts:*""  > Fascist nations tend to promote and tolerate open hostility to higher education, and academia. It is not uncommon for professors and other academics to be censored or even arrested. Free expression in the arts is openly attacked, and governments often refuse to fund the arts.  MAGA is openly hostile towards public education, higher learning, academics and teachers, scientists and researchers, even towards the arts.  The federal government has been pressuring schools and universities into firing its administrators.   The current administration is targeting student protestors, is unlawfully detaining students and faculty who have been critical of the administration's policies, all while demanding that universities report on foreign students and their affairs.  We've seen violent threats issued towards educators, staff members and even school librarians.  The government is demanding that schools hand over their admissions data so that the Trump administration can dictate who qualifies for admission and who does not. They're also demanding that universities supply their employment data so the government can oversee hiring and firing and determine who meets the approved criteria.   The government is even putting certain departments under the supervision of outside security forces (literal thought police)  The Trump administration is also slashing funding for scientific research and grants. This will impact progress on cancer research and research on infectious diseases. It will also hinder the development of future generations of scientists.  Luis Britto García defines fascism in his essay *""Fascismo.""* One of the characteristics of fascism, Garcia says, is how ""fascism is anti-intellectual:""  > Noting the scientific progress achieved by progressivism, Britto Garcia writes ""Fascism does not invent, it recycles. It only believes in yesterday, an imaginary yesterday that never existed.""  This concept is instilled into the MAGA consciousness. ""Scientific progress"" becomes negatively associated with ""the left."" Trump and his supporters constantly challenge widely agreed upon consensus while denying science. They even believe that their backwards, antiquated views about science, medicine, biology, etc, are more valid than the relevant and leading scientific research.  Eden McLean, historian of fascism, notes that fascists historically put their efforts into controlling information:  > Restricting access to information and promoting conformity over critical thinking are tactics reminiscent of fascist regimes.   The Trump administration is already instituting policies that flag thousands of images, articles, online content, historical texts and even words for removal. They are suppressing free speech, attacking the press, and controlling what information is being disseminated to the public.  Ruth Ben-Ghiat, historian and author of *""Strongmen: Mussolini to the Present,""* notes that:  > Mussolini and Hitler both restructured educational systems to promote their authoritarian ideologies and suppress dissent  The goal for fascist regimes is to shape the ideologies of followers and future generations, suppressing any antithetical ideas and perspectives while promoting nationalistic and nativist doctrine.  In this sense, teaching ""patriotism"" amounts to radicalizing the population and instilling a set of ""values"" and beliefs that correspond with the regime's authoritarian, ethnocentric and chauvinistic disciplines.  When forced to acknowledge these parallels, those on the far right will often try to accuse the opposition of pursuing these same tactics.  For fascists and their followers, they're the *real* victims of oppression. They're merely reacting to a system of tyranny that's suffocating *them*. Equality amounts to persecution, addressing past injustices amounts to an assault on *their* rights and freedoms.  They fail to acknowledge historic inequities and perceive things like fairness, diversity and even impartiality as threats to a long-established hierarchy.  Contrary to what they believe, their insistence that they are the victims of a new system of oppression is, ironically, a consequence of them living within an inequitable system for so long, and a system that has predisposed them to believe that they are victims.  These fascist and authoritarian movements propagandize their followers and persuade them to adopt an ""us vs. them"" mentality. Fascist leaders tend to rely on culture wars and a method of identifying dangerous ideas, scapegoats and enemies that act as common threats for their followers to unite against. These ""others,"" these ""them"" represent an existential danger to their core beliefs, their culture, their way of life, their country, their very existence, and in this case, their white, Christian hegemony.",Choice-of-SteinsGate,2025-05-01T19:20:35,1
How 'bout teaching them to love their neighbors? Particularly if  Trump is going to be Pope.,Motorhead-84,2025-05-01T19:20:36,1
"America, do not let this happen, or there's just no coming back from it.",Zazen_Satori_Gaming,2025-05-01T19:35:19,1
Coming from someone who clearly hates America almost as much as they hate Americans.  Such a daft prick.,o8Stu,2025-05-01T19:35:53,1
It’s weird seeing people that hate America and everything it stands for talking about teaching children to love America.   Maybe we should start the “love America” lessons with Stephen Miller and Trump and see if it can help them not hate America.,wwhsd,2025-05-01T19:42:08,1
"So about all that so called indoctrination they claim the left does in schools?   ah right, its always projection and every accusation is a confession with republicans",Successful_Sign_6991,2025-05-01T19:43:07,1
Rofl as things stand we can barely teach them to read,Duke-of-Dogs,2025-05-01T19:58:31,1
A moral government doesn't need to enforce lessons on how to love it in classrooms.,ClimateSociologist,2025-05-01T20:04:04,1
"Well we pledge allegiance to the flag and to the Republic for which it stands. The part he doesn't like is the ""with liberty and justice for all."" Or the Republic part. Or probably the flag. He wants it to be a flag with his face on it and there's going to be gold trim. And there's going to be some big fake titty women on either side of him. Like Frank Reynolds' billboard.",DChristy87,2025-05-01T20:10:59,1
"By that, he means children will be taught to love Trump.",Most-Artichoke6184,2025-05-01T20:19:39,1
"Well, just look at that face? Its like if Himmler and Goering had a baby… comes out exactly like that fool right there!",Loudstealth,2025-05-01T20:22:20,1
I’m an Eagle Scout. Fuck this guy. ,Oldnews26,2025-05-01T20:22:44,1
The regime will tell you what to feel and think,triscuitsrule,2025-05-01T20:28:13,1
