Comment,Author,Date,Score
" As a reminder, this subreddit [is for civil discussion.](/r/politics/wiki/index#wiki_be_civil)  In general, be courteous to others. Debate/discuss/argue the merits of ideas, don't attack people. Personal insults, shill or troll accusations, hate speech, any suggestion or support of harm, violence, or death, and other rule violations can result in a permanent ban.   If you see comments in violation of our rules, please report them.   For those who have questions regarding any media outlets being posted on this subreddit, please click [here](https://www.reddit.com/r/politics/wiki/approveddomainslist) to review our details as to our approved domains list and outlet criteria.    We are actively looking for new moderators.  If you have any interest in helping to make this subreddit a place for quality discussion, please fill out [this form](https://docs.google.com/forms/d/1y2swHD0KXFhStGFjW6k54r9iuMjzcFqDIVwuvdLBjSA).    ***   *I am a bot, and this action was performed automatically. Please [contact the moderators of this subreddit](/message/compose/?to=/r/politics) if you have any questions or concerns.*",AutoModerator,2025-05-05T14:01:48,1
They aren't designed at all. They're the rantings of an old man who has no idea what the fuck he's talking about.,PeterVenkmanIII,2025-05-05T14:04:18,26
Going to heat up this week. Sigh.,KaliMau,2025-05-05T14:12:15,12
He really let that cameo in Home Alone 2 go to his head.,ShakeyLegsMcGee,2025-05-05T14:08:58,4
"Again, it's literally not possible to tariff a film or TV show to begin with.",InfinityComplexxx,2025-05-05T14:18:46,2
"And the world will adjust, evolve, as what once was the United States of America dwindles into isolationism and fascism",Sarcasmgasmizm,2025-05-05T14:26:41,2
*Laugh in French. In Italian. In Brit'. In Japanese. In Chinese. In Canadian. In Swedish. In Korean. In Indian...,BahutF1,2025-05-05T15:57:16,2
Maybe the world will come together and destroy America’s film industry. Doubting it though,[deleted],2025-05-05T19:48:39,1
