Comment,Author,Date,Score
" As a reminder, this subreddit [is for civil discussion.](/r/politics/wiki/index#wiki_be_civil)  In general, be courteous to others. Debate/discuss/argue the merits of ideas, don't attack people. Personal insults, shill or troll accusations, hate speech, any suggestion or support of harm, violence, or death, and other rule violations can result in a permanent ban.   If you see comments in violation of our rules, please report them.   For those who have questions regarding any media outlets being posted on this subreddit, please click [here](https://www.reddit.com/r/politics/wiki/approveddomainslist) to review our details as to our approved domains list and outlet criteria.    We are actively looking for new moderators.  If you have any interest in helping to make this subreddit a place for quality discussion, please fill out [this form](https://docs.google.com/forms/d/1y2swHD0KXFhStGFjW6k54r9iuMjzcFqDIVwuvdLBjSA).    ***   *I am a bot, and this action was performed automatically. Please [contact the moderators of this subreddit](/message/compose/?to=/r/politics) if you have any questions or concerns.*",AutoModerator,2025-04-24T20:53:38,1
"But *of course* they want to release the guy who helped fabricate hundreds of hours of primetime Faux News coverage and spin false narrative against Biden, why wouldn't they?",Silidistani,2025-04-24T21:01:28,39
Naturally.  That was probably part of the quid pro quo bargain from the beginning.  For some reason Trump doesn't honor election laws (or results) unless they favor him.  I don't think the Founders imagined a President and Congress in cahoots to be *this* corrupt.,dremonearm,2025-04-24T21:12:35,12
"Just say whatever you want about people and get a Trump Get Out of Jail Free Card™️, free with every Trump vote.",VanillaCreamyCustard,2025-04-24T22:33:17,5
"~~capitalism~~ bribery is legal now, isn't it?",RuthlessIndecision,2025-04-25T04:31:59,3
So the Don bails out the La MAGA Nostra to go after the good guys... have we ever seen anything like this before?,phosdick,2025-04-25T07:41:04,3
So silly. I wish these pardons could be investigated. All the criminals that ARE guilty… it’s not like Obama when he dropped federal charges of weed dealers who spent twenty years in prison.,fumphdik,2025-04-25T01:13:59,6
