Comment,Author,Date,Score
" As a reminder, this subreddit [is for civil discussion.](/r/politics/wiki/index#wiki_be_civil)  In general, be courteous to others. Debate/discuss/argue the merits of ideas, don't attack people. Personal insults, shill or troll accusations, hate speech, any suggestion or support of harm, violence, or death, and other rule violations can result in a permanent ban.   If you see comments in violation of our rules, please report them.   For those who have questions regarding any media outlets being posted on this subreddit, please click [here](https://www.reddit.com/r/politics/wiki/approveddomainslist) to review our details as to our approved domains list and outlet criteria.    We are actively looking for new moderators.  If you have any interest in helping to make this subreddit a place for quality discussion, please fill out [this form](https://docs.google.com/forms/d/1y2swHD0KXFhStGFjW6k54r9iuMjzcFqDIVwuvdLBjSA).    ***   *I am a bot, and this action was performed automatically. Please [contact the moderators of this subreddit](/message/compose/?to=/r/politics) if you have any questions or concerns.*",AutoModerator,2025-05-08T11:02:59,1
Annual stopped clock moment for Josh Hawley.  Clearly he didn’t get the memo that the Republican Party is now pro-child labor.,ScotTheDuck,2025-05-08T11:05:31,23
"Since it is Josh Hawley, I’d guess he’s investigating how they do it, so he can tell other companies how it works.",jamiegal,2025-05-08T12:03:38,6
The kids yearn for the meat grinder. [You can't tell I'm a GenX kid](https://youtu.be/00c1hibtxRU?t=27) (risky link of the day),VonTastrophe,2025-05-08T11:11:36,3
Is it because it's a child or is it only allowed if it's McDonalds?,Objective_Aerie_2830,2025-05-08T11:32:01,3
So I’m assuming the investigation is divided up into pro and anti sides. Wonder which side republicans are on,xyz_rick,2025-05-08T11:06:15,2
"This submission source is likely to have a soft paywall. If this article is not behind a paywall please report **this comment** for “breaks r/politics rules -> custom -> ""incorrect flair"""". [More information can be found here](https://www.reddit.com/r/politics/wiki/index/#wiki_paywalls)  *I am a bot, and this action was performed automatically. Please [contact the moderators of this subreddit](/message/compose/?to=/r/politics) if you have any questions or concerns.*",AutoModerator,2025-05-08T11:02:59,1
this surprises anyone when the gop keeps rolling back protections for this exact thing?,VOIDsama,2025-05-08T11:35:54,1
Is he investigating just to find out how they got away with it so they can get more kids into dangerous jobs as soon as possible?,uhohnotafarteither,2025-05-08T14:22:30,1
Right? Florida just voted for that (probably to make up for migrant labor),Agreeable_Crow789,2025-05-08T11:08:09,3
They are going to have to choose between deporting children or child labor. They will be besides themselves with how ghoulish they get to be.,now_error_later,2025-05-08T11:14:29,3
Probably give them an award.,Worried_Pineapple823,2025-05-08T18:03:00,1
