Comment,Author,Date,Score
" As a reminder, this subreddit [is for civil discussion.](/r/politics/wiki/index#wiki_be_civil)  In general, be courteous to others. Debate/discuss/argue the merits of ideas, don't attack people. Personal insults, shill or troll accusations, hate speech, any suggestion or support of harm, violence, or death, and other rule violations can result in a permanent ban.   If you see comments in violation of our rules, please report them.   For those who have questions regarding any media outlets being posted on this subreddit, please click [here](https://www.reddit.com/r/politics/wiki/approveddomainslist) to review our details as to our approved domains list and outlet criteria.    We are actively looking for new moderators.  If you have any interest in helping to make this subreddit a place for quality discussion, please fill out [this form](https://docs.google.com/forms/d/1y2swHD0KXFhStGFjW6k54r9iuMjzcFqDIVwuvdLBjSA).    ***   *I am a bot, and this action was performed automatically. Please [contact the moderators of this subreddit](/message/compose/?to=/r/politics) if you have any questions or concerns.*",AutoModerator,2025-05-09T17:09:07,1
Trump is making it unaffordable to live.,Reviews-From-Me,2025-05-09T17:31:12,7
I hope my shitbox can make it until Trump crashes the economy,Zarathruster_,2025-05-09T20:38:16,1
That's the plan. Bleed the stone.  They view the US as a piggybank ready to be broken open.,No_Anxiety285,2025-05-09T18:25:55,4
I have late May as the collapse.,surrender0monkey,2025-05-09T21:04:29,3
