Comment,Author,Date,Score
" As a reminder, this subreddit [is for civil discussion.](/r/politics/wiki/index#wiki_be_civil)  In general, be courteous to others. Debate/discuss/argue the merits of ideas, don't attack people. Personal insults, shill or troll accusations, hate speech, any suggestion or support of harm, violence, or death, and other rule violations can result in a permanent ban.   If you see comments in violation of our rules, please report them.   For those who have questions regarding any media outlets being posted on this subreddit, please click [here](https://www.reddit.com/r/politics/wiki/approveddomainslist) to review our details as to our approved domains list and outlet criteria.    We are actively looking for new moderators.  If you have any interest in helping to make this subreddit a place for quality discussion, please fill out [this form](https://docs.google.com/forms/d/1y2swHD0KXFhStGFjW6k54r9iuMjzcFqDIVwuvdLBjSA).    ***   *I am a bot, and this action was performed automatically. Please [contact the moderators of this subreddit](/message/compose/?to=/r/politics) if you have any questions or concerns.*",AutoModerator,2025-05-01T14:08:24,1
"ANALYSIS: National security adviser’s reassignment is just as much a victory for some Trump loyalists as it is an acknowledgment of his mistakes, writes John Bowden  Read more here: [https://www.independent.co.uk/news/world/americas/us-politics/trump-waltz-hegseth-signal-white-house-b2743293.html](https://www.independent.co.uk/news/world/americas/us-politics/trump-waltz-hegseth-signal-white-house-b2743293.html)",theindependentonline,2025-05-01T14:09:35,2
I thought trump wasnt in favor of this kind of job security for government employees? Whatever happened to that MAGATs?,DoubtSubstantial5440,2025-05-01T14:12:19,2
I'm happy with this because it tees Rubio up on a known sandtrap. Little Marco has one foot in quicksand. Don't stick your tongue in crazy.,mzieg,2025-05-01T14:11:50,1
All that ass kissing yesterday just to get the boot the next day.,LiveZumbi,2025-05-01T14:14:00,0
This isn’t baseball…,acid-jazz,2025-05-01T15:19:51,0
