Comment,Author,Date,Score
"[A reminder for everyone](https://www.reddit.com/r/PoliticalDiscussion/comments/4479er/rules_explanations_and_reminders/). This is a subreddit for genuine discussion:  * Please keep it civil. Report rulebreaking comments for moderator review. * Don't post low effort comments like joke threads, memes, slogans, or links without context. * Help prevent this subreddit from becoming an echo chamber. Please don't downvote comments with which you disagree.  Violators will be fed to the bear.  ---  *I am a bot, and this action was performed automatically. Please [contact the moderators of this subreddit](/message/compose/?to=/r/PoliticalDiscussion) if you have any questions or concerns.*",AutoModerator,2025-03-08T08:21:28,1
"Income inequality across borders and the prospect of a better life.  The salary of low paying jobs in developed nations could easily be multiples of what they earned in their previous countries.   The fastest way to reduce these illegal immigration would be to increase the economic condition of their home countries. However, that's easier said than done.",65726973616769747461,2025-03-09T00:22:09,63
We don't go after the people who hire them.  Most European countries you have to have proper papers to work anywhere and most uphold it.     And of course to make their countries better economically too.,Studio-Empress12,2025-03-09T08:21:45,6
"The root causes are global inequality and instability in other nations.    I.e. people wanting to migrate to escape poverty, operation or just seek better economic opportunities     There is no quick fix to these issues but some long term solutions are removing trade barriers for developing nations and increasing foreign aid.    There are no quick fixes for the root causes. Even the long term solutions won't guarantee a improvements in every nation.   Making illegal immigration difficult with stronger border protections is a solution... but not for the root causes",Joshau-k,2025-03-09T00:59:10,5
"Jobs. Bottom line. They all know this would end, or at the very least be minimal, if these owners and officers of corporations start going to prison for hiring undocumented workers. These fines are slaps on the wrist. Fines only hurt poor people.",rbrt115,2025-03-09T10:23:22,5
"Try American foreign policy whereupon ‘we’ went into countries in Latin, South & Central America & destabilized their political, social & economic spheres. It only makes sense that they would then hazard a journey to the US doorstep. Also, try refugee versus “illegal immigrant.” No one leaves their country via foot strictly for better currency terms.",SalomeMoreau,2025-03-08T23:41:00,30
"In the US, it is that it is just not possible for working class workers (eg in agriculture, construction and cleaning services) to immigrate legally. There are no legal ways to immigrate. And the only legal way to apply for asylum is to be on US soil, so people cross the border and turn themselves in to authorities to be able to apply, but the GOP keeps reducing the number of asylum judges so nobody can get their case heard.  So what needs to happen is the laws need to change to allow workers to immigrate.",Baselines_shift,2025-03-08T23:37:45,19
"The root cause is the different in pay that someone can make by illegally crossing the boarder. There are not a lot of Americans trying to sneak into Canada because there isn't a big difference in pay. However if for some reason wages in Canadian were 10x what they are in the US you'd have a ton of people trying to get in illegally.  Obviously the US don't want to make that difference smaller by making the US poorer so the only other option would be to make the countries that are the sources of illegal immigrants better places to live. Things like investment, financial aid, and security assistance against cartels to these countries would help.",informat7,2025-03-08T23:13:07,17
"Years ago before we closed the southern border, Mexicans would come north for work and then go home for the season. No problem. People don't come here to be criminals, generally. 99% come here for a better life--they want to work and raise their kids somewhere safe and with opportunity. If they had that at home, they'd prefer to stay there. I mean, consider what it would take for you to take you family and a few belongings on your back and walk to Guatemala? Wouldn't you rather stay here?",johnbro27,2025-03-09T10:08:52,3
"I’d be willing bet good money that most immigrants who don’t have papers would prefer to live in the country with proper documentation.  Most people come to the country to make a living, and most of these bureaucratic barriers  we erected to make sure that only the “right people” are coming in just encourage more people to be undocumented. From mandatory wait periods to long applications and restrictions on where you can live and work, it just doesn’t make much financial and logistical sense to go the legal route.  President Trump recently offered a solution that I really like. He said that you can just skip all of that process and buy a green card, or “gold card,” as he called it. Now that we’ve established the political will to reduce unnecessary bureaucracy and effort, maybe we can also reduce the price of said gold card to like $20 or something.",BuzzBadpants,2025-03-09T11:21:46,3
">However, there must root causes which drive people to undertake such dramatic risks to cross heavily guarded borders illegally, and then continue evade capture from authorities while hiding in the country.   I should point out that this is not the only way illegal immigration happens... If you go to Asia, especially South East Asia you will also see white people living and working illegally.   They didn't cross a boarder, but used the power of their foreign passport to get in by plane, and simply never left.   My point is that illegal immigration is a much deeper issue than simply what you see on TV. Even countries like Vietnam, where people enter and overstay in other countries, also have inbound illegal immigrants.",Eclipsed830,2025-03-09T00:08:42,5
"Make it illegal to employ them, with a reasonable fine. Problem solved INSTANTLY, BUT the REPUBLICANS are against that - for good reason - where would they get their cheap labor? Instead they have consistantly pushed for lower fines and no fine if 'corrected,' when all they have to do to not make the 'error' in the first place is to do a routine employment check like most industries do.",Intraluminal,2025-03-08T23:57:14,8
The root cause is that the wage for even an under the table illegal worker in a developed nation exceeds a middle class wage in their nation of origin. As such there are four ways i can see of stopping it.    Help develop the nations of origin so there economies and wages improve to the point emigrating isn't such a big inprovement to earnings.      Destroy the economy of the developed country to the point wages fall to match that of the country of origin.      Make all such immigration legal from those countries.      Extreme border controls where every land and port is patrolled 24/7 along witthe complete removal of visas or other means of legal travel to the country of origin.,Prasiatko,2025-03-09T09:44:00,2
"The root cause for the illegal immigration from south of the border to the United States dates back to Ronald Reagans Central American policies and regime changes that he and the CIA orchestrated to make the governments more favorable to the United States.  His policies collapsed Central American governments and caused the drug cartels to flourish which caused other problems for the United States.  In the end the people who lived in these countries saw their way of life disappear and in many places if they didn't work for the drug cartels their life expectancy was only 22 years, so as a matter of survival the United States offered a better way of life and they went for it.",Falcon3492,2025-03-09T12:05:26,2
The simplest fix is to make employers comply with the law. They should be using E-Verify,LolaSupreme19,2025-03-09T12:41:55,2
"1. the government (federal and local) being soft on preventing/removing them  2. employers hiring them, and the government (federal and local) not doing enough to detect this / punish these employers to make the risk not worth the reward.  at the end of the day, it all boils down to a risk/reward proposition, and the government traditionally hasn't offered enough risk to do dissuade the reward (and  in many cases has done the opposite, putting their thumb on the reward side of the scale)",reaper527,2025-03-09T14:13:52,2
There is close to 400 million people in the US. There is about 11-13 million illegal immigrants in the US currently. I honestly dont think illegal immigrants are the cause of many of the problems that the republicans are blaming them for.,EnvironmentalCook520,2025-03-10T17:19:49,2
"Poor living conditions in Latin American countries. Many of them caused by American imperialism, acting to destabilize countries that democratically elect socialist/communist leaders.  But not all of them.  If the US can improve living conditions in Latin American countries, immigration would slow.   But there’s a big issue with the cartels, that exist perpetually because of the massive illicit drug market in the US.",Y0___0Y,2025-03-09T01:10:09,5
">So, what are these root causes?  Borders.  It sounds glib but there has been ""illegal immigration"" for as long as humanity has had things that we could call borders.   People move around. It's what we do. We move in response to weather, changes in life circumstances, economic opportunities, educational opportunities, etc.   North Korea has a virtual shoot on sight policy for their border and yet even they have recognized that you can't really stop people from hopping the border and there are actually benefits to letting people get away with it. There's a relatively free flow of goods and information over the North Korean-Chinese border and North Korea tolerates this to a degree.  If North Korea has decided to give up on a strict border policy, it's pretty much pointless to pursue it.",HeloRising,2025-03-08T21:19:29,4
"Many people come into the US through legal ports of entry and then overstay their work/tourist/education visa. Others are refugees fleeing conflict from all over the world. I met an immigrant who came here from Ecuador with her children after her husband was kidnapped by gangs. Others seek a better life/jobs/opportunities. I think a big reason why people are ""illegal"" goes back to the 1996 law the IIRAIRA. I wrote about this in a post on the ezra klein subreddit: [https://www.reddit.com/r/ezraklein/comments/1j28bs0/a\_case\_study\_in\_bureaucratic\_stupidity/](https://www.reddit.com/r/ezraklein/comments/1j28bs0/a_case_study_in_bureaucratic_stupidity/) . In essence the reason that people are ""illegal"" is we passed laws making it impossible for people, many of whom have been in the US for decades, to ever become ""legal"" by changing the law in three ways:  1. Prior to the passage of the IIRAIRA, the Attorney General could “exercise discretion to grant suspension of deportation to an individual who established seven years continuous physical presence in the U.S., good moral character during that period, and that deportation would result in extreme hardship to the individual or to his or her spouse, parent, or child who was a US citizen or lawful permanent resident.” However, the IIRAIRA limited the number of undocumented immigrants who could be granted “cancellation of removal” to 4,000 a year. While one can imagine that it was a form of ritual humiliation to prove to some government functionary your good moral character and the hardship that would be caused by your deportation, limiting discretion of government agents to make an exception of your case made the situation infinitely worse. 2. Immigrants who overstayed their visa were barred from entering the US for a set period of time (3 years if they overstayed between 180 and 365 days and 10 year if they overstayed for more than a year). This made it so that people couldn’t return to their countries of origin to apply for legal status without a major disruption to their lives. 3. Finally, undocumented immigrants in the US could no longer apply for legal status.  This basically trapped people in the US because it was better to stay then to go home and risk not being able to come back to the US for 10 years.",matt-the-dickhead,2025-03-09T00:45:25,2
Ive been running to the border uncontrollably since the 90s.. taco bell im lookin at you.,wentzr1976,2025-03-09T00:27:43,1
"People living in countries not very well managed. The first thing to do about it is to make the own, hopefully better managed country being a good example and in every way behave like a good citizen and asking that of every citizen in the country where one live. Of course some monetary help might be neeeded, but the people in all of the world need to get out of bad religious, tribal and family patterns and need to be good citizens working hard. This then needs to go all the way up to governments acting responsible with no corruption. Venezuela being as bad an example as Argentina.",Karakoima,2025-03-09T04:06:45,1
"The causes are things like instability, persecution, danger, or lack of opportunity in their home country. If people could do as well staying put, they generally would.   Ironically, what could be done to address it long term includes things like programs to increase stability in those countries which is what Harris' ""border czar"" responsibilities actually were and which seemed likely to produce some success in the long term except that they are now being cut along with everything else related to foreign aid by trump.",KitchenBomber,2025-03-09T07:16:19,1
I wonder if the UN has anything to do with it.  https://www.un.org/development/desa/pd/sites/www.un.org.development.desa.pd/files/unpd-egm_200010_un_2001_replacementmigration.pdf,FollowingVast1503,2025-03-09T07:17:13,1
"If US citizens stopped doing drugs like cocaine, there would be less hell in Central American countries, and therefore less illegal immigration.   Some say it would be better to simply legalize dugs, but I don’t know the data on that.",CaspinLange,2025-03-09T11:36:43,1
"This question can be entered in one of two contexts: The *literal* reason, as in ""why does anyone want to immigrant in the first place?"" With the answer obviously being income inequality and a want for economic and social mobility. And then there's the **logistics** reason, as in ""why are people choosing to enter illegally rather than legally?"" Which has gone drastically unaddressed by the popular public.  The latter question is something that can more easily be addressed. The backlog of migrant cases is in the thousands, with judges understaffed to take them. Many of these migrants are legitimate refugees that aren't being addressed through our system, and even the non-refugees are a net benefit to the country since they follow laws, pay income taxes, and contribute to our economy in nearly every metric. There's also no economic benefit in NOT legalizing them, when we have plenty of financial incentive to do so.  The problem is that our citizens ignorantly assume that our legal processes are perfectly fine, without realizing that if you're not Cuban/Indian, the wait lines take decades since we have country caps on the number of legal applicants we accept. People who cross the border and people applying can wait up to a decade for legal residency. THAT is the main reason immigrants are illegal, its not a lack of effort on their own parts, just a consequence to an overburdened understaffed bureaucracy.  The message democrats need to emphasize is ""Fix LEGAL immigration"" to fight illegal immigration. This is the most unnecessary humanitarian issue that could exist. But when its framed as solely an ethical dilemma rather than a practical solution, the argument and focus shifts towards allowing the continuation of illegal immigration, rather than highlighting a reasonable pathway to legal residency and citizenship.",illegalmorality,2025-03-09T11:42:18,1
"Yeah it’s called capitalism and American Imperialism  Corporations want cheap resources and access to the globe, the American Government wants money and land, so they help eachother - look up how we got the saying “a Banana Republic”. We are routinely doing coups on governments that try to nationalize their own resources out of America’s control - we can look to chile, Iran, Guatemala or any other country we’ve had a hand in destabilizing.   Bombing families, destroying their governments, and driving climate change has largely contributed to people having to flee their homes. And you’re a lot less likely to get bombed if you live in the country doing the bombing (you might still get bombed tho, we’ve bombed our own citizens before)  The sad reality is that capitalism NEEDS immigrants or else it wouldn’t be able to sustain itself.   The cost of living in capitalism is always kept at a level so that workers feel like things are scarce and so they feel desperate for ANY work they can find. Why? So capitalists can pay you the least amount possible for your labor while asking you to work more. Because if we don’t work in capitalism, we get made homeless, and we DIE. It’s work, or you die. That’s the coercion of labor, you work or you die. Capitalists are aware of this and use it to continually exploit workers  This economic environment leaves workers feeling like they’re too poor to have children, so they don’t. They work and try to save what little money they can. Those few workers that CAN afford to have kids are in such small amount that it can’t replace the workforce that society requires to function. So we have a constantly shrinking population that’s continuously consolidating wealth to the top, leaving very little for everyone at the bottom to share amongst themselves.   So since people aren’t afforded enough to live, they don’t have kids - society and capitalists have seen this problem and decided the solution is immigrants. Make more of them and demonize them to maintain economic control and the status quo  Capitalists rely on immigrants to act as a scapegoat for peoples economic problems, while also using them to drive down the wages of workers. This also allows capitalists to exert more control over and exploit these workers more than an average worker, because of the threat of deportation.   Wanna stop immigrants coming to your country? Stop bombing countries and doing coups on their governments. Have worker unions take control of industries and allow democracy into the workplace, get good pay and working conditions for everyone regardless of citizenship. Stop enabling the shit that’s driving climate change.",WinnieThePooPoo73,2025-03-09T12:16:59,1
"You want a really counterfactual discussion. Just open the borders, until WWII the default state for all time was open borders. They were only closed during war time. Partially because the cost of helping a militarized border wasn't worth it.    The US and other countries are about to have a demographics crisis. Keeping more people now is probably the best strategy.   Of course this is not a political reality, but the default assumption is that borders have to be closed for no particular reason.",metarinka,2025-03-09T13:17:13,1
We should compare the USA with countries that have little or no undocumented immigration and see what they’re doing that the USA is not.  What’s the undocumented immigration situation in Venezuela or Cuba?,baxterstate,2025-03-09T15:38:52,1
cause: poor economic conditions to the south of us in the same hemisphere.  we can we do: provide aid to these other countries to lift up the quality of life there and minimize the pressure to migrate.  but the right doesn't want to do that and dems only want to do it if they can profit from it.,skyfishgoo,2025-03-09T16:35:34,1
"Well first, stop with all the racism and bias by saying things like ""illegal immigration"". Trying to come to the US isn't illegal.    It doesn't take much to figure out why people are leaving their homes but let's go at a very high level: They want a better life. What makes a better life? Safety, having a sustainable income, being politically safe, access to health care and education, not having Russia bomb your home, not having terrorists kill your leaders.  We in the US can't solve our own internal problems. While we are so divided as a country, with so much racism and hate, I doubt we can help anyone else outside the US. Seriously. Who would want our input now?  What we can do is start treating migrants with compassion. Stop firing immigration judges and instead, expand the ability to obtain Visas and Green Cards. Help people with paths toward documentation. They will be able to find jobs, housing, pay taxes. Isn't this what the US was founded on? When I was in school, I was taught the US was ""the melting pot"" of the world. I was proud of that blended history. We should ask ourselves instead, what would it take to return (or even become) that country where people can feel welcomed and have a better life?",Sufficient-Opposite3,2025-03-10T07:17:40,1
"The root causes of peoples desperate attempts to flee in to a country illegally are simple.  It's desperation.  Where they're coming from is either impovrished, oppressive and/or war torn and they need to head somewhere else and fast.  Trying to help create more stability in countries around the world could help all of us, including matters of illegal immigration.",RamJamR,2025-03-10T12:34:17,1
"Addressing root cause it's sexy so it gets no headlines, and is often vilified as not fast enough or strong enough - but is the only thing for the long term to help.   This article gives zero credit to until the end, but highlights some of the efforts the administration did to actually work on root causes.   https://www.nbcnews.com/investigations/kamala-harris-border-policy-rcna163317",WeakRelation1,2025-03-10T13:05:58,1
"Global poverty is the major cause, followed by violence, which of course traces back to poverty....sooo",invltrycuck,2025-03-10T13:20:45,1
"Their country is shitty... our country is better.  But don't worry, the USA is fast becoming the shit-hole it deserves.  Mexico and Canada lookin' pretty good right now.",I_compleat_me,2025-03-10T18:58:27,1
"There's only one:  50 years of Republican obstruction on comprehensive immigration reform.  Yours truly, a former U.S. Immigration employee (criminal fugitive alien apprehension unit).",PreviousAvocado9967,2025-03-12T00:33:17,1
"Overpopulation for limited natural resources. World population has tripled in my 77 years. Before Covid we were adding an unprecedented billion (one thousand million) people every 12 years!  Cartels, poverty, violence, corruption? Small, overcrowded planet. Think rats in a barrel. It’s really food and clean water. We haven’t seen anything yet",Positive_Thought8494,2025-03-12T11:08:29,1
"The illegal part? Because the legal way doesn't work and overcomplicated so much so you would give up instead. Nobody can wait years to find out they might be allowed.   They are not choosing to be second class citizens and work borderline slave labour for pennies just for fun. Legal immigration is not accessible, on purpose. It's designed to make you miserable  Also most of them go there legally and simple stay there after their papers expire. Because let's be honest, why wouldn't they?  The exploitation of the global south fuels this entire thing, of course people will also drift in the same ways, to the north",Palanki96,2025-03-09T05:28:57,1
"Make it vastly easier for people around the world to legally migrate between countries. People should generally be allowed to live and work where they want to. If countries, including those of more authoritarian leanings, don't want to lose their best and brightest, they'll be incentivized to actually improve conditions at home.",Mjolnir2000,2025-03-09T05:49:35,1
"I would fault the following:   1. The ability to be employed and earn a living in the country they immigrated to.   2. The ability for their children to obtain citizenship in the country they immigrated to (birthright citizenship).   3. The ability to receive social services in the country they immigrated to.    4. The ability for their children to obtain a ""free"" education in the country they immigrated to.     Illegal immigration would be significantly reduced once illegal employment is strictly enforced and birth right citizenship is no longer allowed.",SlowFreddy,2025-03-09T00:19:02,0
Te political parties involved . In the US it’s GOP who projects to champion the idea of real border security but on all actuality they are the reasons that our borders are what they are now. Chaos is a ladder and the parties climb both sides.,SirMasterDrew,2025-03-09T03:01:42,0
