Comment,Author,Date,Score"Normally when you analyse migration you analyse push and pull factors, so factors that are negative in your country and factors that you desire in other countrys. Speaking of ""illegal migration"" is in my opinion always a bad thing, you should only speak of migration, because people tend to stygmatise other people who are called illegal. It is also a relevant fact that most of migration in total is migration in the own country. This are long story short root causes  So I suppose that you want to adress the migration to another country. I would claim that in this case you have both, push and pull. For example in south america the people want to get away from the disparities that cause social tension. The ""criminal drug dealing gangs"" are a problem for those people as well. Because the people know that it could be possible to migrate to the US they might try that, also because ths US stands for prosperity in their minds.  Now lets imagine there would be a better social and political situation in those south american countrys (most of them actually are not mexico). Would people still migrate? Not that much for sure, there would still be regular migration (to study in the US, to work in the US, tourism). Many of those people might not stay and most importantly: They all have a social status. They have an income or the parents have to be wealthy. But this is not the part you would call ""illegal immigrants"", would you? Certainly not, because there are visa for these possible causes of ""migration"".  You probably mean people without a social status who hope for a better life in America, who dont have (at least a perspective for) a social status. Those people are most of the times poor, they have nothing. When they come to the US the social problems of the US start to get relevant: People without a job have to work anywhere without a proper ""apprenticeship"" and have to live in a segregated part of the city, because their income is not really high, because they are working informal. There might also be the problem of language barrier, but I suppose that you can get along with spanish pretty well in the border states, espacially in the segregated parts of certain citys.  But you ask for my opinion: Because it is nearly impossible to limit push factors with a capitalist midset (the thing you actually asked for; Well I would guess that you have to imprison any poor person or do actual socialist policys) and because it is not really a positive pull factor that segregation in the US is better than living in another city in south America I would try to improve the situation in the US, so that the segregation does not lead to bigger problems and that people may work regulary in good jobs. In my opinion local somehow unions with integrated migrants, political interested people and new migrants should form to provide aid to one another, because the US government does not do it, and to be realistic, wont do it, even though governmental funding for these unions would probably be a good thing. I suppose that a stop of stygmatisation and a more liberal migration law could also help, something like a ""provisionally citicenship"" that grants the same rights and stability for everyone who would like to stay in the US for their life.",Lauchiger-lachs,2025-03-09T03:07:41,0
"Lots of things can be done but most of them are expensive and or 'woke' like help keep them out of the US by aiding and improving the economy where they come from. Also, nobody goes after the companies that hire them.   As long as them big farms and other types of companies keep hiring them with without any consequences the 'problem' is not going to get 'solved'",maybeafarmer,2025-03-09T07:46:17,0
"We built an amazing country -- one which has stood head and shoulders above the rest as the best guardian of ""minority"" rights every single day for 250 years.  Some people are grateful for that -- particularly those who have experienced what it's like to be a ""minority"" anywhere else. But unfortunately, some people are *hateful* about that, because they see America as not looking ""like them.""",the_very_pants,2025-03-09T08:16:36,0
"This ""border"" you speak of is a construct of white Europeans having migrated as Vikings around  1003.  People of color were thought to have migrated to and thrived over 10 thousand years ago to North America.  Earlier migrations of over 130 thousand years have recently been discovered.  Google ""Exploration of North America"" on wiki. The root cause of illegal immigration is your narrow perspective.",OldAngryWhiteMan,2025-03-09T01:11:03,-2
"Seems like the plan we're going with is to bring down our standard of living, so that it's not worth coming here",murdock-b,2025-03-09T08:37:42,15
"We could also make sure that our foreign policy doesn't include destabilizing governments. History is dominoes, and we've got a history of playing fast and loose in central America at least as far back as the Banana Wars.",FuzzyMcBitty,2025-03-09T08:02:19,24
but that would make you a globalist who cares about people that aren’t american! how dare you want everyone to have equal opportunity if they aren’t a citizen of our great country,tryingnottocryatwork,2025-03-09T09:41:38,6
"The fastest way to reduce illegal immigration would be to increase legal immigration. Right now, even if you're a young and healthy worker, it's incredibly difficult to move to the US from Guatemala and work legally. The number of legal slots is much lower than the number of people who want to move. If we just let people move here legally, then illegal immigration would decrease sharply.",meelar,2025-03-09T11:51:53,5
"I think this is part of it, but there are other factors in play.  First, if someone does manage to cross the border, they'll document how they did it for others to copy. Second, they'll have an extended network of friends and family back home who they'll work tirelessly to bring over. Finally, there are many business owners who appreciate the cheap labor and will look the other way, which fuels the whole process, and round it goes.  This state of affairs isn't a failure of policy, it's an intended effect. This is where things get counter-intuitive. The right benefits *massively* from immigration. Not in the rank-and-file, but at the top. Besides reliably winning them elections as we've seen, it benefits many right-leaning business owners due to cheap, unregulated labor.  I predict therefore that if the left ever somehow managed to flip-flop and drive an effort to *actually reduce* illegal immigration, there would be a panic and we'd see some really *weird shit* happen in right-wing politics.",greim,2025-03-09T17:00:38,2
"It's the ""easier said than done"" part that's interesting to me. Seems like that's where the correct policy prescriptions would be.",Storymode-Chronicles,2025-03-09T10:53:22,1
"it's not as hard as it seems, as long as we don't let republicans try and sabotage it every chance they get and we don't let dems line the pocket with ""favors"" for doing it.",skyfishgoo,2025-03-09T16:37:25,1
Probably not just economy. I'm guessing the number of people illegally immigrating from El Salvador has dropped since the murder rate went from super high to actually quite low.  Edit: finding it hard to find data on this since it only happened in the last handful of years  Edit2: okay looks like it indeed is down since 2020 - https://www.statista.com/statistics/1392885/migration-rate-el-salvador/,LLJKCicero,2025-03-14T14:12:36,1
"Latin and south America are fucked up because of Spanish colonial practices not American interference. Countries that the US ""interfered with"" were unstable long before there was any interference.",getawarrantfedboi,2025-03-09T21:55:59,5
"So, what can we do about it now? Assuming we've identified the issue here, what is the solution?",Storymode-Chronicles,2025-03-09T10:58:36,2
"Not true on the last bit you mentioned.   A lot of people leave their country for better currency. That's why so many Africans and Middle Eastern people immigrate to Europe, so many Latin Americans immigrate to the US/Canada, and why so many Filipinos and Indonesians immigrate to Singapore/Korea/Japan.  There are people in all of these countries who are multimillionaires and a lot of them move to make even more money. They have no concern for safety in their home countries, because they have the capital to permanently ensure safety.",Pale-Candidate8860,2025-03-08T23:59:10,-2
"I thought that former VP Kamala H. was going to dig into the possible causes and fix, or at least propose solutions?  You know, draw some Venn diagrams displaying, like: you know, Venezuelan gangs, able citizens slipping into Columbia because socialism is so wonderful a la Chavez / Maduro; rationale for attempting to claim global-warming (oops, pardon me), …climate change (which is a hedge) as a cause of immigration & you never have to be wrong because it describe, essentially ALL weather events, but I digress.",WATGGU,2025-03-09T12:47:05,1
No true.   There are special visas available.  The problem is volume and the fact that native populations as a whole don't want to work in those jobs.   https://www.uscis.gov/working-in-the-united-states/temporary-workers/h-2a-temporary-agricultural-workers,JKlerk,2025-03-09T08:08:01,6
"This is the answer. A lot of the other comments seem to be trying to explain immigration, and miss the part about illegal.  The root cause of *illegal* immigration is the difficulty of *legal* immigration, and the solution is to make legal immigration easier/possible for most people who want to immigrate.",gravity_kills,2025-03-09T06:07:10,9
Still doesn't seem to address why it is so important to these people to leave their homes and family to risk such a journey. There must be a deeper root cause then.,Storymode-Chronicles,2025-03-09T11:02:33,1
">Obviously the US don't want to make that difference smaller by making the US poorer so the only other option would be to make the countries that are the sources of illegal immigrants better places to live. Things like investment, financial aid, and security assistance against cartels to these countries would help.  That's exactly why USAID is a great investment, and why Trump allegedly trying to cut costs, is sending us backwards.",satyrday12,2025-03-09T06:59:39,8
There is one other option outside of making the US worse or the home country better: open up legal pathways and give them legal ways to immigrate.  That's really our root problem right now: too many people want to come and not enough legal pathways are available to them.,link3945,2025-03-09T04:05:37,4
"Your whole second paragraph starts with a false premise. If we wanted to keep the US from getting poorer, we'd see a minimum wage tied to inflation, and robust safety nets.",murdock-b,2025-03-09T08:41:12,1
"Comrade. I like you, but let's please back up.  > There are not a lot of Americans trying to sneak into Canadian  That's not a country.  > However if for some reason wages in Canadian were 10x what they are in the US  Russian bots",kinkgirlwriter,2025-03-09T01:17:10,-13
"I'm not sure Trump would agree that $20 guarantees the ""right people"" are coming in. It seems at though his ""gold card"" proposal exclusively targets the top 0.01% of wealthy immigrants. $20 seems like you're essentially arguing for an open border?  Otherwise, we still need to address why these people want to leave their home and family behind to risk their life and freedom to cross a border.",Storymode-Chronicles,2025-03-09T11:42:41,1
"It is illegal.  Every employee is required to fill out an I9 to prove their eligibility to work. Employers are generally following the law in this regard, there's just not a good mechanism to catch fraud.",Dr_thri11,2025-03-09T09:28:18,2
How does that address the root cause of why immigrants find one country so preferable that they are willing to risk their lives to live there illegally?,Storymode-Chronicles,2025-03-09T11:09:22,1
">Many of them caused by American imperialism  Have you read *Why Nations Fail*? The authors argue that Latin American countries were essentially ""designed"" to be poor because of the way they were exploited by Spain.",Eminence_grizzly,2025-03-09T04:03:09,8
"It's well-known among backpackers that SE Asia, South Asia and most other regions are safer than Latin America. You'd have to be doing something really stupid, or be very unlucky to be mugged in Bangkok. A big reason Latin America isn't as safe as it could be is drug trafficking and all the violence over territory it brings. Drug production and trafficking in Latin America is mostly caused by the market in the US.  Sadly, remedies that could actually alleviate the situation like ending the war on drugs, funding drug addiction research, decriminalization of some drugs, and legalization of marijuana are not politically feasible.",Def_Surrounds_Us,2025-03-09T05:11:58,2
"Ok, but what can we materially do to ""improve living conditions in Latin American countries""?",Storymode-Chronicles,2025-03-09T11:11:26,1
"No, I get that. Ideally, if there were no borders then each country's policy would act like a ""free market"" for immigration. So, it would incentivize the elite in each country to make policy which keeps consumers inside their borders by choice, rather than necessity. Unfortunately, this is rather an all-or-nothing solution. It only really works within territorial blocs which have agreed to mutually open their borders, unions such as the EU and US which create open immigration between states within expanded borders.  There is a wide chasm between that and North Korea maintaining a shoot on sight policy at their borders with another relatively closed dictatorship while tacitly accepting there is still some amount of illegal immigration they will not be able to fully control, and may in fact have some benefits. People who are not willing to risk death or imprisonment are still unlikely to test their luck across a border the authorities would kill them for attempting to cross, into a country whose authorities would imprison them simply for being there.",Storymode-Chronicles,2025-03-09T11:33:36,1
"Yeah, I don't think you're going to be able to get people to just stop liking cocaine and heroin. The best model I know of for ending a drug war was when alcohol prohibition ended, which seemed like a great success.",Storymode-Chronicles,2025-03-09T12:10:37,1
"> If US citizens stopped doing drugs like cocaine, there would be less hell in Central American countries,  or just allowed for american companies to produce/sell it, undercutting the black market as we saw with weed.  those central american / south american druglords only have the power they do because there isn't any competition in developed nations.",reaper527,2025-03-09T14:15:41,1
"The latter question may be more easily addressed, but it is the former which seems to be the root cause then. So, what can we do to help ""income inequality and a want for economic and social mobility""?",Storymode-Chronicles,2025-03-09T12:15:18,1
[deleted],[deleted],2025-03-09T03:05:26,0
130 thousand years..?,BromaEmpire,2025-03-09T03:38:31,2
"The Norse settlement failed. None of the people remained, and nothing they did had a lasting impact on the later borders. European colonial powers, yes, but not starting in 1003. And although I don't know how they managed their territory, the indigenous people of the Americas definitely recognized some kind of this-area-is-ours-and-we-get-to-say-how-things-work-in-our-place.",gravity_kills,2025-03-09T06:17:26,2
"We just elected a billionaire to the Presidency, who has hired 14 other billionaires to work in his administration. Those people are clearly not taking time off from their pursuit of enormous wealth, to serve the common people at government salaries. They're not going to change the system that made them billionaires. It seems most Americans want to live lives of desperation and economic oppression.",BluesSuedeClues,2025-03-09T09:14:05,10
"So, from a foreign policy perspective, what could we do now? Aside from just not continuing to destabilize South America causing chaos and lawlessness, what could we actively do to reverse this?",Storymode-Chronicles,2025-03-09T10:55:11,4
"Seems like even if you're instead spending your efforts toppling foreign governments to replace them with regimes you believe will give you more favorable trade terms, that's still globalist? Just much a more antagonistic globalism.",Storymode-Chronicles,2025-03-09T10:57:39,1
There are so many people that want to do that. The US would become latin america in a few years. No thanks!,Big_Black_Clock_____,2025-03-14T04:42:28,0
"We literally installed multiple brutal dictators in South America.  In Argentina, military forces overthrew the democratically elected President Isabel Perón in the 1976 Argentine coup d'état, starting the military dictatorship of General Jorge Rafael Videla. The coup was accepted and tacitly supported by the Ford administration and the U.S. government had close relations with the ensuing authoritarian regime, with U.S. Secretary of State Henry Kissinger paying several official visits to Argentina.  The US government supported the 1971 coup led by General Hugo Banzer that toppled President Juan José Torres of Bolivia. Torres had displeased Washington by convening an ""Asamblea del Pueblo"" (Assembly of the Town), in which representatives of specific proletarian sectors of society were represented (miners, unionized teachers, students, peasants), and more generally by leading the country in what was perceived as a left wing direction. Banzer hatched a bloody military uprising starting on August 18, 1971, that succeeded in taking the reins of power by August 22, 1971.  Brazil experienced several decades of authoritarian governments, especially after the US-backed 1964 Brazilian coup d'état against social democrat João Goulart. Under then-President John F. Kennedy, the US sought to ""prevent Brazil from becoming another China or Cuba"", a policy which was carried forward under Lyndon B. Johnson and which led to US military support for the coup in April 1964.  After the democratic election of President Salvador Allende in 1970, an economic war ordered by President Richard Nixon, among other things, caused the 1973 Chilean coup d'état with the involvement of the CIA due to Allende's democratic socialist leanings. What followed was the decades-long US-backed military dictatorship of Augusto Pinochet.  This is just a few examples. Cuba, Venezula, Haiti, Panama. The list goes on. We literally had a school, The School of The Americas in Panama, where we trained South American military personnel to do this. Nearly a dozen South American dictators were graduates.",Upstairs-Scratch-927,2025-03-11T11:13:13,3
It's always possible to make a bad situation worse.,ColossusOfChoads,2025-03-14T03:15:19,1
"""Some other guy punched him in the face before I got there, your honor! How can I possibly be responsible for beating him up some more after that?""",kottabaz,2025-03-11T09:44:55,1
"It’s not as simple as merely fixing something that we broke. Much like Trump is doing to the US now — destruction takes seconds, rebuilding lasts a lifetime. A good first step would be to acknowledge the harm we caused & treat people crossing the Southern Border with humanity & respect.",SalomeMoreau,2025-03-09T17:56:25,3
Harris' plan was to create economic opportunities in the countries that people were leaving. [Progress on Central America Forward - United States Department of State](https://www.state.gov/progress-on-central-america-forward)  Programs like that could make leaving your home country less desirable.,Matt2_ASC,2025-03-11T18:22:35,1
"If they are multimillionaires, why would they have to immigrate illegally?",actualgoals,2025-03-09T03:01:05,10
"Millionaires are only 1% of the population, it seems highly unlikely they represent a significant portion of illegal immigration.",Storymode-Chronicles,2025-03-09T11:01:04,2
"The same thing could be said for bank robberies. You could reduce  bank robberies (illegally removing money from bank) by making more people have money in banks to remove.  A lot of people want to immigrate to the u.s. just like a lot of people want a bank account with a lot of money in it. But there are only so many people the u.s. can take in without causing social and economic problems.  We've already exceeding that number, not just from illegal immigration but from refugees and family-based immigration.  This isn't the 19th century when The West was still being settled. We already have the 21st century version of ""huddled masses"" in parks, shelters, encampments, etc. that we aren't doing enough to help.",jerzd00d,2025-03-09T07:18:00,6
"You have never known real poverty or violent conditions then. Sorry but there’s a breaking point for anyone where it’s just foolish to stay, whether it’s your home or not.   Also American propaganda spewing we are the best since the 1950s does tend to encourage people to come when they live in shitty conditions nearby.",KeyserSoze72,2025-03-09T11:40:03,2
That solution only further stagnates the economy in the original county as all the skill from the original countries gets drained into America ,StampMcfury,2025-03-09T07:52:20,3
"I’m arguing that everyone who wants to come in should be documented, and there should be very little barriers to do so. We want poor immigrants to come in because they form the bedrock of the economy, and it has always been that way since the founding of the country.  I don’t think anyone in modernity would point to “Ellis Island” rules and claim that they made America weak 150 years ago, so why would it be different now?",BuzzBadpants,2025-03-09T15:26:48,2
"The important part is punishing the EMPLOYERS, and that is not currently done in a significant way.",Intraluminal,2025-03-09T11:38:25,2
No job no food. You figure it out.,Intraluminal,2025-03-09T11:38:51,2
And then there’s things like until very recently Haiti was still paying reparations for ending slavery.  Around 21 billion to France.,bigmac22077,2025-03-09T06:16:20,3
">""remedies that could actually alleviate the situation like ending the war on drugs, funding drug addiction research, decriminalization of some drugs, and legalization of marijuana are not politically feasible""  Are they really not feasible though? You seem to be prescribing mainstream Criminology curriculum here.",Storymode-Chronicles,2025-03-09T11:17:05,1
USAID. Which seems to be abolished now.,Y0___0Y,2025-03-09T22:20:42,2
I think it’s an interesting idea. Probably plenty of data to look over that would point to the validity of such an approach.,CaspinLange,2025-03-09T14:36:39,1
"I feel like that's too loaded of a question. It's not our responsibility to uplift every country south of us, and it certainly isn't a practical goal. More practical would be to fix our legal system to let more people pay more taxes legally here. Not to say we can't do both, but reforming the legal system brings much more proportional benefits than investing on entire nations.",illegalmorality,2025-03-09T19:39:14,1
"Interesting.  Providing free lunches and free English as a second language in school, and free education without citizenship is not huge?    What school other country provides  free language tutors in public school for forgein speaking children?",SlowFreddy,2025-03-09T03:07:52,2
"US citizens seem to have a severe lack of understanding of how absurd an amount of money $1 billion dollars is. All of us could probably live perfectly comfortable lives with just a million dollars+interest and a single billion is a thousand millions. And the current billionaire class mostly has hundreds of billions each. Mind boggling that we allowed the disparity to get this bad.   The fact that one third of Americans seem to feel very strongly that billionaires ""earned"" their wealth and should have every right to wield that money to amass political influence to enable them to hoard even more at the expense of literally every other creature on this planet is complete insanity. It's as depressing as it is frustrating.",frisbeejesus,2025-03-09T09:24:42,12
Elon could have ended homelessness in America (He even mentioned this in 2018) with his projected wealth. Instead he used it to buy Twitter.,Shionkron,2025-03-09T10:07:18,3
">just not continuing to destabilize South America  I think that would already be incredibly effective, haha. Maybe I’m just biased, being a lefty, but I genuinely believe Latin America would be in a much better place if the U.S. hadn’t been constantly interfering with their sovereignty, installing US puppet regimes and stealing their resources.",Proper-Republic1561,2025-03-09T11:05:11,7
"I don't know, but we're currently shrinking the state department and assistance programs that help the poorest people in the world.   The current policy seems to be to ""let them deal with their own problems.""",FuzzyMcBitty,2025-03-09T11:04:57,2
A wild idea I know but I think we should fund good politicians with good pro-domestic economic ideas in other countries. We should definitely help out politicians who wish to expand the welfare state and actually reduce corruption. We could use our intelligence network to assist them in rooting out corruption and cartels. Like a reverse-coup. They don’t need to be beholden to us (we got them into this mess in the first place) but we need to help clean up the entrenched corruption of these governments that we have spent decades encouraging through espionage and shared intel.,KeyserSoze72,2025-03-09T11:34:26,2
