Comment,Author,Date,Score"I'd say that publicly acknowledging these mistakes would actually be a pretty phenomenal first step. It would open the door to dialog around reconstruction as partners, rather than adversaries. Similar to how the Marshall Plan was implemented following WW2.",Storymode-Chronicles,2025-03-09T18:30:07,2
"I was referring to immigration as a whole, not illegal immigration.",Pale-Candidate8860,2025-03-09T03:01:52,-3
"Have you ever been outside of a major city? We have tons of empty space. And in the areas that are built up, we've built very inefficiently. Unlike your bank example, we actually become better off with every person who immigrates.  Think of the international order as a massive team sport. Every person who immigrates is quitting their old team and joining our team. They make us stronger. We have more labor available for useful work, and more market capacity for the things people want to produce.  The huddled masses you imagine only exist because we refuse to use some of the available labor to build more houses. If we built to the density of Manhattan, the population of the entire planet would fit in Nevada. Obviously no one wants that, but it shows just how much room for growth we actually have.",gravity_kills,2025-03-09T07:37:22,6
">The same thing could be said for bank robberies.  Yes, in the sense that anything can be said.  You inadvertently raise a good point though, why is immigration viewed so negatively that people are willing to openly compare it to a violent crime like a bank robbery?  I would say it's professional political agitators who highlight the worst aspects of immmigration and obfuscate its benefits.",PinchesTheCrab,2025-03-09T17:30:54,2
"That's my question though. If the issue is poverty and violent conditions, what can we do from a foreign policy perspective to help alleviate those?",Storymode-Chronicles,2025-03-09T12:13:31,2
"True, it seems like solutions which incentivize prospective immigrants to prefer their country of origin would more directly address a root cause.",Storymode-Chronicles,2025-03-09T11:06:23,1
"Ah, on the contrary. I'm certain most conservatives would argue that Ellis Island was far too lenient a standard to employ today. They believe that poor people will only drain resources from the welfare state.  So, while I agree with you that immigrants on average commit less crimes and build more economically, I would definitely not say that is the norm.  Again though, this also doesn't get at how we address the poor conditions people are fleeing from.",Storymode-Chronicles,2025-03-09T17:28:50,2
If an employer has all employees fill out an I9 and submits them to the federal government they've kinda done their part. Should they do extra checks on anyone that's brown?,Dr_thri11,2025-03-09T12:05:12,3
"Ok, so how do you use foreign policy to create jobs and access to food in their native country?",Storymode-Chronicles,2025-03-09T12:11:18,1
"I don't see how he could.  The US federal government spent $67 billion on social housing in 2023 alone.  In 2021, State and local governments spent a further $65 billion.  So if we took a low estimate of $120 billion annually spent by government in the US on housing, that hasn't ""solved homelessness"", we're looking at Musk's current reported net worth of $400 billion keeping roofs over heads for three and a bit years, even if that net worth could be converted to cash.  Governments spend incredible amounts of money on all sorts of things.",EnglishTony,2025-03-09T10:30:18,4
Why is it his responsibility to take his hard earned money and fix someone else's problem that THEY made?,Pitiful-Bee6815,2025-03-14T18:27:03,1
"If you move drug addicts and mentally ill people into a house, it will shortly be trashed and they will require another one.",Big_Black_Clock_____,2025-03-14T04:33:33,1
"Yeah, agree. Seems like there might actually be some complimentary foreign policy that could be implemented though.",Storymode-Chronicles,2025-03-09T11:53:13,1
"From a lot of the answers here, ""let them deal with their own problems"" might actually be a positive change from a history of foreign policy that instead chooses to topple regimes and destabilize the region.   It has also been suggested that ending the ""war on drugs"" should be a principle solution. In this case, I believe the Mexican government has actually been open to this, which the US government has pressured them against.  So a hands-off approach could actually be an improvement. It's still interesting to think what a proactive policy to help things might actually look like.",Storymode-Chronicles,2025-03-09T11:51:57,6
"Prosperous neighbours with a good trading relationship should in theory be their own economic benefit. I do wonder if actively funding certain politicians may create a narrative of foreign corruption surrounding them though. Imagine if a US politician was found be funded by Russia or China. A lot of the narrative around Euromaidan is similar. Perhaps it would be better to just try incentivizing whoever is in power with more favorable trade relations, or US manufacturing locations?   Sharing intelligence would be good, but I do wonder if the best way to battle cartels isn't just by ending the war on drugs?",Storymode-Chronicles,2025-03-09T12:09:18,1
and you really think that multimillionaires migrating is a significant enough part of immigration as a whole to be referenced in this discussion?,FuehrerStoleMyBike,2025-03-09T08:43:42,4
"Of course there is ""empty space"".  However, much of the truly open spaces have other intended uses.  13% of the U.S. land area is Federal or State Parks or other protected areas.  39% of the U.S. land area is agricultural. Huge areas, especially the southwest, are drinking-water limited are ""empty space"".   We are certainly not ""better off with every person who immigrates"".    Such hyperbole makes it hard to even discuss.  Limited, legal immigration is generally a good thing.  But it should be obvious in your sports team analogy that the players quitting their team may not be the best players on the team.  The U.S. isn't Canada who prioritizes economic immigration, with the goal of attracting skilled workers and professionals who can contribute to the country's economy.   And that's for legal immigration.  I doubt the U.S. is getting better players off the Did Not Follow Immigration Law team whose first act was to break U.S. law.    The ""huddled masses"" referenced don't just exist because there aren't enough houses.  The reasons include but aren't limited to substance addiction, mental illness, job loss, etc.  A quarter of Americans live paycheck to paycheck (95% to necessities).",jerzd00d,2025-03-09T10:13:31,7
"> Every person who immigrates is quitting their old team and joining our team. They make us stronger.  This is complicated, though. Do they see themselves as joining our team, or do they see America as a place that they can fight for their team to win? (Imho the degree to which people cling to inherently nonsensical notions like ""there's X races/colors"" is evidence of the latter.)  Like everybody else in the world, Americans want neighbors who will sacrifice and fight for them, not just neighbors who are technically contributing to the economy but who feel no connections/attachment.",the_very_pants,2025-03-09T09:22:33,5
"Well let’s work backwards here. What policies did we adopt that helped to impoverish those countries in the first place? When certain countries tried to nationalize their own resources we stepped in and either invaded or backed coups or political oppositions to these moves. So we should back movements that will help the economies of these places, and not just back the American corporations who extract the wealth of these places leaving pennies for the locals. Fund movements to uproot corruption and pool our intel on criminal organizations like cartels and trafficking networks. Foster a relationship of trust and mutual understanding instead of competitiveness and exploitation.    Of course, this would require us getting a stranglehold on our own oligarchs who pull the strings in Washington. With them still in the picture and globalized capitalism ruling everything, expect the conditions to get worse and for more people to come because there is no incentive for them to help out, because they only care about increasing profits. Keeping these places poor and desperate means they get a gigantic pool of poor and desperate workers who’ll take anything at any price so long as they get a chance at a relatively more peaceful and safe life here in the US.",KeyserSoze72,2025-03-09T21:27:20,2
"Conservatives at the time also said that Ellis Island was far too lenient. All these poor Irishmen and Polish and Chinese people kept coming in, bringing their crime, poverty, and barbarism with them, being a drain on the civic society. The modern complaints are not new.  You acknowledge that immigrants contribute economically and commit less crime, why then do you say this is not the norm? The data suggests that undocumented immigrants are no different in these respects… they pay taxes, they commit fewer crimes, they support your local economy, they create jobs… what’s not to like? Literally the only thing wrong is that they don’t have documentation and as a result are more subject to exploitation and slipping through the cracks.",BuzzBadpants,2025-03-09T20:00:48,2
"As for how to improve conditions in foreign countries as to not create refugees, America’s options are somewhat limited. We mostly have economic and foreign policy levers to pull, but those are rather limited even as powerful as we are. Probably the best thing we could do is end our propping up of oil and the petrodollar. Not only would it reduce the number of climate refugees, it would reduce the power of authoritarian petrostates like Venezuela and by extension Haiti.",BuzzBadpants,2025-03-09T21:53:53,1
"First off, stop presuming that I'm prejudiced, I'm not, LOL. Second, I am not a fan of the orange one's policies. I am simply suggesting that if they want to pretend that they actually want to stop people from working, which i do NOT believe BTW,  then they could at least have the decency to arrest the business owners. I have never worked at a job that hired illegally because it would have been bad for business. If these companies TRULY didn't want to hire illegally it is VERY possible.",Intraluminal,2025-03-09T16:32:48,1
"Your question makes no sense. If, as I believe you are suggesting,  I wanted to increase jobs in the United States, I suppose I would do what old orange is doing - reducing job competition by reducing the number of workers by getting rid of illegal workers. I doubt that most Americans will take those jobs - at least not at the current wages and working conditions.   Access to food in their native country?  What does that mean?",Intraluminal,2025-03-09T16:39:19,1
"IMO, a primary cause for immigration is opportunity, typically financial, but safety & well being, parents wanting a better life for their kids away from whatever other crappy situations exist in their home country: politically, economically, socially etc. Unfortunately, assimilating into the US is not a primary objective or priority (I know that’s a broad generalization).  I see this EVERY day, since I teach ELL high schoolers, math & science.  Candidly, I periodically poll students about how much English they practiced at home (or work) over the weekend, over breaks and over summer vacations.  Do this with their parents, siblings, their pet dog, whatever.  In the majority of cases, the answer is none, or extremely little.  It is very possible to live, shop, work within & among their ethnic communities for weeks or months at a time without the need for spoken English except in only the fewest of instances.  I’m stubborn enough to continue pressing that point, and it ain’t easy! But,  Regardless, money alone is not the answer.  Hundreds of billions, nay, tipping into trillions of dollars have been spent by the federal government just in the last 50-60 years on programs to reduce poverty, provide social welfare ‘safety- nets’, housing, food security, including dipping (w/ a massive back-hoe!) into social security to fund new classifications of aid, etc., etc., etc.  The ROI has not reaped the benefits intended. So to all the absolute irrational insanity on display by the left, I say, “what have we got to lose, by trying a different path?” And by their non-stop bitching, who’s trying to maintain the status quo, now?",WATGGU,2025-03-11T14:53:22,2
16 million unoccupied homes in the U.S. and around 725k homeless.    The government can absolutely do something.,rbrt115,2025-03-09T11:50:34,1
"So everyone that’s homeless is because “THEY” chose to be? That is a weak argument. I and Elon never said it was his responsibility. Did we? Last but not least. If I gave you $100,000 everyday from the year 1 A.D. until today, you would not have as much money as Elon Musk is worth. Why do you support this type of wealth, that is allowed to infiltrate our politics and spread propaganda that more influential than good will and fact?",Shionkron,2025-03-14T18:47:19,1
"This is an extremely bad faith argument and ignores that many that are homeless are not drug addicts or mentally ill. However, the claim that drug addicts and mentally ill individuals will inevitably trash a home and require another one oversimplifies complex issues and ignores evidence-based solutions. Studies show that supportive housing, when combined with mental health care and addiction treatment, helps individuals maintain stability and reduces homelessness. The Housing First model, for example, has proven effective in improving long-term outcomes. While some may struggle without proper support, assuming all individuals in these groups will destroy property is a harmful stereotype. Providing housing with necessary services is not only more compassionate but also more cost-effective than cycling people through jails, shelters, and emergency rooms.",Shionkron,2025-03-14T07:57:19,0
"I'm from Switzerland, and here, the left had a brilliant idea to introduce a policy (2020 Corporate Responsibility Initiative) that Swiss businesses could only trade or do business with foreign companies that met the same standards as Switzerland in terms of environmental protection and worker/human rights. Unfortunately, the right-wing and centrist parties here killed the bill. I believe something like this could be extremely beneficial for developing countries, ensuring that their workers aren’t exploited and their natural resources are better protected from predatory corporations.  Edit: If a major economy like the U.S. were to implement something like this, it could have a significant impact on those countries. While it would likely make cheap products from low-income countries more expensive, it could probably lead to a reduction in immigration by addressing some of the root causes of economic disparity.",Proper-Republic1561,2025-03-09T13:56:03,4
"It might. I don't know enough about any of these countries to know the best approach. In an ideal world, where unicorns are everywhere and jellybeans grow on trees, that's what a functioning state department and a leader that's willing to listen to experts are for.   But even with leaders that listen, the experts can't be imperialists. Sooo.... *shrug*",FuzzyMcBitty,2025-03-09T12:14:39,1
[deleted],[deleted],2025-03-09T09:57:52,2
"Judging by the number of Mexican and other foreign flags I see at every single protest about anything, these people are NOT quitting their old team to join ours.  They are still loyal to the old team and using our team to fund the old team's salaries.",Been-There_Done_That,2025-03-10T13:47:54,2
I'm pointing out the only way for companies to go beyond I9 is to racially profile. If someone passes their I9 check but is actually illegally working that's the government's failure.,Dr_thri11,2025-03-09T16:53:04,3
"Access to food in their native country means just that. If they are migrating because they are starving, perhaps we should just determine ways to ensure they have food where they already are instead of letting things get so desperate they are risking their lives to illegally cross borders and hide in another country just to survive.   Same with jobs, basically we're looking at how to strengthen the prosperity and safety of our neighbours, so they can be stronger economic partners.",Storymode-Chronicles,2025-03-09T17:35:31,1
I think there would be constitutional barriers to doing so.,EnglishTony,2025-03-09T13:15:39,1
That is mostly seasonal rentals not normal housing:  https://www.census.gov/library/stories/2023/05/vacant-seasonal-housing.html,Big_Black_Clock_____,2025-03-14T04:39:01,1
Why do you think people need to share their hard earned money with people just because they have money?,Pitiful-Bee6815,2025-03-14T22:06:50,1
https://ciceroinstitute.org/research/housing-first-is-a-failure/,Big_Black_Clock_____,2025-03-14T11:38:03,1
"I agree with that, except for your conclusion.  > And it's always proved to be bullshit. The second and third generation are always integrated. Always.  Integration is about how people *feel* -- do they want to teach their kids that they're all on the same team, or do they want to teach their kids that they're on a separate team?  Would we see e.g. violent racial segregation in prisons if everybody truly felt integrated?",the_very_pants,2025-03-09T10:07:43,2
"OK. You got me. You say that the only way for a company to not hire illegally is to racially profile? Then how have all the companies I've ever worked for do it? Magic? In case you hadn't noticed, the United States is  ot 100% Caucasian",Intraluminal,2025-03-09T17:05:43,1
"You mean like...be human? Are you insane? How would Trump get his next billion dollars? Although,  to be fair, it is INCREDIBLY difficult to get the didn't the people who need it because, often the REASON they need help is the colossal,  unstoppable, relentless greed of their rulers.",Intraluminal,2025-03-09T17:37:06,1
The constitution isn't worth the parchment it's written on anymore. Greed and mental health issues keep the homeless situation dire. 2 things the government has active hands in.,rbrt115,2025-03-09T14:21:42,3
"Let's say that's true, 700k homeless and 8 million empty homes. Are you seriously saying that makes it better?",rbrt115,2025-03-14T06:18:11,1
The only earned money that should be shared is the fair share of taxes (which by the way they “doge” having to do).,Shionkron,2025-03-15T13:11:42,1
"I already said many that are homeless are not drug addicts or mentally ill yet you ignored that point.   First off, Cicero Institute is a far right think tank that has used fictional statistics to shame the homeless. Its founder Joe Lonsdale is a Tech Billionaire who has offered zero help to the problem and only offered shame. Cicero also has used PragerU content which lied about statistics to back its claims on the number of homeless being drug addicts. The Cicero Institute advocates for the policies that were a failure two decades ago! It didn’t work than why now?   It costs two-three times more fiscally with Cicero’s approach and does ZERO to help the people actually suffering, INCLUDING non addicts and non mentally ill. (P.s. labeling undesirables as “Mentally Ill” is some authoritarian BS)",Shionkron,2025-03-14T12:08:34,1
[deleted],[deleted],2025-03-09T10:25:51,2
Bet you filled out an I9 form. Which is my point the I9 is a company following the law.,Dr_thri11,2025-03-09T17:16:25,3
"I mean, obviously you're being facetious, but I was asking what the correct policy would actually be, not if one politician or another would actually do it. Ironically, Kamala Harris was in charge with exploring this question herself as VP, and didn't seem to do much in the way publicly recommending any of the policy identified here either.  However, I would maintain that this is in fact also the best way for a billionaire to become more wealthy in the end. Usually they only have short term thinking for some reason, although they act like they're galaxy brains playing 4D chess, they always seem to have the same short-sighted solutions which rob the lower classes, and economic stability over the course, in favour of immediately lining their pockets.   Instead, I believe making your neighbours prosperous so they can contribute as partners to the system will always ultimately enrich you more over the long term. Empowering the lower classes with high quality jobs that have living wages, and a safety net that allows them to seek education and entrepreneurship just creates more investment opportunities for you, the billionaire they will be asking for investment. That opportunity only compounds with each of your neighbouring nations doing the same, as the billionaire class observes no borders.",Storymode-Chronicles,2025-03-09T17:49:02,1
"You didn't bother to read the rest of that link, did you?",Big_Black_Clock_____,2025-03-14T11:34:07,1
"OK, what is their (or anyone’s for that matter) “Fair Share?” “Fair Share” as a rallying, class-warfare term is tossed around DC by the likes of multi-millionaires Bernie Sanders, AOC, Chuck Schumer, Nancy Pelosi, Elizabeth Warren, etal.  They’re not willing to share.  Curious how they start stammering when asked.",WATGGU,2025-04-13T09:36:14,1
https://jamanetwork.com/journals/jama/article-abstract/2818774  https://www.sciencedirect.com/science/article/pii/S2667118223000107  Is jama fake news?,Big_Black_Clock_____,2025-03-14T12:17:03,0
"> What group is not integrated after three generations?  There are no groups -- there is only illusion/hallucination about groups. There are no separate teams, but there are adults who want to teach their children that they're on separate teams (and that some teams are nicer/better than other teams).  > Pretty sure your example of prisons is not very applicable to the larger society.  Why wouldn't it be? The model of separate, distinct races doesn't come from adults in prisons. Prison conditions simply *reveal* the underlying tribalism.  We could point to schools just as easily, where some adults desperately want kids taught that ""blackness"" and ""brownness"" are real things, and that some kids have the right to punch other kids for singing along to the wrong team's songs.  > People from Alabama have never been on the same team as people from Boston.  *To you*, maybe -- but if you asked them, what would they say?  > Native Americans and New Mexicans... Lobster fisherman from Maine... School teacher in Minnesota with swedish heritage. Some guy speak in French in the bayou with no shoes on on a fan boat. I could go on and on. They're all Americans dude.  Again, it's not *me* saying Americans are divided into separate teams -- I'm just listening to what these people themselves say, and observing who's most interested in teaching kids the ""separate teams"" garbage.",the_very_pants,2025-03-09T10:42:35,2
"According to everything I've read, there are companies that hire illegally and which pay little or no penalty.",Intraluminal,2025-03-09T17:27:54,1
"Harvard business school has explicitly taught people for decades now, not to plan more than five years out (i think it's aimed at CEOs).  Kamala Harris rightly steered clear of that issue because ""Now the "" N-word"" wants us to give welfare overseas!"" Would have been the very first wors out of their MAGA mouths.",Intraluminal,2025-03-09T20:22:08,1
Are you arguing we shouldn’t have any taxes? I think we should. The fair share is what we collectively decide and approve is entitled ugh to run a healthy Nation. That is the “fair share”.,Shionkron,2025-04-13T09:52:35,1
"The Jama said studies are lumping Canada, Germany, and the USA in a small sample group together. Also I was an addiction counselor. Stop trying to google your way into hating trying to help homeless people.",Shionkron,2025-03-14T13:33:53,1
As you keep trying to say homeless are drug addicts you have yet to answer many are not and even IF SO many use drugs to help escape from the TORTURE of being HOMELESS!!!!!!!! How have you helped?! Stop being an ass and be a proponent to help people! Not argue to not.,Shionkron,2025-03-14T13:36:47,1
I have been in the field of this topic and helped hundreds…have you?!!!!,Shionkron,2025-03-14T13:38:47,1
You are as anti science as a climate change denying trump supporter.,Big_Black_Clock_____,2025-03-14T16:15:14,0
Hahahahahahaha!!!!! I am not anti science. You are anti statistics and have zero experience in the field. Go piss up a rope.,Shionkron,2025-03-14T16:26:28,1
