Comment,Author,Date,Score"That’s the classic Republican playbook. First you fight against the establishment of something and take credit when it helps your constituents. Then you take funding away from the thing, complain about the thing not working because you took away funding, and then privatizing it",Neon_culture79,2025-03-05T20:46:28,242
They are purposely destroying the government so their billionaire buddies can come in and privatize everything. This is a coup and we are all being robbed blind. Something drastic needs to be done.,Biscuits4u2,2025-03-05T21:05:02,176
Do they want to privatize social security because of all the money that will dump into the stock market for the right to snarf up?,Buck_Thorn,2025-03-05T22:14:03,16
"This is the answer.  I don't think Trump wants any of those things personally.  It's a conditions of his presidency this time around.  He's good at one thing, pushing through terribly unpopular changes under the veil of his open absurdity.  It's just a job to him.  And in return he gets more time in the spotlight and more power, and doesn't have to spend the rest of his life behind bars like he deserves.  This is about the only comforting reason I *don't* think this will all end in open dictatorship.  He's clearly on a leash, and the leashholders clearly want to manipulate the majority into wanting to vote this way forever, not install a dictator.  Or as Trump said, they want it to be like 100 years ago again, not like Italy 90 years ago.",novagenesis,2025-03-06T06:40:01,12
Yep. This is why they are cutting staff. They want it to suck so you fall for privatizing. Look how well it worked for 401Ks. Remember when people just had pensions?,cmit,2025-03-06T10:29:45,4
One interesting thing most people don’t know is Trump actually invented the phrase “prime the pump”.  lol.,reelznfeelz,2025-03-06T08:53:51,2
"It is also to sow unrest so people protest and riot. The end goal is to declare martial law so he can cancel the 2026 elections and forever consolidate his power.  It’s straight out of the Putin playbook. Create a fake crisis, allow the masses to display their anger and fear by protesting, do something to escalate it so people riot, declare martial law & say it’s for the public good, shut down the upcoming elections.  This is completely out in the open and nobody is acknowledging that is the true end game. The phone call is coming from inside the house people, this is a true break the glass moment.!",Planetofthetakes,2025-03-06T08:35:28,5
"Which is so silly,  encause if you realistically just discovered a bunch of fraud in SS, the outcome would be “good news! We eliminated the fraud so now we can give you more SS for the same tax!” not eliminate all together",WeezerHunter,2025-03-06T18:46:56,1
"You are a tossed, they don't want to privatize SS, if the ss department is showing people we'll over 100 getting money , then why would you think the SS web site would be accurate about anything, so it's not possible that there could be mistakes made in that department.It has to all be on the right.""Wings people are all crooks""    You extreme people are idiots",Same_Marzipan_9356,2025-03-11T15:51:29,1
"That may be the case, but I doubt that Trump is stupid enough to let RP Congresscritters reduce SS.   IMO, his focus should be on substantially increasing payments to retired workers directly while leaving the social security system in place.",DyadVe,2025-03-06T09:35:31,1
>They want to privatize social security  I think that's just called a retirement plan. How would privatizing it even work?,Santosp3,2025-03-05T20:52:14,-2
"Privatizing it would be a good thing, how can people be against it…",oswestrywalesmate,2025-03-07T07:50:55,-1
Starve the beast,Trump_Eats_bASS,2025-03-05T22:19:19,30
"Create problem, sell solution. If only people weren’t dumb enough to fall for this BS",Disownership,2025-03-06T08:39:13,19
">150-year-olds are not receiving Social Security payments   This is exactly what Republicans are saying, so I don't know why your throwing shade on them. ",random_guy00214,2025-03-06T09:12:00,-10
The former head of the Social Security office was on CNN the other day talking about if that many people are getting laid off the system itself will collapse in 30 to 90 days,Neon_culture79,2025-03-05T20:47:05,46
Desperate people are easy to conn. Take away SS and everybody becomes desperate.,bedrooms-ds,2025-03-05T21:43:11,3
"They don’t have to cut anything. They can just say it, pass meaningless resolutions, and keep kicking the can down the road when it comes to specifics. Then nothing happens, and Democrats come back to power, and suddenly Republicans care about the deficit again.",ThemesOfMurderBears,2025-03-06T08:59:12,6
"I am sorry. That’s upsetting to the core. You do not deserve this perception, sentiment, or to hear such words from someone who is supposedly our leader. There are many more of us that do care and gladly help our fellow brothers and sisters.   That “Democracy Now” interview was a lot to unpack! How horrible! That is family!   I remember when DJT made fun of the reporter and I thought that was utterly gross bullying behavior.  Thank you for sharing. It further highlights this man is not a normal empathic human being. Within his power he has the ability to help, and he just doesn’t. As if DJT cannot process obvious logic or caring. Completely unfit to lead a nation of people, people that depend on his leadership.",sugarGlide,2025-03-06T05:09:29,12
I was watching a video just yesterday of some of Hitler's excerpts from Mein Kampf.  He actually says weak people should have no place in the world (paraphrasing).,saruin,2025-03-05T23:42:02,20
Thank you for posting this.  I get social security disability too. Or did. Now they’re asking for me to pay back many months because I went over one month my ssd which was my fault but they waited a year and half to tell me and ask for every month back since.  Normally I’d understand the idea of paying back but given that this is under Trump and Musk now I don’t think they need everyone’s money given to them,coldliketherockies,2025-03-05T22:30:03,20
Non vet disabled is considered DEI now. As far as they are concerned you are not a person and everything you got in life was a handout or to meet a quota.   I hope you make it out ok. I have friends in similar situations as well.,Sageblue32,2025-03-07T11:13:35,3
"It's not that they want you to die, it's that they will go to absolutely no effort whatsoever to prevent you from dying.",epiphanette,2025-03-06T15:12:05,1
Thank you for taking the time to reply. I am so sorry that your essential benefit is at risk from a political agenda.  I wish you all the best and will work to the bone to support your right to a healthy and happy life!,KensofarEon,2025-03-07T07:53:46,1
[removed],[deleted],2025-03-05T20:48:24,-69
"They’ll be like, “line it’s a scam! Defund it!!!”   “Wait, what happened to my social security check??”",Ex-CultMember,2025-03-06T01:24:25,8
"Honestly we do need to trim the deficit and badly need some entitlement reforms, but the way they’re going about it sucks ass because the “real” reformers will be discredited for a generation.  We should lift the cap on SS taxes (why should richer people pay *less*??) and *modestly* raise the retirement age for most workers (if you’re a roofer and can’t safely do the job, different story).  And we should expand skilled immigration because those people help tremendously with the age demographic problem (not enough younger working people relative to the glut of retiring boomers).  And we need to expand the supply of doctors and health care workers and relax the stupid residency rules and etc etc etc.  But my fear is the GOP will just slash and burn and so Dems will reflexively take the maximally opposite view.  Just sucks man.",Books_and_Cleverness,2025-03-06T09:19:26,4
The COBOL glitch is misinformation. COBOL doesn't use 1875 as a reference date or anything like that.,its_a_gibibyte,2025-03-05T22:40:33,17
"They're not just saying ""fraud is going on"". They are saying ""shocking levels of [probable] fraud"". ""Rampant fraud"". It's false - but it doesn't matter. The lie is out there, and people believe it because Trump says it and all his minions repeat it.   That means when they come out and say ""we're scrapping the system"", people will go along with it. It may also give them cover for actually adding fraud to the system.",MoonBatsRule,2025-03-06T11:24:44,3
What is the COBOL glitch?,dravik,2025-03-05T20:28:20,0
"The surplus population, in the words of Ebenezer Scrooge. I, too, am a member of that population, poised to lose everything, like many of us are. Too old now to fight back or raise the roof, but would not have chosen to have the final years of life watching America die like this. I have no words to express my sorrow.",givemeadarnbreak,2025-03-08T07:13:11,1
It's broken already. The government has already reported before Trump that it is going bankrupt. All the funds have been robbed from the account.,DuckTalesOohOoh,2025-03-05T20:49:47,-25
They’ve tried upgrading and failed.,DBDude,2025-03-06T07:12:38,1
There are systems in place that allow widows/widowers and disabled dependents to collect SS from a deceased relative.  Did someone from the family die at your address? Were the two beneficiaries married or offspring to the deceased?,KensofarEon,2025-03-07T07:59:56,1
"Wired is actually just straight up lying here. There is nothing in COBOL that references May 20 1875. It’s literally a complete fiction they are repeating in print.  May 20 was the date a of a conference that signed the Meter Convention in which Euro countries, et. al. agreed to the very specific details of the metric standards, one of which happens to be the standardized Gregorian calendar they use today.  That’s it. Nothing related to COBOL in any way.  Edit: and honestly, just do the goddamn math, you idiots at Wired. They’d be 149-year olds!",absolutefunkbucket,2025-03-06T09:08:32,4
"Happy cake day!  I see where you are coming from, SSA could have easily manufactured these numbers to downplay any fraud.  I've heard that there are beneficiaries from both widows/widowers and disabled descendants that would qualify for a deceased persons SS benefits, so lets just say they were excluded from the report and the SSA graph only included living recipients of SS benefits.  Why hasn't DOGE or Trump addressed the amount of checks given to malicious collectors?  Their claims is, and the view of most MAGA I've interacted with, that living people are cheating the system to collect deceased individuals social security.  I'm all for removing that sort of manipulation, but I have yet to hear of Trump or Musk address either of those figures, just that there are discrepancies in the database where people older than 150+ are listed in the database. I've yet to hear an actual reference to the volume or amount of checks being sent out fraudulently  That's the entire reason I made this thread tbh..",KensofarEon,2025-03-07T07:00:11,1
The COBOL story is fake. Completely made up. Disinformation that you are yourself eating up.,absolutefunkbucket,2025-03-06T07:21:06,3
">It might sound like a lot of money, but it’s a very small amount relative to[ the $1.5 trillion in benefits the Social Security Administration](https://www.ssa.gov/finance/2024/Overview%20of%20the%20Social%20Security%20Administration.pdf) paid out last year, said Richard Himelfarb, a political science professor at Hofstra University.   >That $9 billion is less than 1% of expenditures, he pointed out. It’s also a tiny fraction of last year’s federal deficit, which stood [at more than $1.8 trillion.](https://fiscaldata.treasury.gov/americas-finance-guide/national-deficit/)  Didn't seem relevant.  Afterall we just passed a 4.5 Trillion dollar tax cut.  9 Billion is only .2% of that.",KensofarEon,2025-03-07T07:28:57,2
Id love to see the source on that.,The-Wizard-of_Odd,2025-03-06T08:17:31,0
0000 is not a valid year in ISO 8601.  There is no magic default year in either COBOL or ISO 8601. It’s just completely made up,absolutefunkbucket,2025-03-06T07:26:30,1
"Social Security has become an inadequate boondoggle at least since it expanded its mission beyond providing funds for retirees.  The ""Lock Box"" should have been real and the money should have been invested in ETFs.  IMO,  Trump's opposition should be demanding much larger SS checks, and individual vested accounts to be expanded every year from general revenue until they can provide a decent pension for retired workers.  IOW, damages from decades of gross mismanagement of the funds provided.    #",DyadVe,2025-03-12T12:05:22,1
"Yep. They’re saying this to prepare us for the eventual axing of it all. Might not happen in my lifetime (I’m 58), but I feel sorry for younger people that don’t have decent jobs and won’t be able to afford to plan for any kind of retirement.   Suddenly the movie Elysium has become a realistic glimpse into our future.",Icy-Map9410,2025-03-14T12:32:21,1
"This is the end goal, unfortunately. People had zero thought process to any of this happening when they voted the Republicans back in. Trump was their stooge, and it worked…now they’re back in power to stay, and they will rule over us minions.",Icy-Map9410,2025-03-14T12:29:17,2
"As that article points out in the next paragraph that's ""0.84 percent of $8.6 trillion in benefits paid over that time.""  If the goal is to save money, hire *more* bureaucrats to audit paperwork, not *fewer*.  If the goal is to use improper payments existing to wipe out the program entirely, why?  What's the goal, despite the elderly having paid into the system all their life proceed to... not pay them their own money?",zaoldyeck,2025-03-06T00:17:45,1
"[Among this group of 18.9 million, the report found that only 44,000, or 0.2%, were still receiving Social Security benefits. The ](https://www.factcheck.org/2025/02/trump-musk-exaggerate-scale-of-improper-social-security-payments-to-the-dead/)",loCAtek,2025-03-06T00:26:14,1
"The problem here is that what should be a push for reasonable reforms is being used as an excuse to destroy systems entirely, not to mention the guardrails protecting all of our governmental institutions.  It's hard to have a reasonable discussion with the trump administration when they're utterly uninterested in having one. They just want to use this stuff as a pretext to dissolve our governmental checks, and amass power. And so democrats understandably move into a position of resistance, which also plays into the administrations hands, as useful idiots miss the forest for the trees, and assume these actions have anything to do with cutting waste.",GiantK0ala,2025-03-06T12:39:25,5
"We're just on step one is the current leftist logic tree. It goes 1) it's not happening! 2) Okay it's happening but it's not that bad. 3)   Okay maybe it's kind of bad but why do you care. And finally 4) you're a bigot for noticing!   I see several comments where when pushed pale are already saying ""okay it's happening but it's only .2% which is only hundred billion dollars!""",A_SNAPPIN_Turla,2025-03-06T12:28:23,-1
Apparently more people than I had expected!,The-Wizard-of_Odd,2025-03-06T08:19:16,-1
What does the sentence “the values calculate to other numbers” even mean?,absolutefunkbucket,2025-03-06T07:27:31,1
"It’s COBOL, and no. People’s ages have nothing to do with it.",absolutefunkbucket,2025-03-06T07:19:53,1
"Social Security has a built in cutoff date of 115 years old, specifically to prevent fraud. As in, there is literally **not a single person** over 200 who is receiving payments, because the payments stop when someone turns 115. This was established more than a decade ago,",ShouldersofGiants100,2025-03-05T21:41:29,11
Post your sources. This is the second time you made this claim.,baby_budda,2025-03-05T21:10:36,15
I’m truly ready to read some proof of the people over 300 years old receiving benefits and eat my words; that this is bullshit.,Rastiln,2025-03-05T21:44:50,7
"Ay, if they found this supposed fraud. This would mean those funds are being mailed to a physical address or deposited into a bank account. Cause like, that's how you turn these deposits into liquid cash, right?  So like, wouldn't that be a simple call to local PD to go check on this ... if you find a 27 year old influencer trying to cash a check for a 211 year old SSI recipient. Couldn't you like, arrest them?   And why hasn't any of that happened?",DreamingMerc,2025-03-05T23:00:41,6
"Where are the charges for fraud? I haven’t seen one. Millions of people ripping off the government and no charges? Weird.   Go repeat this statement on genealogy subs. Everyone knows this is an issue where their ancestors who died prior to the 80s have no death date registered at SS. But more recent deaths are automatically linked with all the states death certificates and SS. They are done nearly in real time. In fact, they’ll reach into your account and grab your last check back if you died during the month for which you received your last check.      Lack of a death date doesn’t mean someone is getting a check.",sheshesheila,2025-03-05T21:13:46,13
"> The number of people who are receiving funds who are over 100, 200 and even 300 years old is shocking.  How many is it, can you be specific? I’m prepared to be shocked",RabbaJabba,2025-03-05T20:49:29,13
LegalEagle  [DOGE vs Reality](https://youtu.be/71hKowGIpHM?si=rLMjFqVt3hAiNoSo),loCAtek,2025-03-06T00:17:42,6
"Wow, you sure are wrong! It's impressive how high a degree of wrongness you have achieved here. I will take it back if you can post a single shred of evidence in the form of A) Identifying those records, and B) Connecting the identified records to actual payments being made. Amazing that you can believe those claims at all without any of that...",analogWeapon,2025-03-05T23:33:56,2
George W tried to do this. Republicans have hated SS for decades.,Horn_Flyer,2025-03-06T04:59:13,62
The exact same thing happens with public education.,abobslife,2025-03-08T07:18:57,2
Poisoning the well to sell bottled water.,Unlikely_Mastodon165,2025-03-11T11:25:57,1
"""Government doesn't work. Elect us and we'll prove it!""",Splenda,2025-03-12T09:31:43,1
"Two weeks ago there was another [shooting of an insurance CEO.](https://www.insurancebusinessmag.com/us/news/breaking-news/ceo-of-state-accident-insurance-fund-corporation-has-house-riddled-with-gunfire-526887.aspx) It was their home, and not the individual them self, but it's clear the media learned their lesson, and are being a lot more hush about it.  People are ready for drastic action, the problem is organizing when everyone keeps a tracking device with visual and audio in their pocket at all time.",EarthRester,2025-03-05T21:58:42,89
Regaining the narriative is a hard to blind ears.  You need to fix that first.,mycall,2025-03-06T07:46:49,1
All you have to do is win elections.,DyadVe,2025-03-07T08:59:34,1
Calm down.  They're cutting waste.  Granted most government is waste so it feels strange. But you're okay with the waste?,used_to_be_a_Freer,2025-03-07T10:31:40,1
"That would be my guess.  A while ago they let slip that the whole reason for privatized schools was to get at that sweet taxpayer money.  Worse results, higher costs.",tosser1579,2025-03-06T00:31:49,26
"Yes.  So let's take a lot of the fund and pay it in fees to banks.  Under a corrupt administration like the felons, the money would also be used to reward kiss asses.  I'm not going to say loyalty.  That does not exist among thieves.",bjdevar25,2025-03-06T05:31:39,6
The Right thinks they are entitled to steal money from the public.,neverendingchalupas,2025-03-06T22:11:41,1
"Trump is old and won't be alive in a few years, and the Republicans have no one who has a tenth of his talent for snowblowing pure bullshit. What will they do when he's gone and no one else can keep MAGA hypnotized?",jetpacksforall,2025-03-06T09:22:24,3
Collapse it faster?  Make the younger generation who paid into it not be able to collect anything after watching all that money got to the boomers.  That's evil.  He's probably considering it.,tosser1579,2025-03-06T12:30:34,3
You need to pay people to administer the new private company. And that company needs to make money. And those high level employees will definitely be making more than anyone in the Social Security Administration.  It's the same thing in healthcare. United Healthcare made 5 billion in profit last year. That doesn't include the millions executives made. How many extra procedures could be covered with that money? And that's just one healthcare company.,Erigion,2025-03-05T21:28:20,25
Investment firms and private equity companies will skim off all sorts of fees.  The end recipients will be lucky to get 80% of what they were originally entitled to.  And that’s only if the market doesn’t hit a significant downturn.,TomTheNurse,2025-03-06T00:59:23,8
A quick glance at the private school movement tells you everything you need to know.,tosser1579,2025-03-07T08:53:39,1
Elon Musk not knowing how to use a basic database system is not justification for ending social security.,0zymandeus,2025-03-06T11:24:08,10
"And then the talking point will be, “see it doesn’t work.”  Get ready, people. Time to save that $million before you retire because they gettin rid of it. Same with the rest of your family.   It’s the Gilded Again, where the billionaires rule and the rest of us get to be peasants again.",Ex-CultMember,2025-03-06T01:18:42,38
"That's a lot of blue collar old people who are going to be *really* pissed off.  A very angry old man, aged somewhere between 75 and dead, who's looking at sleeping in a tent, does not have much to lose.",ColossusOfChoads,2025-03-06T01:47:05,15
Well sounds like my grandma is going back to work,11711510111411009710,2025-03-06T10:35:32,3
"They actually do have to find cuts because they just passed 4.5 trillion in tax cuts, claiming that a big part of those cuts is no tax on tips or overtime, but looking at the figures the cuts will benefit corporations with a nice reduction to 15% tax rate (if they move back to the states but hey, who is to say all that involves is just one head quarters in the state and the rest of operations maintained overseas?) as well as a in the ball park of $60,000 year cut to individuals making over $300k, (I think its a reduction from 39 to 37%)?  Rest of the figures show no change to those in the tax brackets below $300k, and now they're getting their benefits programs cut too?    Now there's no way they will balance the budget and they'll blame the Democrats for the deficit before and after Trump's term (ignoring that COVID played a large part of the economic crash).  Like /u[DReddit111](https://www.reddit.com/user/DReddit111/) said ""Musk and Trump are really good and absolutely relentless at weaving whatever reality suits their ambitions.""  They say everything with such conviction that they are certainly securing republican possessions of powers for years to come.",KensofarEon,2025-03-07T07:52:25,2
Thank you for your solidarity.,WheelyWheelyTired,2025-03-06T10:00:43,4
"When I was in a discussion with a MAGAnut about drug prices and I mentioned that as a cancer patient Bidens drug plan would save me money and allow me drugs that could prolong my life he stated that I should just ""go ahead and die"".",booze_talking,2025-03-06T02:21:13,17
"I’m very sorry to hear about what you’re going through. It is absolutely ridiculous for them to be asking you to pay back a year and a half worth of benefits due to one overpayment. Unfortunately, it doesn’t surprise me. I have heard many such stories.",WheelyWheelyTired,2025-03-05T23:25:21,9
"They have not shown evidence of any fraud. The people they claim are collecting at 125 years old are because of date error in the software that reverts the birthdate to a default number if the information is unknown. These are very old people that often were born at home and lived most of their lives with incomplete government records. That doesn't mean that they never paid in, or that they should be left out. John Oliver covered all of this recently.",imlosingsleep,2025-03-05T20:54:20,50
"Personally, I think that if the alternative is the program not existing and elderly and disabled folks suffering, then some fraud occurring is acceptable.  You may not know this, but even permanently disabled folks like myself are audited at minimum once every seven years, by law.   Additionally, we aren’t allowed to have more than $2000 in assets at any time, excluding one house and one vehicle.   If during such an audit we are found to have violated any rules, of which there are many, we are required to pay those funds back and can also be charged with felony fraud.  For reference, I receive only $967 monthly to live on. $375 of that goes to rent and bills. Leaving $592 for food, gas, entertainment and all other expenses for myself and my loved ones.   I receive close to the maximum you can receive in my state. The idea that anyone at this level of poverty should be charged with felony fraud is rather ridiculous, in my own opinion.  It doesn’t make sense to go after folks making less than $12k a year.   If you’re going to go after fraud, look at the rich folks.  You’ll get as much back catching one of them as you would hundreds or thousands of poor folks.",WheelyWheelyTired,2025-03-05T21:01:37,40
Homie I work with forensic accountants. Looking into the massive amount of data that ssa has to keep would take YEARS. They are running a clown show and can’t back up any of their claims,Megsann1117,2025-03-05T20:54:31,38
