Comment,Author,Date,Score
"[A reminder for everyone](https://www.reddit.com/r/PoliticalDiscussion/comments/4479er/rules_explanations_and_reminders/). This is a subreddit for genuine discussion:  * Please keep it civil. Report rulebreaking comments for moderator review. * Don't post low effort comments like joke threads, memes, slogans, or links without context. * Help prevent this subreddit from becoming an echo chamber. Please don't downvote comments with which you disagree.  Violators will be fed to the bear.  ---  *I am a bot, and this action was performed automatically. Please [contact the moderators of this subreddit](/message/compose/?to=/r/PoliticalDiscussion) if you have any questions or concerns.*",AutoModerator,2025-03-05T17:12:32,1
"They want to privatize social security, so making the existing program sound pathetic and ill run are necessary to prime the pump.    They will probably lie about both, cutting spending while thinking doge for saving money.",tosser1579,2025-03-05T20:16:18,790
"It's the old classic Republican motto: Government doesn't work, and if you elect us we'll prove it!",mycatisgrumpy,2025-03-05T20:28:30,215
"Considering the administration is laying off more than 10% of SSA staff and cancelling leases for field offices, it seems like they want to undermine social security to kill it.",avfc41,2025-03-05T20:18:19,111
"Trump wants to give tax cuts to rich people,  but he can’t, deficits are already too big. He has to cut something. But nothing is big enough. Most of the federal government expenses are Social Security, Medicare, Medicaid, the military and interest on the national debt.Everything else put together, foreign aid, NASA, the Justice Department, National Parks, the CDC, border patrol, etc… doesn’t come close to those big items. They could get rid of literally the entire US government, besides those five things, and still not be able to balance the budget, let alone cut taxes more.  What Trump wants to do is impossible, what DOGE says they are going to do (2 trillion in cuts) is impossible. All they are doing is making a lot of noise firing all those federal workers. It won’t have much of an effect on the deficit and certainly not pay for Trump tax cuts. So they have to attack something big like Social Security.  But people like Social Security so they need a reason to cut it that people will accept. Finding waste, fraud and abuse (I’m so sick of hearing those terms) is a handy cliche and is good political theater they can use to justify doing something everybody is going hate. It also justifies the existence of DOGE, something else a lot of people are hating on, if they are out there fighting the boogie man. That fact that the boogie man is made up matters not even a little bit. As long as they can convince enough people that the boogie man is real and is a threat it lets them do whatever they want.  Musk and Trump are really good and absolutely relentless at weaving whatever reality suits their ambitions. They’ll keep at it no matter how dumb the narrative is is or how thoroughly it’s been debunked. Turns out having absolutely no shame is a pretty good formula for success in today’s world.",DReddit111,2025-03-05T21:23:57,69
"Disabled Triplegic person who relies on SSI to support myself and my loved ones here.   My guess is that they don’t feel that disabled folks like me are deserving of support or worthy of life.   Trump has allegedly made such comments explicitly about his own family:  https://www.democracynow.org/2024/9/6/fred_trump_iii_memoir  There was also the time he made fun of a reporter openly for having a disability:  https://www.bbc.com/news/world-us-canada-34930042.amp  I encourage everyone to learn about how disabled people were treated by the Nazis. Here’s some more info on Aktion T4 and the T4 program, which explicitly institutionalized and killed hundreds of thousands of disabled people:  https://collections.ushmm.org/search/catalog/pa15074  https://encyclopedia.ushmm.org/content/en/article/euthanasia-program  Please don’t stand by and allow this to happen to folks like us again. I fear we are viewed as acceptable casualties to most people.",WheelyWheelyTired,2025-03-05T20:24:33,200
"To prime their supporters for the inevitable cuts to social security and claim it was justified while changing public opinion on their side that it's ""good"".",prodigalpariah,2025-03-05T20:33:33,25
"Because they are going to   A: Shut it down ""THERES TOO MUCH FRAUD, ITS GOTTA GO""  B: Rob it blind to fun their pockets and pet projects.",unknownpoltroon,2025-03-05T21:20:16,16
"privatizing social security will fuck up global value of the dollar on a massive scale. destabilizing currency has been goal of tech for some time, and it aligns with conservative anti new deal to not have a central bank. it’s fucked up. it’s completely undermining what has made the U.S. a global power since world war 2. along with exiting nato, it seems like they like just want to fuck shit up so oligarchs can just buy shit for pennie’s on the dollar. screw government or any egalitarian larger goal, they just want monies and power. the middle class will be dead in 20 years.",dIO__OIb,2025-03-05T20:37:24,13
"If you look on the conservative sites, they don’t seem to know about the COBOL glitch, and most buy Elon’s narrative that fraud is going on. That will make it easier for them to justify tearing Social Security down.  Unfortunately, there is no one around to stop them.",Spin_Quarkette,2025-03-05T20:26:22,36
"They want to bleed people off of it, on their way to outright killing it.   This isn't like a deep mystery or full of secret turns. Despite both of these people practically living off the government, they feel themselves as superior beings, and people who have to 'live off the government' are simply less than human and should be slaughtered.",DreamingMerc,2025-03-05T22:52:43,7
Because the government has borrowed $3 trillion dollars and counting from the Social Security trust fund and they don’t want to pay it back.   They want to put the money into the pockets of billionaires like themselves instead.,Gr8daze,2025-03-05T20:26:58,12
"They want to poison and break Social Security so they can privatize it. That way, their donors can gamble with the entire nation's retirement funds.",TecumsehSherman,2025-03-05T20:16:01,17
Has anyone ever gone bankrupt taking advantage of the stupidy of the American people?,maybeafarmer,2025-03-05T20:29:03,5
"Because after you tell people over and over that government is doing something incompetently, you can tell people that the only way to save it is to privatize it.  And then the increased cost of adding a middleman reduces benefits, but you justify that by saying it was the only way to save the program that you lied was failing.  Alternately, you can cut the agency’s administrators and workers to the bone in the name of efficiency, until the program ceases to function, thus justifying its elimination, at which point rich people get to pay less taxes.  This is always the Republican goal - Eliminate social programs so that rich people stay richer.",Enjoy-the-sauce,2025-03-05T22:14:01,5
"They wreck governmental programs. Then they say ,""hey look, these programs don't work for shit"". Then they shut the programs down to privatize them.",BurrrritoBoy,2025-03-05T22:30:40,3
I am AMAZED they are going after SS.  This and health care are 3rd rails.  The 2026 midterms will destroy the GOP if they mess with SS.,Which-Worth5641,2025-03-05T23:12:43,4
"# PhD in Computer Science here….  The CAP Therom states databases can be at most two consistent, available, and partitioned. Our system picked available and partitioned— which means you can always submit information and different departments will process it.  Without consistency you'll have erroneous data. Scale that by millions of employees manually changing data over decades. There's a zero percent chance the data is correct.  Does that mean fraud and waste? Undefined. It means theres bogus records that are valid in government systems. Depending on how those records are used cross-department there could be issues  Suppose the student loan system only cares that the ssn system known a record is valid. In that case, you could get a loan using a 200-year-old Ssn. It doesn't mean someone has that loan— only that its possible.  It gets even more complex as most checks are transitive across multiple departments/agencies.   TLDR: Do we need to clean up the data? Probably. Is there fraud occurring? Potentially. Is the data accurate? Unlikely.",ThigleBeagleMingle,2025-03-06T08:42:36,3
"There's no need to also include a falsehood on COBOL to make your point.  There's no such standard for 5/20/1875 for default dates or fields that hold a NULL value, that's been repeatedly debunked by the CS community.    That being said it's obvious to anyone with a calculator or a spreadsheet that these guys are lying through their teeth.  Their own math doesn't make a lick of sense.",bbpsword,2025-03-06T10:00:02,5
"When they hate something, they say there are nefarious characters taking advantage.   They hate when people who are not like them have the ability to vote.  They hate paying for help for armed services members who can no longer serve.  They hate when workers try to organize to have just a little bit of power compared to corporate interests.  They hate spending money on people who are no longer able to contribute to corporate america.  They hate making sure poor people won't starve or freeze to death.  They hate giving healthcare to anybody.  They hate when people feel safe in their homes and neighborhoods.   They think that if they can get the gullible onside with this technique, they can shut these systems down and funnel the cash and/or power over to their corporate masters.",patt,2025-03-05T22:05:31,11
"I know legit 2 people in my family who commit SS fraud right now, adults in their 50s.   Live abroad with parent, parent died, still collecting the checks. Living in South American. Its cant be that uncommon.",Real_Abrocoma873,2025-03-06T07:44:06,7
They are claiming fraud because they want to LOOT Social Security and STEAL our money.,shawsghost,2025-03-05T21:24:22,3
"First and foremost I think they are manipulating public opinion about *them*. One, their claims are absurd and everything absurd and exaggerated is easily remembered (and catches on); two, these BS spread; three, when going widespread, it damages dems' reputation (congress approved funds, but they are blaming dems/biden), while at the same time portraying trump+musk as saviors above suspicion.  You see, to me it's not about social security *per se*. Yeah, of course they would privatize it if heard good proposals from wallstreet (w/ corruption included), but they're just *using* social security because, well, it became available to them at this moment. With trump (which he learned from his first campaign), it's more about 'getting authority though spectacle + hating an enemy' then about influencing voters by proposals and ideas and stuff. Trump and his best minds assembly of aids are strong in the first, mediocre at the latter.  Problem is, standing up against this strategy is very difficult without society's help. When you fact check current BS, he's already in the next round and damage is already done. When a lot of the population doesn't care about politics, all these made-up facts fly. That's why he threatened to arrest zuckerberg: fact checking right into his posts was very dangerous for him. Dems, I think, can't fight this simply because most of the population either doesn't care or is maga.  When people start feeling the consequences personally (ie, in their pockets), then there's a chance. Of course, there'll be another round of BS and lies and another enemy to blame, but by then hopefully the affected voters will be bothered enough to start questioning stuff and thinking for themselves.",Str4425,2025-03-06T05:27:04,3
"It’s a repeated and blatant lie for political persuasion (and probably meets the definition of propaganda). They’re very careful in how they phrase it though, but their implication is that payments are going to these people who are over 200 years old.",sluterus,2025-03-05T20:28:07,6
The strategy here is to keep telling people that their eyes don't see what they are seeing.,deviateparadigm,2025-03-05T20:40:06,4
"They want to cripple it and gut it so that it doesn't run correctly. Then they can turn around and privatize it (using some cronies with kickbacks to them) or worse, take the money and invest it into some scheme of Musk's making. Then when it all fails, Trump can point at Musk and say it wasn't his own fault.",thewoodsiswatching,2025-03-05T20:54:40,2
Cool cut me the check 40 plus years of paying into Social Security don't forget the interest,lets_talk2566,2025-03-05T22:57:36,2
"Anybody who’s ever lost a parent knows how much of a lie this is. When somebody passes, those social security payments cease _immediately_.  To be fair, there has absolutely been fraud in social security before. But that takes real investigation. Musk and the script kiddies have zero knowledge of how anything actually works, so everything looks like fraud to them, just like how Mike Lindell thought that ordinary DNS packets on a network were incontrovertible proof of vote flipping.",russrobo,2025-03-06T02:07:28,2
"So they can convince people it's not that bad when they end the program, it's that simple.",Swaglord245,2025-03-06T03:38:37,2
"Trump lies. Duh. He wants to take your social security money, this is his latest excuse.",frosted1030,2025-03-06T04:06:06,2
"I didn’t know COBOL is 65 years old.  Geeze Louise time for an upgrade.    Probably poor record keeping and program written to allow such data entry.  Neither wants to say management is sloppy which is probably more accurate than fraudulent beneficiaries.   I worked in the SSA system for 37 years, retired now 10.  It’s easy to discover where the benefits are going with simple queries.  Don’t believe SSA doesn’t know or cannot find out.",FollowingVast1503,2025-03-06T04:20:07,2
"Why do they push any narrative?  They did the same thing with FEMA during Helene.  I've heard people talk about how terrible FEMA's response was who had no damage or any reason to complain.  Those of us on the ground?  We efficiently got help during a disaster, period.  The ""politicians"" get a pass as it's their job to spout nonsense, but it's repugnant to hear it from lucky citizens who just hate liberals and the idea of the needy getting help.",HardlyDecent,2025-03-06T05:37:27,2
"You can’t cancel something that people like. So you have to demonize it first.  For example… “Black lives matter”? Yes, they do, but don’t “all lives” matter more?  And also, “why are those ‘BLM thugs’ burning down Walmarts?”, etc.   — once you’ve converted the narrative, it’s easier to point out who you’ve determined the bad guys to be and to prosecute a war against them.  Same thing here. “People need social security, but not if it’s corrupt and stealing money from grandma to pay 160 year old fake people!”  It’s sad that so many people fall for this shit, but they will and real people are going to suffer.  Side note: it should be obvious that are not my personal feelings on BLM or SS, I’m just giving an example of the fuckery.",foulpudding,2025-03-06T05:50:53,2
Having data and doing analytics are so different  Dude got some data and skipped the analytics of it - and of course they know it’s bullshit,RCA2CE,2025-03-06T05:57:19,2
"This is Trump's normal move before he tries to destroy something. He claims it is riddled with fraud, like he did with the presidential elections. He claimed that in both 2016 and 2020 the votes were ""horrible"" and full of fraud. Therefore they can't be trusted.  He's still doing it for the ""Russia hoax"" as he calls it. He did in fact have numerous meetings, calls, and emails with the Russians and he did lie about them all. Russia did help him in the 2016 election. He's trying to erase that fact by constantly calling it a ""hoax"".  The whole effort is to discredit whatever Trump is against by claiming it is fraud. Now he's doing it for Social Security.  The simple fact is that Trump himself is a fraud, as has been found in court numerous times. He compensates by calling everything else a fraud.  Look for Social Security payments to be interrupted for the first time in 80 years. If Musk can lay off enough SS employees, they can crash the whole system and make it very difficult to resurrect it.",billpalto,2025-03-06T07:16:54,2
"Worked with the media, now most republicans don’t trust the media.   A few years ago they started with the education conspiracy stuff, most republicans now think public schools are places designed solely to make their child trans, now the DOE is being dismantled.   They play the long, consistent messaging game and it works. ",BrownWallyBoot,2025-03-06T09:11:40,2
"My take is that it's just a continuation of the Republican push to privatize Social Security.  Their 401k smoke and mirrors trick, aimed mainly at taking money from working people paychecks and handing directly to Wall Street to the tune of over $30 billion a month, has led to the final push to hand Social Security withholding directly to Wall Street as well.  But it's not welfare for Wall Street or anything.  Now bring on the investor bros who have yet to experience a 50% loss in their portfolios due to things like deregulation of the mortgage industry, or computer algorithms crashing the market as they did on Black Monday in 1987 and tell me how that $6.7 trillion in 401k money and the $300 billion a year in additional money isn't propping up inflated equities values.  Investing in companies with value, reasonable p/e, and predictable growth and dividends is so 20th Century now.  Meme stocks for everybody is the answer to retirement!  And bring on the crypto because nothing is something that has real value now!",oldbastardbob,2025-03-06T09:17:51,2
Same reason they're pushing the whole fentanyl through Canada's border thing. Manipulation.,sleepeegirl,2025-03-06T10:17:24,2
"If your goal is to destroy something that is generally very popular, you have to start by convincing people that it should be unpopular.  Elon hates Social Security, describing it as a Ponzi scheme, but huge swaths of the American electorate are reliant upon it as their primary source of income.  So, to convince them that they should support cutting off their own income he tells them that it's riddled with fraud.    It's a very classic political bullshit artist move to make bold claims and point to something as evidence that doesn't say what you claim it says.  Our media has been largely cowed by years of accusation of bias to not call out lies but leave it to the opposition to call those out, so media outlets will largely just amplify what Elon says and tell Dems that it's their job to tell people that Elon is full of shit.  But the old saying in politics is that if you're explaining you're losing, the bullshit artists have realized they can largely make big claims backed by nothing and the public will rarely be informed that they're full of shit.    Eventually the media stops amplifying your bullshit, but that can take years - Jim Jordan spent the Obama years claiming reports his committee was releasing showed evidence of huge scandal only for it not to, but it took the better part of a decade for the non-GOP media to get it in their heads that he was full of shit and should be treated with skepticism rather than uncritically echoed.  Elon isn't tethered to that reputation for some reason that boggles my mind so he's going out and telling everyone that fraud is rampant, getting the claims echoed, and by the time people go, ""But that's not what your data says!"" the public is two scandals down the road already.",HombreFawkes,2025-03-06T11:36:31,2
"Why do they push any of their lies? To divert money to themselves and other billionaires, to appease Putin, to destroy America, and make most of our lives worse.",Medaphysical,2025-03-06T12:07:46,2
"Republicans have wanted to kill social security ever since it was passed 89 years, 6 months and and 20 days ago. The reason why they wanted to kill it then remains the same today. Greed. You can't afford the kind of lifestyle they enjoy without exploiting large numbers of people.",RonocNYC,2025-03-06T14:30:49,2
Did you know that social security denies coverage at rates upwards of 3x the amount that the major medical insurance companies do?  Did you also know that  wealthier people end up collecting larger benefits for much much longer time than poor people?,banana_hammock_815,2025-03-06T16:12:30,2
Because it gets their voters going. The  First rules to keep the trump train rolling is to blame everyone else and make up lies to get people who have no idea what’s going on angry. Sadly it works because it turns out most Americans also like blaming everyone else for their problems and love being mad at life.,Fit-Chemist-3603,2025-03-06T19:57:19,2
"The strategy here is relatively simple. They are highlighting fraud, waste, and abuse. PART of that are inefficiencies and inaccuracies within the federal government systems and employees. To DOGE, these are all lumped together. So when you hear claims like this, they’re not making a definitive claim that these are only the number of people that actually receiving checks. That would be hyperbolic baccarat everybody knows that not every person past 72 actually collects Social Security; but the SS does have records of every person whether they take payments or not.   Bringing up the flaw in the SS data is to embarrass the federal system and workforce; and to highlight actual real inefficiencies. No matter how you look at it, the fact that there are these many people in the system and nobody has ever bothered to fix it, is unquestionably shameful. Our tax payers fund these system, organizations, and employees. And this is the outcome?   So that’s the strategy. To expose fraud, waste, and abuse from many angles, not just purely monetary or economic.",Nootherids,2025-03-06T21:35:32,2
[deleted],[deleted],2025-03-07T07:36:12,2
Why don’t you have anything else better to do with your time than type this up?,[deleted],2025-03-07T09:49:03,2
"> Wired magazine reported that the number of people in the 150-year age bracket **may** have to do with the programming language used by the SSA, known as COBOL, or the Common Business Oriented Language.   1. ""may"" is doing some heavy lifting there. wired is speculating about what they think could possibly explain it. at the end of the day, they don't know 2. this overlooks that the vast majority of the suspect records are NOT exactly age 150.  at the end of the day, it's indisputable that red flags have been found, and those red flags absolutely should be investigated to so if any money was going out to people who are ineligible. it shouldn't be controversial, but some people let their hatred of the administration cause them to blindly oppose anything they do.",reaper527,2025-03-06T08:45:34,4
"I'm not sure I'm getting the OP straight here so let me recap this and see if I'm tracking.  DOGE reports issues, inconsistencies, and potentially fraud, waste, and abuse in the SSA right?  Then you post data from the SSA saying that they're wrong?     Let's try this another way:  If I was an investigative journalist and I reported my findings that the New York Police Department is corrupt and wrought with fraud, waste, and abuse.....how much sense would it make for you to respond by posting data that's gathered, compiled, and managed by the New York Police Department as a rebuttal to to my findings?",Vaulk7,2025-03-06T09:57:48,2
"Because their base is too dumb to listen to and process the whole COBOL story, and they just eat up what they say. They want to cut back social security and this is the only way to get people to be ok with it",sjets3,2025-03-05T20:50:39,4
">>A report from the agency found that between fiscal years 2015 and 2022, the agency sent out nearly $72 billion in improper payments, which were mostly overpayments. That’s about $9 billion a year.   Why didn’t you include this part?",mitzy_floppington_ii,2025-03-07T06:11:35,2
There will soon be an attempt to privatize Social Security so that we can reward America's oligarchs.  [Joseph Goebbels](https://www.azquotes.com/author/5626-Joseph_Goebbels) had it all figured out.  Tell a lie often enough and ..... (https://www.azquotes.com/author/5626-Joseph\_Goebbels).,rgc6075k,2025-03-06T12:12:00,2
