Comment,Author,Date,Score"> You say it won’t deter, he says it will.  Yeah, and I'm also saying that the outcomes of street crime would be worse because more guns pretty consistently results in more injuries and deaths from guns. Obviously.  >What you’re saying is that people cannot be trusted.  More that people aren't *capable*. Even the best trained warriors on Earth make mistakes when fight-or-flight is on the table, and that's what we're talking about during a mugging or something that is just significantly more likely to escalate into bloodshed if there are *also* a couple guns in the fray than otherwise.  >Not just any people but everyone who isn’t in government. That’s a very left position isn’t it?   Not at all, skepticism of the government is an inherently leftist position.  >Nobody should protect themselves because the government is there to keep you safe from all harm.  Personally, I would argue that if the government reined in the excesses of the oligarchs and the average, working American had a decent place to live with three reliable squares a day, access to healthcare, education, public third spaces, walkable cities with lush, beautiful parks and public transportation, etc? We could probably own guns to high heaven and incur very little crime and *generally* I think that would be a good thing.  I think the right to bear arms is good, and I think liberals right now are kidding themselves while there are open-and-shut fascists running the show. They should probably want guns, you know, just in case Stephen Miller gets a little too Reinhard Heydrich-ey with his ICE Gestapo.  >You don’t want to see how that itself does damage to a society, because in your eyes a free society - free enough to allow it to protect itself is a dangerous society.   No, I've just read studies and I'm unwilling to let my personal hobbies (yay guns) cloud my judgement when reading them. Even in my ideal society, there would be more gun deaths than not, because crime will likely never TRULY be gone. The fact is, the more guns are privately-owned throughout society, the more at least *some* percentage of them will be used maliciously. That's just a fact - a fact rabid gun owners who don't want to face uncomfortable realities refuse to face, but a fact nonetheless.  >Tennessee just became an open carry state. It saw crime becoming an issue that was hard to control. What do the numbers show is that crime is still an issue regardless.   Right. And studies across the board find that carrying guns pretty much universally results in more gun injuries and deaths that simply are not reflected with inferior melee weapons, like knives and clubs. They just do. Tennessee's law is too recent to draw any statistically significant conclusions, but there's no reason to expect that they'll be any different - especially given that they're a red state with high poverty and minimal social welfare programs. Desperate people are already somewhat dangerous. Desperate people with guns, moreso.  >What it can’t show and what no studies can show is crime as a result of open carry.  Yeah, they can. And do. All the time: https://old.reddit.com/r/PoliticalDiscussion/comments/1j4h36s/why_do_trump_and_musk_keep_pushing_the_social/mghgbth/  >This makes your argument simply based on fear. In feelings. You could well interact with people everyday that carry concealed weapons and not even realize it.   The people operating on fear and feelings are the ones unwilling to square with the data, which is very much *not* fear and feelings, and *is* what my argument is predicated on. You've been linked the data. It's up to you as to whether or not you choose to ignore it or not.  >he question then becomes, when or if you are ever the victim of a crime where you can lose your life, are you better off to be able to protect yourself or not? If you can’t, that would suck for you. If you could, would you?   Yeah, again, I'm only a gun control advocate because the surrounding policies of our society are dogshit. If we had a society that gave a shit about average people instead of rich people, where average people had time to live their lives and had decent amounts of time off and reliable housing, food, healthcare, education, etc. we probably could own all of the guns and have very, very, very minimal crime and gun violence.  But we don't live in that society, we live in a stupid, extremely right-wing one, so crime is a real thing that desperate, impoverished, overworked, destitute people resort to. And guns make that way, way easier, so they're utilized, and as a result we have an insane amount of gun injury and death in this country compared to countries with sensible gun control laws.  >Criminals already carry guns around regardless of laws.  This is false. We excise the guns from the public and criminals would have a much, much, much harder time getting guns.  >So it’s not a matter of if all people are allowed to carry legally would more crime happen, it becomes a matter of acting in defense when nobody is there to do it for you.  I'm not arguing ""more crime would happen"", I'm arguing that interactions with criminals would become more bloody overall.",the_calibre_cat,2025-03-12T17:11:17,1
"Calling a bunch of different philosophies with different endgames the same thing isn't ""a semantic argument"", to me.  You can feel free to feel that way, but it's not productive.  I don't see value in finding some excuse that seems irrational to me to look at ""really bad"" and ""fucking fascism"" and just mashing them together as if they're exactly the same.  Trump is a Fascist; he would start killing immigrants if it came down to it.  I am convinced that Project2025 doesn't go there, but does go places that Trump normally wouldn't care to.  It wants to lean into ""Republic over Democracy"" not ""actual Oligarchy"".  I mean, take an HONEST look at the organizations that made up their consortium.  They are extreme organizations with extreme views.  We should not just pretend those views are a different type of extreme view.  Both because it's untrue, and because we can't stop something that we are intentionally misrepresenting to ourselves.  The CEO of UHC and serial killers both lead to a lot of innocent deaths.  But the way you stop healthcare CEOs and the way you stop serial killers is different.  Ditto with the Religious Right and with Nazis.  They both do horrible things.  But they both are wildly different.",novagenesis,2025-03-06T12:28:26,3
I remember a time when everyone said with confidence trump would never be president,wha-haa,2025-03-06T22:00:03,1
"As a leftist I've got to say the whole ""guns won't help you against the government"" thing is an incredibly nieve take.  Hellfires cost money, hellfires need factories with workers, hellfires need a global supply chain.   When you are using the hellfires on the factories and people making them they start running out quick.  If anything, we now live in a world where anyone who can fly a drone has a $500 tank killing cruise missile in their backpack they can order off amazon...  America hasn't had to deal with a modern insurgency on its own soil before. It could absolutely collapse the government and society for better or worse and all that fancy shit the army has dissappears in a month if it isn't maintained and refreshed.  Then you have to ask, when all the fancy stuff is gone, and it's just guys in foxholes, does the US military even know how to fight that war any more?",Revelati123,2025-03-08T15:00:21,2
"On one hand, yeah. Guns makes committing violence easier, but America is dangerous because our institutions have failed to provide the basic necessities. People deprived of what they need are people who are willing to disregard the social contract to get them. A lot of the gun violence we see in America today would vanish if everyone had safe housing, healthy food, clean water, proper education, and free healthcare.  It would be even better if our prison system was actually designed with rehabilitation and reintegration in mind. Instead of having an actual to god profit motive to keep people behind bars for the free labor they provide.  So violence is a part of America for the foreseeable future, and it seems it will be our second greatest tool against this coup.",EarthRester,2025-03-06T12:44:09,3
"IOW, resistance to Fascism is futile?    Why would you assume that someone who supports the right of citizens to armed self defense ""likes guns""?  Gun control and professional armed police began in the US to protect the slave system.   “In the South, however, the economics that drove the creation of police forces were centered not on the protection of shipping interests but on the preservation of the slavery system. Some of the primary policing institutions there were the slave patrols tasked with chasing down runaways and preventing slave revolts, Potter says; the first formal slave patrol had been created in the Carolina colonies in 1704. During the Civil War, the military became the primary form of law enforcement in the South, but during Reconstruction, many local sheriffs functioned in a way analogous to the earlier slave patrols, enforcing segregation and the disenfranchisement of freed slaves.”   TIME MAGAZINE, How the U.S. Got Its Police Force, By Olivia Waxman, May 18, 2017.  [https://time.com/4779112/police-history-origins/](https://time.com/4779112/police-history-origins/)",DyadVe,2025-03-06T15:02:07,1
"In fact, all crime including gun crime soars after strict gun control laws are imposed.   **""Handgun crime soars despite Dunblane ban,**By Thomas Harding11 January 2001 • 12:00am""   https://www.telegraph.co.uk/news/uknews/1314245/Handgun-crime-soars-despite-Dunblane-ban.html""  [https://www.telegraph.co.uk/news/uknews/1334043/Gun-crimes-soaring-despite-ban-brought-in-following-Dunblane.html](https://www.telegraph.co.uk/news/uknews/1334043/Gun-crimes-soaring-despite-ban-brought-in-following-Dunblane.html)  Why would anyone believe this would not be the result of disarming the targets of criminal violence?",DyadVe,2025-03-07T08:58:05,1
"How does society just care for the rich? That doesn't even make sense. Perhaps it cares for those who try the hardest. It's just as valid. Are you trying to say it doesn't care about its people who are struggling? Or they don't care about people below a certain income level? What constitutes rich in your mind? This country allows people to rise up from nothing to be at the top financially. The government doesn't discriminate against effort. But perhaps I should just let you explain, but honestly, with that attitude, it seems you think people are owed something. Being envious of those with money because they are better at whatever earns them money than you are won't get you ahead in life. I don't have to convince you that's true, you will find out for yourself.   Yes, if guns are outlawed, who are the ones willing to have guns one way or another? Those willing to break the law. Nobody will excise guns. It is impossible to do.  People can build guns without much effort. What makes you think criminals would have a hard time getting them? What reality have you experienced?  Where do you get the idea that the right equals crime? Who was calling for defending the police? Who raised the limit of theft to $1000 dollars before any action would be taken? Who decided not to prosecute people for crimes since it just didn't seem ""fair"". Yeah, your arguments don't hold water. You want your opinions to be made valid based on feelings and assumptions. As such, there is no more to be said.",Licalottapuss,2025-03-13T00:11:29,1
"Of course there's a difference between the would-be theocrats in Heritage and the white supremacists on Trump's other shoulder, but I don't think there's a different way to handle them. Both operate in bad faith, both want to restrict voting rights, move the country in a deeply authoritarian direction, and both operate in bad faith. Heritage is willing to lie, cheat, steal and pump out disinformation just like the Nazis. Arguing with them is pointless, since they'll simply use pretzel logic to argue that any facts you care to point out actually support their cause. They're willing to use the power of the state to restrict birth control, divorce, interracial marriage, pornography, the first amendment, etc. etc. Compromising with them is impossible, because again, bad faith. Power is the only way to keep them from seizing power over the rest of us.",jetpacksforall,2025-03-06T17:57:38,1
So what makes you so confident now?,jetpacksforall,2025-03-06T22:21:58,1
"Again, that's just myth making. You just have to look at Gaza to see how well unsupported light infantry work when fighting against a modern military force. Whether or not you have a rifle at the start of the war is largely irrelevant if you don't have the training for small unit tactics, and *that's* still largely irrelevant when fighting a state with air superiority if all you have is small arms. Even *if* your ambition is nothing more intensive than Troubles style terrorism, you're still going to accomplish more there with diesel fuel and fertilizer than you still with any AR-15. And even if your mythical leftist resistance is somehow able to destroy every tank and drone the US armed forces have, the US armed forces are still perfectly adequate infantry fighters. You ask if the US military knows how to fight an infantry war? What makes you think the *American left* does, or will figure it out faster than the conventional military?  And that's ignoring that the entire root of this conversation was an inane assertion that everyone carrying guns around would reduce crime. He just abandoned that factually indefensible position to for a more popular but still naive view on the impact of easy gun ownership on preventing government oppression.",VodkaBeatsCube,2025-03-08T15:20:11,1
"Correct, even ""rocket science"" is very old tech now. DIY versions of mortars and RPGs are being manufactured in third world villages these days.   Beyond that, who will the military fight after the US government becomes the kind of bureaucratic leviathan that, according to Marxist thought, deserves to be overthrown by violent revolutionary force?  The only thing that keeps our corrupt bipartisan ruling political class safe is the people's faith in free and fair elections. IMO, the dummies in power had better guard that protection very carefully.  [https://www.msn.com/en-us/news/world/us-soldiers-arrested-by-fbi-accused-of-betraying-country-to-china/ar-AA1AqWf4](https://www.msn.com/en-us/news/world/us-soldiers-arrested-by-fbi-accused-of-betraying-country-to-china/ar-AA1AqWf4)  # [US Soldiers Arrested by FBI, Accused of 'Betraying' Country to China](https://www.msn.com/en-us/news/world/us-soldiers-arrested-by-fbi-accused-of-betraying-country-to-china/ar-AA1AqWf4)  [Newsweek](https://www.msn.com/en-us/news/world/us-soldiers-arrested-by-fbi-accused-of-betraying-country-to-china/ar-AA1AqWf4)|2 days ago**The FBI arrested two active-duty U.S. Army soldiers and one former soldier for allegedly gathering sensitive military information that was then sold to China, the U.S. Attorney's Office for the District of Oregon announced on** [**Thursday.US**](http://Thursday.US) **Soldiers Arrested by FBI, Accused of 'Betraying' Country to China**  [Newsweek](https://www.msn.com/en-us/news/world/us-soldiers-arrested-by-fbi-accused-of-betraying-country-to-china/ar-AA1AqWf4)",DyadVe,2025-03-09T12:27:52,1
"Exactly right.  "" **The crisis in policing is the culmination of a thousand other failures—failures of education, social services, public health, gun regulation, criminal justice, and economic development.** Police have a lot in common with firefighters, E.M.T.s, and paramedics: they’re there to help, often at great sacrifice, and by placing themselves in harm’s way. To say that this doesn’t always work out, however, does not begin to cover the size of the problem. The killing of [George Floyd](https://www.newyorker.com/tag/george-floyd), in Minneapolis, cannot be wished away as an outlier. In each of the past five years, police in the United States have killed roughly a thousand people. (During each of those same years, about a hundred police officers were killed in the line of duty.) One study suggests that, among American men between the ages of fifteen and thirty-four, the number who were treated in emergency rooms as a result of injuries inflicted by police and security guards was almost as great as the number who, as pedestrians, were injured by motor vehicles. Urban police forces are nearly always whiter than the communities they patrol. The victims of police brutality are disproportionately Black teen-age boys: children. To say that many good and admirable people are police officers, dedicated and brave public servants, which is, of course, true, is to fail to address both the nature and the scale of the crisis and the legacy of centuries of racial injustice. The best people, with the best of intentions, doing their utmost, cannot fix this system from within."" 9emphasis mine)  THE NEW YORKER, [A Critic at Large](https://www.newyorker.com/magazine/a-critic-at-large), **The Invention of the Police*****,Why did American policing get so big, so fast? The answer, mainly, is slavery.,*** **By** [**Jill Lepore**](https://www.newyorker.com/contributors/jill-lepore)**,** July 13, 2020.https://www.newyorker.com/magazine/2020/07/20/the-invention-of-the-police",DyadVe,2025-03-06T15:12:11,4
">A lot of the gun violence we see in America today would vanish if everyone had safe housing, healthy food, clean water, proper education, and free healthcare.  You're conflating violence and gun violence. You are correct, a lot of the *violence* would go away, including gun violence. The ratio of gun violence to violent crime would stay the same, however. It is a logical fallacy to say that improving base conditions would reduce gun violence. It would just reduce violence overall. It would be a noble cause and a good first step towards any violence reduction, but so long as firearms remain easily accessible the gun violence rate will be nominally higher here than other comparable first world countries.   Your argument really falls apart when you take into consideration the *many* third world countries with significantly lower quality of life that have a lower gun violence rate due to weapons being more restricted. Iraq is a noticeable example of a country with a lower gun violence rate compared to the US. Let that sink in.   We have enough data and evidence to pretty clearly say less guns equals less gun violence per violent crime rate. Arguing against that is saying your unempirically proven reality is more tangible than all of the empirical evidence to the contrary. I'm open to any counterpoint based on more than ""I feel this way,"" but as a person who owns multiple firearms and used to be of the same opinions as you, there just isnt much rational argument that gun restrictions don't lower gun violence. I'm opposed to removing the second ammendment right, but not to increasing the security measures required to access a firearm. It just makes sense.",Brickscratcher,2025-03-08T18:44:53,1
"Resistance to fascism isn't futile. You're just not going to be successful with the longarm you have under your bed. You're already going to be relying on government armouries for resistance in one way or another, having the rifle already doesn't move the needle much. What actually makes effective resistance is training, sabotage and heavy material gained from one form of large scale organization or another, not pretending you're John Wayne.  You guys have a myth you want to tell yourself, but it assumes that the United States exists as a unique and special island where the lessons of the rest of the world just can't apply. But it's just a lie you tell yourselves to pretend that you can be the hero of your own story with only the effort and expense required to enjoy a moderately expensive hobby.",VodkaBeatsCube,2025-03-06T16:43:59,3
"> In fact, all crime including gun crime soars after strict gun control laws are imposed  It factually doesn't, and zero of my studies confirm this - they comfirm the opposite on the topic of concealed carry.  On other forms of gun control, we find similar reductions - states with the most permissive gun laws have the most gun violence:  https://publichealth.jhu.edu/center-for-gun-violence-solutions/research-reports/americans-agree-on-effective-gun-policy-more-than-were-led-to-believe  https://www.pnas.org/doi/10.1073/pnas.1619896114  https://www.bu.edu/articles/2019/state-gun-laws-that-reduce-gun-deaths/  https://www.acpjournals.org/doi/10.7326/M13-1301?articleid=1814426  A couple of telegraph articles from 2001 do not disprove decades of empirical, rigorous, academic, peer-reviewed evidence. America's gun deaths are objectively a result of the ease of access to guns and our broadly shitty social policies. I think we could probably have fun ownership with minimal gun deaths, but not with this raging capitalist death machine that we call a society.  EDIT: Also, the notion that gun deaths *went up* after the 1996 law is just... beyond parody, objectively false, and something easily researched:  https://www.aic.gov.au/sites/default/files/2020-06/draft_of_trends_issues_paper_mass_shootings_and_firearm_control_comparing_australia_and_the_united_states_submitted_to_peer_review.pdf  Gun deaths went down. Significantly. And that reduction took place over a period of population growth. Quit your bullshitting.",the_calibre_cat,2025-03-07T09:08:53,1
