Comment,Author,Date,Score"> no, we don't live in a facist society. What are you basing that on anyway? something you read on social media? There are plenty of examples of true facist governments and ours are nothing like that at all. Nobody is getting rid of immigrants. They are deporting ILLEGAL immigrants. Huge Huge difference.   So, this is a lie: https://www.nbcnews.com/politics/immigration/trump-end-immigration-program-cuban-republicans-florida-rcna197998  These people are all here legally. Trump is unilaterally ending their legal status and deporting them, because... he (and the Republican Party more broadly) are fascist ethnonationalist neo-segregationist bigots.  >You might be using your own definition of what an immigrant means, but it needs to be predicated by ""Illegal"" in front of it.  No, it doesn't. And illegal immigrants are still human beings, entitled to dignity and, more importantly, [entitled to the protections of the Bill of Rights to include due process of law](https://www.accessiblelaw.untdallas.edu/post/undocumented-immigrants-rights-under-the-united-states-constitution) - something the ~200+ immigrants who were deported to the El Salvadoran gulag were denied when the administration up and referred to them as ""Tren de Aragua members"" and shipped them out of the country against a court order.  >And who is cracking down on gays? what fucking world do you live in? what does that even mean, ""cracking down""?   Seeking to end same-sex marriage protections and equality under the law, and Republicans are, because they're (guess what) bigots:  https://www.nbcnews.com/nbc-out/out-politics-and-policy/lawmakers-9-states-propose-measures-undermine-sex-marriage-rights-rcna193743  https://www.politico.com/news/2022/06/24/thomas-constitutional-rights-00042256  >But you are right, nobody is ""sharing"" wealth. That is completely up to you to create for yourself. what is so hard to understand about that? Communists understand one thing. Power. You would think that its all roses; everything being shared and equal to the lowest common denominator. Everything except for the ones at the top. There is no other ""true communism"" as the ignorant like to claim. Why? For the same reason that Capitalism also has its flaws, mainly human nature. Communism as the examples have shown the world is rife with people hungry for power. There are those at the top - very few but true to form, more than ready to keep their position through oppression.  Great, so the same system we have today, except I get healthcare. Not seeing a downside here.  >Then there is everyone else; none of whome will rise up to make anything that advances society because they aren't allowed to be seen as better, or smarter, or wealthier. They are the same as the slowest and lowest of their comrades. Capitalism thrives on innovation, on individual achievement. See how something could be made better? do it and be rewarded by your efforts.   This is false. Capitalism doesn't thrive on innovation and individual achievement, it subordinates it to the will of the owner. Profitability pre-empts innovation to the extent that if a company has a technical lead, it will withhold that innovation.  >Unfortunately, that may well not be helpful if you just arent all that smart or motivated. Which is where you come in! take it from others!  The ""anti-innovation"" Soviets beat the Americans to space, among many, many other things. In repeated instances of history, American capitalists were happy to languish behind, fat on profits, rather than investing in innovation because innovation costs money, and capitalists loathe spending money on *anything*. The British and the Germans beat us to jet engines and their radar was FAR better, etc.  Only when Einstein wrote about how we could build a sick bomb did America step up its game - and then invest massively in a *public sector project* to develop atomic energy (we were behind the Germans for quite some time) which we don't use because capitalists don't want to spend money so they'd rather invest in cheaper and more environmentally harmful oil, natural gas, and coal-powered plants than in nuclear power because capitalists are actually scum.  >Please don't insult me by saying you believe everyone is equal when you follow it immediately by desparaging conservatives.   Oh, conservatives are terrible. No question. Evil sons of bitches who want to harm and kill anyone who doesn't look like, love, or worship like them. But they should still be equal under the law, a legal philosophy and approach they seek to deny to everyone else (because, again, they're evil/stupid).  >Your arguments are pure shit. I'm not here to change your mind, and your ideas run completely against american values.  I'm quite aware. America has been a conservative country with an unequal, racial/religious social hierarchy for most of its history. Those conservative values are bad, and should be relegated to the dustbin of history along with other shitty political ideologies like fascism, segregation (a conservative invention), slavery (a conservative institution), etc.  >Which either makes you foreign in which case your opinion holds absolutely no weight to whats happening herel, or if you are american, your future is really going to be one that is always going to clash with the rest of the success minded people around you.   No, it's not. They can be as ""success-minded"" as they want, the oligarchs don't give a shit and don't care to share that wealth with anyone. You and I are nothing to them, they have *said this* on repeated occasions. You just still choose to simp for them, and to simp for conservative bigotry, probably for cultural reasons - but certainly not logical, reasoned reasons.   Nobody is a conservative through reason, unless they are a bigot.",the_calibre_cat,2025-03-26T13:20:49,1
"Do you actually read what I've posted?  I double dog dare you to paste up this from my posts: **""guns are the only thing that makes the population safer""**  :-)  You are debating statements that have not been made.  I pasted it up again hoping you might read it.  Try this one:  “[Rape](https://www.independent.co.uk/topic/rape) offences reported to police have hit a record in England and Wales as the proportion prosecuted plummets to a new low. Despite falls in overall [crime](https://www.independent.co.uk/topic/crime) in the 12 months to June, **driven by coronavirus restrictions,** the [Office for National Statistics](https://www.independent.co.uk/topic/office-national-statistics) said recorded sexual offences increased by eight per cent.”  THE INDEPENDENT, [News](https://www.independent.co.uk/)[UK](https://www.independent.co.uk/news/uk)[Crime](https://www.independent.co.uk/news/uk/crime), **Record number of rapes reported to police in a year, crime figures show**  Reports increase as prosecutions plummet to record low of 1.4 per cent of reported rapes, By Lizzie Dearden, Home Affairs Correspondent, Thursday 04 November 2021.  [https://www.independent.co.uk/news/uk/crime/rape-england-wales-police-report-b1951284.html](https://www.independent.co.uk/news/uk/crime/rape-england-wales-police-report-b1951284.html)  IMO, empowering people with more freedom and capital would be smarter politically than disarming them, but professional political strategists still clearly disagree with me.  ;-)",DyadVe,2025-03-10T15:58:20,1
"There are Republicans pols like Fred Upton, Adam Kinzinger, Tony Gonzales. who support gun control.  Its just not popular with too many ordinary human beings who vote.  Most elected Republicans, as opposed to Democrats running for office have learned to embrace popular positions. Unfair right? ;-)",DyadVe,2025-03-08T20:12:45,1
"Very few  trusts the government or its police anymore. The left never has.  OTOH, ""conservatives"" and some ""liberals"" are Back the Blue to the bitter end.   They are dwindling minority.   The Inconvenient Truth: Gun control encourages violent criminals to commit crimes with guns.   “""Since 1994 or 1995, there's been a clear change; the guns are now becomingdispersed in the population,"" said Hiroyuki Fujimura, a seniorsuperintendent in the Firearms Division of the National Police Agency.  A growing number of robberies accounts for the sharpest rise in hand guncrimes, he said: ""We are worried about it. **Crimes are becoming more violent,**  **more serious. And handguns are very efficient weapons for that.”” (emphasis mine)**WASHINGTON POST, **Gun Use Intrudes on Japanese Serenity,** By Doug Struck, Washington Post Foreign Service, Friday, August 11, 2000; A17.  [https://www.washingtonpost.com/archive/politics/2000/08/11/gun-use-intrudes-on-japanese-serenity/9e0c6e66-e5da-46f7-89af-ba5fef9385ba/](https://www.washingtonpost.com/archive/politics/2000/08/11/gun-use-intrudes-on-japanese-serenity/9e0c6e66-e5da-46f7-89af-ba5fef9385ba/)",DyadVe,2025-03-08T17:07:06,1
"That gay marriage link shows nothing but a disregard for other people’s beliefs.  Not every is down with gay marriage, forcing compliance does the exact opposite. Hey if people don’t like it so what? The church won’t marry a couple because it goes against their doctrine, so what, go somewhere else.  “The owner” of wealth, or business doesn’t have to share anything. But that’s what capitalism is great for. Anyone can become an owner. You just want that “sharing” of money to be given to you. Good luck with that. See your still on that “sharing” vibe. Nobody has to share shit with you.  It’s too bad you harbor hate. That’s on you. Sucks for you that things are changing apparently. But feel free to slander conservatives. It doesn’t bother us. We kind of pity those who do, nobody mentally sound lets things affect them so much. Sadly it is true as a society we have put aside mental health care for too long. But if you really need help I’m sure you could find it. Anger towards people you don’t even know is a red flag.",Licalottapuss,2025-04-02T21:56:51,1
"They disagree with you because you're factually wrong. Spitting out cherry picked headlines without actually looking at the underlying data doesn't change that.  Again, answer the question: if guns make you safer why does the US have more violent crime per capita than the UK?",VodkaBeatsCube,2025-03-10T16:03:04,1
"All you're really demonstrating is that you're too deeply ensconced in your particular subculture to understand that your position isn't even a majority of Americans. You can lie to yourself as much as you care to, but all it means is that you're going to be that much more surprised and upset when people on the periphery of your altered reality realize your wild west myth of gun ownership being a panacea for social ills doesn't actually work.",VodkaBeatsCube,2025-03-08T20:22:53,1
"> Very few trusts the government or its police anymore. The left never has.  I'm not arguing about ""trusting the government"". I'm arguing about trusting you. I don't take the word of some guy on the internet, I'm not a conservative. Show me a wide body of academic, rigorous, peer-reviewed evidence.   You can't, because the evidence is overwhelmingly not on your side - it's on mine.  >OTOH, ""conservatives"" and some ""liberals"" are Back the Blue to the bitter end.  >They are dwindling minority.  i fuckin' wish  >A growing number of robberies accounts for the sharpest rise in hand guncrimes, he said: ""We are worried about it. Crimes are becoming more violent,  >more serious. And handguns are very efficient weapons for that.”” (emphasis mine)WASHINGTON POST, Gun Use Intrudes on Japanese Serenity, By Doug Struck, Washington Post Foreign Service, Friday, August 11, 2000; A17.  >https://www.washingtonpost.com/archive/politics/2000/08/11/gun-use-intrudes-on-japanese-serenity/9e0c6e66-e5da-46f7-89af-ba5fef9385ba/  This is literally my argument",the_calibre_cat,2025-03-12T17:13:12,1
"> That gay marriage link shows nothing but a disregard for other people’s beliefs.  Yeah. I don't care. I literally do not care that you're caping for raging bigots. I just know that decency compels equality before the law. So, if straight people can get married and enjoy certain government benefits as a result of that, then so too must gay people. Anything less than that is a.) caping for bigotry, and b.) creating a class of second-class citizens.  Which, of course, is the objective of the conservative political project - to make some people *more equal* than others, usually predicated on who and how they love, what God they worship, and what race they were born into. I do not care what religious *or* secular (but, lol, c'mon, zero of us are under any misconception that there are a bunch of atheists out there crying about gay marriage) bigotry people harbor, in the exact same way that I don't particularly care that segregationists ""aren't down with"" sharing bar stools and drinking fountains with black people.  > The church won’t marry a couple because it goes against their doctrine, so what, go somewhere else.  In virtually all circumstances, churches that proselytize that kind of bigotry aren't forced to marry gay people. Same-sec marriage recognition is about forcing the government to recognize them, and to afford those with same-sex marriage licenses the same benefits that straight couples are afforded. The country clerk is compelled, not some bigots who happen to be pastors.  > “The owner” of wealth, or business doesn’t have to share anything. But that’s what capitalism is great for. Anyone can become an owner.  But everyone can't be, and under capitalism, capital owners can, will, and do use their outsize wealth to influence the government to favor their interests over those of workers. So they'll pay people poverty wages for the labor that makes everything possible, while they produce absolutely nothing - but keep the lion's share of the wealth.  I think the people who do the work should keep... all of the wealth.  > You just want that “sharing” of money to be given to you. Good luck with that. See your still on that “sharing” vibe. Nobody has to share shit with you.  Incorrect. Workers have to share the wealth they produce with capitalists who produce nothing - conservatives just consistently go up to bat for the aristocracy, as they always have throughout the centuries.  > But feel free to slander conservatives. It doesn’t bother us.  lol yes it does, conservatives are the weeniest crew when it comes to criticism.  > Sadly it is true as a society we have put aside mental health care for too long.  Literally because of conservatives, who object to spending a fucking dime on social welfare programs like healthcare that would afford people decent care, including mental health care.  > But if you really need help I’m sure you could find it.  Yeah. I'm fortunate enough to have employer-sponsored healthcare. A profoundly stupid, dogshit system fought for tooth and nail by conservatives *who also* hate America's moronic healthcare system.  > Anger towards people you don’t even know is a red flag.  No, it isn't. It's pretty normal, and conservatives do it *all the fucking time* lol.",the_calibre_cat,2025-04-03T01:32:24,1
"You have clearly been misled. The public record is very clear and consistent over the decades since the gun ban was imposed.  Professional police agencies are notorious for fudging their data and undercounting crime. Surely you know that.  “Half the English police forces inspected since last year are failing to meet required standards at investigating crime, according to analysis by the *Observer* that raises questions over whether policing is fit for purpose.”  ““Their failed policies have left policing overstretched and undermined, with still 6,000 fewer neighbourhood police, shortages of detectives, **and record low charging rates, so more criminals are being let off, while victims and communities are let down.”**  Richard Garside, director of the [Centre for Crime and Justice Studies](https://www.crimeandjustice.org.uk/), added: **“Billions are being spent on a public service that appears to be underperforming badly.**”  “**Even the home secretary has had to admit that people aren’t reporting muggings because they only get a crime number, since the police are so overstretched,” said Cooper.**  Garside added: “When the police appear unresponsive or indifferent, it corrodes public confidence and feeds cynicism.”  THE GUARDIAN, Revealed: half of English police forces fail to meet standards in crime investigations, **Analysis by the Observer raises questions over whether policing is fit for purpose and will put more pressure on the home secretary,** By [**Chaminda Jayanetti**](https://www.theguardian.com/profile/chaminda-jayanetti) *and* [**Mark Townsend**](https://www.theguardian.com/profile/marktownsend)*,* Sat 26 Nov 2022 13.57 EST, Last modified on Sun 27 Nov 2022 00.12 EST.  [https://www.theguardian.com/uk-news/2022/nov/26/revealed-half-of-english-police-forces-fail-to-meet-standards-in-investigations](https://www.theguardian.com/uk-news/2022/nov/26/revealed-half-of-english-police-forces-fail-to-meet-standards-in-investigations)",DyadVe,2025-03-11T09:51:29,1
"I never said that gun ownership was a ""panacea"".    Focus more on what I actually post. It works better than debating an imaginary friend who likes guns. I am personally very anti-gun -- I dislike every aspect of gun ownership.  :-)  That said, these gun control schemes have predictably created a subculture of violent crime and public fear -- perhaps as intended.  “It's a culture where the gun appears to play a large part. It is a respect thing. The gun is sometimes seen as an accessory - almost a fashion accessory - and is sometimes used to demand respect from their peer group.""   THE GUARDIAN, Paddy Meaney, Martin Wainwright, **“Killings put 'Gunchester' back on crime map,” “Police warn that weapons have become a fashion accessory as 17-year-old becomes latest victim of Manchester's gangland rivalry London's gun violence: special report,”**, 1/14/00.  [https://www.theguardian.com/uk/2000/jan/14/ukguns.martinwainwright#:\~:text=Police%20warned%20yesterday%20that%20guns,death%20on%20a%20roadside%20verge.](https://www.theguardian.com/uk/2000/jan/14/ukguns.martinwainwright#:~:text=Police%20warned%20yesterday%20that%20guns,death%20on%20a%20roadside%20verge.)",DyadVe,2025-03-09T13:04:32,1
"Google: ""replication crisis"" and then tell me you rely on peer reviewed studies.  Your wrong -- both parties ""Back The Blue"".  In an announcement that the *New York Times* described as ""a page from the Republican playbook,"" Clinton said on July 23, 1992:  >  ""Sponsored by [U.S. Representative](https://en.wikipedia.org/wiki/United_States_House_of_Representatives) [Jack Brooks](https://en.wikipedia.org/wiki/Jack_Brooks_(American_politician)) of [Texas](https://en.wikipedia.org/wiki/Texas),[^(\[4\])](https://en.wikipedia.org/wiki/Violent_Crime_Control_and_Law_Enforcement_Act#cite_note-4) the bill was passed by [Congress](https://en.wikipedia.org/wiki/United_States_Congress) and signed into law by [President](https://en.wikipedia.org/wiki/President_of_the_United_States)[Bill Clinton](https://en.wikipedia.org/wiki/Bill_Clinton).[^(\[5\])](https://en.wikipedia.org/wiki/Violent_Crime_Control_and_Law_Enforcement_Act#cite_note-5) Then-Senator [Joe Biden](https://en.wikipedia.org/wiki/Joe_Biden) of [Delaware](https://en.wikipedia.org/wiki/Delaware) drafted the Senate version of the legislation in cooperation with the [National Association of Police Organizations](https://en.wikipedia.org/wiki/National_Association_of_Police_Organizations), also incorporating the Assault Weapons ban and the [Violence Against Women Act](https://en.wikipedia.org/wiki/Violence_Against_Women_Act) (VAWA) with Senator [Orrin Hatch](https://en.wikipedia.org/wiki/Orrin_Hatch).[^(\[6\])](https://en.wikipedia.org/wiki/Violent_Crime_Control_and_Law_Enforcement_Act#cite_note-:2-6)[^(\[7\])](https://en.wikipedia.org/wiki/Violent_Crime_Control_and_Law_Enforcement_Act#cite_note-7)^(""https://en.wikipedia.org/wiki/Violent\_Crime\_Control\_and\_Law\_Enforcement\_Act)  ^(Your WP article shows that handguns work.  Is that supposed to contradict something from my posts?)  ^(If so, paste up exactly what you believe I got wrong.)",DyadVe,2025-03-13T10:49:05,1
"Hey, I'll agree that systems as a whole suck. I'll even go so far as to say people can be greedy as easily as they can be cruel.  You seem to be blaming everything on conservatives. We did just 4 months ago come out of a time where the left had all kinds of power to change a great many things. Was life good for you? Did they change the work environment for you? Probably not. They certainly didn't care at all about the mentally illl on the streets.nor the rising crime. That's OK if you don't want to see that. I really don't expect you would, it doesn't change the truth. The healthcare system (apart from the very broken mental healthcare)  is twisted for sure. there is no argument from me. That aside, yes, anyone can be a business owner. This is the United States. I suppose there might be very special circumstances in which someone can't run a business, perhaps legally, but I can't think of them at the moment. Maybe you can enlighten me on why not everyone can work for themselves and start a business. You can choose to work for someone if they're hiring. It's a weird take to then think you should be given all the money when you didn't spend a dime on building the building you work at, or lease. You didn't buy anything such as machinery that you use, you didn't pay for the insurance nor the Healthcare contract nor the monthly electrical or water bill.nor do you really take any risk in the company's future or investments. So why the hell do you deserve the money? Go work somewhere else. Your entitlement seems to imply you are not aware of something called bettering yourself. Get trained for a better position, for better pay.  You've never hired anyone to do anything for you? Maybe not.  You don't seem like a bad person. It's a shame you hold so much hate for others. You know, it is said that anger is usually directed at one's self. It is true to an extent. Mos5 of the time it's for putting yourself in the position that you find yourself in. Nobody is responsible for your life except you. What you give is what you get, but often in a different form. Stay kind and realize everyone is getting through this life the best way they can. We all end up the same in just a few years.",Licalottapuss,2025-04-03T07:05:09,1
"You continue to not actually understand the information you're relying on. Charging rates aren't the same thing as the actual rate of crimes. Just to pick one stat, people are five times more likely to be murdered in the United States than in the United Kingdom. A murder still happens regardless of if they charge someone for it. The only way those articles are a valid rebuttal is if you think that there are something in the neighbourhood of *2700* unreported murders in the UK every year. That is just facially impossible.   So answer the question. If guns make you safer, why is the rate of violent crime so much higher in the US?",VodkaBeatsCube,2025-03-11T10:08:33,1
"So are you just feeding questions into chat GPT at this point? That's the second time you pulled an article that's older than the average Reddit user to try and comment on current events.  >IOW, support constitutional carry. Would also stop most random street crime instantly  This is the comment that sparked this entire conversation. You've been talking out of both sides of your mouth the entire time since. Pick a position and stick with it, or stop wasting everyone's time.",VodkaBeatsCube,2025-03-09T18:51:53,1
"> Google: ""replication crisis"" and then tell me you rely on peer reviewed studies.  I'm aware of the replication crisis. This doesn't render the entire lexicon of science invalid, except to conservatives.  >Your WP article shows that handguns work. Is that supposed to contradict something from my posts?  No, it doesn't. Handguns are the greatest offending category of guns.  >If so, paste up exactly what you believe I got wrong.  I have, repeatedly. Your ""argument"" is ""scientific studies are woke and gay"" or something.",the_calibre_cat,2025-03-15T23:12:28,0
